Porta a Porta,no,filter_out,a,porta,"ata a evaporare con la fine dell ' estate , quando riapriranno il Parlamento e  Porta a Porta . Il fatto è che viviamo , politicamente , in un sistema maggioritario bipolare",,,,,
Porta a Porta,no,filter_out,a,porta,"CAMPAGNA ELETTORALE La sfida tv si farà Ieri , l ' annuncio nella trasmissione  Porta a Porta : « Rinuncio alla conferenza finale . Ora vediamo se Prodi smette di scappare »",,,,,
Porta a Porta,no,filter_out,a,porta,"elle elezioni del 9 aprile . L ' annuncio , ieri sera , quando la trasmissione  Porta a Porta era iniziata da pochi minuti : « Va bene : rinuncio alla conferenza stampa fina",,,,,
porta a porta,yes,,a,porta,Dieci comandamenti per non prendere fregature negli acquisti,porta a porta,.,sg,succession/iteration/distributivity,modifier
porta a porta,yes,,a,porta,Così il traffico aumenta e aumenterà con la nova economia e le consegne,porta a porta,.,sg,succession/iteration/distributivity,modifier
porta a porta,yes,,a,porta,"Un altro vantaggio per i broker è che i potenziali clienti ""visitano"" l'immobile online, liberando il professionista dall'onere di condurre",porta a porta,gli acquirenti interessati.,sg,succession/iteration/distributivity,modifier
porta a porta,yes,,a,porta,"È situato a circa un isolato da Virgin Megastore,",porta a porta,"con il London Astoria, e se capitate nella giornata giusta pagherete 6 sterline quello che 20 metri più a nord è in vendita a 13; ma consultate il vostro oroscopo prima di andare, o rischierete di fare un viaggio a vuoto.",sg,succession/iteration/distributivity,modifier
porta a porta,yes,,a,porta,Anni fa le donne del Campidano acquistavano dai contadini di San Gavino grosse quantità di zafferano che vendevano,porta a porta,alle famiglie di Cagliari e dei paesi limitrofi.,sg,succession/iteration/distributivity,modifier
porta a porta,yes,,a,porta,volantino distribuito,porta a porta,.,sg,succession/iteration/distributivity,modifier
porta a porta,yes,,a,porta,vendita,porta a porta,.,sg,succession/iteration/distributivity,modifier
porta a porta,yes,,a,porta,"Tipicamente, in questa situazione l'acquirente è impreparato, si trova difrontead un'unica offerta e non può operare confronti con altri fornitori; al contempo, di solito, il venditore",porta a porta,può incontrare l'acquirente una sola volta.,sg,succession/iteration/distributivity,modifier
porta a porta,yes,,a,porta,Tipologia di vendita,porta a porta,"in cui un grande automezzo, attrezzato come un negozio, si reca in prossimità delle abitazioni dei probabili acquirenti che, se interessati, potranno acquistare direttamente sul posto.",sg,succession/iteration/distributivity,modifier
porta a porta,yes,,a,porta,vendita,porta a porta,.,sg,succession/iteration/distributivity,modifier
porta a porta,yes,,a,porta,Nella vendita,porta a porta,", l'acquirente è impreparato, si trova di front ead un'unica offerta e non può operare confronti con altro fornitore; per contro, di solito, il venditore porta a porta incontra l'acquirente una sola volta.",sg,succession/iteration/distributivity,modifier
porta a porta,yes,,a,porta,"Nella vendita porta a porta, l'acquirente è impreparato, si trova di front ead un'unica offerta e non può operare confronti con altro fornitore; per contro, di solito, il venditore",porta a porta,incontra l'acquirente una sola volta.,sg,succession/iteration/distributivity,modifier
porta a porta,yes,,a,porta,distribuzione,porta a porta,.,sg,succession/iteration/distributivity,modifier
porta a porta,yes,,a,porta,"Un esempio di pubblicità diretta a specifici nominativi è costituito dalla corrispondenza diretta, mentre un esempio di pubblicità diretta non indirizzata concerne la distribuzione",porta a porta,di volantini pubblicitari.,sg,succession/iteration/distributivity,modifier
porta a porta,yes,,a,porta,corrispondenza diretta non mirata; distribuzione,porta a porta,.,sg,succession/iteration/distributivity,modifier
porta a porta,yes,,a,porta,vendita,porta a porta,.,sg,succession/iteration/distributivity,modifier
porta a porta,yes,,a,porta,"Nato ad Alessandria, Egitto, a 12 anni è emigrato in Israele, dove è cresciuto in un monolocale di Tel Aviv dove la mamma lavorava come sarta mentre il padre andava",porta a porta,a vendere giocattoli.,sg,succession/iteration/distributivity,modifier
porta a porta,yes,,a,porta,"Il problema è grave e merita un appello ai fabbricanti di bolli autoadesivi e a tutti coloro che ne dispongono l'impiego: direttori, gestori, maneggioni a vario titolo di centri commerciali, negozi, spacci aziendali, bancarelle, venditori",porta a porta,": vi supplico ""cambiate colla""!",sg,succession/iteration/distributivity,modifier
porta a porta,yes,,a,porta,"In vendita questa settimana Borotalco, la pellicola di Carlo Verdone che nel 1982 vinse tre premi David (miglior film, miglior attore e migliore attrice): la storia di un giovane e ingenuo venditore di enciclopedie",porta a porta,che cerca l'aiuto della più brava tra le sue colleghe (Eleonora Giorgi).,sg,succession/iteration/distributivity,modifier
porta a porta,yes,,a,porta,Uno delle centinaia di rilevatori che in questi giorni stanno consegnando (e ritirando),porta a porta,"i moduli del censimento Istat, utilizzando personale dei vari Comuni affiancato da ragazzi e ragazze appositamente arruolati.",sg,succession/iteration/distributivity,modifier
porta a porta,yes,,a,porta,Io e Pabs abitavamo,porta a porta,"a LH45 e, aparte il fatto di essere entrambi italiani, avevamo un'altra cosa in comune: manco una lira.",sg,succession/iteration/distributivity,modifier
porta a porta,yes,,a,porta,"La prima macchina del tempo di cui si ha notizia fu inventata, nel 1912, da un giovanotto di Cleveland, Sam Patash, venditore",porta a porta,di collari antipulci per gatti.,sg,succession/iteration/distributivity,modifier
porta a porta,yes,,a,porta,"""Ci siamo mossi tra l'Appennino, largo Ravenna e il Prenestino. - dice il capo della Digos romana Gabrielli - Un lavoro",porta a porta,"alla ricerca di cantine e garage che potessero corrispondere alle caratteristiche di un covo"".",sg,succession/iteration/distributivity,modifier
porta a porta,yes,,a,porta,"In caso di chiusura temporanea e ricorrente dei punti esclusivi di vendita o di impedimento temporaneo dei titolari questi devono affidare a titolari di altre licenze o ad altri soggetti la vendita, anche",porta a porta,", di quotidiani e periodici.",sg,succession/iteration/distributivity,modifier
porta a porta,yes,,a,porta,"Sui compensi corrisposti da editori, distributori ed edicolanti a personale non dipendente per servizi di consegna",porta a porta,o di vendita ambulante di prodotti editoriali è operata una ritenuta a titolo d'imposta con l'aliquota IRPEF corrispondente al più basso scaglione di reddito qualora si tratti di compensi determinati in relazione ad un numero di ore giornaliere di attività non superiore a tre.,sg,succession/iteration/distributivity,modifier
porta a porta,idiosyncratic,,a,porta,"Silenzio sulle città che hanno adottato la strategia 'Rifiuti Zero' e che puntano su tecniche alternative senza combustione come il Trattamento biologico, alla raccolta differenziata con il '",porta a porta,e alla riduzione a monte di rifiuti ed imballaggi.,sg,idiosyncratic,nominal
porta a porta,idiosyncratic,,a,porta,"Da ultime Savona, Alessandria e Novara, dove grazie al '",porta a porta,", arrivato al 70% di raccolta differenziata, sono stati cancellati i progetti di un inceneritore e di una discarica.",sg,idiosyncratic,nominal
porta a porta,yes,,a,porta,"Per informare sui danni degli inceneritori sulle alternative possibili (strategie Rifiuti Zero, sistemi integrati con riduzione alla fonte, raccolta differenziata",porta a porta,", trattamento biologico'a freddo') i Meet Up di tutta Italia sabato 2 dicembre scenderanno in piazza in tantissime città italiane.",sg,succession/iteration/distributivity,modifier
porta a porta,yes,,a,porta,"Va spiegato ai piromani che esistono le alternative per evitare inceneritori e chiudere molte discariche: - riduzione alla fonte - - tassare il doppio - triplo imballaggio, vendita prodotti alla spina - raccolta differenziata",porta a porta,con tariffa puntuale con microchip (più ricicli meno paghi) che può arrivare anche al 75 - 80% come dimostrano esperienze in provincia di Treviso - per il residuo non riciclabile il trattamento biologico a 'freddo' senza combustione.,sg,succession/iteration/distributivity,modifier
porta a porta,yes,,a,porta,"Non una parola sulle alternative possibili agli inceneritori e il dimezzamento delle discariche grazie a sistemi integrati di riduzione alla fonte, raccolta",porta a porta,"con tariffa puntuale, compostaggio e trattamento biologico a 'freddo'.",sg,succession/iteration/distributivity,modifier
porta a porta,yes,,a,porta,"Ne parlano domani in Sala Buzzati Gad Lerner, Aldo Grasso, Lorenzo Ornaghi (prorettore della Cattolica) e Luca Ricolfi (docente di sociologia) durante l'incontro «La politica",porta a porta,» organizzato dalla Fondazione Corriere per il ciclo «Società in diretta».,sg,succession/iteration/distributivity,modifier
porta a porta,yes,,a,porta,"Ma Davi suggerisce, se la vicenda Unipol dovesse monopolizzare tv e giornali nazionali ancora per mesi, di fare una campagna",porta a porta,": «Rinunciare a fare di Rai3 una rete militante, preferire interviste ai giornali e alle tv locali, tanta radio, non solo nelle emittenti di sinistra, comizi».",sg,succession/iteration/distributivity,modifier
porta a porta,idiosyncratic,,a,porta,"Ormai l'estorsione mensile, quella alla ""Mi manda Picone"", il film di Nanni Loy, del",porta a porta,"a Natale, Pasqua e Ferragosto, è una prassi da clan straccione, usata da gruppi che cercano di sopravvivere, incapaci di fare impresa.",sg,idiosyncratic,nominal
porta a porta,yes,,a,porta,"I Giuliano sembrano un clan giunto al capolinea, lentamente emerso dalla miseria, dal contrabbando alle puttane, dalla gestione dell'estorsione",porta a porta,ai rapimenti.,sg,succession/iteration/distributivity,modifier
porta a porta,yes,,a,porta,"Alla quale vanno aggiunti ancora un sindacato (Domina: organizzazione dei datori di lavoro domestico), un patronato (Informafamiglia), una società (Rete - Rete) per vendite",porta a porta,.,sg,succession/iteration/distributivity,modifier
porta a porta,yes,,a,porta,Un trucchetto che mi ha insegnato un mio ex che faceva vendite,porta a porta,non so più di cosa.,sg,succession/iteration/distributivity,modifier
porta a porta,yes,,a,porta,"Mia sorella Peg viveva a Cleveland, dove era diventata un'adepta delle vendite di cosmetici",porta a porta,", degli Indians e dei cristiani fondamentalisti, pur non necessariamente in questo ordine.",sg,succession/iteration/distributivity,modifier
porta a porta,yes,,a,porta,Hanno già cominciato a far firmare appelli,porta a porta," per Tel Kedar: ma quale disintossicazione, una volta drogati sono drogati per sempre, e certo dietro c'è qualcuno che vuole arricchirsi, e perché proprio qui da noi?",sg,succession/iteration/distributivity,modifier
porta a porta,yes,,a,porta,Suo padre faceva il rappresentante,porta a porta,"per la Rawleigh, un'azienda di prodotti per la casa.",sg,succession/iteration/distributivity,modifier
porta a porta,yes,,a,porta,Faceva un sacco di strada a piedi con i suoi ingombranti campionari per vendere prodotti per la casa,porta a porta,e guadagnare qualche soldo.,sg,succession/iteration/distributivity,modifier
porta a porta,yes,,a,porta,"Quando si riprese, Ron andò a vendere",porta a porta,i prodotti della Rawleigh come suo padre.,sg,succession/iteration/distributivity,modifier
porta a porta,yes,,a,porta,"Alcuni anni prima, quando faceva il venditore",porta a porta,"per la Rawleigh, Ron una volta fu invitato a entrare in casa da una donna che gli si parò difronte completamente nuda.",sg,succession/iteration/distributivity,modifier
porta a porta,yes,,a,porta,Per i venditori,porta a porta,", i postini, e chiunque altro non lo conoscesse, però, era comese Cujo fosse balzato fuori dall'inferno e l'unica cosa che stava tra loro e una spietata mutilazione fosse la nostra porta di legno.",sg,succession/iteration/distributivity,modifier
porta a porta,yes,,a,porta,Pensi a Leo che vende i suoi tritacarni,porta a porta,in Ohio.,sg,succession/iteration/distributivity,modifier
porta a porta,yes,,a,porta,"Nella prefazione ho accennato al piccolo libro Dame al Macao di Alberto Arduini, raffinatissimo antiquario romano con negozio prima in via Frattina, poi in piazza di Spagna",porta a porta,con la KeatsShelley Memorial.,sg,succession/iteration/distributivity,modifier
porta a porta,yes,,a,porta,"Il ""sistema"" di queste regole comprende la disciplina sui soggetti abilitati ad operare professionalmente nel mercato, gli obblighi di informazione e di trasparenza gravanti su quanti fanno appello al pubblico risparmio (predisposizione e pubblicazione di un prospetto informativo sotto il controllo della Consob - artt. 94 ss. t.u.fin. -), la tutela dei risparmiatori contro forme particolarmente insidiose di sollecitazione all'investimento (le c.d. vendite """,porta a porta,""", ora definite ""offerte fuori sede""- artt. 30 ss. t.u.fin. - ), la affermazione del principio di uguaglianza tra gli investitori e la conseguente repressione delle pratiche ad esso contrastanti ecc.",sg,succession/iteration/distributivity,modifier
porta a porta,no,filter_out,a,porta,RaiTre 21.00,porta a porta,"Si parlerà dei funerali del Papa, del pellegrinaggio dei fedeli in piazza San Pietro e del Conclave.",,,
porta a porta,no,filter_out,a,porta,La 7 23.30,porta a porta,,,,
Porta a Porta,no,filter_out,a,porta,"issioni benemerie che dovrebbero andare in onda 24 ore su 24 ! Vanno censurati  Porta a Porta e Matrix , soprattutto per il deprimente spettacolo costruito intorno_ai fatti",,,,,
Porta a Porta,no,filter_out,a,porta,", rincarano ancora . Sempre loro . Ieri , Silvio Berlusconi ha presentano a ""  Porta a Porta "" , in diretta TV , i risultati dei frenetici lavori del suo Governo che hanno",,,,,
Porta a porta,no,filter_out,a,porta,"della facoltà di Architettura , Â  diventato un palcoscenico neanche fosse Â   Porta a porta , la tentazione Â  è quella Â  di sottoscrivere Â  l ' invito Â  rivolto ai pol",,,,,
Porta a Porta,no,filter_out,a,porta,"e ore alla_luce_del sole , come amano dire , anzi dei riflettori : quelli di ""  Porta a Porta "" . Da una parte , il ministro della Giustizia del governo Berlusconi , Angelin",,,,,
Porta a Porta,no,filter_out,a,porta,"i * * * * Bruno Vespa Crisi in tv , trionfa Bruno Vespa : non ha concorrenti «  Porta a Porta » che su Raiuno racconta i drammatici momenti della giornata che ha segnato la",,,,,
Porta a Porta,no,filter_out,a,porta,"ora Caro Romano , non riesco a comprendere perché trasmissioni analoghe come «  Porta a Porta » e « Matrix » vengono messe in onda nello stesso giorno e più o meno alla stes",,,,,
Porta a Porta,no,filter_out,a,porta,", che macina comizi con disinvoltura e che ha annunciato che andrà presto a «  Porta a Porta » . Ad accoglierlo a Locarno , oltre_a un gruppuscolo di contestatori dei centr",,,,,
Porta a Porta,no,filter_out,a,porta,anza . « Perché dobbiamo partire dall ' idea di dover vendere ? - ha detto a «  Porta a Porta » - . Siamo così stupidi da non poter fare quello che fanno gli altri ? La Cai,,,,,
Porta a Porta,no,filter_out,a,porta,"atte lo show di Chiambretti . Su Raiuno Bruno Vespa commemora Mino Reitano a «  Porta a Porta » , con Pupo e la Cinquetti : lo seguono 1.817.000 spettatori , 23,36% di share",,,,,
Porta a Porta,no,filter_out,a,porta,eletti * Incarico Il premier Silvio Berlusconi lo ha annunciato ieri sera a «  Porta a Porta » parlando delle candidature per le elezioni Europee : « Licia Renzulli ( nella,,,,,
Porta a porta,no,filter_out,a,porta,"n maniera intelligente » . Ecco giustifica la sua presenza alla trasmissione «  Porta a porta » con l ' esigenza di chiarire i fatti . « Non ci sono andato volentieri , - di",,,,,
Porta a porta,no,filter_out,a,porta,vicedirettore generale Antonio Marano sostiene che la decisione di spostare «  Porta a porta » in prima serata e di far slittare « Ballarò » è stata presa per « valorizzare,,,,,
Porta a porta,no,filter_out,a,porta,"di « Ballarò » ; in Rai è ancora e sempre la politica a fare i palinsesti . «  Porta a porta » è un programma dal forte sapore istituzionale , la terza Camera del Parlament",,,,,
Porta a porta,no,filter_out,a,porta,"e del 2001 non c ' è più la Vespa di Moretti , ma Bruno Vespa , demiurgo di un  Porta a porta promosso al rango di terzo ramo del Parlamento . Su una scrivania di ciliegio B",,,,,
Porta a Porta,no,filter_out,a,porta,"dare voce anche ad Antonio Di Pietro , che dunque è stato discriminato . Il ""  Porta a Porta "" di Vespa dovrà invitare ancora i Radicali ( l ' Autorità lo ha già chiesto il",,,,,
porta a porta,yes,,a,porta,"Il ""sistema"" di queste regole comprende la disciplina sui soggetti abilitati ad operare professionalmente nel mercato, gli obblighi di informazione e di trasparenza gravanti su quanti fanno appello al pubblico risparmio (predisposizione e pubblicazione di un prospetto informativo sotto il controllo della Consob - artt. 94 ss. t.u.fin. -), la tutela dei risparmiatori contro forme particolarmente insidiose di sollecitazione all'investimento (le c.d. vendite """,porta a porta,""", ora definite ""offerte fuori sede""- artt. 30 ss. t.u.fin. - ), la affermazione del principio di uguaglianza tra gli investitori e la conseguente repressione delle pratiche ad esso contrastanti ecc.",sg,succession/iteration/distributivity,modifier
porta a porta,yes,,a,porta,"Per salvaguardare la salute le istituzioni devono offrirci la raccolta """,porta a porta,""", non gli inceneritori.",sg,succession/iteration/distributivity,modifier
porta a porta,no,filter_out,a,porta,"ma nel frattempo bruno vespa avrà fatto il plastico della nave ""pirata"" e durante una drammatica puntata di",porta a porta,", per l'occasione ciamata ""oblò ad oblò"", convincerà gli italiani che i 6 pirla erano comunisti pagati da garibaldini rossi con tendenze vietcong, ed il tutto finità a tarallucci e vino graziealla valida diplomazia italiana, conosciuta e stimata in tutto il mondo, isole comprese.",,,
porta a porta,yes,,a,porta,"Occorre poi potenziare e effettuare una ""vera"" raccolta differenziata, incrementare e incentivare la raccolta",porta a porta,"e quant'altro possibile per rendere sempre meno necessario l'utilizzo e la costruzione di nuovi inceneritori, che, oltreche insalubri, pesano in maniera insopportabile sui bilanci delle Istituzioni e dei cittadini.",sg,succession/iteration/distributivity,modifier
porta a porta,yes,,a,porta,"Sono un insegnante ed ho sempre cercato di far bene il mio lavoro, ma sono stufo di vedere i ""miei"" ragazzi che fanno i cassieri, distribuiscono volantini",porta a porta,"o che fanno gli operatori nei call - center (perchè questa è l'unica cosa che si trova da fare: se la famiglia non ha più i soldi per sostenersi, figurarsi se può permettersi di mandare i propri figli all'Università).",sg,succession/iteration/distributivity,modifier
porta a porta,yes,,a,porta,"Lo scontro «avvenne praticamente nel centro abitato, o addirittura",porta a porta,"» scrive Rocco Fino, in Il Capo di Leuca e dintorni.",sg,succession/iteration/distributivity,modifier
porta a porta,yes,,a,porta,"Profumino invadente di tabaccaio di lusso spacciato per raro oggetto di profumeria, qui la tirchieria è di casa, roba che ti intontisce l'olfatto, venditrice di bigiotteria",porta a porta,"o casalinga con marito assente, fa tante telefonate ad amiche che fanno anche loro tante telefonate.",sg,succession/iteration/distributivity,modifier
porta a porta,yes,,a,porta,"Io, invece, di indole, purdi scongiurare un litigio, sarei pronto a vendere le enciclopedie",porta a porta,.,sg,succession/iteration/distributivity,modifier
porta a porta,yes,,a,porta,I poliziotti facevano domande,porta a porta,", parlavano di omicidio a scopo di furto senza precisare che il vecchio era stato ridotto in briciole.",sg,succession/iteration/distributivity,modifier
porta a porta,yes,,a,porta,"Si vola con la fantasia applicata a Cassinetta di Lugagnano (MI), primo comune con la variante urbanistica a crescita zero stabilita per legge; a Torraca, piccolo paese del salernitano con l'intero parco di strade illuminato a LED (consumi energetici ridotti dell'80%); a Ponte alle Alpi (Bl), Capannori (Lu), Montebelluna dove la raccolta differenziata ""spinta"", cioè",porta a porta,", supera l'80%; a Castelbuono (Pa) e a Riace, il borgo dei bronzi, che alpostodei netturbini hanno assunto degli asini - massicci, resistenti e a zero emissioni  - per la raccolta porta a porta; a Settimo Rottaro (To), l'unico paese d'Italia con una fontana da cui sgorga acqua frizzante; ai tanti comuni che si sono dotati di erogatori per il latte e POTH o il detersivo alla spina, a quelli che hanno incentivato l'acquisto di pannelli fotovoltaici o la costituzione di gruppi d'acquisto.",sg,succession/iteration/distributivity,modifier
porta a porta,yes,,a,porta,"Si vola con la fantasia applicata a Cassinetta di Lugagnano (MI), primo comune con la variante urbanistica a crescita zero stabilita per legge; a Torraca, piccolo paese del salernitano con l'intero parco di strade illuminato a LED (consumi energetici ridotti dell'80%); a Ponte alle Alpi (Bl), Capannori (Lu), Montebelluna dove la raccolta differenziata""spinta"", cioè porta a porta, supera l'80%; a Castelbuono (Pa) e a Riace, il borgo dei bronzi, che alpostodei netturbini hanno assunto degli asini - massicci, resistenti e a zero emissioni - per la raccolta ",porta a porta,"; a Settimo Rottaro (To), l'unico paese d'Italia con una fontana da cui sgorga acqua frizzante; ai tanti comuni che si sono dotati di erogatori per il latte e POTH o il detersivo alla spina, a quelli che hanno incentivato l'acquisto di pannelli fotovoltaici o la costituzione di gruppi d'acquisto.",sg,succession/iteration/distributivity,modifier
porta a porta,idiosyncratic,,a,porta,"Il libro dei sogni di Silvio di Tito Boeri Una ""mobilitazione"" generale e, da affidare ai Promotori della libertà della Brambilla, il ""più grande",porta a porta,"mai realizzato in Italia ""per"" fare da megafono dell'azione del governo sul territorio"".",sg,idiosyncratic,nominal
porta a porta,yes,,a,porta,"Un viaggio,",porta a porta,", di circa 18 ore, per giunta più caro della stessa tratta in aereo.",sg,succession/iteration/distributivity,modifier
Porta a Porta,no,filter_out,a,porta,"torale : candidata senza fortuna nella lista civica per Alemanno . È guardando  Porta a Porta , ospite fissa sul tema Rom e dintorni , che si sono accorti di lei : del fatto",,,,,
Porta a Porta,no,filter_out,a,porta,"anche alle Camere , allora ? E ' quel che ha chiesto , durante la puntata di ""  Porta a Porta "" , Bruno Vespa al ministro della Pubblica Amministrazione . Il giornalista ha",,,,,
Porta a Porta,no,filter_out,a,porta,"e Sky schierano speciali e dirette . Domani su RaiUno Vespa condurrà Speciale  Porta a Porta maratona di oltre 6 ore in diretta dalle 23.45 . Sempre domani su Tg2 . it , al",,,,,
Porta a Porta,no,filter_out,a,porta,"ssimo . Questo , a_dispetto_del giuramento solenne rinnovato dal Cavaliere a «  Porta a Porta » di due giorni fa , fa pensare che l ' impegno di una « casetta » a tutti gli",,,,,
Porta a Porta,no,filter_out,a,porta,"sciello ricorre anche nella ricostruzione posticcia che il Cavaliere rende a ""  Porta a Porta "" sulla sua « imprevista » partecipazione alla festa di Noemi ( « Elio mi telef",,,,,
Porta a porta,no,filter_out,a,porta,"soprattutto maschile , in prima serata e non » . Pensa ad Annozero , Ballarò ,  Porta a porta , L ' Infedele ? « Certo . Michele Santoro , Giovanni Floris , Bruno Vespa e Ga",,,,,
porta a porta,yes,,a,porta,Non si era detto una volta che avrebbero fatto una specie di raccolta,porta a porta,?,sg,succession/iteration/distributivity,modifier
porta a porta,yes,,a,porta,"E Nicola Zingaretti, presidente della Provincia di Roma aggiunge: «Leggeremo il documento, ma noi siamo in regola: in 3 anni siamo passati da 29 mila a 850 mila cittadini impegnati sulla raccolta",porta a porta,».,sg,succession/iteration/distributivity,modifier
porta a porta,yes,,a,porta,"I risultati sono ottimi da quando il Comune, coadiuvato dalla società di gestione, ha adottato la raccolta «",porta a porta,"», grazie anche alla fattiva collaborazione della popolazione, adeguatamente coinvolta da efficaci iniziative di comunicazione ed informazione alla cittadinanza: la raccolta pro - capite nel 2011 è stata di 17 kg per abitante contro una media di 6,6 kg per abitante del Lazio.",sg,succession/iteration/distributivity,modifier
Porta a Porta,no,filter_out,a,porta,di Francesco battono i giovani della Marcuzzi . Prima serata con lo « Speciale  Porta a Porta » dedicato alla Giornata Mondiale della Gioventù di Rio : il Papa viene seguito,,,,,
porta a porta,yes,,a,porta,Entro fine anno il vetro si raccoglierà,porta a porta,.,sg,succession/iteration/distributivity,modifier
