anima ad anima,yes,,a,anima,"Ecco, devono essere nati così questi ultimi due romanzi di famiglia, seguiti da lunghe ore al computer, uno accanto all'altro, gomito a gomito,",anima ad anima,", ogni tanto un sospiro, una lunga occhiata, qualche sorriso di tenerezza perché i due si adorano e si cercano come solo due innamoratini sanno fare, al di là delle loro abbondanti sessanta primavere. ",sg,juxtaposition/contact,modifier
balcone a balcone,yes,,a,balcone,"di gatti che mi ospita sta nell ' appartamento in cui abitiamo , che confina ,  balcone a balcone , con un altro appartamento nel quale viveva fino_a poco tempo fa una gatta vec",,,sg,juxtaposition/contact,modifier
balcone a balcone,yes,,a,balcone,"ente superiore nel cortile , a esempio , sul cav. Bizzini , suo dirimpettaio ,  balcone a balcone , che vive con la figlia , il genero e i ragazzi un maschio e una femmina e pot",,,sg,juxtaposition/contact,modifier
balle a balle,no,verbal,a,balle,"o che andava da Brian Boldman . "" Concluse che forse era meglio non aggiungere  balle a balle . Uscì dall ' ufficio e disse alla segretaria che stava andando al bar del 5º P",,,,,
bit a bit,yes,,a,bit,L'operazione viene eseguita,bit a bit,", ovvero tra le coppie di bit corrispondenti nei due operandi.",sg,succession/iteration/distributivity,modifier
bit a bit,yes,,a,bit,Esegue l 'operazione di OR,bit a bit,"tra i due operandio specificati, ponendo il risultato nel secondo.",sg,succession/iteration/distributivity,modifier
bit a bit,yes,,a,bit,Esegue l'operazione di OR esclusivo,bit a bit,"tra i due operandi specificato, ponendo il risultato nel secondo.",sg,succession/iteration/distributivity,modifier
bit a bit,yes,,a,bit,"È compito di quest'ultimo trasmettere,",bit a bit,", l'informazione sul cavo e quindi al destinatario.",sg,succession/iteration/distributivity,modifier
bit a bit,yes,,a,bit,in datagram Controlla il flusso delle informazioni Fisico Trasmette i datagram  bit a bit Realizza lo scambio delle informazioni Tabella 6 Livelli di comunicazione del m,,,sg,succession/iteration/distributivity,modifier
bocca a bocca,yes,,a,bocca,La respirazione,bocca a bocca,.,sg,juxtaposition/contact,modifier
bocca a bocca,yes,,a,bocca,"Alcune tecniche di rianimazione, come per esempio la respirazione",bocca a bocca,", possono risultare pericolose per il soccorritore: in questo modo si possono trasmettere molte malattie, soprattutto se l'infortunato ha delle perdite di sangue.",sg,juxtaposition/contact,modifier
bocca a bocca,yes,,a,bocca,"La respirazione artificiale andrebbe fatta attraverso l'apposito pallone ""ambu"", che evita il contatto",bocca a bocca,", ed è più efficace perché immette aria dall'ambiente o ricca di ossigeno inveceche aria già respirata e ricca di anidride carbonica.",sg,juxtaposition/contact,modifier
bocca a bocca,yes,,a,bocca,"In ogni caso, chi compie la respirazione",bocca a bocca,lo fa a suo rischio e pericolo.,sg,juxtaposition/contact,modifier
bocca a bocca,yes,,a,bocca,"Allo stesso modo, la respirazione",bocca a bocca,", serve per ossigenare il sangue che viene pompato in modo meccanico attraverso il massaggio cardiaco.",sg,juxtaposition/contact,modifier
bocca a bocca,yes,,a,bocca,A questo punto bisogna procedere all'iperestensione del capo e prepararsi all'insufflazione,bocca a bocca,.,sg,juxtaposition/contact,modifier
bocca a bocca,yes,,a,bocca,"La respirazione artificiale andrebbe praticata attraverso strumenti medicali come il pallone ambu e, per motivi di igiene e profilassi, è sconsigliabile praticare la respirazione",bocca a bocca,.,sg,juxtaposition/contact,modifier
bocca a bocca,yes,,a,bocca,Respirazione bocca a bocca naso,bocca a bocca,.,sg,juxtaposition/contact,modifier
bocca a bocca,yes,,a,bocca,"Se l'infortunato presenta delle fratture alla mandibola o alla mascella, si può procedere come nelcaso della respirazione",bocca a bocca,"con la differenza che la bocca viene tenuta chiusa per evitare che fuoriesca l'aria insufflata, e le insufflazioni vanno fatte attraverso il naso.",sg,juxtaposition/contact,modifier
bocca a bocca,yes,,a,bocca,Respirazione,bocca a bocca,naso.,sg,juxtaposition/contact,modifier
bocca a bocca,yes,,a,bocca,Se non è possibile la respirazione,bocca a bocca,si può tentare una respirazione manuale la cui efficacia è molto inferiore.,sg,juxtaposition/contact,modifier
bocca a bocca,yes,,a,bocca,Se non è possibile la respirazione,bocca a bocca,si può tentare questa respirazione manuale la cui efficacia è molto inferiore.,sg,juxtaposition/contact,modifier
bocca a bocca,yes,,a,bocca,Questa posizione è indispensabile primadi praticare la respirazione,bocca a bocca,", altrimenti l'aria insufflata rischia di non raggiungere i polmoni.",sg,juxtaposition/contact,modifier
bocca a bocca,yes,,a,bocca,È uno strumento che serve per effettuare la respirazione artificiale evitando il contatto,bocca a bocca,.,sg,juxtaposition/contact,modifier
bocca a bocca,yes,,a,bocca,In questo modo il soccorritore può ventilare l'infortunato evitando il contatto,bocca a bocca,.,sg,juxtaposition/contact,modifier
bocca a bocca,yes,,a,bocca,"Inoltre, l'aria insufflata presa dall'ambiente, o collegata a un erogatore di ossigeno contiene delle percentuali di ossigeno superiori a quelle insufflate con il metodo",bocca a bocca,.,sg,juxtaposition/contact,modifier
bocca a bocca,yes,,a,bocca,Procedete con la respirazione,bocca a bocca,.,sg,juxtaposition/contact,modifier
bocca a bocca,idiosyncratic,,a,bocca,"Neppure le mura del carcere possono trattenere le parole del Marchese: la bella lavandaia Madeleine (Kate Winslet) le fa uscire con la biancheria, le ricopia dalle lenzuola del recluso, le trascrive raccogliendo il",bocca a bocca,"che, dalla cella dello scrittore, attraversa quelle dei ricoverati di Charenton.",sg,idiosyncratic,nominal
Bocca a bocca,yes,,a,bocca,"Bocca a bocca parlo con lui , in visione.",,,sg,juxtaposition/contact,modifier
bocca a bocca,yes,,a,bocca,"Metodo ""bocca a bocca"".",,,sg,juxtaposition/contact,modifier
bocca a bocca,yes,,a,bocca,Per i primi cinque minuti il massaggio non va interrotto (amenoche non si sia obbligati ad eseguire contemporaneamente la respirazione,bocca a bocca,.,sg,juxtaposition/contact,modifier
bocca a bocca,yes,,a,bocca,"Non hai preso lezioni di pronto soccorso, non sai come si fa un massaggio cardiaco, non ti piace la respirazione",bocca a bocca,", trovi inutile quindi fermarti a guardare.",sg,juxtaposition/contact,modifier
bocca a bocca,yes,,a,bocca,"Pioveva sugli astanti infagottati, campanelli suonavano elemosine, sigarette e parole bagnate sotto un tetto di Smeraldo, dentro poltrone rosse di solitudine aspettavano in file ordinate che la musica facesse la respirazione",bocca a bocca,alla sala.,sg,juxtaposition/contact,modifier
bocca a bocca,yes,,a,bocca,Nessuno parla dell'impiegato di banca che non è corrotto e che magari un giorno ha salvato la vita a un collega facendogli la respirazione,bocca a bocca,.,sg,juxtaposition/contact,modifier
bocca a bocca,yes,,a,bocca,E il protagonista ha imparato a fare la respirazione,bocca a bocca,leggendo le riviste gettate nella spazzatura.,sg,juxtaposition/contact,modifier
bocca a bocca,yes,,a,bocca,"I film egiziani dell'epoca mostravano senza pudori la nudità delle danzatrici del ventre, di attrici avvenenti, ed effusioni disinibite con il finale del bacio",bocca a bocca,tra i protagonisti perdutamente innamorati.,sg,juxtaposition/contact,modifier
bocca a bocca,yes,,a,bocca,"In questo libro, che è il seguito naturale di Regime, raccontiamo che cosa è accaduto nell'ultimo decennio: da quando quel cadavere politico fu rianimato dai suoi sedicenti oppositori con respirazioni",bocca a bocca,", promosso padre costituente, beneficiato prima con provvidenziali""distrazioni""che gli consentirono di quotare in Borsa i suoi debiti, poi con leggi su misura (vedi alla voce Maccanico) e leggi insabbiate (vedi alla voce conflitto d'interessi) che salvarono il suo monopolio dichiarato incostituzionale dalla Consulta findal'94.",sg,juxtaposition/contact,modifier
bocca a bocca,yes,,a,bocca,Kayla ti ha praticato la respirazione,bocca a bocca,.,sg,juxtaposition/contact,modifier
bocca a bocca,yes,,a,bocca,"È stato qualche anno fa e ricordo ogni minimo dettaglio: lui disteso per terra, attraverso la portiera schiacciata stava facendo la respirazione",bocca a bocca,a una donna che aveva perso conoscenza.,sg,juxtaposition/contact,modifier
bocca a bocca,yes,,a,bocca,"In fondo alla strada, in un punto in cui il lampione non arrivava, c'era una coppia abbracciata, immobile come una statua, le labbra appiccicate in un contatto di pietra cui il buio dava parvenza di respirazione",bocca a bocca,.,sg,juxtaposition/contact,modifier
bocca a bocca,yes,,a,bocca,"Quelle di Gesù non sono le prime della Bibbia: il primato spetta infatti ad Elia, che resuscitò un bambino sdraiandosi sopraal cadavere tre volte, seguito da Eliseo, che usò qualcosa di simile alla respirazione",bocca a bocca,.,sg,juxtaposition/contact,modifier
bocca a bocca,yes,,a,bocca,"Insomma, l'anima non è altro che un'ipostatizzazione del respiro: non a caso, per infondere divinamente la vita Jahvé soffia semplicemente il suo alito nelle narici di Adamo, in una specie di animazione (appunto)",bocca a bocca,.,sg,juxtaposition/contact,modifier
bocca a bocca,yes,,a,bocca,Cominciò a praticare la respirazione,bocca a bocca,a Phillip mentre scendeva le scale.,sg,juxtaposition/contact,modifier
bocca a bocca,yes,,a,bocca,E Sage e Meredith continuavano a farti la respirazione,bocca a bocca,.,sg,juxtaposition/contact,modifier
bocca a bocca,yes,,a,bocca,"Tentai di rianimarlo, a bordo c'era un medico che provò la respirazione",bocca a bocca,", ma non c'era più nulla da fare.",sg,juxtaposition/contact,modifier
bocca a bocca,yes,,a,bocca,"Sembrava che ci fosse poco da fare per la piccola Jihan: «Il camionista ha portato dell'acqua per lavarla dal sangue, e io ho provato a farle la respirazione",bocca a bocca,».,sg,juxtaposition/contact,modifier
bocca a bocca,yes,,a,bocca,"Se invece vedi una persona attaccata alla bocca di un'altra, esistono effettivamente più possibilità: che stiano facendo respirazione",bocca a bocca,", che, vista la miseria, abbiano un solo apparecchio per raddrizzare i denti e lo usino in contemporanea, o che si bacino.",sg,juxtaposition/contact,modifier
bocca a bocca,yes,,a,bocca,"Peccato che lui fosse semistecchito e che, quindi, gli abbiano dovuto praticare prima il massaggio cardiaco e poi la respirazione",bocca a bocca,.,sg,juxtaposition/contact,modifier
bocca a bocca,yes,,a,bocca,"La madre era sparita dietro le spalle larghe dello sconosciuto, i due stavano attaccati",bocca a bocca,e si stringevano forte.,sg,juxtaposition/contact,modifier
bocca a bocca,yes,,a,bocca,Ripasso mentalmente le mosse della respirazione,bocca a bocca,e incomincio.,sg,juxtaposition/contact,modifier
bocca a bocca,yes,,a,bocca,Leonardo si china su Lucrezia e inizia a farle anche lui la respirazione,bocca a bocca,.,sg,juxtaposition/contact,modifier
bocca a bocca,yes,,a,bocca,"Se non avesse ripreso a respirare, doveva procedere con la respirazione",bocca a bocca,.,sg,juxtaposition/contact,modifier
bocca a bocca,yes,,a,bocca,"Così la ""guerriglia"" non è stata organizzata da gruppi d'élite, da attivisti di qualche sorta, da una ""punta di diamante"", ma si è sviluppata spontaneamente, come una sorta di tam tam, di trasmissione",bocca a bocca,da cittadino a cittadino.,sg,juxtaposition/contact,modifier
bocca a bocca,idiosyncratic,,a,bocca,"D'altra parte, quando lenta, ostinata e inesorabile, un'ora prima sfiorava i palazzi, le cupole e i campanili più agili e ariosi del mondo, noi, che da un'altana osservavamo il suo",bocca a bocca,"con Palazzo Ducale, San Giorgio Maggiore, la chiesa della Salute, avevamo la netta impressione che la nave fosse Venezia, e che la città senza radici e senza identità fosse invece questa Msc Preziosa, con il suo esotismo omologato, il dominio di un ordine finto aldilàdi ogni misura e di ogni codice, il triangolo delle Bermude delle identità perdute delle città del mondo ormai alla deriva, il luccicante spazio - spazzatura inventato dall'architetto Koolhaas che proprio quest'anno dirigerà la Biennale: 140mila tonnellate di junkspace, 68 metri d'altezza, 4.345 passeggeri, 1.751 cabine, 97 suite con maggiordomo personale in tight e guanti bianchi, il teatro Platinum con 1.600 posti, 4 piscine, 12 jacuzzi, 9 ristoranti (uno Eataly) e 26 ascensori per portare Astolfo sulla Luna.",sg,idiosyncratic,nominal
bocca a bocca,yes,,a,bocca,"Bruciavano i fuochi: e, inoltrandosi la notte, dilatando sopra i tetti e lungo gli asfalti il dorso, sembrava mirassero a congiungere",bocca a bocca,avviluppando in un abbraccio evidentemente mortale tutta la città.,sg,juxtaposition/contact,modifier
bocca a bocca,yes,,a,bocca,"Ah ... e quando vi ho trovati abbracciati,",bocca a bocca,", cosa stavate facendo, l'aereosolterapia reciproca?",sg,juxtaposition/contact,modifier
bocca a bocca,yes,,a,bocca,Mia nonna mi aveva praticato una tempestiva respirazione,bocca a bocca,", sperando di essere arrivata in tempo, primadi lesioni irreparabili al cervello.",sg,juxtaposition/contact,modifier
bocca a bocca,idiosyncratic,,a,bocca,Dopo quel,bocca a bocca,"estenuante per rianimare Tom, uno che prende vita per conto suo.",sg,idiosyncratic,nominal
bocca a bocca,yes,,a,bocca,"A difendere gli amanti aveva fatto scendere una coltrina di avara trasparenza, e quei corpi ormai scoperti erano libri di solare negromanzia, i cui accenti sacri si rivelavano a due soli eletti, che si sillabavano a vicenda",bocca a bocca,.,sg,juxtaposition/contact,modifier
bocca a bocca,yes,,a,bocca,"Quando Immacolata vide che non respirava gli gettò sul viso acqua fredda, ma il rimedio non ebbe alcun effetto, allora si ricordò di un programma televisivo e si mise a fargli la respirazione",bocca a bocca,e a colpirgli il petto con i pugni.,sg,juxtaposition/contact,modifier
bocca a bocca,yes,,a,bocca,Tu boccheggiavi e tossivi; poi ti facevano la respirazione,bocca a bocca,ed eri fuori pericolo.,sg,juxtaposition/contact,modifier
bocca a bocca,yes,,a,bocca,L'altro agente praticò a Sullivan la respirazione artificiale,bocca a bocca,.,sg,juxtaposition/contact,modifier
bocca a bocca,yes,,a,bocca,"Tutti dovrebbero essere capaci di fare un letto, di cucinare un semplice pasto, di cucire un bottone, di bendare una ferita, di scacciare un cane, di aggiustare un rubinetto, di aprire una vongola, di fare la respirazione",bocca a bocca,.,sg,juxtaposition/contact,modifier
bocca a bocca,yes,,a,bocca,Karin levò la mano: Ma nella Bibbia c'è scritto che Dio ha soffiato la vita dentro il primo uomo... La respirazione,bocca a bocca,.,sg,juxtaposition/contact,modifier
bocca a bocca,yes,,a,bocca,"Mentre una fazione sosteneva che fosse meglio metterlo seduto, bagnargli la fronte e parlargli, un altro gruppo asseriva, sempre a squarciagola, che fosse meglio lasciarlo così com'era, in attesa del capufficio, vale a dire tutto raggomitolato e col sangue che gli usciva dal naso; invece un terzo partito, con a capo Clara, optava energicamente per riattivargli la circolazione sanguigna mettendolo a testa in giù, massaggiandogli i polsi, picchiettandogli le guance e facendogli addirittura la respirazione",bocca a bocca,.,sg,juxtaposition/contact,modifier
bocca a bocca,yes,,a,bocca,"Tutto si vela, tutto si ammanta, tutto trapassa così in un mondo parallelo dove anche il dolore può stemperarsi nel calore delle leggende, nella familiarità dei lunghi racconti",bocca a bocca,.,sg,juxtaposition/contact,modifier
bocca a bocca,yes,,a,bocca,"A causa di queste fasi di rigetto acuto, e non sapendo come affrontarle, Barnard e la equipe decisero di effettuare il trapianto eterotopico, una tecnica che consiste nel lasciare in sito il cuore originale, la sua parete posteriore degli atrii viene anastomizzata (ricongiungimento",bocca a bocca,", in questo di vene e arterie), agli atrii del secondo cuore inmododa consentire una assistenza o una vera e propria sostituzione funzionale al cuore malato.",sg,juxtaposition/contact,modifier
bocca a bocca,yes,,a,bocca,Il significato erotico del bacio deriverebbe dall'alimentazione,bocca a bocca,dell'infante.,sg,juxtaposition/contact,modifier
bocca a bocca,yes,,a,bocca,Intanto io gli facevo la respirazione,bocca a bocca,"e il massaggio cardiaco, gli cambiavo il pigiama sporco, lo tenevo su per la testa.",sg,juxtaposition/contact,modifier
bocca a bocca,yes,,a,bocca,"Per oltre 15 minuti ha tenuto in vita un amico intrappolato sott'acqua soffiandogli aria nei polmoni con ripetute immersioni e altrettante ""respirazioni",bocca a bocca,""".",sg,juxtaposition/contact,modifier
bocca a bocca,yes,,a,bocca,In attesa dell'arrivo dell'ambulanza gli hanno praticato il massaggio cardiaco e la respirazione,bocca a bocca,ma tutto è stato inutiule.,sg,juxtaposition/contact,modifier
bocca a bocca,yes,,a,bocca,"Incurante dei rischi di contagio che si possono correre in casi del genere, il capopattuglia, Marco Colmo, ha praticato al tossicodipendente la respirazione",bocca a bocca,"; l'autista, Mauro Cucciniello, gli ha, quindi, fatto il massaggio cardiaco.",sg,juxtaposition/contact,modifier
bocca a bocca,yes,,a,bocca,"Si è trascinato per qualche metro finoall'uscita della fabbrica, poi è crollato sul marciapiede sotto gli occhi del giovane complice, che ha tentato inutilmente di animarlo con la respirazione",bocca a bocca,.,sg,juxtaposition/contact,modifier
bocca a bocca,yes,,a,bocca,"Di più, provano a rianimare i due amici: massaggio cardiaco, respirazione",bocca a bocca,.,sg,juxtaposition/contact,modifier
bocca a bocca,yes,,a,bocca,"Se il bambino non respira: intervenire con la respirazione """,bocca a bocca,""", insufflando aria tenendo chiuse le narici con le dita.",sg,juxtaposition/contact,modifier
bocca a bocca,yes,,a,bocca,"Se, invece, la vittima dovesse presentarsi priva di sensi e avere difficoltà respiratorie, iniziate immediatamente la respirazione artificiale",bocca a bocca,.,sg,juxtaposition/contact,modifier
bocca a bocca,yes,,a,bocca,Insegnare al maggior numero di persone (ad esempio studenti delle scuole medie superiori) le tecniche del massaggio cardiaco e della respirazione,bocca a bocca,.,sg,juxtaposition/contact,modifier
bocca a bocca,yes,,a,bocca,E Respirazione bocca a bocca A Nel bambino incosciente la lingua tende a scivolare indietro e a ostruire il passaggio dell ' aria.,,,sg,juxtaposition/contact,modifier
bocca a bocca,yes,,a,bocca,"Se non respira, intervenire per la respirazione",bocca a bocca,.,sg,juxtaposition/contact,modifier
bocca a bocca,yes,,a,bocca,Nel bambino da 1 a 8 anni si fa la respirazione,bocca a bocca,", tenendo chiuse le narici con le dita.",sg,juxtaposition/contact,modifier
bocca a bocca,yes,,a,bocca,"La rinuncia alla propria individualità è celebrata in Breathing In POTH Breathing Out (sempre del 1977) dove,",bocca a bocca,"e con le narici chiuse da filtri di sigaretta, l'una respira nella bocca dell'altro, in una rappresentazione tragica di cosa succede quando si dipende completamente da un'altra persona.",sg,juxtaposition/contact,modifier
braccio a braccio,yes,,a,braccio,"Primo edificio per la musica progettato dallo studio di Michel Rojkind, è il frutto di un processo progettuale sviluppato",braccio a braccio,"con la direzione dell'Orchestra: le scelte riguardanti il tipo di sala, il numero di sedute e le destinazioni funzionali degli ambienti sono dunque condivise e volute dai successivi inquilini dello spazio.",sg,juxtaposition/contact,modifier
brano a brano,yes,,a,brano,"""E siccome era stato portato lì davanti con tutti i suoi paramenti sacerdotali, iniziò un rito in cui",brano a brano,i paramenti gli venivano levati sinoa che rimase in quella vesticciola che a Firenze chiamano cioppa.,sg,succession/iteration/distributivity,modifier
brano a brano,yes,,a,brano,E mentre viene divorato,brano a brano,"non saprà più chi abbia ragione, e quasi spera che il rito sia buono, per giustificare almeno la propria morte.",sg,succession/iteration/distributivity,modifier
brano a brano,yes,,a,brano,"Preso da passionali amnesie, lui che a tratti (e per pagine splendide) sa navigare per gli spazi siderali o aliare su interminate praterie, sempre più spesso si fa carne, vive in una donna rugosa e cadente, in un cartografo gobbo, in un ebreo fuggiasco, viene sacrificato",brano a brano,"come disperata lucertola, spinge Mosè a inventare la storia e la missione del popolo eletto, si congiunge con una fanciulla ebrea e diventa, accorgendosene in ritardo, padre di Cristo, cercando di credere in lui, affrontandolo deluso, affascinato, impotente di fronte al suo dolore e alla sua gloria, parla con Agostino, sobilla Freud, complotta con Einstein... Ma è sempre più insicuro, voglioso che l'uomo compia il destino di entrambi, la perfezione del mondo umano e l'autocoscienza di lui, povero Dio, che attende sempreche qualcuno scriva le sue memorie, terrorizzato dalla grandezza e perfezione che i filosofi gli attribuiscono, ansioso di ripartire, e sempre risospinto a vivere sulla sua pelle di creatore carnale e continuamente incarnato gli orgasmi e il sangue, la gioia ed il dolore di quel mondo che non ha potuto non creare.",sg,succession/iteration/distributivity,modifier
brano a brano,yes,,a,brano,"Ma non primadi aver beccato Nauplio finoa levargli la pelle, a scuoiarlo,",brano a brano,.,sg,succession/iteration/distributivity,modifier
brano a brano,yes,,a,brano,È sensibile ai tentativi dei poeti di rischiarare,brano a brano,l'ancora vasta oscurità delle cose non dette.,sg,succession/iteration/distributivity,modifier
campo a campo,yes,,a,campo,"o deponevano ai piedi degli apostoli "" . E così , goccia a goccia , o meglio ,  campo a campo e casa a casa , in duemila anni la Chiesa ha potuto accumulare un patrimonio im",,,sg,succession/iteration/distributivity,modifier
carineria a carineria,no,verbal,a,carineria,"olscevichi . « E se non lo capite , allora andate a fare ... » . Sommando così  carineria a carineria . S ' intende che « andare a fare » è detto con affetto . Con eguale affetto i",,,,,
carte a carte,no,verbal,a,carte,"a . Six aveva difeso a lungo il suo bistrot di place des Fetes . Aveva opposto  carte a carte , legge a legge . La sua Alvernia natale gli aveva insegnato a sopravvivere in",,,,,
casa a casa,yes,,a,casa,"piedi degli apostoli "" . E così , goccia a goccia , o meglio , campo a campo e  casa a casa , in duemila anni la Chiesa ha potuto accumulare un patrimonio immenso , che ne",,,sg,succession/iteration/distributivity,modifier
cellule a cellule,no,other,a,cellule,", determina anche l ' attivazione linfocitaria e la differenziazione di queste  cellule a cellule effettrici . Se invece un antigene è presentato da altri tipi di cellule , non",,,,,
ciocca a ciocca,yes,,a,ciocca,Il più attuale si fa sfilando,ciocca a ciocca,", per creare l'effetto piuma, che alleggerisce la pettinatura e rende la piega particolarmente facile.",sg,succession/iteration/distributivity,modifier
cm a cm,yes,,a,cm,"uardavo fissofisso . Il sottinteso mi sembrava chiaro . Cominciai a esaminarla  cm a cm , la situazione era piuttosto eccitante , e risposi : "" Niente , il lavoro è la",,,sg,succession/iteration/distributivity,modifier
collega a collega,no,PNPN,a,collega,"ello che accade o che lui fa credere che accada . A una sola condizione , da ""  collega a collega "" : "" Non citarmi mai "" , si capisce . Eppure tanta cautela non gli risparmia c",,,,,
commento a commento,no,verbal,a,commento,"ento di una dichiarazione d ' agenzia . Volti tirati , ma è inutile aggiungere  commento a commento . "" Di Pietro ha delle priorità diverse "" aveva detto poco prima Parisi . Modo",,,,,
commissione a commissione,no,filter_out,a,commissione,ase quoziente merito tali 5 . 6 . I attribuito punteggi quadri all ' ispettore  commissione a commissione . d ' avanzamento . graduatoria di merito risultante da compila sono d ' avanza,,,,,
complicazione a complicazione,no,verbal,a,complicazione,"sono occupate dalle televisioni per i loro ponti radio ) , potrebbe aggiungere  complicazione a complicazione , rendendo ancora più difficile l ' adozione del nuovo sistema . I pretendenti",,,,,
confusione a confusione,no,verbal,a,confusione,"aggiunge la nota , « che esige di non disperdere il voto , per non aggiungere  confusione a confusione » . * Allarme veleni « Nichel e cadmio nella rete idrica » * * di GIOVANNA MARI",,,,,
confusione a confusione,no,verbal,a,confusione,"sta in piedi . Nè sul piano della forma nè sul piano della sostanza . Aggiunge  confusione a confusione . C ' è al lavoro , da mesi , la commissione Bicamerale : è lì che bisogna batt",,,,,
consenso a consenso,no,verbal,a,consenso,"ico in veste veltronica , un infotainment che crea consenso , anzi , che somma  consenso a consenso , riuscendo perfino a proporre al pubblico in prima serata scrittori come Mario",,,,,
core a core,no,filter_out,a,core,"Si direbbe di sì, a giudicare da quel che sta avvenendo nelle acque del Gran Cayman, nel Mar dei Caraibi, dove in un tunnel naturale che corre parallelo alla barriera corallina nuotano ",core a core,subacquei e pesci velenosi.,sg,juxtaposition/contact,modifier
