goccia a goccia,yes,,a,goccia,"Tuttavia, quanto di superstizioso e irrazionale vive in me, sopraffacendomi, a tratti, come il sintomo di una malattia ciclotimica o come una impressionabilità che si intromette fra me e il mondo, rendendolo nemico ai miei sensi, mi fu istillato",goccia a goccia,da mia zia Peppina.,sg,succession/iteration/distributivity,modifier
goccia a goccia,yes,,a,goccia,"Efestione si diede da fare e il medico versò il liquido in bocca ad Alessandro,",goccia a goccia,.,sg,succession/iteration/distributivity,modifier
goccia a goccia,yes,,a,goccia,"Cominciò a scavare con la punta della spada finché vide affiorare lentamente,",goccia a goccia,", dell'acqua.",sg,succession/iteration/distributivity,modifier
goccia a goccia,yes,,a,goccia,"L'acqua, dal canto suo, non scorreva più fluente, ma",goccia a goccia,", Una folla di gocce che se ne andavano mentre Mahdokht pativa.",sg,succession/iteration/distributivity,modifier
goccia a goccia,yes,,a,goccia,"Nei giorni a venire e nelle notti illuni e nelle notti quando una luna fulgidissima splendeva sopra la terra, il vecchio avrebbe continuato a parlargli, a parlargli,",goccia a goccia,", sassolino su sassolino, petalo dopo petalo.",sg,succession/iteration/distributivity,modifier
goccia a goccia,yes,,a,goccia,"«Be', non spetta a noi ammirare questo centellinare",goccia a goccia,",» rispose Theresa.",sg,succession/iteration/distributivity,modifier
goccia a goccia,yes,,a,goccia,Era solito compiacersi nel centellinare,goccia a goccia,l'esposizione delle proprie opinioni per tenere in sospeso gli ascoltatori.,sg,succession/iteration/distributivity,modifier
goccia a goccia,yes,,a,goccia,"Può darsi che in realtà non fosse che una ventata di panico, ma sta di fatto che Pablo Vicario entrò da solo nel porcile a cercare gli altri due coltelli, mentre il fratello agonizzava",goccia a goccia,sforzandosi di orinare sotto i tamarindi.,sg,succession/iteration/distributivity,modifier
goccia a goccia,yes,,a,goccia,"La medicina nutriva Malaussene con parsimonia,",goccia a goccia,.,sg,succession/iteration/distributivity,modifier
goccia a goccia,yes,,a,goccia,"Aggiungete,",goccia a goccia,", il latte.",sg,succession/iteration/distributivity,modifier
goccia a goccia,yes,,a,goccia,"Aggiungete,",goccia a goccia,", il latte finché il raggio luminoso diventa chiaramente visibile.",sg,succession/iteration/distributivity,modifier
goccia a goccia,yes,,a,goccia,Sarebbe meglio parlare di irrigazione,goccia a goccia,", quasi indipendente dai meriti dei ricercatori e dal valore del progetto presentato.",sg,succession/iteration/distributivity,modifier
goccia a goccia,yes,,a,goccia,C'è l'emissione,goccia a goccia,", tipica di ""Phosphorus""e""Selenium"".",sg,succession/iteration/distributivity,modifier
goccia a goccia,yes,,a,goccia,"Unite poi,",goccia a goccia,", il latte (non necessariamente tutto) finché la preparazione risulterà una crema omogenea.",sg,succession/iteration/distributivity,modifier
goccia a goccia,yes,,a,goccia,"Se, invece, la persona a cui volete regalarlo è come Coco Chanel, che diceva sempreche il profumo va messo ""dove si vuole essere baciate"", preferite un flacone: lo userà",goccia a goccia,.,sg,succession/iteration/distributivity,modifier
goccia a goccia,yes,,a,goccia,"Secondo, meglio usare sistemi di irrigazione",goccia a goccia,", che non quelli a getto nebulizzato inmodoche vi sia un minor consumo d'acqua.",sg,succession/iteration/distributivity,modifier
goccia a goccia,yes,,a,goccia,"Con il tempo la situazione peggiora: lo svuotamento avviene a più riprese,",goccia a goccia,.,sg,succession/iteration/distributivity,modifier
goccia a goccia,yes,,a,goccia,"Grazie a una saracinesca regolata dall'interno dell'edificio, l'acqua della vasca sgorga",goccia a goccia,dalle fauci muschiate di un ippopotamo in pietra.,sg,succession/iteration/distributivity,modifier
goccia a goccia,yes,,a,goccia,La cura giusta,goccia a goccia,"vediamo quali sono i piccoli fastidi che si possono curare con un collirio da banco, e quale prodotto è più adatto per ognuno di essi.",sg,succession/iteration/distributivity,modifier
goccia a goccia,yes,,a,goccia,Spesso il sangue si mette a sgorgare,goccia a goccia,"o in modo continuo, iniziando improvvisamente senza una ragione apparente: talvolta i genitori notano solo l'orecchio o il cuscino sporco di sangue.",sg,succession/iteration/distributivity,modifier
goccia a goccia,yes,,a,goccia,Quando l'acqua e gli oli hanno la stessa temperatura (tra i 30 - 35 ° C) aggiungete l'acqua,goccia a goccia,emulsionando con il frullino a immersione.,sg,succession/iteration/distributivity,modifier
goccia a goccia,yes,,a,goccia,"La fine portava la festa, il maiale si svuotava",goccia a goccia,", in chiesa il prete issava il Cristo infreddolito sulla croce e dava l'ostia ai credenti, le strade si riempivano, sulla terra bianca la chiazza rossa si stendeva con la lentezza delle cose passate, e il mio sguardo non trovava rifugio.",sg,succession/iteration/distributivity,modifier
goccia a goccia,yes,,a,goccia,"Circuiti cognitivi che si tenta di riattivare passo dopo passo,",goccia a goccia,", perché «lo sviluppo cognitivo può essere come una botte, che riempi molto velocemente, oppure come una damigiana che ha il collo stretto e va riempita lentamente.",sg,succession/iteration/distributivity,modifier
goccia a goccia,yes,,a,goccia,"È però forse più pratico procurarsi un buon prodotto, già confezionato informadi oliatore, con il quale passare,",goccia a goccia,", tutte le maglie della catena.",sg,succession/iteration/distributivity,modifier
goccia a goccia,yes,,a,goccia,come una ferita che lascia sgorgare il sangue,goccia a goccia,.,sg,succession/iteration/distributivity,modifier
goccia a goccia,yes,,a,goccia,"La sala, ordinata e illuminata, Amalia l'ha riempita di piante ben curate, a decine, coltura idroponica rivestita di una ghiaia sottile e brillante, irrigata con un impianto",goccia a goccia,che fornisce un miscuglio di fertilizzante e sali minerali.,sg,succession/iteration/distributivity,modifier
goccia a goccia,yes,,a,goccia,"Senza un ordine preciso, ma, come si dice,",goccia a goccia,", mi giungevano, nell'angosciosa notte successiva alla sua morte i ricordi di quelle impressioni della vita familiare che avevo colto allora.",sg,succession/iteration/distributivity,modifier
goccia a goccia,yes,,a,goccia,"È solo che mi piace sentirti parlare di quando il mare si poteva vedere, di quando ci si poteva entrare dentro; mi piace bere,",goccia a goccia,", quel distillato di saggezza che... --- Il distillato di tua mamma!",sg,succession/iteration/distributivity,modifier
goccia a goccia,yes,,a,goccia,"Meg Conti scoppiò a piangere, tanta era l'emozione, ma erano lacrime dolci che",goccia a goccia,le lavavano un'antica colpa e le ridavano il desiderio di vivere.,sg,succession/iteration/distributivity,modifier
goccia a goccia,yes,,a,goccia,"Si lavorava da sole a sole, alcuni incidendo gli alberi per togliergli la vita",goccia a goccia,", altri cuocendo il liquido raccolto per ispessirlo e farne grandi palle.",sg,succession/iteration/distributivity,modifier
goccia a goccia,yes,,a,goccia,Il generale si mise a distillare le sue amarezze,goccia a goccia,.,sg,succession/iteration/distributivity,modifier
goccia a goccia,no,filter_out,a,goccia,"o ... E tu , tu hai intenzione di consolare Clara che ha capito tutto questo ,  goccia a goccia , durante la sua notte rossa ... molto dopo_che Amar se n ' era andato . - Ce l",,,,,
goccia a goccia,no,filter_out,a,goccia,"enza , incominci con difficoltà e sovente si svolga con molta lentezza , anche  goccia a goccia . Certo , l ' ipertrofia prostatica è un ' affezione benigna - secondo la defin",,,,,
goccia a goccia,yes,,a,goccia,"Fra gli altri spettacoli in cartellone,""Un Cid""di Corneille, del francese Theatre du Fust, in programma il 25 e 26, originale riduzione per marionette di ghiaccio di Emilie Valentin, dove i personaggi che",goccia a goccia,"si alleggeriscono, si corrodono, si fondono in lacrime, fumano, sudano, soffrono, segno del lato effimero del teatro.",sg,succession/iteration/distributivity,modifier
gomito a gomito,yes,,a,gomito,E questo è un dono di cui abbiamo immensamente bisogno: in una società come la nostra dove c'è tanta solitudine e dove l'indifferenza crea barriere che sembrano insormontabili anche fra gente che vive,gomito a gomito,", tu sei il Maestro interiore che può produrre il miracolo dell'amore, e trasformare il deserto delle solitudini nel giardino di un incontro possibile con gli altri.",sg,juxtaposition/contact,modifier
gomito a gomito,idiosyncratic,,a,gomito,"Piuttosto che lavoro in rete qui siamo dinanzia lavoro per reciprocità immediata e continuata, nel tempo e nello spazio, ossia fondate sul face to face o sul",gomito a gomito,"o sull'autorità tecnica di leader naturali che non sono piramidali perché visibili, contestabili, interrelabili.",sg,idiosyncratic,nominal
gomito a gomito,yes,,a,gomito,Nell'agenzia il copywriter lavora,gomito a gomito,con un'altra figura che poi definiremo: l'art director.,sg,juxtaposition/contact,modifier
gomito a gomito,yes,,a,gomito,"L'indomani tornarono a gruppetti di tre, di quattro, per rendere la manovra più varia, per allungare l'operazione, per non farsi inghiottire in un solo boccone, soprattutto per temprare il coraggio di ognuno, meglio di quando si marcia al riparo del numero e",gomito a gomito,…,sg,juxtaposition/contact,modifier
gomito a gomito,yes,,a,gomito,"L'articolista, prendendo spunto da dati elaborati al computer (standing ovation!!) , filosofeggia che dove gli upper - upper class e i giovani bohemiens vivono",gomito a gomito,", la promiscuità sia garantita dallo scorrere più inquieto degli ormoni e dell'ambizione.",sg,juxtaposition/contact,modifier
gomito a gomito,yes,,a,gomito,A metà della scala si potrebbero porre invece quelle che mostrano artisti e scienziati lavorare,gomito a gomito,", producendo conoscenze o rappresentazioni reciprocamente utili, come accadeva per esempio agli incisori che si affiancarono ad anatomisti e astronomi da cui dipendono le due grandi rivoluzioni scientifiche della modernità.",sg,juxtaposition/contact,modifier
gomito a gomito,yes,,a,gomito,"All'alba di ieri, su quella carcassa arrivata dritta sulla spiaggia di Le Cannella una delle località di mare più belle di Isola Capo Rizzuto stavano",gomito a gomito,"317 persone, per lo più curdi, pakistani e afgani.",sg,juxtaposition/contact,modifier
gomito a gomito,yes,,a,gomito,"La storia del software libero inizia negli anni sessanta fra i tavoli verdini e il neon dei laboratori degli istituti universitari di Stanford e Berkeley: ingegno e fondi inversamente proporzionali, vita",gomito a gomito,", comune passione per la ricerca.",sg,juxtaposition/contact,modifier
gomito a gomito,yes,,a,gomito,"Noi ci auguriamo che tutti i comunisti, dappertutto nel mondo, lottino",gomito a gomito,e si oppongano ad ogni attacco di un paese imperialista contro qualsiasi paese del terzo mondo.,sg,juxtaposition/contact,modifier
gomito a gomito,yes,,a,gomito,Cosa crede che succeda quando uno della valle di Ossau lavora,gomito a gomito,con uno della valle del Gave?,sg,juxtaposition/contact,modifier
gomito a gomito,yes,,a,gomito,Era la prima volta che mi trovavo,gomito a gomito,"con qualcosa o qualcuno di nobile stirpe, la mia famiglia inclusa.",sg,juxtaposition/contact,modifier
gomito a gomito,yes,,a,gomito,"Ci hanno divisi per evitare problemi, perquanto era possibile, vistoche si camminava tutto il giorno spalla a spalla,",gomito a gomito,", a passi diversi, ma alla stessa velocità, e quando vivi una situazione di fatica e scomodità come quella, con poco cibo e poca acqua e nessun posto dove ripararsi e molto freddo, invece, molto, molto freddo, be', i battibecchi e le risse sono sempre dietro l'angolo, in agguato, e gli accoltellamenti anche, quindi è meglio tenere separate le etnie ostili.",sg,juxtaposition/contact,modifier
gomito a gomito,yes,,a,gomito,«Solo l'idea di lavorare,gomito a gomito,con un esponente di Cl pare gli sia andata di traverso» scrissero i giornali.,sg,juxtaposition/contact,modifier
gomito a gomito,yes,,a,gomito,"Ho iniziato a lavorare alla Brown nel 1965 ed è stato per me un grande piacere e una enorme gioia non soltanto insegnare a migliaia di studenti universitari e a qualche laureato, ma anche poter lavorare",gomito a gomito,con circa duecento di loro.,sg,juxtaposition/contact,modifier
gomito a gomito,yes,,a,gomito,"Per prima cosa ottenne un sostanzioso prestito grazieall'appoggio e alla fiducia di banchieri legati all'agente commerciale di suo padre, poi mandò i commandeurs ai canneti, a lavorare",gomito a gomito,"con gli stessi uomini che prima avevano martirizzato e li rimpiazzò con altri meno depravati, ridusse i castighi e assunse un veterinario, che trascorse due mesi a Saint - Lazare cercando di restituire un po 'di salute ai neri.",sg,juxtaposition/contact,modifier
gomito a gomito,yes,,a,gomito,"Alla Pisacane studiano 87 bambini stranieri su cento, e la percentuale è in crescita: bengalesi, cinesi, romeni, polacchi, colombiani, filippini, algerini, egiziani e italiani imparano",gomito a gomito,"«a leggere e scrivere in stampatello e corsivo», e «eseguono le addizioni con 3 numeri», giura un gruppo di genitori in un appello ad altri italiani a iscrivere i loro figli nonostante le continue polemiche.",sg,juxtaposition/contact,modifier
gomito a gomito,yes,,a,gomito,Queste cose non le ha mai dette neanche con me che siamo,gomito a gomito,da due anni e mezzo.,sg,juxtaposition/contact,modifier
gomito a gomito,yes,,a,gomito,"Allora un prete non poteva fare beneficenza alla maniera di Susanita, doveva stare",gomito a gomito,con i bisognosi.,sg,juxtaposition/contact,modifier
gomito a gomito,yes,,a,gomito,"Dal 7 al 10 maggio sono stato in Brasile,",gomito a gomito,"con 10 baristi, provenienti da tutto il mondo, selezionati per partecipare a Barista & Farmer, il talent show made in Italy pensato per permettere ai baristi di andare alle origini del prodotto con cui lavora tutti i giorni e di cui è appassionato: il caffè.",sg,juxtaposition/contact,modifier
gomito a gomito,yes,,a,gomito,"Aggiungi a questo che sei una persona fidata, e quindi anche le informazioni più riservate sono al sicuro; infine con te vado d'accordo, e non è detto che mi troverei tanto bene a lavorare",gomito a gomito,con qualcun altro.,sg,juxtaposition/contact,modifier
gomito a gomito,yes,,a,gomito,"Ecco cosa succede quando gli eurodeputati si mettono in testa di vincere la classifica della produttività a ogni costo di Alberto D'Argenzio 01 giugno 2015 [ I furbetti italiani dell'Europarlamento, tante presenze ma poca sostanza ] Ultima sessione plenaria di Strasburgo, pomeriggio del 19 o del 20 maggio, al bar dei deputati si trovano",gomito a gomito,"due veri e propri stacanovisti del Parlamento europeo, Nicola Caputo, Pd, e Mara Bizzotto, Lega Nord.",sg,juxtaposition/contact,modifier
gomito a gomito,yes,,a,gomito,"Sono impazzito per il mercato del pesce di Tokyo, colazione alle quattro di mattina, mangiando ""yakitori"", ""ramen"", sushi,",gomito a gomito,con uno che puzza di pesce perchè lì ci lavora.,sg,juxtaposition/contact,modifier
gomito a gomito,yes,,a,gomito,"Per non correre il rischio, s'era iscritto all'Accademia militare di Modena dove, disgrazia delle disgrazie, s'era trovato",gomito a gomito,"con Cavallo Pazzo che seguiva i medesimi corsi e... Desaix anzi Des Aix, Collinet, Augereau, battaglia di Marengo e di Preussisch - Eylau e di Wagram, Cicerone, Seneca, Ovidio.",sg,juxtaposition/contact,modifier
gomito a gomito,yes,,a,gomito,Preferirei vivere,gomito a gomito,"con una banda di Arancioni o di Teste Rasate, e magari litigarci tutti i giorni, piuttosto che fare un altro passo in quest'inferno.",sg,juxtaposition/contact,modifier
gomito a gomito,yes,,a,gomito,"Cosí si compí il tradimento, progettato e custodito findall'arrivo nella città dei folli,",gomito a gomito,"con loro, per oltre un anno.",sg,juxtaposition/contact,modifier
gomito a gomito,yes,,a,gomito,"I bambini, stretti",gomito a gomito,", rimasero con i fiori in mano, senza sapere dove posarli.",sg,juxtaposition/contact,modifier
gomito a gomito,yes,,a,gomito,"Neri di arrogante negritudine, neri vestiti di nero con occhiali neri e un'espressione provocatoria occupavano, nel passare, tutta la larghezza del marciapiede,",gomito a gomito,"con le loro donne, nere audaci che marciavano con i seni eretti guardando dritto davantia sé, ora non cedevano il passo ai bianchi, non guardavano a terra né abbassavano la voce.",sg,juxtaposition/contact,modifier
gomito a gomito,yes,,a,gomito,"Il fatto che si sentisse veramente realizzata vendendo gioielli per le strade e pensasse di passare il resto della sua esistenza come una vagabonda spingendo il suo carrettino e vivendo d'aria,",gomito a gomito,"con dementi e falliti, era una prova convincente della sua immaturità.",sg,juxtaposition/contact,modifier
gomito a gomito,yes,,a,gomito,"Naturalmente certi vecchi quartieri londinesi conservavano le antiche caratteristiche di grande eleganza e ricchezza, ma erano spesso",gomito a gomito,con gli slum più squallidi e più ripugnanti.,sg,juxtaposition/contact,modifier
gomito a gomito,yes,,a,gomito,Funzionari della polizia britannica in Francia e funzionari della polizia francese in Inghilterra lavorarono,gomito a gomito,"con investigatori privati assunti dalle banche, dalle ferrovie e dalla società di navigazione.",sg,juxtaposition/contact,modifier
gomito a gomito,yes,,a,gomito,"Siccome eravamo in ritardo ci inserimmo dove capitava, ma di solito era il primo della lunga fila di scolari stretti",gomito a gomito,", carichi di libri, di quaderni, di penne, che M. Seurel passava in rivista.",sg,juxtaposition/contact,modifier
gomito a gomito,yes,,a,gomito,"E se bisognava affrontarlo - bisognava necessariamente affrontarlo - era di certo meglio farlo in gruppo, in questo",gomito a gomito,"che ci saldava l'uno all'altro e che era, nell'imminenza del pericolo, come un ultimo rifugio.",sg,juxtaposition/contact,modifier
gomito a gomito,yes,,a,gomito,"Tuttavia, per quanto intimo fosse il nostro",gomito a gomito,"e stretta la vigilanza dei nostri maggiori, questa marcia silenziosa lontano dalle case al chiarore scolorato della luna, che succedeva alla gazzarra di poco prima, e ancora il luogo sacro verso cui ci stavamo dirigendo e infine e soprattutto la presenza di Konden Diara, non potevano non angosciarci.",sg,juxtaposition/contact,modifier
gomito a gomito,yes,,a,gomito,Ma probabilmente avvertivano qualcosa dell'angoscia che ci stringeva; non dovevano gradire più di noi l'unione di notte e silenzio; questo stretto,gomito a gomito,aveva lo scopo di rassicurare anche loro.,sg,juxtaposition/contact,modifier
gomito a gomito,yes,,a,gomito,Intorno al tavolo non c'erano abbastanza sedie per tutti e così Kenneth dovette stare,gomito a gomito,"con Shirley, cosa che invero pareva non dispiacergli affatto.",sg,juxtaposition/contact,modifier
gomito a gomito,yes,,a,gomito,"A Saint Louis, in realtà, non ero mai stata",gomito a gomito,"con i ricettatori, i ladri, e i truffatori.",sg,juxtaposition/contact,modifier
gomito a gomito,yes,,a,gomito,"Questa baraonda e questo carnevale durarono finoache il Pretore, una sera, al cinema, accesasi la luce, si trovò",gomito a gomito,con un individuo interrogato in carcere quella mattina.,sg,juxtaposition/contact,modifier
gomito a gomito,yes,,a,gomito,Nasce anche un modo di lavorare ` volante'; mi reco presso l'agenzia a collaborare,gomito a gomito,"con gli art director con cui, di volta in volta, sono in coppia.",sg,juxtaposition/contact,modifier
gomito a gomito,yes,,a,gomito,"Cominciai con quella battuta perché volevo sviluppare questo tema: come possiamo ignorare, o tagliare fuoridal dialogo interlocutori che di fatto ci forniscono i servizi quotidiani e con i quali viviamo",gomito a gomito,?,sg,juxtaposition/contact,modifier
gomito a gomito,yes,,a,gomito,Tanto meno dimenticherò voi con cui sono vissuto,gomito a gomito,"incontrandovi in chiesa, sul sagrato, in piazza, al mercato, o in casa vostra.",sg,juxtaposition/contact,modifier
gomito a gomito,yes,,a,gomito,Gli episodi di aggressività interspecifica osservati in Scozia sono dovuti probabilmente al fatto che i tursiopi e le focene si trovano,gomito a gomito,"in stretti canali di mare e i più grandi, i delfini, attaccano i più piccoli, che muoiono inseguitoalle ferite.",sg,juxtaposition/contact,modifier
gomito a gomito,yes,,a,gomito,"Come compagni ha ritrovato Davide, Alex, Federica, Maddalena, Valentina... bambine e bambini di terza, quarta e quinta, di nuovo",gomito a gomito,", tutti insieme.",sg,juxtaposition/contact,modifier
gomito a gomito,yes,,a,gomito,"L'iniziativa del capo del ""civil service"", che lavora",gomito a gomito,"con il primo ministro, ha provocato polemiche: non garba al conservatore John Major sentirsi sfrattato prima ancora del voto, nè piace a Tony Blair, probabile nuovo inquilino, che il risultato sia dato per scontato.",sg,juxtaposition/contact,modifier
gomito a gomito,yes,,a,gomito,"È la morale delle facili transazioni e dei facili adattamenti, per cui mentre ci si vergogna di stare",gomito a gomito,"con qualcuno che ha il certificato penale non troppo pulito, non si sente vergogna di stare a contatto, gomito a gomito, con qualcuno che ha il certificato politico infinitamente sporco per il suo passato.",sg,juxtaposition/contact,modifier
gomito a gomito,yes,,a,gomito,"È la morale delle facili transazioni e dei facili adattamenti, per cui mentre ci si vergogna di stare gomito a gomito con qualcuno che ha il certificato penale non troppo pulito, non si sente vergogna di stare a contatto,",gomito a gomito,", con qualcuno che ha il certificato politico infinitamente sporco per il suo passato.",sg,juxtaposition/contact,modifier
gomito a gomito,yes,,a,gomito,Ma i Carabinieri che lavorano,gomito a gomito,con gli ispettori del lavoro non bastano.,sg,juxtaposition/contact,modifier
gomito a gomito,yes,,a,gomito,"Eppure i libri, per distrarre la paura e dimenticare il pesante",gomito a gomito,"delle coabitazioni e dal contatto continuo con sconosciuti, sono un rimedio sovrannaturale!",sg,juxtaposition/contact,modifier
gomito a gomito,yes,,a,gomito,Dopo 8 km percorsi,gomito a gomito,", avvincente lo sprint tra Giovanni De Benedictis e lo stesso Shchennikov, rivincita della volata che 6 anni fa assegnò a Parigi l'oro iridato indoor della 5 km.",sg,juxtaposition/contact,modifier
Gomito a gomito,yes,,a,gomito,,gomito a gomito,", si vedono lavorare i volontari cattolici delle Misericordie e gli alpini, gli scouts e i vigili del fuoco, i volontari della Protezione civile e le forze di polizia.",sg,juxtaposition/contact,modifier
gomito a gomito,yes,,a,gomito,"L'unica cosa sopravvissuta, ma desolatamente annerita dal fumo, è la lunga serpentina di marmo in cui i viaggiatori si sedevano",gomito a gomito,"per consumare un rapido pasto prima di sperdersi nella regione dei laghi a Est di New York o nelle innumerevoli cittadine incastonate lungo il fiume Hudson, dove la frenesia della città che non dorme mai, nonostante la breve distanza, sembra una cosa remota e incredibile.",sg,juxtaposition/contact,modifier
gomito a gomito,yes,,a,gomito,"Alla commemorazione sono arrivati da Roma i ministri Napolitano, Flick e Bersani, il presidente dell'Antimafia Del Turco e il leader del ccd Casini, il capo della polizia Masone e il suo vice De Gennaro, che per anni lavorò",gomito a gomito,"con Falcone: dal'92 non era mai venuto a queste commemorazioni ma oggi, proprio quando c'è chi lancia l'allarme della retorica, ha voluto essere qui.",sg,juxtaposition/contact,modifier
gomito a gomito,yes,,a,gomito,"Tutti quelli della cricca di Mobutu che non sono riusciti a scappare si sono intanto infilati all'Intercontinental, dove stanno",gomito a gomito,"con i giornalisti (chi altri mai potrebbe venire a Kinshasa, in questi giorn?).",sg,juxtaposition/contact,modifier
gomito a gomito,yes,,a,gomito,"Così a parità di lavoro svolto, collaboriamo",gomito a gomito,con colleghi che usufruiscono di notevoli incentivi economici.,sg,juxtaposition/contact,modifier
gomito a gomito,yes,,a,gomito,"Rebecchini è seduto al tavolo dei promotori dell'intesa An - Elefantino,",gomito a gomito,con l'anti - proibizionista Taradash.,sg,juxtaposition/contact,modifier
gomito a gomito,yes,,a,gomito,"Silvana era come il vaso di coccio tra i vasi di ferro: il debole che deve contrastare i più forti o, senza difesa, si trova",gomito a gomito,coi prepotenti.,sg,juxtaposition/contact,modifier
gomito a gomito,yes,,a,gomito,Quel vivere,gomito a gomito,era una situazione umanamente paradossale.,sg,juxtaposition/contact,modifier
gomito a gomito,yes,,a,gomito,Non esistono infine uffici: gli impiegati e le segretarie operano,gomito a gomito,"in ""open space"".",sg,juxtaposition/contact,modifier
gomito a gomito,yes,,a,gomito,"Lavorare durante l'estate, tra giostre, montagne russe e castelli incantati,",gomito a gomito,"con i personaggi delle fiabe e con migliaia di turisti, grandi e piccini.",sg,juxtaposition/contact,modifier
gomito a gomito,yes,,a,gomito,"Per esempio che, a forza di stare",gomito a gomito,"con gli stranieri, tanti milanesi hanno deciso di reagire nella maniera giusta: informandosi.",sg,juxtaposition/contact,modifier
