Settimana a settimana,yes,,a,settimana,«,Settimana a settimana,"» , ha spiegato Del Fante : «È l 'era del digitale».",sg,succession/iteration/distributivity,modifier
Sfida a sfida,no,filter_out,a,sfida,,Sfida a sfida,,sg,succession/iteration/distributivity,modifier
sillaba a sillaba,no,verbal,a,sillaba,"... Sei tu , Signore , l ' anima delle parole , il filo d ' oro che congiunge  sillaba a sillaba , il fuoco che spira dalle nostre bocche quando diciamo il vero "" . Sempre la S",,,,,
sinistra a sinistra,no,other,a,sinistra,". , che però restava scettico , mentre la C.G.I.L. non lo era . Si formava una  sinistra a sinistra della sinistra . Drizzavamo le orecchie ascoltando Trentin e Foa e Garavini e C",,,,,
sinistra a sinistra,no,other,a,sinistra,il salario a ogni contratto più decente . Se mancò in Italia fino_al 1968 una  sinistra a sinistra del P.C.I. era per la convinzione che il P.C.I. aveva messo saldamente un rampi,,,,,
sinistra a sinistra,no,other,a,sinistra,"o referendum - che potevano essere un primo banco di prova per l ' unità della  sinistra a sinistra dal Pd - sono stati in realtà motivi di discussione , e di divisione : « Siamo",,,,,
smentita a smentita,no,verbal,a,smentita,"tribuita "" . Ma il giornalista ha confermato la bontà della notizia , sommando  smentita a smentita . Grauso ha anche ridimensionato una sua dichiarazione che pareva attribuire un",,,,,
soddisfazioni a soddisfazioni,no,verbal,a,soddisfazioni,"tore del regime , la carriera politico - professionale non fece che aggiungere  soddisfazioni a soddisfazioni : poco dopo ottenne la cattedra di psichiatria presso l ' Istituto centrale sup",,,,,
sofferenza a sofferenza,no,verbal,a,sofferenza,"pettegolezzi , alcune voci giravano da anni . Â Mi rendo conto di aggiungere  sofferenza a sofferenza . Le parole gli erano uscite di bocca piú false che mai . Eppure , la mancanza",,,,,
sofferenza a sofferenza,no,verbal,a,sofferenza,"da inconcepibile - commenta Andrea Amato , segretario del Cub - , che aggiunge  sofferenza a sofferenza "" . Secondo il sindacato , i lavori di risistemazione del Malattie Infettive ,",,,,,
soia a soia,no,other,a,soia,"ra , Troy ha preso una decisione radicale : di piantare ciascun acro della sua  soia a soia GM Roundup Ready ( autorizzata e pagandola ) . 9 . Punti chiave Per_quanto rigu",,,,,
sorpresa a sorpresa,no,verbal,a,sorpresa,"ce lei . Era passata automaticamente dal "" lei "" al "" tu "" , e questo aggiunse  sorpresa a sorpresa , spiazzando completamente Stefano , che cercò di chiudere alla svelta la sua",,,,,
sorso a sorso,yes,,a,sorso,Me lo gusto,sorso a sorso,.,sg,juxtaposition/contact,modifier
spalla a spalla,yes,,a,spalla,Tutti gli oranti si trovano ad agire,spalla a spalla,"nel modo più disciplinato, indipendentemente da ogni considerazione di tipo mondano.",sg,juxtaposition/contact,modifier
spalla a spalla,yes,,a,spalla,"E ci si sente intrappolati,",spalla a spalla,", i due uomini le esaminavano.",sg,juxtaposition/contact,modifier
spalla a spalla,yes,,a,spalla,"Chinati,",spalla a spalla,", i due uomini le esaminavano.",sg,juxtaposition/contact,modifier
spalla a spalla,yes,,a,spalla,"Marco andò all'unico tavolino libero, sul fondo, e quando finalmente si sedette con la schiena al muro si ritrovò in pratica",spalla a spalla,"con due avventori, entrambi assorti nella lettura del giornale e quindi apparentemente disinteressati a lui.",sg,juxtaposition/contact,modifier
spalla a spalla,yes,,a,spalla,"La privacy era minima, i detenuti erano praticamente",spalla a spalla,e Ron non rispettava gli spazi.,sg,juxtaposition/contact,modifier
spalla a spalla,yes,,a,spalla,Tu e tuo fratello indietreggiate,spalla a spalla,.,sg,juxtaposition/contact,modifier
spalla a spalla,yes,,a,spalla,"Ti sei svegliato arso dalla sete, e anche ora che il sole è basso, e gli ultimi passi della giornata vi guidano",spalla a spalla,"lungo il pontile proteso sulle acque ferme del Trasimeno, nei vostri crani farciti di foglie ristagna il residuo incombusto della gioia.",sg,juxtaposition/contact,modifier
spalla a spalla,yes,,a,spalla,Avete coperto,spalla a spalla,"gli ultimi metri, le donne sorridevano, e il frinire degli insetti sembrava qualcosa di assordante, finché non era risuonata attraverso il cortile una voce baritonale e carica d'irritazione.",sg,juxtaposition/contact,modifier
spalla a spalla,yes,,a,spalla,"Le teste giganti dei candidati sorridono a gara, e Galerio dice che sembrano mostri, mostri che sorgono",spalla a spalla,dalle viscere della terra.,sg,juxtaposition/contact,modifier
spalla a spalla,yes,,a,spalla,"Qualunque cosa accadrà, siete nel palmo della stessa mano, e anziché tenere Dina fuori dai tuoi progetti migliori, dovreste camminare",spalla a spalla,finché il Cielo ve ne darà la possibilità.,sg,juxtaposition/contact,modifier
spalla a spalla,yes,,a,spalla,Si profila dunque una volata,spalla a spalla,che probabilmente si concluderà con il ballottaggio del 23 ottobre prossimo.,sg,juxtaposition/contact,modifier
spalla a spalla,yes,,a,spalla,«Torno ad un lavoro in trincea e state certi - ha concluso - che tutti troverete in me un punto di riferimento: lavoreremo,spalla a spalla,", città per città, posto di lavoro per posto di lavoro per far vincere il nostro progetto».",sg,juxtaposition/contact,modifier
spalla a spalla,yes,,a,spalla,"Ci hanno divisi per evitare problemi, per quanto era possibile, visto che si camminava tutto il giorno",spalla a spalla,", gomito a gomito, a passi diversi, ma alla stessa velocità, e quando vivi una situazione di fatica e scomodità come quella, con poco cibo e poca acqua e nessun posto dove ripararsi e molto freddo, invece, molto, molto freddo, be', i battibecchi e le risse sono sempre dietro l'angolo, in agguato, e gli accoltellamenti anche, quindi è meglio tenere separate le etnie ostili.",sg,juxtaposition/contact,modifier
spalla a spalla,yes,,a,spalla,"La maggior parte dei dirigenti è lì, a lavorare",spalla a spalla,con l'imprenditore.,sg,juxtaposition/contact,modifier
spalla a spalla,yes,,a,spalla,Entrambi in passato hanno lavorato,spalla a spalla,come aggiunti a Palermo.,sg,juxtaposition/contact,modifier
spalla a spalla,yes,,a,spalla,"Arrivo di corsa e trovo Gabriel e Nick,",spalla a spalla,", che aspettano.",sg,juxtaposition/contact,modifier
spalla a spalla,yes,,a,spalla,"Sono addestrati per il campo di battaglia, per stare",spalla a spalla,"dietro gli scudi, con la lancia protesa davanti a sé.",sg,juxtaposition/contact,modifier
spalla a spalla,yes,,a,spalla,"Lorenzo invece si schiera dall'altra parte della barricata,",spalla a spalla,"con Pipetta, il giovane comunista di San Donato di Calenzano; eppure nel momento in cui glielo scrive, in una lettera che, diciamolo a voce alta, è un gioiello della letteratura italiana, annuncia il suo tradimento: ""Ma il giorno che avremo sfondata insieme la cancellata di qualche parco, installata insieme la casa dei poveri nella reggia del ricco, ricordatene Pipetta, non ti fidar di me, quel giorno io ti tradirò"".",sg,juxtaposition/contact,modifier
spalla a spalla,yes,,a,spalla,Era per vendicarsi di una condanna ingiusta che aveva combattuto,spalla a spalla,"con quegli stessi Uberti che a Campaldino militavano tra le file nemiche o quella alleanza, che soltanto pochi mesi prima gli sarebbe sembrata contro natura, aveva una più profonda e nobile giustificazione?",sg,juxtaposition/contact,modifier
spalla a spalla,yes,,a,spalla,"Ribadiamo che il governo di Madrid ha annunciato che il compito della missione congiunta italo - spagnola sarà quello di formare un'intera brigata dell'esercito nazionale iracheno, e non delle forze curde, operando """,spalla a spalla,""".",sg,juxtaposition/contact,modifier
Spalla a spalla,yes,,a,spalla,,Spalla a spalla,", in doppia fila, la prima in ginocchio, l'altra in piedi, cominciarono a sparare senza sosta colpendo con micidiale precisione ma i Blemmi sembravano avere un'energia e una vitalità inesauribili.",sg,juxtaposition/contact,modifier
spalla a spalla,yes,,a,spalla,Questi pensieri mi agitavano mentre,spalla a spalla,con i miei compagni muti attendevo i colpi di fischietto degli ufficiali per superare il parapetto e inoltrarmi in quell'orribile scabro e tormentato deserto innanzia me.,sg,juxtaposition/contact,modifier
spalla a spalla,yes,,a,spalla,"Avendo infatti faticato e sudato come una bestia e avendo anche bevuto nelle soste diversi tipi di bevande leggere tra cui birra tiepida, vino bianco frizzantino, un chinotto, un Campari e, per finire, una miscela di birra e gazzosa denominata ""shandy"", ma non avendo orinato più di tanto per via della notevole sudorazione, ed essendo stato per otto ore a stretto contatto con la mondezza e anche",spalla a spalla,"con i suoi compagni sudati come lui, Tizio aveva assorbito un po 'di quella nuova puzza mista e naturalmente aveva ceduto loro una quota della sua; ed essendo come tutti gli altri, cioè essendo uscito dallo stesso buco, come argomentava il nonno Rico quando parlava di politica e d'ingiustizie sociali, facendo immancabilmente incazzare la nonna, alla fine avvertiva di avere un odore personale più marcato del solito, un'essenza nuova composta di mondezza fresca, di broda e del sudore dei suoi compagni, che peraltro già aveva imparato a distinguere.",sg,juxtaposition/contact,modifier
spalla a spalla,yes,,a,spalla,"L'uomo al centro era attorniato da due che lo tenevano avviluppato a loro sottobraccio, gli altri affiancati procedevano",spalla a spalla,come a formare un muro invalicabile a protezione del personaggio.,sg,juxtaposition/contact,modifier
spalla a spalla,yes,,a,spalla,"Solo cosí ho potuto fare quello che ho fatto, vivendo",spalla a spalla,"con il teologo di corte, giorno dopo giorno, sul sentiero che portava alla rovina.",sg,juxtaposition/contact,modifier
spalla a spalla,yes,,a,spalla,"Compiuta la spettacolare manovra lanciarono di nuovo al galoppo i loro animali,",spalla a spalla,", testa a testa, lasciandosi dietro una densa nuvola di polvere, e si arrestarono in brevissimo spazio davantial principe.",sg,juxtaposition/contact,modifier
spalla a spalla,yes,,a,spalla,"Mancava ormai poco e gli ateniesi continuavano a scendere al passo,",spalla a spalla,", scudo contro scudo, con le lance protese in avanti, spinti dal suono continuo e acuto dei flauti, dal rullo ossessivo dei tamburi, urlando, a ogni passo: Alalalai!",sg,juxtaposition/contact,modifier
spalla a spalla,yes,,a,spalla,"Si trovavano ora di fronte la falange dei pezeteri e quella dei mercenari di Memnone, che continuavano ad avanzare compatti,",spalla a spalla,", protetti dai grandi scudi convessi, i volti coperti dalle celate corinzie.",sg,juxtaposition/contact,modifier
spalla a spalla,yes,,a,spalla,"Ma i veterani di Memnone si fermarono sul crinale della breccia,",spalla a spalla,", in schieramento serrato, ad attendere una mossa dell'avversario.",sg,juxtaposition/contact,modifier
spalla a spalla,yes,,a,spalla,"Alessandro diede il segnale e tutti i destrieri si lanciarono al galoppo sfrenato,",spalla a spalla,", testa a testa nella pianura deserta: sembravano furie infernali partorite dall'Ade.",sg,juxtaposition/contact,modifier
Spalla a spalla,yes,,a,spalla,,Spalla a spalla,Hammerskin e Blood and Honour: per la prima volta due sigle di estrema destra uniscono le proprie forze.,sg,juxtaposition/contact,modifier
spalla a spalla,yes,,a,spalla,"Ora sono vicini,",spalla a spalla,", e fronteggiano il piagnisteo dell'albero.",sg,juxtaposition/contact,modifier
spalla a spalla,yes,,a,spalla,"Poi, furono costretti a fermarsi quando un contingente delle truppe di Sua Maestà Tenebrosa, in fila",spalla a spalla,", arrivò a passo di marcia lungo la strada.",sg,juxtaposition/contact,modifier
spalla a spalla,yes,,a,spalla,Sono tutti seduti,spalla a spalla,", completamente esposti a questo angolo, dalle pelvi in su.",sg,juxtaposition/contact,modifier
spalla a spalla,yes,,a,spalla,"Ora è ancora più diverso, perché tutto quello che non t'uccide ti rafforza, ed io sono diventato più forte di superman e l'uomo ragno messi",spalla a spalla,", a forza di calci tengo botta alla grande ed ora sì che sono pronto per far vedere al mondo chi sono e quante ne ho vissute in questo mio tempo, non mi sono mica solo ingrassato e ubriacato io, ho fatto step, vari stage, ho comperato una macchina col leasing in una chat, e mi hanno messo due by-pass mentre facevo del cyber sex, ma stavolta l'amore mi ha trovato.",sg,juxtaposition/contact,modifier
spalla a spalla,yes,,a,spalla,"Se deciderete di passare un po 'di tempo davantiallo schermo """,spalla a spalla,""" con qualche bambino, scoprirete che i bambini, anche molto piccoli, hanno un rapporto naturale con il computer: un legame affettivo, che li porta immediatamente a un contatto diretto, proprio come con il fluire della lingua materna.",sg,juxtaposition/contact,modifier
spalla a spalla,yes,,a,spalla,"Tutto sommato, l'Italia, partita tardi, ha recuperato, piazzandosi dietro la Germania e",spalla a spalla,con gli inglesi.,sg,juxtaposition/contact,modifier
spalla a spalla,yes,,a,spalla,"Fuori c'erano i fiorai profumati e i mendicanti storpi,",spalla a spalla,: e solo a guardarli s'allargava in me la confusione della vita.,sg,juxtaposition/contact,modifier
spalla a spalla,yes,,a,spalla,"Al congresso di Torino, abbiamo visto",spalla a spalla,"le seguenti sotto - parrocchie dei Ds: ulivisti puri, miglioristi superstiti, veltroniani, dalemiani, pontieri, sinistra tenera, sinistra dura, laburisti, cristianosociali, sinistra repubblicana, comunisti unitari e, dulcis in fundo, riformatori per l'Europa.",sg,juxtaposition/contact,modifier
spalla a spalla,yes,,a,spalla,Lega e Polo,spalla a spalla,nella corsa per il comune con una lieve prevalenza del Carroccio di Aldo Fumagalli sul centro - destra di Riccardo Broggini: il primo attestato fra il 36 e il 32 per cento contro il 35 e 31 del rivale.,sg,juxtaposition/contact,modifier
spalla a spalla,yes,,a,spalla,"Torino, Rifondazione apre a Castellani L'ex ministro Costa corre per il Polo,",spalla a spalla,con il sindaco.,sg,juxtaposition/contact,modifier
spalla a spalla,yes,,a,spalla,I sondaggi ufficiali (finchè si potevano rendere pubblici) e quelli ufficiosi li danno,spalla a spalla,", con una quota tra il 25 e il 30 % dei consensi al primo turno.",sg,juxtaposition/contact,modifier
spalla a spalla,yes,,a,spalla,"In Europa sarebbe al secondo o terzo posto appena alle spalle dei tedeschi, lontano da Metro ma",spalla a spalla,con Rewe ed Edeka.,sg,juxtaposition/contact,modifier
spalla a spalla,yes,,a,spalla,"Se per decenni si sono vicendevolmente ignorate, Italia e Albania sono oggi",spalla a spalla,.,sg,juxtaposition/contact,modifier
spalla a spalla,yes,,a,spalla,"Proprio mentre i piloti dei jet americani e inglesi,",spalla a spalla,", scaricano ogni giorno bombe su Saddam e schivano il fuoco della sua contraerea, in una marziale conferma della storica ""relazione speciale"" tra i due paesi, l'ambasciatore americano a Londra è stato convocato al ministero del commercio per ricevere una ferma e ufficiale protesta del governo di Tony Blair.",sg,juxtaposition/contact,modifier
spalla a spalla,yes,,a,spalla,"Kurt rimase un attimo in silenzio, ripensò alle ragazze degli inizi, orde di ragazze che saltellavano, tremavano, strillavano, ragazze con magliette con su scritto SIG.RA SKY, ragazze a cui per qualche motivo non dispiaceva accalcarsi",spalla a spalla,"con tutte quelle altre Sig.re Sky mentre assaltavano la hall di qualche albergo o straripavano dalle transenne ai margini della strada, ragazze che protendevano braccia stecchite versodi lui, ragazze che sfoggiavano ombretti blu scintillanti nella speranza che lo sbrilluccichio dei loro occhi attirasse i suoi, ragazze in iperventilazione, ragazze che si riempivano di sfoghi, ragazze che si sparavano siringhette di adrenalina per non soffocare, ragazze che reggevano altre ragazze svenute, ragazze che mollavano quelle ragazze a terra per poi travolgerle.",sg,juxtaposition/contact,modifier
spalla a spalla,yes,,a,spalla,"Con due o tre passi si è avvicinata a Vera, è",spalla a spalla,"con lei, si è piazzata davantiall'obiettivo con un'espressione severa, compunta.",sg,juxtaposition/contact,modifier
spalla a spalla,yes,,a,spalla,"Un viaggio fra gli ""spazi del consumo"", rappresenta un viaggio in una comunità dove la diversità , almeno in quel luogo , può essere dimenticata, lì si può stare",spalla a spalla,con gente simile.,sg,juxtaposition/contact,modifier
spalla a spalla,yes,,a,spalla,Se l'Inter sarà ancora,spalla a spalla,"significherà che è cresciuta davvero, alla faccia del lamentoso bluffare di Conte.",sg,juxtaposition/contact,modifier
spalla a spalla,yes,,a,spalla,E al fatto che i due abbiano lavorato,spalla a spalla,"per cinque anni alla V Commissione di Bilancio (il primo come funzionario e segretario, il secondo come presidente), prima che Cabras - figlio di Paolo, a lungo parlamentare della Dc - diventasse nel 2014 capo di gabinetto di Fabrizio Saccomanni al ministero dell'Economia.",sg,juxtaposition/contact,modifier
spalla a spalla,yes,,a,spalla,Il mio virologo di riferimento Tom Cruise può avere esagerato nel minacciare di licenziamento i membri della troupe di «Mission: Impossible 7» che chiacchieravano,spalla a spalla,senza indossare la mascherina.,sg,juxtaposition/contact,modifier
spalle a spalle,yes,,a,spalle,Ma almeno gli diede soddisfazione e distrasse i Ra'zac abbastanza a lungo da permettergli di correre da Roran e mettersi,spalle a spalle,col cugino.,sg,juxtaposition/contact,modifier
spalle a spalle,yes,,a,spalle,Ancora,spalle a spalle,"col cugino, Eragon avvertì i contraccolpi trasmessi dalla schiena di Roran alla sua, mentre i Ra'zac sferravano attacchi in rapida successione.",sg,juxtaposition/contact,modifier
splendore a splendore,no,verbal,a,splendore,rcheologica . Ma queste fantasie schliemanniane non fanno altro che aggiungere  splendore a splendore . Epidauro Prima_di lasciare l ' Argolide ci attende il santuario di Asclepio d,,,,,
Teletrasporto a Teletrasporto,no,filter_out,a,teletrasporto,! ! Colleghiamoci subito con Vespasianus ed il suo plastico alla trasmissione  Teletrasporto a Teletrasporto ! ! Whou ! pittoresco ! mooolto pittorescoo ! ! ! Stanno crollando tutti i rude,,,,,
Tell a Tell,no,filter_out,a,tell,", disse Tell . ""Vattene."" "" Pronto a conoscere la verità , intendo "" , precisò  Tell a Tell e il Tell fermo sulla soglia del box vide polvere bianca intorno_alle narici de",,,,,
tempia a tempia,yes,,a,tempia,"Gegia e Silvio non avevano incarichi particolari, se non un caldo incoraggiamento a darsi senza indugio alla lettura di romanzi ovviamente cavallereschi, e a dirla tutta l'idea di quei due fianco a fianco,",tempia a tempia,", fiato a fiato e magari in mezzo un bel libro galeotto non mi entusiasmava.",sg,juxtaposition/contact,modifier
tempo a tempo,no,filter_out,a,tempo,"degli occhi , "" La bellezza ! Â , grido , e spudoratamente in lacrime , "" Il  tempo a tempo ! Il tempo nel suo tempo ! La vita ! Â , tanto so che il rullo dei bidoni che",,,,,
tensione a tensione,no,verbal,a,tensione,"e ti potrebbe montare l ' ansia , però se prosegui così , purtroppo , aggiungi  tensione a tensione , ansia , sua ansia . è uno sforzo molto impegnativo , ma è l ' unica cosa da f",,,,,
teorie a teorie,no,verbal,a,teorie,"ta , ora tocca al Polo . "" Si tratta di sostituire nomi a nomi , miti a miti ,  teorie a teorie . Un lavoro di rifondazione delle filosofie pubbliche che vale per tutti , ma c",,,,,
termine a termine,idiosyncratic,,a,termine,"Ma in definitiva si può dire che la selva degli alberi corrisponde alle colonne della Tabula Generalis, anche se non si riescono a individuare sempre corrispondenze",termine a termine,.,sg,idiosyncratic,modifier
termine a termine,idiosyncratic,,a,termine,La medicina delle epidemie si oppone,termine a termine,"ad una medicina delle classi, come la percezione collettiva d'un fenomeno globale, ma unico e mai ripetuto, può opporsi alla percezione individuale di ciò che un'essenza può far apparire costantemente d'essa stessa e della sua identità nella molteplicità dei fenomeni.",sg,idiosyncratic,modifier
termine a termine,idiosyncratic,,a,termine,"uesta ambiguità ha pesato sul metodo clinico, che ha tuttavia seguito una china concettuale esattamente opposta all'evoluzione di Condillac: rovesciamento",termine a termine,del punto d'origine e del punto di compimento.,sg,idiosyncratic,modifier
termine a termine,idiosyncratic,,a,termine,"La nostra analisi può ormai contare sulle precedenti, da cui ricaviamo due indicazioni di metodo: la prima è che sorvoleremo su aspetti già osservati; la seconda è il suggerimento di appaiare la serie dei tratti musicali a quella dei significati - funzioni cerimoniale - retorici non",termine a termine,", ma come continui, e ciò inquanto i rispettivi tratti singoli delle due serie, se considerati come noi faremo in modo un po' sommario, non risultano precisamente coestensivi",sg,idiosyncratic,modifier
terra a terra,no,filter_out,a,terra,"del [ "" rapporto sbilanciato "" ] [ 17 ] , bensì con un avvertimento molto più  terra a terra : attenzione , potrebbe essere un ' arma a doppio taglio per voi inglesi ... ch",,,,,
terra a terra,no,filter_out,a,terra,"be meglio , la fredda Therese , a investire nel mondo terreno , a seminare nel  terra a terra . Quando un proiettile aveva fatto in un cervello il lavoro di un cucchiaino ne",,,,,
testa a testa,idiosyncratic,,a,testa,È stato uno straordinario,testa a testa,", una lotta tra il meglio del meglio, una corsa lungo un mese: ma alla fine avete deciso.",sg,idiosyncratic,nominal
testa a testa,idiosyncratic,,a,testa,"Per concludere con le categorie stradali (o Street Legal), la A5 ha visto l'inconsueto scontro",testa a testa,fra Stefano Bennassi (Bologna) con la sua veloce 205 GTI 1.9 e Stefano Fioresi (Modena) con una Porsche 911 S 2.2 che non necessita certo di presentazioni.,sg,idiosyncratic,modifier
testa a testa,idiosyncratic,,a,testa,"D'altronde, la ID Software ha preferito prendere con decisione la strada del multiplayer, che in Quake 3 è suddiviso in quattro modalità: Tourney (un torneo a eliminazione basato su scontri",testa a testa,") e le più ""classiche"" Deathmatch, Team Deathmatch e Capture The Flag.",sg,idiosyncratic,modifier
testa a testa,idiosyncratic,,a,testa,"test """,testa a testa,""".",sg,idiosyncratic,nominal
testa a testa,idiosyncratic,,a,testa,LO STATO in cui il generale Clark è,testa a testa,con il senatore Kerry: l'Oklahoma.,sg,idiosyncratic,nominal
testa a testa,idiosyncratic,,a,testa,Un bel,testa a testa,anche per il terzo gradino del podio sul quale è salita l'Audi A4 ascapitodella Peugeot 307.,sg,idiosyncratic,nominal
testa a testa,idiosyncratic,,a,testa,Il mercato domestico sarà una lotta,testa a testa,tra Sony e Nintendo.,sg,idiosyncratic,modifier
testa a testa,idiosyncratic,,a,testa,I rispettivi campioni si battono,testa a testa,in un torneo al meglio dei tre round.,sg,idiosyncratic,modifier
testa a testa,idiosyncratic,,a,testa,Il,testa a testa,- come sostenuto da legali americani nei mesi scorsi - potrebbe avere infatti una rilevante appendice nelle aule della Corte di Prima Istanza con sede in Lussemburgo e formata da 15 giudici provenienti da 15 Stati membri dell'Unione.,sg,idiosyncratic,nominal
testa a testa,idiosyncratic,,a,testa,Avvincente,testa a testa,per l'elezione del presidente regionale della Federnuoto (73 società votanti su 130 aventi diritto).,sg,idiosyncratic,nominal
testa a testa,idiosyncratic,,a,testa,L'emozionante,testa a testa,"tra ""Gigi""e""Beppe"", che in molti avevano pronosticato prima del verdetto delle urne, non ci sarà.",sg,idiosyncratic,nominal
testa a testa,idiosyncratic,,a,testa,Un,testa a testa,"all'ultima preferenza, nella città che ha appena dato all'Ulivo dieci parlamentari su dodici.",sg,idiosyncratic,nominal
testa a testa,idiosyncratic,,a,testa,"A Carmagnola è stata una partita al cardiopalma, un",testa a testa,fino all'ultimo voto.,sg,idiosyncratic,nominal
testa a testa,idiosyncratic,,a,testa,"La soluzione, quindi, richiede di creare o sostenere riviste che possano competere",testa a testa,con le grandi e costose riviste dei grandi editori commerciali.,sg,idiosyncratic,modifier
testa a testa,yes,,a,testa,"Lei, liberandosi, mi accarezzò la guancia; eravamo appoggiati di fianco al finestrino e,",testa a testa,", con la fronte appoggiata al vetro vedevamo correre veloci le nostre due ombre vicine, proiettate sulla campagna.",sg,juxtaposition/contact,modifier
testa a testa,idiosyncratic,,a,testa,Come mai i sondaggi indicavano un,testa a testa,?,sg,idiosyncratic,nominal
testa a testa,idiosyncratic,,a,testa,Sarà,testa a testa,tra il «sì» e il «no» al referendum sulla Costituzione europea il 29 maggio in Francia.,sg,idiosyncratic,nominal
testa a testa,idiosyncratic,,a,testa,A complicare le cose il,testa a testa,"Moratti - Ferrante («Per cui non si poteva rischiare la minima svista») e la stanchezza (scrutatore anonimo a conteggio ultimato: «Alla fine, ci si incrociavano gli occhi»).",sg,idiosyncratic,nominal
testa a testa,idiosyncratic,,a,testa,"Secondo le ultime indiscrezioni, il",testa a testa,"per la quota messa in vendita dal gruppo senese è ormai una questione franco - olandese: un rush finale tra il gruppo Aegon, sede all'Aia, e il concorrente Axa, quartier generale a Parigi.",sg,idiosyncratic,nominal
testa a testa,idiosyncratic,,a,testa,I denti del pettine erano tenuti da due cavalli che si fronteggiavano,testa a testa,.,sg,idiosyncratic,modifier
testa a testa,idiosyncratic,,a,testa,"Ancora a favore della Juve un altro episodio del '98, nel tormentato campionato del",testa a testa,con l'Inter.,sg,idiosyncratic,nominal
