NPN;construction;preposition;noun;context_pre;costr;context_post;number_of_noun;Type;other_cxn;meaning;syntactic_function
bit a bit;yes;a;bit;Esegue l 'operazione di OR;bit a bit;tra i due operandio specificati, ponendo il risultato nel secondo.;sg;_;_;succession/iteration/distributivity;modifier
bit a bit;yes;a;bit;È compito di quest'ultimo trasmettere,;bit a bit;, l'informazione sul cavo e quindi al destinatario.;sg;_;_;succession/iteration/distributivity;modifier
braccio a braccio;yes;a;braccio;Primo edificio per la musica progettato dallo studio di Michel Rojkind, è il frutto di un processo progettuale sviluppato;braccio a braccio;con la direzione dell'Orchestra: le scelte riguardanti il tipo di sala, il numero di sedute e le destinazioni funzionali degli ambienti sono dunque condivise e volute dai successivi inquilini dello spazio.;sg;_;_;juxtaposition/contact;modifier
brano a brano;yes;a;brano;"""E siccome era stato portato lì davanti con tutti i suoi paramenti sacerdotali, iniziò un rito in cui";brano a brano;i paramenti gli venivano levati sinoa che rimase in quella vesticciola che a Firenze chiamano cioppa.;sg;_;_;succession/iteration/distributivity;modifier
brano a brano;yes;a;brano;Ma non primadi aver beccato Nauplio finoa levargli la pelle, a scuoiarlo,;brano a brano;.;sg;_;_;succession/iteration/distributivity;modifier
brano a brano;yes;a;brano;È sensibile ai tentativi dei poeti di rischiarare;brano a brano;l'ancora vasta oscurità delle cose non dette.;sg;_;_;succession/iteration/distributivity;modifier
campo a campo;yes;a;campo;E così, goccia a goccia, o meglio,;campo a campo;e casa a casa, in duemila anni la Chiesa ha potuto accumulare un patrimonio immenso, che nel passato era amministrato dal cosiddetto Obolo di San Pietro, e oggi lo è invece dal Pio Istituto per le Opere di Religione (IOR).;sg;_;_;succession/iteration/distributivity;modifier
corpo a corpo;yes;a;corpo;"Temi di attualità: la paura del domani, il Duemila è alle porte; il fascino del messaggio predicatorio; la lotta";corpo a corpo;tra ragione e cuore.;sg;_;_;juxtaposition/contact;modifier
corpo a corpo;yes;a;corpo;Mai prima quei guerrieri avevano affrontato;corpo a corpo;le legioni e non pareva loro vero di sfogare la rabbia a lungo compressa su quei reparti in disfatta, in preda al panico e alla confusione.;sg;_;_;juxtaposition/contact;modifier
corpo a corpo;yes;a;corpo;Scoperto difronteal proprio nemico, faccia a faccia,;corpo a corpo;, il nostro scrittore si apprestava a scrivere un'altra pagina del suo romanzo, quello della vita.;sg;_;_;juxtaposition/contact;modifier
corpo a corpo;yes;a;corpo;I caduti statunitensi erano già più di centomila, vittime in ugual misura del gelido inverno coreano e della maestria dell'esercito cinese nel combattimento;corpo a corpo;e nelle incursioni notturne.;sg;_;_;juxtaposition/contact;modifier
corpo a corpo;yes;a;corpo;Per contro la loro forze e il loro fisico non sono assolutamente adatti nello scontro;corpo a corpo;.;sg;_;_;juxtaposition/contact;modifier
corpo a corpo;yes;a;corpo;James Buck aveva fatto parte delle SAS, le forze aeree speciali britanniche, e, tra le altre cose, era un esperto di combattimenti;corpo a corpo;e di armi bianche.;sg;_;_;juxtaposition/contact;modifier
corpo a corpo;yes;a;corpo;Tauro cercò di fermarlo: per qualche istante la sua rocciosa complessione, il suo coraggio, l'abilità nel duello e l'esperienza di mille combattimenti;corpo a corpo;parvero mettere in difficoltà il guerriero germanico.;sg;_;_;juxtaposition/contact;modifier
corpo a corpo;yes;a;corpo;Nell'economia del risultato a pesare è anche il comparto visivo perché, alla routine degli scontri;corpo a corpo;", Watts ci riserva sorprese quando si tratta di mettere in scena il potere illusionistico di Mysterio in una serie di sequenze da far girare la testa allo spettatore, per il gioco di specchi in cui la realtà fa a gara a smentire se stessa manco ci trovassimo nella sequenza finale de ""La signora di Shangai"" di Orson Welles.";sg;_;_;juxtaposition/contact;modifier
corpo a corpo;yes;a;corpo;Non gli restava che il combattimento;corpo a corpo;.;sg;_;_;juxtaposition/contact;modifier
corpo a corpo;yes;a;corpo;Il killer - ballerino e le cubiste - prede erano impegnati in una danza;corpo a corpo;molto coinvolgente.;sg;_;_;juxtaposition/contact;modifier
corpo a corpo;yes;a;corpo;Nel frattempo, i macedoni rinchiusi nella cittadella fecero una sortita e presero alle spalle i guerrieri avversari che si battevano;corpo a corpo;, nelle vie strette e tortuose, davanti alle loro stesse case.;sg;_;_;juxtaposition/contact;modifier
corpo a corpo;yes;a;corpo;I colpi sono stati sparati durante la lotta,;corpo a corpo;.;sg;_;_;juxtaposition/contact;modifier
corpo a corpo;yes;a;corpo;Caratteristica utile a chi combatte;corpo a corpo;con l'avversario.;sg;_;_;juxtaposition/contact;modifier
corpo a corpo;yes;a;corpo;Non era il momento adatto a considerazioni tattiche, la colluttazione era diventata un furioso combattimento;corpo a corpo;.;sg;_;_;juxtaposition/contact;modifier
corpo a corpo;yes;a;corpo;"Dodici fra loro, originari di Lebbeke, si erano rifugiati nella fattoria di Ottavio Vernulst; essi furono legati";corpo a corpo;e condotti dietro alla fattoria, dove vennero massacrati.;sg;_;_;juxtaposition/contact;modifier
corpo a corpo;yes;a;corpo;Elias insegnava ai popolani come schierarsi in falange, puntare le picche, affrontare un uomo;corpo a corpo;.;sg;_;_;juxtaposition/contact;modifier
corpo a corpo;yes;a;corpo;In questa situazione i giornalisti portati al seguito delle truppe per assistere a un rapido trionfo, sono diventati scomodi testimoni di una campagna difficile e lunga, dove i combattimenti;corpo a corpo;nelle periferie delle città si verificano con una frequenza sempre più ravvicinata.;sg;_;_;juxtaposition/contact;modifier
corpo a corpo;yes;a;corpo;Inoltre l'uso giudizioso della massa corporea può rappresentare in certe situazioni un vantaggio supplementare non indifferente, per esempio negli incontri rapidi;corpo a corpo;, come nella lotta greco - romana, nel catch, nel sumo.;sg;_;_;juxtaposition/contact;modifier
corpo a corpo;yes;a;corpo;Pare abbia ucciso di sua mano un ribelle della tribù dei cadusi in un duello;corpo a corpo;.;sg;_;_;juxtaposition/contact;modifier
corpo a corpo;yes;a;corpo;I due fratelli si scontrarono accanitamente;corpo a corpo;e morirono entrambi.;sg;_;_;juxtaposition/contact;modifier
corpo a corpo;yes;a;corpo;Come dice Manuel Estiarte, il più forte pallanuotista di tutti i tempi: «È vero, bisogna calcolare che le probabilità che Messi esca sconfitto da un impatto;corpo a corpo;sono elevate, come elevato è il rischio che venga totalmente travolto dai difensori.;sg;_;_;juxtaposition/contact;modifier
corpo a corpo;yes;a;corpo;Essi o lo impegnavano in violenti combattimenti;corpo a corpo;, oppure rimanevano ritti immobili e silenziosi in qualche angolo della casa.;sg;_;_;juxtaposition/contact;modifier
corpo a corpo;yes;a;corpo;Non possedeva più la pistola e la spranga che aveva trovato si sarebbe rivelata utile solo in uno scontro;corpo a corpo;.;sg;_;_;juxtaposition/contact;modifier
corpo a corpo;yes;a;corpo;Ma anche questa volta per occupare la Città Santa devono combattere;corpo a corpo;con i palestinesi per annientare la resistenza araba.;sg;_;_;juxtaposition/contact;modifier
corpo a corpo;yes;a;corpo;La guerriglia urbana, la battaglia;corpo a corpo;nelle strade della capitale è proprio quello che al Pentagono vogliono evitare.;sg;_;_;juxtaposition/contact;modifier
corpo a corpo;yes;a;corpo;Qualche scettico si domanderà come mai il comando americano mandi un preziosissimo marconista navajo a combattere;corpo a corpo;contro il nemico, con il rischio che lo catturino.;sg;_;_;juxtaposition/contact;modifier
corpo a corpo;yes;a;corpo;Saphira era meglio equipaggiata dei Lethrblaka per il combattimento;corpo a corpo;, grazie alle squame - più dure e resistenti della loro pellaccia grigia - e ai denti - di gran lunga più letali del loro becco in uno scontro ravvicinato - ma in quella situazione, con il basso soffitto della caverna che le dava scarsa libertà di manovra per saltare o volare, aveva non poche difficoltà a tenere testa a due creature che l'attaccavano contemporaneamente.;sg;_;_;juxtaposition/contact;modifier
corpo a corpo;yes;a;corpo;Nella tradizione cristiana, durante i giorni di Pasqua si legge un versetto in latino che dice in modo mirabile che la vita e la morte combattono;corpo a corpo;.;sg;_;_;juxtaposition/contact;modifier
corpo a corpo;yes;a;corpo;La caccia a cavallo o a piedi, la lotta;corpo a corpo;, i combattimenti dei galli erano quanto deliziava la gente e tutte queste attività si concludevano con solenni bevute.;sg;_;_;juxtaposition/contact;modifier
corpo a corpo;yes;a;corpo;"Sto rollando verso di te, balena, tu che tutto distruggi e nulla conquisti; fino all'ultimo lotto con te";corpo a corpo;", e dal cuore dell'inferno ti pugnalo; in nome dell'odio ti sputo addosso l'estremo respiro.";sg;_;_;juxtaposition/contact;modifier
fibra a fibra;yes;a;fibra;La sua voce si impoveriva man mano che andava avanti, come se le sue parole si portassero via;fibra a fibra;il tessuto del suo timbro.;sg;_;_;succession/iteration/distributivity;modifier
fibra a fibra;yes;a;fibra;Le sembrava che Francesco fosse improvvisamente penetrabile alla sua conoscenza e che avrebbe potuto percorrerlo;fibra a fibra;, come si fa con uno strumento musicale le cui note appartengano a uno spartito certo.;sg;_;_;succession/iteration/distributivity;modifier
goccia a goccia;yes;a;goccia;La fine portava la festa, il maiale si svuotava;goccia a goccia;, in chiesa il prete issava il Cristo infreddolito sulla croce e dava l'ostia ai credenti, le strade si riempivano, sulla terra bianca la chiazza rossa si stendeva con la lentezza delle cose passate, e il mio sguardo non trovava rifugio.;sg;_;_;succession/iteration/distributivity;modifier
goccia a goccia;yes;a;goccia;Aggiungete, sempre mescolando, l'olio di vaselina;goccia a goccia;.;sg;_;_;succession/iteration/distributivity;modifier
goccia a goccia;yes;a;goccia;Cominciò a scavare con la punta della spada finché vide affiorare lentamente,;goccia a goccia;, dell'acqua.;sg;_;_;succession/iteration/distributivity;modifier
goccia a goccia;yes;a;goccia;Ai due lati del viale, dentro gabbie di ferro avvolte di tela di sacco per ripararle dalle tempeste di sabbia, alcune piante di poinciana nutrite dall'irrigazione;goccia a goccia;e ancora incredule sul senso della propria esistenza.;sg;_;_;succession/iteration/distributivity;modifier
goccia a goccia;yes;a;goccia;I suoi occhi sfavillano ora di un desiderio mai visto di vita, di piacere, ora di tristezza profonda, vissuta;goccia a goccia;, una desolazione tanto esausta da sconfinare nell'ironia.;sg;_;_;succession/iteration/distributivity;modifier
goccia a goccia;yes;a;goccia;come una ferita che lascia sgorgare il sangue;goccia a goccia;.;sg;_;_;succession/iteration/distributivity;modifier
goccia a goccia;yes;a;goccia;"Se, invece, la persona a cui volete regalarlo è come Coco Chanel, che diceva sempreche il profumo va messo ""dove si vuole essere baciate"", preferite un flacone: lo userà";goccia a goccia;.;sg;_;_;succession/iteration/distributivity;modifier
goccia a goccia;yes;a;goccia;Con il tempo la situazione peggiora: lo svuotamento avviene a più riprese,;goccia a goccia;.;sg;_;_;succession/iteration/distributivity;modifier
goccia a goccia;yes;a;goccia;Il libro inizia con queste parole: «La speranza non scende mai;goccia a goccia;.;sg;_;_;succession/iteration/distributivity;modifier
goccia a goccia;yes;a;goccia;Nel braccio di Bruno è conficcato l'ago e lungo il flessibile scorre;goccia a goccia;la medicina che per il momento regala al suo volto un'aria distesa e l'ombra di un sorriso.;sg;_;_;succession/iteration/distributivity;modifier
goccia a goccia;yes;a;goccia;La medicina nutriva Malaussene con parsimonia,;goccia a goccia;.;sg;_;_;succession/iteration/distributivity;modifier
goccia a goccia;yes;a;goccia;Si lavorava da sole a sole, alcuni incidendo gli alberi per togliergli la vita;goccia a goccia;, altri cuocendo il liquido raccolto per ispessirlo e farne grandi palle.;sg;_;_;succession/iteration/distributivity;modifier
goccia a goccia;yes;a;goccia;La sala, ordinata e illuminata, Amalia l'ha riempita di piante ben curate, a decine, coltura idroponica rivestita di una ghiaia sottile e brillante, irrigata con un impianto;goccia a goccia;che fornisce un miscuglio di fertilizzante e sali minerali.;sg;_;_;succession/iteration/distributivity;modifier
goccia a goccia;yes;a;goccia;Erano passati vent'anni e la solitudine,;goccia a goccia;, era filtrata in lei.;sg;_;_;succession/iteration/distributivity;modifier
goccia a goccia;yes;a;goccia;Sarebbe meglio parlare di irrigazione;goccia a goccia;, quasi indipendente dai meriti dei ricercatori e dal valore del progetto presentato.;sg;_;_;succession/iteration/distributivity;modifier
goccia a goccia;yes;a;goccia;Meg Conti scoppiò a piangere, tanta era l'emozione, ma erano lacrime dolci che;goccia a goccia;le lavavano un'antica colpa e le ridavano il desiderio di vivere.;sg;_;_;succession/iteration/distributivity;modifier
goccia a goccia;yes;a;goccia;Secondo, meglio usare sistemi di irrigazione;goccia a goccia;, che non quelli a getto nebulizzato inmodoche vi sia un minor consumo d'acqua.;sg;_;_;succession/iteration/distributivity;modifier
goccia a goccia;yes;a;goccia;Era solito compiacersi nel centellinare;goccia a goccia;l'esposizione delle proprie opinioni per tenere in sospeso gli ascoltatori.;sg;_;_;succession/iteration/distributivity;modifier
goccia a goccia;yes;a;goccia;Grazie a una saracinesca regolata dall'interno dell'edificio, l'acqua della vasca sgorga;goccia a goccia;dalle fauci muschiate di un ippopotamo in pietra.;sg;_;_;succession/iteration/distributivity;modifier
goccia a goccia;yes;a;goccia;Nei giorni a venire e nelle notti illuni e nelle notti quando una luna fulgidissima splendeva sopra la terra, il vecchio avrebbe continuato a parlargli, a parlargli,;goccia a goccia;, sassolino su sassolino, petalo dopo petalo.;sg;_;_;succession/iteration/distributivity;modifier
goccia a goccia;yes;a;goccia;Il generale si mise a distillare le sue amarezze;goccia a goccia;.;sg;_;_;succession/iteration/distributivity;modifier
goccia a goccia;yes;a;goccia;È però forse più pratico procurarsi un buon prodotto, già confezionato in forma di oliatore, con il quale passare,;goccia a goccia;, tutte le maglie della catena.;sg;_;_;succession/iteration/distributivity;modifier
goccia a goccia;yes;a;goccia;Quando l'acqua e gli oli hanno la stessa temperatura (tra i 30 - 35 ° C) aggiungete l'acqua;goccia a goccia;emulsionando con il frullino a immersione.;sg;_;_;succession/iteration/distributivity;modifier
goccia a goccia;yes;a;goccia;L'acqua, dal canto suo, non scorreva più fluente, ma;goccia a goccia;, Una folla di gocce che se ne andavano mentre Mahdokht pativa.;sg;_;_;succession/iteration/distributivity;modifier
goccia a goccia;yes;a;goccia;Senza un ordine preciso, ma, come si dice,;goccia a goccia;, mi giungevano, nell'angosciosa notte successiva alla sua morte i ricordi di quelle impressioni della vita familiare che avevo colto allora.;sg;_;_;succession/iteration/distributivity;modifier
goccia a goccia;yes;a;goccia;Spesso il sangue si mette a sgorgare;goccia a goccia;o in modo continuo, iniziando improvvisamente senza una ragione apparente: talvolta i genitori notano solo l'orecchio o il cuscino sporco di sangue.;sg;_;_;succession/iteration/distributivity;modifier
goccia a goccia;yes;a;goccia;Circuiti cognitivi che si tenta di riattivare passo dopo passo,;goccia a goccia;, perché «lo sviluppo cognitivo può essere come una botte, che riempi molto velocemente, oppure come una damigiana che ha il collo stretto e va riempita lentamente.;sg;_;_;succession/iteration/distributivity;modifier
goccia a goccia;yes;a;goccia;«Be', non spetta a noi ammirare questo centellinare;goccia a goccia;,» rispose Theresa.;sg;_;_;succession/iteration/distributivity;modifier
goccia a goccia;yes;a;goccia;"È solo che mi piace sentirti parlare di quando il mare si poteva vedere, di quando ci si poteva entrare dentro; mi piace bere,";goccia a goccia;, quel distillato di saggezza che... --- Il distillato di tua mamma!;sg;_;_;succession/iteration/distributivity;modifier
goccia a goccia;yes;a;goccia;Io adesso ve la faccio bere a viso aperto come il fiele,;goccia a goccia;, fino all'ultima goccia.;sg;_;_;succession/iteration/distributivity;modifier
grado a grado;yes;a;grado;[La scienza politica] chiarisce come scenda la rivelazione da presso Dio,;grado a grado;, fino al primo governante.;sg;_;_;succession/iteration/distributivity;modifier
grado a grado;yes;a;grado;Dormo fondo e poi vengo;grado a grado;in superficie, in una specie di ascensione inevitabile da galleggiante di sughero che sale dal fondo melmoso attraverso l'opacità che diventa via via più trasparente fino a proprio sotto il piano argentato tremolante della luce violenta.;sg;_;_;succession/iteration/distributivity;modifier
grado a grado;yes;a;grado;Catturato dalle sempre più sottili distinzioni e puntualizzazioni che lo conducono;grado a grado;"verso le profondità del microcosmo, il lettore ha la sorpresa di trovarsi alla fine in un terreno che ha le dimensioni dell'universo e un colore umano inconfondibile: E fortuna d'essermi senza volere trovato quasi solo usufruttuario d'un territorio senza confini, in un mondo spezzettato ormai in tante proprietà private, dove non è più palmo che non sia chiuso da cancelli cinto da filo spinato, ringhioso di cani da guardia; desideroso io solo di qualcosa che nessuno mi disputa, nessuno anzi vede (e se chi passa chiede, alla spiegazione sorride incredulo o commiserante).";sg;_;_;succession/iteration/distributivity;modifier
grado a grado;yes;a;grado;Lotto, come molti di noi, con difficoltà economiche, che spero di superare,;grado a grado;.;sg;_;_;succession/iteration/distributivity;modifier
guancia a guancia;yes;a;guancia;E ha una canzone del cuore, la canzone che ascoltava da govane quando ballava;guancia a guancia;con Filippo di Grecia, suo futuro sposo, ora Filippo d'Edimburgo e Principe consorte.;sg;_;_;juxtaposition/contact;modifier
guancia a guancia;yes;a;guancia;Riuscì ancora a vedere i due uomini, vicini al suo viso, appoggiati l'uno all'altro;guancia a guancia;, che osservavano la fine.;sg;_;_;juxtaposition/contact;modifier
guancia a guancia;yes;a;guancia;Nel bridge, esattamente a 1 e 42 secondi primi, la canzone diventa un recitativo, cito letteralmente: Su, vieni più vicino, lasciati andare, è bello stare;guancia a guancia;, no?;sg;_;_;juxtaposition/contact;modifier
guancia a guancia;yes;a;guancia;"Azzurro Caltagirone è a un tavolo ""cheek to cheek"",";guancia a guancia;con il pretone.;sg;_;_;juxtaposition/contact;modifier
guancia a guancia;yes;a;guancia;Certo che me ne aveva raccontate di cose, e ricordo benissimo che, durante quei quattro giorni si può dire;guancia a guancia;, a ogni nuova confidenza mi si raddoppiavano i brividi lungo la schiena: perché si fidava tanto, perché si era fidata incondizionatamente di me?;sg;_;_;juxtaposition/contact;modifier
guancia a guancia;yes;a;guancia;I loro visi si trovarono incollati l'uno all'altro,;guancia a guancia;.;sg;_;_;juxtaposition/contact;modifier
guancia a guancia;yes;a;guancia;Me lo accosto al viso, quasi lo tocco con gli occhi, mentre Zot arriva e stiamo;guancia a guancia;a guardarlo, così vicini che i nostri respiri diventerebbero uno solo, se ci riuscisse respirare.;sg;_;_;juxtaposition/contact;modifier
guancia a guancia;yes;a;guancia;La tromba è guerresca, angelica, apocalittica, vittoriosa, suona la carica, il sassofono fa ballare bulletti di periferia coi capelli unti di brillantina,;guancia a guancia;con ragazze sudate.;sg;_;_;juxtaposition/contact;modifier
guancia a guancia;yes;a;guancia;Alfio per il resto della serata rimase mortificato a guardarla ballare i valzer lenti;guancia a guancia;con Piastrein.;sg;_;_;juxtaposition/contact;modifier
guancia a guancia;yes;a;guancia;Primo piano dei due volti - quello scuro di mio figlio e quello chiarissimo di Hans - che,;guancia a guancia;, ridono felici.;sg;_;_;juxtaposition/contact;modifier
guancia a guancia;yes;a;guancia;Pereira restò solo al tavolino, sostiene, ordinò un'altra limonata e se la bevve a piccoli sorsi guardando i ragazzi che ballavano lentamente;guancia a guancia;.;sg;_;_;juxtaposition/contact;modifier
guancia a guancia;yes;a;guancia;Avrei voluto poter cucinare al mio lui una costata, sapendo che gli piaceva cotta al punto giusto, poter danzare con lui;guancia a guancia;.;sg;_;_;juxtaposition/contact;modifier
guancia a guancia;yes;a;guancia;Gli indicò gli aiutanti che si tenevano abbracciati,;guancia a guancia;", con un sorriso che poteva essere umile o ironico; gli indicò tutti costoro come per presentargli un seguito impostogli da particolari circostanze, aspettandosi però - in ciò vi era una certa confidenza, ed era questa a cui egli mirava - che Barnabas distinguesse sempre bene fra lui e loro.";sg;_;_;juxtaposition/contact;modifier
guancia a guancia;yes;a;guancia;Vide ancora come i signori vicino al suo viso, accostati;guancia a guancia;, osservavano l'esito.;sg;_;_;juxtaposition/contact;modifier
guancia a guancia;yes;a;guancia;Stemmo a lungo insieme, così,;guancia a guancia;.;sg;_;_;juxtaposition/contact;modifier
guancia a guancia;yes;a;guancia;Lei e Nina sono ancora sotto la coperta, sedute vicine, quasi;guancia a guancia;, ma non si guardano.;sg;_;_;juxtaposition/contact;modifier
guancia a guancia;yes;a;guancia;Pensavo alla sua infanzia e alla sua adolescenza, ai divani ridotti a brandelli e ai materassi masticati, alle fantastiche passeggiate lungo l'Intracoastal e ai balli;guancia a guancia;con lo stereo a tutto volume.;sg;_;_;juxtaposition/contact;modifier
palmo a palmo;yes;a;palmo;Allora il prete si avvicinò a me e disse che lui quelle montagne le conosceva;palmo a palmo;perché da piccolo con suo padre e sua sorella arrivavano fin lassù.;sg;_;_;succession/iteration/distributivity;modifier
palmo a palmo;yes;a;palmo;I tre si sparpagliarono e cominciarono a frugare;palmo a palmo;il terreno.;sg;_;_;succession/iteration/distributivity;modifier
palmo a palmo;yes;a;palmo;Gli sarebbero occorsi mesi per rilevarne il tracciato e per esplorarle;palmo a palmo;.;sg;_;_;succession/iteration/distributivity;modifier
palmo a palmo;yes;a;palmo;Snocciolata questa sfilza di assurdità Bengal'skij riunì le mani;palmo a palmo;facendo segni di saluto verso la fessura del sipario, che di conseguenza, con un rumore sordo, si aprì.;sg;_;_;succession/iteration/distributivity;modifier
palmo a palmo;yes;a;palmo;E invece la sua macchina, accompagnata dai rintocchi della campana di Montecitorio, è arrivata puntualissima sul piazzale della Camera, scrutato;palmo a palmo;dai tiratori scelti appostati sui tetti.;sg;_;_;succession/iteration/distributivity;modifier
palmo a palmo;yes;a;palmo;Ufficio che è stato controllato;palmo a palmo;.;sg;_;_;succession/iteration/distributivity;modifier
palmo a palmo;yes;a;palmo;Per lui si tratterà di procedere progredendo senza progredire, di lottare;palmo a palmo;contro qualunque forma di dipendenza dal terapeuta, di non dovergli niente, soprattutto di non essergli debitore di un miglioramento del quale preferisce fare a meno piuttosto che pagarlo a quel prezzo.;sg;_;_;succession/iteration/distributivity;modifier
palmo a palmo;yes;a;palmo;Il geometra De Palo e il geometra Ranieri vengono sguinzagliati per battere;palmo a palmo;la città sulle loro station wagon.;sg;_;_;succession/iteration/distributivity;modifier
palmo a palmo;yes;a;palmo;Moltitudine di prostitute e colori sgargianti, stuoli d'artisti e piaceri del cibo, mio Ludovico, servono a celare spie e sbirri, giudici e inquisitori che;palmo a palmo;scrutano incessanti.;sg;_;_;succession/iteration/distributivity;modifier
palmo a palmo;yes;a;palmo;Ovviamente non possiamo battere quella parte del Gargano;palmo a palmo;.;sg;_;_;succession/iteration/distributivity;modifier
palmo a palmo;yes;a;palmo;Da quella sera, fino a ieri pomeriggio, carabinieri, polizia e vigili del fuoco hanno continuato a cercare madre e figlio, battendo;palmo a palmo;la zona lungo il fiume e scandagliando le acque del Livenza, che a tratti ha correnti molto forti e profondità dai cinque ai nove metri.;sg;_;_;succession/iteration/distributivity;modifier
palmo a palmo;yes;a;palmo;"Dice l'iscrizione ""che esse congiungono le mani";palmo a palmo;""", allegorica immagine che descrive il passaggio da un segno zodiacale a quello precedente, passaggio che avviene nell'equinozio di primavera ogni 2160 anni.";sg;_;_;succession/iteration/distributivity;modifier
palmo a palmo;yes;a;palmo;Cominciando a conoscerti, che a Venezia ha aperto la Settimana della Critica e, ora, soggiorna sui nostri schermi conquistandosi;palmo a palmo;il favore del pubblico più attento.;sg;_;_;succession/iteration/distributivity;modifier
palmo a palmo;yes;a;palmo;Gli promisi nuove fiere o, in alternativa, un viaggio in cui avremmo battuto;palmo a palmo;il Wisconsin.;sg;_;_;succession/iteration/distributivity;modifier
palmo a palmo;yes;a;palmo;Tutte le auto vengono osservate;palmo a palmo;, illuminate da fortissime luci bianche.;sg;_;_;succession/iteration/distributivity;modifier
palmo a palmo;yes;a;palmo;A piedi ci rechiamo quindi alla scoperta della parte più antica dell'abitato, nella quale si trova il poderoso castello aragonese, che esploriamo;palmo a palmo;, fra interessanti ambienti di epoca medioevale e vasti panorami sui paesaggi circostanti.;sg;_;_;succession/iteration/distributivity;modifier
