NPN;construction;preposition;noun;context_pre;costr;context_post;number_of_noun;Type;other_cxn;meaning;syntactic_function
anima ad anima;yes;a;anima;Ecco, devono essere nati così questi ultimi due romanzi di famiglia, seguiti da lunghe ore al computer, uno accanto all'altro, gomito a gomito,;anima ad anima;, ogni tanto un sospiro, una lunga occhiata, qualche sorriso di tenerezza perché i due si adorano e si cercano come solo due innamoratini sanno fare, al di là delle loro abbondanti sessanta primavere. ;sg;_;_;juxtaposition/contact;modifier
balcone a balcone;yes;a;balcone;La comunità di gatti che mi ospita sta nell'appartamento in cui abitiamo, che confina,;balcone a balcone;, con un altro appartamento nel quale viveva fino a poco tempo fa una gatta vecchia e sola.;sg;_;_;juxtaposition/contact;modifier
balcone a balcone;yes;a;balcone;Così si sente superiore nel cortile, a esempio, sul cav. Bizzini, suo dirimpettaio,;balcone a balcone;, che vive con la figlia, il genero e i ragazzi un maschio e una femmina e potrebbe essere privilegiato, ma se sapesse scrollarsi di dosso il rischio di venir ficcato in un ospizio per anziani.;sg;_;_;juxtaposition/contact;modifier
fibra a fibra;yes;a;fibra;La sua voce si impoveriva man mano che andava avanti, come se le sue parole si portassero via;fibra a fibra;il tessuto del suo timbro.;sg;_;_;succession/iteration/distributivity;modifier
fibra a fibra;yes;a;fibra;Le sembrava che Francesco fosse improvvisamente penetrabile alla sua conoscenza e che avrebbe potuto percorrerlo;fibra a fibra;, come si fa con uno strumento musicale le cui note appartengano a uno spartito certo.;sg;_;_;succession/iteration/distributivity;modifier
fotogramma a fotogramma;yes;a;fotogramma;Una mitologia personale, insomma, costruita;fotogramma a fotogramma;"ritagliandomi di netto ciò che è necessario per un Olimpo fatto in casa: un pugno di tragedie sofoclee, uomini ed eroi, martiri casuali, omicidi senza fonte e senza fine; oppure: confondendo l'universo condiviso con gli album personali: eccola una foto di mio padre tale e quale a Satta Flores in C'eravamo tanto amati.";sg;_;_;succession/iteration/distributivity;modifier
fronte a fronte;yes;a;fronte;E l'ordine, sia ben chiaro, non è l'assenza di disordine, ma la confusione regolamentata, su cui vigilano;fronte a fronte;re e vescovi.;sg;_;_;juxtaposition/contact;modifier
fronte a fronte;yes;a;fronte;Hussein, alla minaccia di trovarsi;fronte a fronte;con Amintore e soprattutto con Maria Pia, ha pianto lungamente e voleva far caricare sul jumbo anche un paio di emiri kuwaitiani con tutte le mogli e figli.;sg;_;_;juxtaposition/contact;modifier
fronte a fronte;yes;a;fronte;Una volta tolte di mezzo le operaie, le due regine si trovano;fronte a fronte;.;sg;_;_;juxtaposition/contact;modifier
fronte a fronte;yes;a;fronte;Ed ecco allora ai due estremi del salone,;fronte a fronte;, la Trasfigurazione di Tiziano (dove l'autore discioglie in un vortice drammatico e accalorato - con il bianco fantasmatico del Cristo che si riflette sull'emergenza dei capelli bianchi e sul rubizzo colore rubensiano della testa di Pietro sul bruno sfatto e informe del corpo - il ritmo rigoroso a mandorla della parte alta del modello raffaellesco) e l'Ultima Cena di Tintoretto.;sg;_;_;juxtaposition/contact;modifier
fronte a fronte;yes;a;fronte;Proprio nel novembre del '95, in occasione di una tavola rotonda nell'aula Nervi sull'etica in presenza di duemila medici cattolici, Giovanni Paolo II ed Andreotti si trovarono;fronte a fronte;e si scambiarono una lunga stretta di mano in un clima di ovazione.;sg;_;_;juxtaposition/contact;modifier
goccia a goccia;yes;a;goccia;La fine portava la festa, il maiale si svuotava;goccia a goccia;, in chiesa il prete issava il Cristo infreddolito sulla croce e dava l'ostia ai credenti, le strade si riempivano, sulla terra bianca la chiazza rossa si stendeva con la lentezza delle cose passate, e il mio sguardo non trovava rifugio.;sg;_;_;succession/iteration/distributivity;modifier
goccia a goccia;yes;a;goccia;Aggiungete, sempre mescolando, l'olio di vaselina;goccia a goccia;.;sg;_;_;succession/iteration/distributivity;modifier
goccia a goccia;yes;a;goccia;Cominciò a scavare con la punta della spada finché vide affiorare lentamente,;goccia a goccia;, dell'acqua.;sg;_;_;succession/iteration/distributivity;modifier
goccia a goccia;yes;a;goccia;Ai due lati del viale, dentro gabbie di ferro avvolte di tela di sacco per ripararle dalle tempeste di sabbia, alcune piante di poinciana nutrite dall'irrigazione;goccia a goccia;e ancora incredule sul senso della propria esistenza.;sg;_;_;succession/iteration/distributivity;modifier
goccia a goccia;yes;a;goccia;I suoi occhi sfavillano ora di un desiderio mai visto di vita, di piacere, ora di tristezza profonda, vissuta;goccia a goccia;, una desolazione tanto esausta da sconfinare nell'ironia.;sg;_;_;succession/iteration/distributivity;modifier
goccia a goccia;yes;a;goccia;come una ferita che lascia sgorgare il sangue;goccia a goccia;.;sg;_;_;succession/iteration/distributivity;modifier
goccia a goccia;yes;a;goccia;"Se, invece, la persona a cui volete regalarlo è come Coco Chanel, che diceva sempreche il profumo va messo ""dove si vuole essere baciate"", preferite un flacone: lo userà";goccia a goccia;.;sg;_;_;succession/iteration/distributivity;modifier
goccia a goccia;yes;a;goccia;Con il tempo la situazione peggiora: lo svuotamento avviene a più riprese,;goccia a goccia;.;sg;_;_;succession/iteration/distributivity;modifier
goccia a goccia;yes;a;goccia;Il libro inizia con queste parole: «La speranza non scende mai;goccia a goccia;.;sg;_;_;succession/iteration/distributivity;modifier
goccia a goccia;yes;a;goccia;Nel braccio di Bruno è conficcato l'ago e lungo il flessibile scorre;goccia a goccia;la medicina che per il momento regala al suo volto un'aria distesa e l'ombra di un sorriso.;sg;_;_;succession/iteration/distributivity;modifier
goccia a goccia;yes;a;goccia;La medicina nutriva Malaussene con parsimonia,;goccia a goccia;.;sg;_;_;succession/iteration/distributivity;modifier
goccia a goccia;yes;a;goccia;Si lavorava da sole a sole, alcuni incidendo gli alberi per togliergli la vita;goccia a goccia;, altri cuocendo il liquido raccolto per ispessirlo e farne grandi palle.;sg;_;_;succession/iteration/distributivity;modifier
goccia a goccia;yes;a;goccia;La sala, ordinata e illuminata, Amalia l'ha riempita di piante ben curate, a decine, coltura idroponica rivestita di una ghiaia sottile e brillante, irrigata con un impianto;goccia a goccia;che fornisce un miscuglio di fertilizzante e sali minerali.;sg;_;_;succession/iteration/distributivity;modifier
goccia a goccia;yes;a;goccia;Erano passati vent'anni e la solitudine,;goccia a goccia;, era filtrata in lei.;sg;_;_;succession/iteration/distributivity;modifier
goccia a goccia;yes;a;goccia;Sarebbe meglio parlare di irrigazione;goccia a goccia;, quasi indipendente dai meriti dei ricercatori e dal valore del progetto presentato.;sg;_;_;succession/iteration/distributivity;modifier
goccia a goccia;yes;a;goccia;Meg Conti scoppiò a piangere, tanta era l'emozione, ma erano lacrime dolci che;goccia a goccia;le lavavano un'antica colpa e le ridavano il desiderio di vivere.;sg;_;_;succession/iteration/distributivity;modifier
goccia a goccia;yes;a;goccia;Secondo, meglio usare sistemi di irrigazione;goccia a goccia;, che non quelli a getto nebulizzato inmodoche vi sia un minor consumo d'acqua.;sg;_;_;succession/iteration/distributivity;modifier
goccia a goccia;yes;a;goccia;Era solito compiacersi nel centellinare;goccia a goccia;l'esposizione delle proprie opinioni per tenere in sospeso gli ascoltatori.;sg;_;_;succession/iteration/distributivity;modifier
goccia a goccia;yes;a;goccia;Grazie a una saracinesca regolata dall'interno dell'edificio, l'acqua della vasca sgorga;goccia a goccia;dalle fauci muschiate di un ippopotamo in pietra.;sg;_;_;succession/iteration/distributivity;modifier
goccia a goccia;yes;a;goccia;Nei giorni a venire e nelle notti illuni e nelle notti quando una luna fulgidissima splendeva sopra la terra, il vecchio avrebbe continuato a parlargli, a parlargli,;goccia a goccia;, sassolino su sassolino, petalo dopo petalo.;sg;_;_;succession/iteration/distributivity;modifier
goccia a goccia;yes;a;goccia;Il generale si mise a distillare le sue amarezze;goccia a goccia;.;sg;_;_;succession/iteration/distributivity;modifier
goccia a goccia;yes;a;goccia;È però forse più pratico procurarsi un buon prodotto, già confezionato in forma di oliatore, con il quale passare,;goccia a goccia;, tutte le maglie della catena.;sg;_;_;succession/iteration/distributivity;modifier
goccia a goccia;yes;a;goccia;Quando l'acqua e gli oli hanno la stessa temperatura (tra i 30 - 35 ° C) aggiungete l'acqua;goccia a goccia;emulsionando con il frullino a immersione.;sg;_;_;succession/iteration/distributivity;modifier
goccia a goccia;yes;a;goccia;L'acqua, dal canto suo, non scorreva più fluente, ma;goccia a goccia;, Una folla di gocce che se ne andavano mentre Mahdokht pativa.;sg;_;_;succession/iteration/distributivity;modifier
goccia a goccia;yes;a;goccia;Senza un ordine preciso, ma, come si dice,;goccia a goccia;, mi giungevano, nell'angosciosa notte successiva alla sua morte i ricordi di quelle impressioni della vita familiare che avevo colto allora.;sg;_;_;succession/iteration/distributivity;modifier
goccia a goccia;yes;a;goccia;Spesso il sangue si mette a sgorgare;goccia a goccia;o in modo continuo, iniziando improvvisamente senza una ragione apparente: talvolta i genitori notano solo l'orecchio o il cuscino sporco di sangue.;sg;_;_;succession/iteration/distributivity;modifier
goccia a goccia;yes;a;goccia;Circuiti cognitivi che si tenta di riattivare passo dopo passo,;goccia a goccia;, perché «lo sviluppo cognitivo può essere come una botte, che riempi molto velocemente, oppure come una damigiana che ha il collo stretto e va riempita lentamente.;sg;_;_;succession/iteration/distributivity;modifier
goccia a goccia;yes;a;goccia;«Be', non spetta a noi ammirare questo centellinare;goccia a goccia;,» rispose Theresa.;sg;_;_;succession/iteration/distributivity;modifier
goccia a goccia;yes;a;goccia;"È solo che mi piace sentirti parlare di quando il mare si poteva vedere, di quando ci si poteva entrare dentro; mi piace bere,";goccia a goccia;, quel distillato di saggezza che... --- Il distillato di tua mamma!;sg;_;_;succession/iteration/distributivity;modifier
goccia a goccia;yes;a;goccia;Io adesso ve la faccio bere a viso aperto come il fiele,;goccia a goccia;, fino all'ultima goccia.;sg;_;_;succession/iteration/distributivity;modifier
guancia a guancia;yes;a;guancia;E ha una canzone del cuore, la canzone che ascoltava da govane quando ballava;guancia a guancia;con Filippo di Grecia, suo futuro sposo, ora Filippo d'Edimburgo e Principe consorte.;sg;_;_;juxtaposition/contact;modifier
guancia a guancia;yes;a;guancia;Riuscì ancora a vedere i due uomini, vicini al suo viso, appoggiati l'uno all'altro;guancia a guancia;, che osservavano la fine.;sg;_;_;juxtaposition/contact;modifier
guancia a guancia;yes;a;guancia;Nel bridge, esattamente a 1 e 42 secondi primi, la canzone diventa un recitativo, cito letteralmente: Su, vieni più vicino, lasciati andare, è bello stare;guancia a guancia;, no?;sg;_;_;juxtaposition/contact;modifier
guancia a guancia;yes;a;guancia;"Azzurro Caltagirone è a un tavolo ""cheek to cheek"",";guancia a guancia;con il pretone.;sg;_;_;juxtaposition/contact;modifier
guancia a guancia;yes;a;guancia;Certo che me ne aveva raccontate di cose, e ricordo benissimo che, durante quei quattro giorni si può dire;guancia a guancia;, a ogni nuova confidenza mi si raddoppiavano i brividi lungo la schiena: perché si fidava tanto, perché si era fidata incondizionatamente di me?;sg;_;_;juxtaposition/contact;modifier
guancia a guancia;yes;a;guancia;I loro visi si trovarono incollati l'uno all'altro,;guancia a guancia;.;sg;_;_;juxtaposition/contact;modifier
guancia a guancia;yes;a;guancia;Me lo accosto al viso, quasi lo tocco con gli occhi, mentre Zot arriva e stiamo;guancia a guancia;a guardarlo, così vicini che i nostri respiri diventerebbero uno solo, se ci riuscisse respirare.;sg;_;_;juxtaposition/contact;modifier
guancia a guancia;yes;a;guancia;La tromba è guerresca, angelica, apocalittica, vittoriosa, suona la carica, il sassofono fa ballare bulletti di periferia coi capelli unti di brillantina,;guancia a guancia;con ragazze sudate.;sg;_;_;juxtaposition/contact;modifier
guancia a guancia;yes;a;guancia;Alfio per il resto della serata rimase mortificato a guardarla ballare i valzer lenti;guancia a guancia;con Piastrein.;sg;_;_;juxtaposition/contact;modifier
guancia a guancia;yes;a;guancia;Primo piano dei due volti - quello scuro di mio figlio e quello chiarissimo di Hans - che,;guancia a guancia;, ridono felici.;sg;_;_;juxtaposition/contact;modifier
guancia a guancia;yes;a;guancia;Pereira restò solo al tavolino, sostiene, ordinò un'altra limonata e se la bevve a piccoli sorsi guardando i ragazzi che ballavano lentamente;guancia a guancia;.;sg;_;_;juxtaposition/contact;modifier
guancia a guancia;yes;a;guancia;Avrei voluto poter cucinare al mio lui una costata, sapendo che gli piaceva cotta al punto giusto, poter danzare con lui;guancia a guancia;.;sg;_;_;juxtaposition/contact;modifier
guancia a guancia;yes;a;guancia;Gli indicò gli aiutanti che si tenevano abbracciati,;guancia a guancia;", con un sorriso che poteva essere umile o ironico; gli indicò tutti costoro come per presentargli un seguito impostogli da particolari circostanze, aspettandosi però - in ciò vi era una certa confidenza, ed era questa a cui egli mirava - che Barnabas distinguesse sempre bene fra lui e loro.";sg;_;_;juxtaposition/contact;modifier
guancia a guancia;yes;a;guancia;Vide ancora come i signori vicino al suo viso, accostati;guancia a guancia;, osservavano l'esito.;sg;_;_;juxtaposition/contact;modifier
guancia a guancia;yes;a;guancia;Stemmo a lungo insieme, così,;guancia a guancia;.;sg;_;_;juxtaposition/contact;modifier
guancia a guancia;yes;a;guancia;Lei e Nina sono ancora sotto la coperta, sedute vicine, quasi;guancia a guancia;, ma non si guardano.;sg;_;_;juxtaposition/contact;modifier
guancia a guancia;yes;a;guancia;Pensavo alla sua infanzia e alla sua adolescenza, ai divani ridotti a brandelli e ai materassi masticati, alle fantastiche passeggiate lungo l'Intracoastal e ai balli;guancia a guancia;con lo stereo a tutto volume.;sg;_;_;juxtaposition/contact;modifier
onda a onda;yes;a;onda;Il rumore del mare continuava a coltivare e a vedere crescere,;onda a onda;, il rigoglio del suo disinteresse.;sg;_;_;succession/iteration/distributivity;modifier
pixel a pixel;yes;a;pixel;Per poter essere rilette in formato tridimensionale, le immagini devono essere scritte sullo schermo interallacciate;pixel a pixel;: la separazione ottica delle due immagini avviene a caricod elle microlenti.;sg;_;_;succession/iteration/distributivity;modifier
pixel a pixel;yes;a;pixel;"""Quando si esegue la rilevazione di contorni su un'immagine con tecniche di elaborazione attualmente disponibili lo si fa in maniera digitale,";pixel a pixel;""", ha spiegato il Prof.";sg;_;_;succession/iteration/distributivity;modifier
poro a poro;yes;a;poro;L'avrei presa invece a lei la sbrodolona e rivoltata proprio dall'interno per poi estrarle tutto quell'olio e leccarlo;poro a poro;tutto quell'olio sbrodolone…;sg;_;_;succession/iteration/distributivity;modifier
porta a porta;yes;a;porta;L'Ambiente oggi cerca 20 distributori (uno per ogni regione) più venditori;porta a porta;in tutta Italia.;sg;_;_;succession/iteration/distributivity;modifier
porta a porta;yes;a;porta;Ciò si manifesta anche con la tendenza - si veda a proposito la legge sull'equo canone, sui contratti;porta a porta;", sul credito al consumo, sulla subfornitura e sulla multiproprietà - a non creare nuove figure contrattuali ma a regolare I ""rapporti economici"" fissando requisiti minimi del testo negoziale.";sg;_;_;succession/iteration/distributivity;modifier
porta a porta;yes;a;porta;Ma Davi suggerisce, se la vicenda Unipol dovesse monopolizzare tv e giornali nazionali ancora per mesi, di fare una campagna;porta a porta;: «Rinunciare a fare di Rai3 una rete militante, preferire interviste ai giornali e alle tv locali, tanta radio, non solo nelle emittenti di sinistra, comizi».;sg;_;_;succession/iteration/distributivity;modifier
porta a porta;yes;a;porta;Ma l'azienda cremonese ha bisogno anche di venditori;porta a porta;.;sg;_;_;succession/iteration/distributivity;modifier
porta a porta;yes;a;porta;Un trucchetto che mi ha insegnato un mio ex che faceva vendite;porta a porta;non so più di cosa.;sg;_;_;succession/iteration/distributivity;modifier
porta a porta;yes;a;porta;Nella prefazione ho accennato al piccolo libro Dame al Macao di Alberto Arduini, raffinatissimo antiquario romano con negozio prima in via Frattina, poi in piazza di Spagna;porta a porta;con la KeatsShelley Memorial.;sg;_;_;succession/iteration/distributivity;modifier
porta a porta;yes;a;porta;"Si tratta di vendere questi prodotti attraverso il multilevel marketing, la cosiddetta distribuzione """;porta a porta;""" che funziona attraverso un efficace passa - parola e che permette di guadagnare anche su ogni persona che si riesce a reclutare.";sg;_;_;succession/iteration/distributivity;modifier
porta a porta;yes;a;porta;Oltre agli immancabili call center con contratti a provvigione, tra i casi studiati verranno analizzati i pericoli che si celano nelle offerte per gli impieghi classici, «a domicilio e;porta a porta;"»; ma anche per i lavori che un tempo erano considerati anomali, ma che oggi sono fonte di guadagno per moltissimi giovani, come «quelli che prevedono un corso di formazione a pagamento iniziale, troppo spesso inutile e carissimo».";sg;_;_;succession/iteration/distributivity;modifier
porta a porta;yes;a;porta;Dopo anni passati prima come venditore;porta a porta;di assicurazioni e di calzature per donne, poi come comparsa in film e serie televisive dimenticabili come Il ritorno dei pomodori assassini e Baby talk, questo è il suo momento.;sg;_;_;succession/iteration/distributivity;modifier
porta a porta;yes;a;porta;La sua storia di origini americane risale agli Anni 40 quando fu adottata dai ragazzi che consegnavano i quotidiani;porta a porta;.;sg;_;_;succession/iteration/distributivity;modifier
porta a porta;yes;a;porta;Anziché sostenere la lobby dell'incenerimento Orlando promuova la riduzione dei rifiuti, la raccolta;porta a porta;(abolendo la Tares come chiesto dal M5S con proposte parlamentari), costruzioni di centri riciclo e compostaggio, sistemi alternativi all'incenerimento e alla discarica, in linea con l'Europa!;sg;_;_;succession/iteration/distributivity;modifier
porta a porta;yes;a;porta;Il suo quarto marito le passava a quelli che le vendevano;porta a porta;.;sg;_;_;succession/iteration/distributivity;modifier
porta a porta;yes;a;porta;I Giuliano sembrano un clan giunto al capolinea, lentamente emerso dalla miseria, dal contrabbando alle puttane, dalla gestione dell'estorsione;porta a porta;ai rapimenti.;sg;_;_;succession/iteration/distributivity;modifier
porta a porta;yes;a;porta;Suo padre faceva il rappresentante;porta a porta;per la Rawleigh, un'azienda di prodotti per la casa.;sg;_;_;succession/iteration/distributivity;modifier
porta a porta;yes;a;porta;Profumino invadente di tabaccaio di lusso spacciato per raro oggetto di profumeria, qui la tirchieria è di casa, roba che ti intontisce l'olfatto, venditrice di bigiotteria;porta a porta;o casalinga con marito assente, fa tante telefonate ad amiche che fanno anche loro tante telefonate.;sg;_;_;succession/iteration/distributivity;modifier
porta a porta;yes;a;porta;"In particolare, anche in Italia ci sono esperienze straordinarie a riguardo, conta la raccolta differenziata """;porta a porta;""", domiciliarizzata, portare il servizio vicino alle famiglie.";sg;_;_;succession/iteration/distributivity;modifier
porta a porta;yes;a;porta;Alla quale vanno aggiunti ancora un sindacato (Domina: organizzazione dei datori di lavoro domestico), un patronato (Informafamiglia), una società (Rete - Rete) per vendite;porta a porta;.;sg;_;_;succession/iteration/distributivity;modifier
porta a porta;yes;a;porta;La brochure patinata del venditore;porta a porta;mostrava campi da golf verdissimi e piscine, ma tutto quello che il bambino vede è terra da cimitero e qualche lattina arrugginita.;sg;_;_;succession/iteration/distributivity;modifier
porta a porta;yes;a;porta;15 giovani intraprendenti, anche senza esperienza, hanno la possibilità di entrare a far parte dell'organizzazione commerciale come incaricati alla vendita;porta a porta;, pagati a provvigioni.;sg;_;_;succession/iteration/distributivity;modifier
porta a porta;yes;a;porta;Scompariranno le sue leggendarie ma costose campagne per il finanziamento, durante le quali migliaia di militanti stipendiati raccoglievano soldi e firme;porta a porta;.;sg;_;_;succession/iteration/distributivity;modifier
porta a porta;yes;a;porta;"Un altro vantaggio per i broker è che i potenziali clienti ""visitano"" l'immobile online, liberando il professionista dall'onere di condurre";porta a porta;gli acquirenti interessati.;sg;_;_;succession/iteration/distributivity;modifier
porta a porta;yes;a;porta;Annunci del genere, sui giornali italiani, ormai riguardano solo i venditori di enciclopedie;porta a porta;.;sg;_;_;succession/iteration/distributivity;modifier
porta a porta;yes;a;porta;Al via la raccolta differenziata a Molini, Girola e Valtenna Mercoledì 18 dicembre inizia il nuovo servizio di raccolta differenziata -;porta a porta;nei quartieri Molini, Girola e Valtenna.;sg;_;_;succession/iteration/distributivity;modifier
porta a porta;yes;a;porta;Nel 2002 è tra i tecnici che collaborano all'attivazione della raccolta;porta a porta;in alcuni Comuni della Provincia di Torino.;sg;_;_;succession/iteration/distributivity;modifier
porta a porta;yes;a;porta;Poi i certificati verranno consegnati ai vigili che incominceranno la distribuzione;porta a porta;.;sg;_;_;succession/iteration/distributivity;modifier
porta a porta;yes;a;porta;Un libro del 2015 aveva riassunto in questa tabella il rapporto costi POTH benefici delle varie tattiche da mettere in moto per portare qualcuno a votare, dalla campagna;porta a porta;(31 dollari per voto) alle telefonate dei volontari (35 dollari per voto).;sg;_;_;succession/iteration/distributivity;modifier
porta a porta;yes;a;porta;Quando si riprese, Ron andò a vendere;porta a porta;i prodotti della Rawleigh come suo padre.;sg;_;_;succession/iteration/distributivity;modifier
porta a porta;yes;a;porta;"La consistenza della voce ""altre attività"" (28,9%: include ""altri settori produttivi"", ""attività specifiche d'impresa"", ""maneggi e scuderie"", ""consegna";porta a porta;""", altre attività residuali o non codificate) è il riflesso della storia del lavoro accessorio, all'origine destinato ad ambiti oggettivi di impiego circoscritti (quindi codificabili), negli anni progressivamente ampliati, fino alla riforma contenuta nella legge 92 del 2012 che permette di fatto l'utilizzo di lavoro accessorio per qualsiasi tipologia di attività.";sg;_;_;succession/iteration/distributivity;modifier
porta a porta;yes;a;porta;Entro fine anno il vetro si raccoglierà;porta a porta;.;sg;_;_;succession/iteration/distributivity;modifier
porta a porta;yes;a;porta;Così, cominciò a vendere polivitaminici;porta a porta;.;sg;_;_;succession/iteration/distributivity;modifier
punto a punto;yes;a;punto;Da quel momento si va avanti;punto a punto;.;sg;_;_;succession/iteration/distributivity;modifier
punto a punto;yes;a;punto;A sfidarlo sarà Nicolas Almagro, protagonista di un emozionante partita;punto a punto;contro il brasiliano Bellucci.;sg;_;_;succession/iteration/distributivity;modifier
punto a punto;yes;a;punto;Dall'analisi delle piste è probabile che il mondiale piloti si sviluppi con una battaglia;punto a punto;.;sg;_;_;succession/iteration/distributivity;modifier
punto a punto;yes;a;punto;Per quale motivo la Kinder perde tanti finali di partita;punto a punto;?;sg;_;_;succession/iteration/distributivity;modifier
punto a punto;yes;a;punto;La formazione neroarancione ha deluso nuovamente fuori casa, perdendo per 70-68 dopo un match giocato;punto a punto;.;sg;_;_;succession/iteration/distributivity;modifier
punto a punto;yes;a;punto;E'stata una partita intensa, vissuta a giocata;punto a punto;.;sg;_;_;succession/iteration/distributivity;modifier
uscio a uscio;yes;a;uscio;Erano nati a distanza di pochi giorni l'uno dall'altro e da generazioni le loro famiglie abitavano, come si dice da queste parti,;uscio a uscio;e così i due soci erano cresciuti assieme, assieme erano andati a scuola, quattro chilometri all'andata e quattro al ritorno, sotto il sole, con la neve o con la pioggia.;sg;_;_;juxtaposition/contact;modifier
viso a viso;yes;a;viso;e lo dirò poi Sonia,;viso a viso;e non in presenza di paparino.;sg;_;_;juxtaposition/contact;modifier
viso a viso;yes;a;viso;E poi magari la madre va via piangendo a tutto spiano ma almeno l'ha abbracciata, ha saputo che sta bene:;viso a viso;.;sg;_;_;juxtaposition/contact;modifier
aria su aria;yes;su;aria;Il ventilatore non vale niente, muove;aria su aria;, sempre la stessa.;sg;_;_;greater_plurality/accumulation;nominal
bagni su bagni;yes;su;bagno;Ormai collaudato l'adattamento di Vucinic, attaccante di valore che continua a fare;bagni su bagni;d'umiltà.;pl;_;_;greater_plurality/accumulation;nominal
