NPN;construction;preposition;noun;context_pre;costr;context_post;number_of_noun;Type;other_cxn;meaning;syntactic_function
labbra a labbra;no;a;labbra;Il massimo ardimento fu accostare;labbra a labbra;, e certo non perché avessimo letto Heine e sospettassimo che il bacio fosse più dolce della parola.;sg;verbal;yes;distractor;_
laboratorio a laboratorio;no;a;laboratorio;I risultati, però, sono condizionati dal tipo di reagente utilizzato per il test, che varia da;laboratorio a laboratorio;.;sg;PNPN;yes;distractor;_
lato a lato;no;a;lato;Sulla parete di fronte al letto, nel colore turchino, spiccava solo l'enorme croce nera, da;lato a lato;, come le sbarre di una prigione.;sg;PNPN;yes;distractor;_
legge a legge;no;a;legge;Aveva opposto carte a carte,;legge a legge;.;sg;verbal;yes;distractor;_
linguaggio a linguaggio;no;a;linguaggio;Al di là di quelle che sono le regole standard (che differiscono da;linguaggio a linguaggio;), esistono delle tecniche specifiche che aiutano a rendere più leggibile il codice.;sg;PNPN;yes;distractor;_
luogo a luogo;no;a;luogo;Nella risposta destinata a fornire l'alibi si contrappone;luogo a luogo;, identità a identità.;sg;verbal;yes;distractor;_
luogo a luogo;no;a;luogo;Le leggi al riguardo variano da;luogo a luogo;.;sg;PNPN;yes;distractor;_
luogo a luogo;no;a;luogo;Lo sviluppo non procede infatti secondo un modello unico ma segue piuttosto traiettorie e modelli diversi da;luogo a luogo;, e le ragioni delle diverse velocità di sviluppo e dei diversi livelli raggiunti non può che essere ricercata a scala locale.;sg;PNPN;yes;distractor;_
luogo a luogo;no;a;luogo;Nel mondo reale i diritti naturali sono molto diversi da;luogo a luogo;e nelle varie fasi storiche.;sg;PNPN;yes;distractor;_
luogo a luogo;no;a;luogo;Lo spessore dei ghiacci, misurato con metodi geofisici, varia notevolmente da;luogo a luogo;, in relazione all'andamento del substrato roccioso.;sg;PNPN;yes;distractor;_
malumore a malumore;no;a;malumore;Tanto più che questo improvviso e contestato trasferimento della distribuzione aggiunge;malumore a malumore;.;sg;verbal;yes;distractor;_
mansarda a mansarda;no;a;mansarda;Io e l'avvocato, viceversa, seguiamo la via interna, più segreta, da;mansarda a mansarda;e poi giù, senza offrirci alla vista di alcuno.;sg;PNPN;yes;distractor;_
marca a marca;no;a;marca;Ma la situazione varia molto da;marca a marca;(le Bmw ad esempio sono state aggiornate già nel 1989) ed è bene informarsi presso la rete di assistenza per evitare di danneggiare completamente il motore.;sg;PNPN;yes;distractor;_
marca a marca;no;a;marca;Abbiamo anche indicato nella tabella le dimensioni interne perché possono variare da;marca a marca;, il che in certi casi consente di guadagnare qualche centimetro.;sg;PNPN;yes;distractor;_
materiale a materiale;no;a;materiale;Meno diffusa è la conoscenza dell'entità del fenomeno e del fatto che questo varia da;materiale a materiale;.;sg;PNPN;yes;distractor;_
materiale a materiale;no;a;materiale;"Fu il francese Pierre Curie (1859-1906) a scoprire che il calore disperde il magnetismo; la temperatura a cui questo avviene varia da";materiale a materiale;"e oggi si chiama ""punto di Curie"".";sg;PNPN;yes;distractor;_
mezzanotte a mezzanotte;no;a;mezzanotte;C'era sempre il sole a picco mentre il campanile suonava a compieta (siamo all'Ultima Thule, commentava Belbo tra i denti, sole per sei mesi, da;mezzanotte a mezzanotte;, e ho finito le sigarette), il cane si limitava a soffrire e nessuno badava più a lui, Lorenza diceva che aveva un attacco d'asma, Belbo era ormai sicuro che il cosmo fosse un errore del Demiurgo.;sg;PNPN;yes;distractor;_
miseria a miseria;no;a;miseria;È inutile e crudele aggiungere più di tanto;miseria a miseria;.;sg;verbal;yes;distractor;_
miti a miti;no;a;miti;Si tratta di sostituire nomi a nomi,;miti a miti;, teorie a teorie.;sg;verbal;yes;distractor;_
nascita a nascita;no;a;nascita;"La parca (""vecchia donna in questa vecchia casa"") che cuce, non a caso, la vita da";nascita a nascita;"(""la tua infanzia con quella di tuo figlio"") somiglia alla madre come verrà ritratta più avanti dal poeta.";sg;PNPN;yes;distractor;_
pesce a pesce;no;a;pesce;La moltitudine dei tipi di pesci esige sistemi nutritivi diversi e anche il modo di cibarsi differisce da;pesce a pesce;.;sg;PNPN;yes;distractor;_
pigrizia a pigrizia;no;a;pigrizia;Questo tipo di promozione impoverisce ulteriormente il prodotto - giornale, perché può aggiungere;pigrizia a pigrizia;: un direttore, se sa che domani il suo quotidiano sarà venduto meglio perché c'è dentro la cassetta cinematografica, tira a campare, e finisce col non mettere a punto iniziative giornalistiche trainanti.;sg;verbal;yes;distractor;_
popolo a popolo;no;a;popolo;"Come precisa a tale proposito Croce, ""l'assolutezza dell'attività morale non esclude, anzi include, il variare degli atti morali; non solo da età ad età e da";popolo a popolo;", ma da individuo a individuo, e a ogni istante della vita di ciascun individuo"".";sg;PNPN;yes;distractor;_
porta a porta;no;a;porta;Suvereto ha una strada centrale da;porta a porta;, su cui trovi belli e dritti palazzi borghesi e plebei in pietra e mattone.;sg;PNPN;yes;distractor;_
porta a porta;no;a;porta;Per diversi mesi si è visto, alla Tv, un signore che, con la borsa della spesa, passa da;porta a porta;a farsi ringraziare per gli acquisti che ha fatto e a esortare a fare altrettanto.;sg;PNPN;yes;distractor;_
porta a porta;no;a;porta;Mangiarono una sola castagna a testa e ne vendettero il rimanente da;porta a porta;.;sg;PNPN;yes;distractor;_
porta a porta;no;a;porta;I plateali schiamazzi di Cesare Maldini, le urla scomposte di Marco Tardelli, così diverse e lontane da quelle del leggendario Bernabeu, hanno scandito l'inutile processione da;porta a porta;.;sg;PNPN;yes;distractor;_
porta a porta;no;a;porta;Sulla ribattuta della difesa, la palla giunge a Orlandini che, incredulo, può involarsi da;porta a porta;.;sg;PNPN;yes;distractor;_
porta a porta;no;a;porta;"In particolare si sta mettendo a punto la raccolta differenziata mista che prevede un intervento definito "" a";porta a porta;""" con buste di colore diverso e un altro con i classici contenitori differenziati.";sg;PNPN;yes;distractor;_
potere a potere;no;a;potere;"L'apertura verso l'elettronica può essere pensata nell'ambito di quelle endiadi ""Arte & Non Arte"", meglio ""Avventure & Cultura"", che sommano";potere a potere;, il fare concreto alla pulsionalità e all'intelligenza, la creatività all'ironia.;sg;verbal;yes;distractor;_
problemi a problemi;no;a;problemi;Non poteva però, in quelle condizioni, aggiungere;problemi a problemi;.;sg;verbal;yes;distractor;_
quartiere a quartiere;no;a;quartiere;Ecco come varia nel dettaglio il mercato immobiliare da;quartiere a quartiere;.;sg;PNPN;yes;distractor;_
ricetta a ricetta;no;a;ricetta;Se vi prendete la briga di leggere le ricette per la meringa italiana su qualche libro di pasticceria straniero, troverete che la temperatura dello sciroppo di zucchero varia da;ricetta a ricetta;.;sg;PNPN;yes;distractor;_
riforma a riforma;no;a;riforma;Gli anni 90 sembrano così destinati a consumarsi in continue rincorse da;riforma a riforma;, che vedono ogni volta alzare il tiro verso traguardi più alti e ambiziosi.;sg;PNPN;yes;distractor;_
seduta a seduta;no;a;seduta;Per evitare i brogli del 1992, quando nell'urna apparvero più schede dei votanti, saranno utilizzati fogli colorati, diversi da;seduta a seduta;.;sg;PNPN;yes;distractor;_
sovrano a sovrano;no;a;sovrano;L'esito dello scontro è stato quello che gli dei hanno deciso, ma mi rivolgo a te da;sovrano a sovrano;affinché tu liberi i miei figli, mia madre e la mia sposa.;sg;PNPN;yes;distractor;_
sparo a sparo;no;a;sparo;Sfortunatamente, il moto ondoso influisce negativamente sulla profondità di sparo, causando interferenze nella bolla in espansione, che possono provocare variazioni dell'impulso generato da;sparo a sparo;.;sg;PNPN;yes;distractor;_
sparo a sparo;no;a;sparo;Tale manualità, chiaramente, può variare da;specialista a specialista;.;sg;PNPN;yes;distractor;_
specie a specie;no;a;specie;Il periodo di gestazione varia da;specie a specie;, da 3 o 4 settimane per i più piccoli roditori fino a 21 mesi per l'elefante.;sg;PNPN;yes;distractor;_
specie a specie;no;a;specie;Alla schiusura il piccolo rompe il guscio con una particolare protuberanza ossea e rimane nel nido sotto la protezione della madre, per un periodo che varia da;specie a specie;.;sg;PNPN;yes;distractor;_
specie a specie;no;a;specie;Gli occhi e le capacità visive dei rettili variano da;specie a specie;.;sg;PNPN;yes;distractor;_
specie a specie;no;a;specie;Il capo è dotato di due occhi, due antenne e un apparato boccale che varia da;specie a specie;.;sg;PNPN;yes;distractor;_
specie a specie;no;a;specie;Essa serve ad umidificare il terreno secondo le esigenze delle piante che variano da;specie a specie;per evitare che le radici manchino di un adeguato rifornimento idrico necessario per la crescita.;sg;PNPN;yes;distractor;_
specie a specie;no;a;specie;Per esempio, se siete contrari per i motivi più disparati, anche religiosi, a un trasferimento di geni da;specie a specie;, ora sapete che dovete distinguere tra OGM e OGM.;sg;PNPN;yes;distractor;_
sport a sport;no;a;sport;A prescindere dalle condizioni diverse da;sport a sport;, per atleta «giovane di serie» si intende l'atleta minore di età che, tesserato per una società professionistica o aderente ad una Lega professionistica, abbia compiuto un certo numeri di anni (ad esempio per il calcio si richiede il compimento del quattordicesimo anno di età, mentre per la pallacanestro il compimento del quindicesimo anno di età).;sg;PNPN;yes;distractor;_
sportello a sportello;no;a;sportello;Mai più vedere soggetti che passano da;sportello a sportello;di uffici pubblici, talvolta con effetti defatiganti e che fanno di per sé sfiduciare completamente l'utente circa l'efficienza del servizio reso.;sg;PNPN;yes;distractor;_
studio a studio;no;a;studio;Le cifre, ovviamente, variano da;studio a studio;ma rendono comunque l'idea di quanto la menopausa possa incidere sulla sfera sessuale.;sg;PNPN;yes;distractor;_
superficie a superficie;no;a;superficie;Per il Novecento, il record di vicinanza è già alle nostre spalle e fu stabilito il 4 gennaio 1912, quando tra la Terra e la Luna, da;superficie a superficie;, intercorsero 348.259 chilometri (e 356.375 da centro a centro dei due corpi celesti).;sg;PNPN;yes;distractor;_
teorie a teorie;no;a;teorie;Si tratta di sostituire nomi a nomi, miti a miti,;teorie a teorie;.;sg;verbal;yes;distractor;_
territorio a territorio;no;a;territorio;Questo comporta anche la necessità di tecniche di misurazione e analisi differenti da;territorio a territorio;poiché differenti saranno le modalità di erogazione ed i settori interessati.;sg;PNPN;yes;distractor;_
territorio a territorio;no;a;territorio;Ma non avevamo detto che, se la situazione fosse risultata molto diversa da;territorio a territorio;, si sarebbe proceduto ad aperture differenziate?;sg;PNPN;yes;distractor;_
tessuto a tessuto;no;a;tessuto;La distribuzione degli antigeni HLA di classe I o II sulla membrana L'espressione delle molecole HLA sulle cellule dell'organismo varia da;tessuto a tessuto;e spesso dipende anche dallo stato di attivazione funzionale della cellula, o da fenomeni patologici intercorrenti.;sg;PNPN;yes;distractor;_
testa a testa;no;a;testa;Ma rischiava una sconfitta nella Sud Carolina, lo Stato di John Edwards, che lo precedeva nei sondaggi con il 30 contro il 25 per cento dei voti, e risultava a;testa a testa;con il generale Wesley Clark nell'Oklahoma (dove, a sorpresa, il bollettino di Internet Drudge Report dava invece vincente Edwards stesso).;sg;PNPN;yes;distractor;_
testa a testa;no;a;testa;"Per ottenere le lunghezze desiderate vengono usati giunti a pettine; in pratica incastri molto fini ricavati con fresatura sulle testate delle singole lamelle, che si uniscono a";testa a testa;nel senso della lunghezza, per poi essere incollate di piatto una sull'altra sotto pressione, formando stretti legami intramolecolari simili alle saldature usate coi metalli.;sg;PNPN;yes;distractor;_
testa a testa;no;a;testa;I primi e gli ultimi della scuola europea restano a;testa a testa;anche al terzo problema sull'intricata questione delle proporzioni fisiche di Paolo, Pietro e Maria, risolta brillantemente come un quiz enigmistico.;sg;PNPN;yes;distractor;_
tragedia a tragedia;no;a;tragedia;Non aggiungete dolore a dolore,;tragedia a tragedia;…;sg;verbal;yes;distractor;_
valle a valle;no;a;valle;Nei rastrellamenti dell'estate 1944 dovemmo spostare da;valle a valle;i nuovi arrivati dalla pianura che non potevamo armare.;sg;PNPN;yes;distractor;_
10 su 10;no;su;10;"E mentre Berlusconi si assegna un """;10 su 10;""", "" gli analisti affermano che il governo ha sprecato il suo primo anno "".";X;NumPNum;no;distractor;_
10 su 10;no;su;10;Vorrei che ogni italiano, o almeno 8 su 10 sappiano cosa sia la Milano Sanremo, se;10 su 10;sanno cosa è il Giro.;X;NumPNum;no;distractor;_
11 su 11;no;su;11;Da ricordare la prestazione contro il Belgio allorchè ne ha effettuate;11 su 11;tiri nello specchio della porta degli avversari.;X;NumPNum;no;distractor;_
18 su 18;no;su;18;Il documento ha ottenuto l' unanimità dei voti:;18 su 18;presenti e aventi diritto al voto.;X;NumPNum;no;distractor;_
18 su 18;no;su;18;Io penso che se una persona si impegna, comincia a farlo all' universita' ... magari prendendo dei buoni voti agli esami senza andare a tentare, strappando;18 su 18;.;X;NumPNum;no;distractor;_
18 su 18;no;su;18;La serie A ha votato compatta,;18 su 18;- afferma Galliani - per il ' lodo' che ha preso il mio nome, che prevedeva 3 retrocessioni dalla A e 5 promozioni dalla B, e dall' anno prossimo a regime 3 retrocessioni e 3 promozioni.;X;NumPNum;no;distractor;_
22 su 22;no;su;22;In tempi più recenti, nel giugno scorso,;22 su 22;attentati sono abortiti.;X;NumPNum;no;distractor;_
22 su 22;no;su;22;"Nell' opposizione, tra i socialisti 90 hanno votato a favore mentre 56 si sono astenuti; nel gruppo dei repubblicani e socialisti, invece, i voti contrari sono stati";22 su 22;iscritti.;X;NumPNum;no;distractor;_
4 su 4;no;su;4;Varese ha cercato di resistere con orgoglio, trovando pero' troppo tardi la classe di Meneghin (6 su 11 al tiro e;4 su 4;dalla lunetta), mentre Petruska (4 su 8 e 12 rimbalzi), dopo un felicissimo primo tempo, e' via via scomparso di scena.;X;NumPNum;no;distractor;_
4 su 4;no;su;4;Il suo score recita un;4 su 4;dalla grande distanza e 13 punti nei 13 minuti decisivi per affossare definitivamente la Scavolini.;X;NumPNum;no;distractor;_
4 su 4;no;su;4;Dopo gara 4 i Knicks avranno degli incubi formato Kenyon Martin per tutta l' estate: altra doppia doppia (4;4 su 4;partite), ma quasta volta i punti sono 36.;X;NumPNum;no;distractor;_
4 su 4;no;su;4;Nonostante un opaco Sandro Cherubini (solo 4 i punti del centro della Nazionale italiana), Sassari ha potuto contare su un infallibile Caine dalla lunga distanza (;4 su 4;dalla linea dei 3 punti e 22 i punti totali del britannico) e sui punti di Eveson (25) e Kohlstrom (16), dominatori della lunetta.;X;NumPNum;no;distractor;_
4 su 4;no;su;4;Qualche spunto solo quando Messina gli ha mandato sopra Morlende. </s><s> Chiude la gara con 6 su 13 al tiro con;4 su 4;nei liberi.;X;NumPNum;no;distractor;_
4 su 4;no;su;4;Risultato, al ritorno dopo l' operazione estiva,;4 su 4;da dove conta tre.;X;NumPNum;no;distractor;_
4 su 4;no;su;4;La regione meno virtuosa è risultata la Sardegna, dove il 100% delle province (;4 su 4;) supera i 60 giorni d' attesa (con Oristano e Cagliari in grado di fornire la prestazione non prima di 4 mesi).;X;NumPNum;no;distractor;_
4 su 4;no;su;4;Con quella di oggi, sono;4 su 4;le vittorie di Prada nei testa a testa con l'imbarcazione della bionda Dawn Riley: anche se nelle previsioni, il successo era oggi tutt'altro che scontato.;X;NumPNum;no;distractor;_
4 su 4;no;su;4;Raccoglie punti solamente nei tiri liberi (;4 su 4;) perché la soluzione dalla distanza sembra non baciarlo più, anche in gare facili come questa: su 4 da tre.;X;NumPNum;no;distractor;_
54 su 54;no;su;54;La formazione pugliese è, assieme al Torino, la squadra che ha usufruito fino a questo momento di tutti i cambi disponibili;54 su 54;.;X;NumPNum;no;distractor;_
37 su 37;no;su;37;Nella votazione delle due di notte eravamo;37 su 37;e alla fine è scoppiato un applauso.;X;NumPNum;no;distractor;_
61 su 61;no;su;61;L'ha data già il caso Fiat, bisogna insistere per eliminare anche la mafia, artefice del successo del polo con i;61 su 61;.;X;NumPNum;no;distractor;_
61 su 61;no;su;61;Lasciamo la presidenza dell' assemblea e sentiamo il nuovo presidente della giunta che in Sicilia si è portato a casa tutti i seggi,;61 su 61;.;X;NumPNum;no;distractor;_
61 su 61;no;su;61;Certo le ultime elezioni europee hanno segnato una sconfitta di Berlusconi, il cappotto del;61 su 61;(i seggi del parlamento regionale conquistati dalla destra nelle ultime amministrative) appartiene alla memoria del passato.;X;NumPNum;no;distractor;_
80 su 80;no;su;80;"Alla risposta: ""dovevate o dovevano studiare di più"" noi replichiamo in questo modo: ""anche se tutti gli studenti avessero preso";80 su 80;comunque tantissimi sarebbero tornati a casa!;X;NumPNum;no;distractor;_
80 su 80;no;su;80;Faccia presente che anche se tutta la gente sapesse le cose benissimo, da prendere;80 su 80;comunque tantissima gente dovrebbe tornare a casa.;X;NumPNum;no;distractor;_
9 su 9;no;su;9;A Lecco si è registrato una adesione del 100 per cento (hanno scioperato 19 su 19) così come al tribunale di sorveglianza di Milano (;9 su 9;).;X;NumPNum;no;distractor;_
Pippo su Pippo;no;su;Pippo;La spesa per la riparazione, ammontante a venti euro, da ripartirsi tra tutti i condomini, graverà: su Martino su;Pippo su Pippo;e Martino in parti uguali per un terzo su Martino e per due terzi su Pippo.;X;N_extended;no;distractor;_
DVD su DVD;no;su;DVD;Se vuoi masterizzare un film in;DVD su DVD;+ R DL, ti conviene usare Alcohol o DVD Decrypter (in ISO mode).;sg/pl;thematic_target;no;distractor;_
Pisa su Pisa;no;su;Pisa;Martedì sera Umberto ha avuto una trovata che per poco non ha reso innocuo il pericolante edificio di insulti che ogni puntata pende su di lui, come la Torre di;Pisa su Pisa;.;X;proper_name_inglobation;no;distractor;_
 Vichy su Vichy;no;su;Vichy;Citazione: si esattamente erano collaborazionisti esattamente come tutta la repubblica;Vichy su Vichy;non ci piove, ma sulle SS permettimi di dissentire per due motivi: - arruolamento volontario - giuramento di fedeltà al fuhrer e allla causa nazional-socialista - iniziazione mistica.;X;N_extended;no;distractor;_
satellite su satellite;no;su;satellite;Accesso ad alta velocità al Backbone Internet Europeo e connettività a banda larga, utilizzando tecnologia satellitare bidirezionale mediante canale di comunicazione bidirezionale via;satellite su satellite;geostazionario opportunamente posizionato, e connessione via fibra al Backbone Internet Europeo, con relativa manutenzione ed assistenza tecnica.;sg;N_extended;no;distractor;_
grigio su grigio;no;su;grigio;Innanzitutto, sono stati introdotti nuovi colori per la plancia bicolore;grigio su grigio;e blu su grigio.;sg;thematic_target;no;distractor;_
interessi su interessi;no;su;interesse;Io che sono fiorentina, forse avrei qualche motivo in più per pensarlo, ma preferisco spostare i miei;interessi su interessi;"più ""puliti"" perchè il calcio sicuramente non lo è.";sg;N_extended;no;;_
Christine su Christine;no;su;Christine;"Nel 1969 anche i Nomadi si dedicano al ""trans"", cantano";Christine su Christine;Jorgensen, una transessuale famosa dal 1952, fotografa, attrice e cantante.;X;proper_name_inglobation;no;distractor;_
TV su TV;no;su;TV;Tutta la cerimonia finale verrá trasmessa in diretta;TV su TV;3 dalle 18.40 alle 20.15 e su TV 1 e TV 2 dalle 19.30 alle 20.00.;sg;proper_name_inglobation;no;distractor;_
Guccini su Guccini;no;su;Guccini;Forse il fatto d'essere un lavoro di;Guccini su Guccini;, la possibilità di curiosare nell'armadio dei sogni e dei ricordi, mettendoci a disposizione fin dalla copertina la foto di famiglia del bisnonno che gli ha dato il nome (e sul retro, ma non cercatela nel booklet del cd, un'austera immagine della sua,;X;thematic_target;no;distractor;_
Fede su Fede;no;su;Fede;La Dottrina della Chiesa, la Nota della Congregazione per la Dottrina della;Fede su Fede;e Politica, l' introduzione a questa di ... ;sg;proper_name_inglobation;no;distractor;_
Android su Android ;no;su;Android ;Attualmente è necessario impostare la versione minima di;Android su Android;7,0 (API 24-torrone) per distribuire l'app in dispositivi o emulatori torrone Android.;X;proper_name_inglobation;no;distractor;_
Apple su Apple;no;su;Apple;Anche Noi di Zoleounge.it stiamo promuovendo il Back Friday di Apple e se siete in procinto di acquistare con gli sconti del BlackFriday 2010 di;Apple su Apple;Italia, iTunes Store o su App Store e volete aiutare Zoelounge.it senza peraltro spendere una lira in più, potreste prendere in considerazione l'idea di cliccare su uno dei banner presenti in questa pagina o nei banner presenti nella sidebar.;X;proper_name_inglobation;no;distractor;_
base su base;no;su;base;Agenzia Nazionale per la Ricerca (ANR), creata nel 2007 per finanziare progetti di ricerca di;base su base;competitiva.;sg;N_extended;no;distractor;_
base su base;no;su;base;La Commissione può ora rimborsare spese generali di;base su base;forfetaria o versare importi forfetari per piccoli progetti - di gruppi vulnerabili, per esempio.;sg;N_extended;no;distractor;_
base su base;no;su;base;Nella vita di tutti i giorni un lavaggio di;base su base;mensile è sufficiente.;sg;N_extended;no;distractor;_
base su base;no;su;base;La povertà mestruale - la lotta per pagare i prodotti sanitari di;base su base;mensile - è aumentata durante la pandemia di coronavirus , secondo le associazioni di beneficenza.;sg;N_extended;no;distractor;_
dati su dati;no;su;dato;Una elaborazione fatta da un analista di;dati su dati;Istat dal due mila undici al due mila sedici.;pl;N_extended;no;distractor;_
energia su energia;no;su;energia;Tradotto in italiano è il ritorno di;energia su energia;"investita; è un rapporto tra due valori numerici espressi in kWh.";sg;N_extended;no;distractor;_
Sky su Sky;no;su;Sky;"È possibile acquistare entrambe le offerte ""Vodafone TV + NOW TV Intrattenimento"" e ""Vodafone TV Sport"" per avere accesso sia allo sport di";Sky su Sky;Sport Mix che all'entertaniment televisivo con il Ticket Intrattenimento di NOW TV.;X;proper_name_inglobation;no;distractor;_
Sky su Sky;no;su;Sky;La partita Napoli-Villarreal sarà trasmessa in diretta tv per gli abbonati di;Sky su Sky;Calcio 1 HD (canale 251).;X;proper_name_inglobation;no;distractor;_
Sky su Sky;no;su;Sky;Cliente Sky via fibra/satellite con pack Calcio e Sky Go: 36,80 euro/mese* per le 7 partite/turno di;Sky su Sky;Go.;X;proper_name_inglobation;no;distractor;_
Venere su Venere;no;su;Venere;E i transiti che mi aspettano di ;Venere su Venere;e Saturno e poi di Urano su Marte, posso considerarli buoni per la mia situazione sentimentale?;X;N_extended;no;distractor;_
Venezia su Venezia;no;su;Venezia;Pubblicazione di alcune foto di;Venezia su Venezia;Radio TV e Venetian Holiday.;X;proper_name_inglobation;no;distractor;_
justin su justin;no;su;justin;belibers.....cazzo calmatevi fate paura....justin di qua justin di là;justin su justin;giù!;X;NsuNgiù;yes;distractor;_
mani su mani;no;su;mano;Anche il testo della canzone era stato scritto per essere abbastanza esplicativo e per mostrare cosa si sarebbe dovuto fare (;mani su mani;giù mani dove vuoi) ma l'immagine dei Ricchi & Poveri non era tale da poter imporre un ballo inventato di sana pianta anche perché non c'era più la moda di inventarne di nuovi per il tramite di una canzone lanciata appositamente.;pl;NsuNgiù;yes;distractor;_
km su km;no;su;km;e non può che migliorare col tempo, poi;km su km;giù porto pazienza.;sg/pl;NsuNgiù;yes;distractor;_
punto su punto;no;su;punto;Punto croce ricamo una data;punto su punto; giù indico traccia di trama merletto finito.;sg;NsuNgiù;yes;distractor;_
mente su mente;no;su;mente;"Il credersi ""separati"" in più parti (";mente su mente;"giù, corpo questo e corpo quell'altro, questo è meglio e quello è peggio) è solo il frutto d'una visione ""schizofrenica"".";sg;NsuNgiù;yes;distractor;_
40 su 40;no;su;40;Poi è il turno di Nintendogs, il perfect score di Famitsu (voto;40 su 40;), dopo aver conquistato il mercato nipponico, si prepara ad invadere anche quelli occidentali.;X;NumPNum;no;distractor;_
