NPN;construction;preposition;noun;context_pre;costr;context_post;number_of_noun;Type;other_cxn;meaning;syntactic_function
pezzetto su pezzetto;yes;su;pezzetto;Le era sembrato di costruire ogni giorno;pezzetto su pezzetto;la propria vita e ciò che l'aveva inorgoglita di più era che ogni piccolo miglioramento derivasse dalla sua volontà e dalla assoluta mancanza di compromessi.;sg;_;_;succession/iteration/distributivity;modifier
pietra su pietra;yes;su;pietra;Caro e grande maestro mio, esempio di contento puro e tutto avuto dal bisogno col quale s'era sempre cercato;pietra su pietra;", e quasi per un non - potere di sé che è, come ebbe a scrivere, ""genuinità"", ""qualità di delicatezza"".";sg;_;_;succession/iteration/distributivity;modifier
pietra su pietra;yes;su;pietra;Secondo Rauber, l'organismo vivente non è costruito come un edificio, aggiungendo;pietra su pietra;in modo ordinato.;sg;_;_;greater_plurality/accumulation;nominal
pietra su pietra;yes;su;pietra;"È necessario fare chiarezza su tali aporie (si ricordi il senso della ‘spiegazione’ in Kant!) ; la filosofia non procede cumulativamente, ‘";pietra su pietra;, né può pensare di porre ordine nel linguaggio che effettivamente parliamo ricorrendo al ‘modello’ di ideografie, valide soltanto nell’ambito di procedure logico-matematiche.;sg;_;_;succession/iteration/distributivity;modifier
pietra su pietra;yes;su;pietra;Alta tecnologia che non può fare amenodell'uomo: un po 'come il Duomo di Milano: un'opera collettiva, firmata dal popolo che l'ha edificato;pietra su pietra;.;sg;_;_;succession/iteration/distributivity;modifier
pietra su pietra;yes;su;pietra;I monaci hanno progettato e costruito;pietra su pietra;, cattedrali e monasteri.;sg;_;_;succession/iteration/distributivity;modifier
pietra su pietra;yes;su;pietra;Le pietre scolpite sono l'omaggio alla storia millenaria, costruita;pietra su pietra;, secolo dopo secolo.;sg;_;_;succession/iteration/distributivity;modifier
record su record;yes;su;record;Ma in questi anni va così,;record su record;.;sg/pl;_;_;greater_plurality/accumulation;nominal
record su record;yes;su;record;Ritengo che, dopo essere salita in modo fulmineo macinando;record su record;, la Borsa Usa abbia bisogno di una ripulita dagli eccessi speculativi.;sg/pl;_;_;greater_plurality/accumulation;nominal
record su record;yes;su;record;La ragione è semplice: le principali Borse mondiali (salvo Tokio) macinano;record su record;, la capitalizzazione dei grandi gruppi quotati si espande oltre ogni previsione, i ritorni sull'investimento per chi ha puntato su di loro un anno fa battono tutte le alternative.;sg/pl;_;_;greater_plurality/accumulation;nominal
record su record;yes;su;record;Fuori Perugini: Valentino è primo, in dieci minuti dodici posti risucchiati,;record su record;.;sg/pl;_;_;greater_plurality/accumulation;nominal
ritardi su ritardi;yes;su;ritardo;Bene il raddoppio Mortara, unica linea ancora a singolo binario in città, capacità limitata e treni affollati che accumulano;ritardi su ritardi;a causa degli incroci.;pl;_;_;greater_plurality/accumulation;nominal
ritardi su ritardi;yes;su;ritardo;E se il verboso cattivo accumula;ritardi su ritardi;nelle sue comunicazioni finali al buono, nei teatri d'una volta si gridava «e partite, cretini!»;pl;_;_;greater_plurality/accumulation;nominal
ritardi su ritardi;yes;su;ritardo;Una sorta di modello finlandese, sulla falsariga della società che ha affidato ad Areva la costruzione del reattore di Olkiluoto (che sta però collezionando;ritardi su ritardi;, l'ultimo reso noto proprio ieri).;pl;_;_;greater_plurality/accumulation;nominal
ritardi su ritardi;yes;su;ritardo;Da allora, poco o nulla più:;ritardi su ritardi;da parte di BluTec nell'esecuzione dei piani, i lavoratori che protestano, Invitalia che ritira il finanziamento e chiede indietro i soldi.;pl;_;_;greater_plurality/accumulation;nominal
ritmi su ritmi;yes;su;ritmo;Come i concetti, la musica di Cretu-Enigma non si ferma ma continua ad indagare, sovrapponendo;ritmi su ritmi;, sonorità elettroniche su sonorità canore spesso sintetizzate.;pl;_;_;greater_plurality/accumulation;nominal
riunioni su riunioni;yes;su;riunione;Non resta che aspettare: sempre dal municipio i bene informati fanno sapere che proprio in queste ore si stanno svolgendo;riunioni su riunioni;per risolvere la matassa e passare all'azione, ma sulla tempistica non si sbilancia nessuno.;pl;_;_;greater_plurality/accumulation;nominal
riunioni su riunioni;yes;su;riunione;Come sempre accade, appena un matrimonio va a rotoli si inizia a lavorare finoa tardi, a fare;riunioni su riunioni;, viaggi improvvisi.;pl;_;_;greater_plurality/accumulation;nominal
riunioni su riunioni;yes;su;riunione;Ma per arrivare sino a quel punto, a quel sospiro di sollievo, ci sono state ore di trattative ininterrotte e telefonate notturne e sveglie all'alba e;riunioni su riunioni;.;pl;_;_;greater_plurality/accumulation;nominal
riunioni su riunioni;yes;su;riunione;La situazione era diventata assurda: facevo;riunioni su riunioni;con colleghe e genitori sul modo di migliorare il rapporto educativo coi bambini, individuare le strategie per seguirli meglio... e intanto i miei erano soli.;pl;_;_;greater_plurality/accumulation;nominal
riunioni su riunioni;yes;su;riunione;Da dieci giorni stiamo dicendo in tutte le sedi che bisognava intervenire: si è perduto tempo a discutere, a prendere contatti diplomatici, a fare;riunioni su riunioni;, dichiarazioni su dichiarazioni, mentre la tragedia albanese richiedeva interventi rapidi, decisi, organici, massicci.;pl;_;_;greater_plurality/accumulation;nominal
riunioni su riunioni;yes;su;riunione;Naturalmente, come in ogni occupazione che si rispetti, si susseguono;riunioni su riunioni;.;pl;_;_;greater_plurality/accumulation;nominal
rovine su rovine;yes;su;rovina;Dove ci appare una catena di eventi, egli vede una sola catastrofe che accumula senza tregua;rovine su rovine;e le rovescia ai suoi piedi.;pl;_;_;greater_plurality/accumulation;nominal
sangue su sangue;yes;su;sangue;Hanno gioito o si sono disperati,;sangue su sangue;.;sg;_;_;succession/iteration/distributivity;modifier
saponi su saponi;yes;su;sapone;Mi lavo e mi rilavo, svaniscono;saponi su saponi;, asciugamani e salviette si impregnano d'acqua.;pl;_;_;greater_plurality/accumulation;nominal
sassolino su sassolino;yes;su;sassolino;Nei giorni a venire e nelle notti illuni e nelle notti quando una luna fulgidissima splendeva sopra la terra, il vecchio avrebbe continuato a parlargli, a parlargli, goccia a goccia,;sassolino su sassolino;, petalo dopo petalo.;sg;_;_;succession/iteration/distributivity;modifier
sbagli su sbagli;yes;su;sbaglio;Aveva sempre permesso che loro ne approfittassero – una masochistica consapevolezza che la portava a collezionare;sbagli su sbagli;.;pl;_;_;greater_plurality/accumulation;nominal
serate su serate;yes;su;serata;Lo so, avrei potuto campare di rendita su Kalimba de Luna, collezionando;serate su serate;…;pl;_;_;greater_plurality/accumulation;nominal
sistemi su sistemi;yes;su;sistema;Comprese le giocate al Superenalotto che continuano sostenute e spingono Ferdinando De Nittis e suo cognato Mimì il barbiere a sfornare;sistemi su sistemi;come a una catena di montaggio.;pl;_;_;greater_plurality/accumulation;nominal
soldi su soldi;yes;su;soldi;Il meccanismo adottato in Francia per convincere i cittadini della ineluttabilità del nucleare è lo stesso adottato di recente in Italia: balle su balle raccontate da venduti e;soldi su soldi;per la pubblicità e per foraggiare i giornali.;pl;_;_;greater_plurality/accumulation;nominal
soldi su soldi;yes;su;soldi;E ora questi incapaci hanno il coraggio di chiedere;soldi su soldi;a chi le tasse le paga già fino all'ultimo centesimo.;pl;_;_;greater_plurality/accumulation;nominal
soldi su soldi;yes;su;soldi;Insomma c'è ancora tempo, e spazio, per fare;soldi su soldi;su soldi vendendo e spedendo in tutto il mondo i vecchi libri di carta: tanto più se fatti in casa.;pl;_;_;greater_plurality/accumulation;nominal
soldi su soldi;yes;su;soldi;Insomma c'è ancora tempo, e spazio, per fare soldi su;soldi su soldi;vendendo e spedendo in tutto il mondo i vecchi libri di carta: tanto più se fatti in casa.;pl;_;_;greater_plurality/accumulation;nominal
soldi su soldi;yes;su;soldi;"Si tratta di un accidente della natura, in certi individui; una volta che si è iniziato, non c'è modo di fermarsi,";soldi su soldi;.;pl;_;_;greater_plurality/accumulation;nominal
storie su storie;yes;su;storia;Ma si capirà anche che Amado era tutt'altro che un narratore naif, capace com'era di utilizzare una vasta tavolozza di tecniche e di intrecciare;storie su storie;in complicate architetture.;pl;_;_;greater_plurality/accumulation;nominal
terreni su terreni;yes;su;terreno;Il Comune di Roma, intanto, come aveva cominciato a fare a partire dagli anni Sessanta, gli espropria;terreni su terreni;a Rebibbia, Casal de' Pazzi e Primavalle, mentre le varianti al piano regolatore fanno crollare il valore di altri lotti.;pl;_;_;greater_plurality/accumulation;nominal
terreno su terreno;yes;su;terreno;Io guardavo lo zoppo rincorrere goffamente la più bella e l'altro inseguirli velocissimo guadagnando;terreno su terreno;.;sg;_;_;greater_plurality/accumulation;nominal
vasche su vasche;yes;su;vasca;Continuai ad ammirarla mentre, bracciata dopo bracciata, accumulava;vasche su vasche;.;pl;_;_;greater_plurality/accumulation;nominal
velo su velo;yes;su;velo;Il vento era ancora leggero, ma prometteva tempesta, la sabbia volava bassa e copriva le strade,;velo su velo;.;sg;_;_;succession/iteration/distributivity;modifier
vigneti su vigneti;yes;su;vigneto;"Vagoni arrugginiti dove giovani senza senso lirico hanno spruzzato graffiti di cui, ahimè, non so cogliere il significato;";vigneti su vigneti;", sotto un velo di nebbia setosa come cipria; vecchi in bicicletta, altri che portano a spasso i cani.";pl;_;_;greater_plurality/accumulation;nominal
vittime su vittime;yes;su;vittima;Filippo attraversò l'accampamento gettando una rapida occhiata ad Aristandro che continuava a immolare;vittime su vittime;sul suo altare fumigante nella notte, e raggiunse un luogo in cui sorgeva un gigantesco banyan.;pl;_;_;greater_plurality/accumulation;nominal
volumi su volumi;yes;su;volume;Durante tutto l'inverno, sepolto in una pelliccia accanto al camino, non fece che consultare;volumi su volumi;per trovare tracce di quell'evento: gli angeli sulla terra.;pl;_;_;greater_plurality/accumulation;nominal
agenzia ad agenzia;no;a;agenzia;Il tutto tra l'altro avviene nel giro di pochi mesi con una successione da;agenzia ad agenzia;quasi automatica.;sg;PNPN;yes;distractor;_
albero ad albero;no;a;albero;Non un solo silenzio, ma parecchi: quello del muschio sotto i piedi, quello delle ombre da;albero ad albero;, il silenzio di un piccolo ruscello in esplorazione di pezzetti di terreno, i silenzi che lo attorniavano mentre sbucava su una radura.;sg;PNPN;yes;distractor;_
argomento ad argomento;no;a;argomento;Io credo che tale dipendenza sia molto variabile, da persona a persona e da;argomento ad argomento;: l'elaborazione simbolica può essere vantaggiosa oppure deleteria, a seconda delle circostanze e dell'oggetto.;sg;PNPN;yes;distractor;_
artista ad artista;no;a;artista;Lo spessore dello strato pittorico varia da;artista ad artista;e dalla tecnica impiegata.;sg;PNPN;yes;distractor;_
assurdo ad assurdo;no;a;assurdo;Ma non ha molto senso contrapporre;assurdo ad assurdo;, non si annulleranno mai a vicenda e anzi, l'uno richiama l'altro in una tensione che può anche raggiungere vette esaltanti ma dilania l'uomo, stravolge la prospettiva in cui egli finisce per vedere la vita.;sg;verbal;yes;distractor;_
azienda ad azienda;no;a;azienda;La modularità delle ante varia da;azienda ad azienda;ma, in generale, il battente singolo è largo cm 50-70.;sg;PNPN;yes;distractor;_
azienda ad azienda;no;a;azienda;Il rapporto prezzo utili varia significativamente da settore a settore e, spesso, da;azienda ad azienda;, in quanto ogni azienda si caratterizza con proprie condizioni di rischio.;sg;PNPN;yes;distractor;_
bocca a bocca;no;a;bocca;Per non far cadere il sugo prendendolo con le dita, glielo passò da;bocca a bocca;.;sg;PNPN;yes;distractor;_
bocca a bocca;no;a;bocca;Sperava che saltasse fuori un veleno o una tossina, ma gli interessava anche sapere se Clive era positivo all'HIV, dato che gli aveva praticato la respirazione a;bocca a bocca;ed era entrato in contatto col suo sangue.;sg;PNPN;yes;distractor;_
bocca a bocca;no;a;bocca;Juanita si precipitò a praticarle la respirazione a;bocca a bocca;, ma l'altra, quando si riprese, per poco non la denunciò per atti osceni.;sg;PNPN;yes;distractor;_
bocca a bocca;no;a;bocca;Come si diffondono, ingigantendosi nel passare da;bocca a bocca;o da scritto a scritto?;sg;PNPN;yes;distractor;_
banca a banca;no;a;banca;Nonostante questo, i metodi di tariffazione sono differenti da;banca a banca;: nel caso del Banco Ambrosiano Veneto il servizio è completamente gratuito, ma per il cliente il costo dell'operazione dispositiva di bonifico è lo stesso della filiale.;sg;PNPN;yes;distractor;_
banca a banca;no;a;banca;Organizzazione di spostamento di capitale (conto) da;banca a banca;per porre sotto ricatto il sistema colpendolo dove più sanguina (I SOLDI).;sg;PNPN;yes;distractor;_
banca a banca;no;a;banca;Va ricordato che la tessera Pagobancomat - utilizzabile per i pagamenti presso i punti convenzionati - prevede un costo annuo variabile da;banca a banca;ma è esente da commissioni per operazione e da costi di registrazione scrittura.;sg;PNPN;yes;distractor;_
banca a banca;no;a;banca;E in questo caso i costi sono diversi da;banca a banca;: nella tabella pubblicata sopra vengono riportati quindici esempi relativi al circuito Cirrus - Maestro, il più diffuso sulle carte di debito, da cui emerge che le commissioni variano dallo 0,25% al 4%, più (o in alternativa) le spese fisse.;sg;PNPN;yes;distractor;_
banca a banca;no;a;banca;Per chiudere questo mutuo dovrete pagare una penale del 3% (ma come si vede nella tabella la percentuale cambia da;banca a banca;e, in alcuni casi, il conteggio si può rivelare molto complicato) sull'ammontare del capitale ancora da rimborsare (2.091.736 lire).;sg;PNPN;yes;distractor;_
banca a banca;no;a;banca;Una volta compiuta la scelta vengono attivate le procedure di sicurezza, che variano, ma di poco, da;banca a banca;.;sg;PNPN;yes;distractor;_
banca a banca;no;a;banca;l prezzo al dettaglio (diverso da;banca a banca;), poi, va aggiunta la commissione che può variare dai 50 ai 100 punti base.;sg;PNPN;yes;distractor;_
banca a banca;no;a;banca;Al di là della comodità, dal punto di vista economico la convenienza della domiciliazione varia però non solo da;banca a banca;ma anche e soprattutto a seconda del tipo di conto che si intrattiene con l'istituto.;sg;PNPN;yes;distractor;_
banca a banca;no;a;banca;Per quest'ultimo servizio non c'è alcuna differenza tra tessera vecchia e tessera nuova: sono rimaste in vigore, infatti, le precedenti condizioni economiche, diverse da;banca a banca;, ma in genere gratuite per prelievi agli sportelli automatici del proprio istituto e tariffate (in media dalle 2500 alle 3000 lire) per prelievi in qualsiasi altra banca diversa dalla propria.;sg;PNPN;yes;distractor;_
capitolo a capitolo;no;a;capitolo;All'interno del bilancio amministrativo, la Commissione può procedere, nei limiti e alle condizioni fissate dal regolamento stabilito in esecuzione dell'articolo 78 nono, a trasferimenti di crediti, sia da;capitolo a capitolo;, sia da suddivisione a suddivisione.;sg;PNPN;yes;distractor;_
centro a centro;no;a;centro;La distanza di questi fra di loro deve essere - da;centro a centro;- di mm. 66.;sg;PNPN;yes;distractor;_
centro a centro;no;a;centro;La distanza fra le grandi colonne è pari, da;centro a centro;", a 4,52 metri; nel disegno è di 4,51 metri.";sg;PNPN;yes;distractor;_
centro a centro;no;a;centro;"Inoltre, a causa della mancanza di standard unici, le condizioni ""variano da";centro a centro;""" e in alcuni di questi ci sono ""dubbi sul rispetto dei diritti umani"".";sg;PNPN;yes;distractor;_
ceppo a ceppo;no;a;ceppo;Gli enzimi di parecchi ceppi possono essere confrontati mediante tecniche statistiche che rivelano la divergenza genetica relativa da;ceppo a ceppo;.;sg;PNPN;yes;distractor;_
cervello a cervello;no;a;cervello;Così, l'uomo ha dovuto confrontarsi con la donna in modo diverso, da;cervello a cervello;, e abbandonare il mito dei muscoli.;sg;PNPN;yes;distractor;_
commento a commento;no;a;commento;Volti tirati, ma è inutile aggiungere;commento a commento;.;sg;verbal;yes;distractor;_
complotto a complotto;no;a;complotto;Un progetto astratto di complotto migrava da;complotto a complotto;.;sg;PNPN;yes;distractor;_
comune a comune;no;a;comune;I contributi ed aiuti sociali esistono in Italia, ma il sistema varia da;comune a comune;.;sg;PNPN;yes;distractor;_
comune a comune;no;a;comune;La differenza percentuale fra livello minimale e medio della spesa standard varia però in modo sensibile da;comune a comune;e fra gruppi di comuni.;sg;PNPN;yes;distractor;_
comune a comune;no;a;comune;I fabbisogni di spesa pro capite risultano assai diversi da;comune a comune;e ciò riflette esclusivamente le differenze dei comuni italiani in termini di caratteristiche sociali, economiche e territoriali.;sg;PNPN;yes;distractor;_
comune a comune;no;a;comune;Questa procedura, necessaria per evitare squilibri nei bilanci comunali, genera però un impatto sul reddito disponibile dei cittadini diverso da;comune a comune;in funzione dell'aliquota ICI in vigore.;sg;PNPN;yes;distractor;_
comune a comune;no;a;comune;La distribuzione degli anziani, in particolare, risulta fortemente variabile da regione a regione e, a livello locale, anche da;comune a comune;.;sg;PNPN;yes;distractor;_
comune a comune;no;a;comune;Con le limitazioni in termini di trasferte e spostamenti da regione a regione e in alcuni casi da;comune a comune;, bisogna saper attirare non tanto il turista che viene da fuori ma chi ogni giorno vive della nostra stessa montagna.;sg;PNPN;yes;distractor;_
comune a comune;no;a;comune;Limitare gli spostamenti, anche da;comune a comune;, serve a diminuire gli incontri tra le persone e, dunque, la circolazione del virus.;sg;PNPN;yes;distractor;_
disastro a disastro;no;a;disastro;"Dunque, una buona legge risulta impraticabile; e produrre un'altra riforma inefficace sarebbe aggiungere";disastro a disastro;.;sg;verbal;yes;distractor;_
disastro a disastro;no;a;disastro;E poi, se la pioggia rimane così debole non può certo aggiungere;disastro a disastro;.;sg;verbal;yes;distractor;_
disastro a disastro;no;a;disastro;Se dovesse piovere, si aggiungerebbe;disastro a disastro;.;sg;verbal;yes;distractor;_
distretto a distretto;no;a;distretto;Tra l'altro, per fronteggiare il ripetersi di cause di questo tipo, i tribunali hanno messo a punto una sorta di tabella dei rimborsi, che varia da;distretto a distretto;.;sg;PNPN;yes;distractor;_
gola a gola;no;a;gola;Parlargli di persona, dirgli che non condividevano le scelte di ristrutturazione, che avevano fatto i figli, volevano fissarlo negli occhi smettendola di far passare parola su parola da;gola a gola;, facendo impastare i messaggi dalla saliva di molte lingue, visto che i cellulari non erano utilizzabili per non far risalire al percorso della sua latitanza.;sg;PNPN;yes;distractor;_
immagine a immagine;no;a;immagine;Mi interessava l'espressione di molti invitati, che passavano da;immagine a immagine;con aria di reverenza, e commozione.;sg;PNPN;yes;distractor;_
immobile a immobile;no;a;immobile;In molti comuni le aliquote cambiano da;immobile a immobile;Sono chiamati all'appello dell'Ici i proprietari, gli usufruttuari, i titolari di diritti d'uso o abitazione, su terreni e fabbricati.;sg;PNPN;yes;distractor;_
individuo a individuo;no;a;individuo;I ricordi che un adulto ha della propria vita infantile sono variabili da;individuo a individuo;, ma, generalmente, più si va a ritroso nel tempo e minore è la quantità di ricordi.;sg;PNPN;yes;distractor;_
individuo a individuo;no;a;individuo;Tali percezioni e spiegazioni differiscono da;individuo a individuo;, a causa dell'influenza delle opinioni formatesi in precedenza e del complesso degli atteggiamenti.;sg;PNPN;yes;distractor;_
individuo a individuo;no;a;individuo;Questi caratteri sono variabili da;individuo a individuo;"; essi sono infatti il passaggio nel soggetto percettore del s. di caratteri fisici ben precisi dell'onda, che è l'unica realtà fisica del fenomeno.";sg;PNPN;yes;distractor;_
individuo a individuo;no;a;individuo;Come precisano i ricercatori, la soglia di sensibilità alla sofferenza varia da;individuo a individuo;e, per stabilirla, bisogna considerare anche una buona dose di ereditarietà.;sg;PNPN;yes;distractor;_
individuo a individuo;no;a;individuo;Un ruolo significativo potrebbe essere giocato dalle cellule staminali, che sono diverse da;individuo a individuo;, ma è solo un'ipotesi di lavoro.;sg;PNPN;yes;distractor;_
individuo a individuo;no;a;individuo;Il coniglio inoltre è un animale sensibile, intelligente, vivace, affettuoso e con una sua personalità, diversa da;individuo a individuo;"; di conseguenza non può vivere sempre in gabbia ed ha bisogno di relazioni affettive, di gioco e di un'alimentazione specifica.";sg;PNPN;yes;distractor;_
individuo a individuo;no;a;individuo;La Cosmides e Tooby hanno congetturato che le variazioni genetiche da;individuo a individuo;potrebbero proteggere la nostra specie da malattie o parassiti, ma non dovrebbero avere importanti conseguenze sul comportamento.;sg;PNPN;yes;distractor;_
individuo a individuo;no;a;individuo;La mancanza di equilibrio tra le due culture, umanistica e scientifica, ha rallentato in passato la trasmissione del sapere da;individuo a individuo;nella collettività, favorendo la fuga dei migliori ingegni verso lidi più accoglienti.;sg;PNPN;yes;distractor;_
individuo a individuo;no;a;individuo;Di conseguenza, mentre il modo di guardare una immagine ferma varia molto da;individuo a individuo;, il modo di guardare un film è piuttosto uniforme: tutti gli spettatori tendono a esplorare l'immagine in moto nello stesso modo.;sg;PNPN;yes;distractor;_
individuo a individuo;no;a;individuo;La concentrazione di stronzio 90 nello scheletro umano varia molto da luogo a luogo e da;individuo a individuo;"; si sono trovate persone che ne hanno fino a settantacinque volte la quantità media; i bambini hanno in media una concentrazione almeno quadrupla di quella degli adulti, a causa del più rapido ricambio di sostanze nelle ossa durante la crescita.";sg;PNPN;yes;distractor;_
individuo a individuo;no;a;individuo;Se la razza è in genere un buon indicatore della natura dell'intelligenza istintiva del cane, l'intelligenza adattiva dipende da;individuo a individuo;.;sg;PNPN;yes;distractor;_
individuo a individuo;no;a;individuo;Oltre al livello evolutivo della coscienza, chiaramente il contenuto del dramma emotivo che essa abbraccia varia da;individuo a individuo;.;sg;PNPN;yes;distractor;_
individuo a individuo;no;a;individuo;Anche l'ampiezza e la profondità dello sviluppo mentale variano considerevolmente da;individuo a individuo;.;sg;PNPN;yes;distractor;_
individuo a individuo;no;a;individuo;Meglio provarli qualche settimana prima della partenza definitiva, per valutarne le dosi e gli effetti, che possono variare da;individuo a individuo;, in modo da verificarne l'efficacia e la dose ottimale.;sg;PNPN;yes;distractor;_
individuo a individuo;no;a;individuo;La reazione all'alcol varia molto da;individuo a individuo;.;sg;PNPN;yes;distractor;_
individuo a individuo;no;a;individuo;"È probabile che il desiderio di ""fare il papà"" vari da";individuo a individuo;, tuttavia è cosa certa che non si nasce genitori, ma lo si diventa solo attraverso il concreto rapporto col figlio.;sg;PNPN;yes;distractor;_
individuo a individuo;no;a;individuo;La sensibilità all'alcool varia molto da;individuo a individuo;"; ma il fatto che uno lo regga bene e un altro si ubriachi subito sembra dovuto anche ai suoi geni, in particolare al gene che comanda la produzione nel cervello di un enzima, la Fyn chinasi.";sg;PNPN;yes;distractor;_
individuo a individuo;no;a;individuo;Gli attacchi di panico - spiega Scapicchio - durano pochi minuti e la loro frequenza varia da;individuo a individuo;, ma la paura che si ripresentino invece non passa più.;sg;PNPN;yes;distractor;_
individuo a individuo;no;a;individuo;Alcune variabili, come temperatura dell'aria, appetito e livello di vigilanza oscillano durante il giorno da;individuo a individuo;.;sg;PNPN;yes;distractor;_
individuo a individuo;no;a;individuo;Tenete presente che il ritmo con cui si dimagrisce varia da;individuo a individuo;, a seconda di quanto peso dovete perdere.;sg;PNPN;yes;distractor;_
individuo a individuo;no;a;individuo;Zika è un virus che si trasmette da;individuo a individuo;principalmente attraverso un vettore: le zanzare di tipo Aedes.;sg;PNPN;yes;distractor;_
individuo ad individuo;no;a;individuo;Le percentuali su esposte variano lievemente da;individuo ad individuo;e la presenza quantitativa di determinate sottoclassi sembra essere in correlazione con la presenza di particolari allotipi delle catene H e L.;sg;PNPN;yes;distractor;_
isola a isola;no;a;isola;"Naturalmente tale ago risultò di enorme utilità per i naviganti; esso divenne praticamente indispensabile per la navigazione oceanica, anche se i polinesiani riuscirono ad attraversare il Pacifico da";isola a isola;senza bussola.;sg;PNPN;yes;distractor;_
isola a isola;no;a;isola;"Siamo isole in un mare di indifferenza, caro amico; e, da";isola a isola;, è gradito ricevere e rimandare un cenno di riconoscimento e di saluto.;sg;PNPN;yes;distractor;_
