NPN;construction;preposition;noun;context_pre;costr;context_post;number_of_noun;Type;other_cxn;meaning;syntactic_function
tedeschi a tedeschi;no;a;tedeschi;Un comando particolare, straniero, il comando del nemico, donde «Diktat», aveva vietato l'atteggiamento imperioso del comando militare di;tedeschi a tedeschi;.;sg;N_extended;no;distractor;_
termometro a termometro;no;a;termometro;Il tempo di misurazione di solito cambia da;termometro a termometro;, ma in genere la rilevazione per via rettale varia da uno a tre minuti.;sg;PNPN;yes;distractor;_
trave a trave;no;a;trave;Eccitate dalla gente, svolazzavano da;trave a trave;.;sg;PNPN;yes;distractor;_
volta a volta;no;a;volta;Insomma, da buon notaio, era come se protocollasse diverse deposizioni, testimonianze o confessioni da fornire poi agli avvocati per difendere cause a;volta a volta;diverse - talché aveva iniziato a designare questi suoi appunti come i Protocolli - e si guardava bene di mostrare tutto a padre Bergamaschi, perché per lui filtrava solo i testi di carattere più spiccatamente religioso.;sg;PNPN;yes;distractor;_
volta a volta;no;a;volta;"Fatto sta che Fellini lo piangiamo tutti senza eccezioni; e questo vale perfino per quelli che non l'hanno mai conosciuto se non attraverso i film: e si sono a";volta a volta;"identificati nella sposina ingenua di Lo sceicco bianco, nei Vitelloni annoiati e smargiassi, in Gelsomina vittima e Zampanò carnefice, nei bidonisti che coltivano l'arte di arrangiarsi, in Marcello che galleggia sull'onda dolcevitaiola o si confessa homo perplexus in 8 1\2; e in tantissimi altri personaggi.";sg;PNPN;yes;distractor;_
volta a volta;no;a;volta;Fare un bilancio non è facile: l'Istituto si è proposto iniziative che a;volta a volta;stimolino altri ricercatori alla conoscenza e allo studio del pensiero e dell'opera di Paolo VI.;sg;PNPN;yes;distractor;_
volta a volta;no;a;volta;Si presentò ai giovani lettori con una bella promessa: Questo vostro foglio, a;volta a volta;mattacchione, sereno, sentimentale e utile sempre, intende d'ora in poi giovare al vostro spirito senza essere punto noioso.;sg;PNPN;yes;distractor;_
volta a volta;no;a;volta;Che questo sia il significato delle disposizioni impugnate emerge nitidamente dalla loro lettera: dette disposizioni, difatti, intervenendo a;volta a volta;sull'art. 12 della legge regionale n. 25 del 2011, affiancano alla quantificazione del costo unitario del canone la potenza efficiente quale grandezza di riferimento il criterio, appunto attraverso cui determinare la potenza prodotta dall'impianto idroelettrico e calcolare il canone complessivo dovuto dal concessionario.;sg;PNPN;yes;distractor;_
zero a zero;no;a;zero;Tornando a casa ho acceso il Televideo e ho letto che la partita era finita, malinconicamente,;zero a zero;.;sg;NumPNum;no;distractor;_
zero a zero;no;a;zero;Un Milan con poche idee non va oltre lo;zero a zero;contro il Brescia.;sg;NumPNum;no;distractor;_
zero a zero;no;a;zero;Valzer dei cambi (si fa male anche Lima), Cassano tenta il colpaccio nel finale ma il risultato rimane sullo;zero a zero;.;sg;NumPNum;no;distractor;_
zero a zero;no;a;zero;Uno per uno, mo' che bravi, mo' che carini, mo'hanno anche evitato il prevedibile, squallido;zero a zero;facendosi un golletto a testa.;sg;NumPNum;no;distractor;_
zero a zero;no;a;zero;La capolista Inter fa un solo punto a Palermo:;zero a zero;e grave infortunio a Stankovic.;sg;NumPNum;no;distractor;_
zero a zero;no;a;zero;Assiepati in tribuna d'onore, concentrati su questo inchiodatissimo;zero a zero;che ci fa galleggiare in un limbo di noia e tensione a tutti e ottantamila spettatori quanti siamo, già da cinquantadue minuti di gioco giocato.;sg;NumPNum;no;distractor;_
zero a zero;no;a;zero;Il Genoa balbettante che aveva perso a Cesena e quello senza idee che si era fatto bloccare sullo;zero a zero;dalla Pro Piacenza sembra lontani anni luce.;sg;NumPNum;no;distractor;_
zero a zero;no;a;zero;Così semmai dopo diceva che si doveva ricominciare da;zero a zero;.;sg;NumPNum;no;distractor;_
zero a zero;no;a;zero;La partita era inchiodata sullo;zero a zero;.;sg;NumPNum;no;distractor;_
zero a zero;no;a;zero;Il primo tempo è finito;zero a zero;.;sg;NumPNum;no;distractor;_
zero a zero;no;a;zero;A quell'epoca questo era rivoluzionario e cominciammo a pareggiare;zero a zero;con i migliori e con i peggiori.;sg;NumPNum;no;distractor;_
zero a zero;no;a;zero;Un goal, poi un altro, oppure uno;zero a zero;, senza però che permettessi a me stesso di chiudere gli occhi su alcunché, compresi i fantasmi e le creazioni della mia mente.;sg;NumPNum;no;distractor;_
zero a zero;no;a;zero;Ronaldo ha sbagliato un calcio di rigore quando la partita era ancora sullo;zero a zero;, ma pochi minuti dopo si è fatto perdonare l'errore portando in vantaggio i nerazzurri su un'azione nata da un calcio di punizione.;sg;NumPNum;no;distractor;_
zero a zero;no;a;zero;Grande attesa, 8.000 tifosi ieri all'allenamento Parigi val bene un'Italia da;zero a zero;.;sg;NumPNum;no;distractor;_
zero a zero;no;a;zero;Se ciò risulterà vero, ci troveremo di fronte ad un'inestricabile coincidenza: due squadre che non si attaccano perché convinte della parziale utilità dello;zero a zero;.;sg;NumPNum;no;distractor;_
zero a zero;no;a;zero;Non solo il pareggio in campionato con il Piacenza, ma anche uno striminzito;zero a zero;con la Reggiana in coppa Italia.;sg;NumPNum;no;distractor;_
zero a zero;no;a;zero;Ora ancora in Germania si riparte quasi da;zero a zero;.;sg;NumPNum;no;distractor;_
zero a zero;no;a;zero;"Professa inoltre antipatia per certi traslati volenterosamente spiritosi, come ""risultato occhiali"" per intendere una partita finita sullo";zero a zero;.;sg;NumPNum;no;distractor;_
zero a zero;no;a;zero;Noi dobbiamo fare finta che si parta dallo;zero a zero;.;sg;NumPNum;no;distractor;_
zero a zero;no;a;zero;Il 26 settembre 1973 Caszely gioca contro l'URSS allo Stadio Lenin di Mosca e la partita finisce;zero a zero;.;sg;NumPNum;no;distractor;_
zero a zero;no;a;zero;Nell'intervallo, con il risultato sullo;zero a zero;, negli spogliatoi Tommaso da vero leader cominciò a dare indicazioni, consigli, e non si risparmiava nei rimproveri.;sg;NumPNum;no;distractor;_
zero a zero;no;a;zero;Nino Malandrino quel 29 aprile era stato l'eroe del giorno, parando un rigore sullo;zero a zero;.;sg;NumPNum;no;distractor;_
zero a zero;no;a;zero;Il risultato non si sbloccava e si era sempre sullo;zero a zero;.;sg;NumPNum;no;distractor;_
carta su carta;no;su;carta;E poi c'è lo spariglio, una variante della presa di;carta su carta;uguale.;sg;thematic_target;no;distractor;_
ferro su ferro;no;su;ferro;Il valore del coefficiente di a. volvente del;ferro su ferro;"è per es. 0,005; quello radente, 0,21; l' a. volvente della gomma su strada, 0,02; quello radente, 0,07.";sg;N_extended;no;distractor;_
sasso su sasso;no;su;sasso;Il signor Sandro scuote la testa, si infila le mani in tasca e si piega a guardare la pietra, il disegno fatto a colpi di;sasso su sasso;, poi i piedi, le mani, gli occhi tondi lassù che rispondono allo sguardo.;sg;thematic_target;no;distractor;_
sedia su sedia;no;su;sedia;Le ragioni della priorità psicologica di, per esempio,;sedia su sedia;"a dondolo o mobilio sono percettive e morfologiche (percepiamo una sedia come una gestalt unitaria più facilmente del mobilio; associamo più facilmente un’immagine al livello base che agli altri), funzionali (abbiamo un programma motorio generale per interagire con le sedie, ma non con il mobilio), linguistiche e comunicative (il livello base contiene in media più attributi e dà più informazioni degli altri), di apprendimento (i bambini imparano prima i termini del livello base; inoltre spesso i termini del livello base sono più brevi e meno complessi degli altri).";sg;N_extended;no;distractor;_
bambini su bambini;no;su;bambino;Come impone la legge, nei casi di espianti di;bambini su bambini;di età inferiore a 5 anni, prima di procedere si sono dovute attendere le 24 ore richieste.;pl;N_extended;no;distractor;_
bambini su bambini;no;su;bambino;All'inizio della settimana ho scritto un articolo circa le recenti notizie provenienti dal Kansas sui tassi di violenze sessuali di;bambini su bambini;, aumentate bruscamente...anche la polizia del Regno Unito ha segnalato questa tendenza (40.000 segnalazioni in un paio di anni)…;pl;thematic_target;no;distractor;_
vacche su vacche;no;su;vacca;È suo il conio del palidromo accavallavacca (strumento per caricare;vacche su vacche;", o vacche su cavalli; vedi anche alle voci lavacavalli e vacca).";pl;thematic_target;no;distractor;_
50 su 50;no;su;50;Fatta la prova di mercoledì, la domenica uscivano i risultati che dichiaravano che io avevo preso un punteggio di;50 su 50;!!!!! classificandomi primo insieme ad altri ventisette.;X;NumPNum;no;distractor;_
10 su 10;no;su;10;"E mentre Berlusconi si assegna un """;10 su 10;""", "" gli analisti affermano che il governo ha sprecato il suo primo anno "".";X;NumPNum;no;distractor;_
10 su 10;no;su;10;Vorrei che ogni italiano, o almeno 8 su 10 sappiano cosa sia la Milano Sanremo, se;10 su 10;sanno cosa è il Giro.;X;NumPNum;no;distractor;_
11 su 11;no;su;11;Da ricordare la prestazione contro il Belgio allorchè ne ha effettuate;11 su 11;tiri nello specchio della porta degli avversari.;X;NumPNum;no;distractor;_
110 su 110;no;su;110;Luciano Fonzi esprime il seguente giudizio: Laureato in Scienze Biologiche presso la Università di Siena nel 1969 con;110 su 110;e lode.;X;NumPNum;no;distractor;_
119 su 119;no;su;119;Attivate al 100 % le procedure di bonifica per i siti inquinati a breve termine, in tutto;119 su 119;, e al 58 % quelle per i 146 siti a medio termine, mentre per i 60 siti di piano definiti ' in approfondimentò (considerati a medio termine nell' attesa della definitiva classificazione nell' ambito dell' approvazione dei Piani Provinciali), tale percentuale scende al 32 %.;X;NumPNum;no;distractor;_
19 su 19;no;su;19;A Lecco si è registrato una adesione del 100 per cento (hanno scioperato;19 su 19;) così come al tribunale di sorveglianza di Milano (9 su 9).;X;NumPNum;no;distractor;_
19 su 19;no;su;19;L' Inter respira: allarme rientrato sullo stop di Vieri Vuelta, un danese vola sui Pirenei Frigo 4 ° in classifica Rugby, radiata squadra rumena: positivi;19 su 19;Maradona-doping, Boniek conferma.;X;NumPNum;no;distractor;_
22 su 22;no;su;22;In tempi più recenti, nel giugno scorso,;22 su 22;attentati sono abortiti.;X;NumPNum;no;distractor;_
22 su 22;no;su;22;"Nell' opposizione, tra i socialisti 90 hanno votato a favore mentre 56 si sono astenuti; nel gruppo dei repubblicani e socialisti, invece, i voti contrari sono stati";22 su 22;iscritti.;X;NumPNum;no;distractor;_
4 su 4;no;su;4;Varese ha cercato di resistere con orgoglio, trovando pero' troppo tardi la classe di Meneghin (6 su 11 al tiro e;4 su 4;dalla lunetta), mentre Petruska (4 su 8 e 12 rimbalzi), dopo un felicissimo primo tempo, e' via via scomparso di scena.;X;NumPNum;no;distractor;_
4 su 4;no;su;4;Il suo score recita un;4 su 4;dalla grande distanza e 13 punti nei 13 minuti decisivi per affossare definitivamente la Scavolini.;X;NumPNum;no;distractor;_
4 su 4;no;su;4;Dopo gara 4 i Knicks avranno degli incubi formato Kenyon Martin per tutta l' estate: altra doppia doppia (4;4 su 4;partite), ma quasta volta i punti sono 36.;X;NumPNum;no;distractor;_
4 su 4;no;su;4;Nonostante un opaco Sandro Cherubini (solo 4 i punti del centro della Nazionale italiana), Sassari ha potuto contare su un infallibile Caine dalla lunga distanza (;4 su 4;dalla linea dei 3 punti e 22 i punti totali del britannico) e sui punti di Eveson (25) e Kohlstrom (16), dominatori della lunetta.;X;NumPNum;no;distractor;_
4 su 4;no;su;4;Qualche spunto solo quando Messina gli ha mandato sopra Morlende. </s><s> Chiude la gara con 6 su 13 al tiro con;4 su 4;nei liberi.;X;NumPNum;no;distractor;_
4 su 4;no;su;4;Risultato, al ritorno dopo l' operazione estiva,;4 su 4;da dove conta tre.;X;NumPNum;no;distractor;_
4 su 4;no;su;4;La regione meno virtuosa è risultata la Sardegna, dove il 100% delle province (;4 su 4;) supera i 60 giorni d' attesa (con Oristano e Cagliari in grado di fornire la prestazione non prima di 4 mesi).;X;NumPNum;no;distractor;_
4 su 4;no;su;4;Con quella di oggi, sono;4 su 4;le vittorie di Prada nei testa a testa con l'imbarcazione della bionda Dawn Riley: anche se nelle previsioni, il successo era oggi tutt'altro che scontato.;X;NumPNum;no;distractor;_
4 su 4;no;su;4;Raccoglie punti solamente nei tiri liberi (;4 su 4;) perché la soluzione dalla distanza sembra non baciarlo più, anche in gare facili come questa: su 4 da tre.;X;NumPNum;no;distractor;_
54 su 54;no;su;54;La formazione pugliese è, assieme al Torino, la squadra che ha usufruito fino a questo momento di tutti i cambi disponibili;54 su 54;.;X;NumPNum;no;distractor;_
6 su 6;no;su;6;Osimo ha totalizzato 10 su 10 per quel che concerne i contenuti,;6 su 6;per la programmazione, 6 su 7 per l' originalità e 6 su 7 per la grafica.;X;NumPNum;no;distractor;_
6 su 6;no;su;6;Utilizzarono questa possibilità soprattutto le femmine (;6 su 6;), ma anche alcuni maschi (4 su 12), quindi nel complesso poco più del 50 % della classe.;X;NumPNum;no;distractor;_
6 su 6;no;su;6;Sarà ricordata come la stagione del;6 su 6;: l' intera pallavolo bellunese è retrocessa.;X;NumPNum;no;distractor;_
6 su 6;no;su;6;No perchè 7 su 9 di jones non è che succede sempre, considerando anche il fatto che fino ad un certo punto era;6 su 6;.;X;NumPNum;no;distractor;_
37 su 37;no;su;37;Nella votazione delle due di notte eravamo;37 su 37;e alla fine è scoppiato un applauso.;X;NumPNum;no;distractor;_
61 su 61;no;su;61;L'ha data già il caso Fiat, bisogna insistere per eliminare anche la mafia, artefice del successo del polo con i;61 su 61;.;X;NumPNum;no;distractor;_
61 su 61;no;su;61;Lasciamo la presidenza dell' assemblea e sentiamo il nuovo presidente della giunta che in Sicilia si è portato a casa tutti i seggi,;61 su 61;.;X;NumPNum;no;distractor;_
61 su 61;no;su;61;Certo le ultime elezioni europee hanno segnato una sconfitta di Berlusconi, il cappotto del;61 su 61;(i seggi del parlamento regionale conquistati dalla destra nelle ultime amministrative) appartiene alla memoria del passato.;X;NumPNum;no;distractor;_
9 su 9;no;su;9;A Lecco si è registrato una adesione del 100 per cento (hanno scioperato 19 su 19) così come al tribunale di sorveglianza di Milano (;9 su 9;).;X;NumPNum;no;distractor;_
90 su 90;no;su;90;Una volta fatto il gruppo (non esagerare con le unita' di supporto tanto, tra quelle in difesa e quelle prodotte sarai quasi a;90 su 90;) prendi la strada in alto a destra.;X;NumPNum;no;distractor;_
uomini su uomini;no;su;uomo;Un crimine non certo benedetto da un Dio, ma fatto da;uomini su uomini;(l' orrore, vedi 1945).;pl;thematic_target;no;distractor;_
uomini su uomini;no;su;uomo;Perché ogni governo è di;uomini su uomini;.;pl;thematic_target;no;distractor;_
uomini su uomini;no;su;uomo; Questa domanda non si può respingere con la speranza che allora tutto andrebbe di per sè, che le cose si regolerebbero da sole, che un governo di;uomini su uomini;sarebbe divenuto superfluo, perchè gli uomini allora sarebbero assolutamente liberi.;pl;thematic_target;no;distractor;_
uomini su uomini;no;su;uomo;Per un verso, infatti, essa esclude qualsiasi analogia mimetica tra la sovranità di Dio e la sovranità di;uomini su uomini;(significato politico-critico dell'immagine trinitaria di Dio).;pl;thematic_target;no;distractor;_
uomini su uomini;no;su;uomo;Ne restasse fuori anche uno solo, anche una sola testa, su cosa potrebbe mai fondarsi una nazione se non sul dominio di;uomini su uomini;?;pl;thematic_target;no;distractor;_
uomini su uomini;no;su;uomo;Dall'inizio degli anni Novanta è diminuito il numero di omicidi di;uomini su uomini;"mentre il numero di donne uccise da uomini è aumentato: l'intensità e il grado di diffusione di episodi di violenza e abuso nei confronti delle donne sono tali da aver suggerito il conio del termine ""femminicidio"".";pl;thematic_target;no;distractor;_
uomini su uomini;no;su;uomo;"Come sottolineavano i compagni tedeschi delle Cellule Rivoluzionarie: ""Noi crediamo che la guerra totale contro il sistema di dominio di";uomini su uomini;acchiuda in se stessa contemporaneamente e in egual misura la lotta contro il sistema capitalistico che è in noi stessi.;pl;thematic_target;no;distractor;_
uomini su uomini;no;su;uomo;C'è anche la violenza di;uomini su uomini;, donne contro le donne, adulti su bambini, giovani contro anziani e via di questo passo.;pl;thematic_target;no;distractor;_
uomini su uomini;no;su;uomo;"Nella famosa conferenza del 1919 su ""La politica come professione"", Max Weber disse: ""Lo Stato è, come le associazioni politiche che storicamente lo precedono, un rapporto di dominio di";uomini su uomini;basato sul mezzo della forza legittima (cioè considerata legittima).;pl;thematic_target;no;distractor;_
uomini su uomini;no;su;uomo;"Lo stato è così dunque ""un rapporto di potere di";uomini su uomini;", fondato sul mezzo dell'uso della forza legittima"" (si veda ""Economia e Società"", Milano 1961).";pl;thematic_target;no;distractor;_
uomini su uomini;no;su;uomo;Sono sempre segno di un'ingiustizia regnante, di oppressione di;uomini su uomini;.;pl;thematic_target;no;distractor;_
uomini su uomini;no;su;uomo;E quanto andiamo studiando ci insegna che le società organizzate, precedenti a quelle classiste, precedenti quindi alla comparsa della schiavitù e di ogni sfruttamento di;uomini su uomini;, accumulavano una straordinaria quantità di energia e l'applicavano alla modifica dell'ambiente (edifici monumentali, infrastrutture, produzione materiale) senza spezzarne l'equilibrio.;pl;thematic_target;no;distractor;_
uomini su uomini;no;su;uomo;Quindi, anche nel fumetto Bonelli, come in Berserk, ci sono scene di violenza sessuale verso i protagonisti minorenni, o di violenza sessuale di;uomini su uomini;"(le ho elencate entrambe perchè non sapevo cosa consideravi più ""forte"" nella scena di Berserk).";pl;thematic_target;no;distractor;_
giornalisti su giornalisti;no;su;giornalista;Torna l' estate, tornano puntuali come le zanzare i libri di; giornalisti su giornalisti;e con la calura tornano a scoppiare anche le polemiche tra gli anchormen di casa Mediaset, in primis quella tra Emilio Fede ed Enrico Mentana.;pl;thematic_target;no;distractor;_
seta su seta;no;su;seta;Inizia così una ricca produzione di arazzi ricamati in;seta su seta;o in lana si juta o su tela.;sg;thematic_target;no;distractor;_
ASCO su ASCO;no;su;ASCO;Ulteriori informazioni Per ulteriori informazioni, vedi il meeting virtuale di;ASCO su ASCO;OnLine (www.asco.org), che contiene tutti gli abstract degli studi presentati alla conferenza.;X;proper_name_inglobation;no;distractor;_
 Vichy su Vichy;no;su;Vichy;Citazione: si esattamente erano collaborazionisti esattamente come tutta la repubblica;Vichy su Vichy;non ci piove, ma sulle SS permettimi di dissentire per due motivi: - arruolamento volontario - giuramento di fedeltà al fuhrer e allla causa nazional-socialista - iniziazione mistica.;X;N_extended;no;distractor;_
satellite su satellite;no;su;satellite;Accesso ad alta velocità al Backbone Internet Europeo e connettività a banda larga, utilizzando tecnologia satellitare bidirezionale mediante canale di comunicazione bidirezionale via;satellite su satellite;geostazionario opportunamente posizionato, e connessione via fibra al Backbone Internet Europeo, con relativa manutenzione ed assistenza tecnica.;sg;N_extended;no;distractor;_
grigio su grigio;no;su;grigio;Innanzitutto, sono stati introdotti nuovi colori per la plancia bicolore;grigio su grigio;e blu su grigio.;sg;thematic_target;no;distractor;_
numero su numero;no;su;numero;È possibile cancellare simultaneamente la programmazione dei servizi prenotazione, deviazione; numero su numero;interno, deviazione su numero esterno e non disturbare.;sg;N_extended;no;distractor;_
ruota su ruota;no;su;ruota;DEFINIZIONE: l' attrito volvente (a) è la forza che si sviluppa fra due solidi a contatto in moto rotatorio relativo senza strisciamento (;ruota su ruota;o ruota su strada).;sg;thematic_target;no;distractor;_
Christine su Christine;no;su;Christine;"Nel 1969 anche i Nomadi si dedicano al ""trans"", cantano";Christine su Christine;Jorgensen, una transessuale famosa dal 1952, fotografa, attrice e cantante.;X;proper_name_inglobation;no;distractor;_
TV su TV;no;su;TV;Tutta la cerimonia finale verrá trasmessa in diretta;TV su TV;3 dalle 18.40 alle 20.15 e su TV 1 e TV 2 dalle 19.30 alle 20.00.;sg;proper_name_inglobation;no;distractor;_
uomo su uomo;no;su;uomo;"Il problema del potere si ripresenta qui; il potere d'";uomo su uomo;.;sg;thematic_target;no;distractor;_
uomo su uomo;no;su;uomo;Con lo spargimento di sangue innocente (sopruso di;uomo su uomo;) che ne consegue.;sg;thematic_target;no;distractor;_
uomo su uomo;no;su;uomo;Il sistema odioso di sfruttamento di;uomo su uomo;.;sg;thematic_target;no;distractor;_
uomo su uomo;no;su;uomo;cioè quando si abolirà non solo il concetto di proprieta' di;uomo su uomo;(schiavitu') ma anche quello di SERVITU' di uomo su uomo (noleggio, prostituzione, o come chiamo io, SERVIZIONE).;sg;thematic_target;no;distractor;_
uomo su uomo;no;su;uomo;cioè quando si abolirà non solo il concetto di proprieta' di uomo su uomo (schiavitu') ma anche quello di SERVITU' di;uomo su uomo;(noleggio, prostituzione, o come chiamo io, SERVIZIONE).;sg;thematic_target;no;distractor;_
Guccini su Guccini;no;su;Guccini;Forse il fatto d'essere un lavoro di;Guccini su Guccini;, la possibilità di curiosare nell'armadio dei sogni e dei ricordi, mettendoci a disposizione fin dalla copertina la foto di famiglia del bisnonno che gli ha dato il nome (e sul retro, ma non cercatela nel booklet del cd, un'austera immagine della sua,;X;thematic_target;no;distractor;_
Fede su Fede;no;su;Fede;La Dottrina della Chiesa, la Nota della Congregazione per la Dottrina della;Fede su Fede;e Politica, l' introduzione a questa di ... ;sg;proper_name_inglobation;no;distractor;_
facebook su facebook;no;su;Facebook;io ho creato una pagina di;facebook su facebook;appunto, ma mi rendo conto che non serve a niente perchè nessuno ne sa l'esistenza, quindi non pubblicizzo niente.;X;thematic_target;no;distractor;_
app su app;no;su;app;Per quanto riguarda la connessione mobile, 3g o 4g, le cose sono più complesse perché apple non permette di farlo nativamente, né naturalmente permette la presenza di;app su app;store che lo facciano per noi.;sg/pl;proper_name_inglobation;no;distractor;_
Arezzo su Arezzo;no;su;Arezzo;La posizione del Comune di;Arezzo su Arezzo;Fiere è chiarissima.;X;proper_name_inglobation;no;distractor;_
base su base;no;su;base;Agenzia Nazionale per la Ricerca (ANR), creata nel 2007 per finanziare progetti di ricerca di;base su base;competitiva.;sg;N_extended;no;distractor;_
base su base;no;su;base;La Commissione può ora rimborsare spese generali di;base su base;forfetaria o versare importi forfetari per piccoli progetti - di gruppi vulnerabili, per esempio.;sg;N_extended;no;distractor;_
base su base;no;su;base;Nella vita di tutti i giorni un lavaggio di;base su base;mensile è sufficiente.;sg;N_extended;no;distractor;_
base su base;no;su;base;La povertà mestruale - la lotta per pagare i prodotti sanitari di;base su base;mensile - è aumentata durante la pandemia di coronavirus , secondo le associazioni di beneficenza.;sg;N_extended;no;distractor;_
Camerino su Camerino;no;su;Camerino;Interventi Regione ed Università di;Camerino su Camerino;.;X;proper_name_inglobation;no;distractor;_
capelli su capelli;no;su;capello;Quindi, ad esempio, lo stesso taglio di;capelli su capelli;lisci e ricci apparirà completamente diverso. pertanto quando scegli un taglio di capelli, oltre al tipo di viso, considera anche il tipo di capelli.;pl;N_extended;no;distractor;_
dati su dati;no;su;dato;Una elaborazione fatta da un analista di;dati su dati;Istat dal due mila undici al due mila sedici.;pl;N_extended;no;distractor;_
Sciascia su Sciascia;no;su;Sciascia;Ha curato l'edizione del Quaderno dell'Associazione Amici di;Sciascia su Sciascia;eretico del genere giallo (La vita felice, 2006) e la prefazione dell'edizione italiana de Il controllo della parola di André Schiffrin (Bollati Boringhieri, 2006).;X;proper_name_inglobation;no;distractor;_
strada su strada;no;su;strada;In tal modo l'aquaplaning viene scongiurato e la tenuta di;strada su strada;bagnata e innevata è ottimale.;sg;N_extended;no;distractor;_
Venere su Venere;no;su;Venere;E i transiti che mi aspettano di ;Venere su Venere;e Saturno e poi di Urano su Marte, posso considerarli buoni per la mia situazione sentimentale?;X;N_extended;no;distractor;_
volume su volume;no;su;volume;Questo è un semplice lettore con play pausa avanti indietro;volume su volume;giù.;sg;NsuNgiù;yes;distractor;_
periodi su periodi;no;su;periodo;Tornando al banco,devo dire che i suoi dischi li amo tuttora,certo hanno avuto;periodi su periodi;ma son sempre stati più che dignitosi.;pl;NsuNgiù;yes;distractor;_
km su km;no;su;km;e non può che migliorare col tempo, poi;km su km;giù porto pazienza.;sg/pl;NsuNgiù;yes;distractor;_
