NPN;construction;preposition;noun;context_pre;costr;context_post;number_of_noun;Type;other_cxn;meaning;syntactic_function
cambiali su cambiali;yes;su;cambiale;Mario viveva lì da tanto tempo, aveva comprato quell'appartamento firmando;cambiali su cambiali;per anni, perchè doveva essere così, il matrimonio si sa impone questo tipo di sacrifici.;pl;_;_;greater_plurality/accumulation;nominal
cazzate su cazzate;yes;su;cazzata;Mi aspetto che si metta a ridere come un pazzo e che poi ricominci a frullare;cazzate su cazzate;.;pl;_;_;greater_plurality/accumulation;nominal
colpo su colpo;yes;su;colpo;"Lavorò tutta la mattina, scavando la pietra con il suo scalpello;";colpo su colpo;, poi stanco, si distese sulle stoppie, vicinoal suo cane accovacciato, che nel sonno bizzarro inseguiva chissà quale preda, emettendo guaiti di cucciolo.;sg;_;_;succession/iteration/distributivity;modifier
colpo su colpo;yes;su;colpo;Il Lecce metteva subito sotto pressione il Toro che non si lasciava intimidire e ribatteva;colpo su colpo;.;sg;_;_;succession/iteration/distributivity;modifier
colpo su colpo;yes;su;colpo;Maranghi, con l'arroganza che molti gli rimproverano, ha risposto;colpo su colpo;, rinfacciando alla fine quella che, secondo lui, è stata la più grave colpa del giovane direttore centrale: l'aver a suo tempo escluso che la Consob avrebbe obbligato Mediobanca a fare un'opa sull'ex gruppo Ferruzzi, come invece avvenne, costringendo l'istituto a un esborso di oltre 200 miliardi.;sg;_;_;succession/iteration/distributivity;modifier
colpo su colpo;yes;su;colpo;Il sole d'inizio primavera era alto e già piuttosto caldo e i ragazzi ansimavano apparentemente stremati, ma continuavano a scontrarsi con crescente impeto stringendo i denti, rispondendo;colpo su colpo;e urtandosi con gli scudi con tutta la forza residua delle membra.;sg;_;_;succession/iteration/distributivity;modifier
colpo su colpo;yes;su;colpo;"Ma ora che il presidente Hugo Chavez ha chiesto ai suoi di rispondere """;colpo su colpo;"alle provocazioni dei senzapatria"", quella delle pentole è diventata una piccola guerra che si estende per tutta la capitale venezuelana.";sg;_;_;succession/iteration/distributivity;modifier
colpo su colpo;yes;su;colpo;Se la reazione - peraltro incerta - dell'azionariato Ina fosse un rilancio sulla stessa Ina, poco male: ci si confronterebbe;colpo su colpo;di fronte al mercato.;sg;_;_;succession/iteration/distributivity;modifier
colpo su colpo;yes;su;colpo;L'intesa con Carnival fornisce inoltre a Fincantieri l'opportunità per ribattere davvero;colpo su colpo;la concorrenza dell'altro grande cantiere specializzato in navi passeggeri, il finlandese Masa Yard che recentemente si è aggiudicato un megacontratto della Royal Caribbean cruise line (Rccl) per la costruzione di due unità da 130mila tonnellate destinate a strappare proprio alle Carnival della serie Destiny il primato delle più grandi navi passeggeri del mondo.;sg;_;_;succession/iteration/distributivity;modifier
colpo su colpo;yes;su;colpo;"Non rivolgerti con tono sferzante ad alcuno coloro ai quali ti rivolgerai in questo modo ti potrebbero rispondere nello stesso modo: le ingiurie sono dolorose;";colpo su colpo;, esse ricadranno sopra di te.;sg;_;_;succession/iteration/distributivity;modifier
colpo su colpo;yes;su;colpo;Ma Micheli si infervora, nega, ribatte;colpo su colpo;.;sg;_;_;succession/iteration/distributivity;modifier
colpo su colpo;yes;su;colpo;Diviso tra la sua anima pragmatica legata a Yassin e quella oltranzista del pediatra Rantisi, il gruppo, con profondi contatti col cosiddetto fronte delle carceri, replica alle ritorsioni israeliane;colpo su colpo;senza disdegnare quando necessario la ritirata strategica, la tregua, in vista di una razionalizzazione delle proprie forze.;sg;_;_;succession/iteration/distributivity;modifier
colpo su colpo;yes;su;colpo;Carafa no, preferiva abbandonare i protestanti al loro destino piuttosto che concedere anche una piccola incrinatura dell'autorità assoluta della Chiesa: occorreva ribattere ai luterani;colpo su colpo;, fare pulizia al proprio interno e dotarsi di apparati nuovi che raccogliessero la sfida.;sg;_;_;succession/iteration/distributivity;modifier
colpo su colpo;yes;su;colpo;Sentiva quella sconfitta comese l'avesse subita personalmente, e la formidabile capacità di Memnone di restituire;colpo su colpo;e con forza spaventosa lo umiliava duramente e gli faceva provare per la prima volta in vita sua un frustrante senso d'impotenza e di profonda solitudine.;sg;_;_;greater_plurality/accumulation;nominal
colpo su colpo;yes;su;colpo;Ma Giuseppe Stefanel, Bepi per gli amici, 44 anni, presidente e amministratore del gruppo di Ponte di Piave, non ci sta a passare per vittima sacrificale: rintuzza;colpo su colpo;gli attacchi, e annuncia che il secondo semestre '96 si chiuderà con un piccolo utile, dopo che al giro di boa dei primi sei mesi dell'anno il passivo segnava 19 miliardi.;sg;_;_;succession/iteration/distributivity;modifier
colpo su colpo;yes;su;colpo;Ma in questo campo gli americani sono in grado di ribattere;colpo su colpo;: Chevrolet risponde con una cult car, la Corvette.;sg;_;_;succession/iteration/distributivity;modifier
colpo su colpo;yes;su;colpo;Più adulto e più esperto di lui, era sempre riuscito a tenergli testa, a rispondere;colpo su colpo;o addirittura a prevenire le sue mosse.;sg;_;_;succession/iteration/distributivity;modifier
colpo su colpo;yes;su;colpo;Il nostro compito è restare vigili e rispondere;colpo su colpo;.;sg;_;_;succession/iteration/distributivity;modifier
colpo su colpo;yes;su;colpo;Entrambe le compagini si sono affrontate a viso aperto rispondendo;colpo su colpo;a qualasisi iniziativa opposta, esibendo in certi frangenti anche giocate di buona tecnica.;sg;_;_;succession/iteration/distributivity;modifier
colpo su colpo;yes;su;colpo;All'Arechi gli uomini di Beretta hanno dovuto fare i conti con una Salernitana mai doma, pronta a ribattere;colpo su colpo;agli affondi dei più blasonati avversari.;sg;_;_;succession/iteration/distributivity;modifier
colpo su colpo;yes;su;colpo;"Tutto improvvisamente, intorno a quel ripiano, era tornato coerente con il tradizionale menage familiare della famiglia Masina; Manlio col suo slang condito di parolacce, Giorgio col suo rispondere";colpo su colpo;a tutte le provocazioni esterne, Cinzia con la sua puntuale abilità di organizzatrice familiare, Valentina con la sua svogliata partecipazione alla conduzione domestica e Noel con la sua serena e coccolata presenza, tanto cara a tutti.;sg;_;_;succession/iteration/distributivity;modifier
colpo su colpo;yes;su;colpo;Dopo aver speso una intera vita a fondarla e a cercare di farla funzionare, alla fine è stato lui stesso,;colpo su colpo;, a estinguerla.;sg;_;_;succession/iteration/distributivity;modifier
colpo su colpo;yes;su;colpo;Da dove trar fuori l'energia pietosa per combattere quel dolore, per rispondergli;colpo su colpo;, per non lasciarlo dilagare nel mondo con la sua forza annientatrice?;sg;_;_;succession/iteration/distributivity;modifier
colpo su colpo;yes;su;colpo;I locali hanno comunque retto la botta almeno per i 40 minuti iniziali, controbattendo;colpo su colpo;, anzi pressando in tutte le parti del campo.;sg;_;_;succession/iteration/distributivity;modifier
colpo su colpo;yes;su;colpo;Solo gli Immortali restarono sul posto, si chiusero a quadrato e continuarono a respingere gli assalti nemici rispondendo;colpo su colpo;.;sg;_;_;succession/iteration/distributivity;modifier
colpo su colpo;yes;su;colpo;Che non consiste nel ribattere;colpo su colpo;alle battute dell'antipolitica nei salotti televisivi, ma nel rispondere alle domande della società.;sg;_;_;succession/iteration/distributivity;modifier
colpo su colpo;yes;su;colpo;La strada, però, con una durezza che si ripercoteva fino all'inguine, mi restituiva;colpo su colpo;.;sg;_;_;greater_plurality/accumulation;nominal
colpo su colpo;yes;su;colpo;Aspetto solo una parola per reagire;colpo su colpo;al primo segnale.;sg;_;_;succession/iteration/distributivity;modifier
colpo su colpo;yes;su;colpo;Jack Hyde mi fa domande spiazzanti e intelligenti, ma io non mi faccio cogliere impreparata: rispondo;colpo su colpo;e, quando discutiamo delle mie letture preferite, credo di cavarmela bene.;sg;_;_;succession/iteration/distributivity;modifier
colpo su colpo;yes;su;colpo;Ma Rambo non ci sta, Rambo combatte, lui resta in forma e risponde all'attacco;colpo su colpo;, prendendo la natura a calci nel culo e spaccando il muso alla società.;sg;_;_;succession/iteration/distributivity;modifier
colpo su colpo;yes;su;colpo;Proprio la dote che l'aveva sorretta durante il primo tempo, consentendole di reggere il ritmo - non forsennato - degli avversari ai quali aveva restituito;colpo su colpo;.;sg;_;_;greater_plurality/accumulation;nominal
colpo su colpo;yes;su;colpo;Katoh ha immediatamente risposto, ma Melandri ha reagito;colpo su colpo;.;sg;_;_;succession/iteration/distributivity;modifier
conti su conti;yes;su;conto;"Mentre riaccompagnava Eco in auto in centro, Pete disse: ""Continuo a fare";conti su conti;", sai, mi sembra di essere un cane che si morde la coda"".";pl;_;_;greater_plurality/accumulation;nominal
controlli su controlli;yes;su;controllo;Strade bloccate, frontiere minate, posti di blocco volanti,;controlli su controlli;, ormai il Kosovo è solo questo.;pl;_;_;greater_plurality/accumulation;nominal
crosta su crosta;yes;su;crosta;Dall'alto del Forte capisco il rinnovo degli strati successivi,;crosta su crosta;.;sg;_;_;succession/iteration/distributivity;modifier
dichiarazioni su dichiarazioni;yes;su;dichiarazione;Da dieci giorni stiamo dicendo in tutte le sedi che bisognava intervenire: si è perduto tempo a discutere, a prendere contatti diplomatici, a fare riunioni su riunioni,;dichiarazioni su dichiarazioni;, mentre la tragedia albanese richiedeva interventi rapidi, decisi, organici, massicci.;pl;_;_;greater_plurality/accumulation;nominal
docce su docce;yes;su;doccia;Cioè: quando passavo davanti al monitor si accendevano tutte le lampadine, e questo significa che dovevo fare;docce su docce;": per ""purificarmi"".";pl;_;_;greater_plurality/accumulation;nominal
dolori su dolori;yes;su;dolore;E dietro a quello, molti altri ricordi rossi, indicibili, segreti, sepolti da anni di uso di mondo, errori, matrimoni, figlie, partenze, musica, abbandoni, gioielli, amanti, dolori, e;dolori su dolori;su dolori per mimetizzare il padre di tutti i dolori.;pl;_;_;greater_plurality/accumulation;nominal
dolori su dolori;yes;su;dolore;E dietro a quello, molti altri ricordi rossi, indicibili, segreti, sepolti da anni di uso di mondo, errori, matrimoni, figlie, partenze, musica, abbandoni, gioielli, amanti, dolori, e dolori su;dolori su dolori;per mimetizzare il padre di tutti i dolori.;pl;_;_;greater_plurality/accumulation;nominal
file su file;yes;su;file;I lievi raggi di sole forniscono la sola illuminazione disponibile e, quando i miei occhi si adattano, distinguo;file su file;di feriti, nelle brande, sui pagliericci, sul pavimento, perché sono in tanti a contendersi lo spazio.;pl;_;_;greater_plurality/accumulation;nominal
file su file;yes;su;file;Il salotto era ampio e le pareti, nelle quali erano incassate;file su file;"di scaffali laccati di nero, erano tappezzate di una stoffa damascata in cui il nero prevaleva sul rosso; divano e poltrone erano rivestiti dello stesso tessuto delle pareti e i tappeti armonizzavano con il resto dell'arredamento";pl;_;_;greater_plurality/accumulation;nominal
file su file;yes;su;file;E d'improvviso ci sembrò di vedere;file su file;di formiche del miele col corpo striato e luccicante, che nelle loro celle sotto le radici del mulga traboccavano di nettare.;pl;_;_;greater_plurality/accumulation;nominal
frase su frase;yes;su;frase;Il racconto che brandello su brandello,;frase su frase;, strappavo ai miei ricordi, come un cancro luminoso divorava la mia vita.;sg;_;_;succession/iteration/distributivity;modifier
granellino su granellino;yes;su;granellino;E non meno sorprendente è la tecnica costruttiva della formica - bussola australiana (Amitermes meridionalis) i cui operai ciechi sanno deporre il materiale edilizio,;granellino su granellino;, in modo tale che il risultato sia un nido cuneiforme con l'asse maggiore orientato rigorosamente in direzione Nord - Sud.;sg;_;_;succession/iteration/distributivity;modifier
imprecazioni su imprecazioni;yes;su;imprecazione;"È un segno di gratitudine che solo le bestie sanno esprimere - Bestemmia Berlino invece, come si dice ""omen nomen"" riprende il filo del discorso accavallando";imprecazioni su imprecazioni;e riducendo le solite conosciute bestemmie a vili scioglilingua che non sanno di niente.;pl;_;_;greater_plurality/accumulation;nominal
leggi su leggi;yes;su;legge;"Ecco perché nel Parlamento italiano non c'è mai stato nè mai ci sarà un deputato o un senatore che si alzi a dire: ""Onorevoli colleghi, smettiamola di affastellare";leggi su leggi;: in attività di servizio ce ne sono oltre duecentocinquantamila, il che ci rende lo zimbello del mondo.;pl;_;_;greater_plurality/accumulation;nominal
lettere su lettere;yes;su;lettera;In quel periodo Intrieri scriveva;lettere su lettere;al Viminale, alla prefettura e al prefetto.;pl;_;_;greater_plurality/accumulation;nominal
lettere su lettere;yes;su;lettera;Ciò nonostante, padre Villaverde non esitò a scrivere;lettere su lettere;ai suoi superiori, sostenendo di essere stato aggredito senza motivo e chiedendo che questo accolito di Satana fosse radiato dalla Chiesa.;pl;_;_;greater_plurality/accumulation;nominal
lettere su lettere;yes;su;lettera;L'opera è dedicata a un cardinale a cui Gioseffo invia;lettere su lettere;"nella speranza sempre disattesa d'una qualche risposta, ma un'accidia fatta di ""scontentezza vaga"" non consente allo speziale di condurre avanti la stesura del testo, anche perché una serie di eventi incresciosi verranno a turbare la quiete necessaria a tale compito.";pl;_;_;greater_plurality/accumulation;nominal
lettere su lettere;yes;su;lettera;Ma rari sono gli spiragli che si aprono per l'ex bracciante, facchino, portiere di notte, militante dell'Autonomia Operaia negli anni di piombo che, per sfogarsi dei rifiuti, scrive;lettere su lettere;.;pl;_;_;greater_plurality/accumulation;nominal
mattone su mattone;yes;su;mattone;Per un poliziotto, fare un buon lavoro significa costruire;mattone su mattone;.;sg;_;_;succession/iteration/distributivity;modifier
mattone su mattone;yes;su;mattone;C'era anche il marito della signora Lorenzina: «Questa casa l'abbiamo costruita;mattone su mattone;con mio marito, è tutto quel che mi resta di lui, ecco perché non me ne vado».;sg;_;_;succession/iteration/distributivity;modifier
mattone su mattone;yes;su;mattone;Per tua mano la Sua mannaia edificherà il Regno, passo dopo passo,;mattone su mattone;, testa su testa.;sg;_;_;succession/iteration/distributivity;modifier
mattone su mattone;yes;su;mattone;La costruzione che ho contribuito a edificare;mattone su mattone;, verrà portata a termine da altri e molto presto.;sg;_;_;succession/iteration/distributivity;modifier
mattone su mattone;yes;su;mattone;A ventisei anni, nel 1972, scrivere le prime poesie - Lego sull'incontro con la madre e i fratelli consanguinei è un modo di costruirsi il mondo;mattone su mattone;come un giocattolo solido e colorato, con la stessa fantasia e la stessa pazienza di un bambino.;sg;_;_;succession/iteration/distributivity;modifier
mattone su mattone;yes;su;mattone;I torinesi la videro, ma tra tumulti, morti, feriti: perché mentre loro lavoravano,;mattone su mattone;, a costruire l'aula voluta dal conte e dalla città per sostituire il provvisorio Parlamento subalpino messo su alla buona in soli 113 giorni (in tempo per proclamare, il 18 febbraio 1861, il Regno d'Italia), la diplomazia aveva già deciso di accontentare Napoleone III e trasferire la capitale a Firenze e pochi anni più tardi a Roma.;sg;_;_;succession/iteration/distributivity;modifier
metri su metri;yes;su;metro;Da questo momento in poi, Beckham continuerà almeno per un'ora a divorare;metri su metri;, avversari su avversari, con una facilità che fa male al cuore.;pl;_;_;greater_plurality/accumulation;nominal
metro su metro;yes;su;metro;Ogni volta che ho corso, da quel giorno in poi, ho ingoiato;metro su metro;masticando queste parole salvifiche di mio padre, le parole di Yusuf Omar Nur, figlio di Omar Nur Mohamed.;sg;_;_;greater_plurality/accumulation;nominal
miliardi su miliardi;yes;su;miliardo;"Il quale, al processo, ha specificato quale ""servizio finanziario eserceva"": trasportava di qua e di là dalla frontiera svizzera";miliardi su miliardi;per conto di amici, avvocati e almeno quattro giudici.;pl;_;_;greater_plurality/accumulation;nominal
miliardi su miliardi;yes;su;miliardo;Voi Cannarozzo e Cazzetta ci rovinate la vista, mettete in mostra le Fiat nude come la Caprioglio senza coprirne con i lenzuoli le lamierazze, e fate;miliardi su miliardi;in Brianza e a Squinzano, e poi i bei risultati sono l'Italia.;pl;_;_;greater_plurality/accumulation;nominal
miliardi su miliardi;yes;su;miliardo;Soprattutto per gli assicuratori, che possono continuare a inserire una clausola che consente loro di risparmiare;miliardi su miliardi;sulla pelle degli assicurati.;pl;_;_;greater_plurality/accumulation;nominal
mondo su mondo;yes;su;mondo;«Donne», scrive esemplarmente Cristina Campo, «tende ad elaborare l'idea al punto estremo dell'ingegnosità e in una sapienza retorica altamente controllata», mentre «Emily brucia nel mistico vuoto d'aria di un'assenza totale,;mondo su mondo;, balza da stella morta a stella ancor vivente, valicando la follia e la morte».;sg;_;_;succession/iteration/distributivity;modifier
novità su novità;yes;su;novità;In questo tipo di visione non vi è comprensione o rapporto originario con la verità, ma un tentativo di fuggire dal proprio essere - nel - mondo cercando incessantemente;novità su novità;.;sg/pl;_;_;greater_plurality/accumulation;nominal
obiezioni su obiezioni;yes;su;obiezione;Se avessi negato l'ubriachezza di George, se avessi cercato di nasconderla sollevando;obiezioni su obiezioni;perché il rilevamento del tasso alcolico eseguito mezz'ora dopo l'incidente non venisse acquisito come prova, se avessi fatto tutto ciò non avrei potuto ottenere un risultato favorevole al mio cliente.;pl;_;_;greater_plurality/accumulation;nominal
odio su odio;yes;su;odio;Ma bisogna evitare di creare;odio su odio;, fermarsi a riconsiderare gli strumenti con cui vogliamo combattere questa guerra.;sg;_;_;greater_plurality/accumulation;nominal
odio su odio;yes;su;odio;La logica pretende di farla da padrona e queste sono le inevitabili conseguenze:;odio su odio;.;sg;_;_;greater_plurality/accumulation;nominal
opinioni su opinioni;yes;su;opinione;Ma allora, per essere pienamente razionale, ognuno dovrebbe essere dotato di una rappresentazione del mondo che è costituita da una gerarchia infinita dio;opinioni su opinioni;.;pl;_;_;greater_plurality/accumulation;nominal
orrori su orrori;yes;su;orrore;Ora, non capisco perché dovrei portare rispetto verso una istituzione che nel corso dei secoli ha accumulato;orrori su orrori;, dei quali si è scusata in grave ritardo e solo in parte.;pl;_;_;greater_plurality/accumulation;nominal
palloni su palloni;yes;su;pallone;Con la palla a terra è un pericolo per i suoi, con la capoccia, che ricorda uno spillo, respinge;palloni su palloni;.;pl;_;_;greater_plurality/accumulation;nominal
palloni su palloni;yes;su;pallone;I biancorossi di Guidolin hanno impresso un ritmo vorticoso alla gara fin dai primi minuti, hanno recuperato;palloni su palloni;grazie al pressing a centrocampo e hanno minacciato Turci in continuazione, con un Otero scatenato su tutto il fronte d'attacco.;pl;_;_;greater_plurality/accumulation;nominal
palloni su palloni;yes;su;pallone;Col passare dei minuti migliorano Peruzzi e Simic, nel centrocampo della Roma Assuncao recupera;palloni su palloni;che appoggia ai compagni senza strafare, ad avviare il motore giallorosso ci pensa Totti, che copre mezzo campo.;pl;_;_;greater_plurality/accumulation;nominal
parlamentari su parlamentari;yes;su;parlamentare;Per mesi Gianni Letta e i lobbisti del Biscione avevano avvicinato;parlamentari su parlamentari;.;pl;_;_;greater_plurality/accumulation;nominal
pietra su pietra;yes;su;pietra;Caro e grande maestro mio, esempio di contento puro e tutto avuto dal bisogno col quale s'era sempre cercato;pietra su pietra;", e quasi per un non - potere di sé che è, come ebbe a scrivere, ""genuinità"", ""qualità di delicatezza"".";sg;_;_;succession/iteration/distributivity;modifier
pietra su pietra;yes;su;pietra;Secondo Rauber, l'organismo vivente non è costruito come un edificio, aggiungendo;pietra su pietra;in modo ordinato.;sg;_;_;greater_plurality/accumulation;nominal
pietra su pietra;yes;su;pietra;"È necessario fare chiarezza su tali aporie (si ricordi il senso della ‘spiegazione’ in Kant!) ; la filosofia non procede cumulativamente, ‘";pietra su pietra;, né può pensare di porre ordine nel linguaggio che effettivamente parliamo ricorrendo al ‘modello’ di ideografie, valide soltanto nell’ambito di procedure logico-matematiche.;sg;_;_;succession/iteration/distributivity;modifier
pietra su pietra;yes;su;pietra;Alta tecnologia che non può fare amenodell'uomo: un po 'come il Duomo di Milano: un'opera collettiva, firmata dal popolo che l'ha edificato;pietra su pietra;.;sg;_;_;succession/iteration/distributivity;modifier
pietra su pietra;yes;su;pietra;I monaci hanno progettato e costruito;pietra su pietra;, cattedrali e monasteri.;sg;_;_;succession/iteration/distributivity;modifier
pietra su pietra;yes;su;pietra;Le pietre scolpite sono l'omaggio alla storia millenaria, costruita;pietra su pietra;, secolo dopo secolo.;sg;_;_;succession/iteration/distributivity;modifier
proposte su proposte;yes;su;proposta;Così partirono casse su casse;proposte su proposte;, ma non ricevevamo se non giornali vecchi di due mesi, qualche settimanale come Ogonëk o Donna Sovietica, qualche rivista come Voprosy Filosofii e Sovetskoe Gosudarstvo i Pravo, dai quali ogni tanto Strada segnalava qualcosa perplesso.;pl;_;_;greater_plurality/accumulation;nominal
prova su prova;yes;su;prova;Per fortuna, conosceva la lingua così bene che capì ogni cosa, e si potette difendere, parola su parola, accusa su accusa ,;prova su prova;, senza perdersi d'animo.;sg;_;_;succession/iteration/distributivity;modifier
prove su prove;yes;su;prova;D'altronde da qualche anno l'attivista Jeff Ballinger, fondatore del gruppo Press for Change, porta;prove su prove;circa le scandalose differenze fra le remunerazioni dei lavoratori indonesiani della catena Nike (poco più di un dollaro al giorno) e quelle dei campioni della pubblicità a cui la multinazionale affida la propria immagine.;pl;_;_;greater_plurality/accumulation;nominal
prove su prove;yes;su;prova;Inoltre la pratica di chiedere ai datori di lavoro;prove su prove;"dell'effettiva necessità del lavoro straniero rifletteva la resistenza ad accettare l'idea che esistesse una vera domanda di manodopera non ""autoctona"".";pl;_;_;greater_plurality/accumulation;nominal
prove su prove;yes;su;prova;In Europa sta invece accadendo questo: nonostante ci siano ormai;prove su prove;che la strada che si è intrapresa è totalmente sbagliata ed andrebbe come minimo azzerata e ripensata, chiunque mette in discussione il sogno POTH progetto europeo è un odioso populista, reazionario, fascista.;pl;_;_;greater_plurality/accumulation;nominal
prove su prove;yes;su;prova;Le avevo provviste nei giorni a venire, lunghe, minuziose, documentate, mentre sui tavolini di Pilade mostravo a Belbo;prove su prove;, che egli seguiva con l'occhio sempre più annebbiato, accendendo le sigarette coi mozziconi, stendendo ogni cinque minuti il braccio infuori, il bicchiere vuoto con una parvenza di ghiaccio sul fondo, e Pilade che si precipitava a rifornire, senza attendere altri comandi.;pl;_;_;greater_plurality/accumulation;nominal
prove su prove;yes;su;prova;Tutte abusive sono le donne nel mondo dei maschi: senza passaporto né carta di identità, si fanno passare per quello che non sono, si sottopongono a;prove su prove;, pur di resistere, di non essere cacciate.;pl;_;_;greater_plurality/accumulation;nominal
prove su prove;yes;su;prova;La squadra di tecnici della Telecom fa;prove su prove;per trovare l'inghippo.;pl;_;_;greater_plurality/accumulation;nominal
prove su prove;yes;su;prova;Niente di peggio per cominciare un'altra settimana di esperimenti,;prove su prove;, verifiche e analisi di tutto ciò che non aveva funzionato come avrebbe dovuto.;pl;_;_;greater_plurality/accumulation;nominal
punti su punti;yes;su;punto;Se giocava a basket come baciava, sarebbe stato fin troppo facile segnare;punti su punti;senza un briciolo di fatica.;pl;_;_;greater_plurality/accumulation;nominal
punti su punti;yes;su;punto;L'Eroe e per questo lo proclamiamo tale affronta ogni cimento quando gli si presenta, e accumula;punti su punti;.;pl;_;_;greater_plurality/accumulation;nominal
punti su punti;yes;su;punto;La Bundesbank, che questa palla l'ha sempre lanciata, guadagnando;punti su punti;, adesso potrebbe essere costretta a rincorrerla.;pl;_;_;greater_plurality/accumulation;nominal
punto su punto;yes;su;punto;Stende la mano all'opposizione e rivendica;punto su punto;il proprio programma.;sg;_;_;succession/iteration/distributivity;modifier
punto su punto;yes;su;punto;Il 2 febbraio, con l'Inter avanti di cinque punti, aveva detto: «Non mi dispiacerebbe nemmeno se dovessimo lottare;punto su punto;in campionato.»;sg;_;_;succession/iteration/distributivity;modifier
