NPN;construction;preposition;noun;context_pre;costr;context_post;number_of_noun;Type;other_cxn;meaning;syntactic_function
punto su punto;yes;su;punto;Il capo degli anestesisti, Giuseppe Sala, ha respinto;punto su punto;ogni accusa nel faccia a faccia più lungo della giornata.;sg;_;_;succession/iteration/distributivity;modifier
punto su punto;yes;su;punto;Il governatore Roberto Formigoni sembra chiamarsi fuori: «L'assessore Ponzoni mi ha preannunciato una sua ampia dichiarazione che sarà dimostrazione;punto su punto;di quanto sia estraneo ai fatti».;sg;_;_;succession/iteration/distributivity;modifier
punto su punto;yes;su;punto;Incalzato dai rappresentanti di Uds (Unione degli studenti) e Ras (Rete autogestita studentesca), il ministro ha ribattuto;punto su punto;.;sg;_;_;succession/iteration/distributivity;modifier
punto su punto;yes;su;punto;Il tribunale della libertà risponde;punto su punto;alle obiezioni degli avvocati di Gregorat.;sg;_;_;succession/iteration/distributivity;modifier
punto su punto;yes;su;punto;Giusto così, i titoli si costruiscono alla Niki Lauda,;punto su punto;azzardando il meno possibile.;sg;_;_;succession/iteration/distributivity;modifier
punto su punto;yes;su;punto;Accornero è pronto a ribattere;punto su punto;.;sg;_;_;succession/iteration/distributivity;modifier
punto su punto;yes;su;punto;Il quale cade dalla nuvole, e replica;punto su punto;: È vero che la convocazione del notaio non è stata fatta per iscritto, bensì per telefono.;sg;_;_;succession/iteration/distributivity;modifier
punto su punto;yes;su;punto;Proprio sotto la spinta del suo coloured, Verona ha rosicchiato così;punto su punto;agli avversari (28-31 al 17'), prima di cedere nuovamente qualcosa al riposo (30-35) anche per la serata negativa di Iuzzolino (zero punti all'intervallo, con 4 errori al tiro).;sg;_;_;succession/iteration/distributivity;modifier
punto su punto;yes;su;punto;Una pessima notizia per il Basaksehir, club di recente fondazione che sta lottando;punto su punto;con il più quotato Galatasaray per la vittoria dello scudetto.;sg;_;_;succession/iteration/distributivity;modifier
punto su punto;yes;su;punto;La strategia 5Stelle - contrastare;punto su punto;Salvini colpendolo anche sui temi a lui più cari, come sicurezza e immigrazione - sembra aver avuto qualche effetto.;sg;_;_;succession/iteration/distributivity;modifier
ritardi su ritardi;yes;su;ritardo;Bene il raddoppio Mortara, unica linea ancora a singolo binario in città, capacità limitata e treni affollati che accumulano;ritardi su ritardi;a causa degli incroci.;pl;_;_;greater_plurality/accumulation;nominal
ritardi su ritardi;yes;su;ritardo;E se il verboso cattivo accumula;ritardi su ritardi;nelle sue comunicazioni finali al buono, nei teatri d'una volta si gridava «e partite, cretini!»;pl;_;_;greater_plurality/accumulation;nominal
ritardi su ritardi;yes;su;ritardo;Una sorta di modello finlandese, sulla falsariga della società che ha affidato ad Areva la costruzione del reattore di Olkiluoto (che sta però collezionando;ritardi su ritardi;, l'ultimo reso noto proprio ieri).;pl;_;_;greater_plurality/accumulation;nominal
ritardi su ritardi;yes;su;ritardo;Da allora, poco o nulla più:;ritardi su ritardi;da parte di BluTec nell'esecuzione dei piani, i lavoratori che protestano, Invitalia che ritira il finanziamento e chiede indietro i soldi.;pl;_;_;greater_plurality/accumulation;nominal
rospi su rospi;yes;su;rospo;L'italiano sente, con il suo istinto arcaico e animalesco, che è in arrivo una tempesta nella quale perderà quelle poche certezze che lo aiutavano a inghiottire;rospi su rospi;.;pl;_;_;greater_plurality/accumulation;nominal
sangue su sangue;yes;su;sangue;Hanno gioito o si sono disperati,;sangue su sangue;.;sg;_;_;succession/iteration/distributivity;modifier
saponi su saponi;yes;su;sapone;Mi lavo e mi rilavo, svaniscono;saponi su saponi;, asciugamani e salviette si impregnano d'acqua.;pl;_;_;greater_plurality/accumulation;nominal
scatole su scatole;yes;su;scatola;Maria, non l'aveva neppure mai fatto l'amore e, ciò nonostante, si vedeva recapitare;scatole su scatole;di preservativi.;pl;_;_;greater_plurality/accumulation;nominal
secondi su secondi;yes;su;secondo;Hakkinen passa in testa (deve ancora fare il pit - stop), Schumacher comincia a perdere;secondi su secondi;.;pl;_;_;greater_plurality/accumulation;nominal
stagione su stagione;yes;su;stagione;Vincenzo dipinse la collinetta per quasi due d'anni, colore su colore,;stagione su stagione;.;sg;_;_;succession/iteration/distributivity;modifier
stagione su stagione;yes;su;stagione;Come si erano convinti a smettere di accettare le regole subite;stagione su stagione;da centinaia di migliaia di raccoglitori di frutta, verdura, zucchine e pomodori, angurie in Puglia e grappoli al Nord, senza ribellione?;sg;_;_;succession/iteration/distributivity;modifier
stagioni su stagioni;yes;su;stagione;Alla finestra sul mondo trascorsero;stagioni su stagioni;, poi fu di nuovo neve.;pl;_;_;greater_plurality/accumulation;nominal
superficie su superficie;yes;su;superficie;Dove ho letto che al momento finale, quando la vita,;superficie su superficie;, si è - incrostata di esperienza, sai tutto, il segreto, il potere e la gloria, perché sei nato, perché stai morendo, e come tutto avrebbe potuto andare diversamente?;sg;_;_;succession/iteration/distributivity;modifier
veleni su veleni;yes;su;veleno;E una sfida all'arma bianca per arrivare alla guida di Palazzo Vermexio e gestire ancora il fiume di denaro che ha alimentato;veleni su veleni;, non ultimi quelli che grazie alle inchieste del piccolo giornale La Civetta hanno travolto la Procura, con tanto di trasferimento «cautelare» dell'ex capo Ugo Rossi per legami dei figli con alcune società nell'occhio del ciclone.;pl;_;_;greater_plurality/accumulation;nominal
ventricolo su ventricolo;yes;su;ventricolo;Mi hai aperto il tuo cuore, Giovanni,;ventricolo su ventricolo;.;sg;_;_;succession/iteration/distributivity;modifier
verbali su verbali;yes;su;verbale;Insomma, nel corso di Tangentopoli i mass media hanno pubblicato;verbali su verbali;ancora freschi d'inchiostro e rivelato notizie coperte da segreto istruttorio.;pl;_;_;greater_plurality/accumulation;nominal
verbali su verbali;yes;su;verbale;Un uomo dalla finestra di casa osserva i pizzardoni mentre elevano;verbali su verbali;.;pl;_;_;greater_plurality/accumulation;nominal
vittime su vittime;yes;su;vittima;Filippo attraversò l'accampamento gettando una rapida occhiata ad Aristandro che continuava a immolare;vittime su vittime;sul suo altare fumigante nella notte, e raggiunse un luogo in cui sorgeva un gigantesco banyan.;pl;_;_;greater_plurality/accumulation;nominal
amico a amico;no;a;amico;Quello stesso pomeriggio si presentò in caserma Toulouse Valmorain per parlare con Relais da;amico a amico;, come dichiarò.;sg;PNPN;yes;distractor;_
amico ad amico;no;a;amico;E visto che tra noi è tutto finito, dimmelo francamente, da;amico ad amico;: dove sei stato?;sg;PNPN;yes;distractor;_
architettura ad architettura;no;a;architettura;Come il set di istruzioni varia da;architettura ad architettura;, anche le regole sintattiche dell'assembly varieranno.;sg;PNPN;yes;distractor;_
autore a autore;no;a;autore;Certo, ed è persino superfluo ricordarlo, l'orchestrazione del dialogato conosce modulazioni plurime, variando da;autore a autore;, da opera a opera.;sg;PNPN;yes;distractor;_
brano a brano;no;a;corpo;Talora le passava per la testa una fuggevole meraviglia: che si possa esser trascinati così mentre si muore a;brano a brano;, in mezzo a tutti gli altri, e nessuno se ne accorge…;sg;PNPN;yes;distractor;_
campo a campo;no;a;campo;Per muovere il punto di inserzione da;campo a campo;, premere il tasto [tab] o selezionare con il mouse la casella desiderata.;sg;PNPN;yes;distractor;_
campo a campo;no;a;campo;A Durazzo la voce si insegue da;campo a campo;, da casa a casa.;sg;PNPN;yes;distractor;_
capitolo a capitolo;no;a;capitolo;All'interno del bilancio amministrativo, la Commissione può procedere, nei limiti e alle condizioni fissate dal regolamento stabilito in esecuzione dell'articolo 78 nono, a trasferimenti di crediti, sia da;capitolo a capitolo;, sia da suddivisione a suddivisione.;sg;PNPN;yes;distractor;_
circoscrizione a circoscrizione;no;a;circoscrizione;Il numero di liste varia invece da;circoscrizione a circoscrizione;: a Bologna in totale sono 16.;sg;PNPN;yes;distractor;_
commento a commento;no;a;commento;Volti tirati, ma è inutile aggiungere;commento a commento;.;sg;verbal;yes;distractor;_
confine a confine;no;a;confine;Il traffico di transito delle merci attraverso le Alpi da;confine a confine;avviene per ferrovia.;sg;PNPN;yes;distractor;_
confine a confine;no;a;confine;"In Finlandia si disputa la marcia sciistica non competitiva più lunga del mondo: la Rajalta rajalle - hiihto (che tradotto dal finlandese significa ""Sciata da";confine a confine;"""), più di 400 chilometri percorsi costeggiando il Circolo polare artico da Saunavaara, vicino alla Russia, fino alla Svezia.";sg;PNPN;yes;distractor;_
corpo a corpo;no;a;corpo;Sembrano interconnesse in una sfida infinita che si tramanda da;corpo a corpo;, da anima ad anima, da essere ad essere. ;sg;PNPN;yes;distractor;_
corpo a corpo;no;a;corpo;Le tattiche riflettono le tradizionali forme di lotta a;corpo a corpo;.;sg;PNPN;yes;distractor;_
corpo a corpo;no;a;corpo;Mi sono avvicinato all'opera da;corpo a corpo;, fino all'imitazione della circoncisione.;sg;PNPN;yes;distractor;_
corpo a corpo;no;a;corpo;Così Alba venne a conoscenza di un principe che aveva dormito cent'anni, di damigelle che lottavano a;corpo a corpo;con i draghi, di un lupo perduto nel bosco al quale una bambina aprì la pancia senza motivo.;sg;PNPN;yes;distractor;_
corpo a corpo;no;a;corpo;Un classico contemporaneo a tu per tu, o meglio a;corpo a corpo;, con l'eternità del classico.;sg;PNPN;yes;distractor;_
difficoltà a difficoltà;no;a;difficoltà;Dalla scatola a sorpresa della nostra politica, che non riesce a correggere se stessa, rischiano continuamente di uscire riforme sbagliate , che aggiungono;difficoltà a difficoltà;.;sg;verbal;yes;distractor;_
distorsione a distorsione;no;a;distorsione;Il fatto è che il monopolio, privato o pubblico che sia, modella di sè il sistema e aggiunge;distorsione a distorsione;finché tutti hanno torto, avendo tutti ottime ragioni.;sg;verbal;yes;distractor;_
distretto a distretto;no;a;distretto;Tra l'altro, per fronteggiare il ripetersi di cause di questo tipo, i tribunali hanno messo a punto una sorta di tabella dei rimborsi, che varia da;distretto a distretto;.;sg;PNPN;yes;distractor;_
gommista a gommista;no;a;gommista;Ci sono poi gli sconti, abbastanza consistenti, che variano da;gommista a gommista;.;sg;PNPN;yes;distractor;_
immagine a immagine;no;a;immagine;Mi interessava l'espressione di molti invitati, che passavano da;immagine a immagine;con aria di reverenza, e commozione.;sg;PNPN;yes;distractor;_
isola a isola;no;a;isola;"Naturalmente tale ago risultò di enorme utilità per i naviganti; esso divenne praticamente indispensabile per la navigazione oceanica, anche se i polinesiani riuscirono ad attraversare il Pacifico da";isola a isola;senza bussola.;sg;PNPN;yes;distractor;_
isola a isola;no;a;isola;"Siamo isole in un mare di indifferenza, caro amico; e, da";isola a isola;, è gradito ricevere e rimandare un cenno di riconoscimento e di saluto.;sg;PNPN;yes;distractor;_
labbra a labbra;no;a;labbra;Il massimo ardimento fu accostare;labbra a labbra;, e certo non perché avessimo letto Heine e sospettassimo che il bacio fosse più dolce della parola.;sg;verbal;yes;distractor;_
legume a legume;no;a;legume;I tempi di cottura variano da;legume a legume;: più la varietà avrà la buccia spessa, più dovrà cuocere a lungo.;sg;PNPN;yes;distractor;_
linguaggio a linguaggio;no;a;linguaggio;Al di là di quelle che sono le regole standard (che differiscono da;linguaggio a linguaggio;), esistono delle tecniche specifiche che aiutano a rendere più leggibile il codice.;sg;PNPN;yes;distractor;_
mansarda a mansarda;no;a;mansarda;Io e l'avvocato, viceversa, seguiamo la via interna, più segreta, da;mansarda a mansarda;e poi giù, senza offrirci alla vista di alcuno.;sg;PNPN;yes;distractor;_
marca a marca;no;a;marca;Ma la situazione varia molto da;marca a marca;(le Bmw ad esempio sono state aggiornate già nel 1989) ed è bene informarsi presso la rete di assistenza per evitare di danneggiare completamente il motore.;sg;PNPN;yes;distractor;_
marca a marca;no;a;marca;Abbiamo anche indicato nella tabella le dimensioni interne perché possono variare da;marca a marca;, il che in certi casi consente di guadagnare qualche centimetro.;sg;PNPN;yes;distractor;_
materia a materia;no;a;materia;Ad esempio, la misura in cui le Ict vengono utilizzate come strumento per insegnare altre discipline varia enormemente da;materia a materia;(in prima fila ci sono matematica, tecnologia, informatica e inglese) e da scuola a scuola: alcune scuole secondarie ne fanno uso frequentemente, altre nient'affatto.;sg;PNPN;yes;distractor;_
materiale a materiale;no;a;materiale;Meno diffusa è la conoscenza dell'entità del fenomeno e del fatto che questo varia da;materiale a materiale;.;sg;PNPN;yes;distractor;_
materiale a materiale;no;a;materiale;"Fu il francese Pierre Curie (1859-1906) a scoprire che il calore disperde il magnetismo; la temperatura a cui questo avviene varia da";materiale a materiale;"e oggi si chiama ""punto di Curie"".";sg;PNPN;yes;distractor;_
opera a opera;no;a;opera;Certo, ed è persino superfluo ricordarlo, l'orchestrazione del dialogato conosce modulazioni plurime, variando da autore a autore, da;opera a opera;.;sg;PNPN;yes;distractor;_
palmo a palmo;no;a;palmo;Ciò non è avvenuto: per cinque anni il centrosinistra ha combattuto a;palmo a palmo;"sul terreno della Rai, senza sfuggire al sospetto di una lottizzazione contrattata; e probabilmente la riforma Gentiloni è la figlia, non indecente ma chissà quanto adeguata, di una timidezza durata troppo a lungo.";sg;PNPN;yes;distractor;_
palmo a palmo;no;a;palmo;Will e Nancy setacciarono di nuovo l'appartamento a;palmo a palmo;"; poi, mentre lei restava con Clive, Will perlustrò il corridoio e la tromba delle scale.";sg;PNPN;yes;distractor;_
palmo a palmo;no;a;palmo;Stupita, scopriva la forma nuova e sorprendente del corpo del suo amico, il calore, il gusto, l'aroma, lo esplorava conquistandolo a;palmo a palmo;, seminandolo di carezze appena inventate.;sg;PNPN;yes;distractor;_
persona a persona;no;a;persona;Ma ormai è stato appurato con notevole certezza che il funzionamento dei sensi, e quindi anche l'esperienza sensoriale, varia da;persona a persona;.;sg;PNPN;yes;distractor;_
persona a persona;no;a;persona;Il virus della nuova influenza A si trasmette come una normale influenza stagionale, da;persona a persona;"; febbre, tosse, mal di testa e dolori muscolari sono i sintomi che, nella maggior parte dei casi, si risolvono senza complicazioni.";sg;PNPN;yes;distractor;_
persona a persona;no;a;persona;La rete delle connessioni tra le cellule cerebrali cambia da;persona a persona;.;sg;PNPN;yes;distractor;_
persona a persona;no;a;persona;La ferocia funziona se si propaga come un contagio, di bocca in bocca, da;persona a persona;.;sg;PNPN;yes;distractor;_
persona a persona;no;a;persona;Già, perché l'orecchio è come un'impronta digitale: la sua dimensione, la sua forma, la sua curvatura, cambiano da;persona a persona;e non si modificano col tempo.;sg;PNPN;yes;distractor;_
persona a persona;no;a;persona;L'anno scorso i pagamenti da;persona a persona;sono stati pari a 147 miliardi di dollari a livello globale, in crescita del 47%.;sg;PNPN;yes;distractor;_
persona a persona;no;a;persona;Naturalmente si tratta di valori approssimativi, perché i fattori che possono influire sull'aumento di peso variano da;persona a persona;.;sg;PNPN;yes;distractor;_
persona a persona;no;a;persona;La malattia, infatti, ha un peggioramento progressivo, in media nell'arco di dieci anni, ma la rapidità con cui i sintomi evolvono varia molto da;persona a persona;.;sg;PNPN;yes;distractor;_
persona a persona;no;a;persona;La durata della terapia però varia molto da;persona a persona;e dai risultati che si vogliono ottenere.;sg;PNPN;yes;distractor;_
persona a persona;no;a;persona;"Questa ""soglia di diversità"", come chiamiamo il punto di svolta, può differire da";persona a persona;.;sg;PNPN;yes;distractor;_
persona a persona;no;a;persona;Il cancro è una malattia complessa, che deriva da molti fattori interagenti, presumibilmente diversi da;persona a persona;.;sg;PNPN;yes;distractor;_
persona a persona;no;a;persona;Il senso della realtà è una costruzione del singolo individuo ed assume connotati personali, che differiscono da;persona a persona;.;sg;PNPN;yes;distractor;_
persona a persona;no;a;persona;Dato che il dosaggio varia da;persona a persona;(troppi ormoni danno palpitazioni e tremori), è fondamentale rivolgersi a centri specializzati dove ottenere una cura personalizzata.;sg;PNPN;yes;distractor;_
persona a persona;no;a;persona;Per alcune malattie genetiche esiste una cura ma, di nuovo, questa può variare da;persona a persona;, con differenze significative nei risultati.;sg;PNPN;yes;distractor;_
persona a persona;no;a;persona;La sessualità, nella quale si manifesta l'appartenenza dell'uomo al mondo materiale e biologico, diventa personale e veramente umana allorché è integrata nella relazione da;persona a persona;, nel dono reciproco, totale e illimitato nel tempo, dell'uomo e della donna.;sg;PNPN;yes;distractor;_
persona a persona;no;a;persona;Ma è necessario aggiungere che l'efficacia dei diversi farmaci può variare da;persona a persona;, e anche secondo il sesso: le donne in genere sono meno sensibili degli uomini alla terapia farmacologica con antiaggreganti.;sg;PNPN;yes;distractor;_
persona a persona;no;a;persona;Oltre alla tubercolosi altri agenti infettivi provenienti dalle vie respiratorie, quali streptococchi o meningococchi, potrebbero passare da un individuo all'altro mediante contatto diretto da;persona a persona;.;sg;PNPN;yes;distractor;_
persona a persona;no;a;persona;E ciò non è più altro che una relazione da;persona a persona;, più o meno istituzionalizzata.;sg;PNPN;yes;distractor;_
persona a persona;no;a;persona;Sotto l'etichetta di malattia celiaca potrebbero esserci condizioni diverse con un unico comune denominatore (atrofia della mucosa intestinale), ma modi e tempi in cui si manifesta variano da;persona a persona;.;sg;PNPN;yes;distractor;_
persona a persona;no;a;persona;In qualche caso era richiesto l'uso di droghe, che inducevano sogni ed incubi, diversi da;persona a persona;.;sg;PNPN;yes;distractor;_
persona a persona;no;a;persona;Poiché le esperienze emotive formative attraverso le quali si sviluppa la mente variano moltissimo da;persona a persona;, il livello mentale raggiunto e mantenuto da ognuno è molto diverso.;sg;PNPN;yes;distractor;_
persona a persona;no;a;persona;Le zone del corpo più sensibili alle carezze sono in molti casi soggettive e variano da;persona a persona;.;sg;PNPN;yes;distractor;_
persona a persona;no;a;persona;La velocità con la quale i chemioterapici distruggono le cellule cancerose varia molto da;persona a persona;e dal tipo di cacro che si ha.;sg;PNPN;yes;distractor;_
persona a persona;no;a;persona;È molto infettante ma mutate le condizioni, ossia con temperature più elevate e misure di contenimento e mitigazione, farà più fatica a trasferirsi da;persona a persona;.;sg;PNPN;yes;distractor;_
persona a persona;no;a;persona;È, questo, il bisogno di realizzazione personale, che assume forme diverse da;persona a persona;"; non importa quello che uno riesce a raggiungere, ma quello che ""vuole"" raggiungere, si tratti di vincere il premio Nobel per una scoperta scientifica o di coltivare un hobby creativo o di riattivare il motore di un'automobile.";sg;PNPN;yes;distractor;_
persona a persona;no;a;persona;La notizia indegna passava da;persona a persona;.;sg;PNPN;yes;distractor;_
persona a persona;no;a;persona;È una malattia della mezza età e della vecchiaia, nel corso della quale aumenta di molto il numero dei linfociti, ed il suo andamento varia molto da;persona a persona;.;sg;PNPN;yes;distractor;_
persona a persona;no;a;persona;Invece da noi è possibile che un virus o un germe si possa trasmettere da;persona a persona;in quel momento.;sg;PNPN;yes;distractor;_
persona a persona;no;a;persona;"È qui che si applica la nozione di ""contingenza"": è una cosa vostra, connessa con la vostra esperienza, relativa a eventi che variano da";persona a persona;.;sg;PNPN;yes;distractor;_
persona a persona;no;a;persona;L'eccitazione e il piacere sono composte da mille sensazioni diverse e arricchite da aspetti psicologici che variano da;persona a persona;.;sg;PNPN;yes;distractor;_
piazza a piazza;no;a;piazza;E invece il nostro settore è diventato un far west: regole diverse da;piazza a piazza;, regole che - beninteso - nessuno rispetta, e nessuno sceriffo a fare giustizia.;sg;PNPN;yes;distractor;_
polo a polo;no;a;polo;Se potessimo penetrar con l'occhio e vedere l'interno della terra, da;polo a polo;, o dai nostri piedi sino agli antipodi, con orrore scorgeremmo una mole tremendamente traforata di fessure e caverne.;sg;PNPN;yes;distractor;_
predicatore a predicatore;no;a;predicatore;Si tratta di racconti ripetuti da;predicatore a predicatore;, a lungo tramandati solo oralmente.;sg;PNPN;yes;distractor;_
quartiere a quartiere;no;a;quartiere;Ecco come varia nel dettaglio il mercato immobiliare da;quartiere a quartiere;.;sg;PNPN;yes;distractor;_
scienziato a scienziato;no;a;scienziato;L'interpretazione di una teoria, diversa da;scienziato a scienziato;, ha però costituito in molti casi lo spunto per nuove scoperte.;sg;PNPN;yes;distractor;_
sergente a sergente;no;a;sergente;I periodi minimi di attribuzioni specifiche, per l'avanzamento dei sergenti dell'Aeronautica militare, da;sergente a sergente;maggiore e da sergente maggiore a sergente maggiore capo sono determinati in 4 anni di impiego in incarichi della categoria di appartenenza.;sg;N_extended;no;distractor;_
settore a settore;no;a;settore;Il rapporto prezzo utili varia significativamente da;settore a settore;e, spesso, da azienda ad azienda, inquanto ogni azienda si caratterizza con proprie condizioni di rischio.;sg;PNPN;yes;distractor;_
settore a settore;no;a;settore;La velocità di diffusione e la profondità di tale processo di cambiamento potrà forse variare da realtà a realtà, da;settore a settore;, da Paese a Paese.;sg;PNPN;yes;distractor;_
settore a settore;no;a;settore;Pur con qualche differenza da;settore a settore;il tecnico commerciale, del marketing e delle vendite è segnalato come una figura in forte espansione in tutti i settori industriali e in tutte le regioni del Nord: le richieste maggiori si registrano nella chimica e nella meccanica mentre più debole si presenta nell'elettronica.;sg;PNPN;yes;distractor;_
sito a sito;no;a;sito;I dati di riferimento variavano da;sito a sito;, ma tre erano le teorie fondamentali ricorrenti.;sg;PNPN;yes;distractor;_
smentita a smentita;no;a;smentita;Ma il giornalista ha confermato la bontà della notizia, sommando;smentita a smentita;.;sg;verbal;yes;distractor;_
soggetto a soggetto;no;a;soggetto;Ciò significa che esiste un rischio individuale di danno sul fegato da parte dell'alcol, che varia molto da;soggetto a soggetto;.;sg;PNPN;yes;distractor;_
soggetto a soggetto;no;a;soggetto;Finora, il Dr. Biller e gli altri esperti non son stati in grado d'identificare il motivo per cui la malattia progredisce a ritmo così variabile da;soggetto a soggetto;.;sg;PNPN;yes;distractor;_
soggetto a soggetto;no;a;soggetto;Il periodo di gestazione varia da;soggetto a soggetto;, dai 25 ai 30 giorni.;sg;PNPN;yes;distractor;_
soggetto a soggetto;no;a;soggetto;La sua genesi è molteplice, o almeno può variare da;soggetto a soggetto;.;sg;PNPN;yes;distractor;_
soggetto a soggetto;no;a;soggetto;Una considerazione importante è che in entrambe le forme i sintomi, che vengono riferiti all'esposizione EM, sono molto variabili da;soggetto a soggetto;e inoltre possono variare sensibilmente nel tempo nello stesso soggetto, per intensità e durata.;sg;PNPN;yes;distractor;_
soggetto a soggetto;no;a;soggetto;Le caratteristiche cliniche della malattia possono variare notevolmente da;soggetto a soggetto;"; tuttavia l'inizio è generalmente insidioso - subdolo ed il decorso cronico - progressivo.";sg;PNPN;yes;distractor;_
soggetto a soggetto;no;a;soggetto;L'effetto clinico della singola dose si manifesta con una latenza e una durata molto variabile da;soggetto a soggetto;e nelle diverse fasi evolutive della malattia, tendendo a ridursi progressivamente man mano che la durata di malattia aumenta.;sg;PNPN;yes;distractor;_
soggetto a soggetto;no;a;soggetto;Va comunque tenuto presente che dopo lo scongelamento il recupero è ridotto di una percentuale di vitalità e qualità che varia da;soggetto a soggetto;.;sg;PNPN;yes;distractor;_
soggetto a soggetto;no;a;soggetto;Ciò significa che esiste un rischio individuale di danno sul fegato da parte dell'alcol, che varia molto da;soggetto a soggetto;.;sg;PNPN;yes;distractor;_
soggetto a soggetto;no;a;soggetto;La scelta dei mapuche si concretizza in un dato momento - anche biografico perché scelta anche individuale - che risponde a intime esigenze che saranno diverse da;soggetto a soggetto;.;sg;PNPN;yes;distractor;_
soggetto a soggetto;no;a;soggetto;I segni clinici, la cui intensità varia da;soggetto a soggetto;, si manifestano dopo aver assunto alimenti contenenti lattosio.;sg;PNPN;yes;distractor;_
studioso a studioso;no;a;studioso;Le stime variano in modo abissale da;studioso a studioso;.;sg;PNPN;yes;distractor;_
