NPN;construction;preposition;noun;pre_lemma;context_pre;costr;context_post;number_of_noun;Type;other_cxn;meaning;syntactic_function
guancia a guancia;yes;a;guancia;così;Stemmo a lungo insieme, così,;guancia a guancia;.;sg;_;_;juxtaposition/contact;modifier
base su base;no;su;base;di;La Commissione può ora rimborsare spese generali di;base su base;forfetaria o versare importi forfetari per piccoli progetti - di gruppi vulnerabili, per esempio.;sg;N_extended;no;distractor;_
strati su strati;yes;su;strato;sovrapporre;"""Basta con le tante scene di passeggeri che viaggiano sovrapposti";strati su strati;", come in una dantesca millefoglie - è sbottato in una diretta Facebook il Governatore con il suo solito linguaggio colorito - da oggi pugno duro: i campani potranno disporsi al massimo su tre strati"".";pl;_;_;greater_plurality/accumulation;nominal
gomito a gomito;yes;a;gomito;lavorare;Cosa crede che succeda quando uno della valle di Ossau lavora;gomito a gomito;con uno della valle del Gave?;sg;_;_;juxtaposition/contact;modifier
centesimo su centesimo;yes;su;centesimo;restituire;Aveva anche chiesto soldi in prestito ai suoi amanti, senza pudore, e li aveva, ogni volta, restituiti,;centesimo su centesimo;.;sg;_;_;succession/iteration/distributivity;modifier
porta a porta;yes;a;porta;vendita;15 giovani intraprendenti, anche senza esperienza, hanno la possibilità di entrare a far parte dell'organizzazione commerciale come incaricati alla vendita;porta a porta;, pagati a provvigioni.;sg;_;_;succession/iteration/distributivity;modifier
sentenze su sentenze;yes;su;sentenza;con;Anche se quel reato, ha stabilito negli anni la Cassazione con;sentenze su sentenze;"circa il senso del pudore e della ""continenza sessuale"", è di fatto tollerato se non se ne fa offerta al pubblico.";pl;_;_;greater_plurality/accumulation;nominal
borotalco su borotalco;yes;su;borotalco;mettere;Il suo amore per i libri era nato là, a mettere;borotalco su borotalco;sui libri della biblioteca della scuola, borotalco melmoso e poi ancora borotalco melmoso alla pagina dopo - se eri riuscito a scollarla - tra risate e chiacchiere frenetiche, programmando impraticabili scherzi.;sg;_;_;greater_plurality/accumulation;nominal
soggetto a soggetto;no;a;soggetto;da;L'effetto clinico della singola dose si manifesta con una latenza e una durata molto variabile da;_;_;_;_;_;_;_
Berlinguer su Berlinguer;no;su;Berlinguer;di;Si potrebbe provare A ragionare di;Berlinguer su Berlinguer;a partire da alcuni grandi punti del suo pensiero.;X;thematic_target;no;distractor;_
stazione a stazione;no;a;stazione;da;Ho voluto seguire il tragitto di due treni da;_;_;_;_;_;_;_
goccia a goccia ;no;a;goccia;a;Quella donna fu sottoposta alla tortura dell'acqua: ne dovette ingurgitare litri e litri, a;_;_;_;_;_;_;_
accusa su accusa;yes;su;accusa;parola;Per fortuna, conosceva la lingua così bene che capì ogni cosa, e si potette difendere, parola su parola ,;accusa su accusa;, prova su prova, senza perdersi d'animo.;sg;_;_;succession/iteration/distributivity;modifier
corpo a corpo;no;a;corpo;da;Mi sono avvicinato all'opera da;_;_;_;_;_;_;_
10 su 10;no;su;10;un;E mentre Berlusconi si assegna un;10 su 10;,gli analisti affermano che il governo ha sprecato il suo primo anno.;X;NumPNum;no;distractor;_
Pisa su Pisa;no;su;Pisa;di;Martedì sera Umberto ha avuto una trovata che per poco non ha reso innocuo il pericolante edificio di insulti che ogni puntata pende su di lui, come la Torre di;Pisa su Pisa;.;X;proper_name_inglobation;no;distractor;_
guancia a guancia;yes;a;guancia;dire;Certo che me ne aveva raccontate di cose, e ricordo benissimo che, durante quei quattro giorni si può dire;guancia a guancia;, a ogni nuova confidenza mi si raddoppiavano i brividi lungo la schiena: perché si fidava tanto, perché si era fidata incondizionatamente di me?;sg;_;_;juxtaposition/contact;modifier
secondi su secondi;yes;su;secondo;perdere;Hakkinen passa in testa (deve ancora fare il pit - stop), Schumacher comincia a perdere;secondi su secondi;.;pl;_;_;greater_plurality/accumulation;nominal
dinamitardo a dinamitardo;no;a;dinamitardo;da;Come se un testimone fosse passato di mano da;_;_;_;_;_;_;_
cene su cene;yes;su;cena;organizzare;E fu senz'altro la disperazione che li portò a organizzare;cene su cene;con vino in abbondanza e conseguente e inevitabile sbronza collettiva.;pl;_;_;greater_plurality/accumulation;nominal
uomo su uomo;no;su;uomo;di;Con lo spargimento di sangue innocente (sopruso di;uomo su uomo;) che ne consegue.;sg;thematic_target;no;distractor;_
paese a paese;no;a;paese;da;Mentre la forma e il livello esatti di oneri a carico del beneficiario varia considerevolmente da;_;_;_;_;_;_;_
incarichi su incarichi;yes;su;incarico;tempo;Così finii, ancora una volta, ad accumulare in breve tempo;incarichi su incarichi;, fino ad arrivare a dirigere l'intera divisione.;pl;_;_;greater_plurality/accumulation;nominal
porta a porta;yes;a;porta;e;Oltre agli immancabili call center con contratti a provvigione, tra i casi studiati verranno analizzati i pericoli che si celano nelle offerte per gli impieghi classici, «a domicilio e;porta a porta;"»; ma anche per i lavori che un tempo erano considerati anomali, ma che oggi sono fonte di guadagno per moltissimi giovani, come «quelli che prevedono un corso di formazione a pagamento iniziale, troppo spesso inutile e carissimo».";sg;_;_;succession/iteration/distributivity;modifier
8 su 8;no;su;8;tre;Gioca 29' e chiude con 20 punti, 0 su 2 da due, 4 su 7 da tre,;8 su 8;ai tiri liberi, ben 5 rimbalzi, 4 assist, 25 di valutazione.;X;NumPNum;no;distractor;_
24 su 24;no;su;24;vicinanza;Infatti la scommessa era quella dell' accompagnamento educativo, la presenza, la vicinanza;24 su 24;ore per tot mesi verso chi ne aveva bisogno.;X;NumPNum;no;distractor;_
riunioni su riunioni;yes;su;riunione;fare;Come sempre accade, appena un matrimonio va a rotoli si inizia a lavorare finoa tardi, a fare;riunioni su riunioni;, viaggi improvvisi.;pl;_;_;greater_plurality/accumulation;nominal
guancia a guancia;yes;a;guancia;quasi;Lei e Nina sono ancora sotto la coperta, sedute vicine, quasi;guancia a guancia;, ma non si guardano.;sg;_;_;juxtaposition/contact;modifier
tedeschi a tedeschi;no;a;tedeschi;di;Un comando particolare, straniero, il comando del nemico, donde «Diktat», aveva vietato l'atteggiamento imperioso del comando militare di;_;_;_;_;_;_;_
guancia a guancia;yes;a;guancia;lento;Alfio per il resto della serata rimase mortificato a guardarla ballare i valzer lenti;guancia a guancia;con Piastrein.;sg;_;_;juxtaposition/contact;modifier
volta a volta;yes;a;volta;denominare;Emma (Iaia Forte) e Salvatore, denominato;volta a volta;Sal o Tore (Tommaso Ragno), sono una coppia in crisi che tenta di riattizzare il fuoco recitando - ad uso privato - il proprio rapporto.;sg;_;_;succession/iteration/distributivity;modifier
ritmi su ritmi;yes;su;ritmo;sovrapporre;Come i concetti, la musica di Cretu-Enigma non si ferma ma continua ad indagare, sovrapponendo;ritmi su ritmi;, sonorità elettroniche su sonorità canore spesso sintetizzate.;pl;_;_;greater_plurality/accumulation;nominal
porta a porta;yes;a;porta;campagna;Un libro del 2015 aveva riassunto in questa tabella il rapporto costi POTH benefici delle varie tattiche da mettere in moto per portare qualcuno a votare, dalla campagna;porta a porta;(31 dollari per voto) alle telefonate dei volontari (35 dollari per voto).;sg;_;_;succession/iteration/distributivity;modifier
uomini su uomini;no;su;uomo;di;"Nella famosa conferenza del 1919 su ""La politica come professione"", Max Weber disse: ""Lo Stato è, come le associazioni politiche che storicamente lo precedono, un rapporto di dominio di";uomini su uomini;basato sul mezzo della forza legittima (cioè considerata legittima).;pl;thematic_target;no;distractor;_
soggetto a soggetto;no;a;soggetto;da;La sua genesi è molteplice, o almeno può variare da;_;_;_;_;_;_;_
libri su libri;yes;su;libro;leggere;Di sicuro al distretto avevano pensato che fosse ammattito, vistoche trascorreva le ore del turno trincerato nella sua stanza a leggere;libri su libri;.;pl;_;_;greater_plurality/accumulation;nominal
zolla a zolla;yes;a;zolla;conoscere;Per cui nessuno ci pensa al povero animale che bazzica senza meta nel ben delimitato territorio, che ormai conosce;zolla a zolla;.;sg;_;_;succession/iteration/distributivity;modifier
uomini su uomini;no;su;uomo;di;"Lo stato è così dunque ""un rapporto di potere di";uomini su uomini;", fondato sul mezzo dell'uso della forza legittima"" (si veda ""Economia e Società"", Milano 1961).";pl;thematic_target;no;distractor;_
fronte a fronte;yes;a;fronte;vigilare;E l'ordine, sia ben chiaro, non è l'assenza di disordine, ma la confusione regolamentata, su cui vigilano;fronte a fronte;re e vescovi.;sg;_;_;juxtaposition/contact;modifier
porta a porta;yes;a;porta;polivitaminico;Così, cominciò a vendere polivitaminici;porta a porta;.;sg;_;_;succession/iteration/distributivity;modifier
capelli su capelli;no;su;capello;di;Quindi, ad esempio, lo stesso taglio di;capelli su capelli;lisci e ricci apparirà completamente diverso. pertanto quando scegli un taglio di capelli, oltre al tipo di viso, considera anche il tipo di capelli.;pl;N_extended;no;distractor;_
110 su 110;no;su;110;con;Luciano Fonzi esprime il seguente giudizio: Laureato in Scienze Biologiche presso la Università di Siena nel 1969 con;110 su 110;e lode.;X;NumPNum;no;distractor;_
uomini su uomini;no;su;uomo;di;Ne restasse fuori anche uno solo, anche una sola testa, su cosa potrebbe mai fondarsi una nazione se non sul dominio di;uomini su uomini;?;pl;thematic_target;no;distractor;_
Berlusconi su Berlusconi;no;su;Berlusconi;di;Va bene bene pubblicare in prima pagina una barzelletta di;Berlusconi su Berlusconi;, ma vi sia perlomeno il buon senso di dire al titolista di non mettere come titolo LA BATTUTA finale...;X;thematic_target;no;distractor;_
materiale a materiale;no;a;materiale;da;Meno diffusa è la conoscenza dell'entità del fenomeno e del fatto che questo varia da;_;_;_;_;_;_;_
goccia a goccia ;no;a;goccia;a;Per trasformare la nebbia in una sorgente naturale di acqua, bisogna distillarla a;_;_;_;_;_;_;_
ceppo a ceppo;no;a;ceppo;da;Gli enzimi di parecchi ceppi possono essere confrontati mediante tecniche statistiche che rivelano la divergenza genetica relativa da;_;_;_;_;_;_;_
giorno su giorno;yes;su;giorno;dimostrare;Ne praticavano una da dimostrare;giorno su giorno;, tra gli agguati subiti e quelli resi.;sg;_;_;succession/iteration/distributivity;modifier
energia su energia;no;su;energia;di;Tradotto in italiano è il ritorno di;energia su energia;"investita; è un rapporto tra due valori numerici espressi in kWh.";sg;N_extended;no;distractor;_
categoria a categoria;no;a;categoria;da;Analogamente può essere trasferito da;_;_;_;_;_;_;_
bocca a bocca;no;a;bocca;a;Sperava che saltasse fuori un veleno o una tossina, ma gli interessava anche sapere se Clive era positivo all'HIV, dato che gli aveva praticato la respirazione a;_;_;_;_;_;_;_
gomito a gomito;yes;a;gomito;stare;All'alba di ieri, su quella carcassa arrivata dritta sulla spiaggia di Le Cannella una delle località di mare più belle di Isola Capo Rizzuto stavano;gomito a gomito;317 persone, per lo più curdi, pakistani e afgani.;sg;_;_;juxtaposition/contact;modifier
volta a volta;yes;a;volta;fare;Di questo l'esperienza interiore, il mio sentirmi si fa;volta a volta;avvertito.;sg;_;_;succession/iteration/distributivity;modifier
amici ad amici;no;a;amici;fratello;Riconosco i tanti cognomi della comunità, rivedo le loro storie, riunisco figli a genitori, fratelli a fratelli,;_;_;_;_;_;_;_
categoria a categoria;no;a;categoria;da;Analogamente può essere trasferito da categoria a categoria e da specialità a specialità il sottufficiale e il volontario in congedo della Marina militare, da ruolo a ruolo e da;_;_;_;_;_;_;_
danni su danni;yes;su;danno;produrre;La condizione, naturalmente, è voler discutere davvero del merito dei problemi: mettendo da parte una logica di contrapposizione politica esasperata che, a urne chiuse, non può che produrre;danni su danni;.;pl;_;_;greater_plurality/accumulation;nominal
volta a volta;yes;a;volta;essere;Una ulteriore complicazione dello schema risulterebbe se considerassimo come i destinatari grammaticali delle ottave dei poeti possano essere;volta a volta;, e anche nella medesima ottava, il proprio antagonista o il pubblico medesimo.;sg;_;_;succession/iteration/distributivity;modifier
riunioni su riunioni;yes;su;riunione;svolgere;Non resta che aspettare: sempre dal municipio i bene informati fanno sapere che proprio in queste ore si stanno svolgendo;riunioni su riunioni;per risolvere la matassa e passare all'azione, ma sulla tempistica non si sbilancia nessuno.;pl;_;_;greater_plurality/accumulation;nominal
beni su beni;yes;su;bene;bere;"A loro dice che non devono preoccuparsi di quello che ""avrebbero mangiato o bevuto""; men che meno di ""accumulare";beni su beni;""".";pl;_;_;greater_plurality/accumulation;nominal
uomini su uomini;no;su;uomo;da;Un crimine non certo benedetto da un Dio, ma fatto da;uomini su uomini;(l' orrore, vedi 1945).;pl;thematic_target;no;distractor;_
milioni su milioni;yes;su;milione;sempre;Chi non spera che in un tweet possa lanciare o magari nascondere un qualche indizio di come riesca a guadagnare sempre;milioni su milioni;di dollari andando generalmente controcorrente?;pl;_;_;greater_plurality/accumulation;nominal
10 su 10;no;su;10;se;Vorrei che ogni italiano, o almeno 8 su 10 sappiano cosa sia la Milano Sanremo, se;10 su 10;sanno cosa è il Giro.;X;NumPNum;no;distractor;_
bandiere su bandiere;no;su;bandiera;dire;"Come se ci fosse bisogno di una voce dall' alto che dica""";bandiere su bandiere;" giù"".";pl;NsuNgiù;yes;distractor;_
barzellette su barzellette;yes;su;barzelletta;sfornare;Ormai, Ennio come un fucile, Athos come una mitraglia, sfornano;barzellette su barzellette;", come si suol dire, prendono il pallino in mano; fra un bicchiere e l'altro, una risata e l'altra, cadono le ultime barriere; ci sentiamo ormai comese fossimo davvero cresciuti tutti insieme; nasce in questa occasione oltrealla sintonia del branco, anche l'intercalare ufficiale della vacanza ""olè... se dobla""!";pl;_;_;greater_plurality/accumulation;nominal
bocca a bocca;no;a;bocca;a;Juanita si precipitò a praticarle la respirazione a;_;_;_;_;_;_;_
testa a testa;yes;a;testa;accanto;Banga salì subito sul letto con lui, si sdraiò lì accanto,;testa a testa;, e il procuratore, con una mano sul collo dell'animale, chiuse finalmente gli occhi.;sg;_;_;juxtaposition/contact;modifier
soggetto a soggetto;no;a;soggetto;da;Va comunque tenuto presente che dopo lo scongelamento il recupero è ridotto di una percentuale di vitalità e qualità che varia da;_;_;_;_;_;_;_
citazioni su citazioni;yes;su;citazioni;fare;Mi chiese se continuava a fare;citazioni su citazioni;per legittimare le sue teorie.;pl;_;_;greater_plurality/accumulation;nominal
sofferenza a sofferenza;no;a;sofferenza;aggiungere;Mi rendo conto di aggiungere;_;_;_;_;_;_;_
soggetto a soggetto;no;a;soggetto;da;Il periodo di gestazione varia da;_;_;_;_;_;_;_
canzone su canzone;yes;su;canzone;costruire;Il Libro del Mondo è, in fondo, il lungo racconto che con incredibile coerenza ha costruito;canzone su canzone;"quel grande ""moralista camuffato da immmoralista"" (Cesare G. Romana ) che era Fabrizio.";sg;_;_;succession/iteration/distributivity;modifier
uomo a uomo;no;a;uomo;da;"""Ciò indica che la trasmissione del virus è possibile anche da";_;_;_;_;_;_;_
soldi su soldi;yes;su;soldi;individuo;"Si tratta di un accidente della natura, in certi individui; una volta che si è iniziato, non c'è modo di fermarsi,";soldi su soldi;.;pl;_;_;greater_plurality/accumulation;nominal
decine su decine;yes;su;decina;vedere;Poi tornava a navigare su internet e a vedere;decine su decine;di filmati.;pl;_;_;greater_plurality/accumulation;nominal
porta a porta;yes;a;porta;raccolta;Anziché sostenere la lobby dell'incenerimento Orlando promuova la riduzione dei rifiuti, la raccolta;porta a porta;(abolendo la Tares come chiesto dal M5S con proposte parlamentari), costruzioni di centri riciclo e compostaggio, sistemi alternativi all'incenerimento e alla discarica, in linea con l'Europa!;sg;_;_;succession/iteration/distributivity;modifier
TV su TV;no;su;TV;diretta;Tutta la cerimonia finale verrá trasmessa in diretta;TV su TV;3 dalle 18.40 alle 20.15 e su TV 1 e TV 2 dalle 19.30 alle 20.00.;sg;proper_name_inglobation;no;distractor;_
pezzo su pezzo;yes;su;pezzo;ricostruire;Ho visto i palazzi monumentali di Dresda ricostruiti;pezzo su pezzo;, dopo le distruzioni della Seconda guerra mondiale e ho visto i monumenti dell'Alto Egitto salvati e rimontati all'asciutto.;sg;_;_;succession/iteration/distributivity;modifier
stagione su stagione;yes;su;stagione;subire;Come si erano convinti a smettere di accettare le regole subite;stagione su stagione;da centinaia di migliaia di raccoglitori di frutta, verdura, zucchine e pomodori, angurie in Puglia e grappoli al Nord, senza ribellione?;sg;_;_;succession/iteration/distributivity;modifier
porta a porta;yes;a;porta;distribuzione;Poi i certificati verranno consegnati ai vigili che incominceranno la distribuzione;porta a porta;.;sg;_;_;succession/iteration/distributivity;modifier
telegrammi su telegrammi;yes;su;telegramma;mandare;E quanto alla nonna, che ci può essere di più comico e disgustoso che mandare;telegrammi su telegrammi;domandando continuamente: è morta o non è morta?.;pl;_;_;greater_plurality/accumulation;nominal
porta a porta;yes;a;porta;raccogliere;Entro fine anno il vetro si raccoglierà;porta a porta;.;sg;_;_;succession/iteration/distributivity;modifier
gomito a gomito;yes;a;gomito;essere;Queste cose non le ha mai dette neanche con me che siamo;gomito a gomito;da due anni e mezzo.;sg;_;_;juxtaposition/contact;modifier
volta a volta;yes;a;volta;vedere;Questa è dunque divisibile in due tetrastici ben distinti, distinzione che facilita il compito di anticipazione e ricerca del poeta, il quale ha ache vedere;volta a volta;con una forma strofaica più breve di quella relativamente lunga dell'ottava.;sg;_;_;succession/iteration/distributivity;modifier
goccia a goccia ;no;a;goccia;a;Ufficialmente non c'è nè soddisfazione nè rammarico, nelle file dello stato maggiore di Alleanza nazionale, in questa serata elettorale in cui dati giungono a;_;_;_;_;_;_;_
volta a volta;yes;a;volta;dovere;Un agente di cambio, un venditore, una segretaria, un dirigente delle ferrovie, un professore universitario, un direttore d'albergo, devono;volta a volta;offrire un tipo di personalità diverso che, indipendentemente dalle differenze tra l'una e l'altra, deve rispondere sempre a una condizione: essere richiesto.;sg;_;_;succession/iteration/distributivity;modifier
6 su 6;no;su;6;femmina;Utilizzarono questa possibilità soprattutto le femmine (;6 su 6;), ma anche alcuni maschi (4 su 12), quindi nel complesso poco più del 50 % della classe.;X;NumPNum;no;distractor;_
compagnia a compagnia;no;a;compagnia;da;Considerando le polizze standard, le formule possono variare da;_;_;_;_;_;_;_
volta a volta;yes;a;volta;cui;Mangi, beva, dorma, suoni, lavori o vada a spasso con la sua splendida ragazza tunisina, qualunque cosa faccia, non sopporta di essere distratto da ciò in cui,;volta a volta;, è impegnato.;sg;_;_;succession/iteration/distributivity;modifier
18 su 18;no;su;18;strappare;Io penso che se una persona si impegna, comincia a farlo all' universita' ... magari prendendo dei buoni voti agli esami senza andare a tentare, strappando;18 su 18;.;X;NumPNum;no;distractor;_
tasse su tasse;yes;su;tassa;stella;Dopo un anno, disoccupazione alle stelle,;tasse su tasse;, pensioni in pericolo, criminalità impunita e spavalda, città nelle mani di spacciatori e violenti, il futuro è visto da molti incerto e drammatico.;pl;_;_;greater_plurality/accumulation;nominal
manciate su manciate;yes;su;manciata;dare;Alla fine scovò delle bacche mature e me ne diede;manciate su manciate;.;pl;_;_;greater_plurality/accumulation;nominal
neurone a neurone;no;a;neurone;imprimere;"Solo i nomi mi rimangono impressi
neurone a neurone;no;a;neurone;da;Questi sono le sostanze chimiche che trasmettono il messaggio nervoso da
oggetto a oggetto;no;a;oggetto;da;Quindi, accanto al riciclo meccanico (da
ombra a ombra;no;a;ombra;da;La luce brillava nei loro capelli a ogni passaggio da
opera a opera;no;a;opera;da;Certo, ed è persino superfluo ricordarlo, l'orchestrazione del dialogato conosce modulazioni plurime, variando da autore a autore, da
orecchio a orecchio;no;a;orecchio;da;Marco sperava di trovarvi anche lei ma, come gli chiarì in modo sgarbato quel viscido tappetto cicciottello, sudaticcio e con un riporto da
orecchio a orecchio;no;a;orecchio;da;Ben si voltò indietro e guardò la ragazza sfoggiando un sorriso da
orecchio a orecchio;no;a;orecchio;da;Un taglio praticato sotto il mento, da
orecchio a orecchio;no;a;orecchio;da;Gli disegnai una faccia tonda con un sorriso che andava da
orecchio a orecchio;no;a;orecchio;da;Mi ci piazzavo davanti, lo fissavo, stiravo un sorriso plastico da
orecchio a orecchio;no;a;orecchio;da;Accanto a noi c'era un ometto stilizzato con una faccia tonda e un sorriso da
orecchio a orecchio;no;a;orecchio;da;Un uomo di mezza età, con un indescrivibile riporto di capelli da
orecchio a orecchio;no;a;orecchio;da;Viveva sulle rive dei fiumi della Patagonia, aveva una testa di leone «con qualcosa di umano», una corta barba da
orecchio ad orecchio;no;a;orecchio;da;Rappresentò il volto della donna con un tatuaggio reso dalla combinazione di tre linee brevi orizzontali alternate a tre linee brevi verticali: il tutto dalla fronte al mento e da
organo a organo;no;a;organo;da;Nelle piante superiori la velocità di accrescimento varia invece da
orizzonte a orizzonte;no;a;orizzonte;da;Cominciò a nevicare a larghe falde, che danzavano con il vento e stendevano una coltre bianca sulla terra da
ospedale a ospedale;no;a;ospedale;da;Il tempo a disposizione varia da
ospedale a ospedale;no;a;ospedale;da;Il rischio di aborto è intorno all'1% per entrambi gli esami, ma le percentuali variano da
osservazione ad osservazione;no;a;osservazione;pensiero;Di solito, allora, si sdraiava sul canapè del suo ufficio - non poteva più lasciare il suo ufficio senza essersi riposato un'ora sul canapè - e collegava nel pensiero
paese a paese;no;a;paese;da;Le restrizioni sull'esportazione variano da
paese a paese;no;a;paese;da;E infatti vi sono ancora differenze profonde da
paese a paese;no;a;paese;da;Il primo è una dialettizzazione dell'inglese, ossia la nascita e la crescita di forme di inglese diverso da
paese a paese;no;a;paese;da;Inoltre ha effetti negativi sulle possibilità di conseguire determinati obiettivi se essi sono graduati su scale di priorità diverse da
paese a paese;no;a;paese;da;Sempre nell'ambito dei paesi industrializzati, il ricordato aumento della crescita reale derivante dai processi di innovazione tecnologica e di globalizzazione si è riflesso sull'occupazione in modo diverso da
paese a paese;no;a;paese;da;La documentazione richiesta e gli aventi diritto variano da
paese a paese;no;a;paese;da;Tuttavia, l'interesse di mercato varia da
paese a paese;no;a;paese;da;Anche per quanto riguarda gli strumenti diretti dell'azione fascista sulle comunità italiane all'estero la situazione diverge enormemente da
paese a paese;no;a;paese;da;Secondo lei, la strana caratteristica di questi decessi, e cioè il fatto che le morti si sono susseguite da
paese a paese;no;a;paese;da;L'entrata in vigore delle nuove normative Ue impone infatti la conservazione di tutti i messaggi di posta elettronica per un tempo definito, che varia da
paese a paese;no;a;paese;da;Non di meno, indipendentemente dall'ambito di validità delle licenze, (...) le preferenze dei telespettatori possono variare notevolmente da
paese a paese;no;a;paese;da;Le relazioni extramatrimoniali sono piene di sfumature culturali, che variano da
paese a paese;no;a;paese;da;Se si sostiene un concetto soggettivo di salute, è accettabile che i criteri della sperimentazione umana varino da
paese a paese;no;a;paese;da;Il contributo della mutualità al finanziamento dell'assicurazione di disoccupazione è variabile da
paese a paese;no;a;paese;da;La base di riferimento per il calcolo dei contributi da accreditare è diversa da
paese a paese;no;a;paese;da;Il livello di istruzione dei genitori, invece, ha un effetto sul reddito dei figli variabile da
paese a paese;no;a;paese;da;Essa può assumere valenze parzialmente diverse da
paese a paese;no;a;paese;da;Probabilmente le ragioni che producono alti consensi sui temi della vita più semplice e naturale o della minore importanza data al denaro, sono diverse da
paese a paese;no;a;paese;da;L'entità di questa differenza varia da
paese a paese;no;a;paese;da;In effetti il significato delle parole """"edizione"""" e """"libro"""" differiscono non soltanto da continente a continente, ma anche da""";_;_;_;_;_;_;_
gomito a gomito;yes;a;gomito;spesso;Naturalmente certi vecchi quartieri londinesi conservavano le antiche caratteristiche di grande eleganza e ricchezza, ma erano spesso;gomito a gomito;con gli slum più squallidi e più ripugnanti.;sg;_;_;juxtaposition/contact;modifier
guancia a guancia;yes;a;guancia;ballo;Pensavo alla sua infanzia e alla sua adolescenza, ai divani ridotti a brandelli e ai materassi masticati, alle fantastiche passeggiate lungo l'Intracoastal e ai balli;guancia a guancia;con lo stereo a tutto volume.;sg;_;_;juxtaposition/contact;modifier
