NPN;construction;preposition;noun;pre_lemma;context_pre;costr;context_post;number_of_noun;Type;other_cxn;meaning;syntactic_function
18 su 18;no;su;18;compatto;La serie A ha votato compatta,;18 su 18;- afferma Galliani - per il ' lodo' che ha preso il mio nome, che prevedeva 3 retrocessioni dalla A e 5 promozioni dalla B, e dall' anno prossimo a regime 3 retrocessioni e 3 promozioni.;X;NumPNum;no;distractor;_
volta a volta;yes;a;volta;politico;Nelle regole probatorie legali, infatti si riscontra un fondamento che può essere sia epistemologico che politico,;volta a volta;"prevalendo l'esigenza di determinare esplicitamente un metodo per ""guidare il giudice alla ricerca"" (art. 103 197 c. p. p.).";sg;_;_;succession/iteration/distributivity;modifier
app su app;no;su;app;di;Per quanto riguarda la connessione mobile, 3g o 4g, le cose sono più complesse perché apple non permette di farlo nativamente, né naturalmente permette la presenza di;app su app;store che lo facciano per noi.;sg/pl;proper_name_inglobation;no;distractor;_
satellite su satellite;no;su;satellite;via;Accesso ad alta velocità al Backbone Internet Europeo e connettività a banda larga, utilizzando tecnologia satellitare bidirezionale mediante canale di comunicazione bidirezionale via;satellite su satellite;geostazionario opportunamente posizionato, e connessione via fibra al Backbone Internet Europeo, con relativa manutenzione ed assistenza tecnica.;sg;N_extended;no;distractor;_
Saturno su Saturno;no;su;Saturno;di;Con il transito di ritorno di ;Saturno su Saturno;"natale ti potrebbe creare solo una certa ""accettazione"" e crescita nel campo descritto.";X;N_extended;no;;_
acciaio su acciaio;yes;su;acciaio;macinare;Esattamente come la vecchia Unione sovietica che macinava;acciaio su acciaio;e, per certi versi, anche la Cina attuale.;sg/pl;_;_;greater_plurality/accumulation;nominal
Sky su Sky;no;su;Sky;di;La partita Napoli-Villarreal sarà trasmessa in diretta tv per gli abbonati di;Sky su Sky;Calcio 1 HD (canale 251).;X;proper_name_inglobation;no;distractor;_
studioso a studioso;no;a;studioso;da;Le stime variano in modo abissale da;_;_;_;_;_;_;_
uomo su uomo;no;su;uomo;di;Il sistema odioso di sfruttamento di;uomo su uomo;.;sg;thematic_target;no;distractor;_
stagione su stagione;yes;su;stagione;colore;Vincenzo dipinse la collinetta per quasi due d'anni, colore su colore,;stagione su stagione;.;sg;_;_;succession/iteration/distributivity;modifier
gomito a gomito;yes;a;gomito;lavorare;Emiliano è un pm di prima linea: è stato in Sicilia dove ha lavorato;gomito a gomito;"con Rosario Livatino, il giovane magistrato ucciso dalla mafia; poi a Brindisi dove con una serie di inchieste ha decapitato la mafia pugliese, la Sacra Corona Unita.";sg;_;_;juxtaposition/contact;modifier
cuore a cuore;yes;a;cuore;mano;Invece la stava invitando a camminare al suo fianco, mano nella mano,;cuore a cuore;.;sg;_;_;juxtaposition/contact;modifier
pesce a pesce;no;a;pesce;da;La moltitudine dei tipi di pesci esige sistemi nutritivi diversi e anche il modo di cibarsi differisce da;_;_;_;_;_;_;_
pedalata su pedalata;yes;su;pedalata;sedere;Non essendo lontana dalla città, raggiungevamo la Carletta in bicicletta, portando sul cannone le ragazze e principiando, con timide e apparentemente occasionali strisciate di ginocchio contro il loro sedere,;pedalata su pedalata;, il rito sessuale ridotto.;sg;_;_;succession/iteration/distributivity;modifier
2 su 2;no;su;2;con;Tra le file dell' Hintegra realizzano le migliori prestazioni offensive Simone Vichi con;2 su 2;e Victor Lopez con 2 su 4.;X;NumPNum;no;distractor;_
37 su 37;no;su;37;essere;Nella votazione delle due di notte eravamo;37 su 37;e alla fine è scoppiato un applauso.;X;NumPNum;no;distractor;_
mansarda a mansarda;no;a;mansarda;da;Io e l'avvocato, viceversa, seguiamo la via interna, più segreta, da;_;_;_;_;_;_;_
nazione a nazione;no;a;nazione;da;All'inizio del XIX secolo lo stile si differenzia da;_;_;_;_;_;_;_
corpo a corpo;no;a;corpo;da;Sembrano interconnesse in una sfida infinita che si tramanda da;_;_;_;_;_;_;_
strati su strati;yes;su;strato;da;L'edificio era chiuso con assi di legno e fregiato da;strati su strati;di graffiti.;pl;_;_;greater_plurality/accumulation;nominal
uomini su uomini;no;su;uomo;di;"Come sottolineavano i compagni tedeschi delle Cellule Rivoluzionarie: ""Noi crediamo che la guerra totale contro il sistema di dominio di";uomini su uomini;acchiuda in se stessa contemporaneamente e in egual misura la lotta contro il sistema capitalistico che è in noi stessi.;pl;thematic_target;no;distractor;_
controlli su controlli;yes;su;controllo;volante;Strade bloccate, frontiere minate, posti di blocco volanti,;controlli su controlli;, ormai il Kosovo è solo questo.;pl;_;_;greater_plurality/accumulation;nominal
pasticci su pasticci;yes;su;pasticcio;commettere;È questo il campo dove le donne commettono;pasticci su pasticci;"; seguono i suggerimenti di tutti e non fanno l'unica cosa che è veramente utile: un esame culturale, per valutare l'agente responsabile dell'infezione e mettere in atto, poi, una terapia mirata, suggerita dallo specialista.";pl;_;_;greater_plurality/accumulation;nominal
acque ad acque;no;a;acque;nube;Dapprima la tempesta opponeva nubi a nubi,;_;_;_;_;_;_;_
porta a porta;yes;a;porta;distribuzione;"Si tratta di vendere questi prodotti attraverso il multilevel marketing, la cosiddetta distribuzione """;porta a porta;""" che funziona attraverso un efficace passa - parola e che permette di guadagnare anche su ogni persona che si riesce a reclutare.";sg;_;_;succession/iteration/distributivity;modifier
bocca a bocca;no;a;bocca;da;Per non far cadere il sugo prendendolo con le dita, glielo passò da;_;_;_;_;_;_;_
deficit a deficit;no;a;deficit;sommare;tutto vero, dirà il pensionato, ma è anche vero che se sommo;_;_;_;_;_;_;_
Pippo su Pippo;no;su;Pippo;su;La spesa per la riparazione, ammontante a venti euro, da ripartirsi tra tutti i condomini, graverà: su Martino su;Pippo su Pippo;e Martino in parti uguali per un terzo su Martino e per due terzi su Pippo.;X;N_extended;no;distractor;_
stagioni su stagioni;yes;su;stagione;trascorrere;Alla finestra sul mondo trascorsero;stagioni su stagioni;, poi fu di nuovo neve.;pl;_;_;greater_plurality/accumulation;nominal
volta a volta;yes;a;volta;che;Anche da questo lato il rispetto per altri torna a riproporsi con una regola che;volta a volta;può richiedere la testimonianza della parola o del silenzio.;sg;_;_;succession/iteration/distributivity;modifier
territorio a territorio;no;a;territorio;da;Ma non avevamo detto che, se la situazione fosse risultata molto diversa da;_;_;_;_;_;_;_
100 su 100;no;su;100;e;Anni dopo Bernardini ripropone lo stesso quesito in una scuola elementare, e;100 su 100;"rispondono: "" 50 anni """;X;NumPNum;no;distractor;_
libri su libri;yes;su;libro;leggere;Non posso non esserle riconoscente per avermi costretta a leggere;libri su libri;che raccontano di san Francesco, dei papi che si sono succeduti in quegli anni, dell'alto Medioevo, della letteratura in lingua d'oc e d'oil, per avermi costretta a documentarmi sulla storia dei conventi e sulla vita monacale.;pl;_;_;greater_plurality/accumulation;nominal
fronte a fronte;yes;a;fronte;trovare;Una volta tolte di mezzo le operaie, le due regine si trovano;fronte a fronte;.;sg;_;_;juxtaposition/contact;modifier
campo a campo;no;a;campo;da;A Durazzo la voce si insegue da;_;_;_;_;_;_;_
mani su mani;no;su;mano;fare;Anche il testo della canzone era stato scritto per essere abbastanza esplicativo e per mostrare cosa si sarebbe dovuto fare (;mani su mani;giù mani dove vuoi) ma l'immagine dei Ricchi & Poveri non era tale da poter imporre un ballo inventato di sana pianta anche perché non c'era più la moda di inventarne di nuovi per il tramite di una canzone lanciata appositamente.;pl;NsuNgiù;yes;distractor;_
paese a paese;no;a;paese;industriale;"La disorganizzazione all'interno delle grandi organizzazioni è comune a tutte le democrazie industriali
paese a paese;no;a;paese;da;È una delle voci più carenti del foglietto, anche perché sono state riscontrate indicazioni diverse da
paese a paese;no;a;paese;da;I vari uffici di collocamento offrono servizi diversi da
palmo a palmo;no;a;palmo;a;Ciò non è avvenuto: per cinque anni il centrosinistra ha combattuto a
palmo a palmo;no;a;palmo;a;Will e Nancy setacciarono di nuovo l'appartamento a
palmo a palmo;no;a;palmo;a;Stupita, scopriva la forma nuova e sorprendente del corpo del suo amico, il calore, il gusto, l'aroma, lo esplorava conquistandolo a
palo a palo;no;a;palo;da;Adesso l'uomo scendeva dal palo in terra, saliva da terra al palo, passava da
parete a parete;no;a;parete;da;Un'attenzione particolare merita il letto, realizzato su disegno del progettista: è un piano in legno (pioppo bordato in massello di rovere) agganciato a una putrella di ferro che corre da
parete a parete;no;a;parete;da;Fu allora che i suoi piedi inciamparono in un filo sottile, teso da
parete a parete;no;a;parete;da;Aveva già costruito la stazione, un villaggio di casette di legno, alberi di cartone e un ambiente di colline e tunnel in miniatura che si stendeva da
pastore a pastore;no;a;pastore;da;Quindi, la Chiesa nascente ha vissuto l'unità inscindibile del deposito rivelato, trasmesso da
paziente a paziente;no;a;paziente;da;Le risposte al farmaco variano da
paziente a paziente;no;a;paziente;da;L'entità di queste alterazioni varia in misura notevole da
paziente a paziente;no;a;paziente;da;L'ampiezza di effetti collaterali varia molto da
paziente a paziente;no;a;paziente;da;L'emicrania si presenta, clinicamente, in modo eterogeneo: la frequenza, la durata e la gravità degli attacchi varia notevolmente da
paziente a paziente;no;a;paziente;da;Sebbene le modalità d'esordio e il decorso clinico siano diversi da
paziente a paziente;no;a;paziente;da;Il recupero totale dall'intervento di cataratta, normalmente, avviene nel giro di 8 settimane, benché possa comunque esservi una certa variabilità da
periodo a periodo;no;a;periodo;da;Interessanti, poi, gli articoli di fine serie, scontatissimi, che varieranno da
persona a persona;no;a;persona;da;Ma ormai è stato appurato con notevole certezza che il funzionamento dei sensi, e quindi anche l'esperienza sensoriale, varia da
persona a persona;no;a;persona;da;Il virus della nuova influenza A si trasmette come una normale influenza stagionale, da
persona a persona;no;a;persona;da;La rete delle connessioni tra le cellule cerebrali cambia da
persona a persona;no;a;persona;da;La ferocia funziona se si propaga come un contagio, di bocca in bocca, da
persona a persona;no;a;persona;da;Già, perché l'orecchio è come un'impronta digitale: la sua dimensione, la sua forma, la sua curvatura, cambiano da
persona a persona;no;a;persona;da;L'anno scorso i pagamenti da
persona a persona;no;a;persona;da;Naturalmente si tratta di valori approssimativi, perché i fattori che possono influire sull'aumento di peso variano da
persona a persona;no;a;persona;da;La malattia, infatti, ha un peggioramento progressivo, in media nell'arco di dieci anni, ma la rapidità con cui i sintomi evolvono varia molto da
persona a persona;no;a;persona;da;La durata della terapia però varia molto da
persona a persona;no;a;persona;da;Questa """"soglia di diversità"""", come chiamiamo il punto di svolta, può differire da""";_;_;_;_;_;_;_
aggettivo su aggettivo;yes;su;aggettivo;frase;"Tutto ""montato"" rase su frase,";aggettivo su aggettivo;, fino al crollo repentino della spaventevole magione.;sg;_;_;succession/iteration/distributivity;modifier
zero a zero;no;a;zero;dal;Noi dobbiamo fare finta che si parta dallo;_;_;_;_;_;_;_
sportello a sportello;no;a;sportello;da;Mai più vedere soggetti che passano da;_;_;_;_;_;_;_
2 su 2;no;su;2;vittoria;La partecipazione è sempre stata sinonimo di vittoria:;2 su 2;con i trionfi del 1985 e 1996.;X;NumPNum;no;distractor;_
gomito a gomito;yes;a;gomito;trovare;Ogni volta che il livello del fiume si abbassa e tutti gli alligatori si affollano nei punti più profondi, i rettili si trovano;gomito a gomito;e si mangiano allegramente tra loro.;sg;_;_;juxtaposition/contact;modifier
soggetto a soggetto;no;a;soggetto;da;La scelta dei mapuche si concretizza in un dato momento - anche biografico perché scelta anche individuale - che risponde a intime esigenze che saranno diverse da;_;_;_;_;_;_;_
autonomia su autonomia;no;su;autonomia;di;Che ripeto che ricordo sono quelle delle inchieste sui gruppi terroristici Brigate Rosse prima linea sono quelli dell'inchiesta di;autonomia su autonomia;operaia inchiesta com'era sette aprile.;sg;proper_name_inglobation;no;distractor;_
2 su 2;no;su;2;in;Al Sud il risultato non è meno clamoroso: il centrosinistra è forza di governo in 4 province su 4 in Abruzzo, in 5 su 5 in Puglia, in;2 su 2;in Basilicata, in 4 su 5 in Campania, in 3 su 5 in Calabria.;X;NumPNum;no;distractor;_
nazione a nazione;no;a;nazione;da;Secondo, perché ci si deve aspettare che l'impatto dell'impiego materno vari molto da;_;_;_;_;_;_;_
guancia a guancia;yes;a;guancia;accostare;Vide ancora come i signori vicino al suo viso, accostati;guancia a guancia;, osservavano l'esito.;sg;_;_;juxtaposition/contact;modifier
justin su justin;no;su;justin;là;belibers.....cazzo calmatevi fate paura....justin di qua justin di là;justin su justin;giù!;X;NsuNgiù;yes;distractor;_
volta a volta;yes;a;volta;pensare;Quanto al corpo, nonostante tanta tradizione del pensiero occidentale (e talvolta, del migliore, come quello di Platone dello stupendo Fedone) sia stata avvezza a pensarlo,;volta a volta;, come tomba dell'anima o come semplice strumento dell'anima stessa, è pur vero che altre tradizioni, ad esempio orientali, si sono profuse a sottolineare che il corpo è come un tempio, in cui l'esperienza multiforme del mondo celebra, istante dopo istante, i propri riti.;sg;_;_;succession/iteration/distributivity;modifier
file su file;yes;su;file;distinguere;I lievi raggi di sole forniscono la sola illuminazione disponibile e, quando i miei occhi si adattano, distinguo;file su file;di feriti, nelle brande, sui pagliericci, sul pavimento, perché sono in tanti a contendersi lo spazio.;pl;_;_;greater_plurality/accumulation;nominal
Christine su Christine;no;su;Christine;cantare;"Nel 1969 anche i Nomadi si dedicano al ""trans"", cantano";Christine su Christine;Jorgensen, una transessuale famosa dal 1952, fotografa, attrice e cantante.;X;proper_name_inglobation;no;distractor;_
gomito a gomito;yes;a;gomito;incatenare;Lavorare durante l'estate, tra giostre, montagne russe e castelli incantati,;gomito a gomito;con i personaggi delle fiabe e con migliaia di turisti, grandi e piccini.;sg;_;_;juxtaposition/contact;modifier
pacchi su pacchi;yes;su;pacco;su;Ci mettemmo una cosa come mezz'ora, facendo avanti e indietro tra la strada e la cucina – pacchi su;pacchi su pacchi;– e quando il tizio con il berretto, sfinito, risalì sul suo furgone e sparì, dalla cucina li portammo in taverna – pacchi su pacchi su pacchi.;pl;_;_;greater_plurality/accumulation;nominal
parlamentari su parlamentari;yes;su;parlamentare;avvicinare;Per mesi Gianni Letta e i lobbisti del Biscione avevano avvicinato;parlamentari su parlamentari;.;pl;_;_;greater_plurality/accumulation;nominal
fronte a fronte;yes;a;fronte;trovare;Proprio nel novembre del '95, in occasione di una tavola rotonda nell'aula Nervi sull'etica in presenza di duemila medici cattolici, Giovanni Paolo II ed Andreotti si trovarono;fronte a fronte;e si scambiarono una lunga stretta di mano in un clima di ovazione.;sg;_;_;juxtaposition/contact;modifier
Android su Android ;no;su;Android ;di;Attualmente è necessario impostare la versione minima di;Android su Android;7,0 (API 24-torrone) per distribuire l'app in dispositivi o emulatori torrone Android.;X;proper_name_inglobation;no;distractor;_
testa a testa;yes;a;testa;quaderno;Giovanissime, con le treccine e gli occhialetti, stanno chine sui quaderni,;testa a testa;insieme ai loro studenti: quelli incapaci di tenere il passo della grande macchina alla conquista del pianeta.;sg;_;_;juxtaposition/contact;modifier
porta a porta;yes;a;porta;vendita;Un trucchetto che mi ha insegnato un mio ex che faceva vendite;porta a porta;non so più di cosa.;sg;_;_;succession/iteration/distributivity;modifier
gomito a gomito;yes;a;gomito;trovare;Questa baraonda e questo carnevale durarono finoache il Pretore, una sera, al cinema, accesasi la luce, si trovò;gomito a gomito;con un individuo interrogato in carcere quella mattina.;sg;_;_;juxtaposition/contact;modifier
22 su 22;no;su;22;astenuto;"Nell' opposizione, tra i socialisti 90 hanno votato a favore mentre 56 si sono astenuti; nel gruppo dei repubblicani e socialisti, invece, i voti contrari sono stati";22 su 22;iscritti.;X;NumPNum;no;distractor;_
gomito a gomito;yes;a;gomito;lottare;Noi ci auguriamo che tutti i comunisti, dappertutto nel mondo, lottino;gomito a gomito;e si oppongano ad ogni attacco di un paese imperialista contro qualsiasi paese del terzo mondo.;sg;_;_;juxtaposition/contact;modifier
metro su metro;yes;su;metro;ingoiare;Ogni volta che ho corso, da quel giorno in poi, ho ingoiato;metro su metro;masticando queste parole salvifiche di mio padre, le parole di Yusuf Omar Nur, figlio di Omar Nur Mohamed.;sg;_;_;greater_plurality/accumulation;nominal
onda su onda;yes;su;onda;arte;Il segreto sta nel piegare i tovaglioli a regola d'arte,;onda su onda;, a cono, a busta di lettera, per far trovare un bigliettino intrigante.;sg;_;_;succession/iteration/distributivity;modifier
 Vichy su Vichy;no;su;Vichy;repubblica;Citazione: si esattamente erano collaborazionisti esattamente come tutta la repubblica;Vichy su Vichy;non ci piove, ma sulle SS permettimi di dissentire per due motivi: - arruolamento volontario - giuramento di fedeltà al fuhrer e allla causa nazional-socialista - iniziazione mistica.;X;N_extended;no;distractor;_
animale ad animale;no;a;animale;da;La ragione sta nell'assetto diverso dei cromosomi, le cui forme e specie quasi sempre variano da;_;_;_;_;_;_;_
stato a stato;no;a;stato;da;Gli effetti, comunque, variano di molto da;_;_;_;_;_;_;_
paese a paese;no;a;paese;da;Poi spetta alle leggi, che variano da;_;_;_;_;_;_;_
guancia a guancia;yes;a;guancia;altro;Riuscì ancora a vedere i due uomini, vicini al suo viso, appoggiati l'uno all'altro;guancia a guancia;, che osservavano la fine.;sg;_;_;juxtaposition/contact;modifier
guancia a guancia;yes;a;guancia;altro;I loro visi si trovarono incollati l'uno all'altro,;guancia a guancia;.;sg;_;_;juxtaposition/contact;modifier
indizi su indizi;yes;su;indizio;affastellare;Gli inquirenti romani stanno affastellando;indizi su indizi;, controlli, visure camerali, che confermerebbero l'ascesa delle 'ndrine in questo angolo esclusivo di Roma Nord.;pl;_;_;greater_plurality/accumulation;nominal
porta a porta;yes;a;porta;estorsione;I Giuliano sembrano un clan giunto al capolinea, lentamente emerso dalla miseria, dal contrabbando alle puttane, dalla gestione dell'estorsione;porta a porta;ai rapimenti.;sg;_;_;succession/iteration/distributivity;modifier
uomini su uomini;no;su;uomo;di;Quindi, anche nel fumetto Bonelli, come in Berserk, ci sono scene di violenza sessuale verso i protagonisti minorenni, o di violenza sessuale di;uomini su uomini;"(le ho elencate entrambe perchè non sapevo cosa consideravi più ""forte"" nella scena di Berserk).";pl;thematic_target;no;distractor;_
gomito a gomito;yes;a;gomito;questo;E se bisognava affrontarlo - bisognava necessariamente affrontarlo - era di certo meglio farlo in gruppo, in questo;gomito a gomito;che ci saldava l'uno all'altro e che era, nell'imminenza del pericolo, come un ultimo rifugio.;sg;_;_;juxtaposition/contact;modifier
volta a volta;yes;a;volta;stare;Per esempio lo spazio cosmologico, che è stato;volta a volta;pensato e descritto finito, o infinito, e gli infiniti mondi nello spazio infinito immaginati da Giordano Bruno gli costaronola vita, limitato o illimitato.;sg;_;_;succession/iteration/distributivity;modifier
porta a porta;yes;a;porta;raccolta;Nel 2002 è tra i tecnici che collaborano all'attivazione della raccolta;porta a porta;in alcuni Comuni della Provincia di Torino.;sg;_;_;succession/iteration/distributivity;modifier
24 su 24;no;su;24;disponibile;Tale contenitore poi, grazie alla tecnologia e software di ultima generazione, è disponibile;24 su 24;online e aggiornato in tempo reale, permettendo così ai potenziali clienti di visionare gli immobili direttamente da casa o ufficio, e ai collaboratori del gruppo sparsi in Italia o all' estero di consultare e fornire proposte svincolate dal limite della territorialità di competenza.;X;NumPNum;no;distractor;_
guancia a guancia;yes;a;guancia;lui;Avrei voluto poter cucinare al mio lui una costata, sapendo che gli piaceva cotta al punto giusto, poter danzare con lui;guancia a guancia;.;sg;_;_;juxtaposition/contact;modifier
onda su onda;yes;su;onda;voga;Restando in tema acquatico, si voga;onda su onda;, al concerto dei Litfiba.;sg;_;_;succession/iteration/distributivity;modifier
goccia a goccia ;no;a;goccia;a;Questo verme si nutre del sangue umano, che si procura facendo piccolissimi fori nella mucosa dell'intestino, da cui lascia colare il sangue a;_;_;_;_;_;_;_
volta a volta;yes;a;volta;incarnazione;Per questo uomini non sprovveduti hanno pensato, nel corso dei secoli, ai Signori o al Re del Mondo, forse non una persona fisica, un ruolo, un ruolo collettivo, l'incarnazione;volta a volta;provvisoria di una Intenzione Stabile.;sg;_;_;succession/iteration/distributivity;modifier
facebook su facebook;no;su;facebook;di;la censura su facebook esiste, non si deve parlare male di;facebook su facebook;e non si devono aprire discorsi seri che non c'entrano con le informazioni private che servono 1: a controllarti 2: a sapere cosa pensano i giovani su determinati prodotti.;X;thematic_target;no;distractor;_
19 su 19;no;su;19;scioperare;A Lecco si è registrato una adesione del 100 per cento (hanno scioperato;19 su 19;) così come al tribunale di sorveglianza di Milano (9 su 9).;X;NumPNum;no;distractor;_
bambini su bambini;no;su;bambino;di;Come impone la legge, nei casi di espianti di;bambini su bambini;di età inferiore a 5 anni, prima di procedere si sono dovute attendere le 24 ore richieste.;pl;N_extended;no;distractor;_
soddisfazioni a soddisfazioni;no;a;soddisfazioni;aggiungere;All'ambizioso Snezhnevskij, vincente sul piano scientifico e prono servitore del regime, la carriera politico - professionale non fece che aggiungere;_;_;_;_;_;_;_
goccia a goccia ;no;a;goccia;a;Quando lo zucchero si è completamente sciolto e forma un filo continuo se preso fra il pollice e l'indice, toglietelo dal fuoco e versatelo a;_;_;_;_;_;_;_
frase su frase;yes;su;frase;brandello;Il racconto che brandello su brandello,;frase su frase;, strappavo ai miei ricordi, come un cancro luminoso divorava la mia vita.;sg;_;_;succession/iteration/distributivity;modifier
bambini su bambini;no;su;bambino;di;All'inizio della settimana ho scritto un articolo circa le recenti notizie provenienti dal Kansas sui tassi di violenze sessuali di;bambini su bambini;, aumentate bruscamente...anche la polizia del Regno Unito ha segnalato questa tendenza (40.000 segnalazioni in un paio di anni)…;pl;thematic_target;no;distractor;_
uomini su uomini;no;su;uomo;di;Sono sempre segno di un'ingiustizia regnante, di oppressione di;uomini su uomini;.;pl;thematic_target;no;distractor;_
nomi su nomi;yes;su;nome;snocciolare;Poi cambia registro, si arruola nell'esercito opposto, riscrive un pó di anni di storia, snocciola;nomi su nomi;che solerti funzionari di partito in toga inseriscono negli spazi bianchi di mandati di cattura già pronti;pl;_;_;greater_plurality/accumulation;nominal
materia su materia;yes;su;materia;di;Cazzetti, fichette, zinnette, culetti sodi esplodono su di me in una cosmogonia di;materia su materia;.;sg;_;_;greater_plurality/accumulation;nominal
lingua a lingua;no;a;lingua;da;Quando i prestiti avvengono da;_;_;_;_;_;_;_
permessi su permessi;yes;su;permesso;necessario;Il secondo problema è quello del rispetto delle norme: per gestire correttamente una discoteca sarebbero necessari;permessi su permessi;, certificati su certificati.;pl;_;_;greater_plurality/accumulation;nominal
riunioni su riunioni;yes;su;riunione;fare;Da dieci giorni stiamo dicendo in tutte le sedi che bisognava intervenire: si è perduto tempo a discutere, a prendere contatti diplomatici, a fare;riunioni su riunioni;, dichiarazioni su dichiarazioni, mentre la tragedia albanese richiedeva interventi rapidi, decisi, organici, massicci.;pl;_;_;greater_plurality/accumulation;nominal
base su base;no;su;base;di;Agenzia Nazionale per la Ricerca (ANR), creata nel 2007 per finanziare progetti di ricerca di;base su base;competitiva.;sg;N_extended;no;distractor;_
porta a porta;yes;a;porta;venditore;Ma l'azienda cremonese ha bisogno anche di venditori;porta a porta;.;sg;_;_;succession/iteration/distributivity;modifier
ciglio a ciglio;no;a;ciglio;da;Se il confine si trova in un fosso comune o in una via privata, la distanza si misura da;_;_;_;_;_;_;_
giornalisti su giornalisti;no;su;giornalista;di;Torna l' estate, tornano puntuali come le zanzare i libri di; giornalisti su giornalisti;e con la calura tornano a scoppiare anche le polemiche tra gli anchormen di casa Mediaset, in primis quella tra Emilio Fede ed Enrico Mentana.;pl;thematic_target;no;distractor;_
legume a legume;no;a;legume;da;I tempi di cottura variano da;_;_;_;_;_;_;_
