NPN;construction;preposition;noun;pre_lemma;context_pre;costr;context_post;number_of_noun;Type;other_cxn;meaning;syntactic_function
comunicazioni su comunicazioni;yes;su;comunicazione;ovvero;La capacità di significare tramite icone implica anche che tutti i processi di comunicazione siano di secondo livello, ovvero;comunicazioni su comunicazioni;, spesso lontane dalla vita quotidiana.;pl;_;_;greater_plurality/accumulation;nominal
Italia su Italia;no;su;Italia;in;Ricordiamo che Futurama è partita in America sul network FOX il 28 marzo 1999, ed ha esordito in;Italia su Italia;1 in prima serata alle 20.45 il 6 gennaio 2000.;sg;proper_name_inglobation;no;distractor;_
jeans su jeans;no;su;jeans;di;Quindi abbinare un capo di questo tipo è, sottinteso, che sarà più facile di una semplice camicia di;jeans su jeans;elegante oppure un giabbottino.;sg/pl;N_extended;no;distractor;_
24 su 24;no;su;24;trasmettere;"Un ospedale di Pittsburgh fornisce addirittura una stazione televisiva chiamata ""Humor Helps Healing"" (l'umorismo aiuta a guarire), che trasmette";24 su 24;", mentre in South Carolina, i ""terapisti dell' umorismo"" hanno formato la Carolina Humour and Healing Association (HaHa).";X;NumPNum;no;distractor;_
autore a autore;no;a;autore;da;Certo, ed è persino superfluo ricordarlo, l'orchestrazione del dialogato conosce modulazioni plurime, variando da;_;_;_;_;_;_;_
numero su numero;no;su;numero;deviazione;È possibile cancellare simultaneamente la programmazione dei servizi prenotazione, deviazione; numero su numero;interno, deviazione su numero esterno e non disturbare.;sg;N_extended;no;distractor;_
base su base;no;su;base;di;La povertà mestruale - la lotta per pagare i prodotti sanitari di;base su base;mensile - è aumentata durante la pandemia di coronavirus , secondo le associazioni di beneficenza.;sg;N_extended;no;distractor;_
uomo a uomo;no;a;uomo;ovunque;"Milioni di persone hanno lasciato Wuhan prima che fosse isolata, spargendo il virus ovunque
uomo a uomo;no;a;uomo;da;Questa trasformazione, ipotizzano gli studiosi, """"potrebbe essere dovuta a variazioni o nelle capacità del virus di trasmettersi da""";_;_;_;_;_;_;_
volta a volta;yes;a;volta;metodologico;Ciò non sembra sufficiente per rispondere in modo adeguato a quanto mostrato dagli studi di storia della scienza: ovvero che gli scienziati non si comportano affatto secondo gli standard metodologici;volta a volta;avanzati.;sg;_;_;succession/iteration/distributivity;modifier
Guccini su Guccini;no;su;Guccini;di;Forse il fatto d'essere un lavoro di;Guccini su Guccini;, la possibilità di curiosare nell'armadio dei sogni e dei ricordi, mettendoci a disposizione fin dalla copertina la foto di famiglia del bisnonno che gli ha dato il nome (e sul retro, ma non cercatela nel booklet del cd, un'austera immagine della sua,;X;thematic_target;no;distractor;_
uomo a uomo;no;a;uomo;da;"Gli esperti, nel frattempo, ritengono che la trasmissione del virus dell'""influenza dei polli"" sia possibile anche da";_;_;_;_;_;_;_
ragazzo a ragazzo;no;a;ragazzo;da;In Danimarca, un insegnante ha iniziato una forma di aiuto da;_;_;_;_;_;_;_
porta a porta;yes;a;porta;consegna;"La consistenza della voce ""altre attività"" (28,9%: include ""altri settori produttivi"", ""attività specifiche d'impresa"", ""maneggi e scuderie"", ""consegna";porta a porta;""", altre attività residuali o non codificate) è il riflesso della storia del lavoro accessorio, all'origine destinato ad ambiti oggettivi di impiego circoscritti (quindi codificabili), negli anni progressivamente ampliati, fino alla riforma contenuta nella legge 92 del 2012 che permette di fatto l'utilizzo di lavoro accessorio per qualsiasi tipologia di attività.";sg;_;_;succession/iteration/distributivity;modifier
uomini su uomini;no;su;uomo;di;Perché ogni governo è di;uomini su uomini;.;pl;thematic_target;no;distractor;_
soldi su soldi;yes;su;soldi;e;Il meccanismo adottato in Francia per convincere i cittadini della ineluttabilità del nucleare è lo stesso adottato di recente in Italia: balle su balle raccontate da venduti e;soldi su soldi;per la pubblicità e per foraggiare i giornali.;pl;_;_;greater_plurality/accumulation;nominal
soldi su soldi;yes;su;soldi;fare;Insomma c'è ancora tempo, e spazio, per fare;soldi su soldi;su soldi vendendo e spedendo in tutto il mondo i vecchi libri di carta: tanto più se fatti in casa.;pl;_;_;greater_plurality/accumulation;nominal
Camerino su Camerino;no;su;Camerino;di;Interventi Regione ed Università di;Camerino su Camerino;.;X;proper_name_inglobation;no;distractor;_
categoria a categoria;no;a;categoria;da;Negli ultimi anni il fatturato dei professionisti - spiega Gaetano Stella, presidente di Confprofessioni - è calato da;_;_;_;_;_;_;_
situazione a situazione;no;a;situazione;da;Il peso di Rifondazione comunista è diverso da;_;_;_;_;_;_;_
guancia a guancia;yes;a;guancia;che;Primo piano dei due volti - quello scuro di mio figlio e quello chiarissimo di Hans - che,;guancia a guancia;, ridono felici.;sg;_;_;juxtaposition/contact;modifier
file su file;yes;su;file;incassare;Il salotto era ampio e le pareti, nelle quali erano incassate;file su file;"di scaffali laccati di nero, erano tappezzate di una stoffa damascata in cui il nero prevaleva sul rosso; divano e poltrone erano rivestiti dello stesso tessuto delle pareti e i tappeti armonizzavano con il resto dell'arredamento";pl;_;_;greater_plurality/accumulation;nominal
guancia a guancia;yes;a;guancia;abbracciare;Gli indicò gli aiutanti che si tenevano abbracciati,;guancia a guancia;", con un sorriso che poteva essere umile o ironico; gli indicò tutti costoro come per presentargli un seguito impostogli da particolari circostanze, aspettandosi però - in ciò vi era una certa confidenza, ed era questa a cui egli mirava - che Barnabas distinguesse sempre bene fra lui e loro.";sg;_;_;juxtaposition/contact;modifier
gomito a gomito;yes;a;gomito;giornata;Il podestà si era lungamente preparato a sostenere la parte: avrebbe dovuto passare tutta una giornata;gomito a gomito;con la sua antica morosa e con l'altrettanto antico timoniere che gliel'aveva soffiata.;sg;_;_;juxtaposition/contact;modifier
guancia a guancia;yes;a;guancia;stare;Me lo accosto al viso, quasi lo tocco con gli occhi, mentre Zot arriva e stiamo;guancia a guancia;a guardarlo, così vicini che i nostri respiri diventerebbero uno solo, se ci riuscisse respirare.;sg;_;_;juxtaposition/contact;modifier
corpo a corpo;no;a;corpo;a;Le tattiche riflettono le tradizionali forme di lotta a;_;_;_;_;_;_;_
riunioni su riunioni;yes;su;riunione;e;Ma per arrivare sino a quel punto, a quel sospiro di sollievo, ci sono state ore di trattative ininterrotte e telefonate notturne e sveglie all'alba e;riunioni su riunioni;.;pl;_;_;greater_plurality/accumulation;nominal
compagnia a compagnia;no;a;compagnia;da;Il costo del biglietto può variare da;_;_;_;_;_;_;_
soggetto a soggetto;no;a;soggetto;da;Ciò significa che esiste un rischio individuale di danno sul fegato da parte dell'alcol, che varia molto da;_;_;_;_;_;_;_
Sciascia su Sciascia;no;su;Sciascia;di;Ha curato l'edizione del Quaderno dell'Associazione Amici di;Sciascia su Sciascia;eretico del genere giallo (La vita felice, 2006) e la prefazione dell'edizione italiana de Il controllo della parola di André Schiffrin (Bollati Boringhieri, 2006).;X;proper_name_inglobation;no;distractor;_
dubbi su dubbi;yes;su;dubbio;accumulare;Chiara era felice perché questa scelta le aveva evitato di accumulare;dubbi su dubbi;, perché Alessandro D'Amico era una garanzia.;pl;_;_;greater_plurality/accumulation;nominal
situazione a situazione;no;a;situazione;da;Ray si rendeva perfettamente conto che le esigenze e i rapporti di forza variano da;_;_;_;_;_;_;_
assalti su assalti;yes;su;assalto;lanciare;Sull'ala destra, la cavalleria di Besso si era infranta contro la massa della fanteria pesante greca, ma continuava a lanciare;assalti su assalti;, a ondate, come marosi che frangevano contro le rocce.;pl;_;_;greater_plurality/accumulation;nominal
soggetto a soggetto;no;a;soggetto;da;Finora, il Dr. Biller e gli altri esperti non son stati in grado d'identificare il motivo per cui la malattia progredisce a ritmo così variabile da;_;_;_;_;_;_;_
gomito a gomito;yes;a;gomito;Brasile;Dal 7 al 10 maggio sono stato in Brasile,;gomito a gomito;con 10 baristi, provenienti da tutto il mondo, selezionati per partecipare a Barista & Farmer, il talent show made in Italy pensato per permettere ai baristi di andare alle origini del prodotto con cui lavora tutti i giorni e di cui è appassionato: il caffè.;sg;_;_;juxtaposition/contact;modifier
porta a porta;yes;a;porta;bigiotteria;Profumino invadente di tabaccaio di lusso spacciato per raro oggetto di profumeria, qui la tirchieria è di casa, roba che ti intontisce l'olfatto, venditrice di bigiotteria;porta a porta;o casalinga con marito assente, fa tante telefonate ad amiche che fanno anche loro tante telefonate.;sg;_;_;succession/iteration/distributivity;modifier
cuore a cuore;yes;a;cuore;contatto;E poi ci fu la marsupioterapia, il primo contatto;cuore a cuore;.;sg;_;_;juxtaposition/contact;modifier
balle su balle;yes;su;balla;Italia;Il meccanismo adottato in Francia per convincere i cittadini della ineluttabilità del nucleare è lo stesso adottato di recente in Italia:;balle su balle;raccontate da venduti e soldi su soldi per la pubblicità e per foraggiare i giornali.;pl;_;_;greater_plurality/accumulation;nominal
testa a testa;yes;a;testa;e;"Lei, liberandosi, mi accarezzò la guancia; eravamo appoggiati di fianco al finestrino e,";testa a testa;, con la fronte appoggiata al vetro vedevamo correre veloci le nostre due ombre vicine, proiettate sulla campagna.;sg;_;_;juxtaposition/contact;modifier
uomini su uomini;no;su;uomo;di; Questa domanda non si può respingere con la speranza che allora tutto andrebbe di per sè, che le cose si regolerebbero da sole, che un governo di;uomini su uomini;sarebbe divenuto superfluo, perchè gli uomini allora sarebbero assolutamente liberi.;pl;thematic_target;no;distractor;_
goccia a goccia ;no;a;goccia;a;Diventai come un recipiente che venga riempito a;_;_;_;_;_;_;_
gomito a gomito;yes;a;gomito;spalla;Ci hanno divisi per evitare problemi, perquanto era possibile, vistoche si camminava tutto il giorno spalla a spalla,;gomito a gomito;, a passi diversi, ma alla stessa velocità, e quando vivi una situazione di fatica e scomodità come quella, con poco cibo e poca acqua e nessun posto dove ripararsi e molto freddo, invece, molto, molto freddo, be', i battibecchi e le risse sono sempre dietro l'angolo, in agguato, e gli accoltellamenti anche, quindi è meglio tenere separate le etnie ostili.;sg;_;_;juxtaposition/contact;modifier
bozzi su bozzi;yes;su;bozzo;chiamare;"""Da queste parti la chiamano";bozzi su bozzi;""", ridimensionò subito la faccenda.";pl;_;_;greater_plurality/accumulation;nominal
bicchiere su bicchiere;yes;su;bicchiere;sommare;Poco sveglio da giovane, invecchiando aveva peggiorato e al calare del sole il vino che s'era bevuto durante il giorno, sommandosi;bicchiere su bicchiere;, lo riduceva ad appisolarsi accantoal fuoco d'inverno o sotto l'albero del cortile al tempo della buona stagione.;sg;_;_;succession/iteration/distributivity;modifier
bambino a bambino;no;a;bambino;da;Le difficoltà e i successi ovviamente variano da;_;_;_;_;_;_;_
euro su euro;yes;su;euro;risparmiare;Sposando Luigi, avrebbe lavorato per tutta la vita negli uffici della Coop, risparmiando;euro su euro;per arrivare alla fine del mese.;sg/pl;_;_;greater_plurality/accumulation;nominal
guancia a guancia;yes;a;guancia;ballare;E ha una canzone del cuore, la canzone che ascoltava da govane quando ballava;guancia a guancia;con Filippo di Grecia, suo futuro sposo, ora Filippo d'Edimburgo e Principe consorte.;sg;_;_;juxtaposition/contact;modifier
zero a zero;no;a;zero;sul;Nino Malandrino quel 29 aprile era stato l'eroe del giorno, parando un rigore sullo;_;_;_;_;_;_;_
gomito a gomito;yes;a;gomito;imparare;Alla Pisacane studiano 87 bambini stranieri su cento, e la percentuale è in crescita: bengalesi, cinesi, romeni, polacchi, colombiani, filippini, algerini, egiziani e italiani imparano;gomito a gomito;«a leggere e scrivere in stampatello e corsivo», e «eseguono le addizioni con 3 numeri», giura un gruppo di genitori in un appello ad altri italiani a iscrivere i loro figli nonostante le continue polemiche.;sg;_;_;juxtaposition/contact;modifier
gomito a gomito;yes;a;gomito;mettere;E non è possibile metterli;gomito a gomito;con le donne gomito a gomito, al lavandino, in un gabinetto.;sg;_;_;juxtaposition/contact;modifier
50 su 50;no;su;50;di;Fatta la prova di mercoledì, la domenica uscivano i risultati che dichiaravano che io avevo preso un punteggio di;50 su 50;!!!!! classificandomi primo insieme ad altri ventisette.;X;NumPNum;no;distractor;_
gomito a gomito;yes;a;gomito;trovare;Era la prima volta che mi trovavo;gomito a gomito;con qualcosa o qualcuno di nobile stirpe, la mia famiglia inclusa.;sg;_;_;juxtaposition/contact;modifier
uomo a uomo;no;a;uomo;da;Zika, inoltre, si rivelò molto più complicato di Ebola: mentre Ebola si diffonde quasi esclusivamente da;_;_;_;_;_;_;_
goccia a goccia ;no;a;goccia;a;Riprendendo ad avanzare, come attratta da una forza oscura, verso il Santuario, sentì che, a;_;_;_;_;_;_;_
goccia a goccia ;no;a;goccia;a;Il giardiniere versò il latte a;_;_;_;_;_;_;_
strato su strato;yes;su;strato;che;Ad un certo punto incontrarono una fontana ghiacciata che,;strato su strato;", aveva formato una specie di scultura che sembrava la sagoma di un animale; ma a dire il vero bastava girarsi intorno per riconoscere nel paesaggio mille immagini diverse disegnate dalla galaverna.";sg;_;_;succession/iteration/distributivity;modifier
100 su 100;no;su;100;di;Il valore modale ottenuto è di;100 su 100;, questo è quindi il valore che ricorre più frequentemente.;X;NumPNum;no;distractor;_
foglia a foglia;no;a;foglia;da;Liscio come uno specchio tanto che il vento non rimbalzava da;_;_;_;_;_;_;_
11 su 11;no;su;11;effettuare;Da ricordare la prestazione contro il Belgio allorchè ne ha effettuate;11 su 11;tiri nello specchio della porta degli avversari.;X;NumPNum;no;distractor;_
zero a zero;no;a;zero;sul;Il risultato non si sbloccava e si era sempre sullo;_;_;_;_;_;_;_
assalti su assalti;yes;su;assalto;con;e impugnava lo stendardo rosso con la stella argeade a sedici punte , lanciava  assalti su assalti , ma gli squadroni dei cavalieri arabi e assiri contrattaccavano ogni volta con;assalti su assalti;, ma gli squadroni dei cavalieri arabi e assiri contrattaccavano ogni volta con caparbio valore, sostenuti dai continui, fitti lanci di frecce degli arcieri medi e armeni.;pl;_;_;greater_plurality/accumulation;nominal
valle a valle;no;a;valle;da;Nei rastrellamenti dell'estate 1944 dovemmo spostare da;_;_;_;_;_;_;_
vacche su vacche;no;su;vacca;caricare;È suo il conio del palidromo accavallavacca (strumento per caricare;vacche su vacche;", o vacche su cavalli; vedi anche alle voci lavacavalli e vacca).";pl;thematic_target;no;distractor;_
porta a porta;yes;a;porta;enciclopedia;Annunci del genere, sui giornali italiani, ormai riguardano solo i venditori di enciclopedie;porta a porta;.;sg;_;_;succession/iteration/distributivity;modifier
porta a porta;yes;a;porta;rappresentante;Suo padre faceva il rappresentante;porta a porta;per la Rawleigh, un'azienda di prodotti per la casa.;sg;_;_;succession/iteration/distributivity;modifier
Italia su Italia;no;su;Italia;in;"Una curiosità: Sandra Vidal ha partecipato alla versione americana del programma "" Popstars "", trasmesso anche in";Italia su Italia;1.;X;proper_name_inglobation;no;distractor;_
volta a volta;yes;a;volta;essere;I contributi alla comune cultura europea possono essere;volta a volta;preziosissimi come nel caso della libreria di Jim Stirling nei giardini della Biennale di Venezia o invece di una disarmante superficialità come nelcaso del progetto vincitore della nuova uscita del museo degli Uffizi a Firenze.;sg;_;_;succession/iteration/distributivity;modifier
strato su strato;yes;su;strato;cipolla;A sua volta, il pensiero si divide, come dire, anche da se stesso, in accumulo, foglio sopra foglio, azione dopo ricordo, riflessione sopra decisione, lasciandomi come una grande cipolla,;strato su strato;, nel cui cuore profondo risuonano, lancinanti e abissali, le parole del Grande Matthys, il Dio Fornaio.;sg;_;_;succession/iteration/distributivity;modifier
corpo a corpo;no;a;corpo;a;Così Alba venne a conoscenza di un principe che aveva dormito cent'anni, di damigelle che lottavano a;_;_;_;_;_;_;_
strato su strato;yes;su;strato;incollare;L'unica traccia di colore era offerta dai manifesti elettorali, sbiaditi e incollati;strato su strato;.;sg;_;_;succession/iteration/distributivity;modifier
volume su volume;no;su;volume;indietro;Questo è un semplice lettore con play pausa avanti indietro;volume su volume;giù.;sg;NsuNgiù;yes;distractor;_
61 su 61;no;su;61;il;L'ha data già il caso Fiat, bisogna insistere per eliminare anche la mafia, artefice del successo del polo con i;61 su 61;.;X;NumPNum;no;distractor;_
balcone a balcone;yes;a;balcone;confinare;La comunità di gatti che mi ospita sta nell'appartamento in cui abitiamo, che confina,;balcone a balcone;, con un altro appartamento nel quale viveva fino a poco tempo fa una gatta vecchia e sola.;sg;_;_;juxtaposition/contact;modifier
campo a campo;no;a;campo;da;Per muovere il punto di inserzione da;_;_;_;_;_;_;_
fronte a fronte;yes;a;fronte;trovare;Hussein, alla minaccia di trovarsi;fronte a fronte;con Amintore e soprattutto con Maria Pia, ha pianto lungamente e voleva far caricare sul jumbo anche un paio di emiri kuwaitiani con tutte le mogli e figli.;sg;_;_;juxtaposition/contact;modifier
gomito a gomito;yes;a;gomito;hôte;Credo di avere già scritto su questo mio diario l'impressione che ho riportato di quella grande birreria monacense dove i bavaresi si affollano intorno a lunghe tables d'hôte,;gomito a gomito;, svergognandosi di salsicce untuose e sorbendosi boccali grandi quanto un tino, uomini e donne, le donne più ridanciane, rumorose e volgari degli uomini.;sg;_;_;juxtaposition/contact;modifier
periodi su periodi;no;su;periodo;avere;Tornando al banco,devo dire che i suoi dischi li amo tuttora,certo hanno avuto;periodi su periodi;ma son sempre stati più che dignitosi.;pl;NsuNgiù;yes;distractor;_
faccia a faccia;no;a;faccia;confuso;"Ora vediamo come in uno specchio, in maniera confusa
faccia a faccia;no;a;faccia;a;Varan girò la testa e si trovò a
faccia a faccia;no;a;faccia;a;Daniele partì di corsa, senza pensare e in un secondo si ritrovò tra le suore che lo bloccarono e lui si ritrovò a
farmaco a farmaco;no;a;farmaco;da;Gli inibitori della proteasi, ed in misura minore efavirenz, possono provocare aumento delle concentrazioni ematiche dei farmaci neurolettici, convenzionali e di nuova generazione, in misura variabile da
farmaco a farmaco;no;a;farmaco;da;L'uso concomitante di Inibitori della Proteasi provoca una riduzione della AUC del metadone, variabile da
farmaco a farmaco;no;a;farmaco;da;L'ampiezza di effetti collaterali varia molto da paziente a paziente e da
fase a fase;no;a;fase;da;È interessante notare come la sensibilità al tema delle radici varia da movimento a movimento e da
fibra a fibra;no;a;fibra;da;Il mio nervo acustico è ormai stiracchiato da
film a film;no;a;film;da;Il più significativo fu quello che troviamo nella carriera di un trasgressore radicale e, nel suo passare da
film a film;no;a;film;da;E per quanto le risposte varino molto da
film a film;no;a;film;da;Evidentemente gli esiti stilistici sono diversi da
finestra a finestra;no;a;finestra;da;Aurora vive in un quartiere molto difficile di Aprilia, """"vicino alle case popolari"""", spiega, """"e capita che ci si spari da""";_;_;_;_;_;_;_
volta a volta;yes;a;volta;recitare;Una sua vanteria, immagino, di poter recitare;volta a volta;la parte del defensor fidei e dell'avvocato del diavolo, facendosi apologista ora dei carabinieri, ora dei lestofanti.;sg;_;_;succession/iteration/distributivity;modifier
volta a volta;yes;a;volta;scagliare;I suoi attori, ancora stancamente presenti, si scagliano;volta a volta;contro il sistema della partitocrazia, contro il regime del Caf, contro un sistema imprenditoriale arretrato, contro un mondo dell'informazione che ha preferito distorcere il suo prodotto (ma c'è chi preferisce considerarlo un servizio) al di là del lecito, contro l'organizzazione statale: tutti elementi indubbiamente intrecciati, ma ciascuno dotato anche di vita propria e di inesauribili capacità di sopravvivere alla sua stessa pubblica sconfessione.;sg;_;_;succession/iteration/distributivity;modifier
libri su libri;yes;su;libro;continuare;Le ho già detto che ricevo in continuazione;libri su libri;.;pl;_;_;greater_plurality/accumulation;nominal
massacri a massacri;no;a;massacri;aggiungere;Sottintendeva: ne abbiamo abbastanza di questi generali che aggiungono;_;_;_;_;_;_;_
soggetto a soggetto;no;a;soggetto;da;Una considerazione importante è che in entrambe le forme i sintomi, che vengono riferiti all'esposizione EM, sono molto variabili da;_;_;_;_;_;_;_
telegrammi su telegrammi;yes;su;telegramma;spedire;So benissimo che tu qui spedivi;telegrammi su telegrammi;.;pl;_;_;greater_plurality/accumulation;nominal
119 su 119;no;su;119;tutto;Attivate al 100 % le procedure di bonifica per i siti inquinati a breve termine, in tutto;119 su 119;, e al 58 % quelle per i 146 siti a medio termine, mentre per i 60 siti di piano definiti ' in approfondimentò (considerati a medio termine nell' attesa della definitiva classificazione nell' ambito dell' approvazione dei Piani Provinciali), tale percentuale scende al 32 %.;X;NumPNum;no;distractor;_
porta a porta;yes;a;porta;differenziato;Al via la raccolta differenziata a Molini, Girola e Valtenna Mercoledì 18 dicembre inizia il nuovo servizio di raccolta differenziata -;porta a porta;nei quartieri Molini, Girola e Valtenna.;sg;_;_;succession/iteration/distributivity;modifier
gomito a gomito;yes;a;gomito;lavorare;A metà della scala si potrebbero porre invece quelle che mostrano artisti e scienziati lavorare;gomito a gomito;, producendo conoscenze o rappresentazioni reciprocamente utili, come accadeva per esempio agli incisori che si affiancarono ad anatomisti e astronomi da cui dipendono le due grandi rivoluzioni scientifiche della modernità.;sg;_;_;juxtaposition/contact;modifier
elemento a elemento;no;a;elemento;da;La concentrazione, a cui una sostanza provoca inquinamento, varia molto da;_;_;_;_;_;_;_
soggetto a soggetto;no;a;soggetto;da;I segni clinici, la cui intensità varia da;_;_;_;_;_;_;_
porta a porta;yes;a;porta;venditore;Dopo anni passati prima come venditore;porta a porta;di assicurazioni e di calzature per donne, poi come comparsa in film e serie televisive dimenticabili come Il ritorno dei pomodori assassini e Baby talk, questo è il suo momento.;sg;_;_;succession/iteration/distributivity;modifier
bambino a bambino;no;a;bambino;da;Eppure non è mai stato provato un caso al mondo di contagio da;_;_;_;_;_;_;_
crosta su crosta;yes;su;crosta;successivo;Dall'alto del Forte capisco il rinnovo degli strati successivi,;crosta su crosta;.;sg;_;_;succession/iteration/distributivity;modifier
Apple su Apple;no;su;Apple;di;Anche Noi di Zoleounge.it stiamo promuovendo il Back Friday di Apple e se siete in procinto di acquistare con gli sconti del BlackFriday 2010 di;Apple su Apple;Italia, iTunes Store o su App Store e volete aiutare Zoelounge.it senza peraltro spendere una lira in più, potreste prendere in considerazione l'idea di cliccare su uno dei banner presenti in questa pagina o nei banner presenti nella sidebar.;X;proper_name_inglobation;no;distractor;_
porta a porta;yes;a;porta;vendita;Alla quale vanno aggiunti ancora un sindacato (Domina: organizzazione dei datori di lavoro domestico), un patronato (Informafamiglia), una società (Rete - Rete) per vendite;porta a porta;.;sg;_;_;succession/iteration/distributivity;modifier
coltura a coltura;no;a;coltura;da;Si è visto che la colza GM è una coltura ad alto rischio per quanto riguarda il flusso di geni da;_;_;_;_;_;_;_
gomito a gomito;yes;a;gomito;giorno;Will (e credo, segretamente, anche Ben) ha sempre invidiato il mio lavoro e il fatto che mi costringa a stare quasi ogni giorno;gomito a gomito;con decine di modelle tutte stupende!;sg;_;_;juxtaposition/contact;modifier
copie su copie;yes;su;copia;accatastare;Nel suo ufficio sono accatastate;copie su copie;della Fattoria degli animali di Orwell: il contributo del governo britannico all'insegnamento dell'inglese nelle scuole afghane e una lezione elementare sui danni del marxismo, messa in bocca a un maiale.;pl;_;_;greater_plurality/accumulation;nominal
intenditore a intenditore;no;a;intenditore;da;Il rapporto tra gin e vermouth varia da;_;_;_;_;_;_;_
granellino su granellino;yes;su;granellino;edilizio;E non meno sorprendente è la tecnica costruttiva della formica - bussola australiana (Amitermes meridionalis) i cui operai ciechi sanno deporre il materiale edilizio,;granellino su granellino;, in modo tale che il risultato sia un nido cuneiforme con l'asse maggiore orientato rigorosamente in direzione Nord - Sud.;sg;_;_;succession/iteration/distributivity;modifier
porta a porta;yes;a;porta;firma;Scompariranno le sue leggendarie ma costose campagne per il finanziamento, durante le quali migliaia di militanti stipendiati raccoglievano soldi e firme;porta a porta;.;sg;_;_;succession/iteration/distributivity;modifier
