NPN;construction;preposition;noun;pre_lemma;context_pre;costr;context_post;number_of_noun;Type;other_cxn;meaning;syntactic_function
uomini su uomini;no;su;uomo;di;Ne restasse fuori anche uno solo, anche una sola testa, su cosa potrebbe mai fondarsi una nazione se non sul dominio di;uomini su uomini;?;pl;thematic_target;no;distractor;_
bambini su bambini;no;su;bambino;di;Come impone la legge, nei casi di espianti di;bambini su bambini;di età inferiore a 5 anni, prima di procedere si sono dovute attendere le 24 ore richieste.;pl;N_extended;no;distractor;_
2 su 2;no;su;3;e;Da segnalare anche un ottima prestazione di Cazzulo con 3 su 3 da due e;2 su 2;dalla lunetta, in momenti importanti della gara.;X;NumPNum;no;distractor;_
massacri a massacri;no;a;massacri;aggiungere;Sottintendeva: ne abbiamo abbastanza di questi generali che aggiungono;_;_;_;_;_;_;_
palmo a palmo;yes;a;palmo;battere;Il geometra De Palo e il geometra Ranieri vengono sguinzagliati per battere;palmo a palmo;la città sulle loro station wagon.;sg;_;_;succession/iteration/distributivity;modifier
bagni su bagni;yes;su;bagno;fare;Ormai collaudato l'adattamento di Vucinic, attaccante di valore che continua a fare;bagni su bagni;d'umiltà.;pl;_;_;greater_plurality/accumulation;nominal
goccia a goccia;yes;a;goccia;ma;L'acqua, dal canto suo, non scorreva più fluente, ma;goccia a goccia;, Una folla di gocce che se ne andavano mentre Mahdokht pativa.;sg;_;_;succession/iteration/distributivity;modifier
strato su strato;yes;su;strato;che;Ad un certo punto incontrarono una fontana ghiacciata che,;strato su strato;", aveva formato una specie di scultura che sembrava la sagoma di un animale; ma a dire il vero bastava girarsi intorno per riconoscere nel paesaggio mille immagini diverse disegnate dalla galaverna.";sg;_;_;succession/iteration/distributivity;modifier
strato su strato;yes;su;strato;sistemare;Nel ventre dell'acropoli, una collina compresa fra via Santa Maria in Costantinopoli, via Foria e via Tribunali, le epoche si sono sistemate;strato su strato;, dalle mura greche che risalgono alla fondazione nel V secolo avanti Cristo, fino agli edifici ottocenteschi.;sg;_;_;succession/iteration/distributivity;modifier
5 su 5;no;su;5;essere;"Se il ""numero minimo di domande"" non è stato impostato, allora il suo voto sarà";5 su 5;, cioè 100 %.;X;NumPNum;no;distractor;_
uomo a uomo;no;a;uomo;da;Questa malattia può dare luogo a febbri emorragiche anche fatali e ha una caratteristica particolare: non si trasmette da;_;_;_;_;_;_;_
donna a donna;no;a;donna;da;C'è una donna vescovo, adesso, negli Stati Uniti, forse potrei chiamarla, forse lei potrebbe arrivare a Vina e, non so, forse, parlandole da;_;_;_;_;_;_;_
pietra su pietra;yes;su;pietra;cercare;Caro e grande maestro mio, esempio di contento puro e tutto avuto dal bisogno col quale s'era sempre cercato;pietra su pietra;", e quasi per un non - potere di sé che è, come ebbe a scrivere, ""genuinità"", ""qualità di delicatezza"".";sg;_;_;succession/iteration/distributivity;modifier
5 su 5;no;su;5;di; Questa volta è la Juventus a sbagliare di meno, anzi a non sbagliare proprio nulla visto che mette a segno uno score di;5 su 5;, mentre per il Milan è fatale l' errore di Brocchi.;X;NumPNum;no;distractor;_
palmo a palmo;yes;a;palmo;bosco;In questo modo, i vari eserciti impegnati nella ricerca del tesoro alchemico si sono visti costretti a perlustrare i boschi;palmo a palmo;, sprecando tutta la notte in una lunga serie di appostamenti e di perquisizioni.;sg;_;_;succession/iteration/distributivity;modifier
decibel a decibel;no;a;decibel;aggiungere;Tutti in fila verso l'ingresso del Motodrom, con le bandiere sottobraccio e le trombe da stadio per aggiungere;_;_;_;_;_;_;_
zero a zero;no;a;zero;sul;Nino Malandrino quel 29 aprile era stato l'eroe del giorno, parando un rigore sullo;_;_;_;_;_;_;_
uomo a uomo;no;a;uomo;da;"Gli esperti, nel frattempo, ritengono che la trasmissione del virus dell'""influenza dei polli"" sia possibile anche da";_;_;_;_;_;_;_
appezzamento ad appezzamento;no;a;appezzamento;da;Anche il numero di vermi presenti nel suolo per metro quadrato (nei primi 20 cm di profondità), pur variando da;_;_;_;_;_;_;_
palloni su palloni;yes;su;pallone;recuperare;Col passare dei minuti migliorano Peruzzi e Simic, nel centrocampo della Roma Assuncao recupera;palloni su palloni;che appoggia ai compagni senza strafare, ad avviare il motore giallorosso ci pensa Totti, che copre mezzo campo.;pl;_;_;greater_plurality/accumulation;nominal
palmo a palmo;yes;a;palmo;lottare;Per lui si tratterà di procedere progredendo senza progredire, di lottare;palmo a palmo;contro qualunque forma di dipendenza dal terapeuta, di non dovergli niente, soprattutto di non essergli debitore di un miglioramento del quale preferisce fare a meno piuttosto che pagarlo a quel prezzo.;sg;_;_;succession/iteration/distributivity;modifier
ritardi su ritardi;yes;su;ritardo;collezionare;Una sorta di modello finlandese, sulla falsariga della società che ha affidato ad Areva la costruzione del reattore di Olkiluoto (che sta però collezionando;ritardi su ritardi;, l'ultimo reso noto proprio ieri).;pl;_;_;greater_plurality/accumulation;nominal
palmo a palmo;yes;a;palmo;esplorare;Gli sarebbero occorsi mesi per rilevarne il tracciato e per esplorarle;palmo a palmo;.;sg;_;_;succession/iteration/distributivity;modifier
bicchiere su bicchiere;yes;su;bicchiere;sommare;Poco sveglio da giovane, invecchiando aveva peggiorato e al calare del sole il vino che s'era bevuto durante il giorno, sommandosi;bicchiere su bicchiere;, lo riduceva ad appisolarsi accantoal fuoco d'inverno o sotto l'albero del cortile al tempo della buona stagione.;sg;_;_;succession/iteration/distributivity;modifier
donna a donna;no;a;donna;da;Quali sono i fattori che determinano queste differenze da;_;_;_;_;_;_;_
animale ad animale;no;a;animale;da;La ragione sta nell'assetto diverso dei cromosomi, le cui forme e specie quasi sempre variano da;_;_;_;_;_;_;_
fogli su fogli;yes;su;foglio;togliere;Non facevo altro che togliere;fogli su fogli;di giornali sporchi di merda dalla sua gabbia.;pl;_;_;greater_plurality/accumulation;nominal
file su file;yes;su;file;distinguere;I lievi raggi di sole forniscono la sola illuminazione disponibile e, quando i miei occhi si adattano, distinguo;file su file;di feriti, nelle brande, sui pagliericci, sul pavimento, perché sono in tanti a contendersi lo spazio.;pl;_;_;greater_plurality/accumulation;nominal
foglia a foglia;yes;a;foglia;scomparire;Nanni guarda il triangolino di frittata deflagrare e ricomporsi nel piatto di Cecilia, mentre l'insalata scompare;foglia a foglia;con estenuante lentezza, e tutte le cose che vorrebbe dirle non le può dire.;sg;_;_;succession/iteration/distributivity;modifier
punto a punto;no;a;punto;da;Il computer può trattare frasi che arrivino a un massimo di 1500 caratteri da;_;_;_;_;_;_;_
punto a punto;no;a;punto;da;Tra le singolarità c'è un agglomerato di linee di forza variamente incurvate da;_;_;_;_;_;_;_
ritardi su ritardi;yes;su;ritardo;accumulare;Bene il raddoppio Mortara, unica linea ancora a singolo binario in città, capacità limitata e treni affollati che accumulano;ritardi su ritardi;a causa degli incroci.;pl;_;_;greater_plurality/accumulation;nominal
gomito a gomito;yes;a;gomito;sedere;L'unica cosa sopravvissuta, ma desolatamente annerita dal fumo, è la lunga serpentina di marmo in cui i viaggiatori si sedevano;gomito a gomito;per consumare un rapido pasto prima di sperdersi nella regione dei laghi a Est di New York o nelle innumerevoli cittadine incastonate lungo il fiume Hudson, dove la frenesia della città che non dorme mai, nonostante la breve distanza, sembra una cosa remota e incredibile.;sg;_;_;juxtaposition/contact;modifier
digiuno su digiuno;yes;su;digiuno;fare;"In America, i nostri amici del ""Catholic Worker"" non hanno smesso, a partire dal crimine di Hiroshima, di far";digiuno su digiuno;, pubbliche proteste e pubblicazioni: la loro ultima impresa è stata di farsi mettere in prigione per aver tentato di superare lo sbarramento del servizio d'ordine durante gli esperimenti nel Nevada.;sg;_;_;greater_plurality/accumulation;nominal
punto a punto;no;a;punto;da;L'ATM crea una connessione da;_;_;_;_;_;_;_
mutamenti su mutamenti;yes;su;mutamento;accumulare;«È falsa - scrivono Niles Eldredge e Ian Tattersall, due eminenti paleontologi americani - l'idea di una evoluzione lenta e stabile, progressiva, che accumula;mutamenti su mutamenti;per piccoli scarti, che alla lunga, sommandosi, portano all'emergere di situazioni nuove…;pl;_;_;greater_plurality/accumulation;nominal
verbali su verbali;yes;su;verbale;elevare;Un uomo dalla finestra di casa osserva i pizzardoni mentre elevano;verbali su verbali;.;pl;_;_;greater_plurality/accumulation;nominal
ritardi su ritardi;yes;su;ritardo;accumulare;E se il verboso cattivo accumula;ritardi su ritardi;nelle sue comunicazioni finali al buono, nei teatri d'una volta si gridava «e partite, cretini!»;pl;_;_;greater_plurality/accumulation;nominal
dorso a dorso;yes;a;dorso;che;Avvicinandosi si trovano - e si vedono da vicino - centinaia di bellissimi uccelli che,;dorso a dorso;, sembrano coprire l'acqua con un manto rosato.;sg;_;_;juxtaposition/contact;modifier
strada su strada;no;su;strada;di;In tal modo l'aquaplaning viene scongiurato e la tenuta di;strada su strada;bagnata e innevata è ottimale.;sg;N_extended;no;distractor;_
miliardi su miliardi;yes;su;miliardo;risparmiare;Soprattutto per gli assicuratori, che possono continuare a inserire una clausola che consente loro di risparmiare;miliardi su miliardi;sulla pelle degli assicurati.;pl;_;_;greater_plurality/accumulation;nominal
porta a porta;yes;a;porta;vendita;Un trucchetto che mi ha insegnato un mio ex che faceva vendite;porta a porta;non so più di cosa.;sg;_;_;succession/iteration/distributivity;modifier
zero a zero;no;a;zero;sul;Nell'intervallo, con il risultato sullo;_;_;_;_;_;_;_
119 su 119;no;su;119;tutto;Attivate al 100 % le procedure di bonifica per i siti inquinati a breve termine, in tutto;119 su 119;, e al 58 % quelle per i 146 siti a medio termine, mentre per i 60 siti di piano definiti ' in approfondimentò (considerati a medio termine nell' attesa della definitiva classificazione nell' ambito dell' approvazione dei Piani Provinciali), tale percentuale scende al 32 %.;X;NumPNum;no;distractor;_
uomo a uomo;no;a;uomo;da;"""Ciò indica che la trasmissione del virus è possibile anche da";_;_;_;_;_;_;_
grado a grado;no;a;grado;a;Il grande globo giallo - arancio salì - in alto, ancora più in alto - e rimase sospeso sul mare increspato, illuminando a;_;_;_;_;_;_;_
riunioni su riunioni;yes;su;riunione;fare;Come sempre accade, appena un matrimonio va a rotoli si inizia a lavorare finoa tardi, a fare;riunioni su riunioni;, viaggi improvvisi.;pl;_;_;greater_plurality/accumulation;nominal
19 su 19;no;su;19;scioperare;A Lecco si è registrato una adesione del 100 per cento (hanno scioperato;19 su 19;) così come al tribunale di sorveglianza di Milano (9 su 9).;X;NumPNum;no;distractor;_
colpo a colpo;no;a;colpo;a;Lui va avanti, martella e inchioda, sale e scende e sposta la scala e ci risale, chiude a;_;_;_;_;_;_;_
uomo su uomo;no;su;uomo;qui;"Il problema del potere si ripresenta qui; il potere d'";uomo su uomo;.;sg;thematic_target;no;distractor;_
pigrizia a pigrizia;no;a;pigrizia;aggiungere;Questo tipo di promozione impoverisce ulteriormente il prodotto - giornale, perché può aggiungere;_;_;_;_;_;_;_
porta a porta;yes;a;porta;enciclopedia;Annunci del genere, sui giornali italiani, ormai riguardano solo i venditori di enciclopedie;porta a porta;.;sg;_;_;succession/iteration/distributivity;modifier
settimane su settimane;yes;su;settimana;di;Ciò può servirti solo ad andare in fondo alla questione del dolore, che è più o meno questo: covare nel corso di;settimane su settimane;un'idea o un'azione risolutiva, frutto di fatica fisica e coraggio imposto, e sentirtela smontare in pochi secondi da una risata distratta.;pl;_;_;greater_plurality/accumulation;nominal
gomito a gomito;yes;a;gomito;collaborare;Così a parità di lavoro svolto, collaboriamo;gomito a gomito;con colleghi che usufruiscono di notevoli incentivi economici.;sg;_;_;juxtaposition/contact;modifier
palmo a palmo;yes;a;palmo;zona;Per ore e ore hanno battuto la zona;palmo a palmo;.;sg;_;_;succession/iteration/distributivity;modifier
palmo a palmo;yes;a;palmo;conoscere;Allora il prete si avvicinò a me e disse che lui quelle montagne le conosceva;palmo a palmo;perché da piccolo con suo padre e sua sorella arrivavano fin lassù.;sg;_;_;succession/iteration/distributivity;modifier
porta a porta;yes;a;porta;distribuzione;Poi i certificati verranno consegnati ai vigili che incominceranno la distribuzione;porta a porta;.;sg;_;_;succession/iteration/distributivity;modifier
grado a grado;no;a;grado;a;Quando gli uomini muoiono di morte naturale, allorché l'albero dell'umanità si spoglia a;_;_;_;_;_;_;_
lira su lira;yes;su;lira;mille;Raccolgono monete, carte da mille,;lira su lira;arrivano a quaranta milioni.;sg;_;_;succession/iteration/distributivity;modifier
luogo a luogo;no;a;luogo;da;Nel mondo reale i diritti naturali sono molto diversi da;_;_;_;_;_;_;_
gomito a gomito;yes;a;gomito;lavorare;Cosa crede che succeda quando uno della valle di Ossau lavora;gomito a gomito;con uno della valle del Gave?;sg;_;_;juxtaposition/contact;modifier
rospi su rospi;yes;su;rospo;inghiottire;L'italiano sente, con il suo istinto arcaico e animalesco, che è in arrivo una tempesta nella quale perderà quelle poche certezze che lo aiutavano a inghiottire;rospi su rospi;.;pl;_;_;greater_plurality/accumulation;nominal
donne su donne;no;su;donna;di;Così in quegli anni le esperienze di lavoro di;donne su donne;con sofferenza psichiatrica, se da una parte sollevarono alcune delle questioni dell'esser donna, dall'altra lasciarono immutato il manicomio e tanto piu' le donne che in quello continuavano ad essere recluse, non riuscendo ad arrivare al nocciolo della psichiatria, ne' tanto piu' arrivando a restituire al sociale, al sociale della comunita' femminile, la sua sofferenza.;pl;thematic_target;no;distractor;_
goccia a goccia;yes;a;goccia;riprendere;Con il tempo la situazione peggiora: lo svuotamento avviene a più riprese,;goccia a goccia;.;sg;_;_;succession/iteration/distributivity;modifier
22 su 22;no;su;22;astenuto;"Nell' opposizione, tra i socialisti 90 hanno votato a favore mentre 56 si sono astenuti; nel gruppo dei repubblicani e socialisti, invece, i voti contrari sono stati";22 su 22;iscritti.;X;NumPNum;no;distractor;_
goccia a goccia;yes;a;goccia;vaselina;Aggiungete, sempre mescolando, l'olio di vaselina;goccia a goccia;.;sg;_;_;succession/iteration/distributivity;modifier
bambini su bambini;no;su;bambino;di;All'inizio della settimana ho scritto un articolo circa le recenti notizie provenienti dal Kansas sui tassi di violenze sessuali di;bambini su bambini;, aumentate bruscamente...anche la polizia del Regno Unito ha segnalato questa tendenza (40.000 segnalazioni in un paio di anni)…;pl;thematic_target;no;distractor;_
errori su errori;yes;su;errore;accumulare;E, al contrario, il mister argentino continua ad accumulare;errori su errori;, cambiando ogni settimana le carte in tavola, senza trovare, naturalmente, il rimedio.;pl;_;_;greater_plurality/accumulation;nominal
carta su carta;no;su;carta;di;E poi c'è lo spariglio, una variante della presa di;carta su carta;uguale.;sg;thematic_target;no;distractor;_
muso a muso;no;a;muso;a;La sua resistenza ci portò a;_;_;_;_;_;_;_
bunkr a bunker;no;a;bunker;da;Ma anche Saddam Hussein durante la Guerra del golfo si mosse da;_;_;_;_;_;_;_
serate su serate;yes;su;serata;collezionare;Lo so, avrei potuto campare di rendita su Kalimba de Luna, collezionando;serate su serate;…;pl;_;_;greater_plurality/accumulation;nominal
gomito a gomito;yes;a;gomito;spesso;Naturalmente certi vecchi quartieri londinesi conservavano le antiche caratteristiche di grande eleganza e ricchezza, ma erano spesso;gomito a gomito;con gli slum più squallidi e più ripugnanti.;sg;_;_;juxtaposition/contact;modifier
uomini su uomini;no;su;uomo;di;Per un verso, infatti, essa esclude qualsiasi analogia mimetica tra la sovranità di Dio e la sovranità di;uomini su uomini;(significato politico-critico dell'immagine trinitaria di Dio).;pl;thematic_target;no;distractor;_
pietra su pietra;yes;su;pietra;aggiungere;Secondo Rauber, l'organismo vivente non è costruito come un edificio, aggiungendo;pietra su pietra;in modo ordinato.;sg;_;_;greater_plurality/accumulation;nominal
verbali su verbali;yes;su;verbale;pubblicare;Insomma, nel corso di Tangentopoli i mass media hanno pubblicato;verbali su verbali;ancora freschi d'inchiostro e rivelato notizie coperte da segreto istruttorio.;pl;_;_;greater_plurality/accumulation;nominal
dolori su dolori;yes;su;dolore;su;E dietro a quello, molti altri ricordi rossi, indicibili, segreti, sepolti da anni di uso di mondo, errori, matrimoni, figlie, partenze, musica, abbandoni, gioielli, amanti, dolori, e dolori su;dolori su dolori;per mimetizzare il padre di tutti i dolori.;pl;_;_;greater_plurality/accumulation;nominal
caso a caso;no;a;caso;da;Il terzo stadio consiste in una nuova riduzione del numero dei dipendenti, contestuale a una profonda riorganizzazione, diversa da;_;_;_;_;_;_;_
palmo a palmo;yes;a;palmo;esplorare;Non venendo, l'italiano aveva agito in modo tanto ragionevole quanto scortese, non si sarebbe visto nulla, ci si sarebbe dovuti accontentare di esplorare;palmo a palmo;alcuni quadri con la lampadina tascabile di K.;sg;_;_;succession/iteration/distributivity;modifier
100 su 100;no;su;100;massimo;Il punteggio minimo ottenuto dai nostri studenti è di 28,57, contro quello ottenuto dall' Emilia Romagna di 0,0 e dal Nord Est di 14,29, mentre è allineato il punteggio massimo:;100 su 100;.;X;NumPNum;no;distractor;_
lato a lato;no;a;lato;da;Sulla parete di fronte al letto, nel colore turchino, spiccava solo l'enorme croce nera, da;_;_;_;_;_;_;_
periodi su periodi;no;su;periodo;avere;Tornando al banco,devo dire che i suoi dischi li amo tuttora,certo hanno avuto;periodi su periodi;ma son sempre stati più che dignitosi.;pl;NsuNgiù;yes;distractor;_
39 su 39;no;su;39;a;Essi hanno scoperto che Red Book è stato in grado di fornire con successo le risposte a;39 su 39;richieste su problemi clinici, con una media di 10 secondi per ricerca.;X;NumPNum;no;distractor;_
porta a porta;yes;a;porta;raccogliere;Entro fine anno il vetro si raccoglierà;porta a porta;.;sg;_;_;succession/iteration/distributivity;modifier
bambino a bambino;no;a;bambino;da;Eppure non è mai stato provato un caso al mondo di contagio da;_;_;_;_;_;_;_
40 su 40;no;su;40;voto;Poi è il turno di Nintendogs, il perfect score di Famitsu (voto;40 su 40;), dopo aver conquistato il mercato nipponico, si prepara ad invadere anche quelli occidentali.;X;NumPNum;no;distractor;_
fogli su fogli;yes;su;foglio;compilare;Abbiamo passato un pomeriggio intero, io e Fabio, in quel negozio in centro, con la commessa appresso che compilava;fogli su fogli;.;pl;_;_;greater_plurality/accumulation;nominal
porta a porta;yes;a;porta;vendere;Quando si riprese, Ron andò a vendere;porta a porta;i prodotti della Rawleigh come suo padre.;sg;_;_;succession/iteration/distributivity;modifier
aria su aria;yes;su;aria;muovere;Il ventilatore non vale niente, muove;aria su aria;, sempre la stessa.;sg;_;_;greater_plurality/accumulation;nominal
vacche su vacche;no;su;vacca;caricare;È suo il conio del palidromo accavallavacca (strumento per caricare;vacche su vacche;", o vacche su cavalli; vedi anche alle voci lavacavalli e vacca).";pl;thematic_target;no;distractor;_
app su app;no;su;app;di;Per quanto riguarda la connessione mobile, 3g o 4g, le cose sono più complesse perché apple non permette di farlo nativamente, né naturalmente permette la presenza di;app su app;store che lo facciano per noi.;sg/pl;proper_name_inglobation;no;distractor;_
gomito a gomito;yes;a;gomito;mettere;E non è possibile metterli;gomito a gomito;con le donne gomito a gomito, al lavandino, in un gabinetto.;sg;_;_;juxtaposition/contact;modifier
certificati su certificati;yes;su;certificato;permesso;Il secondo problema è quello del rispetto delle norme: per gestire correttamente una discoteca sarebbero necessari permessi su permessi,;certificati su certificati;.;pl;_;_;greater_plurality/accumulation;nominal
giornalisti su giornalisti;no;su;giornalista;di;Torna l' estate, tornano puntuali come le zanzare i libri di; giornalisti su giornalisti;e con la calura tornano a scoppiare anche le polemiche tra gli anchormen di casa Mediaset, in primis quella tra Emilio Fede ed Enrico Mentana.;pl;thematic_target;no;distractor;_
goccia a goccia;yes;a;goccia;sgorgare;Grazie a una saracinesca regolata dall'interno dell'edificio, l'acqua della vasca sgorga;goccia a goccia;dalle fauci muschiate di un ippopotamo in pietra.;sg;_;_;succession/iteration/distributivity;modifier
bit a bit;yes;a;bit;trasmettere;È compito di quest'ultimo trasmettere,;bit a bit;, l'informazione sul cavo e quindi al destinatario.;sg;_;_;succession/iteration/distributivity;modifier
palmo a palmo;yes;a;palmo;mano;Snocciolata questa sfilza di assurdità Bengal'skij riunì le mani;palmo a palmo;facendo segni di saluto verso la fessura del sipario, che di conseguenza, con un rumore sordo, si aprì.;sg;_;_;succession/iteration/distributivity;modifier
10 su 10;no;su;10;se;Vorrei che ogni italiano, o almeno 8 su 10 sappiano cosa sia la Milano Sanremo, se;10 su 10;sanno cosa è il Giro.;X;NumPNum;no;distractor;_
viso a viso;yes;a;viso;bene;E poi magari la madre va via piangendo a tutto spiano ma almeno l'ha abbracciata, ha saputo che sta bene:;viso a viso;.;sg;_;_;juxtaposition/contact;modifier
uomo a uomo;no;a;uomo;da;Il contagio è solo interumano, vale a dire che la varicella si trasmette solo da;_;_;_;_;_;_;_
punto a punto;no;a;punto;da;Oggi ci rendiamo conto che la critica faradayana alla nozione di particella, inquanto scaturisce da una fisica del continuum dove le interazioni agiscono da;_;_;_;_;_;_;_
danno a danno;no;a;danno;aggiungerebbe;Guai se non fosse così - ha tuonato Romiti - poiché dopo tanti sforzi si aggiungerebbe;_;_;_;_;_;_;_
goccia a goccia;yes;a;goccia;passo;Circuiti cognitivi che si tenta di riattivare passo dopo passo,;goccia a goccia;, perché «lo sviluppo cognitivo può essere come una botte, che riempi molto velocemente, oppure come una damigiana che ha il collo stretto e va riempita lentamente.;sg;_;_;succession/iteration/distributivity;modifier
donna a donna;no;a;donna;da;La signorina Griffin ed io abbiamo fatto una lunga chiacchierata, da;_;_;_;_;_;_;_
goccia a goccia;yes;a;goccia;fiele;Io adesso ve la faccio bere a viso aperto come il fiele,;goccia a goccia;, fino all'ultima goccia.;sg;_;_;succession/iteration/distributivity;modifier
punto a punto;no;a;punto;da;Al contrario nel Tipo C, dove il pino domestico è stato seminato in maniera andante e a integrazione di nuclei di latifoglie preesistenti, con conseguente maggiore variabilità da;_;_;_;_;_;_;_
5 su 5;no;su;5;di;Questa volta è la Juventus a sbagliare di meno, anzi a non sbagliare proprio nulla visto che mette a segno uno score di;5 su 5;, mentre per il Milan è fatale l' errore di Brocchi.;X;NumPNum;no;distractor;_
errori su errori;yes;su;errore;laggiù;Certo che ho mancato, e cominci a correre su e giù per la tua vita matrimoniale, ecco, qui e poi lì, e anche là, anche addirittura laggiù,;errori su errori;, una catena infinita.;pl;_;_;greater_plurality/accumulation;nominal
comune a comune;no;a;comune;da;I contributi ed aiuti sociali esistono in Italia, ma il sistema varia da;_;_;_;_;_;_;_
22 su 22;no;su;22;scorso;In tempi più recenti, nel giugno scorso,;22 su 22;attentati sono abortiti.;X;NumPNum;no;distractor;_
segherie su segherie;yes;su;segheria;apparire;Il primo odore è quello di legno e infatti dopo poche centinaia di metri appaiono;segherie su segherie;con collinette artificiali fatte di trucioli ed assi dappertutto.;pl;_;_;greater_plurality/accumulation;nominal
secondi su secondi;yes;su;secondo;perdere;Hakkinen passa in testa (deve ancora fare il pit - stop), Schumacher comincia a perdere;secondi su secondi;.;pl;_;_;greater_plurality/accumulation;nominal
brano a brano;no;a;corpo;a;Talora le passava per la testa una fuggevole meraviglia: che si possa esser trascinati così mentre si muore a;_;_;_;_;_;_;_
goccia a goccia;yes;a;goccia;passare;È però forse più pratico procurarsi un buon prodotto, già confezionato in forma di oliatore, con il quale passare,;goccia a goccia;, tutte le maglie della catena.;sg;_;_;succession/iteration/distributivity;modifier
goccia a goccia;yes;a;goccia;solitudine;Erano passati vent'anni e la solitudine,;goccia a goccia;, era filtrata in lei.;sg;_;_;succession/iteration/distributivity;modifier
fratelli a fratelli;no;a;fratello;genitore;Riconosco i tanti cognomi della comunità, rivedo le loro storie, riunisco figli a genitori,;_;_;_;_;_;_;_
imprecazioni su imprecazioni;yes;su;imprecazione;accavallare;"È un segno di gratitudine che solo le bestie sanno esprimere - Bestemmia Berlino invece, come si dice ""omen nomen"" riprende il filo del discorso accavallando";imprecazioni su imprecazioni;e riducendo le solite conosciute bestemmie a vili scioglilingua che non sanno di niente.;pl;_;_;greater_plurality/accumulation;nominal
essere ad essere;no;a;essere;da;Sembrano interconnesse in una sfida infinita che si tramanda da corpo a corpo, da anima ad anima, da;_;_;_;_;_;_;_
utente a utente;no;a;utente;da;Sulla rete Tetra 25, le chiamate non saranno, per lo più, da;_;_;_;_;_;_;_
