NPN;construction;preposition;noun;pre_lemma;context_pre;costr;context_post;number_of_noun;Type;other_cxn;meaning;syntactic_function
grado a grado;no;a;grado;a;A lungo Domaris rimase immobile davanti alla porta chiusa, mentre la pietà nei suoi occhi a;_;_;_;_;_;_;_
donna a donna;no;a;donna;da;Ma se vuole un consiglio da;_;_;_;_;_;_;_
testa su testa;yes;su;testa;mattone;Per tua mano la Sua mannaia edificherà il Regno, passo dopo passo, mattone su mattone,;testa su testa;.;sg;_;_;succession/iteration/distributivity;modifier
gomito a gomito;yes;a;gomito;lavorare;Per prima cosa ottenne un sostanzioso prestito grazieall'appoggio e alla fiducia di banchieri legati all'agente commerciale di suo padre, poi mandò i commandeurs ai canneti, a lavorare;gomito a gomito;con gli stessi uomini che prima avevano martirizzato e li rimpiazzò con altri meno depravati, ridusse i castighi e assunse un veterinario, che trascorse due mesi a Saint - Lazare cercando di restituire un po 'di salute ai neri.;sg;_;_;juxtaposition/contact;modifier
dati su dati;no;su;dato;di;Una elaborazione fatta da un analista di;dati su dati;Istat dal due mila undici al due mila sedici.;pl;N_extended;no;distractor;_
comune a comune;no;a;comune;da;I fabbisogni di spesa pro capite risultano assai diversi da;_;_;_;_;_;_;_
parole su parole;yes;su;parola;dare;E i giochini, i disegnetti a bordo pagina che sono sicuro lei fa mentre aspetta che il cervello elabori e le detti;parole su parole;"; perché non stampa anche quei disegnetti scarabocchiati per ingannare la mano che vorrebbe scrivere qualcosa in maniera autonoma?";pl;_;_;greater_plurality/accumulation;nominal
ACCUSE SU ACCUSE;yes;su;accusa;polemica;ANZICHE DISTRUGGERLA CON POLEMICHE SU POLEMICHE ... ;ACCUSE SU ACCUSE;…;pl;_;_;greater_plurality/accumulation;nominal
controlli su controlli;yes;su;controllo;volante;Strade bloccate, frontiere minate, posti di blocco volanti,;controlli su controlli;, ormai il Kosovo è solo questo.;pl;_;_;greater_plurality/accumulation;nominal
pietra su pietra;yes;su;pietra;costruire;I monaci hanno progettato e costruito;pietra su pietra;, cattedrali e monasteri.;sg;_;_;succession/iteration/distributivity;modifier
corpo a corpo;no;a;corpo;da;Sembrano interconnesse in una sfida infinita che si tramanda da;_;_;_;_;_;_;_
palmo a palmo;yes;a;palmo;ispezionare;Tutta l'area è stata immediatamente interdetta e i carabinieri la stanno ispezionando;palmo a palmo;alla ricerca di altri indizi utili all'indagine.;sg;_;_;succession/iteration/distributivity;modifier
leghe su leghe;yes;su;lega;vuoto;Guardia Grigia e Segno di Ghiaccio anche, non ho dubbi, e abbiamo altri quattordici fortilizi ancora vuoti,;leghe su leghe;di Barriera ancora non sorvegliate e indifese.;pl;_;_;greater_plurality/accumulation;nominal
corpo a corpo;no;a;corpo;a;Un classico contemporaneo a tu per tu, o meglio a;_;_;_;_;_;_;_
Pisa su Pisa;no;su;Pisa;di;Martedì sera Umberto ha avuto una trovata che per poco non ha reso innocuo il pericolante edificio di insulti che ogni puntata pende su di lui, come la Torre di;Pisa su Pisa;.;X;proper_name_inglobation;no;distractor;_
discussioni su discussioni;yes;su;discussione;iniziare;Anzi, diciamola tutta: ciascuno ha un'idea differente del suo significato, e va così a finire che iniziano;discussioni su discussioni;.;pl;_;_;greater_plurality/accumulation;nominal
balle su balle;yes;su;balla;Italia;Il meccanismo adottato in Francia per convincere i cittadini della ineluttabilità del nucleare è lo stesso adottato di recente in Italia:;balle su balle;raccontate da venduti e soldi su soldi per la pubblicità e per foraggiare i giornali.;pl;_;_;greater_plurality/accumulation;nominal
goccia a goccia;yes;a;goccia;mai;Il libro inizia con queste parole: «La speranza non scende mai;goccia a goccia;.;sg;_;_;succession/iteration/distributivity;modifier
palmo a palmo;yes;a;palmo;esplorare;A piedi ci rechiamo quindi alla scoperta della parte più antica dell'abitato, nella quale si trova il poderoso castello aragonese, che esploriamo;palmo a palmo;, fra interessanti ambienti di epoca medioevale e vasti panorami sui paesaggi circostanti.;sg;_;_;succession/iteration/distributivity;modifier
palmo a palmo;yes;a;palmo;battere;Da quella sera, fino a ieri pomeriggio, carabinieri, polizia e vigili del fuoco hanno continuato a cercare madre e figlio, battendo;palmo a palmo;la zona lungo il fiume e scandagliando le acque del Livenza, che a tratti ha correnti molto forti e profondità dai cinque ai nove metri.;sg;_;_;succession/iteration/distributivity;modifier
7 su 7;no;su;7;un;Sta meglio il secondo anno (43 partite, 11,3 di medie), quando spara un;7 su 7;da tre al Madison Square Garden di New York.;X;NumPNum;no;distractor;_
comune a comune;no;a;comune;da;La distribuzione degli anziani, in particolare, risulta fortemente variabile da regione a regione e, a livello locale, anche da;_;_;_;_;_;_;_
accusa su accusa;yes;su;accusa;parola;Per fortuna, conosceva la lingua così bene che capì ogni cosa, e si potette difendere, parola su parola ,;accusa su accusa;, prova su prova, senza perdersi d'animo.;sg;_;_;succession/iteration/distributivity;modifier
100 su 100;no;su;100;di;Il valore modale ottenuto è di;100 su 100;, questo è quindi il valore che ricorre più frequentemente.;X;NumPNum;no;distractor;_
porta a porta;yes;a;porta;vendere;Il suo quarto marito le passava a quelli che le vendevano;porta a porta;.;sg;_;_;succession/iteration/distributivity;modifier
gomito a gomito;yes;a;gomito;giornata;Il podestà si era lungamente preparato a sostenere la parte: avrebbe dovuto passare tutta una giornata;gomito a gomito;con la sua antica morosa e con l'altrettanto antico timoniere che gliel'aveva soffiata.;sg;_;_;juxtaposition/contact;modifier
gomito a gomito;yes;a;gomito;questo;E se bisognava affrontarlo - bisognava necessariamente affrontarlo - era di certo meglio farlo in gruppo, in questo;gomito a gomito;che ci saldava l'uno all'altro e che era, nell'imminenza del pericolo, come un ultimo rifugio.;sg;_;_;juxtaposition/contact;modifier
comune a comune;no;a;comune;da;Questa procedura, necessaria per evitare squilibri nei bilanci comunali, genera però un impatto sul reddito disponibile dei cittadini diverso da;_;_;_;_;_;_;_
coltura a coltura;no;a;coltura;da;Si è visto che la colza GM è una coltura ad alto rischio per quanto riguarda il flusso di geni da;_;_;_;_;_;_;_
uomo su uomo;no;su;uomo;di;cioè quando si abolirà non solo il concetto di proprieta' di uomo su uomo (schiavitu') ma anche quello di SERVITU' di;uomo su uomo;(noleggio, prostituzione, o come chiamo io, SERVIZIONE).;sg;thematic_target;no;distractor;_
61 su 61;no;su;61;di;Certo le ultime elezioni europee hanno segnato una sconfitta di Berlusconi, il cappotto del;61 su 61;(i seggi del parlamento regionale conquistati dalla destra nelle ultime amministrative) appartiene alla memoria del passato.;X;NumPNum;no;distractor;_
corpo a corpo;no;a;corpo;a;Le tattiche riflettono le tradizionali forme di lotta a;_;_;_;_;_;_;_
jeans su jeans;no;su;jeans;di;Il trucco è prevalentemente uno, non eccedere con i colori, quindi se indossate una giacca di;jeans su jeans;blu dovranno avere lo stesso colore.;sg/pl;N_extended;no;distractor;_
gomito a gomito;yes;a;gomito;spalla;Ci hanno divisi per evitare problemi, perquanto era possibile, vistoche si camminava tutto il giorno spalla a spalla,;gomito a gomito;, a passi diversi, ma alla stessa velocità, e quando vivi una situazione di fatica e scomodità come quella, con poco cibo e poca acqua e nessun posto dove ripararsi e molto freddo, invece, molto, molto freddo, be', i battibecchi e le risse sono sempre dietro l'angolo, in agguato, e gli accoltellamenti anche, quindi è meglio tenere separate le etnie ostili.;sg;_;_;juxtaposition/contact;modifier
4 su 4;no;su;4;estivo;Risultato, al ritorno dopo l' operazione estiva,;4 su 4;da dove conta tre.;X;NumPNum;no;distractor;_
riunioni su riunioni;yes;su;riunione;e;Ma per arrivare sino a quel punto, a quel sospiro di sollievo, ci sono state ore di trattative ininterrotte e telefonate notturne e sveglie all'alba e;riunioni su riunioni;.;pl;_;_;greater_plurality/accumulation;nominal
viso a viso;yes;a;viso;Sonia;E lo dirò poi Sonia,;viso a viso;e non in presenza di paparino.;sg;_;_;juxtaposition/contact;modifier
eguale a eguale;no;a;eguale;da;Perché se è vero che noi oggi proclamiamo la nostra indipendenza d'intesa col Belgio, paese amico col quale oggi trattiamo da;_;_;_;_;_;_;_
porta a porta;yes;a;porta;vendita;15 giovani intraprendenti, anche senza esperienza, hanno la possibilità di entrare a far parte dell'organizzazione commerciale come incaricati alla vendita;porta a porta;, pagati a provvigioni.;sg;_;_;succession/iteration/distributivity;modifier
tornanti su tornanti;yes;su;tornante;fango;Si viaggia tra sassi e massi, guadi e fango,;tornanti su tornanti;", si sale dai 3000 ai quasi 5000 metri in un attimo; gli spazi gradualmente si allargano, sono quasi in cima, fa freddo, ha nevicato da poco.";pl;_;_;greater_plurality/accumulation;nominal
comune a comune;no;a;comune;da;La differenza percentuale fra livello minimale e medio della spesa standard varia però in modo sensibile da;_;_;_;_;_;_;_
pietra su pietra;yes;su;pietra;costruire;Le pietre scolpite sono l'omaggio alla storia millenaria, costruita;pietra su pietra;, secolo dopo secolo.;sg;_;_;succession/iteration/distributivity;modifier
rovescio su rovescio;yes;su;rovescio;assassino;Sul sei pari abbiamo uno scambio assassino,;rovescio su rovescio;, e io sono un fascio di nervi scossi.;sg;_;_;succession/iteration/distributivity;modifier
palmo a palmo;yes;a;palmo;mano;"Dice l'iscrizione ""che esse congiungono le mani";palmo a palmo;""", allegorica immagine che descrive il passaggio da un segno zodiacale a quello precedente, passaggio che avviene nell'equinozio di primavera ogni 2160 anni.";sg;_;_;succession/iteration/distributivity;modifier
creme su creme;yes;su;crema;su;Altro errore frequentissimo: applicare creme su;creme su creme;sulla cute del viso irritata, arrossata, sensibilizzata.;pl;_;_;greater_plurality/accumulation;nominal
mani su mani;no;su;mano;fare;Anche il testo della canzone era stato scritto per essere abbastanza esplicativo e per mostrare cosa si sarebbe dovuto fare (;mani su mani;giù mani dove vuoi) ma l'immagine dei Ricchi & Poveri non era tale da poter imporre un ballo inventato di sana pianta anche perché non c'era più la moda di inventarne di nuovi per il tramite di una canzone lanciata appositamente.;pl;NsuNgiù;yes;distractor;_
Arezzo su Arezzo;no;su;Arezzo;di;La posizione del Comune di;Arezzo su Arezzo;Fiere è chiarissima.;X;proper_name_inglobation;no;distractor;_
uomo su uomo;no;su;uomo;di;Il sistema odioso di sfruttamento di;uomo su uomo;.;sg;thematic_target;no;distractor;_
11 su 11;no;su;11;effettuare;Da ricordare la prestazione contro il Belgio allorchè ne ha effettuate;11 su 11;tiri nello specchio della porta degli avversari.;X;NumPNum;no;distractor;_
giunzioni su giunzioni;yes;su;giunzione;km;Novità più significative, figlie di questo nuovo modo di intendere la speleologia, sono le esplorazioni all'OPIII, alla Feruglio, nel Complesso del Foran del Muss (che macinando km su km;giunzioni su giunzioni;, sta insidiando l'adiacente Complesso del Col delle Erbe, da oltre 25 anni al primo posto nella classifica delle grotte più estese), e il Led Zeppelin, che è divenuta la più profonda cavità della regione.;pl;_;_;greater_plurality/accumulation;nominal
porta a porta;yes;a;porta;e;Oltre agli immancabili call center con contratti a provvigione, tra i casi studiati verranno analizzati i pericoli che si celano nelle offerte per gli impieghi classici, «a domicilio e;porta a porta;"»; ma anche per i lavori che un tempo erano considerati anomali, ma che oggi sono fonte di guadagno per moltissimi giovani, come «quelli che prevedono un corso di formazione a pagamento iniziale, troppo spesso inutile e carissimo».";sg;_;_;succession/iteration/distributivity;modifier
caso a caso;no;a;caso;da;Per quanto riguarda i lavoratori autonomi, l'accesso alle singole professioni è regolato da requisiti diversi da;_;_;_;_;_;_;_
frase su frase;yes;su;frase;brandello;Il racconto che brandello su brandello,;frase su frase;, strappavo ai miei ricordi, come un cancro luminoso divorava la mia vita.;sg;_;_;succession/iteration/distributivity;modifier
54 su 54;no;su;54;disponibile;La formazione pugliese è, assieme al Torino, la squadra che ha usufruito fino a questo momento di tutti i cambi disponibili;54 su 54;.;X;NumPNum;no;distractor;_
sassolino su sassolino;yes;su;sassolino;goccia;Nei giorni a venire e nelle notti illuni e nelle notti quando una luna fulgidissima splendeva sopra la terra, il vecchio avrebbe continuato a parlargli, a parlargli, goccia a goccia,;sassolino su sassolino;, petalo dopo petalo.;sg;_;_;succession/iteration/distributivity;modifier
memoria su memoria;yes;su;memoria;essere;Se voi mi chiedete come ciò possa essere -;memoria su memoria;, nient'altro che memoria - io ovviamente non so rispondere, e non perché non esistano «io» e «voi», non più di quanto esistano «qui» e «ora», ma perché l'unica cosa che esiste è il passato ricordato, non ritrovato e - attenzione alla differenza - non rivissuto nell'immediatezza del regno sensoriale, ma semplicemente ritrasmesso.;sg;_;_;succession/iteration/distributivity;modifier
mente su mente;no;su;mente;parte;"Il credersi ""separati"" in più parti (";mente su mente;"giù, corpo questo e corpo quell'altro, questo è meglio e quello è peggio) è solo il frutto d'una visione ""schizofrenica"".";sg;NsuNgiù;yes;distractor;_
palmo a palmo;yes;a;palmo;osservare;Tutte le auto vengono osservate;palmo a palmo;, illuminate da fortissime luci bianche.;sg;_;_;succession/iteration/distributivity;modifier
uomini su uomini;no;su;uomo;di;Dall'inizio degli anni Novanta è diminuito il numero di omicidi di;uomini su uomini;"mentre il numero di donne uccise da uomini è aumentato: l'intensità e il grado di diffusione di episodi di violenza e abuso nei confronti delle donne sono tali da aver suggerito il conio del termine ""femminicidio"".";pl;thematic_target;no;distractor;_
caso a caso;no;a;caso;da;I risultati sono estremamente variabili da;_;_;_;_;_;_;_
goccia a goccia;yes;a;goccia;che;Meg Conti scoppiò a piangere, tanta era l'emozione, ma erano lacrime dolci che;goccia a goccia;le lavavano un'antica colpa e le ridavano il desiderio di vivere.;sg;_;_;succession/iteration/distributivity;modifier
granellino su granellino;yes;su;granellino;edilizio;E non meno sorprendente è la tecnica costruttiva della formica - bussola australiana (Amitermes meridionalis) i cui operai ciechi sanno deporre il materiale edilizio,;granellino su granellino;, in modo tale che il risultato sia un nido cuneiforme con l'asse maggiore orientato rigorosamente in direzione Nord - Sud.;sg;_;_;succession/iteration/distributivity;modifier
gomito a gomito;yes;a;gomito;Brasile;Dal 7 al 10 maggio sono stato in Brasile,;gomito a gomito;con 10 baristi, provenienti da tutto il mondo, selezionati per partecipare a Barista & Farmer, il talent show made in Italy pensato per permettere ai baristi di andare alle origini del prodotto con cui lavora tutti i giorni e di cui è appassionato: il caffè.;sg;_;_;juxtaposition/contact;modifier
donna a donna;no;a;donna;da;"Ai margini di un recente convegno sulla giustizia minorile, una procuratore aggiunta raccontava ""da";_;_;_;_;_;_;_
Parole su parole;yes;su;parola;un;ose fondamentali per la formazione del pensiero degli studenti suoi coetanei .  Parole su parole , in_forma_di versi , di articoli , di canzoni perché Evtuscenko sapeva che un;Parole su parole;, in forma di versi, di articoli, di canzoni perché Evtuscenko sapeva che un vecchio proverbio russo era sacrosanta verità: «Ciò che è stato scritto con la penna non si può rimuovere con un'accetta». ;pl;_;_;greater_plurality/accumulation;nominal
80 su 80;no;su;80;prendere;Faccia presente che anche se tutta la gente sapesse le cose benissimo, da prendere;80 su 80;comunque tantissima gente dovrebbe tornare a casa.;X;NumPNum;no;distractor;_
donna a donna;no;a;donna;da;Gli parlò come si potrebbe parlare da;_;_;_;_;_;_;_
legge a legge;no;a;legge;carta;Aveva opposto carte a carte,;_;_;_;_;_;_;_
gomito a gomito;yes;a;gomito;folle;Cosí si compí il tradimento, progettato e custodito fin dall'arrivo nella città dei folli,;gomito a gomito;con loro, per oltre un anno.;sg;_;_;juxtaposition/contact;modifier
quartiere a quartiere;no;a;quartiere;da;Ecco come varia nel dettaglio il mercato immobiliare da;_;_;_;_;_;_;_
miliardi su miliardi;yes;su;miliardo;fare;Voi Cannarozzo e Cazzetta ci rovinate la vista, mettete in mostra le Fiat nude come la Caprioglio senza coprirne con i lenzuoli le lamierazze, e fate;miliardi su miliardi;in Brianza e a Squinzano, e poi i bei risultati sono l'Italia.;pl;_;_;greater_plurality/accumulation;nominal
materia su materia;yes;su;materia;di;Cazzetti, fichette, zinnette, culetti sodi esplodono su di me in una cosmogonia di;materia su materia;.;sg;_;_;greater_plurality/accumulation;nominal
gomito a gomito;yes;a;gomito;stare;All'alba di ieri, su quella carcassa arrivata dritta sulla spiaggia di Le Cannella una delle località di mare più belle di Isola Capo Rizzuto stavano;gomito a gomito;317 persone, per lo più curdi, pakistani e afgani.;sg;_;_;juxtaposition/contact;modifier
pietra su pietra;yes;su;pietra;edificare;Alta tecnologia che non può fare amenodell'uomo: un po 'come il Duomo di Milano: un'opera collettiva, firmata dal popolo che l'ha edificato;pietra su pietra;.;sg;_;_;succession/iteration/distributivity;modifier
parola su parola;yes;su;parola;romantico;"E poi, ""Il cambio della guardia a Whitehall..."" che era romantico; e poi, costruendo";parola su parola;", lesse: ""I soldati della cavalleria le dissero che il cavallo aveva la coda verde; ma per lei era un cavallo qualsiasi"".";sg;_;_;succession/iteration/distributivity;modifier
palmo a palmo;yes;a;palmo;controllare;La ragazza, piuttosto pallida ed esile, controllò;palmo a palmo;l'indumento alla ricerca di eventuali macchie, verificò le cuciture e gli orli, poi la drappeggiò attorno alle sue spalle e sul braccio sinistro e curò le pieghe una per una come se stesse rivestendo il suo padrone.;sg;_;_;succession/iteration/distributivity;modifier
uomini su uomini;no;su;uomo;di; Questa domanda non si può respingere con la speranza che allora tutto andrebbe di per sè, che le cose si regolerebbero da sole, che un governo di;uomini su uomini;sarebbe divenuto superfluo, perchè gli uomini allora sarebbero assolutamente liberi.;pl;thematic_target;no;distractor;_
vigneti su vigneti;yes;su;vigneto;significato;"Vagoni arrugginiti dove giovani senza senso lirico hanno spruzzato graffiti di cui, ahimè, non so cogliere il significato;";vigneti su vigneti;", sotto un velo di nebbia setosa come cipria; vecchi in bicicletta, altri che portano a spasso i cani.";pl;_;_;greater_plurality/accumulation;nominal
punto su punto;no;su;punto;data;Punto croce ricamo una data;punto su punto; giù indico traccia di trama merletto finito.;sg;NsuNgiù;yes;distractor;_
palla su palla;yes;su;palla;giocare;Concludiamo salendo a Noriglio, dove nel girone H, bellissima e tiratissima gara fra Calabria e Puglia che se la giocano;palla su palla;fino al decisivo tie - break.;sg;_;_;succession/iteration/distributivity;modifier
uomo a uomo;no;a;uomo;da;Zika, inoltre, si rivelò molto più complicato di Ebola: mentre Ebola si diffonde quasi esclusivamente da;_;_;_;_;_;_;_
strati su strati;yes;su;strato;sovrapporre;"""Basta con le tante scene di passeggeri che viaggiano sovrapposti";strati su strati;", come in una dantesca millefoglie - è sbottato in una diretta Facebook il Governatore con il suo solito linguaggio colorito - da oggi pugno duro: i campani potranno disporsi al massimo su tre strati"".";pl;_;_;greater_plurality/accumulation;nominal
fiume a fiume;no;a;fiume;da;L'intero universo si inchinò al tirannosauro: io mi chiudevo dentro al guscio o balzavo da;_;_;_;_;_;_;_
metri su metri;yes;su;metro;divorare;Da questo momento in poi, Beckham continuerà almeno per un'ora a divorare;metri su metri;, avversari su avversari, con una facilità che fa male al cuore.;pl;_;_;greater_plurality/accumulation;nominal
80 su 80;no;su;80;prendere;"Alla risposta: ""dovevate o dovevano studiare di più"" noi replichiamo in questo modo: ""anche se tutti gli studenti avessero preso";80 su 80;comunque tantissimi sarebbero tornati a casa!;X;NumPNum;no;distractor;_
gomito a gomito;yes;a;gomito;lavorare;Emiliano è un pm di prima linea: è stato in Sicilia dove ha lavorato;gomito a gomito;"con Rosario Livatino, il giovane magistrato ucciso dalla mafia; poi a Brindisi dove con una serie di inchieste ha decapitato la mafia pugliese, la Sacra Corona Unita.";sg;_;_;juxtaposition/contact;modifier
Microsoft su Microsoft;no;su;Microsoft;e;È accordo di licenza tra PalmOne e;Microsoft su Microsoft;Exchange.;X;proper_name_inglobation;no;distractor;_
gomito a gomito;yes;a;gomito;trovare;Questa baraonda e questo carnevale durarono finoache il Pretore, una sera, al cinema, accesasi la luce, si trovò;gomito a gomito;con un individuo interrogato in carcere quella mattina.;sg;_;_;juxtaposition/contact;modifier
superficie su superficie;yes;su;superficie;vita;Dove ho letto che al momento finale, quando la vita,;superficie su superficie;, si è - incrostata di esperienza, sai tutto, il segreto, il potere e la gloria, perché sei nato, perché stai morendo, e come tutto avrebbe potuto andare diversamente?;sg;_;_;succession/iteration/distributivity;modifier
porta a porta;yes;a;porta;raccolta;Nel 2002 è tra i tecnici che collaborano all'attivazione della raccolta;porta a porta;in alcuni Comuni della Provincia di Torino.;sg;_;_;succession/iteration/distributivity;modifier
goccia a goccia;yes;a;goccia;irrigazione;Sarebbe meglio parlare di irrigazione;goccia a goccia;, quasi indipendente dai meriti dei ricercatori e dal valore del progetto presentato.;sg;_;_;succession/iteration/distributivity;modifier
pietra su pietra;yes;su;pietra;cumulativamente;"È necessario fare chiarezza su tali aporie (si ricordi il senso della ‘spiegazione’ in Kant!) ; la filosofia non procede cumulativamente, ‘";pietra su pietra;, né può pensare di porre ordine nel linguaggio che effettivamente parliamo ricorrendo al ‘modello’ di ideografie, valide soltanto nell’ambito di procedure logico-matematiche.;sg;_;_;succession/iteration/distributivity;modifier
balcone a balcone;yes;a;balcone;confinare;La comunità di gatti che mi ospita sta nell'appartamento in cui abitiamo, che confina,;balcone a balcone;, con un altro appartamento nel quale viveva fino a poco tempo fa una gatta vecchia e sola.;sg;_;_;juxtaposition/contact;modifier
bandiere su bandiere;no;su;bandiera;dire;"Come se ci fosse bisogno di una voce dall' alto che dica""";bandiere su bandiere;" giù"".";pl;NsuNgiù;yes;distractor;_
muro a muro;yes;a;muro;stare;A Lucas Avenue guardavamo dall'alto in basso quelle disgraziate nei casini di Chestnut o di Market Strect, che stavano;muro a muro;con i teatri di varietà, le case da gioco dove un bullo poteva tentare la fortuna al faro o ad altri giochi, trovare qualsiasi tipo di liquore, e soddisfare qualunque capriccio sessuale.;sg;_;_;juxtaposition/contact;modifier
corpo a corpo;no;a;corpo;da;Mi sono avvicinato all'opera da;_;_;_;_;_;_;_
donne su donne;no;su;donna;di;Se la scorsa settimana ho scelto libri di;donne su donne; in questa puntata voglio cambiare completamente genere perché voglio proporvi quattro libri distopici, due pubblicati nel corso del '900 (che non sono i classici come 1984 di Orwell, Fahrenheit 451 di Bradbury, Il racconto dell'ancella della Atwood o La svastica sul sole di Dick) e due invece molto più recenti.;pl;thematic_target;no;distractor;_
Italia su Italia;no;su;Italia;in;"Una curiosità: Sandra Vidal ha partecipato alla versione americana del programma "" Popstars "", trasmesso anche in";Italia su Italia;1.;X;proper_name_inglobation;no;distractor;_
vasche su vasche;yes;su;vasca;accumulare;Continuai ad ammirarla mentre, bracciata dopo bracciata, accumulava;vasche su vasche;.;pl;_;_;greater_plurality/accumulation;nominal
palloni su palloni;yes;su;pallone;recuperare;I biancorossi di Guidolin hanno impresso un ritmo vorticoso alla gara fin dai primi minuti, hanno recuperato;palloni su palloni;grazie al pressing a centrocampo e hanno minacciato Turci in continuazione, con un Otero scatenato su tutto il fronte d'attacco.;pl;_;_;greater_plurality/accumulation;nominal
punto a punto;no;a;punto;da;I nuovi sistemi di trasmissione a distanza si differenziano dai precedenti - telegrafo e telefono - perché non costituiscono un legame da;_;_;_;_;_;_;_
 Vichy su Vichy;no;su;Vichy;repubblica;Citazione: si esattamente erano collaborazionisti esattamente come tutta la repubblica;Vichy su Vichy;non ci piove, ma sulle SS permettimi di dissentire per due motivi: - arruolamento volontario - giuramento di fedeltà al fuhrer e allla causa nazional-socialista - iniziazione mistica.;X;N_extended;no;distractor;_
goccia a goccia;yes;a;goccia;vivere;I suoi occhi sfavillano ora di un desiderio mai visto di vita, di piacere, ora di tristezza profonda, vissuta;goccia a goccia;, una desolazione tanto esausta da sconfinare nell'ironia.;sg;_;_;succession/iteration/distributivity;modifier
zero a zero;no;a;zero;finire;Il 26 settembre 1973 Caszely gioca contro l'URSS allo Stadio Lenin di Mosca e la partita finisce;_;_;_;_;_;_;_
linguaggio a linguaggio;no;a;linguaggio;da;Al di là di quelle che sono le regole standard (che differiscono da;_;_;_;_;_;_;_
