NPN;construction;preposition;noun;pre_lemma;context_pre;costr;context_post;number_of_noun;Type;other_cxn;meaning;syntactic_function
esami su esami;yes;su;esame;fare;Inoltre, sono due anni che faccio;esami su esami;al colon e che dovrei farmi operare cominciando dall'intestino, adesso ho preso la decisione e devo comunicarla di persona ai Civili di Brescia: ci convivrò.;pl;_;_;greater_plurality/accumulation;nominal
balle a balle;no;a;balle;aggiungere;Concluse che forse era meglio non aggiungere;_;_;_;_;_;_;_
volta a volta;yes;a;volta;TV;Ma quella virtualità che connota la realtà televisiva e rende la tv,;volta a volta;, spettacolare, ingannatrice, sedativa, omologante, esorcizzante, evasiva, legittimante, vicaria, è anche dovuta alla nostra virtualità crescente.;sg;_;_;succession/iteration/distributivity;modifier
uomo a uomo;no;a;uomo;da;Il contagio è solo interumano, vale a dire che la varicella si trasmette solo da;_;_;_;_;_;_;_
immobile a immobile;no;a;immobile;da;In molti comuni le aliquote cambiano da;_;_;_;_;_;_;_
interessi su interessi;no;su;interesse;mio;Io che sono fiorentina, forse avrei qualche motivo in più per pensarlo, ma preferisco spostare i miei;interessi su interessi;"più ""puliti"" perchè il calcio sicuramente non lo è.";sg;N_extended;no;;_
54 su 54;no;su;54;disponibile;La formazione pugliese è, assieme al Torino, la squadra che ha usufruito fino a questo momento di tutti i cambi disponibili;54 su 54;.;X;NumPNum;no;distractor;_
curve su curve;yes;su;curva;389;All'altezza della rocca di Posada si penetra nell'interno proseguendo sulla statale 389:;curve su curve;dove è possibile non incrociare altre macchine.;pl;_;_;greater_plurality/accumulation;nominal
carta su carta;no;su;carta;di;E poi c'è lo spariglio, una variante della presa di;carta su carta;uguale.;sg;thematic_target;no;distractor;_
seta su seta;no;su;seta;in;Inizia così una ricca produzione di arazzi ricamati in;seta su seta;o in lana si juta o su tela.;sg;thematic_target;no;distractor;_
vigneti su vigneti;yes;su;vigneto;significato;"Vagoni arrugginiti dove giovani senza senso lirico hanno spruzzato graffiti di cui, ahimè, non so cogliere il significato;";vigneti su vigneti;", sotto un velo di nebbia setosa come cipria; vecchi in bicicletta, altri che portano a spasso i cani.";pl;_;_;greater_plurality/accumulation;nominal
gomito a gomito;yes;a;gomito;fila;Di fronte al nemico si serrano i ranghi e le file;gomito a gomito;.;sg;_;_;juxtaposition/contact;modifier
artista ad artista;no;a;artista;da;Lo spessore dello strato pittorico varia da;_;_;_;_;_;_;_
potenza a potenza;no;a;potenza;da;La pretesa delle BR di ottenere aiuti senza pagare contropartite può apparire assurda in quanto addirittura travalica il concetto, già velleitario, di rapporto da;_;_;_;_;_;_;_
tappa su tappa;yes;su;tappa;aggiungere;Carica sulla Mercedes il figlio e la ex moglie, si ferma nei migliori alberghi lungo il tragitto, attraversa la Penisola Iberica aggiungendo;tappa su tappa;"di un itinerario ""turistico"": Malaga, Costa del Sol, Alicante.";sg;_;_;succession/iteration/distributivity;modifier
uomo su uomo;no;su;uomo;di;cioè quando si abolirà non solo il concetto di proprieta' di uomo su uomo (schiavitu') ma anche quello di SERVITU' di;uomo su uomo;(noleggio, prostituzione, o come chiamo io, SERVIZIONE).;sg;thematic_target;no;distractor;_
bagni su bagni;yes;su;bagno;fare;Ormai collaudato l'adattamento di Vucinic, attaccante di valore che continua a fare;bagni su bagni;d'umiltà.;pl;_;_;greater_plurality/accumulation;nominal
gomito a gomito;yes;a;gomito;sushi;"Sono impazzito per il mercato del pesce di Tokyo, colazione alle quattro di mattina, mangiando ""yakitori"", ""ramen"", sushi,";gomito a gomito;con uno che puzza di pesce perchè lì ci lavora.;sg;_;_;juxtaposition/contact;modifier
fronte a fronte;yes;a;fronte;salone;Ed ecco allora ai due estremi del salone,;fronte a fronte;, la Trasfigurazione di Tiziano (dove l'autore discioglie in un vortice drammatico e accalorato - con il bianco fantasmatico del Cristo che si riflette sull'emergenza dei capelli bianchi e sul rubizzo colore rubensiano della testa di Pietro sul bruno sfatto e informe del corpo - il ritmo rigoroso a mandorla della parte alta del modello raffaellesco) e l'Ultima Cena di Tintoretto.;sg;_;_;juxtaposition/contact;modifier
porta a porta;yes;a;porta;Spagna;Nella prefazione ho accennato al piccolo libro Dame al Macao di Alberto Arduini, raffinatissimo antiquario romano con negozio prima in via Frattina, poi in piazza di Spagna;porta a porta;con la KeatsShelley Memorial.;sg;_;_;succession/iteration/distributivity;modifier
porta a porta;yes;a;porta;campagna;Ma Davi suggerisce, se la vicenda Unipol dovesse monopolizzare tv e giornali nazionali ancora per mesi, di fare una campagna;porta a porta;: «Rinunciare a fare di Rai3 una rete militante, preferire interviste ai giornali e alle tv locali, tanta radio, non solo nelle emittenti di sinistra, comizi».;sg;_;_;succession/iteration/distributivity;modifier
volta a volta;yes;a;volta;soluzione;D'altro canto, non sono soltanto gli interventi normativi, tanto meno quelli che continuino a essere adottati, prima o a prescindere da effettive applicazioni delle soluzioni;volta a volta;accolte, a poter dare risposta alle necessità dell'amministrazione del settore.;sg;_;_;succession/iteration/distributivity;modifier
guancia a guancia;yes;a;guancia;lentamente;Pereira restò solo al tavolino, sostiene, ordinò un'altra limonata e se la bevve a piccoli sorsi guardando i ragazzi che ballavano lentamente;guancia a guancia;.;sg;_;_;juxtaposition/contact;modifier
volta a volta;yes;a;volta;rinvio;Quindi il contratto collettivo si è affermato nella realtà concreta della gestione dei rapporti di lavoro o per forza propria ovvero in ragione dei rinvii;volta a volta;operati dal legislatore.;sg;_;_;succession/iteration/distributivity;modifier
gomito a gomito;yes;a;gomito;sera;Lorenzo, nella sua ingenuità, si era immaginato una vita meravigliosa - di giorno a costruire mattoni, e la sera;gomito a gomito;con i Beatles e a passeggiare a braccetto con Jean Shrimpton o Marianne Faithfull per Carnaby Street.;sg;_;_;juxtaposition/contact;modifier
libri su libri;yes;su;libro;sfornare;Mi domandavo, con curiosità maliziosa: vediamo fin dove oserà spingersi questo giornalista che sforna;libri su libri;!;pl;_;_;greater_plurality/accumulation;nominal
territorio a territorio;no;a;territorio;da;Questo comporta anche la necessità di tecniche di misurazione e analisi differenti da;_;_;_;_;_;_;_
veleni su veleni;yes;su;veleno;alimentare;E una sfida all'arma bianca per arrivare alla guida di Palazzo Vermexio e gestire ancora il fiume di denaro che ha alimentato;veleni su veleni;, non ultimi quelli che grazie alle inchieste del piccolo giornale La Civetta hanno travolto la Procura, con tanto di trasferimento «cautelare» dell'ex capo Ugo Rossi per legami dei figli con alcune società nell'occhio del ciclone.;pl;_;_;greater_plurality/accumulation;nominal
fotogramma a fotogramma;yes;a;fotogramma;costruire;Una mitologia personale, insomma, costruita;fotogramma a fotogramma;"ritagliandomi di netto ciò che è necessario per un Olimpo fatto in casa: un pugno di tragedie sofoclee, uomini ed eroi, martiri casuali, omicidi senza fonte e senza fine; oppure: confondendo l'universo condiviso con gli album personali: eccola una foto di mio padre tale e quale a Satta Flores in C'eravamo tanto amati.";sg;_;_;succession/iteration/distributivity;modifier
fratello a fratello;no;a;fratello;da;Ti racconto tutte queste cose, Jibril, da;_;_;_;_;_;_;_
riunioni su riunioni;yes;su;riunione;fare;La situazione era diventata assurda: facevo;riunioni su riunioni;con colleghe e genitori sul modo di migliorare il rapporto educativo coi bambini, individuare le strategie per seguirli meglio... e intanto i miei erano soli.;pl;_;_;greater_plurality/accumulation;nominal
sofferenza a sofferenza;no;a;sofferenza;aggiungere;Una vicenda inconcepibile - commenta Andrea Amato, segretario del Cub -, che aggiunge;_;_;_;_;_;_;_
radio su radio;no;su;radio;a;Proprio stamattina presto, verso le 5 circa seguivo il programma alla;radio su radio;"1 ""istruzioni per l' uso"" e uno degli argomenti era per l' appunto il blog, si parlava di quanti blog esistono in Italia, circa 30000, (pensavo ce ne fossero di più) mentre in Francia sono 3000000!";sg;proper_name_inglobation;no;distractor;_
testa su testa;yes;su;testa;mattone;Per tua mano la Sua mannaia edificherà il Regno, passo dopo passo, mattone su mattone,;testa su testa;.;sg;_;_;succession/iteration/distributivity;modifier
acero  a acero;no;a;acero;da;Immaginando di tradurre le tinte in suoni, si sentirebbe il gemito del popolo delle foreste, un'eco straziante che si propaga da;_;_;_;_;_;_;_
19 su 19;no;su;19;positivo;L' Inter respira: allarme rientrato sullo stop di Vieri Vuelta, un danese vola sui Pirenei Frigo 4 ° in classifica Rugby, radiata squadra rumena: positivi;19 su 19;Maradona-doping, Boniek conferma.;X;NumPNum;no;distractor;_
facebook su facebook;no;su;Facebook;di;io ho creato una pagina di;facebook su facebook;appunto, ma mi rendo conto che non serve a niente perchè nessuno ne sa l'esistenza, quindi non pubblicizzo niente.;X;thematic_target;no;distractor;_
8 su 8;no;su;8;infilare;Un giorno si ritrova al campetto, tira fuori il pallone e infila;8 su 8;da tre punti: la mano è guarita.;X;NumPNum;no;distractor;_
pagine su pagine;yes;su;pagina;divorare;Perché c'è chi riesce a fartelo drizzare, chi riesce a farti ridere, chi a farti passare la notte divorando;pagine su pagine;per capire chi era l'agente segreto che cagava rubini, chi riesce a farti venire appetito e a farti tornare a Bangkok quando invece sei a casa tua, ad ognuno la sua specialità.;pl;_;_;greater_plurality/accumulation;nominal
porta a porta;yes;a;porta;vendere;Quando si riprese, Ron andò a vendere;porta a porta;i prodotti della Rawleigh come suo padre.;sg;_;_;succession/iteration/distributivity;modifier
porta a porta;yes;a;porta;differenziato;"In particolare, anche in Italia ci sono esperienze straordinarie a riguardo, conta la raccolta differenziata """;porta a porta;""", domiciliarizzata, portare il servizio vicino alle famiglie.";sg;_;_;succession/iteration/distributivity;modifier
mondo su mondo;yes;su;mondo;totale;«Donne», scrive esemplarmente Cristina Campo, «tende ad elaborare l'idea al punto estremo dell'ingegnosità e in una sapienza retorica altamente controllata», mentre «Emily brucia nel mistico vuoto d'aria di un'assenza totale,;mondo su mondo;, balza da stella morta a stella ancor vivente, valicando la follia e la morte».;sg;_;_;succession/iteration/distributivity;modifier
studio a studio;no;a;studio;da;Le cifre, ovviamente, variano da;_;_;_;_;_;_;_
casi su casi;yes;su;caso;risolvere;I laboratori forensi dell'Oklahoma, come di molti altri Stati, soffrivano di una cronica mancanza di fondi e di personale, a fronte di enormi pressioni perché risolvessero;casi su casi;.;pl;_;_;greater_plurality/accumulation;nominal
paese a paese;no;a;paese;da;Poi c'è il fondamentalismo: diverso da;_;_;_;_;_;_;_
faccia a faccia;no;a;faccia;a;E dopo la passione e la morte del nostro Signore Gesù Cristo, esse hanno visto e vedono l'essenza divina in una visione intuitiva e anche a;_;_;_;_;_;_;_
giunzioni su giunzioni;yes;su;giunzione;km;Novità più significative, figlie di questo nuovo modo di intendere la speleologia, sono le esplorazioni all'OPIII, alla Feruglio, nel Complesso del Foran del Muss (che macinando km su km;giunzioni su giunzioni;, sta insidiando l'adiacente Complesso del Col delle Erbe, da oltre 25 anni al primo posto nella classifica delle grotte più estese), e il Led Zeppelin, che è divenuta la più profonda cavità della regione.;pl;_;_;greater_plurality/accumulation;nominal
uomo a uomo;no;a;uomo;da;Questa malattia può dare luogo a febbri emorragiche anche fatali e ha una caratteristica particolare: non si trasmette da;_;_;_;_;_;_;_
caserma a caserma;no;a;caserma;da;Che invece d'una esercitazione notturna o d'uno spostamento di forze da;_;_;_;_;_;_;_
avversari su avversari;yes;su;avversario;metro;Da questo momento in poi, Beckham continuerà almeno per un'ora a divorare metri su metri,;avversari su avversari;, con una facilità che fa male al cuore.;pl;_;_;greater_plurality/accumulation;nominal
schiaffoni su schiaffoni;yes;su;schiaffone;prendere;È il piccoletto dei Brutos che prendeva;schiaffoni su schiaffoni;.;pl;_;_;greater_plurality/accumulation;nominal
volta a volta;yes;a;volta;disattenzione;Roberto non capiva se essa, per disattenzione,;volta a volta;gli attribuisse i detti e i fatti di un altro, oppure lo provocasse con civetteria.;sg;_;_;succession/iteration/distributivity;modifier
guancia a guancia;yes;a;guancia;stare;Nel bridge, esattamente a 1 e 42 secondi primi, la canzone diventa un recitativo, cito letteralmente: Su, vieni più vicino, lasciati andare, è bello stare;guancia a guancia;, no?;sg;_;_;juxtaposition/contact;modifier
sasso su sasso;no;su;sasso;di;Il signor Sandro scuote la testa, si infila le mani in tasca e si piega a guardare la pietra, il disegno fatto a colpi di;sasso su sasso;, poi i piedi, le mani, gli occhi tondi lassù che rispondono allo sguardo.;sg;thematic_target;no;distractor;_
volta a volta;yes;a;volta;proporre;Piuttosto sulla capacità di costruirsi sul dialogo (e sul conflitto) con i luoghi, con le condizioni, con l'altro e di proporre,;volta a volta;a partire da essi, l'emersione di una verità: limitata, provvisoria e specifica quanto universale nelle sue intenzionalità.;sg;_;_;succession/iteration/distributivity;modifier
Sky su Sky;no;su;Sky;di;Cliente Sky via fibra/satellite con pack Calcio e Sky Go: 36,80 euro/mese* per le 7 partite/turno di;Sky su Sky;Go.;X;proper_name_inglobation;no;distractor;_
uomini su uomini;no;su;uomo;di;Per un verso, infatti, essa esclude qualsiasi analogia mimetica tra la sovranità di Dio e la sovranità di;uomini su uomini;(significato politico-critico dell'immagine trinitaria di Dio).;pl;thematic_target;no;distractor;_
verde a verde;no;a;verde;aggiungere;Una grande fabbrica silenziosa con alberi che si arrampicano sulla facciata, aggiungendo;_;_;_;_;_;_;_
faccia a faccia;no;a;faccia;a;Solo alla fine, quando avrà termine la nostra conoscenza imperfetta e vedremo Dio a;_;_;_;_;_;_;_
2 su 2;no;su;2;con;Il MF salernitano si è portato da solo al comando con;2 su 2;, poi ha perso con Braga, ma la vittoria al sesto turno con Belotti lo ha ricatapultato da solo al primo posto a quota 4.5 su 6.;X;NumPNum;no;distractor;_
gomito a gomito;yes;a;gomito;operare;Non esistono infine uffici: gli impiegati e le segretarie operano;gomito a gomito;"in ""open space"".";sg;_;_;juxtaposition/contact;modifier
uomo su uomo;no;su;uomo;qui;"Il problema del potere si ripresenta qui; il potere d'";uomo su uomo;.;sg;thematic_target;no;distractor;_
paese a paese;no;a;paese;da;In Europa centrale e orientale e nei Nuovi Stati Indipendenti è stato definito il quadro giuridico necessario, anche se la qualità e le prestazioni delle autorità di regolamentazione differiscono da;_;_;_;_;_;_;_
isola a isola;no;a;isola;navigante;"Naturalmente tale ago risultò di enorme utilità per i naviganti
isola a isola;no;a;isola;amico;Siamo isole in un mare di indifferenza, caro amico";_;_;_;_;_;_;_
bocca a bocca;no;a;bocca;da;Come si diffondono, ingigantendosi nel passare da;_;_;_;_;_;_;_
stato a stato;no;a;stato;da;Già negli USA la situazione è complessa, perché i professionisti abilitati variano da;_;_;_;_;_;_;_
strada su strada;no;su;strada;di;In tal modo l'aquaplaning viene scongiurato e la tenuta di;strada su strada;bagnata e innevata è ottimale.;sg;N_extended;no;distractor;_
dubbi su dubbi;yes;su;dubbio;instillare;Era una mossa rischiosa: la maggioranza dei difensori non vede l'ora di cominciare a instillare;dubbi su dubbi;nei giurati e a contestare le prove addotte dall'accusa.;pl;_;_;greater_plurality/accumulation;nominal
balle su balle;yes;su;balla;raccontare;Capitan Findus Letta ha raccontato;balle su balle;sul taglio dei rimborsi elettorali che si è puntualmente intascato a luglio insieme agli altri partiti: una rata di 91 milioni.;pl;_;_;greater_plurality/accumulation;nominal
gomito a gomito;yes;a;gomito;collaborare;Così a parità di lavoro svolto, collaboriamo;gomito a gomito;con colleghi che usufruiscono di notevoli incentivi economici.;sg;_;_;juxtaposition/contact;modifier
jeans su jeans;no;su;jeans;di;Il trucco è prevalentemente uno, non eccedere con i colori, quindi se indossate una giacca di;jeans su jeans;blu dovranno avere lo stesso colore.;sg/pl;N_extended;no;distractor;_
porta a porta;yes;a;porta;contratto;Ciò si manifesta anche con la tendenza - si veda a proposito la legge sull'equo canone, sui contratti;porta a porta;", sul credito al consumo, sulla subfornitura e sulla multiproprietà - a non creare nuove figure contrattuali ma a regolare I ""rapporti economici"" fissando requisiti minimi del testo negoziale.";sg;_;_;succession/iteration/distributivity;modifier
discussioni su discussioni;yes;su;discussione;iniziare;Anzi, diciamola tutta: ciascuno ha un'idea differente del suo significato, e va così a finire che iniziano;discussioni su discussioni;.;pl;_;_;greater_plurality/accumulation;nominal
permessi su permessi;yes;su;permesso;senza;Chi dieci anni fa, a casa sua, ha piantato un filare di platani troppo vicini, non li può diradare senza;permessi su permessi;.;pl;_;_;greater_plurality/accumulation;nominal
9 su 9;no;su;9;Milano;A Lecco si è registrato una adesione del 100 per cento (hanno scioperato 19 su 19) così come al tribunale di sorveglianza di Milano (;9 su 9;).;X;NumPNum;no;distractor;_
zero a zero;no;a;zero;sul;Nell'intervallo, con il risultato sullo;_;_;_;_;_;_;_
gomito a gomito;yes;a;gomito;sedere;L'unica cosa sopravvissuta, ma desolatamente annerita dal fumo, è la lunga serpentina di marmo in cui i viaggiatori si sedevano;gomito a gomito;per consumare un rapido pasto prima di sperdersi nella regione dei laghi a Est di New York o nelle innumerevoli cittadine incastonate lungo il fiume Hudson, dove la frenesia della città che non dorme mai, nonostante la breve distanza, sembra una cosa remota e incredibile.;sg;_;_;juxtaposition/contact;modifier
gomito a gomito;yes;a;gomito;altro;Ecco, devono essere nati così questi ultimi due romanzi di famiglia, seguiti da lunghe ore al computer, uno accanto all'altro,;gomito a gomito;, anima ad anima, ogni tanto un sospiro, una lunga occhiata, qualche sorriso di tenerezza perché i due si adorano e si cercano come solo due innamoratini sanno fare, al di là delle loro abbondanti sessanta primavere.;sg;_;_;juxtaposition/contact;modifier
uscio a uscio;no;a;uscio;a;E poi il detto lupo vivette due anni in Agobbio, ed entravasi dimesticamente per le case a;_;_;_;_;_;_;_
circonferenze su circonferenze;yes;su;circonferenza;disegnare;Restò così, trafitto da raggi e bisettrici, mentre le lumache disegnavano;circonferenze su circonferenze;intorno a lui.;pl;_;_;greater_plurality/accumulation;nominal
scatole su scatole;yes;su;scatola;recapitare;Maria, non l'aveva neppure mai fatto l'amore e, ciò nonostante, si vedeva recapitare;scatole su scatole;di preservativi.;pl;_;_;greater_plurality/accumulation;nominal
volta a volta;yes;a;volta;essere;"Sono anche, e qui Isnenghi non potrebbe essere più esplicito, coloro che entrano in azione ""ogni volta che risuona un richiamo di guerra, contro un qualsiasi nemico esterno, sia";volta a volta;Gheddafi, Saddam o Milosevic.;sg;_;_;succession/iteration/distributivity;modifier
metri su metri;yes;su;metro;divorare;Da questo momento in poi, Beckham continuerà almeno per un'ora a divorare;metri su metri;, avversari su avversari, con una facilità che fa male al cuore.;pl;_;_;greater_plurality/accumulation;nominal
goccia a goccia ;no;a;goccia;a;il chiarore del giorno penetra a;_;_;_;_;_;_;_
compagnia a compagnia;no;a;compagnia;da;Sulle polizze nuove le provvigioni variano da ramo a ramo e da;_;_;_;_;_;_;_
cellula a cellula;no;a;cellula;da;Tra tutte le teorie, la più interessante è sembrata essere quella che indica la presenza di un'alterazione a carico delle sostanze deputate al trasporto dell'impulso nervoso da;_;_;_;_;_;_;_
paese a paese;no;a;paese;da;Nella UE il settore dei trasporti genera il 4,1 % del valore aggiunto totale, con notevoli differenze da;_;_;_;_;_;_;_
monologo su monologo;yes;su;monologo;accumulare;Non si fa che procedere per accumulo:;monologo su monologo;.;sg;_;_;succession/iteration/distributivity;modifier
strato su strato;yes;su;strato;formare;La storia poco nota di questa parte di Roma è di straordinario interesse e basterebbe quasi, da sola, a illustrare attraverso quali peripezie militari e religiose si sia venuta formando,;strato su strato;, la città attuale.;sg;_;_;succession/iteration/distributivity;modifier
zero a zero;no;a;zero;finire;Il 26 settembre 1973 Caszely gioca contro l'URSS allo Stadio Lenin di Mosca e la partita finisce;_;_;_;_;_;_;_
gomito a gomito;yes;a;gomito;folle;Cosí si compí il tradimento, progettato e custodito fin dall'arrivo nella città dei folli,;gomito a gomito;con loro, per oltre un anno.;sg;_;_;juxtaposition/contact;modifier
cuore a cuore;yes;a;cuore;te;Ci deve essere la possibilità di rapporti concreti: la mamma deve poterti portare a letto, darti il bacio della buona notte, imboccarti se è necessario, stare con te;cuore a cuore;.;sg;_;_;juxtaposition/contact;modifier
ruota su ruota;no;su;ruota;strisciamento;DEFINIZIONE: l' attrito volvente (a) è la forza che si sviluppa fra due solidi a contatto in moto rotatorio relativo senza strisciamento (;ruota su ruota;o ruota su strada).;sg;thematic_target;no;distractor;_
39 su 39;no;su;39;a;Essi hanno scoperto che Red Book è stato in grado di fornire con successo le risposte a;39 su 39;richieste su problemi clinici, con una media di 10 secondi per ricerca.;X;NumPNum;no;distractor;_
uomini su uomini;no;su;uomo;di;C'è anche la violenza di;uomini su uomini;, donne contro le donne, adulti su bambini, giovani contro anziani e via di questo passo.;pl;thematic_target;no;distractor;_
volta a volta;yes;a;volta;succedere;"Presentati in tavola questi piatti, ""tutte le conversazioni cessarono per la pienezza dei cuori...; e quando i piatti di servizio erano passati, vidi succedersi";volta a volta;"su tutte le fisionomie il fuoco del desiderio, l'estasi della gioia, il riposo perfetto della beatitudine"".";sg;_;_;succession/iteration/distributivity;modifier
proprietà a proprietà;no;a;proprietà;vecchio;Se passerà l'operazione Integritas-Palermo, valutata nell'ordine di 200 milioni di euro, è prevedibile una moltiplicazione di transazioni dalle vecchie;_;_;_;_;_;_;_
volta a volta;yes;a;volta;avere;E sul ritardo contano i dottrinari tedeschi per giudicarle poi inutili (dopo aver;volta a volta;tentato di dimostrarle pericolose o illegali).;sg;_;_;succession/iteration/distributivity;modifier
guancia a guancia;yes;a;guancia;brillantina;La tromba è guerresca, angelica, apocalittica, vittoriosa, suona la carica, il sassofono fa ballare bulletti di periferia coi capelli unti di brillantina,;guancia a guancia;con ragazze sudate.;sg;_;_;juxtaposition/contact;modifier
disappunto a disappunto;no;a;disappunto;aggiungere;Si diede subito della stupida e questo fatto aggiunse;_;_;_;_;_;_;_
fratelli a fratelli;no;a;fratello;genitore;Riconosco i tanti cognomi della comunità, rivedo le loro storie, riunisco figli a genitori,;_;_;_;_;_;_;_
premi su premi;yes;su;premio;famiglia;Il suo ufficio è stracolmo di dossier, faldoni, documenti, libri in quantità, quadri, cornici d'argento con le foto di famiglia,;premi su premi;che raccontano di essere stati compagni di lunghe giornate.;pl;_;_;greater_plurality/accumulation;nominal
porta a porta;yes;a;porta;condurre;"Un altro vantaggio per i broker è che i potenziali clienti ""visitano"" l'immobile online, liberando il professionista dall'onere di condurre";porta a porta;gli acquirenti interessati.;sg;_;_;succession/iteration/distributivity;modifier
guancia a guancia;yes;a;guancia;cheek;"Azzurro Caltagirone è a un tavolo ""cheek to cheek"",";guancia a guancia;con il pretone.;sg;_;_;juxtaposition/contact;modifier
goccia a goccia ;no;a;goccia;a;Carlino provò a lasciarsi cadere a;_;_;_;_;_;_;_
successi su successi;yes;su;successo;macinare;Le sue divisioni cavo e interactive media macinano;successi su successi;, conquistando sempre maggiori fette di mercato.;pl;_;_;greater_plurality/accumulation;nominal
mente su mente;no;su;mente;parte;"Il credersi ""separati"" in più parti (";mente su mente;"giù, corpo questo e corpo quell'altro, questo è meglio e quello è peggio) è solo il frutto d'una visione ""schizofrenica"".";sg;NsuNgiù;yes;distractor;_
emendamenti su emendamenti;yes;su;emendamento;ieri;Basti pensare che, per tutto il pomeriggio, nella riunione plenaria in Sala della Regina sono stati presentati ieri;emendamenti su emendamenti;.;pl;_;_;greater_plurality/accumulation;nominal
100 su 100;no;su;100;di;Delle 20 regioni prese in esame da un gruppo di esperti in comunicazione, sociologia, diritti del cittadino, il portale della Regione Emilia-Romagna risulta primo classificato con un risultato di;100 su 100;per quanto riguarda il rapporto amministrazione-cittadini, davanti a Veneto (89/100) e Liguria (80/100).;X;NumPNum;no;distractor;_
gaffes su gaffes;yes;su;gaffes;inanellare;Inoltre Greg, autentico Fantozzi, ne combina di tutti i colori, inanella;gaffes su gaffes;.;pl;_;_;greater_plurality/accumulation;nominal
