NPN;construction;preposition;noun;pre_lemma;context_pre;costr;context_post;number_of_noun;Type;other_cxn;meaning;syntactic_function
ciocca a ciocca;yes;a;ciocca;sfilare;Il più attuale si fa sfilando;ciocca a ciocca;, per creare l'effetto piuma, che alleggerisce la pettinatura e rende la piega particolarmente facile.;sg;_;_;succession/iteration/distributivity;modifier
porta a porta;yes;a;porta;vendita;Alla quale vanno aggiunti ancora un sindacato (Domina: organizzazione dei datori di lavoro domestico), un patronato (Informafamiglia), una società (Rete - Rete) per vendite;porta a porta;.;sg;_;_;succession/iteration/distributivity;modifier
fogli su fogli;yes;su;foglio;strappare;Un rumore molto forte, comese qualcuno fosse stato impegnato a strappare;fogli su fogli;di lamiera dal centro della macchina.;pl;_;_;greater_plurality/accumulation;nominal
Sky su Sky;no;su;Sky;di;"È possibile acquistare entrambe le offerte ""Vodafone TV + NOW TV Intrattenimento"" e ""Vodafone TV Sport"" per avere accesso sia allo sport di";Sky su Sky;Sport Mix che all'entertaniment televisivo con il Ticket Intrattenimento di NOW TV.;X;proper_name_inglobation;no;distractor;_
ritardi su ritardi;yes;su;ritardo;più;Da allora, poco o nulla più:;ritardi su ritardi;da parte di BluTec nell'esecuzione dei piani, i lavoratori che protestano, Invitalia che ritira il finanziamento e chiede indietro i soldi.;pl;_;_;greater_plurality/accumulation;nominal
porta a porta;yes;a;porta;estorsione;I Giuliano sembrano un clan giunto al capolinea, lentamente emerso dalla miseria, dal contrabbando alle puttane, dalla gestione dell'estorsione;porta a porta;ai rapimenti.;sg;_;_;succession/iteration/distributivity;modifier
porta a porta;yes;a;porta;raccolta;Anziché sostenere la lobby dell'incenerimento Orlando promuova la riduzione dei rifiuti, la raccolta;porta a porta;(abolendo la Tares come chiesto dal M5S con proposte parlamentari), costruzioni di centri riciclo e compostaggio, sistemi alternativi all'incenerimento e alla discarica, in linea con l'Europa!;sg;_;_;succession/iteration/distributivity;modifier
palmo a palmo;yes;a;palmo;terra;Ma le guerre non si vincono né in aria né sull'acqua, si vincono sulla terra,;palmo a palmo;, uomo contro uomo.;sg;_;_;succession/iteration/distributivity;modifier
campo a campo;no;a;campo;da;A Durazzo la voce si insegue da;_;_;_;_;_;_;_
Venere su Venere;no;su;Venere;di;E i transiti che mi aspettano di ;Venere su Venere;e Saturno e poi di Urano su Marte, posso considerarli buoni per la mia situazione sentimentale?;X;N_extended;no;distractor;_
luogo a luogo;no;a;luogo;da;Le leggi al riguardo variano da;_;_;_;_;_;_;_
pacchi su pacchi;yes;su;pacco;su;Ci mettemmo una cosa come mezz'ora, facendo avanti e indietro tra la strada e la cucina – pacchi su;pacchi su pacchi;– e quando il tizio con il berretto, sfinito, risalì sul suo furgone e sparì, dalla cucina li portammo in taverna – pacchi su pacchi su pacchi.;pl;_;_;greater_plurality/accumulation;nominal
grado a grado;no;a;grado;a;Inoltre, la stretta relazione con MaleinaDeoris apprese tutto ciò lentamente, a;_;_;_;_;_;_;_
palmo a palmo;yes;a;palmo;battere;Per individuare le casse di zinco, la polizia batte;palmo a palmo;tutta la basilica, partendo dai sottotetti, scoprendo locali nemmeno mappati nelle cartine catastali, per passare alle stanze che ospitano gli organi, sino a sgabuzzini ricavati vicino alle aule, come quello ispezionato vicino all'attuale aula 201: la coincidenza è interessante, perché la stanza si trova a pochi metri dal quarto piano del palazzo adiacente: proprio la vecchia sede dell'istituto Ludovico da Victoria, la scuola di musica dove Emanuela nel 1983 andava a lezione.;sg;_;_;succession/iteration/distributivity;modifier
3 su 3;no;su;3;con;Da segnalare anche un ottima prestazione di Cazzulo con;3 su 3;da due e 2 su 2 dalla lunetta, in momenti importanti della gara.;X;NumPNum;no;distractor;_
goccia a goccia;yes;a;goccia;irrigazione;Ai due lati del viale, dentro gabbie di ferro avvolte di tela di sacco per ripararle dalle tempeste di sabbia, alcune piante di poinciana nutrite dall'irrigazione;goccia a goccia;e ancora incredule sul senso della propria esistenza.;sg;_;_;succession/iteration/distributivity;modifier
storielle su storielle;yes;su;storiella;raccontare;Lungo il percorso in auto per far passare quelle lunghe ore mi prodigavo a raccontare;storielle su storielle;.;pl;_;_;greater_plurality/accumulation;nominal
palmo a palmo;yes;a;palmo;conquistare;Cominciando a conoscerti, che a Venezia ha aperto la Settimana della Critica e, ora, soggiorna sui nostri schermi conquistandosi;palmo a palmo;il favore del pubblico più attento.;sg;_;_;succession/iteration/distributivity;modifier
90 su 90;no;su;90;a;Una volta fatto il gruppo (non esagerare con le unita' di supporto tanto, tra quelle in difesa e quelle prodotte sarai quasi a;90 su 90;) prendi la strada in alto a destra.;X;NumPNum;no;distractor;_
capelli su capelli;no;su;capello;di;Quindi, ad esempio, lo stesso taglio di;capelli su capelli;lisci e ricci apparirà completamente diverso. pertanto quando scegli un taglio di capelli, oltre al tipo di viso, considera anche il tipo di capelli.;pl;N_extended;no;distractor;_
ASCO su ASCO;no;su;ASCO;di;Ulteriori informazioni Per ulteriori informazioni, vedi il meeting virtuale di;ASCO su ASCO;OnLine (www.asco.org), che contiene tutti gli abstract degli studi presentati alla conferenza.;X;proper_name_inglobation;no;distractor;_
porta a porta;yes;a;porta;venditore;Ma l'azienda cremonese ha bisogno anche di venditori;porta a porta;.;sg;_;_;succession/iteration/distributivity;modifier
balle su balle;yes;su;balla;raccontare;Capitan Findus Letta ha raccontato;balle su balle;sul taglio dei rimborsi elettorali che si è puntualmente intascato a luglio insieme agli altri partiti: una rata di 91 milioni.;pl;_;_;greater_plurality/accumulation;nominal
strato su strato;yes;su;strato;incollare;L'unica traccia di colore era offerta dai manifesti elettorali, sbiaditi e incollati;strato su strato;.;sg;_;_;succession/iteration/distributivity;modifier
porta a porta;yes;a;porta;venditore;L'Ambiente oggi cerca 20 distributori (uno per ogni regione) più venditori;porta a porta;in tutta Italia.;sg;_;_;succession/iteration/distributivity;modifier
citazioni su citazioni;yes;su;citazioni;fare;Mi chiese se continuava a fare;citazioni su citazioni;per legittimare le sue teorie.;pl;_;_;greater_plurality/accumulation;nominal
pesce a pesce;no;a;pesce;da;La moltitudine dei tipi di pesci esige sistemi nutritivi diversi e anche il modo di cibarsi differisce da;_;_;_;_;_;_;_
goccia a goccia;yes;a;goccia;parlare;Nei giorni a venire e nelle notti illuni e nelle notti quando una luna fulgidissima splendeva sopra la terra, il vecchio avrebbe continuato a parlargli, a parlargli,;goccia a goccia;, sassolino su sassolino, petalo dopo petalo.;sg;_;_;succession/iteration/distributivity;modifier
comunicazioni su comunicazioni;yes;su;comunicazione;ovvero;La capacità di significare tramite icone implica anche che tutti i processi di comunicazione siano di secondo livello, ovvero;comunicazioni su comunicazioni;, spesso lontane dalla vita quotidiana.;pl;_;_;greater_plurality/accumulation;nominal
porta a porta;yes;a;porta;distribuzione;"Si tratta di vendere questi prodotti attraverso il multilevel marketing, la cosiddetta distribuzione """;porta a porta;""" che funziona attraverso un efficace passa - parola e che permette di guadagnare anche su ogni persona che si riesce a reclutare.";sg;_;_;succession/iteration/distributivity;modifier
cene su cene;yes;su;cena;organizzare;E fu senz'altro la disperazione che li portò a organizzare;cene su cene;con vino in abbondanza e conseguente e inevitabile sbronza collettiva.;pl;_;_;greater_plurality/accumulation;nominal
grado a grado;no;a;grado;a;Fu scritto in un'epoca d'infermità e di vanità intellettuale, quando io allettato dalle mollezze dell'ozio andavo perdendo a;_;_;_;_;_;_;_
goccia a goccia;yes;a;goccia;sgorgare;Spesso il sangue si mette a sgorgare;goccia a goccia;o in modo continuo, iniziando improvvisamente senza una ragione apparente: talvolta i genitori notano solo l'orecchio o il cuscino sporco di sangue.;sg;_;_;succession/iteration/distributivity;modifier
seta su seta;no;su;seta;in;Inizia così una ricca produzione di arazzi ricamati in;seta su seta;o in lana si juta o su tela.;sg;thematic_target;no;distractor;_
autonomia su autonomia;no;su;autonomia;di;Che ripeto che ricordo sono quelle delle inchieste sui gruppi terroristici Brigate Rosse prima linea sono quelli dell'inchiesta di;autonomia su autonomia;operaia inchiesta com'era sette aprile.;sg;proper_name_inglobation;no;distractor;_
teglie su teglie;yes;su;teglia;grigliato;Un gigantesco pesce spada grigliato,;teglie su teglie;di parmigiana di melanzane, treccione di mozzarella di bufala, pasta con le zucchine fritte, crocchette ed arancini, una gigantesca torta di panna al limone, sfogliatelle e babà al rhum.;pl;_;_;greater_plurality/accumulation;nominal
mondo su mondo;yes;su;mondo;totale;«Donne», scrive esemplarmente Cristina Campo, «tende ad elaborare l'idea al punto estremo dell'ingegnosità e in una sapienza retorica altamente controllata», mentre «Emily brucia nel mistico vuoto d'aria di un'assenza totale,;mondo su mondo;, balza da stella morta a stella ancor vivente, valicando la follia e la morte».;sg;_;_;succession/iteration/distributivity;modifier
brani su brani;yes;su;brano;produrre;"John Lennon diceva che Beethoven ""era una truffa proprio come noi, produceva";brani su brani;""", Ringo invece ""ne ammirava soprattutto le poesie"".";pl;_;_;greater_plurality/accumulation;nominal
feste su feste;yes;su;festa;indire;Per questa ragione, cioè per aumentare il numero delle iscrizioni, gli scissionisti del Pd hanno deciso di indire;feste su feste;in tutta Italia durante l'estate.;pl;_;_;greater_plurality/accumulation;nominal
palmo a palmo;yes;a;palmo;praticamente;Quelli dell'NGA disponevano di migliaia di immagini scattate dai droni e dai satelliti, e conoscevano praticamente;palmo a palmo;l'intera area esterna del compound.;sg;_;_;succession/iteration/distributivity;modifier
pagine su pagine;yes;su;pagina;disposizione;L'uomo aveva sempre a disposizione;pagine su pagine;bianche, lavate dal suo alito.;pl;_;_;greater_plurality/accumulation;nominal
61 su 61;no;su;61;il;L'ha data già il caso Fiat, bisogna insistere per eliminare anche la mafia, artefice del successo del polo con i;61 su 61;.;X;NumPNum;no;distractor;_
prodotto a prodotto;no;a;prodotto;da;La durata dell'azione contraccettiva è anch'essa variabile da;_;_;_;_;_;_;_
porta a porta;yes;a;porta;firma;Scompariranno le sue leggendarie ma costose campagne per il finanziamento, durante le quali migliaia di militanti stipendiati raccoglievano soldi e firme;porta a porta;.;sg;_;_;succession/iteration/distributivity;modifier
palmo a palmo;yes;a;palmo;accanitamente;"La tensione del Franco Cacciatore viene condotta al diapason, allorché l'agens deve unirsi alla ""generale Caccia"" alla Bestia, e batte accanitamente,";palmo a palmo;, l'intrico della macchia.;sg;_;_;succession/iteration/distributivity;modifier
goccia a goccia;yes;a;goccia;amarezza;Il generale si mise a distillare le sue amarezze;goccia a goccia;.;sg;_;_;succession/iteration/distributivity;modifier
donna a donna;no;a;donna;da;Se mi fossi presentata nella maniera giusta, ho pensato, se le avessi parlato da;_;_;_;_;_;_;_
tempia a tempia;no;a;tempia;da;Dalla pelata gli scivolano giù delle goccioline minuscole di sudore, vanno a morire sulle sopracciglia folte che lo attraversano da;_;_;_;_;_;_;_
bit a bit;yes;a;bit;or;Esegue l 'operazione di OR;bit a bit;tra i due operandio specificati, ponendo il risultato nel secondo.;sg;_;_;succession/iteration/distributivity;modifier
Italia su Italia;no;su;Italia;in;Ricordiamo che Futurama è partita in America sul network FOX il 28 marzo 1999, ed ha esordito in;Italia su Italia;1 in prima serata alle 20.45 il 6 gennaio 2000.;sg;proper_name_inglobation;no;distractor;_
numero su numero;no;su;numero;deviazione;È possibile cancellare simultaneamente la programmazione dei servizi prenotazione, deviazione; numero su numero;interno, deviazione su numero esterno e non disturbare.;sg;N_extended;no;distractor;_
justin su justin;no;su;justin;là;belibers.....cazzo calmatevi fate paura....justin di qua justin di là;justin su justin;giù!;X;NsuNgiù;yes;distractor;_
gomito a gomito;yes;a;gomito;fila;Di fronte al nemico si serrano i ranghi e le file;gomito a gomito;.;sg;_;_;juxtaposition/contact;modifier
uomini su uomini;no;su;uomo;di;C'è anche la violenza di;uomini su uomini;, donne contro le donne, adulti su bambini, giovani contro anziani e via di questo passo.;pl;thematic_target;no;distractor;_
spalla a spalla;no;a;spalla;a;Pazzia, avanguardia, eroismo, tutti e tre allo sbaraglio senza saperlo: ognuno crede in un suo fantasma eccezionale: crede e opera al di fuori del branco: gli altri, a;_;_;_;_;_;_;_
palmo a palmo;yes;a;palmo;frugare;I tre si sparpagliarono e cominciarono a frugare;palmo a palmo;il terreno.;sg;_;_;succession/iteration/distributivity;modifier
facebook su facebook;no;su;Facebook;di;io ho creato una pagina di;facebook su facebook;appunto, ma mi rendo conto che non serve a niente perchè nessuno ne sa l'esistenza, quindi non pubblicizzo niente.;X;thematic_target;no;distractor;_
punto a punto;no;a;punto;da;Stanno, invece, in un continuum dove tutte le interazioni si propagano da;_;_;_;_;_;_;_
palmo a palmo;yes;a;palmo;battere;Lui, quando ancora Bossi studiava alla Scuola Radio Elettra, batteva;palmo a palmo;le province di Verona, Vicenza e Treviso per diffondere il verbo della Serenissima.;sg;_;_;succession/iteration/distributivity;modifier
palmo a palmo;yes;a;palmo;scrutare;E invece la sua macchina, accompagnata dai rintocchi della campana di Montecitorio, è arrivata puntualissima sul piazzale della Camera, scrutato;palmo a palmo;dai tiratori scelti appostati sui tetti.;sg;_;_;succession/iteration/distributivity;modifier
3 su 3;no;su;3;fecondare;Per nostra fortuna sono stati fecondati;3 su 3;, il 100 %, pronti per essere impiantati in utero.;X;NumPNum;no;distractor;_
37 su 37;no;su;37;essere;Nella votazione delle due di notte eravamo;37 su 37;e alla fine è scoppiato un applauso.;X;NumPNum;no;distractor;_
nodi su nodi;yes;su;nodo;intrecciare;Sembra vedere e sentire il ritmo di questa fatica: trovare lo strappo, ridurlo, intrecciare;nodi su nodi;, riparare finalmente la rete.;pl;_;_;greater_plurality/accumulation;nominal
Venezia su Venezia;no;su;Venezia;di;Pubblicazione di alcune foto di;Venezia su Venezia;Radio TV e Venetian Holiday.;X;proper_name_inglobation;no;distractor;_
tensione a tensione;no;a;tensione;aggiungere;lo so che ti potrebbe montare l'ansia, però se prosegui così, purtroppo, aggiungi;_;_;_;_;_;_;_
brano a brano;yes;a;brano;scuoiare;Ma non primadi aver beccato Nauplio finoa levargli la pelle, a scuoiarlo,;brano a brano;.;sg;_;_;succession/iteration/distributivity;modifier
bambino a bambino;no;a;bambino;da;Le difficoltà e i successi ovviamente variano da;_;_;_;_;_;_;_
brano a brano;yes;a;brano;cui;"""E siccome era stato portato lì davanti con tutti i suoi paramenti sacerdotali, iniziò un rito in cui";brano a brano;i paramenti gli venivano levati sinoa che rimase in quella vesticciola che a Firenze chiamano cioppa.;sg;_;_;succession/iteration/distributivity;modifier
goccia a goccia;yes;a;goccia;dire;Senza un ordine preciso, ma, come si dice,;goccia a goccia;, mi giungevano, nell'angosciosa notte successiva alla sua morte i ricordi di quelle impressioni della vita familiare che avevo colto allora.;sg;_;_;succession/iteration/distributivity;modifier
gomito a gomito;yes;a;gomito;sera;Lorenzo, nella sua ingenuità, si era immaginato una vita meravigliosa - di giorno a costruire mattoni, e la sera;gomito a gomito;con i Beatles e a passeggiare a braccetto con Jean Shrimpton o Marianne Faithfull per Carnaby Street.;sg;_;_;juxtaposition/contact;modifier
prodotto a prodotto;no;a;prodotto;da;Un'analisi di questo tipo non poteva prescindere dal software fornito in bundle, variabile da;_;_;_;_;_;_;_
tedeschi a tedeschi;no;a;tedeschi;di;Un comando particolare, straniero, il comando del nemico, donde «Diktat», aveva vietato l'atteggiamento imperioso del comando militare di;_;_;_;_;_;_;_
luogo a luogo;no;a;luogo;da;Lo sviluppo non procede infatti secondo un modello unico ma segue piuttosto traiettorie e modelli diversi da;_;_;_;_;_;_;_
palmo a palmo;yes;a;palmo;ripassare;Se già non lo si è fatto sarebbe bene ripassare;palmo a palmo;i bordi misti e le aiuole per ripulire il terreno dai cespi marcescenti o secchi.;sg;_;_;succession/iteration/distributivity;modifier
goccia a goccia;yes;a;goccia;scorrere;Nel braccio di Bruno è conficcato l'ago e lungo il flessibile scorre;goccia a goccia;la medicina che per il momento regala al suo volto un'aria distesa e l'ombra di un sorriso.;sg;_;_;succession/iteration/distributivity;modifier
uomini su uomini;no;su;uomo;di;Quindi, anche nel fumetto Bonelli, come in Berserk, ci sono scene di violenza sessuale verso i protagonisti minorenni, o di violenza sessuale di;uomini su uomini;"(le ho elencate entrambe perchè non sapevo cosa consideravi più ""forte"" nella scena di Berserk).";pl;thematic_target;no;distractor;_
5 su 5;no;su;5;inanellare;A detta di Alberto Artiglia che ne ha inanellati;5 su 5;(l' unico oltre al sottoscritto), il migliore vitto lo abbiamo avuto qui.;X;NumPNum;no;distractor;_
corsi su corsi;yes;su;corso;fare;Ultimamente, siccome si dice che questi ragazzi e queste ragazze non imparano niente, allora si fanno;corsi su corsi;per vedere come avvicinarsi, quindi per curare la relazione, però sempre in un modo strumentale, come mezzo per arrivare al RAZIONALE.;pl;_;_;greater_plurality/accumulation;nominal
sport a sport;no;a;sport;da;A prescindere dalle condizioni diverse da;_;_;_;_;_;_;_
dolori su dolori;yes;su;dolore;e;E dietro a quello, molti altri ricordi rossi, indicibili, segreti, sepolti da anni di uso di mondo, errori, matrimoni, figlie, partenze, musica, abbandoni, gioielli, amanti, dolori, e;dolori su dolori;su dolori per mimetizzare il padre di tutti i dolori.;pl;_;_;greater_plurality/accumulation;nominal
grado a grado;no;a;grado;a;Si infila nelle case e, con quella storia che la malattia si guarisce a;_;_;_;_;_;_;_
strato su strato;yes;su;strato;cipolla;A sua volta, il pensiero si divide, come dire, anche da se stesso, in accumulo, foglio sopra foglio, azione dopo ricordo, riflessione sopra decisione, lasciandomi come una grande cipolla,;strato su strato;, nel cui cuore profondo risuonano, lancinanti e abissali, le parole del Grande Matthys, il Dio Fornaio.;sg;_;_;succession/iteration/distributivity;modifier
Apple su Apple;no;su;Apple;di;Anche Noi di Zoleounge.it stiamo promuovendo il Back Friday di Apple e se siete in procinto di acquistare con gli sconti del BlackFriday 2010 di;Apple su Apple;Italia, iTunes Store o su App Store e volete aiutare Zoelounge.it senza peraltro spendere una lira in più, potreste prendere in considerazione l'idea di cliccare su uno dei banner presenti in questa pagina o nei banner presenti nella sidebar.;X;proper_name_inglobation;no;distractor;_
palla su palla;yes;su;palla;battere;Noi abbiamo solo l'obbligo di giocare per vincere, di batterci;palla su palla;coi campioni olimpici.;sg;_;_;succession/iteration/distributivity;modifier
100 su 100;no;su;100;di;Delle 20 regioni prese in esame da un gruppo di esperti in comunicazione, sociologia, diritti del cittadino, il portale della Regione Emilia-Romagna risulta primo classificato con un risultato di;100 su 100;per quanto riguarda il rapporto amministrazione-cittadini, davanti a Veneto (89/100) e Liguria (80/100).;X;NumPNum;no;distractor;_
donne su donne;no;su;donna;ponderare;"La vedo più come una presa di posizione forte, anche piuttosto ponderata; il fatto che nel filmato ci sia principalmente violenza di";donne su donne;ha abilmente evitato che eventuali polemiche di genere potessero sviare dalla violenza come concetto assoluto.;pl;thematic_target;no;distractor;_
Pippo su Pippo;no;su;Pippo;su;La spesa per la riparazione, ammontante a venti euro, da ripartirsi tra tutti i condomini, graverà: su Martino su;Pippo su Pippo;e Martino in parti uguali per un terzo su Martino e per due terzi su Pippo.;X;N_extended;no;distractor;_
gomito a gomito;yes;a;gomito;lavorare;A metà della scala si potrebbero porre invece quelle che mostrano artisti e scienziati lavorare;gomito a gomito;, producendo conoscenze o rappresentazioni reciprocamente utili, come accadeva per esempio agli incisori che si affiancarono ad anatomisti e astronomi da cui dipendono le due grandi rivoluzioni scientifiche della modernità.;sg;_;_;juxtaposition/contact;modifier
km su km;no;su;km;poi;e non può che migliorare col tempo, poi;km su km;giù porto pazienza.;sg/pl;NsuNgiù;yes;distractor;_
zero a zero;no;a;zero;sul;Il risultato non si sbloccava e si era sempre sullo;_;_;_;_;_;_;_
Roma su Roma;no;su;Roma;da;E se io mando un messaggio da;Roma su Roma;dovrei essere tutelato dalle leggi italiane, rispetto alle intenzioni piratesche delle aziende Usa.;X;thematic_target;no;distractor;_
comune a comune;no;a;comune;da;Limitare gli spostamenti, anche da;_;_;_;_;_;_;_
porte su porte;yes;su;porta;dove;Non trattare il proprio spazio di comunicazione come una reggia dove;porte su porte;si aprono ai diversi poteri politici facendo divenire opinionisti soubrette e strateghi di approfondimento e portaborse esperti di moduli 740.;pl;_;_;greater_plurality/accumulation;nominal
punto a punto;no;a;punto;da;Il confronto del dato sperimentale con quello calcolato consente di tracciare mappe di variazione da;_;_;_;_;_;_;_
sasso su sasso;no;su;sasso;di;Il signor Sandro scuote la testa, si infila le mani in tasca e si piega a guardare la pietra, il disegno fatto a colpi di;sasso su sasso;, poi i piedi, le mani, gli occhi tondi lassù che rispondono allo sguardo.;sg;thematic_target;no;distractor;_
7 su 7;no;su;7;con;Lo fa in modo incontestabile: chiude con;7 su 7;dai 6.25 mt per un totale di 29 punti, il tutto in sola metà gara.;X;NumPNum;no;distractor;_
gomito a gomito;yes;a;gomito;silenzio;Mi insegnò a lavorare coi ferri e stavamo lunghe ore in silenzio,;gomito a gomito;, su quelle sedie della cucina che mi dimenticavo di far impagliare.;sg;_;_;juxtaposition/contact;modifier
poro a poro;yes;a;poro;leccare;L'avrei presa invece a lei la sbrodolona e rivoltata proprio dall'interno per poi estrarle tutto quell'olio e leccarlo;poro a poro;tutto quell'olio sbrodolone…;sg;_;_;succession/iteration/distributivity;modifier
dichiarazioni su dichiarazioni;yes;su;dichiarazione;riunione;Da dieci giorni stiamo dicendo in tutte le sedi che bisognava intervenire: si è perduto tempo a discutere, a prendere contatti diplomatici, a fare riunioni su riunioni,;dichiarazioni su dichiarazioni;, mentre la tragedia albanese richiedeva interventi rapidi, decisi, organici, massicci.;pl;_;_;greater_plurality/accumulation;nominal
invenzioni su invenzioni;yes;su;invenzione;strologare;Non riuscendo a distillare più un solo rimasuglio di verso dalla testa burchiellata dall'intossicazione alcolica perenne, si fece erudito, strologando;invenzioni su invenzioni;di autori che conosceva solo per sentito dire, e soprattutto saccheggiando il Baretti, lui sì iniziatore della storia letteraria italiana, e come tale ignoto ai più.;pl;_;_;greater_plurality/accumulation;nominal
spalla a spalla;no;a;spalla;a;Nessuno osava spingersi avanti da solo, piuttosto qualcuno, nel serrare a;_;_;_;_;_;_;_
palloni su palloni;yes;su;pallone;respingere;Con la palla a terra è un pericolo per i suoi, con la capoccia, che ricorda uno spillo, respinge;palloni su palloni;.;pl;_;_;greater_plurality/accumulation;nominal
gomito a gomito;yes;a;gomito;trovare;Ogni volta che il livello del fiume si abbassa e tutti gli alligatori si affollano nei punti più profondi, i rettili si trovano;gomito a gomito;e si mangiano allegramente tra loro.;sg;_;_;juxtaposition/contact;modifier
porta a porta;yes;a;porta;differenziato;Al via la raccolta differenziata a Molini, Girola e Valtenna Mercoledì 18 dicembre inizia il nuovo servizio di raccolta differenziata -;porta a porta;nei quartieri Molini, Girola e Valtenna.;sg;_;_;succession/iteration/distributivity;modifier
luogo a luogo;no;a;luogo;da;Lo spessore dei ghiacci, misurato con metodi geofisici, varia notevolmente da;_;_;_;_;_;_;_
Roma su Roma;no;su;Roma;spostare;Equiparata ai docenti che si spostano;Roma su Roma;come sembra dall' articolo 25 del contratto nazionale di mobilità? ;X;thematic_target;no;distractor;_
porta a porta;yes;a;porta;venditore;La brochure patinata del venditore;porta a porta;mostrava campi da golf verdissimi e piscine, ma tutto quello che il bambino vede è terra da cimitero e qualche lattina arrugginita.;sg;_;_;succession/iteration/distributivity;modifier
strato su strato;yes;su;strato;formare;La storia poco nota di questa parte di Roma è di straordinario interesse e basterebbe quasi, da sola, a illustrare attraverso quali peripezie militari e religiose si sia venuta formando,;strato su strato;, la città attuale.;sg;_;_;succession/iteration/distributivity;modifier
gomito a gomito;yes;a;gomito;giorno;Will (e credo, segretamente, anche Ben) ha sempre invidiato il mio lavoro e il fatto che mi costringa a stare quasi ogni giorno;gomito a gomito;con decine di modelle tutte stupende!;sg;_;_;juxtaposition/contact;modifier
