NPN;construction;preposition;noun;pre_lemma;context_pre;costr;context_post;number_of_noun;Type;other_cxn;meaning;syntactic_function
energia su energia;no;su;energia;di;Tradotto in italiano è il ritorno di;energia su energia;"investita; è un rapporto tra due valori numerici espressi in kWh.";sg;N_extended;no;distractor;_
volta a volta;no;a;volta;a;Si presentò ai giovani lettori con una bella promessa: Questo vostro foglio, a;volta a volta;mattacchione, sereno, sentimentale e utile sempre, intende d'ora in poi giovare al vostro spirito senza essere punto noioso.;sg;PNPN;yes;distractor;_
100 su 100;no;su;100;massimo;Il punteggio minimo ottenuto dai nostri studenti è di 28,57, contro quello ottenuto dall' Emilia Romagna di 0,0 e dal Nord Est di 14,29, mentre è allineato il punteggio massimo:;100 su 100;.;X;NumPNum;no;distractor;_
confusione a confusione;no;a;confusione;aggiungere;È un momento storico, aggiunge la nota, «che esige di non disperdere il voto, per non aggiungere;confusione a confusione;».;sg;verbal;yes;distractor;_
4 su 4;no;su;4;provincia;La regione meno virtuosa è risultata la Sardegna, dove il 100% delle province (;4 su 4;) supera i 60 giorni d' attesa (con Oristano e Cagliari in grado di fornire la prestazione non prima di 4 mesi).;X;NumPNum;no;distractor;_
uomo su uomo;no;su;uomo;di;cioè quando si abolirà non solo il concetto di proprieta' di uomo su uomo (schiavitu') ma anche quello di SERVITU' di;uomo su uomo;(noleggio, prostituzione, o come chiamo io, SERVIZIONE).;sg;thematic_target;no;distractor;_
sassolino su sassolino;yes;su;sassolino;goccia;Nei giorni a venire e nelle notti illuni e nelle notti quando una luna fulgidissima splendeva sopra la terra, il vecchio avrebbe continuato a parlargli, a parlargli, goccia a goccia,;sassolino su sassolino;, petalo dopo petalo.;sg;_;_;succession/iteration/distributivity;modifier
strada su strada;no;su;strada;di;In tal modo l'aquaplaning viene scongiurato e la tenuta di;strada su strada;bagnata e innevata è ottimale.;sg;N_extended;no;distractor;_
settimana a settimana;yes;a;settimana;qualità;Se tu non dai la qualità;settimana a settimana;, purtroppo queste grandi piattaforme, con tutto il rispetto perché è un mercato, ti trattano non come un dipendente a tempo indeterminato ma come un contratto a ore.;sg;_;_;succession/iteration/distributivity;modifier
9 su 9;no;su;9;Milano;A Lecco si è registrato una adesione del 100 per cento (hanno scioperato 19 su 19) così come al tribunale di sorveglianza di Milano (;9 su 9;).;X;NumPNum;no;distractor;_
interessi su interessi;no;su;interesse;mio;Io che sono fiorentina, forse avrei qualche motivo in più per pensarlo, ma preferisco spostare i miei;interessi su interessi;"più ""puliti"" perchè il calcio sicuramente non lo è.";sg;N_extended;no;;_
porta a porta;yes;a;porta;distribuzione;"Si tratta di vendere questi prodotti attraverso il multilevel marketing, la cosiddetta distribuzione """;porta a porta;""" che funziona attraverso un efficace passa - parola e che permette di guadagnare anche su ogni persona che si riesce a reclutare.";sg;_;_;succession/iteration/distributivity;modifier
bocca a bocca;yes;a;bocca;respirazione;Sembrava che ci fosse poco da fare per la piccola Jihan: «Il camionista ha portato dell'acqua per lavarla dal sangue, e io ho provato a farle la respirazione;bocca a bocca;».;sg;_;_;juxtaposition/contact;modifier
palmo a palmo;yes;a;palmo;battere;Lui, quando ancora Bossi studiava alla Scuola Radio Elettra, batteva;palmo a palmo;le province di Verona, Vicenza e Treviso per diffondere il verbo della Serenissima.;sg;_;_;succession/iteration/distributivity;modifier
aborti su aborti;yes;su;aborto;subire;Ma il destino doveva volergliene personalmente per qualche imperdonabile colpa: Salma, sua moglie, subì;aborti su aborti;e morì mettendo al mondo Mouna dopo dieci mesi di penosa gravidanza.;pl;_;_;greater_plurality/accumulation;nominal
palmo a palmo;yes;a;palmo;scrutare;E invece la sua macchina, accompagnata dai rintocchi della campana di Montecitorio, è arrivata puntualissima sul piazzale della Camera, scrutato;palmo a palmo;dai tiratori scelti appostati sui tetti.;sg;_;_;succession/iteration/distributivity;modifier
libri su libri;yes;su;libro;leggere;Non posso non esserle riconoscente per avermi costretta a leggere;libri su libri;che raccontano di san Francesco, dei papi che si sono succeduti in quegli anni, dell'alto Medioevo, della letteratura in lingua d'oc e d'oil, per avermi costretta a documentarmi sulla storia dei conventi e sulla vita monacale.;pl;_;_;greater_plurality/accumulation;nominal
specie a specie;no;a;specie;da;Essa serve ad umidificare il terreno secondo le esigenze delle piante che variano da;specie a specie;per evitare che le radici manchino di un adeguato rifornimento idrico necessario per la crescita.;sg;PNPN;yes;distractor;_
Pippo su Pippo;no;su;Pippo;su;La spesa per la riparazione, ammontante a venti euro, da ripartirsi tra tutti i condomini, graverà: su Martino su;Pippo su Pippo;e Martino in parti uguali per un terzo su Martino e per due terzi su Pippo.;X;N_extended;no;distractor;_
palmo a palmo;yes;a;palmo;esplorare;Gli sarebbero occorsi mesi per rilevarne il tracciato e per esplorarle;palmo a palmo;.;sg;_;_;succession/iteration/distributivity;modifier
strato su strato;yes;su;strato;che;Ad un certo punto incontrarono una fontana ghiacciata che,;strato su strato;", aveva formato una specie di scultura che sembrava la sagoma di un animale; ma a dire il vero bastava girarsi intorno per riconoscere nel paesaggio mille immagini diverse disegnate dalla galaverna.";sg;_;_;succession/iteration/distributivity;modifier
punto a punto;no;a;punto;da;I nuovi sistemi di trasmissione a distanza si differenziano dai precedenti - telegrafo e telefono - perché non costituiscono un legame da;punto a punto;.;sg;PNPN;yes;distractor;_
specie a specie;no;a;specie;da;Per esempio, se siete contrari per i motivi più disparati, anche religiosi, a un trasferimento di geni da;specie a specie;, ora sapete che dovete distinguere tra OGM e OGM.;sg;PNPN;yes;distractor;_
saponi su saponi;yes;su;sapone;svanire;Mi lavo e mi rilavo, svaniscono;saponi su saponi;, asciugamani e salviette si impregnano d'acqua.;pl;_;_;greater_plurality/accumulation;nominal
valle a valle;no;a;valle;da;Nei rastrellamenti dell'estate 1944 dovemmo spostare da;valle a valle;i nuovi arrivati dalla pianura che non potevamo armare.;sg;PNPN;yes;distractor;_
uomini su uomini;no;su;uomo;di;C'è anche la violenza di;uomini su uomini;, donne contro le donne, adulti su bambini, giovani contro anziani e via di questo passo.;pl;thematic_target;no;distractor;_
bocca a bocca;yes;a;bocca;respirazione;"Per oltre 15 minuti ha tenuto in vita un amico intrappolato sott'acqua soffiandogli aria nei polmoni con ripetute immersioni e altrettante ""respirazioni";bocca a bocca;""".";sg;_;_;juxtaposition/contact;modifier
nodi su nodi;yes;su;nodo;intrecciare;Sembra vedere e sentire il ritmo di questa fatica: trovare lo strappo, ridurlo, intrecciare;nodi su nodi;, riparare finalmente la rete.;pl;_;_;greater_plurality/accumulation;nominal
punto a punto;no;a;punto;da;Stanno, invece, in un continuum dove tutte le interazioni si propagano da;punto a punto;.;sg;PNPN;yes;distractor;_
donna a donna;no;a;donna;da;Se mi fossi presentata nella maniera giusta, ho pensato, se le avessi parlato da;donna a donna;, lei avrebbe capito.;sg;PNPN;yes;distractor;_
colpo su colpo;yes;su;colpo;ribattere;All'Arechi gli uomini di Beretta hanno dovuto fare i conti con una Salernitana mai doma, pronta a ribattere;colpo su colpo;agli affondi dei più blasonati avversari.;sg;_;_;succession/iteration/distributivity;modifier
 Vichy su Vichy;no;su;Vichy;repubblica;Citazione: si esattamente erano collaborazionisti esattamente come tutta la repubblica;Vichy su Vichy;non ci piove, ma sulle SS permettimi di dissentire per due motivi: - arruolamento volontario - giuramento di fedeltà al fuhrer e allla causa nazional-socialista - iniziazione mistica.;X;N_extended;no;distractor;_
piazza a piazza;no;a;piazza;da;E invece il nostro settore è diventato un far west: regole diverse da;piazza a piazza;, regole che - beninteso - nessuno rispetta, e nessuno sceriffo a fare giustizia.;sg;PNPN;yes;distractor;_
3 su 3;no;su;3;bene;Premetto che la scart è una 21 poli e ne ho provate ben;3 su 3;"televisori diversi, ma nulla da fare; pare che dalla scart del dvd non esca il seganle video ... cosa posso fare?";X;NumPNum;no;distractor;_
bocca a bocca;yes;a;bocca;respirazione;Di più, provano a rianimare i due amici: massaggio cardiaco, respirazione;bocca a bocca;.;sg;_;_;juxtaposition/contact;modifier
palmo a palmo;yes;a;palmo;frugare;I tre si sparpagliarono e cominciarono a frugare;palmo a palmo;il terreno.;sg;_;_;succession/iteration/distributivity;modifier
Italia su Italia;no;su;Italia;in;"Una curiosità: Sandra Vidal ha partecipato alla versione americana del programma "" Popstars "", trasmesso anche in";Italia su Italia;1.;X;proper_name_inglobation;no;distractor;_
prove su prove;yes;su;prova;portare;D'altronde da qualche anno l'attivista Jeff Ballinger, fondatore del gruppo Press for Change, porta;prove su prove;circa le scandalose differenze fra le remunerazioni dei lavoratori indonesiani della catena Nike (poco più di un dollaro al giorno) e quelle dei campioni della pubblicità a cui la multinazionale affida la propria immagine.;pl;_;_;greater_plurality/accumulation;nominal
mani su mani;no;su;mano;fare;Anche il testo della canzone era stato scritto per essere abbastanza esplicativo e per mostrare cosa si sarebbe dovuto fare (;mani su mani;giù mani dove vuoi) ma l'immagine dei Ricchi & Poveri non era tale da poter imporre un ballo inventato di sana pianta anche perché non c'era più la moda di inventarne di nuovi per il tramite di una canzone lanciata appositamente.;pl;NsuNgiù;yes;distractor;_
gruppo a gruppo;no;a;gruppo;da;Janette Wenrick Boughman, zoologa dell'Università del Maryland, ha esaminato la struttura di questi versi e ha scoperto che i richiami differiscono da;gruppo a gruppo;, ma all'interno di ciascuno di essi sono riprodotti con grande fedeltà da ogni singolo componente.;sg;PNPN;yes;distractor;_
prove su prove;yes;su;prova;a;Tutte abusive sono le donne nel mondo dei maschi: senza passaporto né carta di identità, si fanno passare per quello che non sono, si sottopongono a;prove su prove;, pur di resistere, di non essere cacciate.;pl;_;_;greater_plurality/accumulation;nominal
palmo a palmo;yes;a;palmo;osservare;Tutte le auto vengono osservate;palmo a palmo;, illuminate da fortissime luci bianche.;sg;_;_;succession/iteration/distributivity;modifier
fabbriche su fabbriche;yes;su;fabbrica;ambrosiano;Qui aveva qualche amico in Scaldasole e al circolo del Ponte della Ghisolfa, piazzale Lugano, il grigio più grigio della periferia ambrosiana,;fabbriche su fabbriche;, l'inizio della sopraelevata, il cavalcavia delle Varesine.;pl;_;_;greater_plurality/accumulation;nominal
fibra a fibra;yes;a;fibra;via;La sua voce si impoveriva man mano che andava avanti, come se le sue parole si portassero via;fibra a fibra;il tessuto del suo timbro.;sg;_;_;succession/iteration/distributivity;modifier
6 su 6;no;su;6;contenere;Osimo ha totalizzato 10 su 10 per quel che concerne i contenuti,;6 su 6;per la programmazione, 6 su 7 per l' originalità e 6 su 7 per la grafica.;X;NumPNum;no;distractor;_
Fede su Fede;no;su;Fede;di;La Dottrina della Chiesa, la Nota della Congregazione per la Dottrina della;Fede su Fede;e Politica, l' introduzione a questa di ... ;sg;proper_name_inglobation;no;distractor;_
uomo a uomo;no;a;uomo;da;Essi non possono più guardare negli occhi un altro, da;uomo a uomo;"; possono invece infondere in un altro la forza di divenire ""più"" di loro.";sg;PNPN;yes;distractor;_
storie su storie;yes;su;storia;intrecciare;Ma si capirà anche che Amado era tutt'altro che un narratore naif, capace com'era di utilizzare una vasta tavolozza di tecniche e di intrecciare;storie su storie;in complicate architetture.;pl;_;_;greater_plurality/accumulation;nominal
sangue su sangue;yes;su;sangue;disperato;Hanno gioito o si sono disperati,;sangue su sangue;.;sg;_;_;succession/iteration/distributivity;modifier
6 su 6;no;su;6;essere;No perchè 7 su 9 di jones non è che succede sempre, considerando anche il fatto che fino ad un certo punto era;6 su 6;.;X;NumPNum;no;distractor;_
porta a porta;yes;a;porta;raccogliere;Entro fine anno il vetro si raccoglierà;porta a porta;.;sg;_;_;succession/iteration/distributivity;modifier
fili su fili;yes;su;fili;potenzialità;"O meglio c'era una che un giorno ""avrebbe potuto"" essere lei: se da un lato obbediva alla vocazione, se svolgeva le potenzialità,";fili su fili;.;pl;_;_;greater_plurality/accumulation;nominal
palmo a palmo;yes;a;palmo;accanitamente;"La tensione del Franco Cacciatore viene condotta al diapason, allorché l'agens deve unirsi alla ""generale Caccia"" alla Bestia, e batte accanitamente,";palmo a palmo;, l'intrico della macchia.;sg;_;_;succession/iteration/distributivity;modifier
caraffe su caraffe;yes;su;caraffa;ordinare;Harry trangugiava un bicchiere fresco dopo l'altro, ordinando;caraffe su caraffe;, convinto che sapessero tutte di alcol da massaggi.;pl;_;_;greater_plurality/accumulation;nominal
palmo a palmo;yes;a;palmo;Gargano;Ovviamente non possiamo battere quella parte del Gargano;palmo a palmo;.;sg;_;_;succession/iteration/distributivity;modifier
rovine su rovine;yes;su;rovina;tregua;Dove ci appare una catena di eventi, egli vede una sola catastrofe che accumula senza tregua;rovine su rovine;e le rovescia ai suoi piedi.;pl;_;_;greater_plurality/accumulation;nominal
bar a bar;no;a;bar;da;La cifra complessiva cambiava da;bar a bar;, ma erano tutti d'accordo che i ricorrenti avessero ottenuto circa cinque milioni di dollari.;sg;PNPN;yes;distractor;_
elaboratore a elaboratore;no;a;elaboratore;da;Le regole del protocollo TCP IP consentono il trasferimento di pacchetti di dati da;elaboratore a elaboratore;.;sg;PNPN;yes;distractor;_
bocca a bocca;yes;a;bocca;dove;La rinuncia alla propria individualità è celebrata in Breathing In POTH Breathing Out (sempre del 1977) dove,;bocca a bocca;e con le narici chiuse da filtri di sigaretta, l'una respira nella bocca dell'altro, in una rappresentazione tragica di cosa succede quando si dipende completamente da un'altra persona.;sg;_;_;juxtaposition/contact;modifier
specie a specie;no;a;specie;da;Il periodo di gestazione varia da;specie a specie;, da 3 o 4 settimane per i più piccoli roditori fino a 21 mesi per l'elefante.;sg;PNPN;yes;distractor;_
bocca a bocca;yes;a;bocca;respirazione;Se l'infortunato presenta delle fratture alla mandibola o alla mascella, si può procedere come nelcaso della respirazione;bocca a bocca;con la differenza che la bocca viene tenuta chiusa per evitare che fuoriesca l'aria insufflata, e le insufflazioni vanno fatte attraverso il naso.;sg;_;_;juxtaposition/contact;modifier
colpo su colpo;yes;su;colpo;rispondere;Più adulto e più esperto di lui, era sempre riuscito a tenergli testa, a rispondere;colpo su colpo;o addirittura a prevenire le sue mosse.;sg;_;_;succession/iteration/distributivity;modifier
lettere su lettere;yes;su;lettera;scrivere;Ma rari sono gli spiragli che si aprono per l'ex bracciante, facchino, portiere di notte, militante dell'Autonomia Operaia negli anni di piombo che, per sfogarsi dei rifiuti, scrive;lettere su lettere;.;pl;_;_;greater_plurality/accumulation;nominal
seta su seta;no;su;seta;in;Inizia così una ricca produzione di arazzi ricamati in;seta su seta;o in lana si juta o su tela.;sg;thematic_target;no;distractor;_
creme su creme;yes;su;crema;su;Altro errore frequentissimo: applicare creme su;creme su creme;sulla cute del viso irritata, arrossata, sensibilizzata.;pl;_;_;greater_plurality/accumulation;nominal
porta a porta;yes;a;porta;distribuzione;Poi i certificati verranno consegnati ai vigili che incominceranno la distribuzione;porta a porta;.;sg;_;_;succession/iteration/distributivity;modifier
bocca a bocca;yes;a;bocca;attaccare;La madre era sparita dietro le spalle larghe dello sconosciuto, i due stavano attaccati;bocca a bocca;e si stringevano forte.;sg;_;_;juxtaposition/contact;modifier
5 su 5;no;su;5;destra;A questo punto anche un Cda tutto di destra (;5 su 5;) andrebbe in crisi;X;NumPNum;no;distractor;_
tragedia a tragedia;no;a;tragedia;dolore;Non aggiungete dolore a dolore,;tragedia a tragedia;…;sg;verbal;yes;distractor;_
soldi su soldi;yes;su;soldi;individuo;"Si tratta di un accidente della natura, in certi individui; una volta che si è iniziato, non c'è modo di fermarsi,";soldi su soldi;.;pl;_;_;greater_plurality/accumulation;nominal
DVD su DVD;no;su;DVD;in;Se vuoi masterizzare un film in;DVD su DVD;+ R DL, ti conviene usare Alcohol o DVD Decrypter (in ISO mode).;sg/pl;thematic_target;no;distractor;_
piano su piano;yes;su;piano;edificio;Vuotò il bicchiere, chiuse gli occhi assaporando la squisitezza, annuì, e si alzò, un livello dopo l'altro, splendido edificio,;piano su piano;.;sg;_;_;succession/iteration/distributivity;modifier
punto a punto;no;a;punto;da;Il computer può trattare frasi che arrivino a un massimo di 1500 caratteri da;punto a punto;.;sg;PNPN;yes;distractor;_
Berlusconi su Berlusconi;no;su;Berlusconi;di;Va bene bene pubblicare in prima pagina una barzelletta di;Berlusconi su Berlusconi;, ma vi sia perlomeno il buon senso di dire al titolista di non mettere come titolo LA BATTUTA finale...;X;thematic_target;no;distractor;_
bocca a bocca;yes;a;bocca;contatto;In questo modo il soccorritore può ventilare l'infortunato evitando il contatto;bocca a bocca;.;sg;_;_;juxtaposition/contact;modifier
cellule a cellule;no;a;cellule;questo;Se un antigene viene presentato dalle cellule specializzate nel presentare l'antigene, determina anche l'attivazione linfocitaria e la differenziazione di queste;cellule a cellule;effettrici.;sg;N_extended;no;distractor;_
bocca a bocca;yes;a;bocca;respirazione;Intanto io gli facevo la respirazione;bocca a bocca;e il massaggio cardiaco, gli cambiavo il pigiama sporco, lo tenevo su per la testa.;sg;_;_;juxtaposition/contact;modifier
satellite su satellite;no;su;satellite;via;Accesso ad alta velocità al Backbone Internet Europeo e connettività a banda larga, utilizzando tecnologia satellitare bidirezionale mediante canale di comunicazione bidirezionale via;satellite su satellite;geostazionario opportunamente posizionato, e connessione via fibra al Backbone Internet Europeo, con relativa manutenzione ed assistenza tecnica.;sg;N_extended;no;distractor;_
permessi su permessi;yes;su;permesso;necessario;Il secondo problema è quello del rispetto delle norme: per gestire correttamente una discoteca sarebbero necessari;permessi su permessi;, certificati su certificati.;pl;_;_;greater_plurality/accumulation;nominal
colpo su colpo;yes;su;colpo;attacco;Ma Rambo non ci sta, Rambo combatte, lui resta in forma e risponde all'attacco;colpo su colpo;, prendendo la natura a calci nel culo e spaccando il muso alla società.;sg;_;_;succession/iteration/distributivity;modifier
donna a donna;no;a;donna;da;L'intensità del dolore in questa fase varia molto da;donna a donna;.;sg;PNPN;yes;distractor;_
bocca a bocca;yes;a;bocca;respirazione;È stato qualche anno fa e ricordo ogni minimo dettaglio: lui disteso per terra, attraverso la portiera schiacciata stava facendo la respirazione;bocca a bocca;a una donna che aveva perso conoscenza.;sg;_;_;juxtaposition/contact;modifier
donna a donna;no;a;donna;da;Ma se vuole un consiglio da;donna a donna;non lo farei.;sg;PNPN;yes;distractor;_
porta a porta;yes;a;porta;polivitaminico;Così, cominciò a vendere polivitaminici;porta a porta;.;sg;_;_;succession/iteration/distributivity;modifier
punto a punto;no;a;punto;da;Il confronto del dato sperimentale con quello calcolato consente di tracciare mappe di variazione da;punto a punto;.;sg;PNPN;yes;distractor;_
4 su 4;no;su;4;estivo;Risultato, al ritorno dopo l' operazione estiva,;4 su 4;da dove conta tre.;X;NumPNum;no;distractor;_
10 su 10;no;su;10;se;Vorrei che ogni italiano, o almeno 8 su 10 sappiano cosa sia la Milano Sanremo, se;10 su 10;sanno cosa è il Giro.;X;NumPNum;no;distractor;_
comparto a comparto;no;a;comparto;da;Ciò però in un contesto che si presenta molto differenziato da;comparto a comparto;e all'interno di ciascuno di essi.;sg;PNPN;yes;distractor;_
volta a volta;no;a;volta;a;Insomma, da buon notaio, era come se protocollasse diverse deposizioni, testimonianze o confessioni da fornire poi agli avvocati per difendere cause a;volta a volta;diverse - talché aveva iniziato a designare questi suoi appunti come i Protocolli - e si guardava bene di mostrare tutto a padre Bergamaschi, perché per lui filtrava solo i testi di carattere più spiccatamente religioso.;sg;PNPN;yes;distractor;_
palmo a palmo;yes;a;palmo;mano;"Dice l'iscrizione ""che esse congiungono le mani";palmo a palmo;""", allegorica immagine che descrive il passaggio da un segno zodiacale a quello precedente, passaggio che avviene nell'equinozio di primavera ogni 2160 anni.";sg;_;_;succession/iteration/distributivity;modifier
palmo a palmo;yes;a;palmo;ispezionare;Tutta l'area è stata immediatamente interdetta e i carabinieri la stanno ispezionando;palmo a palmo;alla ricerca di altri indizi utili all'indagine.;sg;_;_;succession/iteration/distributivity;modifier
Parole su parole;yes;su;parola;un;ose fondamentali per la formazione del pensiero degli studenti suoi coetanei .  Parole su parole , in_forma_di versi , di articoli , di canzoni perché Evtuscenko sapeva che un;Parole su parole;, in forma di versi, di articoli, di canzoni perché Evtuscenko sapeva che un vecchio proverbio russo era sacrosanta verità: «Ciò che è stato scritto con la penna non si può rimuovere con un'accetta». ;pl;_;_;greater_plurality/accumulation;nominal
permessi su permessi;yes;su;permesso;senza;Chi dieci anni fa, a casa sua, ha piantato un filare di platani troppo vicini, non li può diradare senza;permessi su permessi;.;pl;_;_;greater_plurality/accumulation;nominal
luogo a luogo;no;a;luogo;da;Le leggi al riguardo variano da;luogo a luogo;.;sg;PNPN;yes;distractor;_
donne su donne;no;su;donna;ponderare;"La vedo più come una presa di posizione forte, anche piuttosto ponderata; il fatto che nel filmato ci sia principalmente violenza di";donne su donne;ha abilmente evitato che eventuali polemiche di genere potessero sviare dalla violenza come concetto assoluto.;pl;thematic_target;no;distractor;_
campo a campo;no;a;campo;da;Per muovere il punto di inserzione da;campo a campo;, premere il tasto [tab] o selezionare con il mouse la casella desiderata.;sg;PNPN;yes;distractor;_
54 su 54;no;su;54;disponibile;La formazione pugliese è, assieme al Torino, la squadra che ha usufruito fino a questo momento di tutti i cambi disponibili;54 su 54;.;X;NumPNum;no;distractor;_
lettere su lettere;yes;su;lettera;scrivere;Ciò nonostante, padre Villaverde non esitò a scrivere;lettere su lettere;ai suoi superiori, sostenendo di essere stato aggredito senza motivo e chiedendo che questo accolito di Satana fosse radiato dalla Chiesa.;pl;_;_;greater_plurality/accumulation;nominal
guancia a guancia;yes;a;guancia;che;Primo piano dei due volti - quello scuro di mio figlio e quello chiarissimo di Hans - che,;guancia a guancia;, ridono felici.;sg;_;_;juxtaposition/contact;modifier
prove su prove;yes;su;prova;esperimento;Niente di peggio per cominciare un'altra settimana di esperimenti,;prove su prove;, verifiche e analisi di tutto ciò che non aveva funzionato come avrebbe dovuto.;pl;_;_;greater_plurality/accumulation;nominal
donna a donna;no;a;donna;aggiungere;Vai ora, non stare a perdere tempo, aggiungi;donna a donna;, e non metterti a contare.;sg;verbal;yes;distractor;_
bambini su bambini;no;su;bambino;di;Come impone la legge, nei casi di espianti di;bambini su bambini;di età inferiore a 5 anni, prima di procedere si sono dovute attendere le 24 ore richieste.;pl;N_extended;no;distractor;_
ferro su ferro;no;su;ferro;di;Il valore del coefficiente di a. volvente del;ferro su ferro;"è per es. 0,005; quello radente, 0,21; l' a. volvente della gomma su strada, 0,02; quello radente, 0,07.";sg;N_extended;no;distractor;_
4 su 4;no;su;4;libero;Raccoglie punti solamente nei tiri liberi (;4 su 4;) perché la soluzione dalla distanza sembra non baciarlo più, anche in gare facili come questa: su 4 da tre.;X;NumPNum;no;distractor;_
ASCO su ASCO;no;su;ASCO;di;Ulteriori informazioni Per ulteriori informazioni, vedi il meeting virtuale di;ASCO su ASCO;OnLine (www.asco.org), che contiene tutti gli abstract degli studi presentati alla conferenza.;X;proper_name_inglobation;no;distractor;_
colpo su colpo;yes;su;colpo;rintuzzare;Ma Giuseppe Stefanel, Bepi per gli amici, 44 anni, presidente e amministratore del gruppo di Ponte di Piave, non ci sta a passare per vittima sacrificale: rintuzza;colpo su colpo;gli attacchi, e annuncia che il secondo semestre '96 si chiuderà con un piccolo utile, dopo che al giro di boa dei primi sei mesi dell'anno il passivo segnava 19 miliardi.;sg;_;_;succession/iteration/distributivity;modifier
porta a porta;yes;a;porta;quotidiano;La sua storia di origini americane risale agli Anni 40 quando fu adottata dai ragazzi che consegnavano i quotidiani;porta a porta;.;sg;_;_;succession/iteration/distributivity;modifier
punto su punto;no;su;punto;data;Punto croce ricamo una data;punto su punto; giù indico traccia di trama merletto finito.;sg;NsuNgiù;yes;distractor;_
4 su 4;no;su;4;4;Dopo gara 4 i Knicks avranno degli incubi formato Kenyon Martin per tutta l' estate: altra doppia doppia (4;4 su 4;partite), ma quasta volta i punti sono 36.;X;NumPNum;no;distractor;_
