NPN;construction;preposition;noun;pre_lemma;context_pre;costr;context_post;number_of_noun;Type;other_cxn;meaning;syntactic_function
uomo a uomo;no;a;uomo;da;"""È solo una questione di tempo"", secondo Webster, e il virus H5N1, prima o poi, farà il salto della specie, propagandosi da";uomo a uomo;.;sg;PNPN;yes;distractor;_
colpo su colpo;yes;su;colpo;doloroso;"Non rivolgerti con tono sferzante ad alcuno coloro ai quali ti rivolgerai in questo modo ti potrebbero rispondere nello stesso modo: le ingiurie sono dolorose;";colpo su colpo;, esse ricadranno sopra di te.;sg;_;_;succession/iteration/distributivity;modifier
Apple su Apple;no;su;Apple;di;Anche Noi di Zoleounge.it stiamo promuovendo il Back Friday di Apple e se siete in procinto di acquistare con gli sconti del BlackFriday 2010 di;Apple su Apple;Italia, iTunes Store o su App Store e volete aiutare Zoelounge.it senza peraltro spendere una lira in più, potreste prendere in considerazione l'idea di cliccare su uno dei banner presenti in questa pagina o nei banner presenti nella sidebar.;X;proper_name_inglobation;no;distractor;_
uomo a uomo;no;a;uomo;da;Zika, inoltre, si rivelò molto più complicato di Ebola: mentre Ebola si diffonde quasi esclusivamente da;uomo a uomo;, Zika viene perlopiù trasmesso attraverso punture di zanzara.;sg;PNPN;yes;distractor;_
autonomia su autonomia;no;su;autonomia;di;Che ripeto che ricordo sono quelle delle inchieste sui gruppi terroristici Brigate Rosse prima linea sono quelli dell'inchiesta di;autonomia su autonomia;operaia inchiesta com'era sette aprile.;sg;proper_name_inglobation;no;distractor;_
record su record;yes;su;record;macinare;Ritengo che, dopo essere salita in modo fulmineo macinando;record su record;, la Borsa Usa abbia bisogno di una ripulita dagli eccessi speculativi.;sg/pl;_;_;greater_plurality/accumulation;nominal
prove su prove;yes;su;prova;lavoro;Inoltre la pratica di chiedere ai datori di lavoro;prove su prove;"dell'effettiva necessità del lavoro straniero rifletteva la resistenza ad accettare l'idea che esistesse una vera domanda di manodopera non ""autoctona"".";pl;_;_;greater_plurality/accumulation;nominal
colpo su colpo;yes;su;colpo;luterano;Carafa no, preferiva abbandonare i protestanti al loro destino piuttosto che concedere anche una piccola incrinatura dell'autorità assoluta della Chiesa: occorreva ribattere ai luterani;colpo su colpo;, fare pulizia al proprio interno e dotarsi di apparati nuovi che raccogliessero la sfida.;sg;_;_;succession/iteration/distributivity;modifier
uomo a uomo;no;a;uomo;da;Questa malattia può dare luogo a febbri emorragiche anche fatali e ha una caratteristica particolare: non si trasmette da;uomo a uomo;, ma viene trasmessa da una zanzara, che prima punge un malato e poi uno sano.;sg;PNPN;yes;distractor;_
rospi su rospi;yes;su;rospo;inghiottire;L'italiano sente, con il suo istinto arcaico e animalesco, che è in arrivo una tempesta nella quale perderà quelle poche certezze che lo aiutavano a inghiottire;rospi su rospi;.;pl;_;_;greater_plurality/accumulation;nominal
vacche su vacche;no;su;vacca;caricare;È suo il conio del palidromo accavallavacca (strumento per caricare;vacche su vacche;", o vacche su cavalli; vedi anche alle voci lavacavalli e vacca).";pl;thematic_target;no;distractor;_
successi su successi;yes;su;successo;macinare;Le sue divisioni cavo e interactive media macinano;successi su successi;, conquistando sempre maggiori fette di mercato.;pl;_;_;greater_plurality/accumulation;nominal
guancia a guancia;yes;a;guancia;abbracciare;Gli indicò gli aiutanti che si tenevano abbracciati,;guancia a guancia;", con un sorriso che poteva essere umile o ironico; gli indicò tutti costoro come per presentargli un seguito impostogli da particolari circostanze, aspettandosi però - in ciò vi era una certa confidenza, ed era questa a cui egli mirava - che Barnabas distinguesse sempre bene fra lui e loro.";sg;_;_;juxtaposition/contact;modifier
capelli su capelli;no;su;capello;di;Quindi, ad esempio, lo stesso taglio di;capelli su capelli;lisci e ricci apparirà completamente diverso. pertanto quando scegli un taglio di capelli, oltre al tipo di viso, considera anche il tipo di capelli.;pl;N_extended;no;distractor;_
donna a donna;no;a;donna;da;Gli parlò come si potrebbe parlare da;donna a donna;, avvertendo un senso di complicità davvero strano verso una persona che, in fondo, conosceva solo superficialmente da pochi mesi.;sg;PNPN;yes;distractor;_
24 su 24;no;su;24;vicinanza;Infatti la scommessa era quella dell' accompagnamento educativo, la presenza, la vicinanza;24 su 24;ore per tot mesi verso chi ne aveva bisogno.;X;NumPNum;no;distractor;_
parola su parola;yes;su;parola;confermare;Galvanizzato dagli ascolti dell'ultima puntata di Moby Dick (3 milioni 823 mila spettatori), Santoro ha subito replicato: Confermo;parola su parola;quello che ho detto.;sg;_;_;greater_plurality/accumulation;nominal
spalle a spalle;yes;a;spalle;mettere;Ma almeno gli diede soddisfazione e distrasse i Ra'zac abbastanza a lungo da permettergli di correre da Roran e mettersi;spalle a spalle;col cugino.;sg;_;_;juxtaposition/contact;modifier
abbondanza ad abbondanza;no;a;abbondanza;aggiungere;Anche per i Benetton il miliardo messo a disposizione dalla Cassa, con l'astensione in consiglio di Viesti e di un altro componente, sembra aggiungere;abbondanza ad abbondanza;.;sg;verbal;yes;distractor;_
porta a porta;yes;a;porta;campagna;Ma Davi suggerisce, se la vicenda Unipol dovesse monopolizzare tv e giornali nazionali ancora per mesi, di fare una campagna;porta a porta;: «Rinunciare a fare di Rai3 una rete militante, preferire interviste ai giornali e alle tv locali, tanta radio, non solo nelle emittenti di sinistra, comizi».;sg;_;_;succession/iteration/distributivity;modifier
bocca a bocca;yes;a;bocca;respirazione;Nessuno parla dell'impiegato di banca che non è corrotto e che magari un giorno ha salvato la vita a un collega facendogli la respirazione;bocca a bocca;.;sg;_;_;juxtaposition/contact;modifier
situazione a situazione;no;a;situazione;da;Il peso di Rifondazione comunista è diverso da;situazione a situazione;": l'Ulivo, infatti, perde a Milano senza Bertinotti e vince a Torino con l'apparentamento; ma vince a Novara, ed Ancona e Trieste senza l'apporto di Rifondazione";sg;PNPN;yes;distractor;_
guancia a guancia;yes;a;guancia;lento;Alfio per il resto della serata rimase mortificato a guardarla ballare i valzer lenti;guancia a guancia;con Piastrein.;sg;_;_;juxtaposition/contact;modifier
testa a testa;yes;a;testa;e;"Lei, liberandosi, mi accarezzò la guancia; eravamo appoggiati di fianco al finestrino e,";testa a testa;, con la fronte appoggiata al vetro vedevamo correre veloci le nostre due ombre vicine, proiettate sulla campagna.;sg;_;_;juxtaposition/contact;modifier
sergente a sergente;no;a;sergente;da;I periodi minimi di attribuzioni specifiche, per l'avanzamento dei sergenti dell'Aeronautica militare, da;sergente a sergente;maggiore e da sergente maggiore a sergente maggiore capo sono determinati in 4 anni di impiego in incarichi della categoria di appartenenza.;sg;N_extended;no;distractor;_
2 su 2;no;su;3;e;Da segnalare anche un ottima prestazione di Cazzulo con 3 su 3 da due e;2 su 2;dalla lunetta, in momenti importanti della gara.;X;NumPNum;no;distractor;_
colpo su colpo;yes;su;colpo;davvero;L'intesa con Carnival fornisce inoltre a Fincantieri l'opportunità per ribattere davvero;colpo su colpo;la concorrenza dell'altro grande cantiere specializzato in navi passeggeri, il finlandese Masa Yard che recentemente si è aggiudicato un megacontratto della Royal Caribbean cruise line (Rccl) per la costruzione di due unità da 130mila tonnellate destinate a strappare proprio alle Carnival della serie Destiny il primato delle più grandi navi passeggeri del mondo.;sg;_;_;succession/iteration/distributivity;modifier
layer su layer;yes;su;layer;strato;Detriti, come li chiama Napier, che sono visibili per strati,;layer su layer;, quasi si trattasse dei livelli che gli archeologi usano durante le operazioni di scavo.;sg;_;_;succession/iteration/distributivity;modifier
argomento ad argomento;no;a;argomento;da;Io credo che tale dipendenza sia molto variabile, da persona a persona e da;argomento ad argomento;: l'elaborazione simbolica può essere vantaggiosa oppure deleteria, a seconda delle circostanze e dell'oggetto.;sg;PNPN;yes;distractor;_
donna a donna;no;a;donna;da;" anche i sintomi e la successione degli eventi possono essere molto diversi da""";donna a donna;.;sg;PNPN;yes;distractor;_
palmo a palmo;yes;a;palmo;zona;Per ore e ore hanno battuto la zona;palmo a palmo;.;sg;_;_;succession/iteration/distributivity;modifier
muso a muso;no;a;muso;a;La sua resistenza ci portò a;muso a muso;.;sg;PNPN;yes;distractor;_
libri su libri;yes;su;libro;continuare;Le ho già detto che ricevo in continuazione;libri su libri;.;pl;_;_;greater_plurality/accumulation;nominal
uomo a uomo;no;a;uomo;da;Inoltre la situazione degli xenotrapianti oggi è vista esattamente come i trapianti da;uomo a uomo;erano considerati all'inizio degli Anni Sessanta, quando eravamo davvero in pochi a crederci.;sg;PNPN;yes;distractor;_
mille su mille;no;su;mille;sembrare;Il prezzo è stato 8.500 che mi sembra,; mille su mille;giù in linea con quello che si vede in giro.;sg;NsuNgiù;yes;distractor;_
prove su prove;yes;su;prova;fare;La squadra di tecnici della Telecom fa;prove su prove;per trovare l'inghippo.;pl;_;_;greater_plurality/accumulation;nominal
61 su 61;no;su;61;il;L'ha data già il caso Fiat, bisogna insistere per eliminare anche la mafia, artefice del successo del polo con i;61 su 61;.;X;NumPNum;no;distractor;_
esami su esami;yes;su;esame;fare;Inoltre, sono due anni che faccio;esami su esami;al colon e che dovrei farmi operare cominciando dall'intestino, adesso ho preso la decisione e devo comunicarla di persona ai Civili di Brescia: ci convivrò.;pl;_;_;greater_plurality/accumulation;nominal
simmetria su simmetria;yes;su;simmetria;anche;Occhi, seni, ombre e luci sulle anche,;simmetria su simmetria;... il suo respiro che si faceva corto.;sg;_;_;succession/iteration/distributivity;modifier
colpo su colpo;yes;su;colpo;confrontare;Se la reazione - peraltro incerta - dell'azionariato Ina fosse un rilancio sulla stessa Ina, poco male: ci si confronterebbe;colpo su colpo;di fronte al mercato.;sg;_;_;succession/iteration/distributivity;modifier
periodi su periodi;no;su;periodo;avere;Tornando al banco,devo dire che i suoi dischi li amo tuttora,certo hanno avuto;periodi su periodi;ma son sempre stati più che dignitosi.;pl;NsuNgiù;yes;distractor;_
volta a volta;no;a;volta;a;Che questo sia il significato delle disposizioni impugnate emerge nitidamente dalla loro lettera: dette disposizioni, difatti, intervenendo a;volta a volta;sull'art. 12 della legge regionale n. 25 del 2011, affiancano alla quantificazione del costo unitario del canone la potenza efficiente quale grandezza di riferimento il criterio, appunto attraverso cui determinare la potenza prodotta dall'impianto idroelettrico e calcolare il canone complessivo dovuto dal concessionario.;sg;PNPN;yes;distractor;_
bocca a bocca;yes;a;bocca;respirazione;Nel bambino da 1 a 8 anni si fa la respirazione;bocca a bocca;, tenendo chiuse le narici con le dita.;sg;_;_;juxtaposition/contact;modifier
5 su 5;no;su;5;di;Questa volta è la Juventus a sbagliare di meno, anzi a non sbagliare proprio nulla visto che mette a segno uno score di;5 su 5;, mentre per il Milan è fatale l' errore di Brocchi.;X;NumPNum;no;distractor;_
luogo a luogo;no;a;luogo;da;Lo spessore dei ghiacci, misurato con metodi geofisici, varia notevolmente da;luogo a luogo;, in relazione all'andamento del substrato roccioso.;sg;PNPN;yes;distractor;_
porta a porta;yes;a;porta;venditore;La brochure patinata del venditore;porta a porta;mostrava campi da golf verdissimi e piscine, ma tutto quello che il bambino vede è terra da cimitero e qualche lattina arrugginita.;sg;_;_;succession/iteration/distributivity;modifier
Tornante su tornante;yes;su;tornante;cisto;sotto una falesia di roccia tra macchia mediterranea e cespugli di euforbia .  Tornante su tornante il panorama si allarga : tutto intorno macchia mediterranea , cespugli di cisto;Tornante su tornante;il panorama si allarga: tutto intorno macchia mediterranea, cespugli di cisto, qualche boschetto di eucalipti e tra le rocce la vista di Siniscola.;sg;_;_;succession/iteration/distributivity;modifier
porta a porta;yes;a;porta;raccolta;Nel 2002 è tra i tecnici che collaborano all'attivazione della raccolta;porta a porta;in alcuni Comuni della Provincia di Torino.;sg;_;_;succession/iteration/distributivity;modifier
palmo a palmo;yes;a;palmo;controllare;La ragazza, piuttosto pallida ed esile, controllò;palmo a palmo;l'indumento alla ricerca di eventuali macchie, verificò le cuciture e gli orli, poi la drappeggiò attorno alle sue spalle e sul braccio sinistro e curò le pieghe una per una come se stesse rivestendo il suo padrone.;sg;_;_;succession/iteration/distributivity;modifier
moduli su moduli;yes;su;modulo;compilare;La biblioteca, ad esempio: è sempre aperta, non bisogna compilare;moduli su moduli;, ti danno subito gli spartiti in prestito…;pl;_;_;greater_plurality/accumulation;nominal
uomo a uomo;no;a;uomo;da;Vi segnaliamo anche l'accusa pesantissima dell'animatore del sito pacifista Peacelink, Alessandro Marescotti, ai tecnici che si sono resi conniventi della truffa del baco del millennio: un confronto da;uomo a uomo;nella rubrica Delfino.;sg;PNPN;yes;distractor;_
porta a porta;yes;a;porta;vendita;Alla quale vanno aggiunti ancora un sindacato (Domina: organizzazione dei datori di lavoro domestico), un patronato (Informafamiglia), una società (Rete - Rete) per vendite;porta a porta;.;sg;_;_;succession/iteration/distributivity;modifier
donna a donna;no;a;donna;da;C'è una donna vescovo, adesso, negli Stati Uniti, forse potrei chiamarla, forse lei potrebbe arrivare a Vina e, non so, forse, parlandole da;donna a donna;, intercedere per me.;sg;PNPN;yes;distractor;_
bocca a bocca;yes;a;bocca;racconto;Tutto si vela, tutto si ammanta, tutto trapassa così in un mondo parallelo dove anche il dolore può stemperarsi nel calore delle leggende, nella familiarità dei lunghi racconti;bocca a bocca;.;sg;_;_;juxtaposition/contact;modifier
Pisa su Pisa;no;su;Pisa;di;Martedì sera Umberto ha avuto una trovata che per poco non ha reso innocuo il pericolante edificio di insulti che ogni puntata pende su di lui, come la Torre di;Pisa su Pisa;.;X;proper_name_inglobation;no;distractor;_
uomo a uomo;no;a;uomo;da;La mamma, le gemelle e Claudia andarono in cucina, lasciando Giacomo e Cristiano al loro discorsetto da;uomo a uomo;, secondo l'usanza.;sg;PNPN;yes;distractor;_
palmo a palmo;yes;a;palmo;battere;Il geometra De Palo e il geometra Ranieri vengono sguinzagliati per battere;palmo a palmo;la città sulle loro station wagon.;sg;_;_;succession/iteration/distributivity;modifier
bocca a bocca;yes;a;bocca;alimentazione;Il significato erotico del bacio deriverebbe dall'alimentazione;bocca a bocca;dell'infante.;sg;_;_;juxtaposition/contact;modifier
colpo su colpo;yes;su;colpo;rispondere;Il nostro compito è restare vigili e rispondere;colpo su colpo;.;sg;_;_;succession/iteration/distributivity;modifier
bocca a bocca;yes;a;bocca;respirazione;La respirazione artificiale andrebbe praticata attraverso strumenti medicali come il pallone ambu e, per motivi di igiene e profilassi, è sconsigliabile praticare la respirazione;bocca a bocca;.;sg;_;_;juxtaposition/contact;modifier
quartiere a quartiere;no;a;quartiere;da;Ecco come varia nel dettaglio il mercato immobiliare da;quartiere a quartiere;.;sg;PNPN;yes;distractor;_
informazioni su informazioni;yes;su;informazione;addosso;Di converso, e questo è il secondo aspetto, ciò significa che ti si rovesciano addosso;informazioni su informazioni;, sempre di più, col rischio che, superando certi livelli, tutto si confonde e perde di valore.;pl;_;_;greater_plurality/accumulation;nominal
rinvii su rinvii;yes;su;rinvio;Italia;Quindici giorni in cui le attività giudiziarie penalistiche - i processi, grandi e piccoli, di criminalità comune e organizzata, acaricodi imputati eccellenti e sconosciuti - hanno subito, in tutt'Italia,;rinvii su rinvii;e accumulato ritardi.;pl;_;_;greater_plurality/accumulation;nominal
palmo a palmo;yes;a;palmo;conoscere;Allora il prete si avvicinò a me e disse che lui quelle montagne le conosceva;palmo a palmo;perché da piccolo con suo padre e sua sorella arrivavano fin lassù.;sg;_;_;succession/iteration/distributivity;modifier
carta su carta;no;su;carta;di;E poi c'è lo spariglio, una variante della presa di;carta su carta;uguale.;sg;thematic_target;no;distractor;_
24 su 24;no;su;24;disponibile;Tale contenitore poi, grazie alla tecnologia e software di ultima generazione, è disponibile;24 su 24;online e aggiornato in tempo reale, permettendo così ai potenziali clienti di visionare gli immobili direttamente da casa o ufficio, e ai collaboratori del gruppo sparsi in Italia o all' estero di consultare e fornire proposte svincolate dal limite della territorialità di competenza.;X;NumPNum;no;distractor;_
110 su 110;no;su;110;con;Luciano Fonzi esprime il seguente giudizio: Laureato in Scienze Biologiche presso la Università di Siena nel 1969 con;110 su 110;e lode.;X;NumPNum;no;distractor;_
uomini su uomini;no;su;uomo;di;Quindi, anche nel fumetto Bonelli, come in Berserk, ci sono scene di violenza sessuale verso i protagonisti minorenni, o di violenza sessuale di;uomini su uomini;"(le ho elencate entrambe perchè non sapevo cosa consideravi più ""forte"" nella scena di Berserk).";pl;thematic_target;no;distractor;_
gruppo a gruppo;no;a;gruppo;da;Il luogo nel quale viene ricevuta e smistata la merce, varia da;gruppo a gruppo;.;sg;PNPN;yes;distractor;_
porta a porta;yes;a;porta;venditore;L'Ambiente oggi cerca 20 distributori (uno per ogni regione) più venditori;porta a porta;in tutta Italia.;sg;_;_;succession/iteration/distributivity;modifier
porta a porta;yes;a;porta;raccolta;Anziché sostenere la lobby dell'incenerimento Orlando promuova la riduzione dei rifiuti, la raccolta;porta a porta;(abolendo la Tares come chiesto dal M5S con proposte parlamentari), costruzioni di centri riciclo e compostaggio, sistemi alternativi all'incenerimento e alla discarica, in linea con l'Europa!;sg;_;_;succession/iteration/distributivity;modifier
palmo a palmo;yes;a;palmo;setacciare;Il litorale tra Ostia e Anzio viene setacciato;palmo a palmo;con i cani.;sg;_;_;succession/iteration/distributivity;modifier
guancia a guancia;yes;a;guancia;stare;Me lo accosto al viso, quasi lo tocco con gli occhi, mentre Zot arriva e stiamo;guancia a guancia;a guardarlo, così vicini che i nostri respiri diventerebbero uno solo, se ci riuscisse respirare.;sg;_;_;juxtaposition/contact;modifier
sedia su sedia;no;su;sedia;esempio;Le ragioni della priorità psicologica di, per esempio,;sedia su sedia;"a dondolo o mobilio sono percettive e morfologiche (percepiamo una sedia come una gestalt unitaria più facilmente del mobilio; associamo più facilmente un’immagine al livello base che agli altri), funzionali (abbiamo un programma motorio generale per interagire con le sedie, ma non con il mobilio), linguistiche e comunicative (il livello base contiene in media più attributi e dà più informazioni degli altri), di apprendimento (i bambini imparano prima i termini del livello base; inoltre spesso i termini del livello base sono più brevi e meno complessi degli altri).";sg;N_extended;no;distractor;_
guancia a guancia;yes;a;guancia;accostare;Vide ancora come i signori vicino al suo viso, accostati;guancia a guancia;, osservavano l'esito.;sg;_;_;juxtaposition/contact;modifier
uomini su uomini;no;su;uomo;di;"Lo stato è così dunque ""un rapporto di potere di";uomini su uomini;", fondato sul mezzo dell'uso della forza legittima"" (si veda ""Economia e Società"", Milano 1961).";pl;thematic_target;no;distractor;_
uomo a uomo;no;a;uomo;da;Al momento risulta che il contagio umano da influenza aviaria avviene con il contatto diretto con animali infetti, non si hanno prove di una trasmissione del virus da;uomo a uomo;.;sg;PNPN;yes;distractor;_
uomo a uomo;no;a;uomo;da;Oppure senza i sì e i no della figura paterna: finiti i gesti di sostegno virile, i lanci in aria per gioco, le spiegazioni da;uomo a uomo;, il conforto dopo gli insuccessi.;sg;PNPN;yes;distractor;_
uomo a uomo;no;a;uomo;da;Questa doppia infezione potrebbe creare un virus nuovo, trasmissibile da;uomo a uomo;.;sg;PNPN;yes;distractor;_
6 su 6;no;su;6;femmina;Utilizzarono questa possibilità soprattutto le femmine (;6 su 6;), ma anche alcuni maschi (4 su 12), quindi nel complesso poco più del 50 % della classe.;X;NumPNum;no;distractor;_
soldi su soldi;yes;su;soldi;chiedere;E ora questi incapaci hanno il coraggio di chiedere;soldi su soldi;a chi le tasse le paga già fino all'ultimo centesimo.;pl;_;_;greater_plurality/accumulation;nominal
strato su strato;yes;su;strato;incollare;L'unica traccia di colore era offerta dai manifesti elettorali, sbiaditi e incollati;strato su strato;.;sg;_;_;succession/iteration/distributivity;modifier
porta a porta;yes;a;porta;differenziato;Al via la raccolta differenziata a Molini, Girola e Valtenna Mercoledì 18 dicembre inizia il nuovo servizio di raccolta differenziata -;porta a porta;nei quartieri Molini, Girola e Valtenna.;sg;_;_;succession/iteration/distributivity;modifier
uomo a uomo;no;a;uomo;da;Il contagio è solo interumano, vale a dire che la varicella si trasmette solo da;uomo a uomo;e non da animale ad uomo.;sg;PNPN;yes;distractor;_
anima ad anima;yes;a;anima;gomito;Ecco, devono essere nati così questi ultimi due romanzi di famiglia, seguiti da lunghe ore al computer, uno accanto all'altro, gomito a gomito,;anima ad anima;, ogni tanto un sospiro, una lunga occhiata, qualche sorriso di tenerezza perché i due si adorano e si cercano come solo due innamoratini sanno fare, al di là delle loro abbondanti sessanta primavere.;sg;_;_;juxtaposition/contact;modifier
dichiarazioni su dichiarazioni;yes;su;dichiarazione;riunione;Da dieci giorni stiamo dicendo in tutte le sedi che bisognava intervenire: si è perduto tempo a discutere, a prendere contatti diplomatici, a fare riunioni su riunioni,;dichiarazioni su dichiarazioni;, mentre la tragedia albanese richiedeva interventi rapidi, decisi, organici, massicci.;pl;_;_;greater_plurality/accumulation;nominal
colpo su colpo;yes;su;colpo;reagire;Katoh ha immediatamente risposto, ma Melandri ha reagito;colpo su colpo;.;sg;_;_;succession/iteration/distributivity;modifier
3 su 3;no;su;3;fecondare;Per nostra fortuna sono stati fecondati;3 su 3;, il 100 %, pronti per essere impiantati in utero.;X;NumPNum;no;distractor;_
balcone a balcone;yes;a;balcone;dirimpettaio;Così si sente superiore nel cortile, a esempio, sul cav. Bizzini, suo dirimpettaio,;balcone a balcone;, che vive con la figlia, il genero e i ragazzi un maschio e una femmina e potrebbe essere privilegiato, ma se sapesse scrollarsi di dosso il rischio di venir ficcato in un ospizio per anziani.;sg;_;_;juxtaposition/contact;modifier
giornalisti su giornalisti;no;su;giornalista;di;Torna l' estate, tornano puntuali come le zanzare i libri di; giornalisti su giornalisti;e con la calura tornano a scoppiare anche le polemiche tra gli anchormen di casa Mediaset, in primis quella tra Emilio Fede ed Enrico Mentana.;pl;thematic_target;no;distractor;_
uomo a uomo;no;a;uomo;da;Così ho inforcato la Chevrolet e girato per mezz'ora fra quei prefabbricati, cercando di capire dove si annidasse il marito: intendevo parlargli da;uomo a uomo;.;sg;PNPN;yes;distractor;_
porta a porta;yes;a;porta;contratto;Ciò si manifesta anche con la tendenza - si veda a proposito la legge sull'equo canone, sui contratti;porta a porta;", sul credito al consumo, sulla subfornitura e sulla multiproprietà - a non creare nuove figure contrattuali ma a regolare I ""rapporti economici"" fissando requisiti minimi del testo negoziale.";sg;_;_;succession/iteration/distributivity;modifier
inquadratura a inquadratura;no;a;inquadratura;da;Raramente i casi reali di compressione sono così semplici: anche un'unica inquadratura di un cielo blu include sottili variazioni di colore e i colori cambieranno da;inquadratura a inquadratura;.;sg;PNPN;yes;distractor;_
stanza a stanza;no;a;stanza;da;A Water, forse non c'è neanche un posto dove non abbia fatto la stessa cosa, da pensione ad albergo, da;stanza a stanza;.;sg;PNPN;yes;distractor;_
uomini su uomini;no;su;uomo;di;"Nella famosa conferenza del 1919 su ""La politica come professione"", Max Weber disse: ""Lo Stato è, come le associazioni politiche che storicamente lo precedono, un rapporto di dominio di";uomini su uomini;basato sul mezzo della forza legittima (cioè considerata legittima).;pl;thematic_target;no;distractor;_
bocca a bocca;yes;a;bocca;respirazione;Per i primi cinque minuti il massaggio non va interrotto (amenoche non si sia obbligati ad eseguire contemporaneamente la respirazione;bocca a bocca;.;sg;_;_;juxtaposition/contact;modifier
bocca a bocca;yes;a;bocca;artificiale;L'altro agente praticò a Sullivan la respirazione artificiale;bocca a bocca;.;sg;_;_;juxtaposition/contact;modifier
immagine a immagine;no;a;immagine;da;Mi interessava l'espressione di molti invitati, che passavano da;immagine a immagine;con aria di reverenza, e commozione.;sg;PNPN;yes;distractor;_
popolo a popolo;no;a;popolo;morale;" non solo da età ad età e da""";popolo a popolo;", ma da individuo a individuo, e a ogni istante della vita di ciascun individuo"".";sg;PNPN;yes;distractor;_
