NPN;construction;preposition;noun;pre_lemma;context_pre;costr;context_post;number_of_noun;Type;other_cxn;meaning;syntactic_function
parete a parete;no;a;parete;da;Aveva già costruito la stazione, un villaggio di casette di legno, alberi di cartone e un ambiente di colline e tunnel in miniatura che si stendeva da;parete a parete;impedendo il passaggio attraverso la stanza.;sg;PNPN;yes;distractor;_
dorso a dorso;yes;a;dorso;impilare;"Vittorio scosta qualche altra grande tela appoggiata alla parete, giusto abbastanza per farmi dare un'occhiata; me ne fa vedere alcune di quelle più piccole, impilate";dorso a dorso;sul tavolo di legno grezzo.;sg;_;_;juxtaposition/contact;modifier
bocca a bocca;yes;a;bocca;respirazione;Alcune tecniche di rianimazione, come per esempio la respirazione;bocca a bocca;, possono risultare pericolose per il soccorritore: in questo modo si possono trasmettere molte malattie, soprattutto se l'infortunato ha delle perdite di sangue.;sg;_;_;juxtaposition/contact;modifier
grigio su grigio;no;su;grigio;bicolore;Innanzitutto, sono stati introdotti nuovi colori per la plancia bicolore;grigio su grigio;e blu su grigio.;sg;thematic_target;no;distractor;_
donna a donna;no;a;donna;da;Quali sono i fattori che determinano queste differenze da;donna a donna;?;sg;PNPN;yes;distractor;_
palmo a palmo;yes;a;palmo;esplorare;A piedi ci rechiamo quindi alla scoperta della parte più antica dell'abitato, nella quale si trova il poderoso castello aragonese, che esploriamo;palmo a palmo;, fra interessanti ambienti di epoca medioevale e vasti panorami sui paesaggi circostanti.;sg;_;_;succession/iteration/distributivity;modifier
seduta a seduta;no;a;seduta;da;Per evitare i brogli del 1992, quando nell'urna apparvero più schede dei votanti, saranno utilizzati fogli colorati, diversi da;seduta a seduta;.;sg;PNPN;yes;distractor;_
uomo su uomo;no;su;uomo;di;Il sistema odioso di sfruttamento di;uomo su uomo;.;sg;thematic_target;no;distractor;_
libri su libri;yes;su;libro;leggere;Di sicuro al distretto avevano pensato che fosse ammattito, vistoche trascorreva le ore del turno trincerato nella sua stanza a leggere;libri su libri;.;pl;_;_;greater_plurality/accumulation;nominal
ACCUSE SU ACCUSE;yes;su;accusa;polemica;ANZICHE DISTRUGGERLA CON POLEMICHE SU POLEMICHE ... ;ACCUSE SU ACCUSE;…;pl;_;_;greater_plurality/accumulation;nominal
Venezia su Venezia;no;su;Venezia;di;Pubblicazione di alcune foto di;Venezia su Venezia;Radio TV e Venetian Holiday.;X;proper_name_inglobation;no;distractor;_
facebook su facebook;no;su;facebook;di;la censura su facebook esiste, non si deve parlare male di;facebook su facebook;e non si devono aprire discorsi seri che non c'entrano con le informazioni private che servono 1: a controllarti 2: a sapere cosa pensano i giovani su determinati prodotti.;X;thematic_target;no;distractor;_
testa a testa;yes;a;testa;essere;Seduti a un tavolino erano;testa a testa;il luminare di Oxford e il cameriere, l'instancabile cercatore della tomba, sorbendo una tazza di tè.;sg;_;_;juxtaposition/contact;modifier
guancia a guancia;yes;a;guancia;lui;Avrei voluto poter cucinare al mio lui una costata, sapendo che gli piaceva cotta al punto giusto, poter danzare con lui;guancia a guancia;.;sg;_;_;juxtaposition/contact;modifier
donna a donna;no;a;donna;da;Il deficit estrogenico ha una serie di effetti a breve, medio e lungo termine differenti per incidenza da;donna a donna;in base anche a fattori costituzionali e socio-ambientali ma comunque capaci in molti casi di minare gravemente lo stato di salute generale attraverso il danneggiamento di numerosi organi ed apparati (cardiovascolare, nervoso, cutaneo, osseo, uro - genitale).;sg;PNPN;yes;distractor;_
miracolo a miracolo;no;a;miracolo;Gerusalemme;" perciò essa non si arresta più finché non è giunta sulla stalla, fino a quando non ha aggiunto""";miracolo a miracolo;: il miracolo dell'adorazione dei Magi al miracolo della stella che guida i Magi.;sg;verbal;yes;distractor;_
situazione a situazione;no;a;situazione;da;Questo modellamento, però, non può che essere diversificato da;situazione a situazione;perché le istituzioni devono avere forme, figure e azioni adeguate a rapportarsi alle diverse realtà, in alcuni casi prolungandosi, in altre arretrando.;sg;PNPN;yes;distractor;_
donna a donna;no;a;donna;da;Sono villana, lo sai già, e se c'è qualcosa che mi mette di malumore sono le sedute di confidenze da;donna a donna;, per cui gradirei che mi risparmiassi le tue.;sg;PNPN;yes;distractor;_
parole su parole;yes;su;parola;dare;E i giochini, i disegnetti a bordo pagina che sono sicuro lei fa mentre aspetta che il cervello elabori e le detti;parole su parole;"; perché non stampa anche quei disegnetti scarabocchiati per ingannare la mano che vorrebbe scrivere qualcosa in maniera autonoma?";pl;_;_;greater_plurality/accumulation;nominal
uomo a uomo;no;a;uomo;da;Ci siamo stretti con forza, nell'abbraccio da;uomo a uomo;che avevamo codificato la prima volta quando era venuto a prendermi al residence sulla collina.;sg;PNPN;yes;distractor;_
palmo a palmo;yes;a;palmo;praticamente;Quelli dell'NGA disponevano di migliaia di immagini scattate dai droni e dai satelliti, e conoscevano praticamente;palmo a palmo;l'intera area esterna del compound.;sg;_;_;succession/iteration/distributivity;modifier
guancia a guancia;yes;a;guancia;brillantina;La tromba è guerresca, angelica, apocalittica, vittoriosa, suona la carica, il sassofono fa ballare bulletti di periferia coi capelli unti di brillantina,;guancia a guancia;con ragazze sudate.;sg;_;_;juxtaposition/contact;modifier
egemonia ad egemonia;no;a;egemonia;aggiungere;Perché l'Ulivo ha avuto l'abilità - se possiamo considerarla un'abilità - di aggiungere;egemonia ad egemonia;.;sg;verbal;yes;distractor;_
uomini su uomini;no;su;uomo;di;Sono sempre segno di un'ingiustizia regnante, di oppressione di;uomini su uomini;.;pl;thematic_target;no;distractor;_
sbagli su sbagli;yes;su;sbaglio;collezionare;Aveva sempre permesso che loro ne approfittassero – una masochistica consapevolezza che la portava a collezionare;sbagli su sbagli;.;pl;_;_;greater_plurality/accumulation;nominal
tempo a tempo;no;a;tempo;a;MENTRE è in arrivo in Tv l'ottava edizione della Piovra, apprendiamo, a;tempo a tempo;", che si tratta di una ""delle espressioni rilevanti della cultura popolare italiana"".";sg;PNPN;yes;distractor;_
facebook su facebook;no;su;Facebook;di;io ho creato una pagina di;facebook su facebook;appunto, ma mi rendo conto che non serve a niente perchè nessuno ne sa l'esistenza, quindi non pubblicizzo niente.;X;thematic_target;no;distractor;_
colpo su colpo;yes;su;colpo;restituire;Proprio la dote che l'aveva sorretta durante il primo tempo, consentendole di reggere il ritmo - non forsennato - degli avversari ai quali aveva restituito;colpo su colpo;.;sg;_;_;greater_plurality/accumulation;nominal
specie a specie;no;a;specie;da;Il capo è dotato di due occhi, due antenne e un apparato boccale che varia da;specie a specie;.;sg;PNPN;yes;distractor;_
testa a testa;yes;a;testa;accanto;Banga salì subito sul letto con lui, si sdraiò lì accanto,;testa a testa;, e il procuratore, con una mano sul collo dell'animale, chiuse finalmente gli occhi.;sg;_;_;juxtaposition/contact;modifier
dolori su dolori;yes;su;dolore;e;E dietro a quello, molti altri ricordi rossi, indicibili, segreti, sepolti da anni di uso di mondo, errori, matrimoni, figlie, partenze, musica, abbandoni, gioielli, amanti, dolori, e;dolori su dolori;su dolori per mimetizzare il padre di tutti i dolori.;pl;_;_;greater_plurality/accumulation;nominal
tensione a tensione;no;a;tensione;aggiungere;lo so che ti potrebbe montare l'ansia, però se prosegui così, purtroppo, aggiungi;tensione a tensione;, ansia, sua ansia.;sg;verbal;yes;distractor;_
Venere su Venere;no;su;Venere;di;E i transiti che mi aspettano di ;Venere su Venere;e Saturno e poi di Urano su Marte, posso considerarli buoni per la mia situazione sentimentale?;X;N_extended;no;distractor;_
porta a porta;yes;a;porta;differenziato;"In particolare, anche in Italia ci sono esperienze straordinarie a riguardo, conta la raccolta differenziata """;porta a porta;""", domiciliarizzata, portare il servizio vicino alle famiglie.";sg;_;_;succession/iteration/distributivity;modifier
materia su materia;yes;su;materia;di;Cazzetti, fichette, zinnette, culetti sodi esplodono su di me in una cosmogonia di;materia su materia;.;sg;_;_;greater_plurality/accumulation;nominal
soldi su soldi;yes;su;soldi;fare;Insomma c'è ancora tempo, e spazio, per fare;soldi su soldi;su soldi vendendo e spedendo in tutto il mondo i vecchi libri di carta: tanto più se fatti in casa.;pl;_;_;greater_plurality/accumulation;nominal
4 su 4;no;su;4;essere;Con quella di oggi, sono;4 su 4;le vittorie di Prada nei testa a testa con l'imbarcazione della bionda Dawn Riley: anche se nelle previsioni, il successo era oggi tutt'altro che scontato.;X;NumPNum;no;distractor;_
specie a specie;no;a;specie;da;Gli occhi e le capacità visive dei rettili variano da;specie a specie;.;sg;PNPN;yes;distractor;_
guancia a guancia;yes;a;guancia;altro;Riuscì ancora a vedere i due uomini, vicini al suo viso, appoggiati l'uno all'altro;guancia a guancia;, che osservavano la fine.;sg;_;_;juxtaposition/contact;modifier
aria su aria;yes;su;aria;muovere;Il ventilatore non vale niente, muove;aria su aria;, sempre la stessa.;sg;_;_;greater_plurality/accumulation;nominal
palmo a palmo;yes;a;palmo;esaminare;Siccome la domestica non le aveva detto dov'era stata morsa, le alzò la camiciola e la esaminò;palmo a palmo;, seguendo con la luce la treccia di penitenza che teneva avvolta intorno al corpo come una coda di leone.;sg;_;_;succession/iteration/distributivity;modifier
metri su metri;yes;su;metro;divorare;Da questo momento in poi, Beckham continuerà almeno per un'ora a divorare;metri su metri;, avversari su avversari, con una facilità che fa male al cuore.;pl;_;_;greater_plurality/accumulation;nominal
difficoltà a difficoltà;no;a;difficoltà;aggiungere;Dalla scatola a sorpresa della nostra politica, che non riesce a correggere se stessa, rischiano continuamente di uscire riforme sbagliate , che aggiungono;difficoltà a difficoltà;.;sg;verbal;yes;distractor;_
record su record;yes;su;record;così;Ma in questi anni va così,;record su record;.;sg/pl;_;_;greater_plurality/accumulation;nominal
guancia a guancia;yes;a;guancia;cheek;"Azzurro Caltagirone è a un tavolo ""cheek to cheek"",";guancia a guancia;con il pretone.;sg;_;_;juxtaposition/contact;modifier
bocca a bocca;yes;a;bocca;respirazione;In attesa dell'arrivo dell'ambulanza gli hanno praticato il massaggio cardiaco e la respirazione;bocca a bocca;ma tutto è stato inutiule.;sg;_;_;juxtaposition/contact;modifier
Guccini su Guccini;no;su;Guccini;di;Forse il fatto d'essere un lavoro di;Guccini su Guccini;, la possibilità di curiosare nell'armadio dei sogni e dei ricordi, mettendoci a disposizione fin dalla copertina la foto di famiglia del bisnonno che gli ha dato il nome (e sul retro, ma non cercatela nel booklet del cd, un'austera immagine della sua,;X;thematic_target;no;distractor;_
jeans su jeans;no;su;jeans;jeans;Consigli per indossare il giubbino di jeans su jeans;jeans su jeans;.;sg/pl;N_extended;no;distractor;_
uomo a uomo;no;a;uomo;da;"Gli esperti, nel frattempo, ritengono che la trasmissione del virus dell'""influenza dei polli"" sia possibile anche da";uomo a uomo;, tuttavia i test conclusi finora hanno rivelato solo geni animali.;sg;PNPN;yes;distractor;_
uomo a uomo;no;a;uomo;da;Segreti, appunto, che erano da sempre tramandati da;uomo a uomo;, da adulto a giovane, da maestro a discepolo.;sg;PNPN;yes;distractor;_
uomini su uomini;no;su;uomo;di;"Come sottolineavano i compagni tedeschi delle Cellule Rivoluzionarie: ""Noi crediamo che la guerra totale contro il sistema di dominio di";uomini su uomini;acchiuda in se stessa contemporaneamente e in egual misura la lotta contro il sistema capitalistico che è in noi stessi.;pl;thematic_target;no;distractor;_
uomo su uomo;no;su;uomo;qui;"Il problema del potere si ripresenta qui; il potere d'";uomo su uomo;.;sg;thematic_target;no;distractor;_
pagine su pagine;yes;su;pagina;disposizione;L'uomo aveva sempre a disposizione;pagine su pagine;bianche, lavate dal suo alito.;pl;_;_;greater_plurality/accumulation;nominal
gruppo a gruppo;no;a;gruppo;da;Esso viene vissuto e ritualizzato in maniera diversa da;gruppo a gruppo;.;sg;PNPN;yes;distractor;_
22 su 22;no;su;22;scorso;In tempi più recenti, nel giugno scorso,;22 su 22;attentati sono abortiti.;X;NumPNum;no;distractor;_
posizioni su posizioni;yes;su;posizione;risalire;È straordinaria la facilità con cui l'attaccante, che sta ottenendo grande successo nel suo doratissimo esilio spagnolo, ha risalito;posizioni su posizioni;collocandosi al vertice della piramide azzurra.;pl;_;_;greater_plurality/accumulation;nominal
materiale a materiale;no;a;materiale;da;Meno diffusa è la conoscenza dell'entità del fenomeno e del fatto che questo varia da;materiale a materiale;.;sg;PNPN;yes;distractor;_
5 su 5;no;su;5;essere;"Se il ""numero minimo di domande"" non è stato impostato, allora il suo voto sarà";5 su 5;, cioè 100 %.;X;NumPNum;no;distractor;_
parete a parete;no;a;parete;da;Fu allora che i suoi piedi inciamparono in un filo sottile, teso da;parete a parete;", un filo che la sua foga non gli aveva fatto né vedere né cercare; il filo si tese, tirandosi e strappandosi, e nell'aria pesante si udì lo squillante tintinnio di numerosi campanelli lontani: un rudimentale sistema d'allarme.";sg;PNPN;yes;distractor;_
collega a collega;no;a;collega;da;Pongo solo un dubbio deontologico, da;collega a collega;.;sg;PNPN;yes;distractor;_
record su record;yes;su;record;risucchiati;Fuori Perugini: Valentino è primo, in dieci minuti dodici posti risucchiati,;record su record;.;sg/pl;_;_;greater_plurality/accumulation;nominal
comunicazioni su comunicazioni;yes;su;comunicazione;ovvero;La capacità di significare tramite icone implica anche che tutti i processi di comunicazione siano di secondo livello, ovvero;comunicazioni su comunicazioni;, spesso lontane dalla vita quotidiana.;pl;_;_;greater_plurality/accumulation;nominal
splendore a splendore;no;a;splendore;aggiungere;Ma queste fantasie schliemanniane non fanno altro che aggiungere;splendore a splendore;.;sg;verbal;yes;distractor;_
situazione a situazione;no;a;situazione;da;Ray si rendeva perfettamente conto che le esigenze e i rapporti di forza variano da;situazione a situazione;.;sg;PNPN;yes;distractor;_
colpo su colpo;yes;su;colpo;rispondere;Entrambe le compagini si sono affrontate a viso aperto rispondendo;colpo su colpo;a qualasisi iniziativa opposta, esibendo in certi frangenti anche giocate di buona tecnica.;sg;_;_;succession/iteration/distributivity;modifier
Italia su Italia;no;su;Italia;in;Ricordiamo che Futurama è partita in America sul network FOX il 28 marzo 1999, ed ha esordito in;Italia su Italia;1 in prima serata alle 20.45 il 6 gennaio 2000.;sg;proper_name_inglobation;no;distractor;_
8 su 8;no;su;8;tre;Gioca 29' e chiude con 20 punti, 0 su 2 da due, 4 su 7 da tre,;8 su 8;ai tiri liberi, ben 5 rimbalzi, 4 assist, 25 di valutazione.;X;NumPNum;no;distractor;_
5 su 5;no;su;5;inanellare;A detta di Alberto Artiglia che ne ha inanellati;5 su 5;(l' unico oltre al sottoscritto), il migliore vitto lo abbiamo avuto qui.;X;NumPNum;no;distractor;_
pagine su pagine;yes;su;pagina;divorare;Perché c'è chi riesce a fartelo drizzare, chi riesce a farti ridere, chi a farti passare la notte divorando;pagine su pagine;per capire chi era l'agente segreto che cagava rubini, chi riesce a farti venire appetito e a farti tornare a Bangkok quando invece sei a casa tua, ad ognuno la sua specialità.;pl;_;_;greater_plurality/accumulation;nominal
spiegazioni su spiegazioni;yes;su;spiegazione;chiedere;E agli ipocondriaci (le persone che sono sempre convinte di essere ammalate): a furia di chiedere;spiegazioni su spiegazioni;, scoprono di avere costantemente qualche problema di salute.;pl;_;_;greater_plurality/accumulation;nominal
palmo a palmo;yes;a;palmo;battere;Da quella sera, fino a ieri pomeriggio, carabinieri, polizia e vigili del fuoco hanno continuato a cercare madre e figlio, battendo;palmo a palmo;la zona lungo il fiume e scandagliando le acque del Livenza, che a tratti ha correnti molto forti e profondità dai cinque ai nove metri.;sg;_;_;succession/iteration/distributivity;modifier
strato su strato;yes;su;strato;cipolla;A sua volta, il pensiero si divide, come dire, anche da se stesso, in accumulo, foglio sopra foglio, azione dopo ricordo, riflessione sopra decisione, lasciandomi come una grande cipolla,;strato su strato;, nel cui cuore profondo risuonano, lancinanti e abissali, le parole del Grande Matthys, il Dio Fornaio.;sg;_;_;succession/iteration/distributivity;modifier
uomo a uomo;no;a;uomo;da;"Questa trasformazione, ipotizzano gli studiosi, ""potrebbe essere dovuta a variazioni o nelle capacità del virus di trasmettersi da";uomo a uomo;", o nelle caratteristiche della popolazione prevalentemente infettata"".";sg;PNPN;yes;distractor;_
distorsione a distorsione;no;a;distorsione;aggiungere;Il fatto è che il monopolio, privato o pubblico che sia, modella di sè il sistema e aggiunge;distorsione a distorsione;finché tutti hanno torto, avendo tutti ottime ragioni.;sg;verbal;yes;distractor;_
bambino a bambino;no;a;bambino;da;Le difficoltà e i successi ovviamente variano da;bambino a bambino;e da un ordine di scuola all'altro anche in base alle caratteristiche e le modalità organizzative dei vari tipi di scuola.;sg;PNPN;yes;distractor;_
record su record;yes;su;record;macinare;La ragione è semplice: le principali Borse mondiali (salvo Tokio) macinano;record su record;, la capitalizzazione dei grandi gruppi quotati si espande oltre ogni previsione, i ritorni sull'investimento per chi ha puntato su di loro un anno fa battono tutte le alternative.;sg/pl;_;_;greater_plurality/accumulation;nominal
testa a testa;yes;a;testa;quaderno;Giovanissime, con le treccine e gli occhialetti, stanno chine sui quaderni,;testa a testa;insieme ai loro studenti: quelli incapaci di tenere il passo della grande macchina alla conquista del pianeta.;sg;_;_;juxtaposition/contact;modifier
colpo su colpo;yes;su;colpo;ribattere;Che non consiste nel ribattere;colpo su colpo;alle battute dell'antipolitica nei salotti televisivi, ma nel rispondere alle domande della società.;sg;_;_;succession/iteration/distributivity;modifier
base su base;no;su;base;di;La povertà mestruale - la lotta per pagare i prodotti sanitari di;base su base;mensile - è aumentata durante la pandemia di coronavirus , secondo le associazioni di beneficenza.;sg;N_extended;no;distractor;_
gaffes su gaffes;yes;su;gaffes;inanellare;Inoltre Greg, autentico Fantozzi, ne combina di tutti i colori, inanella;gaffes su gaffes;.;pl;_;_;greater_plurality/accumulation;nominal
uomo a uomo;no;a;uomo;da;Anche gli alleati del re di Macedonia gli si rivolgevano da;uomo a uomo;, attendendosi da lui soltanto cortesia e generosità.;sg;PNPN;yes;distractor;_
bocca a bocca;yes;a;bocca;respirazione;Se non è possibile la respirazione;bocca a bocca;si può tentare una respirazione manuale la cui efficacia è molto inferiore.;sg;_;_;juxtaposition/contact;modifier
radio su radio;no;su;radio;a;Proprio stamattina presto, verso le 5 circa seguivo il programma alla;radio su radio;"1 ""istruzioni per l' uso"" e uno degli argomenti era per l' appunto il blog, si parlava di quanti blog esistono in Italia, circa 30000, (pensavo ce ne fossero di più) mentre in Francia sono 3000000!";sg;proper_name_inglobation;no;distractor;_
uomini su uomini;no;su;uomo;da;Un crimine non certo benedetto da un Dio, ma fatto da;uomini su uomini;(l' orrore, vedi 1945).;pl;thematic_target;no;distractor;_
tornanti su tornanti;yes;su;tornante;fango;Si viaggia tra sassi e massi, guadi e fango,;tornanti su tornanti;", si sale dai 3000 ai quasi 5000 metri in un attimo; gli spazi gradualmente si allargano, sono quasi in cima, fa freddo, ha nevicato da poco.";pl;_;_;greater_plurality/accumulation;nominal
volta a volta;no;a;volta;a;Fare un bilancio non è facile: l'Istituto si è proposto iniziative che a;volta a volta;stimolino altri ricercatori alla conoscenza e allo studio del pensiero e dell'opera di Paolo VI.;sg;PNPN;yes;distractor;_
TV su TV;no;su;TV;diretta;Tutta la cerimonia finale verrá trasmessa in diretta;TV su TV;3 dalle 18.40 alle 20.15 e su TV 1 e TV 2 dalle 19.30 alle 20.00.;sg;proper_name_inglobation;no;distractor;_
libri su libri;yes;su;libro;sfornare;Mi domandavo, con curiosità maliziosa: vediamo fin dove oserà spingersi questo giornalista che sforna;libri su libri;!;pl;_;_;greater_plurality/accumulation;nominal
punto a punto;no;a;punto;da;Al contrario nel Tipo C, dove il pino domestico è stato seminato in maniera andante e a integrazione di nuclei di latifoglie preesistenti, con conseguente maggiore variabilità da;punto a punto;.;sg;PNPN;yes;distractor;_
bicchiere su bicchiere;yes;su;bicchiere;sommare;Poco sveglio da giovane, invecchiando aveva peggiorato e al calare del sole il vino che s'era bevuto durante il giorno, sommandosi;bicchiere su bicchiere;, lo riduceva ad appisolarsi accantoal fuoco d'inverno o sotto l'albero del cortile al tempo della buona stagione.;sg;_;_;succession/iteration/distributivity;modifier
porta a porta;yes;a;porta;condurre;"Un altro vantaggio per i broker è che i potenziali clienti ""visitano"" l'immobile online, liberando il professionista dall'onere di condurre";porta a porta;gli acquirenti interessati.;sg;_;_;succession/iteration/distributivity;modifier
porta a porta;yes;a;porta;firma;Scompariranno le sue leggendarie ma costose campagne per il finanziamento, durante le quali migliaia di militanti stipendiati raccoglievano soldi e firme;porta a porta;.;sg;_;_;succession/iteration/distributivity;modifier
guancia a guancia;yes;a;guancia;quasi;Lei e Nina sono ancora sotto la coperta, sedute vicine, quasi;guancia a guancia;, ma non si guardano.;sg;_;_;juxtaposition/contact;modifier
4 su 4;no;su;4;con;Qualche spunto solo quando Messina gli ha mandato sopra Morlende. </s><s> Chiude la gara con 6 su 13 al tiro con;4 su 4;nei liberi.;X;NumPNum;no;distractor;_
dorso a dorso;yes;a;dorso;che;Avvicinandosi si trovano - e si vedono da vicino - centinaia di bellissimi uccelli che,;dorso a dorso;, sembrano coprire l'acqua con un manto rosato.;sg;_;_;juxtaposition/contact;modifier
parete a parete;no;a;parete;da;Un'attenzione particolare merita il letto, realizzato su disegno del progettista: è un piano in legno (pioppo bordato in massello di rovere) agganciato a una putrella di ferro che corre da;parete a parete;.;sg;PNPN;yes;distractor;_
colpo su colpo;yes;su;colpo;reagire;Aspetto solo una parola per reagire;colpo su colpo;al primo segnale.;sg;_;_;succession/iteration/distributivity;modifier
uomo a uomo;no;a;uomo;ovunque;" centinaia di cittadini sono stati contagiati quando era chiaro che il patogeno si trasmetteva da""";uomo a uomo;, ma era vietato dirlo per preservare la stabilità.;sg;PNPN;yes;distractor;_
porta a porta;yes;a;porta;campagna;Un libro del 2015 aveva riassunto in questa tabella il rapporto costi POTH benefici delle varie tattiche da mettere in moto per portare qualcuno a votare, dalla campagna;porta a porta;(31 dollari per voto) alle telefonate dei volontari (35 dollari per voto).;sg;_;_;succession/iteration/distributivity;modifier
piani su piani;yes;su;piano;elaborare;Da mesi gli stati maggiori stanno elaborando;piani su piani;, ipotizzando un vertice italiano che gestirà uno schieramento di forze europee.;pl;_;_;greater_plurality/accumulation;nominal
pile su pile;yes;su;pile;me;Io volavo alle casse, Pabs disimballava, registrava, smistava e scaricava sudi me;pile su pile;di CD a velocità supersonica.;pl;_;_;greater_plurality/accumulation;nominal
punto a punto;no;a;punto;da;Dev'essere ristudiato il Radiobus «classico», ché la formula da;punto a punto;.;sg;PNPN;yes;distractor;_
guancia a guancia;yes;a;guancia;ballare;E ha una canzone del cuore, la canzone che ascoltava da govane quando ballava;guancia a guancia;con Filippo di Grecia, suo futuro sposo, ora Filippo d'Edimburgo e Principe consorte.;sg;_;_;juxtaposition/contact;modifier
volta a volta;no;a;volta;eccezione;" e questo vale perfino per quelli che non l'hanno mai conosciuto se non attraverso i film: e si sono a""";volta a volta;"identificati nella sposina ingenua di Lo sceicco bianco, nei Vitelloni annoiati e smargiassi, in Gelsomina vittima e Zampanò carnefice, nei bidonisti che coltivano l'arte di arrangiarsi, in Marcello che galleggia sull'onda dolcevitaiola o si confessa homo perplexus in 8 1\2; e in tantissimi altri personaggi.";sg;PNPN;yes;distractor;_
sasso su sasso;no;su;sasso;di;Il signor Sandro scuote la testa, si infila le mani in tasca e si piega a guardare la pietra, il disegno fatto a colpi di;sasso su sasso;, poi i piedi, le mani, gli occhi tondi lassù che rispondono allo sguardo.;sg;thematic_target;no;distractor;_
bocca a bocca;yes;a;bocca;respirazione;E il protagonista ha imparato a fare la respirazione;bocca a bocca;leggendo le riviste gettate nella spazzatura.;sg;_;_;juxtaposition/contact;modifier
luogo a luogo;no;a;luogo;da;Nel mondo reale i diritti naturali sono molto diversi da;luogo a luogo;e nelle varie fasi storiche.;sg;PNPN;yes;distractor;_
lettere su lettere;yes;su;lettera;inviare;L'opera è dedicata a un cardinale a cui Gioseffo invia;lettere su lettere;"nella speranza sempre disattesa d'una qualche risposta, ma un'accidia fatta di ""scontentezza vaga"" non consente allo speziale di condurre avanti la stesura del testo, anche perché una serie di eventi incresciosi verranno a turbare la quiete necessaria a tale compito.";pl;_;_;greater_plurality/accumulation;nominal
