NPN;construction;preposition;noun;pre_lemma;context_pre;costr;context_post;number_of_noun;Type;other_cxn;meaning;syntactic_function
porta a porta;yes;a;porta;bigiotteria;Profumino invadente di tabaccaio di lusso spacciato per raro oggetto di profumeria, qui la tirchieria è di casa, roba che ti intontisce l'olfatto, venditrice di bigiotteria;porta a porta;o casalinga con marito assente, fa tante telefonate ad amiche che fanno anche loro tante telefonate.;sg;_;_;succession/iteration/distributivity;modifier
protesi a protesi;no;a;protesi;aggiungere;I suoi erano repulisti al contrario: invece di ridurre all'osso, aggiungeva;protesi a protesi;.;sg;verbal;yes;distractor;_
fili su fili;yes;su;fili;potenzialità;"O meglio c'era una che un giorno ""avrebbe potuto"" essere lei: se da un lato obbediva alla vocazione, se svolgeva le potenzialità,";fili su fili;.;pl;_;_;greater_plurality/accumulation;nominal
egemonia ad egemonia;no;a;egemonia;aggiungere;Perché l'Ulivo ha avuto l'abilità - se possiamo considerarla un'abilità - di aggiungere;egemonia ad egemonia;.;sg;verbal;yes;distractor;_
porta a porta;yes;a;porta;venditore;Dopo anni passati prima come venditore;porta a porta;di assicurazioni e di calzature per donne, poi come comparsa in film e serie televisive dimenticabili come Il ritorno dei pomodori assassini e Baby talk, questo è il suo momento.;sg;_;_;succession/iteration/distributivity;modifier
porta a porta;yes;a;porta;Spagna;Nella prefazione ho accennato al piccolo libro Dame al Macao di Alberto Arduini, raffinatissimo antiquario romano con negozio prima in via Frattina, poi in piazza di Spagna;porta a porta;con la KeatsShelley Memorial.;sg;_;_;succession/iteration/distributivity;modifier
colpo su colpo;yes;su;colpo;ribattere;Il Lecce metteva subito sotto pressione il Toro che non si lasciava intimidire e ribatteva;colpo su colpo;.;sg;_;_;succession/iteration/distributivity;modifier
goccia a goccia ;no;a;goccia;a;Per trasformare la nebbia in una sorgente naturale di acqua, bisogna distillarla a;goccia a goccia;come il più prezioso dei whisky.;sg;PNPN;yes;distractor;_
volta a volta;yes;a;volta;dare;Per tutto il tragitto padre Boni non aveva aperto bocca se non per dargli,;volta a volta;, le indicazioni per l'itinerario da seguire.;sg;_;_;succession/iteration/distributivity;modifier
brano a brano;no;a;brano;a;In questo fango si genererà poi una quantità di piccole mosche e di altri animaletti che si raggomitoleranno nel mio sangue e mi divoreranno a;brano a brano;.;sg;PNPN;yes;distractor;_
goccia a goccia ;no;a;goccia;a;Più che un ritorno al passato, dunque, occorrerebbero interventi tecnologici adatti a un pianeta globale: ad esempio stimolando investimenti in efficienza attraverso l'irrigazione a;goccia a goccia;in agricoltura, tecnologia che evita sprechi, o il riutilizzo delle acque reflue nell'industria.;sg;PNPN;yes;distractor;_
cambiali su cambiali;yes;su;cambiale;firmare;Mario viveva lì da tanto tempo, aveva comprato quell'appartamento firmando;cambiali su cambiali;per anni, perchè doveva essere così, il matrimonio si sa impone questo tipo di sacrifici.;pl;_;_;greater_plurality/accumulation;nominal
volta a volta;yes;a;volta;TV;Ma quella virtualità che connota la realtà televisiva e rende la tv,;volta a volta;, spettacolare, ingannatrice, sedativa, omologante, esorcizzante, evasiva, legittimante, vicaria, è anche dovuta alla nostra virtualità crescente.;sg;_;_;succession/iteration/distributivity;modifier
porta a porta;yes;a;porta;condurre;"Un altro vantaggio per i broker è che i potenziali clienti ""visitano"" l'immobile online, liberando il professionista dall'onere di condurre";porta a porta;gli acquirenti interessati.;sg;_;_;succession/iteration/distributivity;modifier
palmo a palmo;yes;a;palmo;esplorare;Non venendo, l'italiano aveva agito in modo tanto ragionevole quanto scortese, non si sarebbe visto nulla, ci si sarebbe dovuti accontentare di esplorare;palmo a palmo;alcuni quadri con la lampadina tascabile di K.;sg;_;_;succession/iteration/distributivity;modifier
balle a balle;no;a;balle;aggiungere;Concluse che forse era meglio non aggiungere;balle a balle;.;sg;verbal;yes;distractor;_
palmo a palmo;yes;a;palmo;ripassare;Se già non lo si è fatto sarebbe bene ripassare;palmo a palmo;i bordi misti e le aiuole per ripulire il terreno dai cespi marcescenti o secchi.;sg;_;_;succession/iteration/distributivity;modifier
fotogramma a fotogramma;yes;a;fotogramma;costruire;Una mitologia personale, insomma, costruita;fotogramma a fotogramma;"ritagliandomi di netto ciò che è necessario per un Olimpo fatto in casa: un pugno di tragedie sofoclee, uomini ed eroi, martiri casuali, omicidi senza fonte e senza fine; oppure: confondendo l'universo condiviso con gli album personali: eccola una foto di mio padre tale e quale a Satta Flores in C'eravamo tanto amati.";sg;_;_;succession/iteration/distributivity;modifier
dorso a dorso;yes;a;dorso;impilare;"Vittorio scosta qualche altra grande tela appoggiata alla parete, giusto abbastanza per farmi dare un'occhiata; me ne fa vedere alcune di quelle più piccole, impilate";dorso a dorso;sul tavolo di legno grezzo.;sg;_;_;juxtaposition/contact;modifier
porta a porta;yes;a;porta;raccolta;Anziché sostenere la lobby dell'incenerimento Orlando promuova la riduzione dei rifiuti, la raccolta;porta a porta;(abolendo la Tares come chiesto dal M5S con proposte parlamentari), costruzioni di centri riciclo e compostaggio, sistemi alternativi all'incenerimento e alla discarica, in linea con l'Europa!;sg;_;_;succession/iteration/distributivity;modifier
opere su opere;yes;su;opera;scrivere;Gianfrancesco Malipiero studiava e stampava Vivaldi e Monteverdi, mentre di suo scriveva;opere su opere;, grandi e piccole, sole e cicliche, serie e comiche, tra Orfeo e Goldoni muovendosi con la consapevolezza dell'uomo di cultura.;pl;_;_;greater_plurality/accumulation;nominal
episodio a episodio;no;a;episodio;saldare;Lo avrebbe appreso a pezzi e bocconi quando a Tiziano Sclavi andava di mettere un poco d'ordine nella sua opera ribollente e provava a saldare;episodio a episodio;, ma troppo presto finiva per interrompere la ricerca, sollecitato da un'altra tentazione.;sg;verbal;yes;distractor;_
splendore a splendore;no;a;splendore;aggiungere;Ma queste fantasie schliemanniane non fanno altro che aggiungere;splendore a splendore;.;sg;verbal;yes;distractor;_
menzogne a menzogne;no;a;menzogne;aggiungere;In fondo conosceva il giovane da sempre e ben volentieri lo avrebbe accolto come genero, ma che la finisse di aggiungere;menzogne a menzogne;, era giovane e tutti avevano capito e perdonato la sua fuga d'amore.;sg;verbal;yes;distractor;_
porta a porta;yes;a;porta;vendita;Alla quale vanno aggiunti ancora un sindacato (Domina: organizzazione dei datori di lavoro domestico), un patronato (Informafamiglia), una società (Rete - Rete) per vendite;porta a porta;.;sg;_;_;succession/iteration/distributivity;modifier
mattone a mattone;no;a;mattone;da;n questi casi l'intensità dell'urto non era determinante, bastava scuotere l'edificio una sola volta e le vibrazioni si propagavano con incredibile leggerezza e rapidità da;mattone a mattone;.;sg;PNPN;yes;distractor;_
caso a caso;no;a;caso;da;Dato che le situazioni possono essere molto diverse da;caso a caso;, si consiglia di chiedere indicazioni sulla prassi per il disconoscimento al Consultorio ad un avvocato, al Tribunale per i minorenni o al Servizio Sociale del proprio comune.;sg;PNPN;yes;distractor;_
borsa a borsa;no;a;borsa;da;I biglietti di carta spessa, antica, resa da un indefinibile numero di passaggi da mano a mano, da;borsa a borsa;, così morbida e frusciante da sembrare stoffa, mandano un odore forte, come di pelle conciata.;sg;PNPN;yes;distractor;_
bocca a bocca;yes;a;bocca;respirazione;Se non avesse ripreso a respirare, doveva procedere con la respirazione;bocca a bocca;.;sg;_;_;juxtaposition/contact;modifier
colpo su colpo;yes;su;colpo;rispondere;Più adulto e più esperto di lui, era sempre riuscito a tenergli testa, a rispondere;colpo su colpo;o addirittura a prevenire le sue mosse.;sg;_;_;succession/iteration/distributivity;modifier
miracolo a miracolo;no;a;miracolo;Gerusalemme;" perciò essa non si arresta più finché non è giunta sulla stalla, fino a quando non ha aggiunto""";miracolo a miracolo;: il miracolo dell'adorazione dei Magi al miracolo della stella che guida i Magi.;sg;verbal;yes;distractor;_
grado a grado;no;a;grado;a;Fu scritto in un'epoca d'infermità e di vanità intellettuale, quando io allettato dalle mollezze dell'ozio andavo perdendo a;grado a grado;tutte le forze accumulate in parecchi anni di studio e non curante volgevo le spalle ai saggi amici che venivano a gridarmi: - o rinnovarsi, o morire!;sg;PNPN;yes;distractor;_
bocca a bocca;no;a;bocca;a;Juanita si precipitò a praticarle la respirazione a;bocca a bocca;, ma l'altra, quando si riprese, per poco non la denunciò per atti osceni.;sg;PNPN;yes;distractor;_
bocca a bocca;no;a;bocca;da;Come si diffondono, ingigantendosi nel passare da;bocca a bocca;o da scritto a scritto?;sg;PNPN;yes;distractor;_
goccia a goccia ;no;a;goccia;a;Diventai come un recipiente che venga riempito a;goccia a goccia;.;sg;PNPN;yes;distractor;_
porta a porta;yes;a;porta;firma;Scompariranno le sue leggendarie ma costose campagne per il finanziamento, durante le quali migliaia di militanti stipendiati raccoglievano soldi e firme;porta a porta;.;sg;_;_;succession/iteration/distributivity;modifier
volta a volta;yes;a;volta;prepuzio;Di lì, stringendo di nuovo con forza, la mano ripartiva verso il basso dell'asta, tendendo il prepuzio,;volta a volta;strangolando la carne tumescente o allentando la stretta, sfiorando appena la mucosa o molestandola, massaggiando con grandi movimenti del polso oppure tormentando con brevi colpi senza pietà... Il glande, raddoppiato di volume, si infuocava e sembrava ad ogni istante sempre più prossimo a esplodere.;sg;_;_;succession/iteration/distributivity;modifier
balcone a balcone;no;a;balcone;da;La sua ultima creatura erano stati i bastoni per reggere i calici dello spumante con cui aveva allietato i brindisi da;balcone a balcone;, ma ormai era già diventata la penultima, soppiantata da quel telefono di cui smaniavo di sperimentare le potenzialità.;sg;PNPN;yes;distractor;_
azienda ad azienda;no;a;azienda;da;Il rapporto prezzo utili varia significativamente da settore a settore e, spesso, da;azienda ad azienda;, in quanto ogni azienda si caratterizza con proprie condizioni di rischio.;sg;PNPN;yes;distractor;_
storia a storia;no;a;storia;da;Il che non è inverosimile perché anzitutto gli autori di fantascienza si leggono tra loro, alcuni temi migrano da;storia a storia;", e si è creato come un canone parallelo a quello della scienza ufficiale; poi perché i romanzieri non sviluppano le loro finzioni in opposizione alle soluzioni della scienza, ma dalla scienza traggono le conseguenze più estreme; e infine perché alcune delle idee ventilate dalla fantascienza (da Verne in avanti) sono poi diventate realtà scientifiche.";sg;PNPN;yes;distractor;_
categoria a categoria;no;a;categoria;da;Negli ultimi anni il fatturato dei professionisti - spiega Gaetano Stella, presidente di Confprofessioni - è calato da;categoria a categoria;dal 20 al 40 per cento.;sg;PNPN;yes;distractor;_
appezzamento ad appezzamento;no;a;appezzamento;da;Anche il numero di vermi presenti nel suolo per metro quadrato (nei primi 20 cm di profondità), pur variando da;appezzamento ad appezzamento;, non ha mostrato differenze significative.;sg;PNPN;yes;distractor;_
palmo a palmo;yes;a;palmo;esplorare;A piedi ci rechiamo quindi alla scoperta della parte più antica dell'abitato, nella quale si trova il poderoso castello aragonese, che esploriamo;palmo a palmo;, fra interessanti ambienti di epoca medioevale e vasti panorami sui paesaggi circostanti.;sg;_;_;succession/iteration/distributivity;modifier
porta a porta;yes;a;porta;quotidiano;La sua storia di origini americane risale agli Anni 40 quando fu adottata dai ragazzi che consegnavano i quotidiani;porta a porta;.;sg;_;_;succession/iteration/distributivity;modifier
superficie a superficie;no;a;superficie;da;Per il Novecento, il record di vicinanza è già alle nostre spalle e fu stabilito il 4 gennaio 1912, quando tra la Terra e la Luna, da;superficie a superficie;, intercorsero 348.259 chilometri (e 356.375 da centro a centro dei due corpi celesti).;sg;PNPN;yes;distractor;_
colpo su colpo;yes;su;colpo;ribattere;Che non consiste nel ribattere;colpo su colpo;alle battute dell'antipolitica nei salotti televisivi, ma nel rispondere alle domande della società.;sg;_;_;succession/iteration/distributivity;modifier
colpo su colpo;yes;su;colpo;Masina;"Tutto improvvisamente, intorno a quel ripiano, era tornato coerente con il tradizionale menage familiare della famiglia Masina; Manlio col suo slang condito di parolacce, Giorgio col suo rispondere";colpo su colpo;a tutte le provocazioni esterne, Cinzia con la sua puntuale abilità di organizzatrice familiare, Valentina con la sua svogliata partecipazione alla conduzione domestica e Noel con la sua serena e coccolata presenza, tanto cara a tutti.;sg;_;_;succession/iteration/distributivity;modifier
volta a volta;yes;a;volta;pensare;Quanto al corpo, nonostante tanta tradizione del pensiero occidentale (e talvolta, del migliore, come quello di Platone dello stupendo Fedone) sia stata avvezza a pensarlo,;volta a volta;, come tomba dell'anima o come semplice strumento dell'anima stessa, è pur vero che altre tradizioni, ad esempio orientali, si sono profuse a sottolineare che il corpo è come un tempio, in cui l'esperienza multiforme del mondo celebra, istante dopo istante, i propri riti.;sg;_;_;succession/iteration/distributivity;modifier
colpo su colpo;yes;su;colpo;attacco;Ma Rambo non ci sta, Rambo combatte, lui resta in forma e risponde all'attacco;colpo su colpo;, prendendo la natura a calci nel culo e spaccando il muso alla società.;sg;_;_;succession/iteration/distributivity;modifier
certificati su certificati;yes;su;certificato;permesso;Il secondo problema è quello del rispetto delle norme: per gestire correttamente una discoteca sarebbero necessari permessi su permessi,;certificati su certificati;.;pl;_;_;greater_plurality/accumulation;nominal
storielle su storielle;yes;su;storiella;raccontare;Lungo il percorso in auto per far passare quelle lunghe ore mi prodigavo a raccontare;storielle su storielle;.;pl;_;_;greater_plurality/accumulation;nominal
lettere su lettere;yes;su;lettera;inviare;L'opera è dedicata a un cardinale a cui Gioseffo invia;lettere su lettere;"nella speranza sempre disattesa d'una qualche risposta, ma un'accidia fatta di ""scontentezza vaga"" non consente allo speziale di condurre avanti la stesura del testo, anche perché una serie di eventi incresciosi verranno a turbare la quiete necessaria a tale compito.";pl;_;_;greater_plurality/accumulation;nominal
record su record;yes;su;record;macinare;La ragione è semplice: le principali Borse mondiali (salvo Tokio) macinano;record su record;, la capitalizzazione dei grandi gruppi quotati si espande oltre ogni previsione, i ritorni sull'investimento per chi ha puntato su di loro un anno fa battono tutte le alternative.;sg/pl;_;_;greater_plurality/accumulation;nominal
viso a viso;yes;a;viso;bene;E poi magari la madre va via piangendo a tutto spiano ma almeno l'ha abbracciata, ha saputo che sta bene:;viso a viso;.;sg;_;_;juxtaposition/contact;modifier
porta a porta;no;a;porta;da;Mangiarono una sola castagna a testa e ne vendettero il rimanente da;porta a porta;.;sg;PNPN;yes;distractor;_
bocca a bocca;yes;a;bocca;respirazione;In attesa dell'arrivo dell'ambulanza gli hanno praticato il massaggio cardiaco e la respirazione;bocca a bocca;ma tutto è stato inutiule.;sg;_;_;juxtaposition/contact;modifier
odio su odio;yes;su;odio;conseguenza;La logica pretende di farla da padrona e queste sono le inevitabili conseguenze:;odio su odio;.;sg;_;_;greater_plurality/accumulation;nominal
colpo su colpo;yes;su;colpo;restituire;Proprio la dote che l'aveva sorretta durante il primo tempo, consentendole di reggere il ritmo - non forsennato - degli avversari ai quali aveva restituito;colpo su colpo;.;sg;_;_;greater_plurality/accumulation;nominal
trauma a trauma;no;a;trauma;aggiungere;Racconta un educatore che una volta questo compito veniva delegato, quando andava bene, alle prostitute: una soluzione volonterosa ma sbagliata, che aggiungeva;trauma a trauma;al portatore di handicap.;sg;verbal;yes;distractor;_
palmo a palmo;yes;a;palmo;praticamente;Quelli dell'NGA disponevano di migliaia di immagini scattate dai droni e dai satelliti, e conoscevano praticamente;palmo a palmo;l'intera area esterna del compound.;sg;_;_;succession/iteration/distributivity;modifier
saponi su saponi;yes;su;sapone;svanire;Mi lavo e mi rilavo, svaniscono;saponi su saponi;, asciugamani e salviette si impregnano d'acqua.;pl;_;_;greater_plurality/accumulation;nominal
volta a volta;no;a;volta;a;Insomma, da buon notaio, era come se protocollasse diverse deposizioni, testimonianze o confessioni da fornire poi agli avvocati per difendere cause a;volta a volta;diverse - talché aveva iniziato a designare questi suoi appunti come i Protocolli - e si guardava bene di mostrare tutto a padre Bergamaschi, perché per lui filtrava solo i testi di carattere più spiccatamente religioso.;sg;PNPN;yes;distractor;_
identità a identità;no;a;identità;luogo;Nella risposta destinata a fornire l ' alibi si contrappone luogo a luogo ,;identità a identità;.;sg;verbal;yes;distractor;_
zolla a zolla;yes;a;zolla;conoscere;Per cui nessuno ci pensa al povero animale che bazzica senza meta nel ben delimitato territorio, che ormai conosce;zolla a zolla;.;sg;_;_;succession/iteration/distributivity;modifier
palmo a palmo;no;a;palmo;a;Will e Nancy setacciarono di nuovo l'appartamento a;palmo a palmo;"; poi, mentre lei restava con Clive, Will perlustrò il corridoio e la tromba delle scale.";sg;PNPN;yes;distractor;_
colpo su colpo;yes;su;colpo;rispondere;Entrambe le compagini si sono affrontate a viso aperto rispondendo;colpo su colpo;a qualasisi iniziativa opposta, esibendo in certi frangenti anche giocate di buona tecnica.;sg;_;_;succession/iteration/distributivity;modifier
prove su prove;yes;su;prova;ormai;In Europa sta invece accadendo questo: nonostante ci siano ormai;prove su prove;che la strada che si è intrapresa è totalmente sbagliata ed andrebbe come minimo azzerata e ripensata, chiunque mette in discussione il sogno POTH progetto europeo è un odioso populista, reazionario, fascista.;pl;_;_;greater_plurality/accumulation;nominal
bocca a bocca;yes;a;bocca;artificiale;L'altro agente praticò a Sullivan la respirazione artificiale;bocca a bocca;.;sg;_;_;juxtaposition/contact;modifier
stagione su stagione;yes;su;stagione;colore;Vincenzo dipinse la collinetta per quasi due d'anni, colore su colore,;stagione su stagione;.;sg;_;_;succession/iteration/distributivity;modifier
cellula a cellula;no;a;cellula;da;Tra tutte le teorie, la più interessante è sembrata essere quella che indica la presenza di un'alterazione a carico delle sostanze deputate al trasporto dell'impulso nervoso da;cellula a cellula;, i cosiddetti neurotrasmettitori (noradrenalina, dopamina, serotonina, e Gaba).;sg;PNPN;yes;distractor;_
gomito a gomito;no;a;gomito;a;Nelle strade affollate, sacerdoti dalle vesti risplendenti passeggiavano tranquilli a;gomito a gomito;"con mercanti flemmatici e mendicanti cenciosi; una spinta o un urtone d'un villano distratto - che in qualunque altro giorno sarebbe stato punito con una buona frustata oggi procurava all'incauto soltanto un'occhiata sprezzante.";sg;PNPN;yes;distractor;_
porta a porta;yes;a;porta;venditore;L'Ambiente oggi cerca 20 distributori (uno per ogni regione) più venditori;porta a porta;in tutta Italia.;sg;_;_;succession/iteration/distributivity;modifier
grado a grado;no;a;grado;a;Però ricordatevi che questa malattia non si guarisce subito, ma a;grado a grado;.;sg;PNPN;yes;distractor;_
cazzate su cazzate;yes;su;cazzata;frullare;Mi aspetto che si metta a ridere come un pazzo e che poi ricominci a frullare;cazzate su cazzate;.;pl;_;_;greater_plurality/accumulation;nominal
bocca a bocca;yes;a;bocca;respirazione;Questa posizione è indispensabile primadi praticare la respirazione;bocca a bocca;, altrimenti l'aria insufflata rischia di non raggiungere i polmoni.;sg;_;_;juxtaposition/contact;modifier
volta a volta;yes;a;volta;soluzione;D'altro canto, non sono soltanto gli interventi normativi, tanto meno quelli che continuino a essere adottati, prima o a prescindere da effettive applicazioni delle soluzioni;volta a volta;accolte, a poter dare risposta alle necessità dell'amministrazione del settore.;sg;_;_;succession/iteration/distributivity;modifier
colpo su colpo;yes;su;colpo;rintuzzare;Ma Giuseppe Stefanel, Bepi per gli amici, 44 anni, presidente e amministratore del gruppo di Ponte di Piave, non ci sta a passare per vittima sacrificale: rintuzza;colpo su colpo;gli attacchi, e annuncia che il secondo semestre '96 si chiuderà con un piccolo utile, dopo che al giro di boa dei primi sei mesi dell'anno il passivo segnava 19 miliardi.;sg;_;_;succession/iteration/distributivity;modifier
colpo su colpo;yes;su;colpo;rispondere;Jack Hyde mi fa domande spiazzanti e intelligenti, ma io non mi faccio cogliere impreparata: rispondo;colpo su colpo;e, quando discutiamo delle mie letture preferite, credo di cavarmela bene.;sg;_;_;succession/iteration/distributivity;modifier
punto a punto;no;a;punto;da;Tra le singolarità c'è un agglomerato di linee di forza variamente incurvate da;punto a punto;.;sg;PNPN;yes;distractor;_
ritardi su ritardi;yes;su;ritardo;accumulare;E se il verboso cattivo accumula;ritardi su ritardi;nelle sue comunicazioni finali al buono, nei teatri d'una volta si gridava «e partite, cretini!»;pl;_;_;greater_plurality/accumulation;nominal
colpo su colpo;yes;su;colpo;restituire;La strada, però, con una durezza che si ripercoteva fino all'inguine, mi restituiva;colpo su colpo;.;sg;_;_;greater_plurality/accumulation;nominal
potere a potere;no;a;potere;sommare;"L'apertura verso l'elettronica può essere pensata nell'ambito di quelle endiadi ""Arte & Non Arte"", meglio ""Avventure & Cultura"", che sommano";potere a potere;, il fare concreto alla pulsionalità e all'intelligenza, la creatività all'ironia.;sg;verbal;yes;distractor;_
autore a autore;no;a;autore;da;Certo, ed è persino superfluo ricordarlo, l'orchestrazione del dialogato conosce modulazioni plurime, variando da;autore a autore;, da opera a opera.;sg;PNPN;yes;distractor;_
bocca a bocca;yes;a;bocca;respirazione;Se l'infortunato presenta delle fratture alla mandibola o alla mascella, si può procedere come nelcaso della respirazione;bocca a bocca;con la differenza che la bocca viene tenuta chiusa per evitare che fuoriesca l'aria insufflata, e le insufflazioni vanno fatte attraverso il naso.;sg;_;_;juxtaposition/contact;modifier
settimane su settimane;yes;su;settimana;di;Ciò può servirti solo ad andare in fondo alla questione del dolore, che è più o meno questo: covare nel corso di;settimane su settimane;un'idea o un'azione risolutiva, frutto di fatica fisica e coraggio imposto, e sentirtela smontare in pochi secondi da una risata distratta.;pl;_;_;greater_plurality/accumulation;nominal
testa a testa;no;a;testa;a;I primi e gli ultimi della scuola europea restano a;testa a testa;anche al terzo problema sull'intricata questione delle proporzioni fisiche di Paolo, Pietro e Maria, risolta brillantemente come un quiz enigmistico.;sg;PNPN;yes;distractor;_
corna su corna;yes;su;corna;mettere;Invece toccò al capo, ad Agamennone, uomo borioso e fatuo, a cui Clitennestra da tempo metteva;corna su corna;perché ormai impotente.;pl;_;_;greater_plurality/accumulation;nominal
punto a punto;no;a;punto;da;Stanno, invece, in un continuum dove tutte le interazioni si propagano da;punto a punto;.;sg;PNPN;yes;distractor;_
bocca a bocca;yes;a;bocca;respirazione;Alcune tecniche di rianimazione, come per esempio la respirazione;bocca a bocca;, possono risultare pericolose per il soccorritore: in questo modo si possono trasmettere molte malattie, soprattutto se l'infortunato ha delle perdite di sangue.;sg;_;_;juxtaposition/contact;modifier
casi su casi;yes;su;caso;risolvere;I laboratori forensi dell'Oklahoma, come di molti altri Stati, soffrivano di una cronica mancanza di fondi e di personale, a fronte di enormi pressioni perché risolvessero;casi su casi;.;pl;_;_;greater_plurality/accumulation;nominal
azienda ad azienda;no;a;azienda;da;La modularità delle ante varia da;azienda ad azienda;ma, in generale, il battente singolo è largo cm 50-70.;sg;PNPN;yes;distractor;_
punto su punto;no;su;punto;data;Punto croce ricamo una data;punto su punto; giù indico traccia di trama merletto finito.;sg;NsuNgiù;yes;distractor;_
bocca a bocca;yes;a;bocca;alimentazione;Il significato erotico del bacio deriverebbe dall'alimentazione;bocca a bocca;dell'infante.;sg;_;_;juxtaposition/contact;modifier
cuore a cuore;yes;a;cuore;contatto;E poi ci fu la marsupioterapia, il primo contatto;cuore a cuore;.;sg;_;_;juxtaposition/contact;modifier
banca a banca;no;a;banca;da;Per quest'ultimo servizio non c'è alcuna differenza tra tessera vecchia e tessera nuova: sono rimaste in vigore, infatti, le precedenti condizioni economiche, diverse da;banca a banca;, ma in genere gratuite per prelievi agli sportelli automatici del proprio istituto e tariffate (in media dalle 2500 alle 3000 lire) per prelievi in qualsiasi altra banca diversa dalla propria.;sg;PNPN;yes;distractor;_
