NPN;construction;preposition;noun;pre_lemma;context_pre;costr;context_post;number_of_noun;Type;other_cxn;meaning;syntactic_function
banca a banca;no;a;banca;da;Va ricordato che la tessera Pagobancomat - utilizzabile per i pagamenti presso i punti convenzionati - prevede un costo annuo variabile da;banca a banca;ma è esente da commissioni per operazione e da costi di registrazione scrittura.;sg;PNPN;yes;distractor;_
gomito a gomito;yes;a;gomito;essere;Queste cose non le ha mai dette neanche con me che siamo;gomito a gomito;da due anni e mezzo.;sg;_;_;juxtaposition/contact;modifier
goccia a goccia;yes;a;goccia;lentamente;Cominciò a scavare con la punta della spada finché vide affiorare lentamente,;goccia a goccia;, dell'acqua.;sg;_;_;succession/iteration/distributivity;modifier
campi su campi;yes;su;campo;spaziotempo;"Questi campi non vivono nello spaziotempo; vivono, per così dire, uno sull'altro:";campi su campi;.;pl;_;_;greater_plurality/accumulation;nominal
gomito a gomito;yes;a;gomito;spalla;Ci hanno divisi per evitare problemi, perquanto era possibile, vistoche si camminava tutto il giorno spalla a spalla,;gomito a gomito;, a passi diversi, ma alla stessa velocità, e quando vivi una situazione di fatica e scomodità come quella, con poco cibo e poca acqua e nessun posto dove ripararsi e molto freddo, invece, molto, molto freddo, be', i battibecchi e le risse sono sempre dietro l'angolo, in agguato, e gli accoltellamenti anche, quindi è meglio tenere separate le etnie ostili.;sg;_;_;juxtaposition/contact;modifier
aggettivo su aggettivo;yes;su;aggettivo;frase;"Tutto ""montato"" rase su frase,";aggettivo su aggettivo;, fino al crollo repentino della spaventevole magione.;sg;_;_;succession/iteration/distributivity;modifier
guancia a guancia;yes;a;guancia;ballo;Pensavo alla sua infanzia e alla sua adolescenza, ai divani ridotti a brandelli e ai materassi masticati, alle fantastiche passeggiate lungo l'Intracoastal e ai balli;guancia a guancia;con lo stereo a tutto volume.;sg;_;_;juxtaposition/contact;modifier
spalla a spalla;yes;a;spalla;lavorare;E al fatto che i due abbiano lavorato;spalla a spalla;per cinque anni alla V Commissione di Bilancio (il primo come funzionario e segretario, il secondo come presidente), prima che Cabras - figlio di Paolo, a lungo parlamentare della Dc - diventasse nel 2014 capo di gabinetto di Fabrizio Saccomanni al ministero dell'Economia.;sg;_;_;juxtaposition/contact;modifier
gomito a gomito;yes;a;gomito;sedere;L'unica cosa sopravvissuta, ma desolatamente annerita dal fumo, è la lunga serpentina di marmo in cui i viaggiatori si sedevano;gomito a gomito;per consumare un rapido pasto prima di sperdersi nella regione dei laghi a Est di New York o nelle innumerevoli cittadine incastonate lungo il fiume Hudson, dove la frenesia della città che non dorme mai, nonostante la breve distanza, sembra una cosa remota e incredibile.;sg;_;_;juxtaposition/contact;modifier
trauma a trauma;no;a;trauma;aggiungere;Racconta un educatore che una volta questo compito veniva delegato, quando andava bene, alle prostitute: una soluzione volonterosa ma sbagliata, che aggiungeva;trauma a trauma;al portatore di handicap.;sg;verbal;yes;distractor;_
gomito a gomito;yes;a;gomito;questo;E se bisognava affrontarlo - bisognava necessariamente affrontarlo - era di certo meglio farlo in gruppo, in questo;gomito a gomito;che ci saldava l'uno all'altro e che era, nell'imminenza del pericolo, come un ultimo rifugio.;sg;_;_;juxtaposition/contact;modifier
grado a grado;no;a;grado;a;Inoltre, la stretta relazione con MaleinaDeoris apprese tutto ciò lentamente, a;grado a grado;che la complessità della coscienza psichica umana, con le sue correnti chimiche e nervose, le si faceva più chiara - aveva in parte invertito, in Demira, il flusso delle correnti vitali.;sg;PNPN;yes;distractor;_
potere a potere;no;a;potere;sommare;"L'apertura verso l'elettronica può essere pensata nell'ambito di quelle endiadi ""Arte & Non Arte"", meglio ""Avventure & Cultura"", che sommano";potere a potere;, il fare concreto alla pulsionalità e all'intelligenza, la creatività all'ironia.;sg;verbal;yes;distractor;_
lettere su lettere;yes;su;lettera;scrivere;In quel periodo Intrieri scriveva;lettere su lettere;al Viminale, alla prefettura e al prefetto.;pl;_;_;greater_plurality/accumulation;nominal
anticorpo ad anticorpo;no;a;anticorpo;da;Questa zona della molecola differisce da;anticorpo ad anticorpo;, determina la specificità della molecola anticorpale e viene definita paratopo o idiotipo.;sg;PNPN;yes;distractor;_
spalla a spalla;yes;a;spalla;vedere;Al congresso di Torino, abbiamo visto;spalla a spalla;le seguenti sotto - parrocchie dei Ds: ulivisti puri, miglioristi superstiti, veltroniani, dalemiani, pontieri, sinistra tenera, sinistra dura, laburisti, cristianosociali, sinistra repubblicana, comunisti unitari e, dulcis in fundo, riformatori per l'Europa.;sg;_;_;juxtaposition/contact;modifier
generazioni su generazioni;yes;su;generazione;battezzare;Nei paesi in passato il parroco rimaneva nello stesso posto anche quaranta - cinquanta anni e battezzava;generazioni su generazioni;, oggi in una realtà in continuo cambiamento, questo fatto non è accettabile, pur riconoscendo che occorre un certo numero di anni per realizzare un progetto o per stabilire un rapporto profondo.;pl;_;_;greater_plurality/accumulation;nominal
palmo a palmo;yes;a;palmo;setacciare;Il litorale tra Ostia e Anzio viene setacciato;palmo a palmo;con i cani.;sg;_;_;succession/iteration/distributivity;modifier
azienda ad azienda;no;a;azienda;da;La modularità delle ante varia da;azienda ad azienda;ma, in generale, il battente singolo è largo cm 50-70.;sg;PNPN;yes;distractor;_
riunioni su riunioni;yes;su;riunione;fare;La situazione era diventata assurda: facevo;riunioni su riunioni;con colleghe e genitori sul modo di migliorare il rapporto educativo coi bambini, individuare le strategie per seguirli meglio... e intanto i miei erano soli.;pl;_;_;greater_plurality/accumulation;nominal
affetto a affetto;no;a;affetto;da;Diventiamo veramente gli epiteti che ci vengono spinti sotto il muso, i nomignoli, le dolci cime lanciate da;affetto a affetto;mentre tutto ondeggia e tra di noi c'è nebbia, quell'aria che si palpa e da noi nasce come da curve portuali, quell'aria dai calori ascellari, e noi diventiamo la cosa che sembriamo a chi ci dice cosa, quando quelle visioni mosse e volatili si fermano concrete e solide, fatte di materia comune, e si presentano come una esposizione da mercato, da bancarella.;sg;PNPN;yes;distractor;_
categoria a categoria;no;a;categoria;da;Analogamente può essere trasferito da categoria a categoria e da specialità a specialità il sottufficiale e il volontario in congedo della Marina militare, da ruolo a ruolo e da;categoria a categoria;il sottufficiale e il volontario in congedo dell'Aeronautica militare.;sg;PNPN;yes;distractor;_
spalla a spalla;yes;a;spalla;mentre;Questi pensieri mi agitavano mentre;spalla a spalla;con i miei compagni muti attendevo i colpi di fischietto degli ufficiali per superare il parapetto e inoltrarmi in quell'orribile scabro e tormentato deserto innanzia me.;sg;_;_;juxtaposition/contact;modifier
libri su libri;yes;su;libro;sfornare;Mi domandavo, con curiosità maliziosa: vediamo fin dove oserà spingersi questo giornalista che sforna;libri su libri;!;pl;_;_;greater_plurality/accumulation;nominal
bar a bar;no;a;bar;da;La cifra complessiva cambiava da;bar a bar;, ma erano tutti d'accordo che i ricorrenti avessero ottenuto circa cinque milioni di dollari.;sg;PNPN;yes;distractor;_
balcone a balcone;no;a;balcone;da;I miei abitano in un quartiere dove ancora le massaie comunicano da;balcone a balcone;.;sg;PNPN;yes;distractor;_
libro a libro;no;a;libro;da;Insomma, un autore che sapeva descrivere senza errori da;libro a libro;la pianta della casa di Wolfe, i cibi che mangiava, le diecimila orchidee che coltivava, specie per specie, non aveva mai pensato a tenere uno schedario generale (biograficamente attendibile) dei suoi personaggi?;sg;PNPN;yes;distractor;_
banca a banca;no;a;banca;da;Organizzazione di spostamento di capitale (conto) da;banca a banca;per porre sotto ricatto il sistema colpendolo dove più sanguina (I SOLDI).;sg;PNPN;yes;distractor;_
gomito a gomito;yes;a;gomito;fila;Di fronte al nemico si serrano i ranghi e le file;gomito a gomito;.;sg;_;_;juxtaposition/contact;modifier
spalla a spalla;yes;a;spalla;camminare;Qualunque cosa accadrà, siete nel palmo della stessa mano, e anziché tenere Dina fuori dai tuoi progetti migliori, dovreste camminare;spalla a spalla;finché il Cielo ve ne darà la possibilità.;sg;_;_;juxtaposition/contact;modifier
gomito a gomito;no;a;gomito;a;Così ci siamo attrezzati con un nostro ufficio in un palazzo accanto, dove lavorano a;gomito a gomito;giovani avvocati italiani, albanesi e americani.;sg;PNPN;yes;distractor;_
dichiarazioni su dichiarazioni;yes;su;dichiarazione;riunione;Da dieci giorni stiamo dicendo in tutte le sedi che bisognava intervenire: si è perduto tempo a discutere, a prendere contatti diplomatici, a fare riunioni su riunioni,;dichiarazioni su dichiarazioni;, mentre la tragedia albanese richiedeva interventi rapidi, decisi, organici, massicci.;pl;_;_;greater_plurality/accumulation;nominal
bellezza su bellezza;yes;su;bellezza;ammucchiare;Allora, per un po', scherzo con la bellezza, ammucchiando;bellezza su bellezza;, facendone qualcosa di schiacciante, quasi di indecente, come uno stupro.;sg;_;_;greater_plurality/accumulation;nominal
palmo a palmo;yes;a;palmo;ripassare;Se già non lo si è fatto sarebbe bene ripassare;palmo a palmo;i bordi misti e le aiuole per ripulire il terreno dai cespi marcescenti o secchi.;sg;_;_;succession/iteration/distributivity;modifier
palmo a palmo;yes;a;palmo;bosco;In questo modo, i vari eserciti impegnati nella ricerca del tesoro alchemico si sono visti costretti a perlustrare i boschi;palmo a palmo;, sprecando tutta la notte in una lunga serie di appostamenti e di perquisizioni.;sg;_;_;succession/iteration/distributivity;modifier
goccia a goccia;yes;a;goccia;parlare;Nei giorni a venire e nelle notti illuni e nelle notti quando una luna fulgidissima splendeva sopra la terra, il vecchio avrebbe continuato a parlargli, a parlargli,;goccia a goccia;, sassolino su sassolino, petalo dopo petalo.;sg;_;_;succession/iteration/distributivity;modifier
corpo a corpo;no;a;corpo;da;Sembrano interconnesse in una sfida infinita che si tramanda da;corpo a corpo;, da anima ad anima, da essere ad essere. ;sg;PNPN;yes;distractor;_
scandalo a scandalo;no;a;scandalo;aggiungere;"Per il verde Marco Boato ""il congresso Usa aggiunge";scandalo a scandalo;""", il guardasigilli Oliviero Diliberto è ""sbigottito"" per l'""ulteriore beffa"" e Grandi dei Ds chiede un'iniziativa del governo contro questo ""insulto alle vittime"".";sg;verbal;yes;distractor;_
miracolo a miracolo;no;a;miracolo;Gerusalemme;" perciò essa non si arresta più finché non è giunta sulla stalla, fino a quando non ha aggiunto""";miracolo a miracolo;: il miracolo dell'adorazione dei Magi al miracolo della stella che guida i Magi.;sg;verbal;yes;distractor;_
guancia a guancia;yes;a;guancia;quasi;Lei e Nina sono ancora sotto la coperta, sedute vicine, quasi;guancia a guancia;, ma non si guardano.;sg;_;_;juxtaposition/contact;modifier
palmo a palmo;no;a;palmo;a;Will e Nancy setacciarono di nuovo l'appartamento a;palmo a palmo;"; poi, mentre lei restava con Clive, Will perlustrò il corridoio e la tromba delle scale.";sg;PNPN;yes;distractor;_
testa a testa;yes;a;testa;quaderno;Giovanissime, con le treccine e gli occhialetti, stanno chine sui quaderni,;testa a testa;insieme ai loro studenti: quelli incapaci di tenere il passo della grande macchina alla conquista del pianeta.;sg;_;_;juxtaposition/contact;modifier
bocca a bocca;no;a;bocca;a;Sperava che saltasse fuori un veleno o una tossina, ma gli interessava anche sapere se Clive era positivo all'HIV, dato che gli aveva praticato la respirazione a;bocca a bocca;ed era entrato in contatto col suo sangue.;sg;PNPN;yes;distractor;_
prove su prove;yes;su;prova;lavoro;Inoltre la pratica di chiedere ai datori di lavoro;prove su prove;"dell'effettiva necessità del lavoro straniero rifletteva la resistenza ad accettare l'idea che esistesse una vera domanda di manodopera non ""autoctona"".";pl;_;_;greater_plurality/accumulation;nominal
spalla a spalla;yes;a;spalla;storpio;Fuori c'erano i fiorai profumati e i mendicanti storpi,;spalla a spalla;: e solo a guardarli s'allargava in me la confusione della vita.;sg;_;_;juxtaposition/contact;modifier
settimana a settimana;no;a;settimana;da;Si verifica volatilità durante l'anno da;settimana a settimana;finché i prezzi non iniziano a scendere sotto la media annuale verso la fine di agosto, quando i viaggiatori possono risparmiare il 42% o più rispetto al periodo più caro.;sg;PNPN;yes;distractor;_
gomito a gomito;yes;a;gomito;operare;Non esistono infine uffici: gli impiegati e le segretarie operano;gomito a gomito;"in ""open space"".";sg;_;_;juxtaposition/contact;modifier
grado a grado;no;a;grado;a;Il grande globo giallo - arancio salì - in alto, ancora più in alto - e rimase sospeso sul mare increspato, illuminando a;grado a grado;"i loro volti: Deoris, un'apparizione spettrale ritagliata nell'oscurità; Domaris, pallida sotto il cappuccio della veste color ghiaccio; Rajasta, una macchia luminosa accanto alla ringhiera; Riveda, un pilastro di tenebre stagliato contro il chiaro di luna.";sg;PNPN;yes;distractor;_
brano a brano;no;a;brano;a;Talora le passava per la testa una fuggevole meraviglia: che si possa esser trascinati così mentre si muore a;brano a brano;, in mezzo a tutti gli altri, e nessuno se ne accorge...;sg;PNPN;yes;distractor;_
campo a campo;no;a;campo;da;A Durazzo la voce si insegue da;campo a campo;, da casa a casa.;sg;PNPN;yes;distractor;_
gomito a gomito;yes;a;gomito;incatenare;Lavorare durante l'estate, tra giostre, montagne russe e castelli incantati,;gomito a gomito;con i personaggi delle fiabe e con migliaia di turisti, grandi e piccini.;sg;_;_;juxtaposition/contact;modifier
spalla a spalla;no;a;spalla;a;Nessuno osava spingersi avanti da solo, piuttosto qualcuno, nel serrare a;spalla a spalla;, veniva espulso indietro, gli esclusi formarono un doppio cordone che pressava il primo.;sg;PNPN;yes;distractor;_
porta a porta;no;a;porta;da;I plateali schiamazzi di Cesare Maldini, le urla scomposte di Marco Tardelli, così diverse e lontane da quelle del leggendario Bernabeu, hanno scandito l'inutile processione da;porta a porta;.;sg;PNPN;yes;distractor;_
architettura ad architettura;no;a;architettura;da;Come il set di istruzioni varia da;architettura ad architettura;, anche le regole sintattiche dell'assembly varieranno.;sg;PNPN;yes;distractor;_
ritardi su ritardi;yes;su;ritardo;più;Da allora, poco o nulla più:;ritardi su ritardi;da parte di BluTec nell'esecuzione dei piani, i lavoratori che protestano, Invitalia che ritira il finanziamento e chiede indietro i soldi.;pl;_;_;greater_plurality/accumulation;nominal
caso a caso;no;a;caso;da;Dato che le situazioni possono essere molto diverse da;caso a caso;, si consiglia di chiedere indicazioni sulla prassi per il disconoscimento al Consultorio ad un avvocato, al Tribunale per i minorenni o al Servizio Sociale del proprio comune.;sg;PNPN;yes;distractor;_
guancia a guancia;yes;a;guancia;altro;I loro visi si trovarono incollati l'uno all'altro,;guancia a guancia;.;sg;_;_;juxtaposition/contact;modifier
banca a banca;no;a;banca;da;Al di là della comodità, dal punto di vista economico la convenienza della domiciliazione varia però non solo da;banca a banca;ma anche e soprattutto a seconda del tipo di conto che si intrattiene con l'istituto.;sg;PNPN;yes;distractor;_
bocca a bocca;no;a;bocca;da;Come si diffondono, ingigantendosi nel passare da;bocca a bocca;o da scritto a scritto?;sg;PNPN;yes;distractor;_
ritardi su ritardi;yes;su;ritardo;accumulare;Bene il raddoppio Mortara, unica linea ancora a singolo binario in città, capacità limitata e treni affollati che accumulano;ritardi su ritardi;a causa degli incroci.;pl;_;_;greater_plurality/accumulation;nominal
punto a punto;no;a;punto;da;Il computer può trattare frasi che arrivino a un massimo di 1500 caratteri da;punto a punto;.;sg;PNPN;yes;distractor;_
pietra su pietra;yes;su;pietra;edificare;Alta tecnologia che non può fare amenodell'uomo: un po 'come il Duomo di Milano: un'opera collettiva, firmata dal popolo che l'ha edificato;pietra su pietra;.;sg;_;_;succession/iteration/distributivity;modifier
parole su parole;yes;su;parola;dare;E i giochini, i disegnetti a bordo pagina che sono sicuro lei fa mentre aspetta che il cervello elabori e le detti;parole su parole;"; perché non stampa anche quei disegnetti scarabocchiati per ingannare la mano che vorrebbe scrivere qualcosa in maniera autonoma?";pl;_;_;greater_plurality/accumulation;nominal
palmo a palmo;yes;a;palmo;frugare;I tre si sparpagliarono e cominciarono a frugare;palmo a palmo;il terreno.;sg;_;_;succession/iteration/distributivity;modifier
goccia a goccia ;no;a;goccia;a;Come nel riempire una caraffa a;goccia a goccia;, c'è finalmente una stilla che la fa traboccare, così in una sequela di atti gentili ce n'è infine uno che fa traboccare il cuore.;sg;PNPN;yes;distractor;_
ipotesi su ipotesi;yes;su;ipotesi;continuamente;Meno male che la scienza non pensa, ma fa continuamente;ipotesi su ipotesi;, che poi va a verificare diligentemente!;pl;_;_;greater_plurality/accumulation;nominal
palloni su palloni;yes;su;pallone;recuperare;Col passare dei minuti migliorano Peruzzi e Simic, nel centrocampo della Roma Assuncao recupera;palloni su palloni;che appoggia ai compagni senza strafare, ad avviare il motore giallorosso ci pensa Totti, che copre mezzo campo.;pl;_;_;greater_plurality/accumulation;nominal
porta a porta;no;a;porta;da;Per diversi mesi si è visto, alla Tv, un signore che, con la borsa della spesa, passa da;porta a porta;a farsi ringraziare per gli acquisti che ha fatto e a esortare a fare altrettanto.;sg;PNPN;yes;distractor;_
grado a grado;no;a;grado;a;A lungo Domaris rimase immobile davanti alla porta chiusa, mentre la pietà nei suoi occhi a;grado a grado;svaniva, sostituita dal timore.;sg;PNPN;yes;distractor;_
amici ad amici;no;a;amici;fratello;Riconosco i tanti cognomi della comunità, rivedo le loro storie, riunisco figli a genitori, fratelli a fratelli,;amici ad amici;"; ma la pietà di chi resta può essere sufficiente?";pl;verbal;yes;distractor;_
foglia a foglia;no;a;foglia;da;Liscio come uno specchio tanto che il vento non rimbalzava da;foglia a foglia;, ma vi scivolava sopra senza sussulti.;sg;PNPN;yes;distractor;_
gomito a gomito;yes;a;gomito;trovare;Ogni volta che il livello del fiume si abbassa e tutti gli alligatori si affollano nei punti più profondi, i rettili si trovano;gomito a gomito;e si mangiano allegramente tra loro.;sg;_;_;juxtaposition/contact;modifier
riunioni su riunioni;yes;su;riunione;svolgere;Non resta che aspettare: sempre dal municipio i bene informati fanno sapere che proprio in queste ore si stanno svolgendo;riunioni su riunioni;per risolvere la matassa e passare all'azione, ma sulla tempistica non si sbilancia nessuno.;pl;_;_;greater_plurality/accumulation;nominal
goccia a goccia ;no;a;goccia;a;Diventai come un recipiente che venga riempito a;goccia a goccia;.;sg;PNPN;yes;distractor;_
Parole su parole;yes;su;parola;un;ose fondamentali per la formazione del pensiero degli studenti suoi coetanei .  Parole su parole , in_forma_di versi , di articoli , di canzoni perché Evtuscenko sapeva che un;Parole su parole;, in forma di versi, di articoli, di canzoni perché Evtuscenko sapeva che un vecchio proverbio russo era sacrosanta verità: «Ciò che è stato scritto con la penna non si può rimuovere con un'accetta». ;pl;_;_;greater_plurality/accumulation;nominal
argomento ad argomento;no;a;argomento;da;Io credo che tale dipendenza sia molto variabile, da persona a persona e da;argomento ad argomento;: l'elaborazione simbolica può essere vantaggiosa oppure deleteria, a seconda delle circostanze e dell'oggetto.;sg;PNPN;yes;distractor;_
palmo a palmo;no;a;palmo;a;Ciò non è avvenuto: per cinque anni il centrosinistra ha combattuto a;palmo a palmo;"sul terreno della Rai, senza sfuggire al sospetto di una lottizzazione contrattata; e probabilmente la riforma Gentiloni è la figlia, non indecente ma chissà quanto adeguata, di una timidezza durata troppo a lungo.";sg;PNPN;yes;distractor;_
labbra a labbra;no;a;labbra;accostare;Il massimo ardimento fu accostare;labbra a labbra;, e certo non perché avessimo letto Heine e sospettassimo che il bacio fosse più dolce della parola.;sg;verbal;yes;distractor;_
parola su parola;yes;su;parola;difendere;Per fortuna, conosceva la lingua così bene che capì ogni cosa, e si potette difendere,;parola su parola;, accusa su accusa, prova su prova, senza perdersi d'animo.;sg;_;_;succession/iteration/distributivity;modifier
goccia a goccia;yes;a;goccia;passo;Circuiti cognitivi che si tenta di riattivare passo dopo passo,;goccia a goccia;, perché «lo sviluppo cognitivo può essere come una botte, che riempi molto velocemente, oppure come una damigiana che ha il collo stretto e va riempita lentamente.;sg;_;_;succession/iteration/distributivity;modifier
palmo a palmo;yes;a;palmo;esplorare;Non venendo, l'italiano aveva agito in modo tanto ragionevole quanto scortese, non si sarebbe visto nulla, ci si sarebbe dovuti accontentare di esplorare;palmo a palmo;alcuni quadri con la lampadina tascabile di K.;sg;_;_;succession/iteration/distributivity;modifier
goccia a goccia ;no;a;goccia;a;Accese uno Zippo, infiammò lo stoppino di una piccola ampolla di cherosene e cominciò a sciogliere a;goccia a goccia;una stecca di ceralacca sul cartoncino finché non si formò una pozza rosso sangue.;sg;PNPN;yes;distractor;_
limoni su limoni;yes;su;limone;succhiare;Di certo stava ancora succhiando;limoni su limoni;per curarsi la violenta dissenteria che lo aveva colto nella notte e che lo aveva costretto a passare il comando a Vega.;pl;_;_;greater_plurality/accumulation;nominal
goccia a goccia;yes;a;goccia;sgorgare;Spesso il sangue si mette a sgorgare;goccia a goccia;o in modo continuo, iniziando improvvisamente senza una ragione apparente: talvolta i genitori notano solo l'orecchio o il cuscino sporco di sangue.;sg;_;_;succession/iteration/distributivity;modifier
guancia a guancia;yes;a;guancia;lento;Alfio per il resto della serata rimase mortificato a guardarla ballare i valzer lenti;guancia a guancia;con Piastrein.;sg;_;_;juxtaposition/contact;modifier
egemonia ad egemonia;no;a;egemonia;aggiungere;Perché l'Ulivo ha avuto l'abilità - se possiamo considerarla un'abilità - di aggiungere;egemonia ad egemonia;.;sg;verbal;yes;distractor;_
soldi su soldi;yes;su;soldi;e;Il meccanismo adottato in Francia per convincere i cittadini della ineluttabilità del nucleare è lo stesso adottato di recente in Italia: balle su balle raccontate da venduti e;soldi su soldi;per la pubblicità e per foraggiare i giornali.;pl;_;_;greater_plurality/accumulation;nominal
amico ad amico;no;a;amico;da;E visto che tra noi è tutto finito, dimmelo francamente, da;amico ad amico;: dove sei stato?;sg;PNPN;yes;distractor;_
ventricolo su ventricolo;yes;su;ventricolo;Giovanni;Mi hai aperto il tuo cuore, Giovanni,;ventricolo su ventricolo;.;sg;_;_;succession/iteration/distributivity;modifier
prove su prove;yes;su;prova;ormai;In Europa sta invece accadendo questo: nonostante ci siano ormai;prove su prove;che la strada che si è intrapresa è totalmente sbagliata ed andrebbe come minimo azzerata e ripensata, chiunque mette in discussione il sogno POTH progetto europeo è un odioso populista, reazionario, fascista.;pl;_;_;greater_plurality/accumulation;nominal
grado a grado;no;a;grado;a;Fu scritto in un'epoca d'infermità e di vanità intellettuale, quando io allettato dalle mollezze dell'ozio andavo perdendo a;grado a grado;tutte le forze accumulate in parecchi anni di studio e non curante volgevo le spalle ai saggi amici che venivano a gridarmi: - o rinnovarsi, o morire!;sg;PNPN;yes;distractor;_
volta a volta;no;a;volta;a;Insomma, da buon notaio, era come se protocollasse diverse deposizioni, testimonianze o confessioni da fornire poi agli avvocati per difendere cause a;volta a volta;diverse - talché aveva iniziato a designare questi suoi appunti come i Protocolli - e si guardava bene di mostrare tutto a padre Bergamaschi, perché per lui filtrava solo i testi di carattere più spiccatamente religioso.;sg;PNPN;yes;distractor;_
muro a muro;yes;a;muro;stare;A Lucas Avenue guardavamo dall'alto in basso quelle disgraziate nei casini di Chestnut o di Market Strect, che stavano;muro a muro;con i teatri di varietà, le case da gioco dove un bullo poteva tentare la fortuna al faro o ad altri giochi, trovare qualsiasi tipo di liquore, e soddisfare qualunque capriccio sessuale.;sg;_;_;juxtaposition/contact;modifier
banca a banca;no;a;banca;da;l prezzo al dettaglio (diverso da;banca a banca;), poi, va aggiunta la commissione che può variare dai 50 ai 100 punti base.;sg;PNPN;yes;distractor;_
coppe su coppe;yes;su;coppa;mangiare;Orinare stando in piedi era punito in un modo particolarmente arduo, e le donne che durante le mestruazioni si avvicinavano all'acqua o al fuoco venivano costrette a mangiare;coppe su coppe;di piscio e merda maschili.;pl;_;_;greater_plurality/accumulation;nominal
superficie su superficie;yes;su;superficie;vita;Dove ho letto che al momento finale, quando la vita,;superficie su superficie;, si è - incrostata di esperienza, sai tutto, il segreto, il potere e la gloria, perché sei nato, perché stai morendo, e come tutto avrebbe potuto andare diversamente?;sg;_;_;succession/iteration/distributivity;modifier
