NPN;construction;preposition;noun;pre_lemma;context_pre;costr;context_post;number_of_noun;Type;other_cxn;meaning;syntactic_function
spalla a spalla;no;a;spalla;a;Pazzia, avanguardia, eroismo, tutti e tre allo sbaraglio senza saperlo: ognuno crede in un suo fantasma eccezionale: crede e opera al di fuori del branco: gli altri, a;spalla a spalla;, guardano e hanno paura.;sg;PNPN;yes;distractor;_
palmo a palmo;yes;a;palmo;esplorare;Gli sarebbero occorsi mesi per rilevarne il tracciato e per esplorarle;palmo a palmo;.;sg;_;_;succession/iteration/distributivity;modifier
porta a porta;yes;a;porta;campagna;Ma Davi suggerisce, se la vicenda Unipol dovesse monopolizzare tv e giornali nazionali ancora per mesi, di fare una campagna;porta a porta;: «Rinunciare a fare di Rai3 una rete militante, preferire interviste ai giornali e alle tv locali, tanta radio, non solo nelle emittenti di sinistra, comizi».;sg;_;_;succession/iteration/distributivity;modifier
goccia a goccia ;no;a;goccia;a;il chiarore del giorno penetra a;goccia a goccia;nel mio cervello.;sg;PNPN;yes;distractor;_
porta a porta;yes;a;porta;distribuzione;Poi i certificati verranno consegnati ai vigili che incominceranno la distribuzione;porta a porta;.;sg;_;_;succession/iteration/distributivity;modifier
tensione a tensione;no;a;tensione;aggiungere;lo so che ti potrebbe montare l'ansia, però se prosegui così, purtroppo, aggiungi;tensione a tensione;, ansia, sua ansia.;sg;verbal;yes;distractor;_
ore su ore;yes;su;ora;teatro;Gli uomini possono trascorrere a teatro;ore su ore;, e le loro esperienze comuni sono le più svariate.;pl;_;_;greater_plurality/accumulation;nominal
palmo a palmo;yes;a;palmo;conoscere;Allora il prete si avvicinò a me e disse che lui quelle montagne le conosceva;palmo a palmo;perché da piccolo con suo padre e sua sorella arrivavano fin lassù.;sg;_;_;succession/iteration/distributivity;modifier
prove su prove;yes;su;prova;lavoro;Inoltre la pratica di chiedere ai datori di lavoro;prove su prove;"dell'effettiva necessità del lavoro straniero rifletteva la resistenza ad accettare l'idea che esistesse una vera domanda di manodopera non ""autoctona"".";pl;_;_;greater_plurality/accumulation;nominal
volta a volta;yes;a;volta;quello;In fondo, la crisi dell'università è il prodotto di due silenzi: uno è quello,;volta a volta;connivente, frustrato, desensibilizzato, del mondo accademico stesso, che vede e soffre le pecche del sistema e dei comportamenti, ma non sa uscirne con proposte generali e comportamenti adeguati.;sg;_;_;succession/iteration/distributivity;modifier
acque ad acque;no;a;acque;nube;Dapprima la tempesta opponeva nubi a nubi,;acque ad acque;, venti a venti.;pl;verbal;yes;distractor;_
corpo a corpo;no;a;corpo;a;Le tattiche riflettono le tradizionali forme di lotta a;corpo a corpo;.;sg;PNPN;yes;distractor;_
goccia a goccia ;no;a;goccia;a;Come nel riempire una caraffa a;goccia a goccia;, c'è finalmente una stilla che la fa traboccare, così in una sequela di atti gentili ce n'è infine uno che fa traboccare il cuore.;sg;PNPN;yes;distractor;_
pixel a pixel;yes;a;pixel;digitale;"""Quando si esegue la rilevazione di contorni su un'immagine con tecniche di elaborazione attualmente disponibili lo si fa in maniera digitale,";pixel a pixel;""", ha spiegato il Prof.";sg;_;_;succession/iteration/distributivity;modifier
palmo a palmo;yes;a;palmo;lottare;Per lui si tratterà di procedere progredendo senza progredire, di lottare;palmo a palmo;contro qualunque forma di dipendenza dal terapeuta, di non dovergli niente, soprattutto di non essergli debitore di un miglioramento del quale preferisce fare a meno piuttosto che pagarlo a quel prezzo.;sg;_;_;succession/iteration/distributivity;modifier
braccio a braccio;yes;a;braccio;sviluppare;Primo edificio per la musica progettato dallo studio di Michel Rojkind, è il frutto di un processo progettuale sviluppato;braccio a braccio;con la direzione dell'Orchestra: le scelte riguardanti il tipo di sala, il numero di sedute e le destinazioni funzionali degli ambienti sono dunque condivise e volute dai successivi inquilini dello spazio.;sg;_;_;juxtaposition/contact;modifier
bocca a bocca;yes;a;bocca;respirazione;Se non è possibile la respirazione;bocca a bocca;si può tentare una respirazione manuale la cui efficacia è molto inferiore.;sg;_;_;juxtaposition/contact;modifier
scandalo a scandalo;no;a;scandalo;aggiungere;"Per il verde Marco Boato ""il congresso Usa aggiunge";scandalo a scandalo;""", il guardasigilli Oliviero Diliberto è ""sbigottito"" per l'""ulteriore beffa"" e Grandi dei Ds chiede un'iniziativa del governo contro questo ""insulto alle vittime"".";sg;verbal;yes;distractor;_
proposte su proposte;yes;su;proposta;cassa;Così partirono casse su casse;proposte su proposte;, ma non ricevevamo se non giornali vecchi di due mesi, qualche settimanale come Ogonëk o Donna Sovietica, qualche rivista come Voprosy Filosofii e Sovetskoe Gosudarstvo i Pravo, dai quali ogni tanto Strada segnalava qualcosa perplesso.;pl;_;_;greater_plurality/accumulation;nominal
cuore a cuore;yes;a;cuore;mano;Invece la stava invitando a camminare al suo fianco, mano nella mano,;cuore a cuore;.;sg;_;_;juxtaposition/contact;modifier
corsi su corsi;yes;su;corso;fare;Ultimamente, siccome si dice che questi ragazzi e queste ragazze non imparano niente, allora si fanno;corsi su corsi;per vedere come avvicinarsi, quindi per curare la relazione, però sempre in un modo strumentale, come mezzo per arrivare al RAZIONALE.;pl;_;_;greater_plurality/accumulation;nominal
piani su piani;yes;su;piano;elaborare;Da mesi gli stati maggiori stanno elaborando;piani su piani;, ipotizzando un vertice italiano che gestirà uno schieramento di forze europee.;pl;_;_;greater_plurality/accumulation;nominal
fabbriche su fabbriche;yes;su;fabbrica;ambrosiano;Qui aveva qualche amico in Scaldasole e al circolo del Ponte della Ghisolfa, piazzale Lugano, il grigio più grigio della periferia ambrosiana,;fabbriche su fabbriche;, l'inizio della sopraelevata, il cavalcavia delle Varesine.;pl;_;_;greater_plurality/accumulation;nominal
danno a danno;no;a;danno;aggiungerebbe;Guai se non fosse così - ha tuonato Romiti - poiché dopo tanti sforzi si aggiungerebbe;danno a danno;.;sg;verbal;yes;distractor;_
bocca a bocca;yes;a;bocca;respirazione;Cominciò a praticare la respirazione;bocca a bocca;a Phillip mentre scendeva le scale.;sg;_;_;juxtaposition/contact;modifier
palmo a palmo;yes;a;palmo;controllare;La ragazza, piuttosto pallida ed esile, controllò;palmo a palmo;l'indumento alla ricerca di eventuali macchie, verificò le cuciture e gli orli, poi la drappeggiò attorno alle sue spalle e sul braccio sinistro e curò le pieghe una per una come se stesse rivestendo il suo padrone.;sg;_;_;succession/iteration/distributivity;modifier
camino a camino;no;a;camino;da;L'Atrium era pieno di persone che si spostavano da;camino a camino;, sigillandoli.;sg;PNPN;yes;distractor;_
palmo a palmo;yes;a;palmo;accanitamente;"La tensione del Franco Cacciatore viene condotta al diapason, allorché l'agens deve unirsi alla ""generale Caccia"" alla Bestia, e batte accanitamente,";palmo a palmo;, l'intrico della macchia.;sg;_;_;succession/iteration/distributivity;modifier
affetto a affetto;no;a;affetto;da;Diventiamo veramente gli epiteti che ci vengono spinti sotto il muso, i nomignoli, le dolci cime lanciate da;affetto a affetto;mentre tutto ondeggia e tra di noi c'è nebbia, quell'aria che si palpa e da noi nasce come da curve portuali, quell'aria dai calori ascellari, e noi diventiamo la cosa che sembriamo a chi ci dice cosa, quando quelle visioni mosse e volatili si fermano concrete e solide, fatte di materia comune, e si presentano come una esposizione da mercato, da bancarella.;sg;PNPN;yes;distractor;_
punto a punto;no;a;punto;da;L'ATM crea una connessione da;punto a punto;.;sg;PNPN;yes;distractor;_
scherzi su scherzi;yes;su;scherzo;inanellare;L'anarchico Chaplin aveva imparato a sbeffeggiare i nemici (e anche gli amici) inanellando;scherzi su scherzi;.;pl;_;_;greater_plurality/accumulation;nominal
commento a commento;no;a;commento;aggiungere;Volti tirati, ma è inutile aggiungere;commento a commento;.;sg;verbal;yes;distractor;_
fiocco a fiocco;yes;a;fiocco;a;La neve continuava a cadere, fiocco a;fiocco a fiocco;accresceva lo spessore di bianco e di silenzio, senso di distanza dal resto del mondo.;sg;_;_;succession/iteration/distributivity;modifier
tasse su tasse;yes;su;tassa;stella;Dopo un anno, disoccupazione alle stelle,;tasse su tasse;, pensioni in pericolo, criminalità impunita e spavalda, città nelle mani di spacciatori e violenti, il futuro è visto da molti incerto e drammatico.;pl;_;_;greater_plurality/accumulation;nominal
domande su domande;yes;su;domanda;fare;Interi pomeriggi a bere tè ascoltando il racconto della loro vita, e io lì a fare;domande su domande;ome Maria De Filippi.;pl;_;_;greater_plurality/accumulation;nominal
colpo a colpo;no;a;colpo;a;Lui va avanti, martella e inchioda, sale e scende e sposta la scala e ci risale, chiude a;colpo a colpo;il muro esterno della casa che si è costruito.;sg;PNPN;yes;distractor;_
casello a casello;no;a;casello;da;Masotti padre, per l'incazzatura, prese su e andò da Bologna a Taranto in tre ore da;casello a casello;, tanto che il camion si surriscaldò e arrivò a destinazione un gigantesco carico di fritto il cui odore appetitoso fu sentito in tutta la città dei due mari.;sg;PNPN;yes;distractor;_
miti a miti;no;a;miti;nome;Si tratta di sostituire nomi a nomi,;miti a miti;, teorie a teorie.;sg;verbal;yes;distractor;_
porta a porta;yes;a;porta;vendita;15 giovani intraprendenti, anche senza esperienza, hanno la possibilità di entrare a far parte dell'organizzazione commerciale come incaricati alla vendita;porta a porta;, pagati a provvigioni.;sg;_;_;succession/iteration/distributivity;modifier
acero  a acero;no;a;acero;da;Immaginando di tradurre le tinte in suoni, si sentirebbe il gemito del popolo delle foreste, un'eco straziante che si propaga da;acero a acero;, da quercia a quercia.;sg;PNPN;yes;distractor;_
punto a punto;no;a;punto;da;Il confronto del dato sperimentale con quello calcolato consente di tracciare mappe di variazione da;punto a punto;.;sg;PNPN;yes;distractor;_
cuore a cuore;yes;a;cuore;te;Ci deve essere la possibilità di rapporti concreti: la mamma deve poterti portare a letto, darti il bacio della buona notte, imboccarti se è necessario, stare con te;cuore a cuore;.;sg;_;_;juxtaposition/contact;modifier
corpo a corpo;no;a;corpo;da;Sembrano interconnesse in una sfida infinita che si tramanda da;corpo a corpo;, da anima ad anima, da essere ad essere. ;sg;PNPN;yes;distractor;_
ritardi su ritardi;yes;su;ritardo;più;Da allora, poco o nulla più:;ritardi su ritardi;da parte di BluTec nell'esecuzione dei piani, i lavoratori che protestano, Invitalia che ritira il finanziamento e chiede indietro i soldi.;pl;_;_;greater_plurality/accumulation;nominal
banca a banca;no;a;banca;da;Al di là della comodità, dal punto di vista economico la convenienza della domiciliazione varia però non solo da;banca a banca;ma anche e soprattutto a seconda del tipo di conto che si intrattiene con l'istituto.;sg;PNPN;yes;distractor;_
volta a volta;yes;a;volta;essere;Durante più di due secoli essa fu;volta a volta;sotto il dominio dei Visconti, signori di Milano, sotto l'influenza del governo della Chiesa Romana, ebbe governi repubblicani, fu governata dalle più importanti famiglie cittadine in lotta tra loro per ottenere la supremazia.;sg;_;_;succession/iteration/distributivity;modifier
balcone a balcone;no;a;balcone;da;I miei abitano in un quartiere dove ancora le massaie comunicano da;balcone a balcone;.;sg;PNPN;yes;distractor;_
goccia a goccia ;no;a;goccia;a;Quella donna fu sottoposta alla tortura dell'acqua: ne dovette ingurgitare litri e litri, a;goccia a goccia;, attraverso una pezzuola ficcata in gola, fin quasi a morirne soffocata…;sg;PNPN;yes;distractor;_
bocca a bocca;yes;a;bocca;respirazione;Sembrava che ci fosse poco da fare per la piccola Jihan: «Il camionista ha portato dell'acqua per lavarla dal sangue, e io ho provato a farle la respirazione;bocca a bocca;».;sg;_;_;juxtaposition/contact;modifier
colpo su colpo;yes;su;colpo;rispondere;Maranghi, con l'arroganza che molti gli rimproverano, ha risposto;colpo su colpo;, rinfacciando alla fine quella che, secondo lui, è stata la più grave colpa del giovane direttore centrale: l'aver a suo tempo escluso che la Consob avrebbe obbligato Mediobanca a fare un'opa sull'ex gruppo Ferruzzi, come invece avvenne, costringendo l'istituto a un esborso di oltre 200 miliardi.;sg;_;_;succession/iteration/distributivity;modifier
palmo a palmo;yes;a;palmo;battere;Da quella sera, fino a ieri pomeriggio, carabinieri, polizia e vigili del fuoco hanno continuato a cercare madre e figlio, battendo;palmo a palmo;la zona lungo il fiume e scandagliando le acque del Livenza, che a tratti ha correnti molto forti e profondità dai cinque ai nove metri.;sg;_;_;succession/iteration/distributivity;modifier
smentita a smentita;no;a;smentita;sommare;Ma il giornalista ha confermato la bontà della notizia, sommando;smentita a smentita;.;sg;verbal;yes;distractor;_
legge a legge;no;a;legge;carta;Aveva opposto carte a carte,;legge a legge;.;sg;verbal;yes;distractor;_
miseria a miseria;no;a;miseria;tanto;È inutile e crudele aggiungere più di tanto;miseria a miseria;.;sg;verbal;yes;distractor;_
barca a barca;no;a;barca;da;Riflessa dall'acciaio nero della Moldava, l'agitazione variopinta dei giochi di luce faceva guizzare i suoi messaggi di fuoco da;barca a barca;, da zattera a zattera.;sg;PNPN;yes;distractor;_
colpo su colpo;yes;su;colpo;rispondere;"Ma ora che il presidente Hugo Chavez ha chiesto ai suoi di rispondere """;colpo su colpo;"alle provocazioni dei senzapatria"", quella delle pentole è diventata una piccola guerra che si estende per tutta la capitale venezuelana.";sg;_;_;succession/iteration/distributivity;modifier
bar a bar;no;a;bar;da;Non gli avrebbe detto dove aveva passato la notte, non gli avrebbe raccontato di quel lungo vagabondaggio da;bar a bar;, cominciato subito dopo la sua telefonata e terminato con un sonno ristoratore assieme ai barboni della villa comunale.;sg;PNPN;yes;distractor;_
disappunto a disappunto;no;a;disappunto;aggiungere;Si diede subito della stupida e questo fatto aggiunse;disappunto a disappunto;.;sg;verbal;yes;distractor;_
volta a volta;yes;a;volta;fare;Di questo l'esperienza interiore, il mio sentirmi si fa;volta a volta;avvertito.;sg;_;_;succession/iteration/distributivity;modifier
caserma a caserma;no;a;caserma;da;Che invece d'una esercitazione notturna o d'uno spostamento di forze da;caserma a caserma;si trattasse d'una manovra connessa al problema della Torre?;sg;PNPN;yes;distractor;_
artista ad artista;no;a;artista;da;Lo spessore dello strato pittorico varia da;artista ad artista;e dalla tecnica impiegata.;sg;PNPN;yes;distractor;_
casella a casella;no;a ;casella;da;"Per questo motivo oggi sono necessari anche i portalettere: quando passeremo alla posta elettronica ""pura"", cioè che viaggia da";casella a casella;(la casella è un apparecchio tipo Internet) allora si vedrà.;sg;PNPN;yes;distractor;_
porta a porta;yes;a;porta;e;Oltre agli immancabili call center con contratti a provvigione, tra i casi studiati verranno analizzati i pericoli che si celano nelle offerte per gli impieghi classici, «a domicilio e;porta a porta;"»; ma anche per i lavori che un tempo erano considerati anomali, ma che oggi sono fonte di guadagno per moltissimi giovani, come «quelli che prevedono un corso di formazione a pagamento iniziale, troppo spesso inutile e carissimo».";sg;_;_;succession/iteration/distributivity;modifier
palmo a palmo;yes;a;palmo;conquistare;Cominciando a conoscerti, che a Venezia ha aperto la Settimana della Critica e, ora, soggiorna sui nostri schermi conquistandosi;palmo a palmo;il favore del pubblico più attento.;sg;_;_;succession/iteration/distributivity;modifier
soddisfazioni a soddisfazioni;no;a;soddisfazioni;aggiungere;All'ambizioso Snezhnevskij, vincente sul piano scientifico e prono servitore del regime, la carriera politico - professionale non fece che aggiungere;soddisfazioni a soddisfazioni;": poco dopo ottenne la cattedra di psichiatria presso l'Istituto centrale superiore medico di Mosca; nel 1962 divenne membro a vita dell'Accademia delle scienze mediche; successivamente prese anche la direzione dell'Istituto di psichiatria dell'Accademia delle scienze mediche dell'URSS, rinominato nel 1983 Centro unito per la psichiatria e la salute mentale: il più importante centro di ricerca psichiatrica del paese.";sg;verbal;yes;distractor;_
piano su piano;yes;su;piano;edificio;Vuotò il bicchiere, chiuse gli occhi assaporando la squisitezza, annuì, e si alzò, un livello dopo l'altro, splendido edificio,;piano su piano;.;sg;_;_;succession/iteration/distributivity;modifier
porta a porta;yes;a;porta;venditore;Ma l'azienda cremonese ha bisogno anche di venditori;porta a porta;.;sg;_;_;succession/iteration/distributivity;modifier
bocca a bocca;no;a;bocca;a;Sperava che saltasse fuori un veleno o una tossina, ma gli interessava anche sapere se Clive era positivo all'HIV, dato che gli aveva praticato la respirazione a;bocca a bocca;ed era entrato in contatto col suo sangue.;sg;PNPN;yes;distractor;_
disastro a disastro;no;a;disastro;aggiungere;Se dovesse piovere, si aggiungerebbe;disastro a disastro;.;sg;verbal;yes;distractor;_
volta a volta;yes;a;volta;recitare;Una sua vanteria, immagino, di poter recitare;volta a volta;la parte del defensor fidei e dell'avvocato del diavolo, facendosi apologista ora dei carabinieri, ora dei lestofanti.;sg;_;_;succession/iteration/distributivity;modifier
libro a libro;no;a;libro;da;Il Corpus Hermeticum, essendo una compilazione, contiene idee che spesso si contraddicono da;libro a libro;.;sg;PNPN;yes;distractor;_
palmo a palmo;yes;a;palmo;che;Moltitudine di prostitute e colori sgargianti, stuoli d'artisti e piaceri del cibo, mio Ludovico, servono a celare spie e sbirri, giudici e inquisitori che;palmo a palmo;scrutano incessanti.;sg;_;_;succession/iteration/distributivity;modifier
bocca a bocca;yes;a;bocca;respirazione;Intanto io gli facevo la respirazione;bocca a bocca;e il massaggio cardiaco, gli cambiavo il pigiama sporco, lo tenevo su per la testa.;sg;_;_;juxtaposition/contact;modifier
palmo a palmo;yes;a;palmo;battere;Lui, quando ancora Bossi studiava alla Scuola Radio Elettra, batteva;palmo a palmo;le province di Verona, Vicenza e Treviso per diffondere il verbo della Serenissima.;sg;_;_;succession/iteration/distributivity;modifier
punto a punto;no;a;punto;da;Dopo essersi sentito soddisfatto del numero dei puntini, il ragazzo univa il tutto in una sola linea, da;punto a punto;.;sg;PNPN;yes;distractor;_
banca a banca;no;a;banca;da;Nonostante questo, i metodi di tariffazione sono differenti da;banca a banca;: nel caso del Banco Ambrosiano Veneto il servizio è completamente gratuito, ma per il cliente il costo dell'operazione dispositiva di bonifico è lo stesso della filiale.;sg;PNPN;yes;distractor;_
centro a centro;no;a;centro;da;La distanza di questi fra di loro deve essere - da;centro a centro;- di mm. 66.;sg;PNPN;yes;distractor;_
porta a porta;yes;a;porta;polivitaminico;Così, cominciò a vendere polivitaminici;porta a porta;.;sg;_;_;succession/iteration/distributivity;modifier
deficit a deficit;no;a;deficit;sommare;tutto vero, dirà il pensionato, ma è anche vero che se sommo;deficit a deficit;prima o poi il buco diventerà tanto grande che sarà difficile riempirlo.;sg;verbal;yes;distractor;_
sofferenza a sofferenza;no;a;sofferenza;aggiungere;Mi rendo conto di aggiungere;sofferenza a sofferenza;.;sg;verbal;yes;distractor;_
porta a porta;yes;a;porta;vendere;Il suo quarto marito le passava a quelli che le vendevano;porta a porta;.;sg;_;_;succession/iteration/distributivity;modifier
ciglio a ciglio;no;a;ciglio;da;Se il confine si trova in un fosso comune o in una via privata, la distanza si misura da;ciglio a ciglio;o dal ciglio al lembo esteriore della via (911).;sg;PNPN;yes;distractor;_
rinvii su rinvii;yes;su;rinvio;Italia;Quindici giorni in cui le attività giudiziarie penalistiche - i processi, grandi e piccoli, di criminalità comune e organizzata, acaricodi imputati eccellenti e sconosciuti - hanno subito, in tutt'Italia,;rinvii su rinvii;e accumulato ritardi.;pl;_;_;greater_plurality/accumulation;nominal
malumore a malumore;no;a;malumore;aggiungere;Tanto più che questo improvviso e contestato trasferimento della distribuzione aggiunge;malumore a malumore;.;sg;verbal;yes;distractor;_
brano a brano;no;a;brano;a;Talora le passava per la testa una fuggevole meraviglia: che si possa esser trascinati così mentre si muore a;brano a brano;, in mezzo a tutti gli altri, e nessuno se ne accorge...;sg;PNPN;yes;distractor;_
ciocca a ciocca;yes;a;ciocca;sfilare;Il più attuale si fa sfilando;ciocca a ciocca;, per creare l'effetto piuma, che alleggerisce la pettinatura e rende la piega particolarmente facile.;sg;_;_;succession/iteration/distributivity;modifier
porta a porta;yes;a;porta;contratto;Ciò si manifesta anche con la tendenza - si veda a proposito la legge sull'equo canone, sui contratti;porta a porta;", sul credito al consumo, sulla subfornitura e sulla multiproprietà - a non creare nuove figure contrattuali ma a regolare I ""rapporti economici"" fissando requisiti minimi del testo negoziale.";sg;_;_;succession/iteration/distributivity;modifier
porta a porta;yes;a;porta;consegna;"La consistenza della voce ""altre attività"" (28,9%: include ""altri settori produttivi"", ""attività specifiche d'impresa"", ""maneggi e scuderie"", ""consegna";porta a porta;""", altre attività residuali o non codificate) è il riflesso della storia del lavoro accessorio, all'origine destinato ad ambiti oggettivi di impiego circoscritti (quindi codificabili), negli anni progressivamente ampliati, fino alla riforma contenuta nella legge 92 del 2012 che permette di fatto l'utilizzo di lavoro accessorio per qualsiasi tipologia di attività.";sg;_;_;succession/iteration/distributivity;modifier
decibel a decibel;no;a;decibel;aggiungere;Tutti in fila verso l'ingresso del Motodrom, con le bandiere sottobraccio e le trombe da stadio per aggiungere;decibel a decibel;quando Michael e Ralf fanno guaire il motore sotto le tribune.;sg;verbal;yes;distractor;_
stagioni su stagioni;yes;su;stagione;trascorrere;Alla finestra sul mondo trascorsero;stagioni su stagioni;, poi fu di nuovo neve.;pl;_;_;greater_plurality/accumulation;nominal
colpo su colpo;yes;su;colpo;restituire;Sentiva quella sconfitta comese l'avesse subita personalmente, e la formidabile capacità di Memnone di restituire;colpo su colpo;e con forza spaventosa lo umiliava duramente e gli faceva provare per la prima volta in vita sua un frustrante senso d'impotenza e di profonda solitudine.;sg;_;_;greater_plurality/accumulation;nominal
banca a banca;no;a;banca;da;Va ricordato che la tessera Pagobancomat - utilizzabile per i pagamenti presso i punti convenzionati - prevede un costo annuo variabile da;banca a banca;ma è esente da commissioni per operazione e da costi di registrazione scrittura.;sg;PNPN;yes;distractor;_
bocca a bocca;yes;a;bocca;respirazione;Per i primi cinque minuti il massaggio non va interrotto (amenoche non si sia obbligati ad eseguire contemporaneamente la respirazione;bocca a bocca;.;sg;_;_;juxtaposition/contact;modifier
palmo a palmo;yes;a;palmo;bosco;In questo modo, i vari eserciti impegnati nella ricerca del tesoro alchemico si sono visti costretti a perlustrare i boschi;palmo a palmo;, sprecando tutta la notte in una lunga serie di appostamenti e di perquisizioni.;sg;_;_;succession/iteration/distributivity;modifier
volta a volta;yes;a;volta;scagliare;I suoi attori, ancora stancamente presenti, si scagliano;volta a volta;contro il sistema della partitocrazia, contro il regime del Caf, contro un sistema imprenditoriale arretrato, contro un mondo dell'informazione che ha preferito distorcere il suo prodotto (ma c'è chi preferisce considerarlo un servizio) al di là del lecito, contro l'organizzazione statale: tutti elementi indubbiamente intrecciati, ma ciascuno dotato anche di vita propria e di inesauribili capacità di sopravvivere alla sua stessa pubblica sconfessione.;sg;_;_;succession/iteration/distributivity;modifier
testa su testa;yes;su;testa;mattone;Per tua mano la Sua mannaia edificherà il Regno, passo dopo passo, mattone su mattone,;testa su testa;.;sg;_;_;succession/iteration/distributivity;modifier
km su km;no;su;km;poi;e non può che migliorare col tempo, poi;km su km;giù porto pazienza.;sg/pl;NsuNgiù;yes;distractor;_
porta a porta;no;a;porta;da;I plateali schiamazzi di Cesare Maldini, le urla scomposte di Marco Tardelli, così diverse e lontane da quelle del leggendario Bernabeu, hanno scandito l'inutile processione da;porta a porta;.;sg;PNPN;yes;distractor;_
volta a volta;yes;a;volta;metodologico;Ciò non sembra sufficiente per rispondere in modo adeguato a quanto mostrato dagli studi di storia della scienza: ovvero che gli scienziati non si comportano affatto secondo gli standard metodologici;volta a volta;avanzati.;sg;_;_;succession/iteration/distributivity;modifier
ritardi su ritardi;yes;su;ritardo;accumulare;Bene il raddoppio Mortara, unica linea ancora a singolo binario in città, capacità limitata e treni affollati che accumulano;ritardi su ritardi;a causa degli incroci.;pl;_;_;greater_plurality/accumulation;nominal
periodi su periodi;no;su;periodo;avere;Tornando al banco,devo dire che i suoi dischi li amo tuttora,certo hanno avuto;periodi su periodi;ma son sempre stati più che dignitosi.;pl;NsuNgiù;yes;distractor;_
