NPN;construction;preposition;noun;pre_lemma;context_pre;costr;context_post;number_of_noun;Type;other_cxn;meaning;syntactic_function
disastro a disastro;no;a;disastro;aggiungere;E poi, se la pioggia rimane così debole non può certo aggiungere;disastro a disastro;.;sg;verbal;yes;distractor;_
palmo a palmo;yes;a;palmo;Gargano;Ovviamente non possiamo battere quella parte del Gargano;palmo a palmo;.;sg;_;_;succession/iteration/distributivity;modifier
banca a banca;no;a;banca;da;E in questo caso i costi sono diversi da;banca a banca;: nella tabella pubblicata sopra vengono riportati quindici esempi relativi al circuito Cirrus - Maestro, il più diffuso sulle carte di debito, da cui emerge che le commissioni variano dallo 0,25% al 4%, più (o in alternativa) le spese fisse.;sg;PNPN;yes;distractor;_
osservazione ad osservazione;no;a;osservazione;pensiero;Di solito, allora, si sdraiava sul canapè del suo ufficio - non poteva più lasciare il suo ufficio senza essersi riposato un'ora sul canapè - e collegava nel pensiero;osservazione ad osservazione;.;sg;verbal;yes;distractor;_
prova su prova;yes;su;prova;accusa;Per fortuna, conosceva la lingua così bene che capì ogni cosa, e si potette difendere, parola su parola, accusa su accusa ,;prova su prova;, senza perdersi d'animo.;sg;_;_;succession/iteration/distributivity;modifier
cellula a cellula;no;a;cellula;da;L'apertura di questi canali contribuisce a controllare l'eccitabilità della cellula e la liberazione di neurotrasmettitori, i quali veicolano i messaggi da;cellula a cellula;.;sg;PNPN;yes;distractor;_
sorpresa a sorpresa;no;a;sorpresa;aggiungere;"Era passata automaticamente dal ""lei"" al ""tu"", e questo aggiunse";sorpresa a sorpresa;, spiazzando completamente Stefano, che cercò di chiudere alla svelta la sua conversazione telefonica: - Sì... beh... ecco... allora ci sentiamo domani, d'accordo?;sg;verbal;yes;distractor;_
danno a danno;no;a;danno;aggiungere;Le larve di questi insetti, subdoli untori, per aggiungere;danno a danno;, oltre che infestare i tessuti con attacchi diretti sono portatrici di noiosissime dermatiti o congiuntiviti che mietono vittime tra gli umani ipersensibili.;sg;verbal;yes;distractor;_
volta a volta;yes;a;volta;stare;Per esempio lo spazio cosmologico, che è stato;volta a volta;pensato e descritto finito, o infinito, e gli infiniti mondi nello spazio infinito immaginati da Giordano Bruno gli costaronola vita, limitato o illimitato.;sg;_;_;succession/iteration/distributivity;modifier
goccia a goccia ;no;a;goccia;a;Ufficialmente non c'è nè soddisfazione nè rammarico, nelle file dello stato maggiore di Alleanza nazionale, in questa serata elettorale in cui dati giungono a;goccia a goccia;, prima ancora degli exit poll ufficiali, confermando che al Nord il Polo va forte.;sg;PNPN;yes;distractor;_
centro a centro;no;a;centro;da;La distanza fra le grandi colonne è pari, da;centro a centro;", a 4,52 metri; nel disegno è di 4,51 metri.";sg;PNPN;yes;distractor;_
campo a campo;no;a;campo;da;Per muovere il punto di inserzione da;campo a campo;, premere il tasto [tab] o selezionare con il mouse la casella desiderata.;sg;PNPN;yes;distractor;_
bocca a bocca;yes;a;bocca;respirazione;E il protagonista ha imparato a fare la respirazione;bocca a bocca;leggendo le riviste gettate nella spazzatura.;sg;_;_;juxtaposition/contact;modifier
controlli su controlli;yes;su;controllo;volante;Strade bloccate, frontiere minate, posti di blocco volanti,;controlli su controlli;, ormai il Kosovo è solo questo.;pl;_;_;greater_plurality/accumulation;nominal
volta a volta;yes;a;volta;disattenzione;Roberto non capiva se essa, per disattenzione,;volta a volta;gli attribuisse i detti e i fatti di un altro, oppure lo provocasse con civetteria.;sg;_;_;succession/iteration/distributivity;modifier
volta a volta;yes;a;volta;proporre;Piuttosto sulla capacità di costruirsi sul dialogo (e sul conflitto) con i luoghi, con le condizioni, con l'altro e di proporre,;volta a volta;a partire da essi, l'emersione di una verità: limitata, provvisoria e specifica quanto universale nelle sue intenzionalità.;sg;_;_;succession/iteration/distributivity;modifier
colpo su colpo;yes;su;colpo;ribattere;Ma in questo campo gli americani sono in grado di ribattere;colpo su colpo;: Chevrolet risponde con una cult car, la Corvette.;sg;_;_;succession/iteration/distributivity;modifier
circoscrizione a circoscrizione;no;a;circoscrizione;da;Il numero di liste varia invece da;circoscrizione a circoscrizione;: a Bologna in totale sono 16.;sg;PNPN;yes;distractor;_
biblioteca a biblioteca;no;a;biblioteca;da;Se vogliamo tracciare una storia di libertà di Stato, di ragione da Niccolò Machiavelli a Norberto Bobbio, non dovremo più peregrinare da città a città o da;biblioteca a biblioteca;, inseguire opere rare o dimenticate, ma basterà navigare saggiamente su Internet appellandosi a quello che oggi (ma sta per cambiare nome) è il sito Unipi, it: l'intreccio dei concetti più importanti della cultura occidentale ci arriverà così bell'incorniciato dal video.;sg;PNPN;yes;distractor;_
casa a casa;yes;a;casa;e;E così, goccia a goccia, o meglio, campo a campo e;casa a casa;, in duemila anni la Chiesa ha potuto accumulare un patrimonio immenso, che nel passato era amministrato dal cosiddetto Obolo di San Pietro, e oggi lo è invece dal Pio Istituto per le Opere di Religione (IOR).;sg;_;_;succession/iteration/distributivity;modifier
citazioni su citazioni;yes;su;citazioni;fare;Mi chiese se continuava a fare;citazioni su citazioni;per legittimare le sue teorie.;pl;_;_;greater_plurality/accumulation;nominal
colpo su colpo;yes;su;colpo;israeliano;Diviso tra la sua anima pragmatica legata a Yassin e quella oltranzista del pediatra Rantisi, il gruppo, con profondi contatti col cosiddetto fronte delle carceri, replica alle ritorsioni israeliane;colpo su colpo;senza disdegnare quando necessario la ritirata strategica, la tregua, in vista di una razionalizzazione delle proprie forze.;sg;_;_;succession/iteration/distributivity;modifier
bunkr a bunker;no;a;bunker;da;Ma anche Saddam Hussein durante la Guerra del golfo si mosse da;bunkr a bunker;e nonostante gli sforzi americani molti di questi ultimi non sono mai stati messi in luce.;sg;PNPN;yes;distractor;_
volta a volta;yes;a;volta;dovere;Un agente di cambio, un venditore, una segretaria, un dirigente delle ferrovie, un professore universitario, un direttore d'albergo, devono;volta a volta;offrire un tipo di personalità diverso che, indipendentemente dalle differenze tra l'una e l'altra, deve rispondere sempre a una condizione: essere richiesto.;sg;_;_;succession/iteration/distributivity;modifier
fronte a fronte;yes;a;fronte;salone;Ed ecco allora ai due estremi del salone,;fronte a fronte;, la Trasfigurazione di Tiziano (dove l'autore discioglie in un vortice drammatico e accalorato - con il bianco fantasmatico del Cristo che si riflette sull'emergenza dei capelli bianchi e sul rubizzo colore rubensiano della testa di Pietro sul bruno sfatto e informe del corpo - il ritmo rigoroso a mandorla della parte alta del modello raffaellesco) e l'Ultima Cena di Tintoretto.;sg;_;_;juxtaposition/contact;modifier
giorni su giorni;yes;su;giorno;via;Così se n'erano andati via;giorni su giorni;.;pl;_;_;greater_plurality/accumulation;nominal
tornanti su tornanti;yes;su;tornante;fango;Si viaggia tra sassi e massi, guadi e fango,;tornanti su tornanti;", si sale dai 3000 ai quasi 5000 metri in un attimo; gli spazi gradualmente si allargano, sono quasi in cima, fa freddo, ha nevicato da poco.";pl;_;_;greater_plurality/accumulation;nominal
spalla a spalla;no;a;spalla;a;Nessuno osava spingersi avanti da solo, piuttosto qualcuno, nel serrare a;spalla a spalla;, veniva espulso indietro, gli esclusi formarono un doppio cordone che pressava il primo.;sg;PNPN;yes;distractor;_
grado a grado;no;a;grado;a;Il sacerdote sentì crescere la tensione di Micon: le mani torturate gli serrarono le spalle, il nobile volto si fece cinereo, e a;grado a grado;un brivido pervase tutto il suo corpo finché ogni nervo sembrò vibrare per lo sforzo…;sg;PNPN;yes;distractor;_
bocca a bocca;yes;a;bocca;respirazione;"Tu boccheggiavi e tossivi; poi ti facevano la respirazione";bocca a bocca;ed eri fuori pericolo.;sg;_;_;juxtaposition/contact;modifier
capitolo a capitolo;no;a;capitolo;da;All'interno del bilancio amministrativo, la Commissione può procedere, nei limiti e alle condizioni fissate dal regolamento stabilito in esecuzione dell'articolo 78 nono, a trasferimenti di crediti, sia da;capitolo a capitolo;, sia da suddivisione a suddivisione.;sg;PNPN;yes;distractor;_
bambino a bambino;no;a;bambino;da;Eppure non è mai stato provato un caso al mondo di contagio da;bambino a bambino;.;sg;PNPN;yes;distractor;_
pasticci su pasticci;yes;su;pasticcio;commettere;È questo il campo dove le donne commettono;pasticci su pasticci;"; seguono i suggerimenti di tutti e non fanno l'unica cosa che è veramente utile: un esame culturale, per valutare l'agente responsabile dell'infezione e mettere in atto, poi, una terapia mirata, suggerita dallo specialista.";pl;_;_;greater_plurality/accumulation;nominal
uscio a uscio;no;a;uscio;a;E poi il detto lupo vivette due anni in Agobbio, ed entravasi dimesticamente per le case a;uscio a uscio;", sanza fare male a persona e senza esserne fatto a lui; e fu nutricato cortesemente dalla gente, e andandosi così per la terra e per le case, giammai nessuno cane gli abbaiava dietro.";sg;PNPN;yes;distractor;_
disastro a disastro;no;a;disastro;impraticabile;" e produrre un'altra riforma inefficace sarebbe aggiungere""";disastro a disastro;.;sg;verbal;yes;distractor;_
stagione su stagione;yes;su;stagione;subire;Come si erano convinti a smettere di accettare le regole subite;stagione su stagione;da centinaia di migliaia di raccoglitori di frutta, verdura, zucchine e pomodori, angurie in Puglia e grappoli al Nord, senza ribellione?;sg;_;_;succession/iteration/distributivity;modifier
colpo su colpo;yes;su;colpo;reagire;Aspetto solo una parola per reagire;colpo su colpo;al primo segnale.;sg;_;_;succession/iteration/distributivity;modifier
colpo su colpo;yes;su;colpo;rispondere;Il sole d'inizio primavera era alto e già piuttosto caldo e i ragazzi ansimavano apparentemente stremati, ma continuavano a scontrarsi con crescente impeto stringendo i denti, rispondendo;colpo su colpo;e urtandosi con gli scudi con tutta la forza residua delle membra.;sg;_;_;succession/iteration/distributivity;modifier
punto a punto;no;a;punto;da;Oggi ci rendiamo conto che la critica faradayana alla nozione di particella, inquanto scaturisce da una fisica del continuum dove le interazioni agiscono da;punto a punto;.;sg;PNPN;yes;distractor;_
beni su beni;yes;su;bene;bere;"A loro dice che non devono preoccuparsi di quello che ""avrebbero mangiato o bevuto""; men che meno di ""accumulare";beni su beni;""".";pl;_;_;greater_plurality/accumulation;nominal
sillaba a sillaba;no;a;sillaba;congiungere;Sei tu, Signore, l'anima delle parole, il filo d'oro che congiunge;sillaba a sillaba;, il fuoco che spira dalle nostre bocche quando diciamo il vero.;sg;verbal;yes;distractor;_
albero ad albero;no;a;albero;da;Non un solo silenzio, ma parecchi: quello del muschio sotto i piedi, quello delle ombre da;albero ad albero;, il silenzio di un piccolo ruscello in esplorazione di pezzetti di terreno, i silenzi che lo attorniavano mentre sbucava su una radura.;sg;PNPN;yes;distractor;_
bit a bit;yes;a;bit;or;Esegue l 'operazione di OR;bit a bit;tra i due operandio specificati, ponendo il risultato nel secondo.;sg;_;_;succession/iteration/distributivity;modifier
brano a brano;no;a;brano;a;Cominciò il corpo a corpo tra la folla e la milizia e più nessuno ebbe pietà: il leone affamato non strappa così a;brano a brano;l'antilope che ha ucciso e che sta mangiando.;sg;PNPN;yes;distractor;_
testa a testa;yes;a;testa;quaderno;Giovanissime, con le treccine e gli occhialetti, stanno chine sui quaderni,;testa a testa;insieme ai loro studenti: quelli incapaci di tenere il passo della grande macchina alla conquista del pianeta.;sg;_;_;juxtaposition/contact;modifier
foglia a foglia;yes;a;foglia;scomparire;Nanni guarda il triangolino di frittata deflagrare e ricomporsi nel piatto di Cecilia, mentre l'insalata scompare;foglia a foglia;con estenuante lentezza, e tutte le cose che vorrebbe dirle non le può dire.;sg;_;_;succession/iteration/distributivity;modifier
volta a volta;no;a;volta;a;Fare un bilancio non è facile: l'Istituto si è proposto iniziative che a;volta a volta;stimolino altri ricercatori alla conoscenza e allo studio del pensiero e dell'opera di Paolo VI.;sg;PNPN;yes;distractor;_
borotalco su borotalco;yes;su;borotalco;mettere;Il suo amore per i libri era nato là, a mettere;borotalco su borotalco;sui libri della biblioteca della scuola, borotalco melmoso e poi ancora borotalco melmoso alla pagina dopo - se eri riuscito a scollarla - tra risate e chiacchiere frenetiche, programmando impraticabili scherzi.;sg;_;_;greater_plurality/accumulation;nominal
prove su prove;yes;su;prova;esperimento;Niente di peggio per cominciare un'altra settimana di esperimenti,;prove su prove;, verifiche e analisi di tutto ciò che non aveva funzionato come avrebbe dovuto.;pl;_;_;greater_plurality/accumulation;nominal
porta a porta;yes;a;porta;rappresentante;Suo padre faceva il rappresentante;porta a porta;per la Rawleigh, un'azienda di prodotti per la casa.;sg;_;_;succession/iteration/distributivity;modifier
grado a grado;no;a;grado;a;Quando gli uomini muoiono di morte naturale, allorché l'albero dell'umanità si spoglia a;grado a grado;di quanto è pallido e appassito, l'ampia superficie del Silenzio, nel quale annega per sempre chi ha finito di parlare e reggersi in piedi, non s'increspa minimamente, qualunque sia il numero di coloro che la tagliano col capo all'ingiù per raggiungere il lontanissimo fondo.;sg;PNPN;yes;distractor;_
banca a banca;no;a;banca;da;Una volta compiuta la scelta vengono attivate le procedure di sicurezza, che variano, ma di poco, da;banca a banca;.;sg;PNPN;yes;distractor;_
lettere su lettere;yes;su;lettera;scrivere;In quel periodo Intrieri scriveva;lettere su lettere;al Viminale, alla prefettura e al prefetto.;pl;_;_;greater_plurality/accumulation;nominal
volta a volta;no;a;volta;a;Si presentò ai giovani lettori con una bella promessa: Questo vostro foglio, a;volta a volta;mattacchione, sereno, sentimentale e utile sempre, intende d'ora in poi giovare al vostro spirito senza essere punto noioso.;sg;PNPN;yes;distractor;_
brano a brano;no;a;corpo;a;Talora le passava per la testa una fuggevole meraviglia: che si possa esser trascinati così mentre si muore a;brano a brano;, in mezzo a tutti gli altri, e nessuno se ne accorge…;sg;PNPN;yes;distractor;_
bocca a bocca;yes;a;bocca;racconto;Tutto si vela, tutto si ammanta, tutto trapassa così in un mondo parallelo dove anche il dolore può stemperarsi nel calore delle leggende, nella familiarità dei lunghi racconti;bocca a bocca;.;sg;_;_;juxtaposition/contact;modifier
canzone su canzone;yes;su;canzone;costruire;Il Libro del Mondo è, in fondo, il lungo racconto che con incredibile coerenza ha costruito;canzone su canzone;"quel grande ""moralista camuffato da immmoralista"" (Cesare G. Romana ) che era Fabrizio.";sg;_;_;succession/iteration/distributivity;modifier
assurdo ad assurdo;no;a;assurdo;contrapporre;Ma non ha molto senso contrapporre;assurdo ad assurdo;, non si annulleranno mai a vicenda e anzi, l'uno richiama l'altro in una tensione che può anche raggiungere vette esaltanti ma dilania l'uomo, stravolge la prospettiva in cui egli finisce per vedere la vita.;sg;verbal;yes;distractor;_
corpo a corpo;no;a;corpo;a;Un classico contemporaneo a tu per tu, o meglio a;corpo a corpo;, con l'eternità del classico.;sg;PNPN;yes;distractor;_
palmo a palmo;yes;a;palmo;ispezionare;Tutta l'area è stata immediatamente interdetta e i carabinieri la stanno ispezionando;palmo a palmo;alla ricerca di altri indizi utili all'indagine.;sg;_;_;succession/iteration/distributivity;modifier
ore su ore;yes;su;ora;passare;Sei mesi da quando Veronica l'aveva lasciata, e ogni giorno l'appartamento si faceva più vuoto, Giorgia più malinconica, ridotta a passare;ore su ore;davanti al computer.;pl;_;_;greater_plurality/accumulation;nominal
mente su mente;no;su;mente;parte;"Il credersi ""separati"" in più parti (";mente su mente;"giù, corpo questo e corpo quell'altro, questo è meglio e quello è peggio) è solo il frutto d'una visione ""schizofrenica"".";sg;NsuNgiù;yes;distractor;_
bocca a bocca;yes;a;bocca;respirazione;La respirazione artificiale andrebbe praticata attraverso strumenti medicali come il pallone ambu e, per motivi di igiene e profilassi, è sconsigliabile praticare la respirazione;bocca a bocca;.;sg;_;_;juxtaposition/contact;modifier
memoria su memoria;yes;su;memoria;essere;Se voi mi chiedete come ciò possa essere -;memoria su memoria;, nient'altro che memoria - io ovviamente non so rispondere, e non perché non esistano «io» e «voi», non più di quanto esistano «qui» e «ora», ma perché l'unica cosa che esiste è il passato ricordato, non ritrovato e - attenzione alla differenza - non rivissuto nell'immediatezza del regno sensoriale, ma semplicemente ritrasmesso.;sg;_;_;succession/iteration/distributivity;modifier
colpo su colpo;yes;su;colpo;reagire;Katoh ha immediatamente risposto, ma Melandri ha reagito;colpo su colpo;.;sg;_;_;succession/iteration/distributivity;modifier
agenzia ad agenzia;no;a;agenzia;da;Il tutto tra l'altro avviene nel giro di pochi mesi con una successione da;agenzia ad agenzia;quasi automatica.;sg;PNPN;yes;distractor;_
opera a opera;no;a;opera;da;Certo, ed è persino superfluo ricordarlo, l'orchestrazione del dialogato conosce modulazioni plurime, variando da autore a autore, da;opera a opera;.;sg;PNPN;yes;distractor;_
classe a classe;no;a;classe;da;Quando le incursioni maschili da;classe a classe;partivano, lui restava inchiodato al suo banco con aria ostentatamente indifferente, a sfogliacchiare il volume di testo dell'ora dopo, anche se, con l'orecchio più vicino alla porta della sua classe, non poteva fare a meno di seguire lo svolgimento dei fatti a pochi metri di distanza nell'affollato corridoio.;sg;PNPN;yes;distractor;_
bocca a bocca;yes;a;bocca;respirazione;Di più, provano a rianimare i due amici: massaggio cardiaco, respirazione;bocca a bocca;.;sg;_;_;juxtaposition/contact;modifier
centesimo su centesimo;yes;su;centesimo;restituire;Aveva anche chiesto soldi in prestito ai suoi amanti, senza pudore, e li aveva, ogni volta, restituiti,;centesimo su centesimo;.;sg;_;_;succession/iteration/distributivity;modifier
settimana a settimana;no;a;settimana;da;Si verifica volatilità durante l'anno da;settimana a settimana;finché i prezzi non iniziano a scendere sotto la media annuale verso la fine di agosto, quando i viaggiatori possono risparmiare il 42% o più rispetto al periodo più caro.;sg;PNPN;yes;distractor;_
problemi a problemi;no;a;problemi;aggiungere;Non poteva però, in quelle condizioni, aggiungere;problemi a problemi;.;sg;verbal;yes;distractor;_
abbondanza ad abbondanza;no;a;abbondanza;aggiungere;Anche per i Benetton il miliardo messo a disposizione dalla Cassa, con l'astensione in consiglio di Viesti e di un altro componente, sembra aggiungere;abbondanza ad abbondanza;.;sg;verbal;yes;distractor;_
record su record;yes;su;record;risucchiati;Fuori Perugini: Valentino è primo, in dieci minuti dodici posti risucchiati,;record su record;.;sg/pl;_;_;greater_plurality/accumulation;nominal
fronte a fronte;yes;a;fronte;trovare;Hussein, alla minaccia di trovarsi;fronte a fronte;con Amintore e soprattutto con Maria Pia, ha pianto lungamente e voleva far caricare sul jumbo anche un paio di emiri kuwaitiani con tutte le mogli e figli.;sg;_;_;juxtaposition/contact;modifier
viso a viso;yes;a;viso;Sonia;E lo dirò poi Sonia,;viso a viso;e non in presenza di paparino.;sg;_;_;juxtaposition/contact;modifier
bocca a bocca;yes;a;bocca;respirazione;È stato qualche anno fa e ricordo ogni minimo dettaglio: lui disteso per terra, attraverso la portiera schiacciata stava facendo la respirazione;bocca a bocca;a una donna che aveva perso conoscenza.;sg;_;_;juxtaposition/contact;modifier
justin su justin;no;su;justin;là;belibers.....cazzo calmatevi fate paura....justin di qua justin di là;justin su justin;giù!;X;NsuNgiù;yes;distractor;_
campo a campo;no;a;campo;da;A Durazzo la voce si insegue da;campo a campo;, da casa a casa.;sg;PNPN;yes;distractor;_
argomento ad argomento;no;a;argomento;da;Io credo che tale dipendenza sia molto variabile, da persona a persona e da;argomento ad argomento;: l'elaborazione simbolica può essere vantaggiosa oppure deleteria, a seconda delle circostanze e dell'oggetto.;sg;PNPN;yes;distractor;_
centro a centro;no;a;centro;da;"Inoltre, a causa della mancanza di standard unici, le condizioni ""variano da";centro a centro;""" e in alcuni di questi ci sono ""dubbi sul rispetto dei diritti umani"".";sg;PNPN;yes;distractor;_
barzellette su barzellette;yes;su;barzelletta;sfornare;Ormai, Ennio come un fucile, Athos come una mitraglia, sfornano;barzellette su barzellette;", come si suol dire, prendono il pallino in mano; fra un bicchiere e l'altro, una risata e l'altra, cadono le ultime barriere; ci sentiamo ormai comese fossimo davvero cresciuti tutti insieme; nasce in questa occasione oltrealla sintonia del branco, anche l'intercalare ufficiale della vacanza ""olè... se dobla""!";pl;_;_;greater_plurality/accumulation;nominal
colpo su colpo;yes;su;colpo;ribattere;All'Arechi gli uomini di Beretta hanno dovuto fare i conti con una Salernitana mai doma, pronta a ribattere;colpo su colpo;agli affondi dei più blasonati avversari.;sg;_;_;succession/iteration/distributivity;modifier
porta a porta;no;a;porta;da;Per diversi mesi si è visto, alla Tv, un signore che, con la borsa della spesa, passa da;porta a porta;a farsi ringraziare per gli acquisti che ha fatto e a esortare a fare altrettanto.;sg;PNPN;yes;distractor;_
colpo su colpo;yes;su;colpo;confrontare;Se la reazione - peraltro incerta - dell'azionariato Ina fosse un rilancio sulla stessa Ina, poco male: ci si confronterebbe;colpo su colpo;di fronte al mercato.;sg;_;_;succession/iteration/distributivity;modifier
volta a volta;yes;a;volta;avere;E sul ritardo contano i dottrinari tedeschi per giudicarle poi inutili (dopo aver;volta a volta;tentato di dimostrarle pericolose o illegali).;sg;_;_;succession/iteration/distributivity;modifier
bocca a bocca;yes;a;bocca;respirazione;Nessuno parla dell'impiegato di banca che non è corrotto e che magari un giorno ha salvato la vita a un collega facendogli la respirazione;bocca a bocca;.;sg;_;_;juxtaposition/contact;modifier
ritardi su ritardi;yes;su;ritardo;collezionare;Una sorta di modello finlandese, sulla falsariga della società che ha affidato ad Areva la costruzione del reattore di Olkiluoto (che sta però collezionando;ritardi su ritardi;, l'ultimo reso noto proprio ieri).;pl;_;_;greater_plurality/accumulation;nominal
braccio a braccio;no;a;braccio;da;Sembrerà assurdo ma il movimento anti-vaccinista è nato ancor prima della vaccinazione, durante la variolazione, ovvero il passaggio del vaiolo da pustola a pustola, da;braccio a braccio;, che, tuttavia, presentava un tasso di mortalità piuttosto alto (intorno al 6-7%), che ha creato il rifiuto di questo tipo di terapia.;sg;PNPN;yes;distractor;_
fibra a fibra;no;a;fibra;da;Il mio nervo acustico è ormai stiracchiato da;fibra a fibra;e non c'è modo di farci passare attraverso che un costante ronzio, come un canto di api su corolle piene di nettare.;sg;PNPN;yes;distractor;_
bocca a bocca;yes;a;bocca;respirazione;Non hai preso lezioni di pronto soccorso, non sai come si fa un massaggio cardiaco, non ti piace la respirazione;bocca a bocca;, trovi inutile quindi fermarti a guardare.;sg;_;_;juxtaposition/contact;modifier
caso a caso;no;a;caso;da;Nonostante l'omogeneità delle indicazioni di legge, la realtà dei Consultori nelle Regioni risulta diversa da;caso a caso;.;sg;PNPN;yes;distractor;_
palmo a palmo;no;a;palmo;a;Stupita, scopriva la forma nuova e sorprendente del corpo del suo amico, il calore, il gusto, l'aroma, lo esplorava conquistandolo a;palmo a palmo;, seminandolo di carezze appena inventate.;sg;PNPN;yes;distractor;_
bandiere su bandiere;no;su;bandiera;dire;"Come se ci fosse bisogno di una voce dall' alto che dica""";bandiere su bandiere;" giù"".";pl;NsuNgiù;yes;distractor;_
volta a volta;yes;a;volta;essere;"Sono anche, e qui Isnenghi non potrebbe essere più esplicito, coloro che entrano in azione ""ogni volta che risuona un richiamo di guerra, contro un qualsiasi nemico esterno, sia";volta a volta;Gheddafi, Saddam o Milosevic.;sg;_;_;succession/iteration/distributivity;modifier
volta a volta;no;a;volta;eccezione;" e questo vale perfino per quelli che non l'hanno mai conosciuto se non attraverso i film: e si sono a""";volta a volta;"identificati nella sposina ingenua di Lo sceicco bianco, nei Vitelloni annoiati e smargiassi, in Gelsomina vittima e Zampanò carnefice, nei bidonisti che coltivano l'arte di arrangiarsi, in Marcello che galleggia sull'onda dolcevitaiola o si confessa homo perplexus in 8 1\2; e in tantissimi altri personaggi.";sg;PNPN;yes;distractor;_
casa a casa;no;a;casa;da;Quelle ricette sempre uguali a se stesse, eppure diverse da;casa a casa;.;sg;PNPN;yes;distractor;_
record su record;yes;su;record;macinare;Ritengo che, dopo essere salita in modo fulmineo macinando;record su record;, la Borsa Usa abbia bisogno di una ripulita dagli eccessi speculativi.;sg/pl;_;_;greater_plurality/accumulation;nominal
