NPN;construction;preposition;noun;pre_lemma;context_pre;costr;context_post;number_of_noun;Type;other_cxn;meaning;syntactic_function
generazioni su generazioni;yes;su;generazione;battezzare;Nei paesi in passato il parroco rimaneva nello stesso posto anche quaranta - cinquanta anni e battezzava;generazioni su generazioni;, oggi in una realtà in continuo cambiamento, questo fatto non è accettabile, pur riconoscendo che occorre un certo numero di anni per realizzare un progetto o per stabilire un rapporto profondo.;pl;_;_;greater_plurality/accumulation;nominal
porta a porta;yes;a;porta;differenziato;Al via la raccolta differenziata a Molini, Girola e Valtenna Mercoledì 18 dicembre inizia il nuovo servizio di raccolta differenziata -;porta a porta;nei quartieri Molini, Girola e Valtenna.;sg;_;_;succession/iteration/distributivity;modifier
disordine a disordine;no;a;disordine;solo;Ho sbagliato a venire fin qua per te, ho sommato solo;disordine a disordine;, malgrado la tua gentilezza, la tua disponibilità.;sg;verbal;yes;distractor;_
obiezioni su obiezioni;yes;su;obiezione;sollevare;Se avessi negato l'ubriachezza di George, se avessi cercato di nasconderla sollevando;obiezioni su obiezioni;perché il rilevamento del tasso alcolico eseguito mezz'ora dopo l'incidente non venisse acquisito come prova, se avessi fatto tutto ciò non avrei potuto ottenere un risultato favorevole al mio cliente.;pl;_;_;greater_plurality/accumulation;nominal
massacri a massacri;no;a;massacri;aggiungere;Sottintendeva: ne abbiamo abbastanza di questi generali che aggiungono;massacri a massacri;e, invece, dovrebbero trovare un terreno d'intesa concreto con le forze democratiche.;sg;verbal;yes;distractor;_
case su case;yes;su;casa;sinistra;A destra c'è il mare, a sinistra;case su case;, fino a pochi secondi prima di toccare.;pl;_;_;greater_plurality/accumulation;nominal
prove su prove;yes;su;prova;Belbo;Le avevo provviste nei giorni a venire, lunghe, minuziose, documentate, mentre sui tavolini di Pilade mostravo a Belbo;prove su prove;, che egli seguiva con l'occhio sempre più annebbiato, accendendo le sigarette coi mozziconi, stendendo ogni cinque minuti il braccio infuori, il bicchiere vuoto con una parvenza di ghiaccio sul fondo, e Pilade che si precipitava a rifornire, senza attendere altri comandi.;pl;_;_;greater_plurality/accumulation;nominal
bocca a bocca;yes;a;bocca;metodo;Inoltre, l'aria insufflata presa dall'ambiente, o collegata a un erogatore di ossigeno contiene delle percentuali di ossigeno superiori a quelle insufflate con il metodo;bocca a bocca;.;sg;_;_;juxtaposition/contact;modifier
lunghezza su lunghezza;yes;su;lunghezza;recuperare;"Il tedesco Caitano, montato da Andreas Starke, ha atteso la dirittura d'arrivo del ""Jockey"" per recuperare";lunghezza su lunghezza;ai britannici Luso e Mons ed imporre la legge del più forte.;sg;_;_;greater_plurality/accumulation;nominal
caso a caso;no;a;caso;da;Per quanto riguarda i lavoratori autonomi, l'accesso alle singole professioni è regolato da requisiti diversi da;caso a caso;(titoli di studio, esami o concorsi di stato, iscrizioni ad Albi o Ordini professionali ecc.);sg;PNPN;yes;distractor;_
periodo a periodo;no;a;periodo;da;Interessanti, poi, gli articoli di fine serie, scontatissimi, che varieranno da;periodo a periodo;.;sg;PNPN;yes;distractor;_
goccia a goccia ;no;a;goccia;a;Quando lo zucchero si è completamente sciolto e forma un filo continuo se preso fra il pollice e l'indice, toglietelo dal fuoco e versatelo a;goccia a goccia;sul cioccolato fuso mescolando come si trattasse di montare una maionese.;sg;PNPN;yes;distractor;_
bocca a bocca;no;a;bocca;da;Per non far cadere il sugo prendendolo con le dita, glielo passò da;bocca a bocca;.;sg;PNPN;yes;distractor;_
colpo su colpo;yes;su;colpo;davvero;L'intesa con Carnival fornisce inoltre a Fincantieri l'opportunità per ribattere davvero;colpo su colpo;la concorrenza dell'altro grande cantiere specializzato in navi passeggeri, il finlandese Masa Yard che recentemente si è aggiudicato un megacontratto della Royal Caribbean cruise line (Rccl) per la costruzione di due unità da 130mila tonnellate destinate a strappare proprio alle Carnival della serie Destiny il primato delle più grandi navi passeggeri del mondo.;sg;_;_;succession/iteration/distributivity;modifier
palmo a palmo;yes;a;palmo;osservare;Tutte le auto vengono osservate;palmo a palmo;, illuminate da fortissime luci bianche.;sg;_;_;succession/iteration/distributivity;modifier
bocca a bocca;yes;a;bocca;respirazione;"Per oltre 15 minuti ha tenuto in vita un amico intrappolato sott'acqua soffiandogli aria nei polmoni con ripetute immersioni e altrettante ""respirazioni";bocca a bocca;""".";sg;_;_;juxtaposition/contact;modifier
banca a banca;no;a;banca;da;Organizzazione di spostamento di capitale (conto) da;banca a banca;per porre sotto ricatto il sistema colpendolo dove più sanguina (I SOLDI).;sg;PNPN;yes;distractor;_
prove su prove;yes;su;prova;portare;D'altronde da qualche anno l'attivista Jeff Ballinger, fondatore del gruppo Press for Change, porta;prove su prove;circa le scandalose differenze fra le remunerazioni dei lavoratori indonesiani della catena Nike (poco più di un dollaro al giorno) e quelle dei campioni della pubblicità a cui la multinazionale affida la propria immagine.;pl;_;_;greater_plurality/accumulation;nominal
palmo a palmo;yes;a;palmo;battere;Gli promisi nuove fiere o, in alternativa, un viaggio in cui avremmo battuto;palmo a palmo;il Wisconsin.;sg;_;_;succession/iteration/distributivity;modifier
bar a bar;no;a;bar;da;La cifra complessiva cambiava da;bar a bar;, ma erano tutti d'accordo che i ricorrenti avessero ottenuto circa cinque milioni di dollari.;sg;PNPN;yes;distractor;_
bozzi su bozzi;yes;su;bozzo;chiamare;"""Da queste parti la chiamano";bozzi su bozzi;""", ridimensionò subito la faccenda.";pl;_;_;greater_plurality/accumulation;nominal
domande su domande;yes;su;domanda;a;Faye ha scoperto ancora un'altra Julie rispondere a;domande su domande;.;pl;_;_;greater_plurality/accumulation;nominal
palmo a palmo;yes;a;palmo;zona;Per ore e ore hanno battuto la zona;palmo a palmo;.;sg;_;_;succession/iteration/distributivity;modifier
spalla a spalla;no;a;spalla;a;Quando il primo se ne accorge, non approfitta del vantaggio per caricare il contendente al fianco - lo avrebbe facilmente abbattuto -, lo raggiunge invece per riallinearsi a;spalla a spalla;nella marcia rituale prima della battaglia.;sg;PNPN;yes;distractor;_
pixel a pixel;yes;a;pixel;interallacciare;Per poter essere rilette in formato tridimensionale, le immagini devono essere scritte sullo schermo interallacciate;pixel a pixel;: la separazione ottica delle due immagini avviene a caricod elle microlenti.;sg;_;_;succession/iteration/distributivity;modifier
vigneti su vigneti;yes;su;vigneto;significato;"Vagoni arrugginiti dove giovani senza senso lirico hanno spruzzato graffiti di cui, ahimè, non so cogliere il significato;";vigneti su vigneti;", sotto un velo di nebbia setosa come cipria; vecchi in bicicletta, altri che portano a spasso i cani.";pl;_;_;greater_plurality/accumulation;nominal
capoluogo a capoluogo;no;a;capoluogo;da;"""La spesa delle famiglie delle imprese per l'acqua varia notevolmente in Italia, da";capoluogo a capoluogo;"- spiega Samir Traini, l'economista che ha lavorato alla costruzione del portale - Questa variabilità è più contenuta fra i comuni della provincia di Genova che, per quanto riguarda le spese delle famiglie, ricadono tutti, tranne Busalla, nella fascia tariffaria più elevata"".";sg;PNPN;yes;distractor;_
pezzetto su pezzetto;yes;su;pezzetto;giorno;Le era sembrato di costruire ogni giorno;pezzetto su pezzetto;la propria vita e ciò che l'aveva inorgoglita di più era che ogni piccolo miglioramento derivasse dalla sua volontà e dalla assoluta mancanza di compromessi.;sg;_;_;succession/iteration/distributivity;modifier
autoradio ad autoradio;no;a;autoradio;da;Non è il caso di sottolineare quanto sia utile poter trasmettere una foto da;autoradio ad autoradio;.;sg;PNPN;yes;distractor;_
rovine su rovine;yes;su;rovina;tregua;Dove ci appare una catena di eventi, egli vede una sola catastrofe che accumula senza tregua;rovine su rovine;e le rovescia ai suoi piedi.;pl;_;_;greater_plurality/accumulation;nominal
porta a porta;yes;a;porta;raccolta;Nel 2002 è tra i tecnici che collaborano all'attivazione della raccolta;porta a porta;in alcuni Comuni della Provincia di Torino.;sg;_;_;succession/iteration/distributivity;modifier
difficoltà a difficoltà;no;a;difficoltà;aggiungere;Dalla scatola a sorpresa della nostra politica, che non riesce a correggere se stessa, rischiano continuamente di uscire riforme sbagliate , che aggiungono;difficoltà a difficoltà;.;sg;verbal;yes;distractor;_
canino a canino;no;a;canino;da;Non sarei troppo esigente con l'editore, basterebbe un piccolo anticipo di dodici milioni (tale è la cifra che il mio dentista esige per il nuovo ponte superiore da;canino a canino;, altrimenti, aggiungendoci qualche dente, diciotto milioni e non se ne parla più), una bella copertina blu con il mio nome scritto in bianco ed eventualmente anche il titolo del libro, e... voilà, ecco un uomo felice!;sg;PNPN;yes;distractor;_
mani su mani;no;su;mano;fare;Anche il testo della canzone era stato scritto per essere abbastanza esplicativo e per mostrare cosa si sarebbe dovuto fare (;mani su mani;giù mani dove vuoi) ma l'immagine dei Ricchi & Poveri non era tale da poter imporre un ballo inventato di sana pianta anche perché non c'era più la moda di inventarne di nuovi per il tramite di una canzone lanciata appositamente.;pl;NsuNgiù;yes;distractor;_
porta a porta;yes;a;porta;enciclopedia;Annunci del genere, sui giornali italiani, ormai riguardano solo i venditori di enciclopedie;porta a porta;.;sg;_;_;succession/iteration/distributivity;modifier
colpo su colpo;yes;su;colpo;ribattere;Ma Micheli si infervora, nega, ribatte;colpo su colpo;.;sg;_;_;succession/iteration/distributivity;modifier
volta a volta;yes;a;volta;cui;Mangi, beva, dorma, suoni, lavori o vada a spasso con la sua splendida ragazza tunisina, qualunque cosa faccia, non sopporta di essere distratto da ciò in cui,;volta a volta;, è impegnato.;sg;_;_;succession/iteration/distributivity;modifier
stagione a stagione;no;a;stagione;da;Pur con evidenti differenze da;stagione a stagione;, la storia ha dunque per il periodico fiorentino il ruolo dell'appello alle coscienze civili, esercitato in nome di una singolarità nazionale e di un primato così nitidi da giustificare anche le manipolazioni della verità dei fatti che gli strumenti letterari devono rendere piacevolmente credibili e persuasivi agli occhi di un'opinione pubblica da costruire.;sg;PNPN;yes;distractor;_
porta a porta;yes;a;porta;venditore;La brochure patinata del venditore;porta a porta;mostrava campi da golf verdissimi e piscine, ma tutto quello che il bambino vede è terra da cimitero e qualche lattina arrugginita.;sg;_;_;succession/iteration/distributivity;modifier
record su record;yes;su;record;così;Ma in questi anni va così,;record su record;.;sg/pl;_;_;greater_plurality/accumulation;nominal
dorso a dorso;no;a;dorso;a;Certamente facendo percorsi trekking (che durano più di un giorno) scendendo al fiume a piedi o a;dorso a dorso;"di mulo o effettuando il giro in elicottero, la fruizione del canyon sarebbe stata più intensa ma abbiamo scartato i primi per questioni anagrafiche di due di noi (la pendenza è notevole) e la seconda per esplicito rifiuto di Stefania di salire su un ""coso"" che reputa poco sicuro.";sg;PNPN;yes;distractor;_
amico ad amico;no;a;amico;da;E visto che tra noi è tutto finito, dimmelo francamente, da;amico ad amico;: dove sei stato?;sg;PNPN;yes;distractor;_
teorie a teorie;no;a;teorie;mito;Si tratta di sostituire nomi a nomi, miti a miti,;teorie a teorie;.;sg;verbal;yes;distractor;_
colpo su colpo;yes;su;colpo;rispondere;Solo gli Immortali restarono sul posto, si chiusero a quadrato e continuarono a respingere gli assalti nemici rispondendo;colpo su colpo;.;sg;_;_;succession/iteration/distributivity;modifier
goccia a goccia ;no;a;goccia;a;Questo verme si nutre del sangue umano, che si procura facendo piccolissimi fori nella mucosa dell'intestino, da cui lascia colare il sangue a;goccia a goccia;, per giorni e giorni, per anni e anni.;sg;PNPN;yes;distractor;_
gomito a gomito;no;a;gomito;a;Così ci siamo attrezzati con un nostro ufficio in un palazzo accanto, dove lavorano a;gomito a gomito;giovani avvocati italiani, albanesi e americani.;sg;PNPN;yes;distractor;_
sofferenza a sofferenza;no;a;sofferenza;aggiungere;Una vicenda inconcepibile - commenta Andrea Amato, segretario del Cub -, che aggiunge;sofferenza a sofferenza;.;sg;verbal;yes;distractor;_
volta a volta;yes;a;volta;incarnazione;Per questo uomini non sprovveduti hanno pensato, nel corso dei secoli, ai Signori o al Re del Mondo, forse non una persona fisica, un ruolo, un ruolo collettivo, l'incarnazione;volta a volta;provvisoria di una Intenzione Stabile.;sg;_;_;succession/iteration/distributivity;modifier
testa a testa;no;a;testa;a;Ma rischiava una sconfitta nella Sud Carolina, lo Stato di John Edwards, che lo precedeva nei sondaggi con il 30 contro il 25 per cento dei voti, e risultava a;testa a testa;con il generale Wesley Clark nell'Oklahoma (dove, a sorpresa, il bollettino di Internet Drudge Report dava invece vincente Edwards stesso).;sg;PNPN;yes;distractor;_
palmo a palmo;yes;a;palmo;setacciare;Il litorale tra Ostia e Anzio viene setacciato;palmo a palmo;con i cani.;sg;_;_;succession/iteration/distributivity;modifier
animale ad animale;no;a;animale;da;La ragione sta nell'assetto diverso dei cromosomi, le cui forme e specie quasi sempre variano da;animale ad animale;.;sg;PNPN;yes;distractor;_
grado a grado;no;a;grado;a;A lungo Domaris rimase immobile davanti alla porta chiusa, mentre la pietà nei suoi occhi a;grado a grado;svaniva, sostituita dal timore.;sg;PNPN;yes;distractor;_
morti su morti;yes;su;morto;con;Dalla morte di Montanino comincia un lungo e sanguinoso botta e risposta, con;morti su morti;: uno, due agguati al giorno, prima i gregari dei due clan, poi i parenti, l'incendio delle case, i pestaggi, i sospetti.;pl;_;_;greater_plurality/accumulation;nominal
palmo a palmo;yes;a;palmo;controllare;Ufficio che è stato controllato;palmo a palmo;.;sg;_;_;succession/iteration/distributivity;modifier
confusione a confusione;no;a;confusione;aggiungere;È un momento storico, aggiunge la nota, «che esige di non disperdere il voto, per non aggiungere;confusione a confusione;».;sg;verbal;yes;distractor;_
volta a volta;yes;a;volta;concentrare;Ognuna delle due diverse soluzioni presenta vantaggi e limiti: nella prima ipotesi può essere più agevolmente perseguita una politica criminale che concentri;volta a volta;"i propri obbiettivi sui fatti ritenuti più importanti, trascurando gli altri; nella seconda è più agevole assicurare che non si sottraggano al codice penale quanti hanno la possibilità di influire sulle scelte politiche.";sg;_;_;succession/iteration/distributivity;modifier
velo su velo;yes;su;velo;strada;Il vento era ancora leggero, ma prometteva tempesta, la sabbia volava bassa e copriva le strade,;velo su velo;.;sg;_;_;succession/iteration/distributivity;modifier
volta a volta;yes;a;volta;comprendere;Chiarite le tappe di questo itinerario, resta solo da comprendere,;volta a volta;, a quale di esse si trovi un'anima, quale stadio di sviluppo abbia raggiunto una comunità o un popolo, per partire da ciò che hanno compreso e condurli, secondo i tempi di crescita stabiliti da Dio, alla pienezza della conoscenza divina.;sg;_;_;succession/iteration/distributivity;modifier
serate su serate;yes;su;serata;collezionare;Lo so, avrei potuto campare di rendita su Kalimba de Luna, collezionando;serate su serate;…;pl;_;_;greater_plurality/accumulation;nominal
bocca a bocca;yes;a;bocca;respirazione;Nel bambino da 1 a 8 anni si fa la respirazione;bocca a bocca;, tenendo chiuse le narici con le dita.;sg;_;_;juxtaposition/contact;modifier
limoni su limoni;yes;su;limone;succhiare;Di certo stava ancora succhiando;limoni su limoni;per curarsi la violenta dissenteria che lo aveva colto nella notte e che lo aveva costretto a passare il comando a Vega.;pl;_;_;greater_plurality/accumulation;nominal
corpo a corpo;no;a;corpo;da;Mi sono avvicinato all'opera da;corpo a corpo;, fino all'imitazione della circoncisione.;sg;PNPN;yes;distractor;_
palmo a palmo;yes;a;palmo;battere;Per individuare le casse di zinco, la polizia batte;palmo a palmo;tutta la basilica, partendo dai sottotetti, scoprendo locali nemmeno mappati nelle cartine catastali, per passare alle stanze che ospitano gli organi, sino a sgabuzzini ricavati vicino alle aule, come quello ispezionato vicino all'attuale aula 201: la coincidenza è interessante, perché la stanza si trova a pochi metri dal quarto piano del palazzo adiacente: proprio la vecchia sede dell'istituto Ludovico da Victoria, la scuola di musica dove Emanuela nel 1983 andava a lezione.;sg;_;_;succession/iteration/distributivity;modifier
porta a porta;yes;a;porta;differenziato;"In particolare, anche in Italia ci sono esperienze straordinarie a riguardo, conta la raccolta differenziata """;porta a porta;""", domiciliarizzata, portare il servizio vicino alle famiglie.";sg;_;_;succession/iteration/distributivity;modifier
fiocco a fiocco;yes;a;fiocco;cadere;La neve continuava a cadere,;fiocco a fiocco;a fiocco accresceva lo spessore di bianco e di silenzio, senso di distanza dal resto del mondo.;sg;_;_;succession/iteration/distributivity;modifier
colpo su colpo;yes;su;colpo;scalpello;"Lavorò tutta la mattina, scavando la pietra con il suo scalpello;";colpo su colpo;, poi stanco, si distese sulle stoppie, vicinoal suo cane accovacciato, che nel sonno bizzarro inseguiva chissà quale preda, emettendo guaiti di cucciolo.;sg;_;_;succession/iteration/distributivity;modifier
palmo a palmo;yes;a;palmo;mano;Snocciolata questa sfilza di assurdità Bengal'skij riunì le mani;palmo a palmo;facendo segni di saluto verso la fessura del sipario, che di conseguenza, con un rumore sordo, si aprì.;sg;_;_;succession/iteration/distributivity;modifier
anima ad anima;no;a;anima;da;Sembrano interconnesse in una sfida infinita che si tramanda da corpo a corpo, da;anima ad anima;, da essere ad essere.;sg;PNPN;yes;distractor;_
foglia a foglia;no;a;foglia;da;Liscio come uno specchio tanto che il vento non rimbalzava da;foglia a foglia;, ma vi scivolava sopra senza sussulti.;sg;PNPN;yes;distractor;_
grado a grado;no;a;grado;a;Onde (suggeriva oltre cent'anni fa Leopardi) la risposta a una forzatura con un ritorno all'indietro, che a;grado a grado;conduca a transizioni e risultati effettivi, non apparenti e superficiali.;sg;PNPN;yes;distractor;_
pacchi su pacchi;yes;su;pacco;cucina;Ci mettemmo una cosa come mezz'ora, facendo avanti e indietro tra la strada e la cucina –;pacchi su pacchi;su pacchi – e quando il tizio con il berretto, sfinito, risalì sul suo furgone e sparì, dalla cucina li portammo in taverna – pacchi su pacchi su pacchi.;pl;_;_;greater_plurality/accumulation;nominal
bocca a bocca;yes;a;bocca;respirazione;Se non respira, intervenire per la respirazione;bocca a bocca;.;sg;_;_;juxtaposition/contact;modifier
bocca a bocca;yes;a;bocca;attaccare;La madre era sparita dietro le spalle larghe dello sconosciuto, i due stavano attaccati;bocca a bocca;e si stringevano forte.;sg;_;_;juxtaposition/contact;modifier
anticorpo ad anticorpo;no;a;anticorpo;da;Questa zona della molecola differisce da;anticorpo ad anticorpo;, determina la specificità della molecola anticorpale e viene definita paratopo o idiotipo.;sg;PNPN;yes;distractor;_
volume su volume;no;su;volume;indietro;Questo è un semplice lettore con play pausa avanti indietro;volume su volume;giù.;sg;NsuNgiù;yes;distractor;_
mille su mille;no;su;mille;sembrare;Il prezzo è stato 8.500 che mi sembra,; mille su mille;giù in linea con quello che si vede in giro.;sg;NsuNgiù;yes;distractor;_
palmo a palmo;yes;a;palmo;scrutare;E invece la sua macchina, accompagnata dai rintocchi della campana di Montecitorio, è arrivata puntualissima sul piazzale della Camera, scrutato;palmo a palmo;dai tiratori scelti appostati sui tetti.;sg;_;_;succession/iteration/distributivity;modifier
colpo su colpo;yes;su;colpo;controbattere;I locali hanno comunque retto la botta almeno per i 40 minuti iniziali, controbattendo;colpo su colpo;, anzi pressando in tutte le parti del campo.;sg;_;_;succession/iteration/distributivity;modifier
volta a volta;yes;a;volta;succedere;"Presentati in tavola questi piatti, ""tutte le conversazioni cessarono per la pienezza dei cuori...; e quando i piatti di servizio erano passati, vidi succedersi";volta a volta;"su tutte le fisionomie il fuoco del desiderio, l'estasi della gioia, il riposo perfetto della beatitudine"".";sg;_;_;succession/iteration/distributivity;modifier
architettura ad architettura;no;a;architettura;da;Come il set di istruzioni varia da;architettura ad architettura;, anche le regole sintattiche dell'assembly varieranno.;sg;PNPN;yes;distractor;_
indizi su indizi;yes;su;indizio;affastellare;Gli inquirenti romani stanno affastellando;indizi su indizi;, controlli, visure camerali, che confermerebbero l'ascesa delle 'ndrine in questo angolo esclusivo di Roma Nord.;pl;_;_;greater_plurality/accumulation;nominal
tragedia a tragedia;no;a;tragedia;dolore;Non aggiungete dolore a dolore,;tragedia a tragedia;…;sg;verbal;yes;distractor;_
esempi su esempi;yes;su;esempio;citare;Ma si potrebbe continuare a citare;esempi su esempi;: il Medioevo è attraversato da queste ventate di rivolta in cui un gruppo si identifica con l'unica Chiesa legittima, legittimandosi col proprio rigorismo (che, curiosamente, spesso sfocia nella licenza, come se la coscienza della propria perfezione spirituale consentisse una maggior spregiudicatezza nel trattare le miserie della carne).;pl;_;_;greater_plurality/accumulation;nominal
copie su copie;yes;su;copia;accatastare;Nel suo ufficio sono accatastate;copie su copie;della Fattoria degli animali di Orwell: il contributo del governo britannico all'insegnamento dell'inglese nelle scuole afghane e una lezione elementare sui danni del marxismo, messa in bocca a un maiale.;pl;_;_;greater_plurality/accumulation;nominal
punto a punto;no;a;punto;da;I nuovi sistemi di trasmissione a distanza si differenziano dai precedenti - telegrafo e telefono - perché non costituiscono un legame da;punto a punto;.;sg;PNPN;yes;distractor;_
lavoro a lavoro;no;a;lavoro;aggiungere;Da quel momento mia madre cominciò a desiderare che ciò potesse accadere, e pagò sempre in proprio, aggiungendo;lavoro a lavoro;per affrontare l'impegno economico di queste lezioni.;sg;verbal;yes;distractor;_
chiusura a chiusura;no;a;chiusura;da;In questa prospettiva il calo del BTp future, che da;chiusura a chiusura;è passato da 112,52 a 111,36, non può essere considerato drammatico: sulla scadenza decennale lo spread rispetto ai Bund tedeschi si è allargato solo di poco, a 68 punti base a fine giornata contro i 64 del giorno prima.;sg;PNPN;yes;distractor;_
palmo a palmo;yes;a;palmo;frugare;I tre si sparpagliarono e cominciarono a frugare;palmo a palmo;il terreno.;sg;_;_;succession/iteration/distributivity;modifier
volta a volta;no;a;volta;a;Che questo sia il significato delle disposizioni impugnate emerge nitidamente dalla loro lettera: dette disposizioni, difatti, intervenendo a;volta a volta;sull'art. 12 della legge regionale n. 25 del 2011, affiancano alla quantificazione del costo unitario del canone la potenza efficiente quale grandezza di riferimento il criterio, appunto attraverso cui determinare la potenza prodotta dall'impianto idroelettrico e calcolare il canone complessivo dovuto dal concessionario.;sg;PNPN;yes;distractor;_
Tornante su tornante;yes;su;tornante;cisto;sotto una falesia di roccia tra macchia mediterranea e cespugli di euforbia .  Tornante su tornante il panorama si allarga : tutto intorno macchia mediterranea , cespugli di cisto;Tornante su tornante;il panorama si allarga: tutto intorno macchia mediterranea, cespugli di cisto, qualche boschetto di eucalipti e tra le rocce la vista di Siniscola.;sg;_;_;succession/iteration/distributivity;modifier
fronte a fronte;yes;a;fronte;trovare;Una volta tolte di mezzo le operaie, le due regine si trovano;fronte a fronte;.;sg;_;_;juxtaposition/contact;modifier
gomito a gomito;no;a;gomito;a;Da Ferrara saliranno sulle Alpi un centinaio di rappresentanti delle forze di polizia civili e militari del territorio, che ancora una volta si troveranno a;gomito a gomito;, ma lontano dal lavoro quotidiano.;sg;PNPN;yes;distractor;_
cervello a cervello;no;a;cervello;da;Così, l'uomo ha dovuto confrontarsi con la donna in modo diverso, da;cervello a cervello;, e abbandonare il mito dei muscoli.;sg;PNPN;yes;distractor;_
goccia a goccia ;no;a;goccia;a;Carlino provò a lasciarsi cadere a;goccia a goccia;nel pantano del sonno, ma la notte inchiostrata senza luna e senza stelle aveva cento tasche e in ognuna c'erano bestemmie e ferraglie.;sg;PNPN;yes;distractor;_
prove su prove;yes;su;prova;a;Tutte abusive sono le donne nel mondo dei maschi: senza passaporto né carta di identità, si fanno passare per quello che non sono, si sottopongono a;prove su prove;, pur di resistere, di non essere cacciate.;pl;_;_;greater_plurality/accumulation;nominal
goccia a goccia ;no;a;goccia;a;Accese uno Zippo, infiammò lo stoppino di una piccola ampolla di cherosene e cominciò a sciogliere a;goccia a goccia;una stecca di ceralacca sul cartoncino finché non si formò una pozza rosso sangue.;sg;PNPN;yes;distractor;_
