NPN;construction;preposition;noun;pre_lemma;context_pre;costr;context_post;number_of_noun;Type;other_cxn;meaning;syntactic_function
disappunto a disappunto;no;a;disappunto;aggiungere;Si diede subito della stupida e questo fatto aggiunse;disappunto a disappunto;.;sg;verbal;yes;distractor;_
caso a caso;no;a;caso;da;I risultati sono estremamente variabili da;caso a caso;.;sg;PNPN;yes;distractor;_
strato su strato;yes;su;strato;teglia;Cominciai a sbollentare le lasagne e a disporle nella teglia;strato su strato;, ma se avessi potuto distogliere Melchor dal suo gaydar.com gli avrei dato i soldi e gli avrei chiesto di andare a comperarmene una nuova di ghisa.;sg;_;_;succession/iteration/distributivity;modifier
telegrammi su telegrammi;yes;su;telegramma;spedire;So benissimo che tu qui spedivi;telegrammi su telegrammi;.;pl;_;_;greater_plurality/accumulation;nominal
spalla a spalla;yes;a;spalla;procedere;L'uomo al centro era attorniato da due che lo tenevano avviluppato a loro sottobraccio, gli altri affiancati procedevano;spalla a spalla;come a formare un muro invalicabile a protezione del personaggio.;sg;_;_;juxtaposition/contact;modifier
memoria su memoria;yes;su;memoria;essere;Se voi mi chiedete come ciò possa essere -;memoria su memoria;, nient'altro che memoria - io ovviamente non so rispondere, e non perché non esistano «io» e «voi», non più di quanto esistano «qui» e «ora», ma perché l'unica cosa che esiste è il passato ricordato, non ritrovato e - attenzione alla differenza - non rivissuto nell'immediatezza del regno sensoriale, ma semplicemente ritrasmesso.;sg;_;_;succession/iteration/distributivity;modifier
categoria a categoria;no;a;categoria;da;Analogamente può essere trasferito da;categoria a categoria;e da specialità a specialità il sottufficiale e il volontario in congedo della Marina militare, da ruolo a ruolo e da categoria a categoria il sottufficiale e il volontario in congedo dell'Aeronautica militare.;sg;PNPN;yes;distractor;_
spalla a spalla;no;a;spalla;a;Quando il primo se ne accorge, non approfitta del vantaggio per caricare il contendente al fianco - lo avrebbe facilmente abbattuto -, lo raggiunge invece per riallinearsi a;spalla a spalla;nella marcia rituale prima della battaglia.;sg;PNPN;yes;distractor;_
grado a grado;no;a;grado;a;Però ricordatevi che questa malattia non si guarisce subito, ma a;grado a grado;.;sg;PNPN;yes;distractor;_
guancia a guancia;yes;a;guancia;dire;Certo che me ne aveva raccontate di cose, e ricordo benissimo che, durante quei quattro giorni si può dire;guancia a guancia;, a ogni nuova confidenza mi si raddoppiavano i brividi lungo la schiena: perché si fidava tanto, perché si era fidata incondizionatamente di me?;sg;_;_;juxtaposition/contact;modifier
commento a commento;no;a;commento;aggiungere;Volti tirati, ma è inutile aggiungere;commento a commento;.;sg;verbal;yes;distractor;_
cazzate su cazzate;yes;su;cazzata;frullare;Mi aspetto che si metta a ridere come un pazzo e che poi ricominci a frullare;cazzate su cazzate;.;pl;_;_;greater_plurality/accumulation;nominal
anima ad anima;no;a;anima;da;Sembrano interconnesse in una sfida infinita che si tramanda da corpo a corpo, da;anima a anima;, da essere ad essere.;sg;PNPN;yes;distractor;_
spalla a spalla;yes;a;spalla;lavorare;La maggior parte dei dirigenti è lì, a lavorare;spalla a spalla;con l'imprenditore.;sg;_;_;juxtaposition/contact;modifier
punto a punto;no;a;punto;da;Al contrario nel Tipo C, dove il pino domestico è stato seminato in maniera andante e a integrazione di nuclei di latifoglie preesistenti, con conseguente maggiore variabilità da;punto a punto;.;sg;PNPN;yes;distractor;_
parole su parole;yes;su;parola;piallare;Troppe volte si spendono giorni e anni e decadi a piallare;parole su parole;senza sosta e alla fine queste parole sono come zoccoli di legno imperfetti, così scomodi e innaturali da calzare che dopo un po' è meglio tornare alla gomma, più industriale e fredda, ma più pratica, malleabile e comoda.;pl;_;_;greater_plurality/accumulation;nominal
deficit a deficit;no;a;deficit;sommare;tutto vero, dirà il pensionato, ma è anche vero che se sommo;deficit a deficit;prima o poi il buco diventerà tanto grande che sarà difficile riempirlo.;sg;verbal;yes;distractor;_
banca a banca;no;a;banca;da;Una volta compiuta la scelta vengono attivate le procedure di sicurezza, che variano, ma di poco, da;banca a banca;.;sg;PNPN;yes;distractor;_
pedalata su pedalata;yes;su;pedalata;sedere;Non essendo lontana dalla città, raggiungevamo la Carletta in bicicletta, portando sul cannone le ragazze e principiando, con timide e apparentemente occasionali strisciate di ginocchio contro il loro sedere,;pedalata su pedalata;, il rito sessuale ridotto.;sg;_;_;succession/iteration/distributivity;modifier
opera a opera;no;a;opera;da;Certo, ed è persino superfluo ricordarlo, l'orchestrazione del dialogato conosce modulazioni plurime, variando da autore a autore, da;opera a opera;.;sg;PNPN;yes;distractor;_
disastro a disastro;no;a;disastro;impraticabile;" e produrre un'altra riforma inefficace sarebbe aggiungere""";disastro a disastro;.;sg;verbal;yes;distractor;_
goccia a goccia;yes;a;goccia;acqua;Quando l'acqua e gli oli hanno la stessa temperatura (tra i 30 - 35 ° C) aggiungete l'acqua;goccia a goccia;emulsionando con il frullino a immersione.;sg;_;_;succession/iteration/distributivity;modifier
danno a danno;no;a;danno;aggiungerebbe;Guai se non fosse così - ha tuonato Romiti - poiché dopo tanti sforzi si aggiungerebbe;danno a danno;.;sg;verbal;yes;distractor;_
strato su strato;yes;su;strato;cipolla;A sua volta, il pensiero si divide, come dire, anche da se stesso, in accumulo, foglio sopra foglio, azione dopo ricordo, riflessione sopra decisione, lasciandomi come una grande cipolla,;strato su strato;, nel cui cuore profondo risuonano, lancinanti e abissali, le parole del Grande Matthys, il Dio Fornaio.;sg;_;_;succession/iteration/distributivity;modifier
corsi su corsi;yes;su;corso;fare;Ultimamente, siccome si dice che questi ragazzi e queste ragazze non imparano niente, allora si fanno;corsi su corsi;per vedere come avvicinarsi, quindi per curare la relazione, però sempre in un modo strumentale, come mezzo per arrivare al RAZIONALE.;pl;_;_;greater_plurality/accumulation;nominal
goccia a goccia;yes;a;goccia;bere;"È solo che mi piace sentirti parlare di quando il mare si poteva vedere, di quando ci si poteva entrare dentro; mi piace bere,";goccia a goccia;, quel distillato di saggezza che... --- Il distillato di tua mamma!;sg;_;_;succession/iteration/distributivity;modifier
superficie a superficie;no;a;superficie;da;Per il Novecento, il record di vicinanza è già alle nostre spalle e fu stabilito il 4 gennaio 1912, quando tra la Terra e la Luna, da;superficie a superficie;, intercorsero 348.259 chilometri (e 356.375 da centro a centro dei due corpi celesti).;sg;PNPN;yes;distractor;_
goccia a goccia;yes;a;goccia;usare;"Se, invece, la persona a cui volete regalarlo è come Coco Chanel, che diceva sempreche il profumo va messo ""dove si vuole essere baciate"", preferite un flacone: lo userà";goccia a goccia;.;sg;_;_;succession/iteration/distributivity;modifier
libro a libro;no;a;libro;da;Il Corpus Hermeticum, essendo una compilazione, contiene idee che spesso si contraddicono da;libro a libro;.;sg;PNPN;yes;distractor;_
periodi su periodi;no;su;periodo;avere;Tornando al banco,devo dire che i suoi dischi li amo tuttora,certo hanno avuto;periodi su periodi;ma son sempre stati più che dignitosi.;pl;NsuNgiù;yes;distractor;_
strato su strato;yes;su;strato;sistemare;Nel ventre dell'acropoli, una collina compresa fra via Santa Maria in Costantinopoli, via Foria e via Tribunali, le epoche si sono sistemate;strato su strato;, dalle mura greche che risalgono alla fondazione nel V secolo avanti Cristo, fino agli edifici ottocenteschi.;sg;_;_;succession/iteration/distributivity;modifier
obiezioni su obiezioni;yes;su;obiezione;sollevare;Se avessi negato l'ubriachezza di George, se avessi cercato di nasconderla sollevando;obiezioni su obiezioni;perché il rilevamento del tasso alcolico eseguito mezz'ora dopo l'incidente non venisse acquisito come prova, se avessi fatto tutto ciò non avrei potuto ottenere un risultato favorevole al mio cliente.;pl;_;_;greater_plurality/accumulation;nominal
strato su strato;yes;su;strato;formare;La storia poco nota di questa parte di Roma è di straordinario interesse e basterebbe quasi, da sola, a illustrare attraverso quali peripezie militari e religiose si sia venuta formando,;strato su strato;, la città attuale.;sg;_;_;succession/iteration/distributivity;modifier
centro a centro;no;a;centro;da;La distanza fra le grandi colonne è pari, da;centro a centro;", a 4,52 metri; nel disegno è di 4,51 metri.";sg;PNPN;yes;distractor;_
punto a punto;no;a;punto;da;Stanno, invece, in un continuum dove tutte le interazioni si propagano da;punto a punto;.;sg;PNPN;yes;distractor;_
goccia a goccia;yes;a;goccia;amarezza;Il generale si mise a distillare le sue amarezze;goccia a goccia;.;sg;_;_;succession/iteration/distributivity;modifier
goccia a goccia ;no;a;goccia;a;Il giardiniere versò il latte a;goccia a goccia;ai piedi dell'albero fino a che sorse il sole.;sg;PNPN;yes;distractor;_
goccia a goccia ;no;a;goccia;a;Ufficialmente non c'è nè soddisfazione nè rammarico, nelle file dello stato maggiore di Alleanza nazionale, in questa serata elettorale in cui dati giungono a;goccia a goccia;, prima ancora degli exit poll ufficiali, confermando che al Nord il Polo va forte.;sg;PNPN;yes;distractor;_
pietra su pietra;yes;su;pietra;aggiungere;Secondo Rauber, l'organismo vivente non è costruito come un edificio, aggiungendo;pietra su pietra;in modo ordinato.;sg;_;_;greater_plurality/accumulation;nominal
palmo a palmo;no;a;palmo;a;Stupita, scopriva la forma nuova e sorprendente del corpo del suo amico, il calore, il gusto, l'aroma, lo esplorava conquistandolo a;palmo a palmo;, seminandolo di carezze appena inventate.;sg;PNPN;yes;distractor;_
casella a casella;no;a ;casella;da;"Per questo motivo oggi sono necessari anche i portalettere: quando passeremo alla posta elettronica ""pura"", cioè che viaggia da";casella a casella;(la casella è un apparecchio tipo Internet) allora si vedrà.;sg;PNPN;yes;distractor;_
spalla a spalla;yes;a;spalla;inglese;Proprio mentre i piloti dei jet americani e inglesi,;spalla a spalla;", scaricano ogni giorno bombe su Saddam e schivano il fuoco della sua contraerea, in una marziale conferma della storica ""relazione speciale"" tra i due paesi, l'ambasciatore americano a Londra è stato convocato al ministero del commercio per ricevere una ferma e ufficiale protesta del governo di Tony Blair.";sg;_;_;juxtaposition/contact;modifier
volta a volta;no;a;volta;eccezione;" e questo vale perfino per quelli che non l'hanno mai conosciuto se non attraverso i film: e si sono a""";volta a volta;"identificati nella sposina ingenua di Lo sceicco bianco, nei Vitelloni annoiati e smargiassi, in Gelsomina vittima e Zampanò carnefice, nei bidonisti che coltivano l'arte di arrangiarsi, in Marcello che galleggia sull'onda dolcevitaiola o si confessa homo perplexus in 8 1\2; e in tantissimi altri personaggi.";sg;PNPN;yes;distractor;_
bandiere su bandiere;no;su;bandiera;dire;"Come se ci fosse bisogno di una voce dall' alto che dica""";bandiere su bandiere;" giù"".";pl;NsuNgiù;yes;distractor;_
capitolo a capitolo;no;a;capitolo;da;All'interno del bilancio amministrativo, la Commissione può procedere, nei limiti e alle condizioni fissate dal regolamento stabilito in esecuzione dell'articolo 78 nono, a trasferimenti di crediti, sia da;capitolo a capitolo;, sia da suddivisione a suddivisione.;sg;PNPN;yes;distractor;_
metri su metri;yes;su;metro;divorare;Da questo momento in poi, Beckham continuerà almeno per un'ora a divorare;metri su metri;, avversari su avversari, con una facilità che fa male al cuore.;pl;_;_;greater_plurality/accumulation;nominal
braccio a braccio;no;a;braccio;da;Sembrerà assurdo ma il movimento anti-vaccinista è nato ancor prima della vaccinazione, durante la variolazione, ovvero il passaggio del vaiolo da pustola a pustola, da;braccio a braccio;, che, tuttavia, presentava un tasso di mortalità piuttosto alto (intorno al 6-7%), che ha creato il rifiuto di questo tipo di terapia.;sg;PNPN;yes;distractor;_
gomito a gomito;yes;a;gomito;Brasile;Dal 7 al 10 maggio sono stato in Brasile,;gomito a gomito;con 10 baristi, provenienti da tutto il mondo, selezionati per partecipare a Barista & Farmer, il talent show made in Italy pensato per permettere ai baristi di andare alle origini del prodotto con cui lavora tutti i giorni e di cui è appassionato: il caffè.;sg;_;_;juxtaposition/contact;modifier
goccia a goccia;yes;a;goccia;passare;È però forse più pratico procurarsi un buon prodotto, già confezionato in forma di oliatore, con il quale passare,;goccia a goccia;, tutte le maglie della catena.;sg;_;_;succession/iteration/distributivity;modifier
volume su volume;no;su;volume;indietro;Questo è un semplice lettore con play pausa avanti indietro;volume su volume;giù.;sg;NsuNgiù;yes;distractor;_
gomito a gomito;yes;a;gomito;hôte;Credo di avere già scritto su questo mio diario l'impressione che ho riportato di quella grande birreria monacense dove i bavaresi si affollano intorno a lunghe tables d'hôte,;gomito a gomito;, svergognandosi di salsicce untuose e sorbendosi boccali grandi quanto un tino, uomini e donne, le donne più ridanciane, rumorose e volgari degli uomini.;sg;_;_;juxtaposition/contact;modifier
albero ad albero;no;a;albero;da;Non un solo silenzio, ma parecchi: quello del muschio sotto i piedi, quello delle ombre da;albero ad albero;, il silenzio di un piccolo ruscello in esplorazione di pezzetti di terreno, i silenzi che lo attorniavano mentre sbucava su una radura.;sg;PNPN;yes;distractor;_
curve su curve;yes;su;curva;389;All'altezza della rocca di Posada si penetra nell'interno proseguendo sulla statale 389:;curve su curve;dove è possibile non incrociare altre macchine.;pl;_;_;greater_plurality/accumulation;nominal
pietra su pietra;yes;su;pietra;costruire;I monaci hanno progettato e costruito;pietra su pietra;, cattedrali e monasteri.;sg;_;_;succession/iteration/distributivity;modifier
brano a brano;no;a;corpo;a;Talora le passava per la testa una fuggevole meraviglia: che si possa esser trascinati così mentre si muore a;brano a brano;, in mezzo a tutti gli altri, e nessuno se ne accorge…;sg;PNPN;yes;distractor;_
spalla a spalla;yes;a;spalla;combattere;Era per vendicarsi di una condanna ingiusta che aveva combattuto;spalla a spalla;con quegli stessi Uberti che a Campaldino militavano tra le file nemiche o quella alleanza, che soltanto pochi mesi prima gli sarebbe sembrata contro natura, aveva una più profonda e nobile giustificazione?;sg;_;_;juxtaposition/contact;modifier
gomito a gomito;yes;a;gomito;stare;All'alba di ieri, su quella carcassa arrivata dritta sulla spiaggia di Le Cannella una delle località di mare più belle di Isola Capo Rizzuto stavano;gomito a gomito;317 persone, per lo più curdi, pakistani e afgani.;sg;_;_;juxtaposition/contact;modifier
guancia a guancia;yes;a;guancia;che;Primo piano dei due volti - quello scuro di mio figlio e quello chiarissimo di Hans - che,;guancia a guancia;, ridono felici.;sg;_;_;juxtaposition/contact;modifier
strati su strati;yes;su;strato;sovrapporre;"""Basta con le tante scene di passeggeri che viaggiano sovrapposti";strati su strati;", come in una dantesca millefoglie - è sbottato in una diretta Facebook il Governatore con il suo solito linguaggio colorito - da oggi pugno duro: i campani potranno disporsi al massimo su tre strati"".";pl;_;_;greater_plurality/accumulation;nominal
palmo a palmo;yes;a;palmo;controllare;La ragazza, piuttosto pallida ed esile, controllò;palmo a palmo;l'indumento alla ricerca di eventuali macchie, verificò le cuciture e gli orli, poi la drappeggiò attorno alle sue spalle e sul braccio sinistro e curò le pieghe una per una come se stesse rivestendo il suo padrone.;sg;_;_;succession/iteration/distributivity;modifier
gomito a gomito;yes;a;gomito;silenzio;Mi insegnò a lavorare coi ferri e stavamo lunghe ore in silenzio,;gomito a gomito;, su quelle sedie della cucina che mi dimenticavo di far impagliare.;sg;_;_;juxtaposition/contact;modifier
lettere su lettere;yes;su;lettera;scrivere;Ma rari sono gli spiragli che si aprono per l'ex bracciante, facchino, portiere di notte, militante dell'Autonomia Operaia negli anni di piombo che, per sfogarsi dei rifiuti, scrive;lettere su lettere;.;pl;_;_;greater_plurality/accumulation;nominal
palmo a palmo;yes;a;palmo;terra;Ma le guerre non si vincono né in aria né sull'acqua, si vincono sulla terra,;palmo a palmo;, uomo contro uomo.;sg;_;_;succession/iteration/distributivity;modifier
ceppo a ceppo;no;a;ceppo;da;Gli enzimi di parecchi ceppi possono essere confrontati mediante tecniche statistiche che rivelano la divergenza genetica relativa da;ceppo a ceppo;.;sg;PNPN;yes;distractor;_
testa a testa;yes;a;testa;essere;Seduti a un tavolino erano;testa a testa;il luminare di Oxford e il cameriere, l'instancabile cercatore della tomba, sorbendo una tazza di tè.;sg;_;_;juxtaposition/contact;modifier
anno a anno;no;a;anno;da;I raccolti rivaleggiano gli uni con gli altri, da;anno a anno;o da luogo a luogo.;sg;PNPN;yes;distractor;_
voto su voto;yes;su;voto;conquistare;E due candidati in lizza, decisi a conquistare;voto su voto;la fiducia degli elettori.;sg;_;_;succession/iteration/distributivity;modifier
libri su libri;yes;su;libro;continuare;Le ho già detto che ricevo in continuazione;libri su libri;.;pl;_;_;greater_plurality/accumulation;nominal
mente su mente;no;su;mente;parte;"Il credersi ""separati"" in più parti (";mente su mente;"giù, corpo questo e corpo quell'altro, questo è meglio e quello è peggio) è solo il frutto d'una visione ""schizofrenica"".";sg;NsuNgiù;yes;distractor;_
telegrammi su telegrammi;yes;su;telegramma;mandare;E quanto alla nonna, che ci può essere di più comico e disgustoso che mandare;telegrammi su telegrammi;domandando continuamente: è morta o non è morta?.;pl;_;_;greater_plurality/accumulation;nominal
palmo a palmo;yes;a;palmo;Gargano;Ovviamente non possiamo battere quella parte del Gargano;palmo a palmo;.;sg;_;_;succession/iteration/distributivity;modifier
gomito a gomito;yes;a;gomito;sushi;"Sono impazzito per il mercato del pesce di Tokyo, colazione alle quattro di mattina, mangiando ""yakitori"", ""ramen"", sushi,";gomito a gomito;con uno che puzza di pesce perchè lì ci lavora.;sg;_;_;juxtaposition/contact;modifier
prove su prove;yes;su;prova;fare;La squadra di tecnici della Telecom fa;prove su prove;per trovare l'inghippo.;pl;_;_;greater_plurality/accumulation;nominal
spalla a spalla;yes;a;spalla;dare;I sondaggi ufficiali (finchè si potevano rendere pubblici) e quelli ufficiosi li danno;spalla a spalla;, con una quota tra il 25 e il 30 % dei consensi al primo turno.;sg;_;_;juxtaposition/contact;modifier
strati su strati;yes;su;strato;da;L'edificio era chiuso con assi di legno e fregiato da;strati su strati;di graffiti.;pl;_;_;greater_plurality/accumulation;nominal
riunioni su riunioni;yes;su;riunione;fare;Da dieci giorni stiamo dicendo in tutte le sedi che bisognava intervenire: si è perduto tempo a discutere, a prendere contatti diplomatici, a fare;riunioni su riunioni;, dichiarazioni su dichiarazioni, mentre la tragedia albanese richiedeva interventi rapidi, decisi, organici, massicci.;pl;_;_;greater_plurality/accumulation;nominal
guancia a guancia;yes;a;guancia;brillantina;La tromba è guerresca, angelica, apocalittica, vittoriosa, suona la carica, il sassofono fa ballare bulletti di periferia coi capelli unti di brillantina,;guancia a guancia;con ragazze sudate.;sg;_;_;juxtaposition/contact;modifier
goccia a goccia;yes;a;goccia;ma;L'acqua, dal canto suo, non scorreva più fluente, ma;goccia a goccia;, Una folla di gocce che se ne andavano mentre Mahdokht pativa.;sg;_;_;succession/iteration/distributivity;modifier
difficoltà a difficoltà;no;a;difficoltà;aggiungere;Dalla scatola a sorpresa della nostra politica, che non riesce a correggere se stessa, rischiano continuamente di uscire riforme sbagliate , che aggiungono;difficoltà a difficoltà;.;sg;verbal;yes;distractor;_
strato su strato;yes;su;strato;che;Ad un certo punto incontrarono una fontana ghiacciata che,;strato su strato;", aveva formato una specie di scultura che sembrava la sagoma di un animale; ma a dire il vero bastava girarsi intorno per riconoscere nel paesaggio mille immagini diverse disegnate dalla galaverna.";sg;_;_;succession/iteration/distributivity;modifier
guancia a guancia;yes;a;guancia;accostare;Vide ancora come i signori vicino al suo viso, accostati;guancia a guancia;, osservavano l'esito.;sg;_;_;juxtaposition/contact;modifier
miti a miti;no;a;miti;nome;Si tratta di sostituire nomi a nomi,;miti a miti;, teorie a teorie.;sg;verbal;yes;distractor;_
splendore a splendore;no;a;splendore;aggiungere;Ma queste fantasie schliemanniane non fanno altro che aggiungere;splendore a splendore;.;sg;verbal;yes;distractor;_
palmo a palmo;yes;a;palmo;battere;Lui, quando ancora Bossi studiava alla Scuola Radio Elettra, batteva;palmo a palmo;le province di Verona, Vicenza e Treviso per diffondere il verbo della Serenissima.;sg;_;_;succession/iteration/distributivity;modifier
palmo a palmo;yes;a;palmo;battere;Da quella sera, fino a ieri pomeriggio, carabinieri, polizia e vigili del fuoco hanno continuato a cercare madre e figlio, battendo;palmo a palmo;la zona lungo il fiume e scandagliando le acque del Livenza, che a tratti ha correnti molto forti e profondità dai cinque ai nove metri.;sg;_;_;succession/iteration/distributivity;modifier
palmo a palmo;yes;a;palmo;osservare;Tutte le auto vengono osservate;palmo a palmo;, illuminate da fortissime luci bianche.;sg;_;_;succession/iteration/distributivity;modifier
spalla a spalla;yes;a;spalla;pratica;Marco andò all'unico tavolino libero, sul fondo, e quando finalmente si sedette con la schiena al muro si ritrovò in pratica;spalla a spalla;con due avventori, entrambi assorti nella lettura del giornale e quindi apparentemente disinteressati a lui.;sg;_;_;juxtaposition/contact;modifier
materia su materia;yes;su;materia;di;Cazzetti, fichette, zinnette, culetti sodi esplodono su di me in una cosmogonia di;materia su materia;.;sg;_;_;greater_plurality/accumulation;nominal
generazioni su generazioni;yes;su;generazione;influenzare;La passione dichiarata è una sola: disseppellire e filtrare leggende di isole mai esistite o trasfigurate o disperse che tuttavia avevano influenzato;generazioni su generazioni;di navigatori portoghesi spagnoli inglesi, e popolato le loro mappe.;pl;_;_;greater_plurality/accumulation;nominal
goccia a goccia;yes;a;goccia;irrigazione;Secondo, meglio usare sistemi di irrigazione;goccia a goccia;, che non quelli a getto nebulizzato inmodoche vi sia un minor consumo d'acqua.;sg;_;_;succession/iteration/distributivity;modifier
goccia a goccia;yes;a;goccia;sangue;come una ferita che lascia sgorgare il sangue;goccia a goccia;.;sg;_;_;succession/iteration/distributivity;modifier
sorpresa a sorpresa;no;a;sorpresa;aggiungere;"Era passata automaticamente dal ""lei"" al ""tu"", e questo aggiunse";sorpresa a sorpresa;, spiazzando completamente Stefano, che cercò di chiudere alla svelta la sua conversazione telefonica: - Sì... beh... ecco... allora ci sentiamo domani, d'accordo?;sg;verbal;yes;distractor;_
mistero a mistero;no;a;mistero;aggiungere;Due elementi, ritornati fino a noi dalla profondità del tempo insieme a Oetzi e alle sue povere cose, forse spiegano in parte la sua fine, forse aggiungono;mistero a mistero;.;sg;verbal;yes;distractor;_
grado a grado;no;a;grado;a;Onde (suggeriva oltre cent'anni fa Leopardi) la risposta a una forzatura con un ritorno all'indietro, che a;grado a grado;conduca a transizioni e risultati effettivi, non apparenti e superficiali.;sg;PNPN;yes;distractor;_
brano a brano;no;a;brano;a;In questo fango si genererà poi una quantità di piccole mosche e di altri animaletti che si raggomitoleranno nel mio sangue e mi divoreranno a;brano a brano;.;sg;PNPN;yes;distractor;_
caso a caso;no;a;caso;da;Nonostante l'omogeneità delle indicazioni di legge, la realtà dei Consultori nelle Regioni risulta diversa da;caso a caso;.;sg;PNPN;yes;distractor;_
voto su voto;yes;su;voto;essere;Per poi tornare a farsi la guerra, perché alle elezioni europee la contesa sarà;voto su voto;, e i due si contendono lo stesso elettorato.;sg;_;_;succession/iteration/distributivity;modifier
riunioni su riunioni;yes;su;riunione;fare;Come sempre accade, appena un matrimonio va a rotoli si inizia a lavorare finoa tardi, a fare;riunioni su riunioni;, viaggi improvvisi.;pl;_;_;greater_plurality/accumulation;nominal
banca a banca;no;a;banca;da;Per chiudere questo mutuo dovrete pagare una penale del 3% (ma come si vede nella tabella la percentuale cambia da;banca a banca;e, in alcuni casi, il conteggio si può rivelare molto complicato) sull'ammontare del capitale ancora da rimborsare (2.091.736 lire).;sg;PNPN;yes;distractor;_
guancia a guancia;yes;a;guancia;così;Stemmo a lungo insieme, così,;guancia a guancia;.;sg;_;_;juxtaposition/contact;modifier
feste su feste;yes;su;festa;indire;Per questa ragione, cioè per aumentare il numero delle iscrizioni, gli scissionisti del Pd hanno deciso di indire;feste su feste;in tutta Italia durante l'estate.;pl;_;_;greater_plurality/accumulation;nominal
sofferenza a sofferenza;no;a;sofferenza;aggiungere;Mi rendo conto di aggiungere;sofferenza a sofferenza;.;sg;verbal;yes;distractor;_
