NPN;construction;preposition;noun;pre_lemma;context_pre;costr;context_post;number_of_noun;Type;other_cxn;meaning;syntactic_function
posizioni su posizioni;yes;su;posizione;risalire;A quel punto la decisione vincente: si strappa la visiera e incomincia a risalire;posizioni su posizioni;.;pl;_;_;greater_plurality/accumulation;nominal
spalla a spalla;yes;a;spalla;essere;Con due o tre passi si è avvicinata a Vera, è;spalla a spalla;con lei, si è piazzata davantiall'obiettivo con un'espressione severa, compunta.;sg;_;_;juxtaposition/contact;modifier
palmo a palmo;yes;a;palmo;scrutare;E invece la sua macchina, accompagnata dai rintocchi della campana di Montecitorio, è arrivata puntualissima sul piazzale della Camera, scrutato;palmo a palmo;dai tiratori scelti appostati sui tetti.;sg;_;_;succession/iteration/distributivity;modifier
guancia a guancia;yes;a;guancia;cheek;"Azzurro Caltagirone è a un tavolo ""cheek to cheek"",";guancia a guancia;con il pretone.;sg;_;_;juxtaposition/contact;modifier
assalti su assalti;yes;su;assalto;lanciare;Sull'ala destra, la cavalleria di Besso si era infranta contro la massa della fanteria pesante greca, ma continuava a lanciare;assalti su assalti;, a ondate, come marosi che frangevano contro le rocce.;pl;_;_;greater_plurality/accumulation;nominal
mattone a mattone;no;a;mattone;da;n questi casi l'intensità dell'urto non era determinante, bastava scuotere l'edificio una sola volta e le vibrazioni si propagavano con incredibile leggerezza e rapidità da;mattone a mattone;.;sg;PNPN;yes;distractor;_
gomito a gomito;yes;a;gomito;trovare;Era la prima volta che mi trovavo;gomito a gomito;con qualcosa o qualcuno di nobile stirpe, la mia famiglia inclusa.;sg;_;_;juxtaposition/contact;modifier
decibel a decibel;no;a;decibel;aggiungere;Tutti in fila verso l'ingresso del Motodrom, con le bandiere sottobraccio e le trombe da stadio per aggiungere;decibel a decibel;quando Michael e Ralf fanno guaire il motore sotto le tribune.;sg;verbal;yes;distractor;_
ritardi su ritardi;yes;su;ritardo;collezionare;Una sorta di modello finlandese, sulla falsariga della società che ha affidato ad Areva la costruzione del reattore di Olkiluoto (che sta però collezionando;ritardi su ritardi;, l'ultimo reso noto proprio ieri).;pl;_;_;greater_plurality/accumulation;nominal
malumore a malumore;no;a;malumore;aggiungere;Tanto più che questo improvviso e contestato trasferimento della distribuzione aggiunge;malumore a malumore;.;sg;verbal;yes;distractor;_
goccia a goccia ;no;a;goccia;a;Questo verme si nutre del sangue umano, che si procura facendo piccolissimi fori nella mucosa dell'intestino, da cui lascia colare il sangue a;goccia a goccia;, per giorni e giorni, per anni e anni.;sg;PNPN;yes;distractor;_
materia a materia;no;a;materia;da;Ad esempio, la misura in cui le Ict vengono utilizzate come strumento per insegnare altre discipline varia enormemente da;materia a materia;(in prima fila ci sono matematica, tecnologia, informatica e inglese) e da scuola a scuola: alcune scuole secondarie ne fanno uso frequentemente, altre nient'affatto.;sg;PNPN;yes;distractor;_
spalla a spalla;yes;a;spalla;oggi;Se per decenni si sono vicendevolmente ignorate, Italia e Albania sono oggi;spalla a spalla;.;sg;_;_;juxtaposition/contact;modifier
crosta su crosta;yes;su;crosta;successivo;Dall'alto del Forte capisco il rinnovo degli strati successivi,;crosta su crosta;.;sg;_;_;succession/iteration/distributivity;modifier
palmo a palmo;yes;a;palmo;battere;Gli promisi nuove fiere o, in alternativa, un viaggio in cui avremmo battuto;palmo a palmo;il Wisconsin.;sg;_;_;succession/iteration/distributivity;modifier
goccia a goccia;yes;a;goccia;che;Meg Conti scoppiò a piangere, tanta era l'emozione, ma erano lacrime dolci che;goccia a goccia;le lavavano un'antica colpa e le ridavano il desiderio di vivere.;sg;_;_;succession/iteration/distributivity;modifier
rovescio su rovescio;yes;su;rovescio;assassino;Sul sei pari abbiamo uno scambio assassino,;rovescio su rovescio;, e io sono un fascio di nervi scossi.;sg;_;_;succession/iteration/distributivity;modifier
schiaffoni su schiaffoni;yes;su;schiaffone;prendere;È il piccoletto dei Brutos che prendeva;schiaffoni su schiaffoni;.;pl;_;_;greater_plurality/accumulation;nominal
stagione a stagione;no;a;stagione;da;Pur con evidenti differenze da;stagione a stagione;, la storia ha dunque per il periodico fiorentino il ruolo dell'appello alle coscienze civili, esercitato in nome di una singolarità nazionale e di un primato così nitidi da giustificare anche le manipolazioni della verità dei fatti che gli strumenti letterari devono rendere piacevolmente credibili e persuasivi agli occhi di un'opinione pubblica da costruire.;sg;PNPN;yes;distractor;_
spalla a spalla;yes;a;spalla;volata;Si profila dunque una volata;spalla a spalla;che probabilmente si concluderà con il ballottaggio del 23 ottobre prossimo.;sg;_;_;juxtaposition/contact;modifier
mille su mille;no;su;mille;sembrare;Il prezzo è stato 8.500 che mi sembra,; mille su mille;giù in linea con quello che si vede in giro.;sg;NsuNgiù;yes;distractor;_
palloni su palloni;yes;su;pallone;respingere;Con la palla a terra è un pericolo per i suoi, con la capoccia, che ricorda uno spillo, respinge;palloni su palloni;.;pl;_;_;greater_plurality/accumulation;nominal
onda su onda;yes;su;onda;arte;Il segreto sta nel piegare i tovaglioli a regola d'arte,;onda su onda;, a cono, a busta di lettera, per far trovare un bigliettino intrigante.;sg;_;_;succession/iteration/distributivity;modifier
spalla a spalla;yes;a;spalla;sorgere;Le teste giganti dei candidati sorridono a gara, e Galerio dice che sembrano mostri, mostri che sorgono;spalla a spalla;dalle viscere della terra.;sg;_;_;juxtaposition/contact;modifier
onda a onda;yes;a;onda;crescere;Il rumore del mare continuava a coltivare e a vedere crescere,;onda a onda;, il rigoglio del suo disinteresse.;sg;_;_;succession/iteration/distributivity;modifier
voti su voti;yes;su;voto;raccattare;Ma i grattacapi più grandi arrivano da Salvini, che prima raccatta;voti su voti;, incentrando tutto il suo operato sulla lotta all'immigrazione clandestina, riducendo i numeri degli sbarchi (grazie anche ai precedenti accordi portati avanti da Marco Minniti con le tribù libiche) e poi fa saltare il banco sulla Tav.;pl;_;_;greater_plurality/accumulation;nominal
mistero a mistero;no;a;mistero;aggiungere;"Nel comunicato con cui annuncia l'operazione, infatti, Interbanca sottolinea che la società ""fa riferimento a un medio gruppo industriale italiano"", mantenendo segreto il suo nome e aggiungendo";mistero a mistero;.;sg;verbal;yes;distractor;_
domande su domande;yes;su;domanda;fare;Interi pomeriggi a bere tè ascoltando il racconto della loro vita, e io lì a fare;domande su domande;ome Maria De Filippi.;pl;_;_;greater_plurality/accumulation;nominal
abbondanza ad abbondanza;no;a;abbondanza;aggiungere;Anche per i Benetton il miliardo messo a disposizione dalla Cassa, con l'astensione in consiglio di Viesti e di un altro componente, sembra aggiungere;abbondanza ad abbondanza;.;sg;verbal;yes;distractor;_
smentita a smentita;no;a;smentita;sommare;Ma il giornalista ha confermato la bontà della notizia, sommando;smentita a smentita;.;sg;verbal;yes;distractor;_
volta a volta;no;a;volta;a;Si presentò ai giovani lettori con una bella promessa: Questo vostro foglio, a;volta a volta;mattacchione, sereno, sentimentale e utile sempre, intende d'ora in poi giovare al vostro spirito senza essere punto noioso.;sg;PNPN;yes;distractor;_
mani su mani;no;su;mano;fare;Anche il testo della canzone era stato scritto per essere abbastanza esplicativo e per mostrare cosa si sarebbe dovuto fare (;mani su mani;giù mani dove vuoi) ma l'immagine dei Ricchi & Poveri non era tale da poter imporre un ballo inventato di sana pianta anche perché non c'era più la moda di inventarne di nuovi per il tramite di una canzone lanciata appositamente.;pl;NsuNgiù;yes;distractor;_
corpo a corpo;no;a;corpo;a;Le tattiche riflettono le tradizionali forme di lotta a;corpo a corpo;.;sg;PNPN;yes;distractor;_
gomito a gomito;yes;a;gomito;lavorare;Per prima cosa ottenne un sostanzioso prestito grazieall'appoggio e alla fiducia di banchieri legati all'agente commerciale di suo padre, poi mandò i commandeurs ai canneti, a lavorare;gomito a gomito;con gli stessi uomini che prima avevano martirizzato e li rimpiazzò con altri meno depravati, ridusse i castighi e assunse un veterinario, che trascorse due mesi a Saint - Lazare cercando di restituire un po 'di salute ai neri.;sg;_;_;juxtaposition/contact;modifier
grado a grado;no;a;grado;a;Il sacerdote sentì crescere la tensione di Micon: le mani torturate gli serrarono le spalle, il nobile volto si fece cinereo, e a;grado a grado;un brivido pervase tutto il suo corpo finché ogni nervo sembrò vibrare per lo sforzo…;sg;PNPN;yes;distractor;_
spalla a spalla;yes;a;spalla;animale;Compiuta la spettacolare manovra lanciarono di nuovo al galoppo i loro animali,;spalla a spalla;, testa a testa, lasciandosi dietro una densa nuvola di polvere, e si arrestarono in brevissimo spazio davantial principe.;sg;_;_;juxtaposition/contact;modifier
milioni su milioni;yes;su;milione;sempre;Chi non spera che in un tweet possa lanciare o magari nascondere un qualche indizio di come riesca a guadagnare sempre;milioni su milioni;di dollari andando generalmente controcorrente?;pl;_;_;greater_plurality/accumulation;nominal
ritardi su ritardi;yes;su;ritardo;accumulare;E se il verboso cattivo accumula;ritardi su ritardi;nelle sue comunicazioni finali al buono, nei teatri d'una volta si gridava «e partite, cretini!»;pl;_;_;greater_plurality/accumulation;nominal
punto a punto;no;a;punto;da;Oggi ci rendiamo conto che la critica faradayana alla nozione di particella, inquanto scaturisce da una fisica del continuum dove le interazioni agiscono da;punto a punto;.;sg;PNPN;yes;distractor;_
guancia a guancia;yes;a;guancia;lentamente;Pereira restò solo al tavolino, sostiene, ordinò un'altra limonata e se la bevve a piccoli sorsi guardando i ragazzi che ballavano lentamente;guancia a guancia;.;sg;_;_;juxtaposition/contact;modifier
parola su parola;yes;su;parola;romantico;"E poi, ""Il cambio della guardia a Whitehall..."" che era romantico; e poi, costruendo";parola su parola;", lesse: ""I soldati della cavalleria le dissero che il cavallo aveva la coda verde; ma per lei era un cavallo qualsiasi"".";sg;_;_;succession/iteration/distributivity;modifier
caserma a caserma;no;a;caserma;da;Che invece d'una esercitazione notturna o d'uno spostamento di forze da;caserma a caserma;si trattasse d'una manovra connessa al problema della Torre?;sg;PNPN;yes;distractor;_
teorie a teorie;no;a;teorie;mito;Si tratta di sostituire nomi a nomi, miti a miti,;teorie a teorie;.;sg;verbal;yes;distractor;_
spalla a spalla;yes;a;spalla;e;Tutto sommato, l'Italia, partita tardi, ha recuperato, piazzandosi dietro la Germania e;spalla a spalla;con gli inglesi.;sg;_;_;juxtaposition/contact;modifier
palmo a palmo;yes;a;palmo;mano;"Dice l'iscrizione ""che esse congiungono le mani";palmo a palmo;""", allegorica immagine che descrive il passaggio da un segno zodiacale a quello precedente, passaggio che avviene nell'equinozio di primavera ogni 2160 anni.";sg;_;_;succession/iteration/distributivity;modifier
camino a camino;no;a;camino;da;L'Atrium era pieno di persone che si spostavano da;camino a camino;, sigillandoli.;sg;PNPN;yes;distractor;_
bar a bar;no;a;bar;da;Non gli avrebbe detto dove aveva passato la notte, non gli avrebbe raccontato di quel lungo vagabondaggio da;bar a bar;, cominciato subito dopo la sua telefonata e terminato con un sonno ristoratore assieme ai barboni della villa comunale.;sg;PNPN;yes;distractor;_
distorsione a distorsione;no;a;distorsione;aggiungere;Il fatto è che il monopolio, privato o pubblico che sia, modella di sè il sistema e aggiunge;distorsione a distorsione;finché tutti hanno torto, avendo tutti ottime ragioni.;sg;verbal;yes;distractor;_
balcone a balcone;no;a;balcone;da;La sua ultima creatura erano stati i bastoni per reggere i calici dello spumante con cui aveva allietato i brindisi da;balcone a balcone;, ma ormai era già diventata la penultima, soppiantata da quel telefono di cui smaniavo di sperimentare le potenzialità.;sg;PNPN;yes;distractor;_
spalla a spalla;yes;a;spalla;Polo;Torino, Rifondazione apre a Castellani L'ex ministro Costa corre per il Polo,;spalla a spalla;con il sindaco.;sg;_;_;juxtaposition/contact;modifier
categoria a categoria;no;a;categoria;da;Negli ultimi anni il fatturato dei professionisti - spiega Gaetano Stella, presidente di Confprofessioni - è calato da;categoria a categoria;dal 20 al 40 per cento.;sg;PNPN;yes;distractor;_
domande su domande;yes;su;domanda;a;Faye ha scoperto ancora un'altra Julie rispondere a;domande su domande;.;pl;_;_;greater_plurality/accumulation;nominal
foglia a foglia;yes;a;foglia;scomparire;Nanni guarda il triangolino di frittata deflagrare e ricomporsi nel piatto di Cecilia, mentre l'insalata scompare;foglia a foglia;con estenuante lentezza, e tutte le cose che vorrebbe dirle non le può dire.;sg;_;_;succession/iteration/distributivity;modifier
gomito a gomito;yes;a;gomito;sera;Lorenzo, nella sua ingenuità, si era immaginato una vita meravigliosa - di giorno a costruire mattoni, e la sera;gomito a gomito;con i Beatles e a passeggiare a braccetto con Jean Shrimpton o Marianne Faithfull per Carnaby Street.;sg;_;_;juxtaposition/contact;modifier
spalla a spalla;yes;a;spalla;stare;Sono addestrati per il campo di battaglia, per stare;spalla a spalla;dietro gli scudi, con la lancia protesa davanti a sé.;sg;_;_;juxtaposition/contact;modifier
domande su domande;yes;su;domanda;fare;E sa anche che se presenta operazioni un po' bislacche, in consiglio può trovare anche chi comincerà a far;domande su domande;.;pl;_;_;greater_plurality/accumulation;nominal
assurdo ad assurdo;no;a;assurdo;contrapporre;Ma non ha molto senso contrapporre;assurdo ad assurdo;, non si annulleranno mai a vicenda e anzi, l'uno richiama l'altro in una tensione che può anche raggiungere vette esaltanti ma dilania l'uomo, stravolge la prospettiva in cui egli finisce per vedere la vita.;sg;verbal;yes;distractor;_
palmo a palmo;yes;a;palmo;battere;Per individuare le casse di zinco, la polizia batte;palmo a palmo;tutta la basilica, partendo dai sottotetti, scoprendo locali nemmeno mappati nelle cartine catastali, per passare alle stanze che ospitano gli organi, sino a sgabuzzini ricavati vicino alle aule, come quello ispezionato vicino all'attuale aula 201: la coincidenza è interessante, perché la stanza si trova a pochi metri dal quarto piano del palazzo adiacente: proprio la vecchia sede dell'istituto Ludovico da Victoria, la scuola di musica dove Emanuela nel 1983 andava a lezione.;sg;_;_;succession/iteration/distributivity;modifier
justin su justin;no;su;justin;là;belibers.....cazzo calmatevi fate paura....justin di qua justin di là;justin su justin;giù!;X;NsuNgiù;yes;distractor;_
guancia a guancia;yes;a;guancia;ballare;E ha una canzone del cuore, la canzone che ascoltava da govane quando ballava;guancia a guancia;con Filippo di Grecia, suo futuro sposo, ora Filippo d'Edimburgo e Principe consorte.;sg;_;_;juxtaposition/contact;modifier
spalla a spalla;yes;a;spalla;schermo;"Se deciderete di passare un po 'di tempo davanti allo schermo """;spalla a spalla;""" con qualche bambino, scoprirete che i bambini, anche molto piccoli, hanno un rapporto naturale con il computer: un legame affettivo, che li porta immediatamente a un contatto diretto, proprio come con il fluire della lingua materna.";sg;_;_;juxtaposition/contact;modifier
pietra su pietra;yes;su;pietra;cumulativamente;"È necessario fare chiarezza su tali aporie (si ricordi il senso della ‘spiegazione’ in Kant!) ; la filosofia non procede cumulativamente, ‘";pietra su pietra;, né può pensare di porre ordine nel linguaggio che effettivamente parliamo ricorrendo al ‘modello’ di ideografie, valide soltanto nell’ambito di procedure logico-matematiche.;sg;_;_;succession/iteration/distributivity;modifier
gomito a gomito;yes;a;gomito;lavorare;Emiliano è un pm di prima linea: è stato in Sicilia dove ha lavorato;gomito a gomito;"con Rosario Livatino, il giovane magistrato ucciso dalla mafia; poi a Brindisi dove con una serie di inchieste ha decapitato la mafia pugliese, la Sacra Corona Unita.";sg;_;_;juxtaposition/contact;modifier
spalla a spalla;yes;a;spalla;praticamente;La privacy era minima, i detenuti erano praticamente;spalla a spalla;e Ron non rispettava gli spazi.;sg;_;_;juxtaposition/contact;modifier
citazioni su citazioni;yes;su;citazioni;fare;Mi chiese se continuava a fare;citazioni su citazioni;per legittimare le sue teorie.;pl;_;_;greater_plurality/accumulation;nominal
palla su palla;yes;su;palla;giocare;Concludiamo salendo a Noriglio, dove nel girone H, bellissima e tiratissima gara fra Calabria e Puglia che se la giocano;palla su palla;fino al decisivo tie - break.;sg;_;_;succession/iteration/distributivity;modifier
settimane su settimane;yes;su;settimana;di;Ciò può servirti solo ad andare in fondo alla questione del dolore, che è più o meno questo: covare nel corso di;settimane su settimane;un'idea o un'azione risolutiva, frutto di fatica fisica e coraggio imposto, e sentirtela smontare in pochi secondi da una risata distratta.;pl;_;_;greater_plurality/accumulation;nominal
soldi su soldi;yes;su;soldi;fare;Insomma c'è ancora tempo, e spazio, per fare;soldi su soldi;su soldi vendendo e spedendo in tutto il mondo i vecchi libri di carta: tanto più se fatti in casa.;pl;_;_;greater_plurality/accumulation;nominal
punto a punto;no;a;punto;da;L'ATM crea una connessione da;punto a punto;.;sg;PNPN;yes;distractor;_
episodio a episodio;no;a;episodio;saldare;Lo avrebbe appreso a pezzi e bocconi quando a Tiziano Sclavi andava di mettere un poco d'ordine nella sua opera ribollente e provava a saldare;episodio a episodio;, ma troppo presto finiva per interrompere la ricerca, sollecitato da un'altra tentazione.;sg;verbal;yes;distractor;_
canino a canino;no;a;canino;da;Non sarei troppo esigente con l'editore, basterebbe un piccolo anticipo di dodici milioni (tale è la cifra che il mio dentista esige per il nuovo ponte superiore da;canino a canino;, altrimenti, aggiungendoci qualche dente, diciotto milioni e non se ne parla più), una bella copertina blu con il mio nome scritto in bianco ed eventualmente anche il titolo del libro, e... voilà, ecco un uomo felice!;sg;PNPN;yes;distractor;_
punto su punto;no;su;punto;data;Punto croce ricamo una data;punto su punto; giù indico traccia di trama merletto finito.;sg;NsuNgiù;yes;distractor;_
campo a campo;no;a;campo;da;Per muovere il punto di inserzione da;campo a campo;, premere il tasto [tab] o selezionare con il mouse la casella desiderata.;sg;PNPN;yes;distractor;_
scherzi su scherzi;yes;su;scherzo;inanellare;L'anarchico Chaplin aveva imparato a sbeffeggiare i nemici (e anche gli amici) inanellando;scherzi su scherzi;.;pl;_;_;greater_plurality/accumulation;nominal
appezzamento ad appezzamento;no;a;appezzamento;da;Anche il numero di vermi presenti nel suolo per metro quadrato (nei primi 20 cm di profondità), pur variando da;appezzamento ad appezzamento;, non ha mostrato differenze significative.;sg;PNPN;yes;distractor;_
goccia a goccia ;no;a;goccia;a;Quella donna fu sottoposta alla tortura dell'acqua: ne dovette ingurgitare litri e litri, a;goccia a goccia;, attraverso una pezzuola ficcata in gola, fin quasi a morirne soffocata…;sg;PNPN;yes;distractor;_
strato su strato;yes;su;strato;incollare;L'unica traccia di colore era offerta dai manifesti elettorali, sbiaditi e incollati;strato su strato;.;sg;_;_;succession/iteration/distributivity;modifier
goccia a goccia;yes;a;goccia;scorrere;Nel braccio di Bruno è conficcato l'ago e lungo il flessibile scorre;goccia a goccia;la medicina che per il momento regala al suo volto un'aria distesa e l'ombra di un sorriso.;sg;_;_;succession/iteration/distributivity;modifier
gomito a gomito;yes;a;gomito;lavorare;Cosa crede che succeda quando uno della valle di Ossau lavora;gomito a gomito;con uno della valle del Gave?;sg;_;_;juxtaposition/contact;modifier
soldi su soldi;yes;su;soldi;su;Insomma c'è ancora tempo, e spazio, per fare soldi su;soldi su soldi;vendendo e spedendo in tutto il mondo i vecchi libri di carta: tanto più se fatti in casa.;pl;_;_;greater_plurality/accumulation;nominal
storie su storie;yes;su;storia;intrecciare;Ma si capirà anche che Amado era tutt'altro che un narratore naif, capace com'era di utilizzare una vasta tavolozza di tecniche e di intrecciare;storie su storie;in complicate architetture.;pl;_;_;greater_plurality/accumulation;nominal
gomito a gomito;yes;a;gomito;mettere;E non è possibile metterli;gomito a gomito;con le donne gomito a gomito, al lavandino, in un gabinetto.;sg;_;_;juxtaposition/contact;modifier
banca a banca;no;a;banca;da;Per quest'ultimo servizio non c'è alcuna differenza tra tessera vecchia e tessera nuova: sono rimaste in vigore, infatti, le precedenti condizioni economiche, diverse da;banca a banca;, ma in genere gratuite per prelievi agli sportelli automatici del proprio istituto e tariffate (in media dalle 2500 alle 3000 lire) per prelievi in qualsiasi altra banca diversa dalla propria.;sg;PNPN;yes;distractor;_
libri su libri;yes;su;libro;leggere;Di sicuro al distretto avevano pensato che fosse ammattito, vistoche trascorreva le ore del turno trincerato nella sua stanza a leggere;libri su libri;.;pl;_;_;greater_plurality/accumulation;nominal
testa a testa;no;a;testa;pettine;" in pratica incastri molto fini ricavati con fresatura sulle testate delle singole lamelle, che si uniscono a""";testa a testa;nel senso della lunghezza, per poi essere incollate di piatto una sull'altra sotto pressione, formando stretti legami intramolecolari simili alle saldature usate coi metalli.;sg;PNPN;yes;distractor;_
riunioni su riunioni;yes;su;riunione;e;Ma per arrivare sino a quel punto, a quel sospiro di sollievo, ci sono state ore di trattative ininterrotte e telefonate notturne e sveglie all'alba e;riunioni su riunioni;.;pl;_;_;greater_plurality/accumulation;nominal
goccia a goccia;yes;a;goccia;parsimonia;La medicina nutriva Malaussene con parsimonia,;goccia a goccia;.;sg;_;_;succession/iteration/distributivity;modifier
goccia a goccia ;no;a;goccia;a;Per trasformare la nebbia in una sorgente naturale di acqua, bisogna distillarla a;goccia a goccia;come il più prezioso dei whisky.;sg;PNPN;yes;distractor;_
gomito a gomito;yes;a;gomito;giorno;Will (e credo, segretamente, anche Ben) ha sempre invidiato il mio lavoro e il fatto che mi costringa a stare quasi ogni giorno;gomito a gomito;con decine di modelle tutte stupende!;sg;_;_;juxtaposition/contact;modifier
punto a punto;no;a;punto;da;I nuovi sistemi di trasmissione a distanza si differenziano dai precedenti - telegrafo e telefono - perché non costituiscono un legame da;punto a punto;.;sg;PNPN;yes;distractor;_
onda su onda;yes;su;onda;voga;Restando in tema acquatico, si voga;onda su onda;, al concerto dei Litfiba.;sg;_;_;succession/iteration/distributivity;modifier
porta a porta;no;a;porta;da;Suvereto ha una strada centrale da;porta a porta;, su cui trovi belli e dritti palazzi borghesi e plebei in pietra e mattone.;sg;PNPN;yes;distractor;_
brano a brano;no;a;brano;a;Cominciò il corpo a corpo tra la folla e la milizia e più nessuno ebbe pietà: il leone affamato non strappa così a;brano a brano;l'antilope che ha ucciso e che sta mangiando.;sg;PNPN;yes;distractor;_
storielle su storielle;yes;su;storiella;raccontare;Lungo il percorso in auto per far passare quelle lunghe ore mi prodigavo a raccontare;storielle su storielle;.;pl;_;_;greater_plurality/accumulation;nominal
punto a punto;no;a;punto;da;Dev'essere ristudiato il Radiobus «classico», ché la formula da;punto a punto;.;sg;PNPN;yes;distractor;_
anima ad anima;no;a;anima;da;Sembrano interconnesse in una sfida infinita che si tramanda da corpo a corpo, da;anima ad anima;, da essere ad essere.;sg;PNPN;yes;distractor;_
colpo a colpo;no;a;colpo;a;Lui va avanti, martella e inchioda, sale e scende e sposta la scala e ci risale, chiude a;colpo a colpo;il muro esterno della casa che si è costruito.;sg;PNPN;yes;distractor;_
spalla a spalla;yes;a;spalla;vivere;Solo cosí ho potuto fare quello che ho fatto, vivendo;spalla a spalla;con il teologo di corte, giorno dopo giorno, sul sentiero che portava alla rovina.;sg;_;_;juxtaposition/contact;modifier
spalla a spalla;yes;a;spalla;giorno;Ci hanno divisi per evitare problemi, per quanto era possibile, visto che si camminava tutto il giorno;spalla a spalla;, gomito a gomito, a passi diversi, ma alla stessa velocità, e quando vivi una situazione di fatica e scomodità come quella, con poco cibo e poca acqua e nessun posto dove ripararsi e molto freddo, invece, molto, molto freddo, be', i battibecchi e le risse sono sempre dietro l'angolo, in agguato, e gli accoltellamenti anche, quindi è meglio tenere separate le etnie ostili.;sg;_;_;juxtaposition/contact;modifier
gomito a gomito;no;a;gomito;a;Da Ferrara saliranno sulle Alpi un centinaio di rappresentanti delle forze di polizia civili e militari del territorio, che ancora una volta si troveranno a;gomito a gomito;, ma lontano dal lavoro quotidiano.;sg;PNPN;yes;distractor;_
goccia a goccia;yes;a;goccia;irrigazione;Ai due lati del viale, dentro gabbie di ferro avvolte di tela di sacco per ripararle dalle tempeste di sabbia, alcune piante di poinciana nutrite dall'irrigazione;goccia a goccia;e ancora incredule sul senso della propria esistenza.;sg;_;_;succession/iteration/distributivity;modifier
