NPN;construction;preposition;noun;pre_lemma;context_pre;costr;context_post;number_of_noun;Type;other_cxn;meaning;syntactic_function
amico a amico;no;a;amico;da;Quello stesso pomeriggio si presentò in caserma Toulouse Valmorain per parlare con Relais da;amico a amico;, come dichiarò.;sg;PNPN;yes;distractor;_
assalti su assalti;yes;su;assalto;con;e impugnava lo stendardo rosso con la stella argeade a sedici punte , lanciava  assalti su assalti , ma gli squadroni dei cavalieri arabi e assiri contrattaccavano ogni volta con;assalti su assalti;, ma gli squadroni dei cavalieri arabi e assiri contrattaccavano ogni volta con caparbio valore, sostenuti dai continui, fitti lanci di frecce degli arcieri medi e armeni.;pl;_;_;greater_plurality/accumulation;nominal
protesi a protesi;no;a;protesi;aggiungere;I suoi erano repulisti al contrario: invece di ridurre all'osso, aggiungeva;protesi a protesi;.;sg;verbal;yes;distractor;_
mutamenti su mutamenti;yes;su;mutamento;accumulare;«È falsa - scrivono Niles Eldredge e Ian Tattersall, due eminenti paleontologi americani - l'idea di una evoluzione lenta e stabile, progressiva, che accumula;mutamenti su mutamenti;per piccoli scarti, che alla lunga, sommandosi, portano all'emergere di situazioni nuove…;pl;_;_;greater_plurality/accumulation;nominal
bordo a bordo;no;a;bordo;da;Prima si tracciano delle linee in una direzione, da;bordo a bordo;.;sg;PNPN;yes;distractor;_
animale ad animale;no;a;animale;da;La ragione sta nell'assetto diverso dei cromosomi, le cui forme e specie quasi sempre variano da;animale ad animale;.;sg;PNPN;yes;distractor;_
pigrizia a pigrizia;no;a;pigrizia;aggiungere;Questo tipo di promozione impoverisce ulteriormente il prodotto - giornale, perché può aggiungere;pigrizia a pigrizia;: un direttore, se sa che domani il suo quotidiano sarà venduto meglio perché c'è dentro la cassetta cinematografica, tira a campare, e finisce col non mettere a punto iniziative giornalistiche trainanti.;sg;verbal;yes;distractor;_
goccia a goccia ;no;a;goccia;a;Carlino provò a lasciarsi cadere a;goccia a goccia;nel pantano del sonno, ma la notte inchiostrata senza luna e senza stelle aveva cento tasche e in ognuna c'erano bestemmie e ferraglie.;sg;PNPN;yes;distractor;_
discussioni su discussioni;yes;su;discussione;iniziare;Anzi, diciamola tutta: ciascuno ha un'idea differente del suo significato, e va così a finire che iniziano;discussioni su discussioni;.;pl;_;_;greater_plurality/accumulation;nominal
gomito a gomito;no;a;gomito;a;Nelle strade affollate, sacerdoti dalle vesti risplendenti passeggiavano tranquilli a;gomito a gomito;"con mercanti flemmatici e mendicanti cenciosi; una spinta o un urtone d'un villano distratto - che in qualunque altro giorno sarebbe stato punito con una buona frustata oggi procurava all'incauto soltanto un'occhiata sprezzante.";sg;PNPN;yes;distractor;_
problemi a problemi;no;a;problemi;aggiungere;Non poteva però, in quelle condizioni, aggiungere;problemi a problemi;.;sg;verbal;yes;distractor;_
goccia a goccia ;no;a;goccia;a;Quando lo zucchero si è completamente sciolto e forma un filo continuo se preso fra il pollice e l'indice, toglietelo dal fuoco e versatelo a;goccia a goccia;sul cioccolato fuso mescolando come si trattasse di montare una maionese.;sg;PNPN;yes;distractor;_
spalla a spalla;yes;a;spalla;fila;Poi, furono costretti a fermarsi quando un contingente delle truppe di Sua Maestà Tenebrosa, in fila;spalla a spalla;, arrivò a passo di marcia lungo la strada.;sg;_;_;juxtaposition/contact;modifier
prove su prove;yes;su;prova;a;Tutte abusive sono le donne nel mondo dei maschi: senza passaporto né carta di identità, si fanno passare per quello che non sono, si sottopongono a;prove su prove;, pur di resistere, di non essere cacciate.;pl;_;_;greater_plurality/accumulation;nominal
parola su parola;yes;su;parola;confermare;Galvanizzato dagli ascolti dell'ultima puntata di Moby Dick (3 milioni 823 mila spettatori), Santoro ha subito replicato: Confermo;parola su parola;quello che ho detto.;sg;_;_;greater_plurality/accumulation;nominal
settimana a settimana;yes;a;settimana;qualità;Se tu non dai la qualità;settimana a settimana;, purtroppo queste grandi piattaforme, con tutto il rispetto perché è un mercato, ti trattano non come un dipendente a tempo indeterminato ma come un contratto a ore.;sg;_;_;succession/iteration/distributivity;modifier
dorso a dorso;no;a;dorso;a;Certamente facendo percorsi trekking (che durano più di un giorno) scendendo al fiume a piedi o a;dorso a dorso;"di mulo o effettuando il giro in elicottero, la fruizione del canyon sarebbe stata più intensa ma abbiamo scartato i primi per questioni anagrafiche di due di noi (la pendenza è notevole) e la seconda per esplicito rifiuto di Stefania di salire su un ""coso"" che reputa poco sicuro.";sg;PNPN;yes;distractor;_
prove su prove;yes;su;prova;Belbo;Le avevo provviste nei giorni a venire, lunghe, minuziose, documentate, mentre sui tavolini di Pilade mostravo a Belbo;prove su prove;, che egli seguiva con l'occhio sempre più annebbiato, accendendo le sigarette coi mozziconi, stendendo ogni cinque minuti il braccio infuori, il bicchiere vuoto con una parvenza di ghiaccio sul fondo, e Pilade che si precipitava a rifornire, senza attendere altri comandi.;pl;_;_;greater_plurality/accumulation;nominal
utilitarie su utilitarie;yes;su;utilitaria;sfornare;Eppure, il sito siciliano era una volta il cuore pulsante del settore automobilistico italiano, con lo stabilimento che sfornava;utilitarie su utilitarie;- dalla leggendaria 500 degli anni settanta alla Panda - finoallo stop comunicato dal Lingotto nel 2009 e imposto nel 2011.;pl;_;_;greater_plurality/accumulation;nominal
uscio a uscio;no;a;uscio;a;E poi il detto lupo vivette due anni in Agobbio, ed entravasi dimesticamente per le case a;uscio a uscio;", sanza fare male a persona e senza esserne fatto a lui; e fu nutricato cortesemente dalla gente, e andandosi così per la terra e per le case, giammai nessuno cane gli abbaiava dietro.";sg;PNPN;yes;distractor;_
sillaba a sillaba;no;a;sillaba;congiungere;Sei tu, Signore, l'anima delle parole, il filo d'oro che congiunge;sillaba a sillaba;, il fuoco che spira dalle nostre bocche quando diciamo il vero.;sg;verbal;yes;distractor;_
libri su libri;yes;su;libro;leggere;Non posso non esserle riconoscente per avermi costretta a leggere;libri su libri;che raccontano di san Francesco, dei papi che si sono succeduti in quegli anni, dell'alto Medioevo, della letteratura in lingua d'oc e d'oil, per avermi costretta a documentarmi sulla storia dei conventi e sulla vita monacale.;pl;_;_;greater_plurality/accumulation;nominal
palmo a palmo;yes;a;palmo;praticamente;Quelli dell'NGA disponevano di migliaia di immagini scattate dai droni e dai satelliti, e conoscevano praticamente;palmo a palmo;l'intera area esterna del compound.;sg;_;_;succession/iteration/distributivity;modifier
palmo a palmo;yes;a;palmo;conoscere;Allora il prete si avvicinò a me e disse che lui quelle montagne le conosceva;palmo a palmo;perché da piccolo con suo padre e sua sorella arrivavano fin lassù.;sg;_;_;succession/iteration/distributivity;modifier
capoluogo a capoluogo;no;a;capoluogo;da;"""La spesa delle famiglie delle imprese per l'acqua varia notevolmente in Italia, da";capoluogo a capoluogo;"- spiega Samir Traini, l'economista che ha lavorato alla costruzione del portale - Questa variabilità è più contenuta fra i comuni della provincia di Genova che, per quanto riguarda le spese delle famiglie, ricadono tutti, tranne Busalla, nella fascia tariffaria più elevata"".";sg;PNPN;yes;distractor;_
palmo a palmo;yes;a;palmo;esaminare;Siccome la domestica non le aveva detto dov'era stata morsa, le alzò la camiciola e la esaminò;palmo a palmo;, seguendo con la luce la treccia di penitenza che teneva avvolta intorno al corpo come una coda di leone.;sg;_;_;succession/iteration/distributivity;modifier
testa a testa;yes;a;testa;e;"Lei, liberandosi, mi accarezzò la guancia; eravamo appoggiati di fianco al finestrino e,";testa a testa;, con la fronte appoggiata al vetro vedevamo correre veloci le nostre due ombre vicine, proiettate sulla campagna.;sg;_;_;juxtaposition/contact;modifier
guancia a guancia;yes;a;guancia;altro;Riuscì ancora a vedere i due uomini, vicini al suo viso, appoggiati l'uno all'altro;guancia a guancia;, che osservavano la fine.;sg;_;_;juxtaposition/contact;modifier
confusione a confusione;no;a;confusione;aggiungere;È un momento storico, aggiunge la nota, «che esige di non disperdere il voto, per non aggiungere;confusione a confusione;».;sg;verbal;yes;distractor;_
goccia a goccia ;no;a;goccia;a;il chiarore del giorno penetra a;goccia a goccia;nel mio cervello.;sg;PNPN;yes;distractor;_
prove su prove;yes;su;prova;portare;D'altronde da qualche anno l'attivista Jeff Ballinger, fondatore del gruppo Press for Change, porta;prove su prove;circa le scandalose differenze fra le remunerazioni dei lavoratori indonesiani della catena Nike (poco più di un dollaro al giorno) e quelle dei campioni della pubblicità a cui la multinazionale affida la propria immagine.;pl;_;_;greater_plurality/accumulation;nominal
identità a identità;no;a;identità;luogo;Nella risposta destinata a fornire l ' alibi si contrappone luogo a luogo ,;identità a identità;.;sg;verbal;yes;distractor;_
euro su euro;yes;su;euro;risparmiare;Sposando Luigi, avrebbe lavorato per tutta la vita negli uffici della Coop, risparmiando;euro su euro;per arrivare alla fine del mese.;sg/pl;_;_;greater_plurality/accumulation;nominal
soldi su soldi;yes;su;soldi;individuo;"Si tratta di un accidente della natura, in certi individui; una volta che si è iniziato, non c'è modo di fermarsi,";soldi su soldi;.;pl;_;_;greater_plurality/accumulation;nominal
caraffe su caraffe;yes;su;caraffa;ordinare;Harry trangugiava un bicchiere fresco dopo l'altro, ordinando;caraffe su caraffe;, convinto che sapessero tutte di alcol da massaggi.;pl;_;_;greater_plurality/accumulation;nominal
incarichi su incarichi;yes;su;incarico;tempo;Così finii, ancora una volta, ad accumulare in breve tempo;incarichi su incarichi;, fino ad arrivare a dirigere l'intera divisione.;pl;_;_;greater_plurality/accumulation;nominal
goccia a goccia;yes;a;goccia;dire;Senza un ordine preciso, ma, come si dice,;goccia a goccia;, mi giungevano, nell'angosciosa notte successiva alla sua morte i ricordi di quelle impressioni della vita familiare che avevo colto allora.;sg;_;_;succession/iteration/distributivity;modifier
successi su successi;yes;su;successo;macinare;Le sue divisioni cavo e interactive media macinano;successi su successi;, conquistando sempre maggiori fette di mercato.;pl;_;_;greater_plurality/accumulation;nominal
spalla a spalla;no;a;spalla;a;Pazzia, avanguardia, eroismo, tutti e tre allo sbaraglio senza saperlo: ognuno crede in un suo fantasma eccezionale: crede e opera al di fuori del branco: gli altri, a;spalla a spalla;, guardano e hanno paura.;sg;PNPN;yes;distractor;_
acque ad acque;no;a;acque;nube;Dapprima la tempesta opponeva nubi a nubi,;acque ad acque;, venti a venti.;pl;verbal;yes;distractor;_
parlamentari su parlamentari;yes;su;parlamentare;avvicinare;Per mesi Gianni Letta e i lobbisti del Biscione avevano avvicinato;parlamentari su parlamentari;.;pl;_;_;greater_plurality/accumulation;nominal
disastro a disastro;no;a;disastro;aggiungere;Se dovesse piovere, si aggiungerebbe;disastro a disastro;.;sg;verbal;yes;distractor;_
menzogne a menzogne;no;a;menzogne;aggiungere;In fondo conosceva il giovane da sempre e ben volentieri lo avrebbe accolto come genero, ma che la finisse di aggiungere;menzogne a menzogne;, era giovane e tutti avevano capito e perdonato la sua fuga d'amore.;sg;verbal;yes;distractor;_
gomito a gomito;yes;a;gomito;giornata;Il podestà si era lungamente preparato a sostenere la parte: avrebbe dovuto passare tutta una giornata;gomito a gomito;con la sua antica morosa e con l'altrettanto antico timoniere che gliel'aveva soffiata.;sg;_;_;juxtaposition/contact;modifier
testa a testa;no;a;testa;a;Ma rischiava una sconfitta nella Sud Carolina, lo Stato di John Edwards, che lo precedeva nei sondaggi con il 30 contro il 25 per cento dei voti, e risultava a;testa a testa;con il generale Wesley Clark nell'Oklahoma (dove, a sorpresa, il bollettino di Internet Drudge Report dava invece vincente Edwards stesso).;sg;PNPN;yes;distractor;_
borsa a borsa;no;a;borsa;da;I biglietti di carta spessa, antica, resa da un indefinibile numero di passaggi da mano a mano, da;borsa a borsa;, così morbida e frusciante da sembrare stoffa, mandano un odore forte, come di pelle conciata.;sg;PNPN;yes;distractor;_
tragedia a tragedia;no;a;tragedia;dolore;Non aggiungete dolore a dolore,;tragedia a tragedia;…;sg;verbal;yes;distractor;_
miseria a miseria;no;a;miseria;tanto;È inutile e crudele aggiungere più di tanto;miseria a miseria;.;sg;verbal;yes;distractor;_
porta a porta;no;a;porta;da;Sulla ribattuta della difesa, la palla giunge a Orlandini che, incredulo, può involarsi da;porta a porta;.;sg;PNPN;yes;distractor;_
legni su legni;yes;su;legno;inchiodare;Le avanguardie, paradossali e inverosimili, enigmatiche, che mettono insieme una maniglia e la dalia paonazza di un dolore acuto, che lanciano fiamme su tesi materiali da imballaggio, che inchiodano;legni su legni;con chiodi di già arrugginiti, di già tutti ritorti, rimediati, e che incollano, coi liquami dei colori industriali, cortecce che di una guerra hanno visto di striscio un fuggiasco che correva slacciandosi la corazzetta coi muscoli sbalzati... ecco chi scrive la storia: chi raccatta gli aneddoti, ci sputa dietro e te li appiccica in fronte, e taglia e cuce, senza badare per niente all'armonia, al bell'insieme... cosa significa?;pl;_;_;greater_plurality/accumulation;nominal
casello a casello;no;a;casello;da;Masotti padre, per l'incazzatura, prese su e andò da Bologna a Taranto in tre ore da;casello a casello;, tanto che il camion si surriscaldò e arrivò a destinazione un gigantesco carico di fritto il cui odore appetitoso fu sentito in tutta la città dei due mari.;sg;PNPN;yes;distractor;_
disastro a disastro;no;a;disastro;aggiungere;E poi, se la pioggia rimane così debole non può certo aggiungere;disastro a disastro;.;sg;verbal;yes;distractor;_
danno a danno;no;a;danno;aggiungere;Le larve di questi insetti, subdoli untori, per aggiungere;danno a danno;, oltre che infestare i tessuti con attacchi diretti sono portatrici di noiosissime dermatiti o congiuntiviti che mietono vittime tra gli umani ipersensibili.;sg;verbal;yes;distractor;_
riunioni su riunioni;yes;su;riunione;susseguire;Naturalmente, come in ogni occupazione che si rispetti, si susseguono;riunioni su riunioni;.;pl;_;_;greater_plurality/accumulation;nominal
banca a banca;no;a;banca;da;E in questo caso i costi sono diversi da;banca a banca;: nella tabella pubblicata sopra vengono riportati quindici esempi relativi al circuito Cirrus - Maestro, il più diffuso sulle carte di debito, da cui emerge che le commissioni variano dallo 0,25% al 4%, più (o in alternativa) le spese fisse.;sg;PNPN;yes;distractor;_
prove su prove;yes;su;prova;esperimento;Niente di peggio per cominciare un'altra settimana di esperimenti,;prove su prove;, verifiche e analisi di tutto ciò che non aveva funzionato come avrebbe dovuto.;pl;_;_;greater_plurality/accumulation;nominal
grado a grado;no;a;grado;a;E mentre il terreno smotta (e potrebbe essere un processo lentissimo) sentirebbe che il calore, ovvero il moto che ne consegue, passa a;grado a grado;da una parte all'altra di essa.;sg;PNPN;yes;distractor;_
pietra su pietra;yes;su;pietra;cercare;Caro e grande maestro mio, esempio di contento puro e tutto avuto dal bisogno col quale s'era sempre cercato;pietra su pietra;", e quasi per un non - potere di sé che è, come ebbe a scrivere, ""genuinità"", ""qualità di delicatezza"".";sg;_;_;succession/iteration/distributivity;modifier
grado a grado;no;a;grado;a;Quando gli uomini muoiono di morte naturale, allorché l'albero dell'umanità si spoglia a;grado a grado;di quanto è pallido e appassito, l'ampia superficie del Silenzio, nel quale annega per sempre chi ha finito di parlare e reggersi in piedi, non s'increspa minimamente, qualunque sia il numero di coloro che la tagliano col capo all'ingiù per raggiungere il lontanissimo fondo.;sg;PNPN;yes;distractor;_
punto a punto;no;a;punto;da;Tra le singolarità c'è un agglomerato di linee di forza variamente incurvate da;punto a punto;.;sg;PNPN;yes;distractor;_
palmo a palmo;yes;a;palmo;esplorare;Gli sarebbero occorsi mesi per rilevarne il tracciato e per esplorarle;palmo a palmo;.;sg;_;_;succession/iteration/distributivity;modifier
corpo a corpo;no;a;corpo;a;Così Alba venne a conoscenza di un principe che aveva dormito cent'anni, di damigelle che lottavano a;corpo a corpo;con i draghi, di un lupo perduto nel bosco al quale una bambina aprì la pancia senza motivo.;sg;PNPN;yes;distractor;_
palla su palla;yes;su;palla;battere;Noi abbiamo solo l'obbligo di giocare per vincere, di batterci;palla su palla;coi campioni olimpici.;sg;_;_;succession/iteration/distributivity;modifier
goccia a goccia ;no;a;goccia;a;Più che un ritorno al passato, dunque, occorrerebbero interventi tecnologici adatti a un pianeta globale: ad esempio stimolando investimenti in efficienza attraverso l'irrigazione a;goccia a goccia;in agricoltura, tecnologia che evita sprechi, o il riutilizzo delle acque reflue nell'industria.;sg;PNPN;yes;distractor;_
spalla a spalla;yes;a;spalla;agire;Tutti gli oranti si trovano ad agire;spalla a spalla;nel modo più disciplinato, indipendentemente da ogni considerazione di tipo mondano.;sg;_;_;juxtaposition/contact;modifier
palmo a palmo;yes;a;palmo;battere;Il geometra De Palo e il geometra Ranieri vengono sguinzagliati per battere;palmo a palmo;la città sulle loro station wagon.;sg;_;_;succession/iteration/distributivity;modifier
palmo a palmo;yes;a;palmo;accanitamente;"La tensione del Franco Cacciatore viene condotta al diapason, allorché l'agens deve unirsi alla ""generale Caccia"" alla Bestia, e batte accanitamente,";palmo a palmo;, l'intrico della macchia.;sg;_;_;succession/iteration/distributivity;modifier
palmo a palmo;yes;a;palmo;conquistare;Cominciando a conoscerti, che a Venezia ha aperto la Settimana della Critica e, ora, soggiorna sui nostri schermi conquistandosi;palmo a palmo;il favore del pubblico più attento.;sg;_;_;succession/iteration/distributivity;modifier
cellula a cellula;no;a;cellula;da;L'apertura di questi canali contribuisce a controllare l'eccitabilità della cellula e la liberazione di neurotrasmettitori, i quali veicolano i messaggi da;cellula a cellula;.;sg;PNPN;yes;distractor;_
goccia a goccia;yes;a;goccia;impianto;La sala, ordinata e illuminata, Amalia l'ha riempita di piante ben curate, a decine, coltura idroponica rivestita di una ghiaia sottile e brillante, irrigata con un impianto;goccia a goccia;che fornisce un miscuglio di fertilizzante e sali minerali.;sg;_;_;succession/iteration/distributivity;modifier
prova su prova;yes;su;prova;accusa;Per fortuna, conosceva la lingua così bene che capì ogni cosa, e si potette difendere, parola su parola, accusa su accusa ,;prova su prova;, senza perdersi d'animo.;sg;_;_;succession/iteration/distributivity;modifier
pile su pile;yes;su;pile;me;Io volavo alle casse, Pabs disimballava, registrava, smistava e scaricava sudi me;pile su pile;di CD a velocità supersonica.;pl;_;_;greater_plurality/accumulation;nominal
grado a grado;no;a;grado;a;Si infila nelle case e, con quella storia che la malattia si guarisce a;grado a grado;, ci mangia a sbafo per un bel po' e non se ne va finché non gli danno qualcosa da portarsi via.;sg;PNPN;yes;distractor;_
spalla a spalla;yes;a;spalla;sfrenato;Alessandro diede il segnale e tutti i destrieri si lanciarono al galoppo sfrenato,;spalla a spalla;, testa a testa nella pianura deserta: sembravano furie infernali partorite dall'Ade.;sg;_;_;juxtaposition/contact;modifier
gomito a gomito;yes;a;gomito;spesso;Naturalmente certi vecchi quartieri londinesi conservavano le antiche caratteristiche di grande eleganza e ricchezza, ma erano spesso;gomito a gomito;con gli slum più squallidi e più ripugnanti.;sg;_;_;juxtaposition/contact;modifier
bocca a bocca;no;a;bocca;a;Juanita si precipitò a praticarle la respirazione a;bocca a bocca;, ma l'altra, quando si riprese, per poco non la denunciò per atti osceni.;sg;PNPN;yes;distractor;_
campo a campo;yes;a;campo;meglio;E così, goccia a goccia, o meglio,;campo a campo;e casa a casa, in duemila anni la Chiesa ha potuto accumulare un patrimonio immenso, che nel passato era amministrato dal cosiddetto Obolo di San Pietro, e oggi lo è invece dal Pio Istituto per le Opere di Religione (IOR).;sg;_;_;succession/iteration/distributivity;modifier
verde a verde;no;a;verde;aggiungere;Una grande fabbrica silenziosa con alberi che si arrampicano sulla facciata, aggiungendo;verde a verde;, colore non solo del riposo ma anche del risparmio energetico: preoccupazione prima dell'intero progetto.;sg;verbal;yes;distractor;_
testa a testa;no;a;testa;a;I primi e gli ultimi della scuola europea restano a;testa a testa;anche al terzo problema sull'intricata questione delle proporzioni fisiche di Paolo, Pietro e Maria, risolta brillantemente come un quiz enigmistico.;sg;PNPN;yes;distractor;_
bocca a bocca;no;a;bocca;da;Per non far cadere il sugo prendendolo con le dita, glielo passò da;bocca a bocca;.;sg;PNPN;yes;distractor;_
tensione a tensione;no;a;tensione;aggiungere;lo so che ti potrebbe montare l'ansia, però se prosegui così, purtroppo, aggiungi;tensione a tensione;, ansia, sua ansia.;sg;verbal;yes;distractor;_
corpo a corpo;no;a;corpo;a;Un classico contemporaneo a tu per tu, o meglio a;corpo a corpo;, con l'eternità del classico.;sg;PNPN;yes;distractor;_
storia a storia;no;a;storia;da;Il che non è inverosimile perché anzitutto gli autori di fantascienza si leggono tra loro, alcuni temi migrano da;storia a storia;", e si è creato come un canone parallelo a quello della scienza ufficiale; poi perché i romanzieri non sviluppano le loro finzioni in opposizione alle soluzioni della scienza, ma dalla scienza traggono le conseguenze più estreme; e infine perché alcune delle idee ventilate dalla fantascienza (da Verne in avanti) sono poi diventate realtà scientifiche.";sg;PNPN;yes;distractor;_
circonferenze su circonferenze;yes;su;circonferenza;disegnare;Restò così, trafitto da raggi e bisettrici, mentre le lumache disegnavano;circonferenze su circonferenze;intorno a lui.;pl;_;_;greater_plurality/accumulation;nominal
spalla a spalla;yes;a;spalla;intrappolare;E ci si sente intrappolati,;spalla a spalla;, i due uomini le esaminavano.;sg;_;_;juxtaposition/contact;modifier
Giro su giro;yes;su;giro;atto;a deciso di prendere la propria Mercedes e di andare a cercare nel quartiere .  Giro su giro l ' uomo ha inanellato tre passaggi consecutivi davanti_al consolato russo atti;giunzioni su giunzioni;, sta insidiando l'adiacente Complesso del Col delle Erbe, da oltre 25 anni al primo posto nella classifica delle grotte più estese), e il Led Zeppelin, che è divenuta la più profonda cavità della regione.;pl;_;_;greater_plurality/accumulation;nominal
massacri a massacri;no;a;massacri;aggiungere;Sottintendeva: ne abbiamo abbastanza di questi generali che aggiungono;massacri a massacri;e, invece, dovrebbero trovare un terreno d'intesa concreto con le forze democratiche.;sg;verbal;yes;distractor;_
biblioteca a biblioteca;no;a;biblioteca;da;Se vogliamo tracciare una storia di libertà di Stato, di ragione da Niccolò Machiavelli a Norberto Bobbio, non dovremo più peregrinare da città a città o da;biblioteca a biblioteca;, inseguire opere rare o dimenticate, ma basterà navigare saggiamente su Internet appellandosi a quello che oggi (ma sta per cambiare nome) è il sito Unipi, it: l'intreccio dei concetti più importanti della cultura occidentale ci arriverà così bell'incorniciato dal video.;sg;PNPN;yes;distractor;_
palmo a palmo;yes;a;palmo;conquistare;"Il ""settore del mattone"" continua ad avere fame di venditori per conquistare";palmo a palmo;città e province.;sg;_;_;succession/iteration/distributivity;modifier
palmo a palmo;yes;a;palmo;ispezionare;Tutta l'area è stata immediatamente interdetta e i carabinieri la stanno ispezionando;palmo a palmo;alla ricerca di altri indizi utili all'indagine.;sg;_;_;succession/iteration/distributivity;modifier
braccio a braccio;yes;a;braccio;sviluppare;Primo edificio per la musica progettato dallo studio di Michel Rojkind, è il frutto di un processo progettuale sviluppato;braccio a braccio;con la direzione dell'Orchestra: le scelte riguardanti il tipo di sala, il numero di sedute e le destinazioni funzionali degli ambienti sono dunque condivise e volute dai successivi inquilini dello spazio.;sg;_;_;juxtaposition/contact;modifier
autoradio ad autoradio;no;a;autoradio;da;Non è il caso di sottolineare quanto sia utile poter trasmettere una foto da;autoradio ad autoradio;.;sg;PNPN;yes;distractor;_
palmo a palmo;yes;a;palmo;controllare;Ufficio che è stato controllato;palmo a palmo;.;sg;_;_;succession/iteration/distributivity;modifier
goccia a goccia ;no;a;goccia;a;Riprendendo ad avanzare, come attratta da una forza oscura, verso il Santuario, sentì che, a;goccia a goccia;, quell'acqua la mondava di tutto il suo passato, di tutti i suoi piccoli egoismi.;sg;PNPN;yes;distractor;_
lettere su lettere;yes;su;lettera;scrivere;Ciò nonostante, padre Villaverde non esitò a scrivere;lettere su lettere;ai suoi superiori, sostenendo di essere stato aggredito senza motivo e chiedendo che questo accolito di Satana fosse radiato dalla Chiesa.;pl;_;_;greater_plurality/accumulation;nominal
