ID;preposition;pre_lemma;meaning;NPN;construction;syntactic_function;noun;number_of_noun;Type;other_cxn;context_pre;costr;context_post
1121;a;da;distractor;paese a paese;no;_;paese;sg;PNPN;yes;Inoltre ha effetti negativi sulle possibilità di conseguire determinati obiettivi se essi sono graduati su scale di priorità diverse da;paese a paese;e così pure se essi sono perseguiti attraverso strumenti fondamentalmente diversi.
1122;a;da;distractor;paese a paese;no;_;paese;sg;PNPN;yes;Sempre nell'ambito dei paesi industrializzati, il ricordato aumento della crescita reale derivante dai processi di innovazione tecnologica e di globalizzazione si è riflesso sull'occupazione in modo diverso da;paese a paese;.
1124;a;da;distractor;paese a paese;no;_;paese;sg;PNPN;yes;La documentazione richiesta e gli aventi diritto variano da;paese a paese;.
1126;a;da;distractor;paese a paese;no;_;paese;sg;PNPN;yes;Tuttavia, l'interesse di mercato varia da;paese a paese;, per cui possono determinarsi svantaggi rilevanti se si confronta un esportatore che opera in un paese con alti saggi di interesse con un esportatore impegnato in un paese dove i saggi di interesse sono bassi.
1127;a;da;distractor;paese a paese;no;_;paese;sg;PNPN;yes;Anche per quanto riguarda gli strumenti diretti dell'azione fascista sulle comunità italiane all'estero la situazione diverge enormemente da;paese a paese;, non necessariamente seguendo una discriminante culturale o geografica.
1130;a;da;distractor;paese a paese;no;_;paese;sg;PNPN;yes;Secondo lei, la strana caratteristica di questi decessi, e cioè il fatto che le morti si sono susseguite da;paese a paese;, da città in città, tutte in blocco, non potrebbe far pensare ad un'agente mortale che si è diffuso in tutto il pianeta, partendo da questa città?
1131;a;da;distractor;paese a paese;no;_;paese;sg;PNPN;yes;L'entrata in vigore delle nuove normative Ue impone infatti la conservazione di tutti i messaggi di posta elettronica per un tempo definito, che varia da;paese a paese;, pertanto le aziende si troveranno ad affrontare il problema dell'archiviazione dei messaggi di posta, ulteriormente aggravato dal peso che le email personali hanno sui sistemi dedicati all'archiviazione dati.
1132;a;da;distractor;paese a paese;no;_;paese;sg;PNPN;yes;Non di meno, indipendentemente dall'ambito di validità delle licenze, (...) le preferenze dei telespettatori possono variare notevolmente da;paese a paese;, in funzione del tipo di sport e del tipo di manifestazione, cosicché le condizioni di concorrenza per l'acquisto di diritti televisivi sono variabili.
1133;a;da;distractor;paese a paese;no;_;paese;sg;PNPN;yes;Le relazioni extramatrimoniali sono piene di sfumature culturali, che variano da;paese a paese;.
1134;a;da;distractor;paese a paese;no;_;paese;sg;PNPN;yes;Se si sostiene un concetto soggettivo di salute, è accettabile che i criteri della sperimentazione umana varino da;paese a paese;.
1136;a;da;distractor;paese a paese;no;_;paese;sg;PNPN;yes;Il contributo della mutualità al finanziamento dell'assicurazione di disoccupazione è variabile da;paese a paese;e nel tempo.
1137;a;da;distractor;paese a paese;no;_;paese;sg;PNPN;yes;La base di riferimento per il calcolo dei contributi da accreditare è diversa da;paese a paese;.
1138;a;da;distractor;paese a paese;no;_;paese;sg;PNPN;yes;Il livello di istruzione dei genitori, invece, ha un effetto sul reddito dei figli variabile da;paese a paese;.
1140;a;da;distractor;paese a paese;no;_;paese;sg;PNPN;yes;Essa può assumere valenze parzialmente diverse da;paese a paese;, ma generalmente si colloca a destra chi enfatizza i valori dell'ordine sociale, della stabilità, della retribuzione secondo i meriti e a sinistra chi, invece, a tali valori è meno sensibile in nome della libertà di ciascun individuo (libertà, peraltro, non tanto intesa in termini di attività economica e politica, quanto rispetto alle norme ed ai costumi) nonché del diritto di questi a veder soddisfatti i propri bisogni.
1141;a;da;distractor;paese a paese;no;_;paese;sg;PNPN;yes;Probabilmente le ragioni che producono alti consensi sui temi della vita più semplice e naturale o della minore importanza data al denaro, sono diverse da;paese a paese;.
1142;a;da;distractor;paese a paese;no;_;paese;sg;PNPN;yes;L'entità di questa differenza varia da;paese a paese;"; in Unione Sovietica era pari al 30 per cento, ma è ovunque significativa nonostante la forte spinta della legislazione compensativa."
1143;a;da;distractor;paese a paese;no;_;paese;sg;PNPN;yes;"In effetti il significato delle parole ""edizione"" e ""libro"" differiscono non soltanto da continente a continente, ma anche da";paese a paese;.
1144;a;da;distractor;paese a paese;no;_;paese;sg;PNPN;yes;Mentre la forma e il livello esatti di oneri a carico del beneficiario varia considerevolmente da;paese a paese;, la maggior parte applica oneri di modesta entità con ampie esenzioni nel caso di consultazioni mediche e ricoveri.
1145;a;da;distractor;paese a paese;no;_;paese;sg;PNPN;yes;In Europa centrale e orientale e nei Nuovi Stati Indipendenti è stato definito il quadro giuridico necessario, anche se la qualità e le prestazioni delle autorità di regolamentazione differiscono da;paese a paese;e, in genere, nei paesi candidati migliorano più rapidamente che in Russia o in Ucraina.
1146;a;da;distractor;paese a paese;no;_;paese;sg;PNPN;yes;Tuttavia questi tassi di infezione da HIV variano notevolmente da;paese a paese;, dall'1% in Inghilterra, Irlanda e Galles al 32% in Spagna, ma anche all'interno di uno stesso Stato, tra regioni e città.
1147;a;da;distractor;paese a paese;no;_;paese;sg;PNPN;yes;Nella UE il settore dei trasporti genera il 4,1 % del valore aggiunto totale, con notevoli differenze da;paese a paese;: in Italia e Regno Unito si arriva a quasi il 5%, mentre in Germania, Francia e Spagna si registrano valori inferiori al 4%.
1150;a;da;distractor;paese a paese;no;_;paese;sg;PNPN;yes;Poi c'è il fondamentalismo: diverso da;paese a paese;, potente perché capace di dare un'identità e un orgoglio di appartenenza ai ceti più poveri.
1151;a;da;distractor;paese a paese;no;_;paese;sg;PNPN;yes;Tutta la storia è, ovviamente, molto più complessa e varia da;paese a paese;.
1152;a;da;distractor;paese a paese;no;_;paese;sg;PNPN;yes;Poi spetta alle leggi, che variano da;paese a paese;, attribuire le responsabilità.
1153;a;industriale;distractor;paese a paese;no;_;paese;sg;PNPN;yes;"La disorganizzazione all'interno delle grandi organizzazioni è comune a tutte le democrazie industriali; ma la risposta è diversa da";paese a paese;.
1154;a;da;distractor;paese a paese;no;_;paese;sg;PNPN;yes;È una delle voci più carenti del foglietto, anche perché sono state riscontrate indicazioni diverse da;paese a paese;.
1155;a;da;distractor;paese a paese;no;_;paese;sg;PNPN;yes;I vari uffici di collocamento offrono servizi diversi da;paese a paese;e vanno da programmi di orientamento, alla formazione e all'aiuto concreto nella ricerca di un'occupazione.
1156;a;a;distractor;palmo a palmo;no;_;palmo;sg;PNPN;yes;Ciò non è avvenuto: per cinque anni il centrosinistra ha combattuto a;palmo a palmo;"sul terreno della Rai, senza sfuggire al sospetto di una lottizzazione contrattata; e probabilmente la riforma Gentiloni è la figlia, non indecente ma chissà quanto adeguata, di una timidezza durata troppo a lungo."
1157;a;a;distractor;palmo a palmo;no;_;palmo;sg;PNPN;yes;Will e Nancy setacciarono di nuovo l'appartamento a;palmo a palmo;"; poi, mentre lei restava con Clive, Will perlustrò il corridoio e la tromba delle scale."
1158;a;a;distractor;palmo a palmo;no;_;palmo;sg;PNPN;yes;Stupita, scopriva la forma nuova e sorprendente del corpo del suo amico, il calore, il gusto, l'aroma, lo esplorava conquistandolo a;palmo a palmo;, seminandolo di carezze appena inventate.
1160;a;da;distractor;palo a palo;no;_;palo;sg;PNPN;yes;Adesso l'uomo scendeva dal palo in terra, saliva da terra al palo, passava da;palo a palo;, dal palo raggiungeva l'orizzonte per poi tornare indietro: stava rendendo completamente assurdo l'universo spaziale di Arthur.
1161;a;da;distractor;parete a parete;no;_;parete;sg;PNPN;yes;Un'attenzione particolare merita il letto, realizzato su disegno del progettista: è un piano in legno (pioppo bordato in massello di rovere) agganciato a una putrella di ferro che corre da;parete a parete;.
1163;a;da;distractor;parete a parete;no;_;parete;sg;PNPN;yes;Fu allora che i suoi piedi inciamparono in un filo sottile, teso da;parete a parete;", un filo che la sua foga non gli aveva fatto né vedere né cercare; il filo si tese, tirandosi e strappandosi, e nell'aria pesante si udì lo squillante tintinnio di numerosi campanelli lontani: un rudimentale sistema d'allarme."
1164;a;da;distractor;parete a parete;no;_;parete;sg;PNPN;yes;Aveva già costruito la stazione, un villaggio di casette di legno, alberi di cartone e un ambiente di colline e tunnel in miniatura che si stendeva da;parete a parete;impedendo il passaggio attraverso la stanza.
1165;a;da;distractor;pastore a pastore;no;_;pastore;sg;PNPN;yes;Quindi, la Chiesa nascente ha vissuto l'unità inscindibile del deposito rivelato, trasmesso da;pastore a pastore;, come piena comprensione e compimento, alla luce dell'insegnamento di Gesù e del dono del suo Spirito, della precedente scrittura profetica, con l'ausilio della sua fissazione negli scritti che costituiscono l'attuale Nuovo Testamento.
1166;a;da;distractor;paziente a paziente;no;_;paziente;sg;PNPN;yes;Le risposte al farmaco variano da;paziente a paziente;: può senz'altro prolungare la sopravvivenza ma non è detto che guarisca
1167;a;da;distractor;paziente a paziente;no;_;paziente;sg;PNPN;yes;L'entità di queste alterazioni varia in misura notevole da;paziente a paziente;.
1168;a;da;distractor;paziente a paziente;no;_;paziente;sg;PNPN;yes;L'ampiezza di effetti collaterali varia molto da;paziente a paziente;e da farmaco a farmaco ed in ogni caso medici ed infermieri sono in grado di minimizzare quelli più spiacevoli e faticosi.
1170;a;da;distractor;paziente a paziente;no;_;paziente;sg;PNPN;yes;L'emicrania si presenta, clinicamente, in modo eterogeneo: la frequenza, la durata e la gravità degli attacchi varia notevolmente da;paziente a paziente;, risultando talora addirittura invalidante.
1171;a;da;distractor;paziente a paziente;no;_;paziente;sg;PNPN;yes;Sebbene le modalità d'esordio e il decorso clinico siano diversi da;paziente a paziente;, è possibile descrivere un percorso caratteristico.
1172;a;da;distractor;paziente a paziente;no;_;paziente;sg;PNPN;yes;Il recupero totale dall'intervento di cataratta, normalmente, avviene nel giro di 8 settimane, benché possa comunque esservi una certa variabilità da;paziente a paziente;.
1174;a;da;distractor;periodo a periodo;no;_;periodo;sg;PNPN;yes;Interessanti, poi, gli articoli di fine serie, scontatissimi, che varieranno da;periodo a periodo;.
1208;a;da;distractor;persona a persona;no;_;persona;sg;PNPN;yes;Ma ormai è stato appurato con notevole certezza che il funzionamento dei sensi, e quindi anche l'esperienza sensoriale, varia da;persona a persona;.
1187;a;da;distractor;persona a persona;no;_;persona;sg;PNPN;yes;Il virus della nuova influenza A si trasmette come una normale influenza stagionale, da;persona a persona;"; febbre, tosse, mal di testa e dolori muscolari sono i sintomi che, nella maggior parte dei casi, si risolvono senza complicazioni."
1179;a;da;distractor;persona a persona;no;_;persona;sg;PNPN;yes;La rete delle connessioni tra le cellule cerebrali cambia da;persona a persona;.
1191;a;da;distractor;persona a persona;no;_;persona;sg;PNPN;yes;La ferocia funziona se si propaga come un contagio, di bocca in bocca, da;persona a persona;.
1202;a;da;distractor;persona a persona;no;_;persona;sg;PNPN;yes;Già, perché l'orecchio è come un'impronta digitale: la sua dimensione, la sua forma, la sua curvatura, cambiano da;persona a persona;e non si modificano col tempo.
1227;a;da;distractor;persona a persona;no;_;persona;sg;PNPN;yes;L'anno scorso i pagamenti da;persona a persona;sono stati pari a 147 miliardi di dollari a livello globale, in crescita del 47%.
1211;a;da;distractor;persona a persona;no;_;persona;sg;PNPN;yes;Naturalmente si tratta di valori approssimativi, perché i fattori che possono influire sull'aumento di peso variano da;persona a persona;.
1223;a;da;distractor;persona a persona;no;_;persona;sg;PNPN;yes;La malattia, infatti, ha un peggioramento progressivo, in media nell'arco di dieci anni, ma la rapidità con cui i sintomi evolvono varia molto da;persona a persona;.
1216;a;da;distractor;persona a persona;no;_;persona;sg;PNPN;yes;La durata della terapia però varia molto da;persona a persona;e dai risultati che si vogliono ottenere.
1198;a;da;distractor;persona a persona;no;_;persona;sg;PNPN;yes;"Questa ""soglia di diversità"", come chiamiamo il punto di svolta, può differire da";persona a persona;.
1199;a;da;distractor;persona a persona;no;_;persona;sg;PNPN;yes;Il cancro è una malattia complessa, che deriva da molti fattori interagenti, presumibilmente diversi da;persona a persona;.
1200;a;da;distractor;persona a persona;no;_;persona;sg;PNPN;yes;Il senso della realtà è una costruzione del singolo individuo ed assume connotati personali, che differiscono da;persona a persona;.
1214;a;da;distractor;persona a persona;no;_;persona;sg;PNPN;yes;Dato che il dosaggio varia da;persona a persona;(troppi ormoni danno palpitazioni e tremori), è fondamentale rivolgersi a centri specializzati dove ottenere una cura personalizzata.
1205;a;da;distractor;persona a persona;no;_;persona;sg;PNPN;yes;Per alcune malattie genetiche esiste una cura ma, di nuovo, questa può variare da;persona a persona;, con differenze significative nei risultati.
1180;a;da;distractor;persona a persona;no;_;persona;sg;PNPN;yes;La sessualità, nella quale si manifesta l'appartenenza dell'uomo al mondo materiale e biologico, diventa personale e veramente umana allorché è integrata nella relazione da;persona a persona;, nel dono reciproco, totale e illimitato nel tempo, dell'uomo e della donna.
1222;a;da;distractor;persona a persona;no;_;persona;sg;PNPN;yes;Ma è necessario aggiungere che l'efficacia dei diversi farmaci può variare da;persona a persona;, e anche secondo il sesso: le donne in genere sono meno sensibili degli uomini alla terapia farmacologica con antiaggreganti.
1204;a;da;distractor;persona a persona;no;_;persona;sg;PNPN;yes;Oltre alla tubercolosi altri agenti infettivi provenienti dalle vie respiratorie, quali streptococchi o meningococchi, potrebbero passare da un individuo all'altro mediante contatto diretto da;persona a persona;.
1194;a;da;distractor;persona a persona;no;_;persona;sg;PNPN;yes;E ciò non è più altro che una relazione da;persona a persona;, più o meno istituzionalizzata.
1185;a;da;distractor;persona a persona;no;_;persona;sg;PNPN;yes;Sotto l'etichetta di malattia celiaca potrebbero esserci condizioni diverse con un unico comune denominatore (atrofia della mucosa intestinale), ma modi e tempi in cui si manifesta variano da;persona a persona;.
1193;a;da;distractor;persona a persona;no;_;persona;sg;PNPN;yes;In qualche caso era richiesto l'uso di droghe, che inducevano sogni ed incubi, diversi da;persona a persona;.
1209;a;da;distractor;persona a persona;no;_;persona;sg;PNPN;yes;Poiché le esperienze emotive formative attraverso le quali si sviluppa la mente variano moltissimo da;persona a persona;, il livello mentale raggiunto e mantenuto da ognuno è molto diverso.
1176;a;da;distractor;persona a persona;no;_;persona;sg;PNPN;yes;Le zone del corpo più sensibili alle carezze sono in molti casi soggettive e variano da;persona a persona;.
1197;a;da;distractor;persona a persona;no;_;persona;sg;PNPN;yes;La velocità con la quale i chemioterapici distruggono le cellule cancerose varia molto da;persona a persona;e dal tipo di cacro che si ha.
1226;a;da;distractor;persona a persona;no;_;persona;sg;PNPN;yes;È molto infettante ma mutate le condizioni, ossia con temperature più elevate e misure di contenimento e mitigazione, farà più fatica a trasferirsi da;persona a persona;.
1221;a;da;distractor;persona a persona;no;_;persona;sg;PNPN;yes;È, questo, il bisogno di realizzazione personale, che assume forme diverse da;persona a persona;"; non importa quello che uno riesce a raggiungere, ma quello che ""vuole"" raggiungere, si tratti di vincere il premio Nobel per una scoperta scientifica o di coltivare un hobby creativo o di riattivare il motore di un'automobile."
1195;a;da;distractor;persona a persona;no;_;persona;sg;PNPN;yes;La notizia indegna passava da;persona a persona;.
1196;a;da;distractor;persona a persona;no;_;persona;sg;PNPN;yes;È una malattia della mezza età e della vecchiaia, nel corso della quale aumenta di molto il numero dei linfociti, ed il suo andamento varia molto da;persona a persona;.
1220;a;da;distractor;persona a persona;no;_;persona;sg;PNPN;yes;Invece da noi è possibile che un virus o un germe si possa trasmettere da;persona a persona;in quel momento.
1206;a;da;distractor;persona a persona;no;_;persona;sg;PNPN;yes;"È qui che si applica la nozione di ""contingenza"": è una cosa vostra, connessa con la vostra esperienza, relativa a eventi che variano da";persona a persona;.
1215;a;da;distractor;persona a persona;no;_;persona;sg;PNPN;yes;L'eccitazione e il piacere sono composte da mille sensazioni diverse e arricchite da aspetti psicologici che variano da;persona a persona;.
1228;a;da;distractor;pesce a pesce;no;_;pesce;sg;PNPN;yes;La moltitudine dei tipi di pesci esige sistemi nutritivi diversi e anche il modo di cibarsi differisce da;pesce a pesce;.
1229;a;primo;distractor;piani a piani;no;_;piani;sg;N_extended;no;Le due telecamere alternavano primi;piani a piani;a figura intera da angolazioni diverse, restringevano l'inquadratura sulle sue mani o sugli occhi o sui piedi in base alle istruzioni della regia.
1230;a;da;distractor;piastrella a piastrella;no;_;piastrella;sg;PNPN;yes;Il disegno sulle piastrelle era costituito da due pali telegrafici i cui fili si univano, da;piastrella a piastrella;.
1232;a;da;distractor;piazza a piazza;no;_;piazza;sg;PNPN;yes;E invece il nostro settore è diventato un far west: regole diverse da;piazza a piazza;, regole che - beninteso - nessuno rispetta, e nessuno sceriffo a fare giustizia.
1233;a;da;distractor;pigmento a pigmento;no;_;pigmento;sg;PNPN;yes;La macinazione permette l'ulteriore riduzione nelle dimensioni degli agglomerati di pigmento: la raffinazione varia da;pigmento a pigmento;e si ottiene tramite passaggi in mulini a microsfere del premiscelato.
1234;a;aggiungere;distractor;pigrizia a pigrizia;no;_;pigrizia;sg;verbal;yes;Questo tipo di promozione impoverisce ulteriormente il prodotto - giornale, perché può aggiungere;pigrizia a pigrizia;: un direttore, se sa che domani il suo quotidiano sarà venduto meglio perché c'è dentro la cassetta cinematografica, tira a campare, e finisce col non mettere a punto iniziative giornalistiche trainanti.
1238;a;da;distractor;polo a polo;no;_;polo;sg;PNPN;yes;Se potessimo penetrar con l'occhio e vedere l'interno della terra, da;polo a polo;, o dai nostri piedi sino agli antipodi, con orrore scorgeremmo una mole tremendamente traforata di fessure e caverne.
1239;a;morale;distractor;popolo a popolo;no;_;popolo;sg;PNPN;yes;"Come precisa a tale proposito Croce, ""l'assolutezza dell'attività morale non esclude, anzi include, il variare degli atti morali; non solo da età ad età e da";popolo a popolo;", ma da individuo a individuo, e a ogni istante della vita di ciascun individuo""."
1240;a;da;distractor;porta a porta;no;_;porta;sg;PNPN;yes;Suvereto ha una strada centrale da;porta a porta;, su cui trovi belli e dritti palazzi borghesi e plebei in pietra e mattone.
1241;a;da;distractor;porta a porta;no;_;porta;sg;PNPN;yes;Per diversi mesi si è visto, alla Tv, un signore che, con la borsa della spesa, passa da;porta a porta;a farsi ringraziare per gli acquisti che ha fatto e a esortare a fare altrettanto.
1242;a;da;distractor;porta a porta;no;_;porta;sg;PNPN;yes;Mangiarono una sola castagna a testa e ne vendettero il rimanente da;porta a porta;.
1243;a;da;distractor;porta a porta;no;_;porta;sg;PNPN;yes;I plateali schiamazzi di Cesare Maldini, le urla scomposte di Marco Tardelli, così diverse e lontane da quelle del leggendario Bernabeu, hanno scandito l'inutile processione da;porta a porta;.
1244;a;da;distractor;porta a porta;no;_;porta;sg;PNPN;yes;Sulla ribattuta della difesa, la palla giunge a Orlandini che, incredulo, può involarsi da;porta a porta;.
1245;a;a;distractor;porta a porta;no;_;porta;sg;PNPN;yes;"In particolare si sta mettendo a punto la raccolta differenziata mista che prevede un intervento definito "" a";porta a porta;""" con buste di colore diverso e un altro con i classici contenitori differenziati."
1247;a;da;distractor;portone a portone;no;_;portone;sg;PNPN;yes;E ricominciava a picchiare i pugni sul legno, passando da;portone a portone;.
1248;a;da;distractor;potenza a potenza;no;_;potenza;sg;PNPN;yes;La pretesa delle BR di ottenere aiuti senza pagare contropartite può apparire assurda in quanto addirittura travalica il concetto, già velleitario, di rapporto da;potenza a potenza;, per approdare a quello di una potenza dominante (le BR) che vuole imporre le sue condizioni ad una potenza subalterna.
1249;a;sommare;distractor;potere a potere;no;_;potere;sg;verbal;yes;"L'apertura verso l'elettronica può essere pensata nell'ambito di quelle endiadi ""Arte & Non Arte"", meglio ""Avventure & Cultura"", che sommano";potere a potere;, il fare concreto alla pulsionalità e all'intelligenza, la creatività all'ironia.
1250;a;da;distractor;predicatore a predicatore;no;_;predicatore;sg;PNPN;yes;Si tratta di racconti ripetuti da;predicatore a predicatore;, a lungo tramandati solo oralmente.
1252;a;aggiungere;distractor;problemi a problemi;no;_;problemi;sg;verbal;yes;Non poteva però, in quelle condizioni, aggiungere;problemi a problemi;.
1253;a;da;distractor;prodotto a prodotto;no;_;prodotto;sg;PNPN;yes;Un'analisi di questo tipo non poteva prescindere dal software fornito in bundle, variabile da;prodotto a prodotto;, che, se in alcuni casi è forse più di quello che realmente serve, in altri è appena lo stretto necessario per la telecomunicazione.
1254;a;da;distractor;prodotto a prodotto;no;_;prodotto;sg;PNPN;yes;La durata dell'azione contraccettiva è anch'essa variabile da;prodotto a prodotto;: da una a tre ore.
1255;a;da;distractor;prodotto a prodotto;no;_;prodotto;sg;PNPN;yes;Anche volendo considerare il solo olio di oliva, la composizione esatta varia da;prodotto a prodotto;.
1256;a;da;distractor;produttore a produttore;no;_;produttore;sg;PNPN;yes;È un formaggio alpino, il cui ingrediente principale è il latte intero ma con un'aggiunta di erbe o spezie, aggiunte in proporzioni ed assortimenti variabili da;produttore a produttore;, che gli conferiscono la nota aromatica caratteristica.
1258;a;vecchio;distractor;proprietà a proprietà;no;_;proprietà;sg;N_extended;no;Se passerà l'operazione Integritas-Palermo, valutata nell'ordine di 200 milioni di euro, è prevedibile una moltiplicazione di transazioni dalle vecchie;proprietà a proprietà;sempre meno trasparenti.
1259;a;aggiungere;distractor;protesi a protesi;no;_;protesi;sg;verbal;yes;I suoi erano repulisti al contrario: invece di ridurre all'osso, aggiungeva;protesi a protesi;.
1260;a;da;distractor;provincia a provincia;no;_;provincia;sg;PNPN;yes;La parte più sostanziosa della domanda regionale di alloggi è garantita da chi si trasferisce da un'altra regione o da;provincia a provincia;: oltre il 39 per cento.
1261;a;da;distractor;provincia a provincia;no;_;provincia;sg;PNPN;yes;Ma si provi a immaginare un Paese in cui le norme antinquinamento differiscano da zona a zona, da;provincia a provincia;, magari a difesa di interessi particolari.
1262;a;da;distractor;provincia a provincia;no;_;provincia;sg;PNPN;yes;Secondo i risultati della ricerca le scelte imprenditoriali si differenziano da;provincia a provincia;.
1263;a;da;distractor;provincia a provincia;no;_;provincia;sg;PNPN;yes;Le graduatorie formulate dai provveditorati, tuttavia, potranno comportare vistose differenze di età anagrafica dei pensionati, da;provincia a provincia;.
1264;a;da;distractor;provincia a provincia;no;_;provincia;sg;PNPN;yes;I metodi di campionamento degli appartamenti finora sono disomogenei da;provincia a provincia;.
1265;a;da;distractor;punto a punto;no;_;punto;sg;PNPN;yes;L'ATM crea una connessione da;punto a punto;.
1267;a;da;distractor;punto a punto;no;_;punto;sg;PNPN;yes;I nuovi sistemi di trasmissione a distanza si differenziano dai precedenti - telegrafo e telefono - perché non costituiscono un legame da;punto a punto;.
1268;a;da;distractor;punto a punto;no;_;punto;sg;PNPN;yes;Il computer può trattare frasi che arrivino a un massimo di 1500 caratteri da;punto a punto;.
1270;a;da;distractor;punto a punto;no;_;punto;sg;PNPN;yes;Al contrario nel Tipo C, dove il pino domestico è stato seminato in maniera andante e a integrazione di nuclei di latifoglie preesistenti, con conseguente maggiore variabilità da;punto a punto;.
1271;a;da;distractor;punto a punto;no;_;punto;sg;PNPN;yes;Dev'essere ristudiato il Radiobus «classico», ché la formula da;punto a punto;.
1272;a;da;distractor;punto a punto;no;_;punto;sg;PNPN;yes;Il confronto del dato sperimentale con quello calcolato consente di tracciare mappe di variazione da;punto a punto;.
1273;a;da;distractor;punto a punto;no;_;punto;sg;PNPN;yes;Dopo essersi sentito soddisfatto del numero dei puntini, il ragazzo univa il tutto in una sola linea, da;punto a punto;.
