ID;preposition;pre_lemma;meaning;NPN;construction;syntactic_function;noun;number_of_noun;Type;other_cxn;context_pre;costr;context_post
2065;su;alimentare;greater_plurality/accumulation;veleni su veleni;yes;nominal;veleno;pl;_;_;E una sfida all'arma bianca per arrivare alla guida di Palazzo Vermexio e gestire ancora il fiume di denaro che ha alimentato;veleni su veleni;, non ultimi quelli che grazie alle inchieste del piccolo giornale La Civetta hanno travolto la Procura, con tanto di trasferimento «cautelare» dell'ex capo Ugo Rossi per legami dei figli con alcune società nell'occhio del ciclone.
2066;su;strada;succession/iteration/distributivity;velo su velo;yes;modifier;velo;sg;_;_;Il vento era ancora leggero, ma prometteva tempesta, la sabbia volava bassa e copriva le strade,;velo su velo;.
2067;su;Giovanni;succession/iteration/distributivity;ventricolo su ventricolo;yes;modifier;ventricolo;sg;_;_;Mi hai aperto il tuo cuore, Giovanni,;ventricolo su ventricolo;.
2068;su;pubblicare;greater_plurality/accumulation;verbali su verbali;yes;nominal;verbale;pl;_;_;Insomma, nel corso di Tangentopoli i mass media hanno pubblicato;verbali su verbali;ancora freschi d'inchiostro e rivelato notizie coperte da segreto istruttorio.
2071;su;elevare;greater_plurality/accumulation;verbali su verbali;yes;nominal;verbale;pl;_;_;Un uomo dalla finestra di casa osserva i pizzardoni mentre elevano;verbali su verbali;.
2072;su;sfornare;greater_plurality/accumulation;versioni su versioni;yes;nominal;versione;pl;_;_;E la Microsoft in crescita rapida, la Microsoft che non guarda in faccia a nessuno, che sforna;versioni su versioni;sempre più avanzate del suo software comincia a crearsi una corona di nemici, via via sempre più feroci e vociferanti.
2075;su;significato;greater_plurality/accumulation;vigneti su vigneti;yes;nominal;vigneto;pl;_;_;"Vagoni arrugginiti dove giovani senza senso lirico hanno spruzzato graffiti di cui, ahimè, non so cogliere il significato;";vigneti su vigneti;", sotto un velo di nebbia setosa come cipria; vecchi in bicicletta, altri che portano a spasso i cani."
2078;su;immolare;greater_plurality/accumulation;vittime su vittime;yes;nominal;vittima;pl;_;_;Filippo attraversò l'accampamento gettando una rapida occhiata ad Aristandro che continuava a immolare;vittime su vittime;sul suo altare fumigante nella notte, e raggiunse un luogo in cui sorgeva un gigantesco banyan.
2080;su;consultare;greater_plurality/accumulation;volumi su volumi;yes;nominal;volume;pl;_;_;Durante tutto l'inverno, sepolto in una pelliccia accanto al camino, non fece che consultare;volumi su volumi;per trovare tracce di quell'evento: gli angeli sulla terra.
2081;su;raccattare;greater_plurality/accumulation;voti su voti;yes;nominal;voto;pl;_;_;Ma i grattacapi più grandi arrivano da Salvini, che prima raccatta;voti su voti;, incentrando tutto il suo operato sulla lotta all'immigrazione clandestina, riducendo i numeri degli sbarchi (grazie anche ai precedenti accordi portati avanti da Marco Minniti con le tribù libiche) e poi fa saltare il banco sulla Tav.
2083;su;essere;succession/iteration/distributivity;voto su voto;yes;modifier;voto;sg;_;_;Per poi tornare a farsi la guerra, perché alle elezioni europee la contesa sarà;voto su voto;, e i due si contendono lo stesso elettorato.
2084;su;conquistare;succession/iteration/distributivity;voto su voto;yes;modifier;voto;sg;_;_;E due candidati in lizza, decisi a conquistare;voto su voto;la fiducia degli elettori.
716;a;aggiungere;distractor;abbondanza ad abbondanza;no;_;abbondanza;sg;verbal;yes;Anche per i Benetton il miliardo messo a disposizione dalla Cassa, con l'astensione in consiglio di Viesti e di un altro componente, sembra aggiungere;abbondanza ad abbondanza;.
717;a;da;distractor;acero  a acero;no;_;acero;sg;PNPN;yes;Immaginando di tradurre le tinte in suoni, si sentirebbe il gemito del popolo delle foreste, un'eco straziante che si propaga da;acero a acero;, da quercia a quercia.
718;a;nube;distractor;acque ad acque;no;_;acque;pl;verbal;yes;Dapprima la tempesta opponeva nubi a nubi,;acque ad acque;, venti a venti.
719;a;da;distractor;affetto a affetto;no;_;affetto;sg;PNPN;yes;Diventiamo veramente gli epiteti che ci vengono spinti sotto il muso, i nomignoli, le dolci cime lanciate da;affetto a affetto;mentre tutto ondeggia e tra di noi c'è nebbia, quell'aria che si palpa e da noi nasce come da curve portuali, quell'aria dai calori ascellari, e noi diventiamo la cosa che sembriamo a chi ci dice cosa, quando quelle visioni mosse e volatili si fermano concrete e solide, fatte di materia comune, e si presentano come una esposizione da mercato, da bancarella.
720;a;da;distractor;agenzia ad agenzia;no;_;agenzia;sg;PNPN;yes;Il tutto tra l'altro avviene nel giro di pochi mesi con una successione da;agenzia ad agenzia;quasi automatica.
721;a;da;distractor;albero ad albero;no;_;albero;sg;PNPN;yes;Non un solo silenzio, ma parecchi: quello del muschio sotto i piedi, quello delle ombre da;albero ad albero;, il silenzio di un piccolo ruscello in esplorazione di pezzetti di terreno, i silenzi che lo attorniavano mentre sbucava su una radura.
722;a;fratello;distractor;amici ad amici;no;_;amici;pl;verbal;yes;Riconosco i tanti cognomi della comunità, rivedo le loro storie, riunisco figli a genitori, fratelli a fratelli,;amici ad amici;"; ma la pietà di chi resta può essere sufficiente?"
723;a;da;distractor;amico a amico;no;_;amico;sg;PNPN;yes;Quello stesso pomeriggio si presentò in caserma Toulouse Valmorain per parlare con Relais da;amico a amico;, come dichiarò.
724;a;da;distractor;amico ad amico;no;_;amico;sg;PNPN;yes;E visto che tra noi è tutto finito, dimmelo francamente, da;amico ad amico;: dove sei stato?
725;a;da;distractor;anima ad anima;no;_;anima;sg;PNPN;yes;Sembrano interconnesse in una sfida infinita che si tramanda da corpo a corpo, da;anima a anima;, da essere ad essere.
725;a;da;distractor;anima ad anima;no;_;anima;sg;PNPN;yes;Sembrano interconnesse in una sfida infinita che si tramanda da corpo a corpo, da;anima ad anima;, da essere ad essere.
729;a;da;distractor;animale ad animale;no;_;animale;sg;PNPN;yes;La ragione sta nell'assetto diverso dei cromosomi, le cui forme e specie quasi sempre variano da;animale ad animale;.
730;a;da;distractor;anno a anno;no;_;anno;sg;PNPN;yes;I raccolti rivaleggiano gli uni con gli altri, da;anno a anno;o da luogo a luogo.
731;a;da;distractor;anticorpo ad anticorpo;no;_;anticorpo;sg;PNPN;yes;Questa zona della molecola differisce da;anticorpo ad anticorpo;, determina la specificità della molecola anticorpale e viene definita paratopo o idiotipo.
732;a;da;distractor;appezzamento ad appezzamento;no;_;appezzamento;sg;PNPN;yes;Anche il numero di vermi presenti nel suolo per metro quadrato (nei primi 20 cm di profondità), pur variando da;appezzamento ad appezzamento;, non ha mostrato differenze significative.
733;a;da;distractor;architettura ad architettura;no;_;architettura;sg;PNPN;yes;Come il set di istruzioni varia da;architettura ad architettura;, anche le regole sintattiche dell'assembly varieranno.
734;a;da;distractor;argomento ad argomento;no;_;argomento;sg;PNPN;yes;Io credo che tale dipendenza sia molto variabile, da persona a persona e da;argomento ad argomento;: l'elaborazione simbolica può essere vantaggiosa oppure deleteria, a seconda delle circostanze e dell'oggetto.
735;a;da;distractor;artista ad artista;no;_;artista;sg;PNPN;yes;Lo spessore dello strato pittorico varia da;artista ad artista;e dalla tecnica impiegata.
736;a;contrapporre;distractor;assurdo ad assurdo;no;_;assurdo;sg;verbal;yes;Ma non ha molto senso contrapporre;assurdo ad assurdo;, non si annulleranno mai a vicenda e anzi, l'uno richiama l'altro in una tensione che può anche raggiungere vette esaltanti ma dilania l'uomo, stravolge la prospettiva in cui egli finisce per vedere la vita.
737;a;da;distractor;autoradio ad autoradio;no;_;autoradio;sg;PNPN;yes;Non è il caso di sottolineare quanto sia utile poter trasmettere una foto da;autoradio ad autoradio;.
738;a;da;distractor;autore a autore;no;_;autore;sg;PNPN;yes;Certo, ed è persino superfluo ricordarlo, l'orchestrazione del dialogato conosce modulazioni plurime, variando da;autore a autore;, da opera a opera.
739;a;da;distractor;azienda ad azienda;no;_;azienda;sg;PNPN;yes;La modularità delle ante varia da;azienda ad azienda;ma, in generale, il battente singolo è largo cm 50-70.
740;a;da;distractor;azienda ad azienda;no;_;azienda;sg;PNPN;yes;Il rapporto prezzo utili varia significativamente da settore a settore e, spesso, da;azienda ad azienda;, in quanto ogni azienda si caratterizza con proprie condizioni di rischio.
741;a;da;distractor;balcone a balcone;no;_;balcone;sg;PNPN;yes;I miei abitano in un quartiere dove ancora le massaie comunicano da;balcone a balcone;.
742;a;da;distractor;balcone a balcone;no;_;balcone;sg;PNPN;yes;La sua ultima creatura erano stati i bastoni per reggere i calici dello spumante con cui aveva allietato i brindisi da;balcone a balcone;, ma ormai era già diventata la penultima, soppiantata da quel telefono di cui smaniavo di sperimentare le potenzialità.
743;a;aggiungere;distractor;balle a balle;no;_;balle;sg;verbal;yes;Concluse che forse era meglio non aggiungere;balle a balle;.
744;a;da;distractor;bambino a bambino;no;_;bambino;sg;PNPN;yes;Le difficoltà e i successi ovviamente variano da;bambino a bambino;e da un ordine di scuola all'altro anche in base alle caratteristiche e le modalità organizzative dei vari tipi di scuola.
745;a;da;distractor;bambino a bambino;no;_;bambino;sg;PNPN;yes;Eppure non è mai stato provato un caso al mondo di contagio da;bambino a bambino;.
746;a;da;distractor;bocca a bocca;no;_;bocca;sg;PNPN;yes;Per non far cadere il sugo prendendolo con le dita, glielo passò da;bocca a bocca;.
762;a;a;distractor;bocca a bocca;no;_;bocca;sg;PNPN;yes;Sperava che saltasse fuori un veleno o una tossina, ma gli interessava anche sapere se Clive era positivo all'HIV, dato che gli aveva praticato la respirazione a;bocca a bocca;ed era entrato in contatto col suo sangue.
763;a;a;distractor;bocca a bocca;no;_;bocca;sg;PNPN;yes;Juanita si precipitò a praticarle la respirazione a;bocca a bocca;, ma l'altra, quando si riprese, per poco non la denunciò per atti osceni.
764;a;da;distractor;bocca a bocca;no;_;bocca;sg;PNPN;yes;Come si diffondono, ingigantendosi nel passare da;bocca a bocca;o da scritto a scritto?
747;a;da;distractor;banca a banca;no;_;banca;sg;PNPN;yes;Nonostante questo, i metodi di tariffazione sono differenti da;banca a banca;: nel caso del Banco Ambrosiano Veneto il servizio è completamente gratuito, ma per il cliente il costo dell'operazione dispositiva di bonifico è lo stesso della filiale.
748;a;da;distractor;banca a banca;no;_;banca;sg;PNPN;yes;Organizzazione di spostamento di capitale (conto) da;banca a banca;per porre sotto ricatto il sistema colpendolo dove più sanguina (I SOLDI).
750;a;da;distractor;banca a banca;no;_;banca;sg;PNPN;yes;Va ricordato che la tessera Pagobancomat - utilizzabile per i pagamenti presso i punti convenzionati - prevede un costo annuo variabile da;banca a banca;ma è esente da commissioni per operazione e da costi di registrazione scrittura.
751;a;da;distractor;banca a banca;no;_;banca;sg;PNPN;yes;E in questo caso i costi sono diversi da;banca a banca;: nella tabella pubblicata sopra vengono riportati quindici esempi relativi al circuito Cirrus - Maestro, il più diffuso sulle carte di debito, da cui emerge che le commissioni variano dallo 0,25% al 4%, più (o in alternativa) le spese fisse.
752;a;da;distractor;banca a banca;no;_;banca;sg;PNPN;yes;Per chiudere questo mutuo dovrete pagare una penale del 3% (ma come si vede nella tabella la percentuale cambia da;banca a banca;e, in alcuni casi, il conteggio si può rivelare molto complicato) sull'ammontare del capitale ancora da rimborsare (2.091.736 lire).
753;a;da;distractor;banca a banca;no;_;banca;sg;PNPN;yes;Una volta compiuta la scelta vengono attivate le procedure di sicurezza, che variano, ma di poco, da;banca a banca;.
754;a;da;distractor;banca a banca;no;_;banca;sg;PNPN;yes;l prezzo al dettaglio (diverso da;banca a banca;), poi, va aggiunta la commissione che può variare dai 50 ai 100 punti base.
755;a;da;distractor;banca a banca;no;_;banca;sg;PNPN;yes;Al di là della comodità, dal punto di vista economico la convenienza della domiciliazione varia però non solo da;banca a banca;ma anche e soprattutto a seconda del tipo di conto che si intrattiene con l'istituto.
756;a;da;distractor;banca a banca;no;_;banca;sg;PNPN;yes;Per quest'ultimo servizio non c'è alcuna differenza tra tessera vecchia e tessera nuova: sono rimaste in vigore, infatti, le precedenti condizioni economiche, diverse da;banca a banca;, ma in genere gratuite per prelievi agli sportelli automatici del proprio istituto e tariffate (in media dalle 2500 alle 3000 lire) per prelievi in qualsiasi altra banca diversa dalla propria.
757;a;da;distractor;bar a bar;no;_;bar;sg;PNPN;yes;La cifra complessiva cambiava da;bar a bar;, ma erano tutti d'accordo che i ricorrenti avessero ottenuto circa cinque milioni di dollari.
758;a;da;distractor;bar a bar;no;_;bar;sg;PNPN;yes;Non gli avrebbe detto dove aveva passato la notte, non gli avrebbe raccontato di quel lungo vagabondaggio da;bar a bar;, cominciato subito dopo la sua telefonata e terminato con un sonno ristoratore assieme ai barboni della villa comunale.
759;a;da;distractor;barca a barca;no;_;barca;sg;PNPN;yes;Riflessa dall'acciaio nero della Moldava, l'agitazione variopinta dei giochi di luce faceva guizzare i suoi messaggi di fuoco da;barca a barca;, da zattera a zattera.
761;a;da;distractor;biblioteca a biblioteca;no;_;biblioteca;sg;PNPN;yes;Se vogliamo tracciare una storia di libertà di Stato, di ragione da Niccolò Machiavelli a Norberto Bobbio, non dovremo più peregrinare da città a città o da;biblioteca a biblioteca;, inseguire opere rare o dimenticate, ma basterà navigare saggiamente su Internet appellandosi a quello che oggi (ma sta per cambiare nome) è il sito Unipi, it: l'intreccio dei concetti più importanti della cultura occidentale ci arriverà così bell'incorniciato dal video.
765;a;da;distractor;bordo a bordo;no;_;bordo;sg;PNPN;yes;Prima si tracciano delle linee in una direzione, da;bordo a bordo;.
766;a;da;distractor;borsa a borsa;no;_;borsa;sg;PNPN;yes;I biglietti di carta spessa, antica, resa da un indefinibile numero di passaggi da mano a mano, da;borsa a borsa;, così morbida e frusciante da sembrare stoffa, mandano un odore forte, come di pelle conciata.
767;a;da;distractor;braccio a braccio;no;_;braccio;sg;PNPN;yes;Sembrerà assurdo ma il movimento anti-vaccinista è nato ancor prima della vaccinazione, durante la variolazione, ovvero il passaggio del vaiolo da pustola a pustola, da;braccio a braccio;, che, tuttavia, presentava un tasso di mortalità piuttosto alto (intorno al 6-7%), che ha creato il rifiuto di questo tipo di terapia.
768;a;a;distractor;brano a brano;no;_;brano;sg;PNPN;yes;Cominciò il corpo a corpo tra la folla e la milizia e più nessuno ebbe pietà: il leone affamato non strappa così a;brano a brano;l'antilope che ha ucciso e che sta mangiando.
770;a;a;distractor;brano a brano;no;_;brano;sg;PNPN;yes;In questo fango si genererà poi una quantità di piccole mosche e di altri animaletti che si raggomitoleranno nel mio sangue e mi divoreranno a;brano a brano;.
771;a;a;distractor;brano a brano;no;_;brano;sg;PNPN;yes;Talora le passava per la testa una fuggevole meraviglia: che si possa esser trascinati così mentre si muore a;brano a brano;, in mezzo a tutti gli altri, e nessuno se ne accorge...
772;a;a;distractor;brano a brano;no;_;corpo;sg;PNPN;yes;Talora le passava per la testa una fuggevole meraviglia: che si possa esser trascinati così mentre si muore a;brano a brano;, in mezzo a tutti gli altri, e nessuno se ne accorge…
774;a;da;distractor;bunkr a bunker;no;_;bunker;sg;PNPN;yes;Ma anche Saddam Hussein durante la Guerra del golfo si mosse da;bunkr a bunker;e nonostante gli sforzi americani molti di questi ultimi non sono mai stati messi in luce.
775;a;da;distractor;camino a camino;no;_;camino;sg;PNPN;yes;L'Atrium era pieno di persone che si spostavano da;camino a camino;, sigillandoli.
776;a;da;distractor;campo a campo;no;_;campo;sg;PNPN;yes;Per muovere il punto di inserzione da;campo a campo;, premere il tasto [tab] o selezionare con il mouse la casella desiderata.
777;a;da;distractor;campo a campo;no;_;campo;sg;PNPN;yes;A Durazzo la voce si insegue da;campo a campo;, da casa a casa.
778;a;da;distractor;canino a canino;no;_;canino;sg;PNPN;yes;Non sarei troppo esigente con l'editore, basterebbe un piccolo anticipo di dodici milioni (tale è la cifra che il mio dentista esige per il nuovo ponte superiore da;canino a canino;, altrimenti, aggiungendoci qualche dente, diciotto milioni e non se ne parla più), una bella copertina blu con il mio nome scritto in bianco ed eventualmente anche il titolo del libro, e... voilà, ecco un uomo felice!
780;a;da;distractor;capitolo a capitolo;no;_;capitolo;sg;PNPN;yes;All'interno del bilancio amministrativo, la Commissione può procedere, nei limiti e alle condizioni fissate dal regolamento stabilito in esecuzione dell'articolo 78 nono, a trasferimenti di crediti, sia da;capitolo a capitolo;, sia da suddivisione a suddivisione.
781;a;da;distractor;capoluogo a capoluogo;no;_;capoluogo;sg;PNPN;yes;"""La spesa delle famiglie delle imprese per l'acqua varia notevolmente in Italia, da";capoluogo a capoluogo;"- spiega Samir Traini, l'economista che ha lavorato alla costruzione del portale - Questa variabilità è più contenuta fra i comuni della provincia di Genova che, per quanto riguarda le spese delle famiglie, ricadono tutti, tranne Busalla, nella fascia tariffaria più elevata""."
784;a;da;distractor;casa a casa;no;_;casa;sg;PNPN;yes;Nel tragitto che percorro ogni settimana, da;casa a casa;, osservo il paesaggio mutare attraverso il finestrino del pullman, vedo il suo degradare da montagne a colline, alla pianura con le sue campagne e, infine, alla città.
785;a;da;distractor;casa a casa;no;_;casa;sg;PNPN;yes;A Durazzo la voce si insegue da campo a campo, da;casa a casa;.
786;a;da;distractor;casa a casa;no;_;casa;sg;PNPN;yes;Quelle ricette sempre uguali a se stesse, eppure diverse da;casa a casa;.
787;a;da;distractor;casella a casella;no;_;casella;sg;PNPN;yes;"Per questo motivo oggi sono necessari anche i portalettere: quando passeremo alla posta elettronica ""pura"", cioè che viaggia da";casella a casella;(la casella è un apparecchio tipo Internet) allora si vedrà.
790;a;da;distractor;casello a casello;no;_;casello;sg;PNPN;yes;Masotti padre, per l'incazzatura, prese su e andò da Bologna a Taranto in tre ore da;casello a casello;, tanto che il camion si surriscaldò e arrivò a destinazione un gigantesco carico di fritto il cui odore appetitoso fu sentito in tutta la città dei due mari.
792;a;da;distractor;caserma a caserma;no;_;caserma;sg;PNPN;yes;Che invece d'una esercitazione notturna o d'uno spostamento di forze da;caserma a caserma;si trattasse d'una manovra connessa al problema della Torre?
794;a;da;distractor;caso a caso;no;_;caso;sg;PNPN;yes;Il terzo stadio consiste in una nuova riduzione del numero dei dipendenti, contestuale a una profonda riorganizzazione, diversa da;caso a caso;ma sempre all'insegna del decentramento.
796;a;da;distractor;caso a caso;no;_;caso;sg;PNPN;yes;I risultati sono estremamente variabili da;caso a caso;.
797;a;da;distractor;caso a caso;no;_;caso;sg;PNPN;yes;Per quanto riguarda i lavoratori autonomi, l'accesso alle singole professioni è regolato da requisiti diversi da;caso a caso;(titoli di studio, esami o concorsi di stato, iscrizioni ad Albi o Ordini professionali ecc.)
798;a;da;distractor;caso a caso;no;_;caso;sg;PNPN;yes;Nonostante l'omogeneità delle indicazioni di legge, la realtà dei Consultori nelle Regioni risulta diversa da;caso a caso;.
799;a;da;distractor;caso a caso;no;_;caso;sg;PNPN;yes;Dato che le situazioni possono essere molto diverse da;caso a caso;, si consiglia di chiedere indicazioni sulla prassi per il disconoscimento al Consultorio ad un avvocato, al Tribunale per i minorenni o al Servizio Sociale del proprio comune.
801;a;da;distractor;categoria a categoria;no;_;categoria;sg;PNPN;yes;Negli ultimi anni il fatturato dei professionisti - spiega Gaetano Stella, presidente di Confprofessioni - è calato da;categoria a categoria;dal 20 al 40 per cento.
802;a;da;distractor;categoria a categoria;no;_;categoria;sg;PNPN;yes;Analogamente può essere trasferito da;categoria a categoria;e da specialità a specialità il sottufficiale e il volontario in congedo della Marina militare, da ruolo a ruolo e da categoria a categoria il sottufficiale e il volontario in congedo dell'Aeronautica militare.
803;a;da;distractor;categoria a categoria;no;_;categoria;sg;PNPN;yes;Analogamente può essere trasferito da categoria a categoria e da specialità a specialità il sottufficiale e il volontario in congedo della Marina militare, da ruolo a ruolo e da;categoria a categoria;il sottufficiale e il volontario in congedo dell'Aeronautica militare.
804;a;da;distractor;cellula a cellula;no;_;cellula;sg;PNPN;yes;L'apertura di questi canali contribuisce a controllare l'eccitabilità della cellula e la liberazione di neurotrasmettitori, i quali veicolano i messaggi da;cellula a cellula;.
806;a;da;distractor;cellula a cellula;no;_;cellula;sg;PNPN;yes;Tra tutte le teorie, la più interessante è sembrata essere quella che indica la presenza di un'alterazione a carico delle sostanze deputate al trasporto dell'impulso nervoso da;cellula a cellula;, i cosiddetti neurotrasmettitori (noradrenalina, dopamina, serotonina, e Gaba).
807;a;questo;distractor;cellule a cellule;no;_;cellule;sg;N_extended;no;Se un antigene viene presentato dalle cellule specializzate nel presentare l'antigene, determina anche l'attivazione linfocitaria e la differenziazione di queste;cellule a cellule;effettrici.
808;a;da;distractor;centro a centro;no;_;centro;sg;PNPN;yes;La distanza di questi fra di loro deve essere - da;centro a centro;- di mm. 66.
810;a;da;distractor;centro a centro;no;_;centro;sg;PNPN;yes;La distanza fra le grandi colonne è pari, da;centro a centro;", a 4,52 metri; nel disegno è di 4,51 metri."
811;a;da;distractor;centro a centro;no;_;centro;sg;PNPN;yes;"Inoltre, a causa della mancanza di standard unici, le condizioni ""variano da";centro a centro;""" e in alcuni di questi ci sono ""dubbi sul rispetto dei diritti umani""."
812;a;da;distractor;ceppo a ceppo;no;_;ceppo;sg;PNPN;yes;Gli enzimi di parecchi ceppi possono essere confrontati mediante tecniche statistiche che rivelano la divergenza genetica relativa da;ceppo a ceppo;.
813;a;da;distractor;cervello a cervello;no;_;cervello;sg;PNPN;yes;Così, l'uomo ha dovuto confrontarsi con la donna in modo diverso, da;cervello a cervello;, e abbandonare il mito dei muscoli.
814;a;da;distractor;chiusura a chiusura;no;_;chiusura;sg;PNPN;yes;In questa prospettiva il calo del BTp future, che da;chiusura a chiusura;è passato da 112,52 a 111,36, non può essere considerato drammatico: sulla scadenza decennale lo spread rispetto ai Bund tedeschi si è allargato solo di poco, a 68 punti base a fine giornata contro i 64 del giorno prima.
815;a;da;distractor;ciglio a ciglio;no;_;ciglio;sg;PNPN;yes;Se il confine si trova in un fosso comune o in una via privata, la distanza si misura da;ciglio a ciglio;o dal ciglio al lembo esteriore della via (911).
817;a;da;distractor;circoscrizione a circoscrizione;no;_;circoscrizione;sg;PNPN;yes;Il numero di liste varia invece da;circoscrizione a circoscrizione;: a Bologna in totale sono 16.
819;a;da;distractor;classe a classe;no;_;classe;sg;PNPN;yes;Quando le incursioni maschili da;classe a classe;partivano, lui restava inchiodato al suo banco con aria ostentatamente indifferente, a sfogliacchiare il volume di testo dell'ora dopo, anche se, con l'orecchio più vicino alla porta della sua classe, non poteva fare a meno di seguire lo svolgimento dei fatti a pochi metri di distanza nell'affollato corridoio.
821;a;da;distractor;codice a codice;no;_;codice;sg;PNPN;yes;È anche il caso delle trascrizioni da;codice a codice;.
822;a;da;distractor;collega a collega;no;_;collega;sg;PNPN;yes;Pongo solo un dubbio deontologico, da;collega a collega;.
824;a;da;distractor;collega a collega;no;_;collega;sg;PNPN;yes;"A una sola condizione, da """;collega a collega;""": ""Non citarmi mai"", si capisce."
825;a;da;distractor;collina a collina;no;_;collina;sg;PNPN;yes;Adesso qui, come in Borgogna, siamo concentrati su come il Barolo si esprima da;collina a collina;, da vigna a vigna negli undici Comuni della zona.
826;a;da;distractor;collisione a collisione;no;_;collisione;sg;PNPN;yes;A parità di peso atomico, il rapporto E1 E2 è compreso tra 1 e (1 + a) 2, anche se in realtà J varia statisticamente da;collisione a collisione;.
827;a;a;distractor;colpo a colpo;no;_;colpo;sg;PNPN;yes;Lui va avanti, martella e inchioda, sale e scende e sposta la scala e ci risale, chiude a;colpo a colpo;il muro esterno della casa che si è costruito.
828;a;da;distractor;coltura a coltura;no;_;coltura;sg;PNPN;yes;Si è visto che la colza GM è una coltura ad alto rischio per quanto riguarda il flusso di geni da;coltura a coltura;, e il mais GM è una coltura a rischio medio - alto.
829;a;aggiungere;distractor;commento a commento;no;_;commento;sg;verbal;yes;Volti tirati, ma è inutile aggiungere;commento a commento;.
832;a;da;distractor;compagnia a compagnia;no;_;compagnia;sg;PNPN;yes;Il costo del biglietto può variare da;compagnia a compagnia;.
