ID;preposition;pre_lemma;meaning;NPN;construction;syntactic_function;noun;number_of_noun;Type;other_cxn;context_pre;costr;context_post
1;a;gomito;juxtaposition/contact;anima ad anima;yes;modifier;anima;sg;_;_;Ecco, devono essere nati così questi ultimi due romanzi di famiglia, seguiti da lunghe ore al computer, uno accanto all'altro, gomito a gomito,;anima ad anima;, ogni tanto un sospiro, una lunga occhiata, qualche sorriso di tenerezza perché i due si adorano e si cercano come solo due innamoratini sanno fare, al di là delle loro abbondanti sessanta primavere.
2;a;confinare;juxtaposition/contact;balcone a balcone;yes;modifier;balcone;sg;_;_;La comunità di gatti che mi ospita sta nell'appartamento in cui abitiamo, che confina,;balcone a balcone;, con un altro appartamento nel quale viveva fino a poco tempo fa una gatta vecchia e sola.
3;a;dirimpettaio;juxtaposition/contact;balcone a balcone;yes;modifier;balcone;sg;_;_;Così si sente superiore nel cortile, a esempio, sul cav. Bizzini, suo dirimpettaio,;balcone a balcone;, che vive con la figlia, il genero e i ragazzi un maschio e una femmina e potrebbe essere privilegiato, ma se sapesse scrollarsi di dosso il rischio di venir ficcato in un ospizio per anziani.
5;a;or;succession/iteration/distributivity;bit a bit;yes;modifier;bit;sg;_;_;Esegue l 'operazione di OR;bit a bit;tra i due operandio specificati, ponendo il risultato nel secondo.
6;a;trasmettere;succession/iteration/distributivity;bit a bit;yes;modifier;bit;sg;_;_;È compito di quest'ultimo trasmettere,;bit a bit;, l'informazione sul cavo e quindi al destinatario.
59;a;respirazione;juxtaposition/contact;bocca a bocca;yes;modifier;bocca;sg;_;_;In attesa dell'arrivo dell'ambulanza gli hanno praticato il massaggio cardiaco e la respirazione;bocca a bocca;ma tutto è stato inutiule.
7;a;respirazione;juxtaposition/contact;bocca a bocca;yes;modifier;bocca;sg;_;_;Alcune tecniche di rianimazione, come per esempio la respirazione;bocca a bocca;, possono risultare pericolose per il soccorritore: in questo modo si possono trasmettere molte malattie, soprattutto se l'infortunato ha delle perdite di sangue.
67;a;respirazione;juxtaposition/contact;bocca a bocca;yes;modifier;bocca;sg;_;_;Nel bambino da 1 a 8 anni si fa la respirazione;bocca a bocca;, tenendo chiuse le narici con le dita.
18;a;metodo;juxtaposition/contact;bocca a bocca;yes;modifier;bocca;sg;_;_;Inoltre, l'aria insufflata presa dall'ambiente, o collegata a un erogatore di ossigeno contiene delle percentuali di ossigeno superiori a quelle insufflate con il metodo;bocca a bocca;.
54;a;racconto;juxtaposition/contact;bocca a bocca;yes;modifier;bocca;sg;_;_;Tutto si vela, tutto si ammanta, tutto trapassa così in un mondo parallelo dove anche il dolore può stemperarsi nel calore delle leggende, nella familiarità dei lunghi racconti;bocca a bocca;.
42;a;respirazione;juxtaposition/contact;bocca a bocca;yes;modifier;bocca;sg;_;_;Se non avesse ripreso a respirare, doveva procedere con la respirazione;bocca a bocca;.
14;a;respirazione;juxtaposition/contact;bocca a bocca;yes;modifier;bocca;sg;_;_;Se non è possibile la respirazione;bocca a bocca;si può tentare una respirazione manuale la cui efficacia è molto inferiore.
12;a;respirazione;juxtaposition/contact;bocca a bocca;yes;modifier;bocca;sg;_;_;La respirazione artificiale andrebbe praticata attraverso strumenti medicali come il pallone ambu e, per motivi di igiene e profilassi, è sconsigliabile praticare la respirazione;bocca a bocca;.
68;a;dove;juxtaposition/contact;bocca a bocca;yes;modifier;bocca;sg;_;_;La rinuncia alla propria individualità è celebrata in Breathing In POTH Breathing Out (sempre del 1977) dove,;bocca a bocca;e con le narici chiuse da filtri di sigaretta, l'una respira nella bocca dell'altro, in una rappresentazione tragica di cosa succede quando si dipende completamente da un'altra persona.
33;a;respirazione;juxtaposition/contact;bocca a bocca;yes;modifier;bocca;sg;_;_;Cominciò a praticare la respirazione;bocca a bocca;a Phillip mentre scendeva le scale.
17;a;contatto;juxtaposition/contact;bocca a bocca;yes;modifier;bocca;sg;_;_;In questo modo il soccorritore può ventilare l'infortunato evitando il contatto;bocca a bocca;.
29;a;respirazione;juxtaposition/contact;bocca a bocca;yes;modifier;bocca;sg;_;_;È stato qualche anno fa e ricordo ogni minimo dettaglio: lui disteso per terra, attraverso la portiera schiacciata stava facendo la respirazione;bocca a bocca;a una donna che aveva perso conoscenza.
13;a;respirazione;juxtaposition/contact;bocca a bocca;yes;modifier;bocca;sg;_;_;Se l'infortunato presenta delle fratture alla mandibola o alla mascella, si può procedere come nelcaso della respirazione;bocca a bocca;con la differenza che la bocca viene tenuta chiusa per evitare che fuoriesca l'aria insufflata, e le insufflazioni vanno fatte attraverso il naso.
66;a;respirazione;juxtaposition/contact;bocca a bocca;yes;modifier;bocca;sg;_;_;Se non respira, intervenire per la respirazione;bocca a bocca;.
21;a;respirazione;juxtaposition/contact;bocca a bocca;yes;modifier;bocca;sg;_;_;Per i primi cinque minuti il massaggio non va interrotto (amenoche non si sia obbligati ad eseguire contemporaneamente la respirazione;bocca a bocca;.
39;a;attaccare;juxtaposition/contact;bocca a bocca;yes;modifier;bocca;sg;_;_;La madre era sparita dietro le spalle larghe dello sconosciuto, i due stavano attaccati;bocca a bocca;e si stringevano forte.
36;a;respirazione;juxtaposition/contact;bocca a bocca;yes;modifier;bocca;sg;_;_;Sembrava che ci fosse poco da fare per la piccola Jihan: «Il camionista ha portato dell'acqua per lavarla dal sangue, e io ho provato a farle la respirazione;bocca a bocca;».
15;a;respirazione;juxtaposition/contact;bocca a bocca;yes;modifier;bocca;sg;_;_;Questa posizione è indispensabile primadi praticare la respirazione;bocca a bocca;, altrimenti l'aria insufflata rischia di non raggiungere i polmoni.
57;a;respirazione;juxtaposition/contact;bocca a bocca;yes;modifier;bocca;sg;_;_;Intanto io gli facevo la respirazione;bocca a bocca;e il massaggio cardiaco, gli cambiavo il pigiama sporco, lo tenevo su per la testa.
22;a;respirazione;juxtaposition/contact;bocca a bocca;yes;modifier;bocca;sg;_;_;Non hai preso lezioni di pronto soccorso, non sai come si fa un massaggio cardiaco, non ti piace la respirazione;bocca a bocca;, trovi inutile quindi fermarti a guardare.
25;a;respirazione;juxtaposition/contact;bocca a bocca;yes;modifier;bocca;sg;_;_;E il protagonista ha imparato a fare la respirazione;bocca a bocca;leggendo le riviste gettate nella spazzatura.
49;a;respirazione;juxtaposition/contact;bocca a bocca;yes;modifier;bocca;sg;_;_;"Tu boccheggiavi e tossivi; poi ti facevano la respirazione";bocca a bocca;ed eri fuori pericolo.
64;a;artificiale;juxtaposition/contact;bocca a bocca;yes;modifier;bocca;sg;_;_;Se, invece, la vittima dovesse presentarsi priva di sensi e avere difficoltà respiratorie, iniziate immediatamente la respirazione artificiale;bocca a bocca;.
52;a;respirazione;juxtaposition/contact;bocca a bocca;yes;modifier;bocca;sg;_;_;Karin levò la mano: Ma nella Bibbia c'è scritto che Dio ha soffiato la vita dentro il primo uomo... La respirazione;bocca a bocca;.
50;a;artificiale;juxtaposition/contact;bocca a bocca;yes;modifier;bocca;sg;_;_;L'altro agente praticò a Sullivan la respirazione artificiale;bocca a bocca;.
61;a;respirazione;juxtaposition/contact;bocca a bocca;yes;modifier;bocca;sg;_;_;Si è trascinato per qualche metro finoall'uscita della fabbrica, poi è crollato sul marciapiede sotto gli occhi del giovane complice, che ha tentato inutilmente di animarlo con la respirazione;bocca a bocca;.
58;a;respirazione;juxtaposition/contact;bocca a bocca;yes;modifier;bocca;sg;_;_;"Per oltre 15 minuti ha tenuto in vita un amico intrappolato sott'acqua soffiandogli aria nei polmoni con ripetute immersioni e altrettante ""respirazioni";bocca a bocca;"""."
56;a;alimentazione;juxtaposition/contact;bocca a bocca;yes;modifier;bocca;sg;_;_;Il significato erotico del bacio deriverebbe dall'alimentazione;bocca a bocca;dell'infante.
62;a;respirazione;juxtaposition/contact;bocca a bocca;yes;modifier;bocca;sg;_;_;Di più, provano a rianimare i due amici: massaggio cardiaco, respirazione;bocca a bocca;.
24;a;respirazione;juxtaposition/contact;bocca a bocca;yes;modifier;bocca;sg;_;_;Nessuno parla dell'impiegato di banca che non è corrotto e che magari un giorno ha salvato la vita a un collega facendogli la respirazione;bocca a bocca;.
69;a;sviluppare;juxtaposition/contact;braccio a braccio;yes;modifier;braccio;sg;_;_;Primo edificio per la musica progettato dallo studio di Michel Rojkind, è il frutto di un processo progettuale sviluppato;braccio a braccio;con la direzione dell'Orchestra: le scelte riguardanti il tipo di sala, il numero di sedute e le destinazioni funzionali degli ambienti sono dunque condivise e volute dai successivi inquilini dello spazio.
70;a;cui;succession/iteration/distributivity;brano a brano;yes;modifier;brano;sg;_;_;"""E siccome era stato portato lì davanti con tutti i suoi paramenti sacerdotali, iniziò un rito in cui";brano a brano;i paramenti gli venivano levati sinoa che rimase in quella vesticciola che a Firenze chiamano cioppa.
72;a;scuoiare;succession/iteration/distributivity;brano a brano;yes;modifier;brano;sg;_;_;Ma non primadi aver beccato Nauplio finoa levargli la pelle, a scuoiarlo,;brano a brano;.
73;a;rischiare;succession/iteration/distributivity;brano a brano;yes;modifier;brano;sg;_;_;È sensibile ai tentativi dei poeti di rischiarare;brano a brano;l'ancora vasta oscurità delle cose non dette.
74;a;meglio;succession/iteration/distributivity;campo a campo;yes;modifier;campo;sg;_;_;E così, goccia a goccia, o meglio,;campo a campo;e casa a casa, in duemila anni la Chiesa ha potuto accumulare un patrimonio immenso, che nel passato era amministrato dal cosiddetto Obolo di San Pietro, e oggi lo è invece dal Pio Istituto per le Opere di Religione (IOR).
75;a;e;succession/iteration/distributivity;casa a casa;yes;modifier;casa;sg;_;_;E così, goccia a goccia, o meglio, campo a campo e;casa a casa;, in duemila anni la Chiesa ha potuto accumulare un patrimonio immenso, che nel passato era amministrato dal cosiddetto Obolo di San Pietro, e oggi lo è invece dal Pio Istituto per le Opere di Religione (IOR).
76;a;sfilare;succession/iteration/distributivity;ciocca a ciocca;yes;modifier;ciocca;sg;_;_;Il più attuale si fa sfilando;ciocca a ciocca;, per creare l'effetto piuma, che alleggerisce la pettinatura e rende la piega particolarmente facile.
118;a;lotta;juxtaposition/contact;corpo a corpo;yes;modifier;corpo;sg;_;_;"Temi di attualità: la paura del domani, il Duemila è alle porte; il fascino del messaggio predicatorio; la lotta";corpo a corpo;tra ragione e cuore.
100;a;affrontare;juxtaposition/contact;corpo a corpo;yes;modifier;corpo;sg;_;_;Mai prima quei guerrieri avevano affrontato;corpo a corpo;le legioni e non pareva loro vero di sfogare la rabbia a lungo compressa su quei reparti in disfatta, in preda al panico e alla confusione.
104;a;faccia;juxtaposition/contact;corpo a corpo;yes;modifier;corpo;sg;_;_;Scoperto difronteal proprio nemico, faccia a faccia,;corpo a corpo;, il nostro scrittore si apprestava a scrivere un'altra pagina del suo romanzo, quello della vita.
94;a;combattimento;juxtaposition/contact;corpo a corpo;yes;modifier;corpo;sg;_;_;I caduti statunitensi erano già più di centomila, vittime in ugual misura del gelido inverno coreano e della maestria dell'esercito cinese nel combattimento;corpo a corpo;e nelle incursioni notturne.
79;a;scontro;juxtaposition/contact;corpo a corpo;yes;modifier;corpo;sg;_;_;Per contro la loro forze e il loro fisico non sono assolutamente adatti nello scontro;corpo a corpo;.
98;a;combattimento;juxtaposition/contact;corpo a corpo;yes;modifier;corpo;sg;_;_;James Buck aveva fatto parte delle SAS, le forze aeree speciali britanniche, e, tra le altre cose, era un esperto di combattimenti;corpo a corpo;e di armi bianche.
101;a;combattimento;juxtaposition/contact;corpo a corpo;yes;modifier;corpo;sg;_;_;Tauro cercò di fermarlo: per qualche istante la sua rocciosa complessione, il suo coraggio, l'abilità nel duello e l'esperienza di mille combattimenti;corpo a corpo;parvero mettere in difficoltà il guerriero germanico.
123;a;scontro;juxtaposition/contact;corpo a corpo;yes;modifier;corpo;sg;_;_;Nell'economia del risultato a pesare è anche il comparto visivo perché, alla routine degli scontri;corpo a corpo;", Watts ci riserva sorprese quando si tratta di mettere in scena il potere illusionistico di Mysterio in una serie di sequenze da far girare la testa allo spettatore, per il gioco di specchi in cui la realtà fa a gara a smentire se stessa manco ci trovassimo nella sequenza finale de ""La signora di Shangai"" di Orson Welles."
97;a;combattimento;juxtaposition/contact;corpo a corpo;yes;modifier;corpo;sg;_;_;Non gli restava che il combattimento;corpo a corpo;.
89;a;danza;juxtaposition/contact;corpo a corpo;yes;modifier;corpo;sg;_;_;Il killer - ballerino e le cubiste - prede erano impegnati in una danza;corpo a corpo;molto coinvolgente.
109;a;battere;juxtaposition/contact;corpo a corpo;yes;modifier;corpo;sg;_;_;Nel frattempo, i macedoni rinchiusi nella cittadella fecero una sortita e presero alle spalle i guerrieri avversari che si battevano;corpo a corpo;, nelle vie strette e tortuose, davanti alle loro stesse case.
91;a;lotta;juxtaposition/contact;corpo a corpo;yes;modifier;corpo;sg;_;_;I colpi sono stati sparati durante la lotta,;corpo a corpo;.
80;a;combattere;juxtaposition/contact;corpo a corpo;yes;modifier;corpo;sg;_;_;Caratteristica utile a chi combatte;corpo a corpo;con l'avversario.
82;a;combattimento;juxtaposition/contact;corpo a corpo;yes;modifier;corpo;sg;_;_;Non era il momento adatto a considerazioni tattiche, la colluttazione era diventata un furioso combattimento;corpo a corpo;.
115;a;legare;juxtaposition/contact;corpo a corpo;yes;modifier;corpo;sg;_;_;"Dodici fra loro, originari di Lebbeke, si erano rifugiati nella fattoria di Ottavio Vernulst; essi furono legati";corpo a corpo;e condotti dietro alla fattoria, dove vennero massacrati.
106;a;uomo;juxtaposition/contact;corpo a corpo;yes;modifier;corpo;sg;_;_;Elias insegnava ai popolani come schierarsi in falange, puntare le picche, affrontare un uomo;corpo a corpo;.
84;a;combattimento;juxtaposition/contact;corpo a corpo;yes;modifier;corpo;sg;_;_;In questa situazione i giornalisti portati al seguito delle truppe per assistere a un rapido trionfo, sono diventati scomodi testimoni di una campagna difficile e lunga, dove i combattimenti;corpo a corpo;nelle periferie delle città si verificano con una frequenza sempre più ravvicinata.
114;a;rapido;juxtaposition/contact;corpo a corpo;yes;modifier;corpo;sg;_;_;Inoltre l'uso giudizioso della massa corporea può rappresentare in certe situazioni un vantaggio supplementare non indifferente, per esempio negli incontri rapidi;corpo a corpo;, come nella lotta greco - romana, nel catch, nel sumo.
108;a;duello;juxtaposition/contact;corpo a corpo;yes;modifier;corpo;sg;_;_;Pare abbia ucciso di sua mano un ribelle della tribù dei cadusi in un duello;corpo a corpo;.
81;a;accanitamente;juxtaposition/contact;corpo a corpo;yes;modifier;corpo;sg;_;_;I due fratelli si scontrarono accanitamente;corpo a corpo;e morirono entrambi.
92;a;impatto;juxtaposition/contact;corpo a corpo;yes;modifier;corpo;sg;_;_;Come dice Manuel Estiarte, il più forte pallanuotista di tutti i tempi: «È vero, bisogna calcolare che le probabilità che Messi esca sconfitto da un impatto;corpo a corpo;sono elevate, come elevato è il rischio che venga totalmente travolto dai difensori.
88;a;combattimento;juxtaposition/contact;corpo a corpo;yes;modifier;corpo;sg;_;_;Essi o lo impegnavano in violenti combattimenti;corpo a corpo;, oppure rimanevano ritti immobili e silenziosi in qualche angolo della casa.
96;a;scontro;juxtaposition/contact;corpo a corpo;yes;modifier;corpo;sg;_;_;Non possedeva più la pistola e la spranga che aveva trovato si sarebbe rivelata utile solo in uno scontro;corpo a corpo;.
121;a;combattere;juxtaposition/contact;corpo a corpo;yes;modifier;corpo;sg;_;_;Ma anche questa volta per occupare la Città Santa devono combattere;corpo a corpo;con i palestinesi per annientare la resistenza araba.
87;a;battaglia;juxtaposition/contact;corpo a corpo;yes;modifier;corpo;sg;_;_;La guerriglia urbana, la battaglia;corpo a corpo;nelle strade della capitale è proprio quello che al Pentagono vogliono evitare.
86;a;combattere;juxtaposition/contact;corpo a corpo;yes;modifier;corpo;sg;_;_;Qualche scettico si domanderà come mai il comando americano mandi un preziosissimo marconista navajo a combattere;corpo a corpo;contro il nemico, con il rischio che lo catturino.
93;a;combattimento;juxtaposition/contact;corpo a corpo;yes;modifier;corpo;sg;_;_;Saphira era meglio equipaggiata dei Lethrblaka per il combattimento;corpo a corpo;, grazie alle squame - più dure e resistenti della loro pellaccia grigia - e ai denti - di gran lunga più letali del loro becco in uno scontro ravvicinato - ma in quella situazione, con il basso soffitto della caverna che le dava scarsa libertà di manovra per saltare o volare, aveva non poche difficoltà a tenere testa a due creature che l'attaccavano contemporaneamente.
95;a;combattere;juxtaposition/contact;corpo a corpo;yes;modifier;corpo;sg;_;_;Nella tradizione cristiana, durante i giorni di Pasqua si legge un versetto in latino che dice in modo mirabile che la vita e la morte combattono;corpo a corpo;.
111;a;lotta;juxtaposition/contact;corpo a corpo;yes;modifier;corpo;sg;_;_;La caccia a cavallo o a piedi, la lotta;corpo a corpo;, i combattimenti dei galli erano quanto deliziava la gente e tutte queste attività si concludevano con solenni bevute.
112;a;te;juxtaposition/contact;corpo a corpo;yes;modifier;corpo;sg;_;_;"Sto rollando verso di te, balena, tu che tutto distruggi e nulla conquisti; fino all'ultimo lotto con te";corpo a corpo;", e dal cuore dell'inferno ti pugnalo; in nome dell'odio ti sputo addosso l'estremo respiro."
126;a;mano;juxtaposition/contact;cuore a cuore;yes;modifier;cuore;sg;_;_;Invece la stava invitando a camminare al suo fianco, mano nella mano,;cuore a cuore;.
127;a;te;juxtaposition/contact;cuore a cuore;yes;modifier;cuore;sg;_;_;Ci deve essere la possibilità di rapporti concreti: la mamma deve poterti portare a letto, darti il bacio della buona notte, imboccarti se è necessario, stare con te;cuore a cuore;.
128;a;contatto;juxtaposition/contact;cuore a cuore;yes;modifier;cuore;sg;_;_;E poi ci fu la marsupioterapia, il primo contatto;cuore a cuore;.
129;a;impilare;juxtaposition/contact;dorso a dorso;yes;modifier;dorso;sg;_;_;"Vittorio scosta qualche altra grande tela appoggiata alla parete, giusto abbastanza per farmi dare un'occhiata; me ne fa vedere alcune di quelle più piccole, impilate";dorso a dorso;sul tavolo di legno grezzo.
130;a;che;juxtaposition/contact;dorso a dorso;yes;modifier;dorso;sg;_;_;Avvicinandosi si trovano - e si vedono da vicino - centinaia di bellissimi uccelli che,;dorso a dorso;, sembrano coprire l'acqua con un manto rosato.
132;a;via;succession/iteration/distributivity;fibra a fibra;yes;modifier;fibra;sg;_;_;La sua voce si impoveriva man mano che andava avanti, come se le sue parole si portassero via;fibra a fibra;il tessuto del suo timbro.
133;a;percorrere;succession/iteration/distributivity;fibra a fibra;yes;modifier;fibra;sg;_;_;Le sembrava che Francesco fosse improvvisamente penetrabile alla sua conoscenza e che avrebbe potuto percorrerlo;fibra a fibra;, come si fa con uno strumento musicale le cui note appartengano a uno spartito certo.
134;a;cadere;succession/iteration/distributivity;fiocco a fiocco;yes;modifier;fiocco;sg;_;_;La neve continuava a cadere,;fiocco a fiocco;a fiocco accresceva lo spessore di bianco e di silenzio, senso di distanza dal resto del mondo.
135;a;a;succession/iteration/distributivity;fiocco a fiocco;yes;modifier;fiocco;sg;_;_;La neve continuava a cadere, fiocco a;fiocco a fiocco;accresceva lo spessore di bianco e di silenzio, senso di distanza dal resto del mondo.
136;a;scomparire;succession/iteration/distributivity;foglia a foglia;yes;modifier;foglia;sg;_;_;Nanni guarda il triangolino di frittata deflagrare e ricomporsi nel piatto di Cecilia, mentre l'insalata scompare;foglia a foglia;con estenuante lentezza, e tutte le cose che vorrebbe dirle non le può dire.
137;a;costruire;succession/iteration/distributivity;fotogramma a fotogramma;yes;modifier;fotogramma;sg;_;_;Una mitologia personale, insomma, costruita;fotogramma a fotogramma;"ritagliandomi di netto ciò che è necessario per un Olimpo fatto in casa: un pugno di tragedie sofoclee, uomini ed eroi, martiri casuali, omicidi senza fonte e senza fine; oppure: confondendo l'universo condiviso con gli album personali: eccola una foto di mio padre tale e quale a Satta Flores in C'eravamo tanto amati."
139;a;vigilare;juxtaposition/contact;fronte a fronte;yes;modifier;fronte;sg;_;_;E l'ordine, sia ben chiaro, non è l'assenza di disordine, ma la confusione regolamentata, su cui vigilano;fronte a fronte;re e vescovi.
140;a;trovare;juxtaposition/contact;fronte a fronte;yes;modifier;fronte;sg;_;_;Hussein, alla minaccia di trovarsi;fronte a fronte;con Amintore e soprattutto con Maria Pia, ha pianto lungamente e voleva far caricare sul jumbo anche un paio di emiri kuwaitiani con tutte le mogli e figli.
141;a;trovare;juxtaposition/contact;fronte a fronte;yes;modifier;fronte;sg;_;_;Una volta tolte di mezzo le operaie, le due regine si trovano;fronte a fronte;.
142;a;salone;juxtaposition/contact;fronte a fronte;yes;modifier;fronte;sg;_;_;Ed ecco allora ai due estremi del salone,;fronte a fronte;, la Trasfigurazione di Tiziano (dove l'autore discioglie in un vortice drammatico e accalorato - con il bianco fantasmatico del Cristo che si riflette sull'emergenza dei capelli bianchi e sul rubizzo colore rubensiano della testa di Pietro sul bruno sfatto e informe del corpo - il ritmo rigoroso a mandorla della parte alta del modello raffaellesco) e l'Ultima Cena di Tintoretto.
143;a;trovare;juxtaposition/contact;fronte a fronte;yes;modifier;fronte;sg;_;_;Proprio nel novembre del '95, in occasione di una tavola rotonda nell'aula Nervi sull'etica in presenza di duemila medici cattolici, Giovanni Paolo II ed Andreotti si trovarono;fronte a fronte;e si scambiarono una lunga stretta di mano in un clima di ovazione.
189;a;svuotare;succession/iteration/distributivity;goccia a goccia;yes;modifier;goccia;sg;_;_;La fine portava la festa, il maiale si svuotava;goccia a goccia;, in chiesa il prete issava il Cristo infreddolito sulla croce e dava l'ostia ai credenti, le strade si riempivano, sulla terra bianca la chiazza rossa si stendeva con la lentezza delle cose passate, e il mio sguardo non trovava rifugio.
155;a;vaselina;succession/iteration/distributivity;goccia a goccia;yes;modifier;goccia;sg;_;_;Aggiungete, sempre mescolando, l'olio di vaselina;goccia a goccia;.
168;a;lentamente;succession/iteration/distributivity;goccia a goccia;yes;modifier;goccia;sg;_;_;Cominciò a scavare con la punta della spada finché vide affiorare lentamente,;goccia a goccia;, dell'acqua.
149;a;irrigazione;succession/iteration/distributivity;goccia a goccia;yes;modifier;goccia;sg;_;_;Ai due lati del viale, dentro gabbie di ferro avvolte di tela di sacco per ripararle dalle tempeste di sabbia, alcune piante di poinciana nutrite dall'irrigazione;goccia a goccia;e ancora incredule sul senso della propria esistenza.
146;a;vivere;succession/iteration/distributivity;goccia a goccia;yes;modifier;goccia;sg;_;_;I suoi occhi sfavillano ora di un desiderio mai visto di vita, di piacere, ora di tristezza profonda, vissuta;goccia a goccia;, una desolazione tanto esausta da sconfinare nell'ironia.
145;a;sangue;succession/iteration/distributivity;goccia a goccia;yes;modifier;goccia;sg;_;_;come una ferita che lascia sgorgare il sangue;goccia a goccia;.
181;a;usare;succession/iteration/distributivity;goccia a goccia;yes;modifier;goccia;sg;_;_;"Se, invece, la persona a cui volete regalarlo è come Coco Chanel, che diceva sempreche il profumo va messo ""dove si vuole essere baciate"", preferite un flacone: lo userà";goccia a goccia;.
184;a;riprendere;succession/iteration/distributivity;goccia a goccia;yes;modifier;goccia;sg;_;_;Con il tempo la situazione peggiora: lo svuotamento avviene a più riprese,;goccia a goccia;.
154;a;mai;succession/iteration/distributivity;goccia a goccia;yes;modifier;goccia;sg;_;_;Il libro inizia con queste parole: «La speranza non scende mai;goccia a goccia;.
161;a;scorrere;succession/iteration/distributivity;goccia a goccia;yes;modifier;goccia;sg;_;_;Nel braccio di Bruno è conficcato l'ago e lungo il flessibile scorre;goccia a goccia;la medicina che per il momento regala al suo volto un'aria distesa e l'ombra di un sorriso.
176;a;parsimonia;succession/iteration/distributivity;goccia a goccia;yes;modifier;goccia;sg;_;_;La medicina nutriva Malaussene con parsimonia,;goccia a goccia;.
169;a;vita;succession/iteration/distributivity;goccia a goccia;yes;modifier;goccia;sg;_;_;Si lavorava da sole a sole, alcuni incidendo gli alberi per togliergli la vita;goccia a goccia;, altri cuocendo il liquido raccolto per ispessirlo e farne grandi palle.
150;a;impianto;succession/iteration/distributivity;goccia a goccia;yes;modifier;goccia;sg;_;_;La sala, ordinata e illuminata, Amalia l'ha riempita di piante ben curate, a decine, coltura idroponica rivestita di una ghiaia sottile e brillante, irrigata con un impianto;goccia a goccia;che fornisce un miscuglio di fertilizzante e sali minerali.
