ID;preposition;pre_lemma;meaning;NPN;construction;syntactic_function;noun;number_of_noun;Type;other_cxn;context_pre;costr;context_post
1619;su;rispondere;succession/iteration/distributivity;colpo su colpo;yes;modifier;colpo;sg;_;_;Più adulto e più esperto di lui, era sempre riuscito a tenergli testa, a rispondere;colpo su colpo;o addirittura a prevenire le sue mosse.
1596;su;rispondere;succession/iteration/distributivity;colpo su colpo;yes;modifier;colpo;sg;_;_;Il nostro compito è restare vigili e rispondere;colpo su colpo;.
1642;su;rispondere;succession/iteration/distributivity;colpo su colpo;yes;modifier;colpo;sg;_;_;Entrambe le compagini si sono affrontate a viso aperto rispondendo;colpo su colpo;a qualasisi iniziativa opposta, esibendo in certi frangenti anche giocate di buona tecnica.
1588;su;ribattere;succession/iteration/distributivity;colpo su colpo;yes;modifier;colpo;sg;_;_;All'Arechi gli uomini di Beretta hanno dovuto fare i conti con una Salernitana mai doma, pronta a ribattere;colpo su colpo;agli affondi dei più blasonati avversari.
1593;su;Masina;succession/iteration/distributivity;colpo su colpo;yes;modifier;colpo;sg;_;_;"Tutto improvvisamente, intorno a quel ripiano, era tornato coerente con il tradizionale menage familiare della famiglia Masina; Manlio col suo slang condito di parolacce, Giorgio col suo rispondere";colpo su colpo;a tutte le provocazioni esterne, Cinzia con la sua puntuale abilità di organizzatrice familiare, Valentina con la sua svogliata partecipazione alla conduzione domestica e Noel con la sua serena e coccolata presenza, tanto cara a tutti.
1629;su;stesso;succession/iteration/distributivity;colpo su colpo;yes;modifier;colpo;sg;_;_;Dopo aver speso una intera vita a fondarla e a cercare di farla funzionare, alla fine è stato lui stesso,;colpo su colpo;, a estinguerla.
1607;su;rispondere;succession/iteration/distributivity;colpo su colpo;yes;modifier;colpo;sg;_;_;Da dove trar fuori l'energia pietosa per combattere quel dolore, per rispondergli;colpo su colpo;, per non lasciarlo dilagare nel mondo con la sua forza annientatrice?
1640;su;controbattere;succession/iteration/distributivity;colpo su colpo;yes;modifier;colpo;sg;_;_;I locali hanno comunque retto la botta almeno per i 40 minuti iniziali, controbattendo;colpo su colpo;, anzi pressando in tutte le parti del campo.
1620;su;rispondere;succession/iteration/distributivity;colpo su colpo;yes;modifier;colpo;sg;_;_;Solo gli Immortali restarono sul posto, si chiusero a quadrato e continuarono a respingere gli assalti nemici rispondendo;colpo su colpo;.
1595;su;ribattere;succession/iteration/distributivity;colpo su colpo;yes;modifier;colpo;sg;_;_;Che non consiste nel ribattere;colpo su colpo;alle battute dell'antipolitica nei salotti televisivi, ma nel rispondere alle domande della società.
1614;su;restituire;greater_plurality/accumulation;colpo su colpo;yes;nominal;colpo;sg;_;_;La strada, però, con una durezza che si ripercoteva fino all'inguine, mi restituiva;colpo su colpo;.
1613;su;reagire;succession/iteration/distributivity;colpo su colpo;yes;modifier;colpo;sg;_;_;Aspetto solo una parola per reagire;colpo su colpo;al primo segnale.
1600;su;rispondere;succession/iteration/distributivity;colpo su colpo;yes;modifier;colpo;sg;_;_;Jack Hyde mi fa domande spiazzanti e intelligenti, ma io non mi faccio cogliere impreparata: rispondo;colpo su colpo;e, quando discutiamo delle mie letture preferite, credo di cavarmela bene.
1601;su;attacco;succession/iteration/distributivity;colpo su colpo;yes;modifier;colpo;sg;_;_;Ma Rambo non ci sta, Rambo combatte, lui resta in forma e risponde all'attacco;colpo su colpo;, prendendo la natura a calci nel culo e spaccando il muso alla società.
1641;su;restituire;greater_plurality/accumulation;colpo su colpo;yes;nominal;colpo;sg;_;_;Proprio la dote che l'aveva sorretta durante il primo tempo, consentendole di reggere il ritmo - non forsennato - degli avversari ai quali aveva restituito;colpo su colpo;.
1634;su;reagire;succession/iteration/distributivity;colpo su colpo;yes;modifier;colpo;sg;_;_;Katoh ha immediatamente risposto, ma Melandri ha reagito;colpo su colpo;.
1654;su;ovvero;greater_plurality/accumulation;comunicazioni su comunicazioni;yes;nominal;comunicazione;pl;_;_;La capacità di significare tramite icone implica anche che tutti i processi di comunicazione siano di secondo livello, ovvero;comunicazioni su comunicazioni;, spesso lontane dalla vita quotidiana.
1655;su;fare;greater_plurality/accumulation;conti su conti;yes;nominal;conto;pl;_;_;"Mentre riaccompagnava Eco in auto in centro, Pete disse: ""Continuo a fare";conti su conti;", sai, mi sembra di essere un cane che si morde la coda""."
1657;su;volante;greater_plurality/accumulation;controlli su controlli;yes;nominal;controllo;pl;_;_;Strade bloccate, frontiere minate, posti di blocco volanti,;controlli su controlli;, ormai il Kosovo è solo questo.
1659;su;accatastare;greater_plurality/accumulation;copie su copie;yes;nominal;copia;pl;_;_;Nel suo ufficio sono accatastate;copie su copie;della Fattoria degli animali di Orwell: il contributo del governo britannico all'insegnamento dell'inglese nelle scuole afghane e una lezione elementare sui danni del marxismo, messa in bocca a un maiale.
1661;su;mangiare;greater_plurality/accumulation;coppe su coppe;yes;nominal;coppa;pl;_;_;Orinare stando in piedi era punito in un modo particolarmente arduo, e le donne che durante le mestruazioni si avvicinavano all'acqua o al fuoco venivano costrette a mangiare;coppe su coppe;di piscio e merda maschili.
1662;su;mettere;greater_plurality/accumulation;corna su corna;yes;nominal;corna;pl;_;_;Invece toccò al capo, ad Agamennone, uomo borioso e fatuo, a cui Clitennestra da tempo metteva;corna su corna;perché ormai impotente.
1663;su;trafiggere;greater_plurality/accumulation;corpi su corpi;yes;nominal;corpo;pl;_;_;Invano risuonò l'ululato, straziante, di tutti i superstiti: i proiettili seguitarono a trafiggere;corpi su corpi;, trasformandoli in un batter d'occhio in bambolotti di pezza privi di vita.
1664;su;fare;greater_plurality/accumulation;corsi su corsi;yes;nominal;corso;pl;_;_;Ultimamente, siccome si dice che questi ragazzi e queste ragazze non imparano niente, allora si fanno;corsi su corsi;per vedere come avvicinarsi, quindi per curare la relazione, però sempre in un modo strumentale, come mezzo per arrivare al RAZIONALE.
1668;su;su;greater_plurality/accumulation;creme su creme;yes;nominal;crema;pl;_;_;Altro errore frequentissimo: applicare creme su;creme su creme;sulla cute del viso irritata, arrossata, sensibilizzata.
1669;su;successivo;succession/iteration/distributivity;crosta su crosta;yes;modifier;crosta;sg;_;_;Dall'alto del Forte capisco il rinnovo degli strati successivi,;crosta su crosta;.
1671;su;389;greater_plurality/accumulation;curve su curve;yes;nominal;curva;pl;_;_;All'altezza della rocca di Posada si penetra nell'interno proseguendo sulla statale 389:;curve su curve;dove è possibile non incrociare altre macchine.
1672;su;produrre;greater_plurality/accumulation;danni su danni;yes;nominal;danno;pl;_;_;La condizione, naturalmente, è voler discutere davvero del merito dei problemi: mettendo da parte una logica di contrapposizione politica esasperata che, a urne chiuse, non può che produrre;danni su danni;.
1673;su;scatenare;greater_plurality/accumulation;dati su dati;yes;nominal;dato;pl;_;_;È il caso della finanza, che dopo la mondializzazione dei mercati borsistici ha visto scatenarsi;dati su dati;in quantità torrenziali e sta trovando nuova linfa proprio nelle nuove metodologie di rappresentazione.
1676;su;vedere;greater_plurality/accumulation;decine su decine;yes;nominal;decina;pl;_;_;Poi tornava a navigare su internet e a vedere;decine su decine;di filmati.
1678;su;trattamento;greater_plurality/accumulation;denunce su denunce;yes;nominal;denuncia;pl;_;_;Così come gli ingegneri e i geometri che lavorano per noi: anche tra loro, più d'uno ha subito il mio stesso trattamento,;denunce su denunce;.
1681;su;snocciolare;greater_plurality/accumulation;dettagli su dettagli;yes;nominal;dettaglio;pl;_;_;E intanto Jonathan continuava a snocciolare;dettagli su dettagli;, tanto che lo accusai di aver messo sotto controllo il telefono.
1682;su;vita;succession/iteration/distributivity;dettaglio su dettaglio;yes;modifier;dettaglio;sg;_;_;Eppure gli ci erano voluti dei mesi per mettere insieme il quadro della sua vita,;dettaglio su dettaglio;, dalle primissime annotazioni dell'epoca delle elementari attraverso le relazioni degli assistenti sociali finoalle inchieste di polizia e ai verbali del tribunale.
1683;su;snervante;succession/iteration/distributivity;dettaglio su dettaglio;yes;modifier;dettaglio;sg;_;_;Prima parlò dei suoi studi segreti, quelli da architetto, e mi raccontò in modo snervante,;dettaglio su dettaglio;, come si era svolto un esame difficile che aveva superato brillantemente.
1685;su;riunione;greater_plurality/accumulation;dichiarazioni su dichiarazioni;yes;nominal;dichiarazione;pl;_;_;Da dieci giorni stiamo dicendo in tutte le sedi che bisognava intervenire: si è perduto tempo a discutere, a prendere contatti diplomatici, a fare riunioni su riunioni,;dichiarazioni su dichiarazioni;, mentre la tragedia albanese richiedeva interventi rapidi, decisi, organici, massicci.
1688;su;fare;greater_plurality/accumulation;digiuno su digiuno;yes;nominal;digiuno;sg;_;_;"In America, i nostri amici del ""Catholic Worker"" non hanno smesso, a partire dal crimine di Hiroshima, di far";digiuno su digiuno;, pubbliche proteste e pubblicazioni: la loro ultima impresa è stata di farsi mettere in prigione per aver tentato di superare lo sbarramento del servizio d'ordine durante gli esperimenti nel Nevada.
1689;su;iniziare;greater_plurality/accumulation;discussioni su discussioni;yes;nominal;discussione;pl;_;_;Anzi, diciamola tutta: ciascuno ha un'idea differente del suo significato, e va così a finire che iniziano;discussioni su discussioni;.
1690;su;fare;greater_plurality/accumulation;docce su docce;yes;nominal;doccia;pl;_;_;Cioè: quando passavo davanti al monitor si accendevano tutte le lampadine, e questo significa che dovevo fare;docce su docce;": per ""purificarmi""."
1692;su;e;greater_plurality/accumulation;dolori su dolori;yes;nominal;dolore;pl;_;_;E dietro a quello, molti altri ricordi rossi, indicibili, segreti, sepolti da anni di uso di mondo, errori, matrimoni, figlie, partenze, musica, abbandoni, gioielli, amanti, dolori, e;dolori su dolori;su dolori per mimetizzare il padre di tutti i dolori.
1693;su;su;greater_plurality/accumulation;dolori su dolori;yes;nominal;dolore;pl;_;_;E dietro a quello, molti altri ricordi rossi, indicibili, segreti, sepolti da anni di uso di mondo, errori, matrimoni, figlie, partenze, musica, abbandoni, gioielli, amanti, dolori, e dolori su;dolori su dolori;per mimetizzare il padre di tutti i dolori.
1694;su;fare;greater_plurality/accumulation;domande su domande;yes;nominal;domanda;pl;_;_;E sa anche che se presenta operazioni un po' bislacche, in consiglio può trovare anche chi comincerà a far;domande su domande;.
1695;su;fare;greater_plurality/accumulation;domande su domande;yes;nominal;domanda;pl;_;_;Interi pomeriggi a bere tè ascoltando il racconto della loro vita, e io lì a fare;domande su domande;ome Maria De Filippi.
1696;su;a;greater_plurality/accumulation;domande su domande;yes;nominal;domanda;pl;_;_;Faye ha scoperto ancora un'altra Julie rispondere a;domande su domande;.
1699;su;instillare;greater_plurality/accumulation;dubbi su dubbi;yes;nominal;dubbio;pl;_;_;Era una mossa rischiosa: la maggioranza dei difensori non vede l'ora di cominciare a instillare;dubbi su dubbi;nei giurati e a contestare le prove addotte dall'accusa.
1700;su;accumulare;greater_plurality/accumulation;dubbi su dubbi;yes;nominal;dubbio;pl;_;_;Chiara era felice perché questa scelta le aveva evitato di accumulare;dubbi su dubbi;, perché Alessandro D'Amico era una garanzia.
1703;su;ieri;greater_plurality/accumulation;emendamenti su emendamenti;yes;nominal;emendamento;pl;_;_;Basti pensare che, per tutto il pomeriggio, nella riunione plenaria in Sala della Regina sono stati presentati ieri;emendamenti su emendamenti;.
1704;su;testimoniare;greater_plurality/accumulation;episodi su episodi;yes;nominal;episodio;pl;_;_;Né potrebbe essere altrimenti, poiché chiunque l'abbia conosciuto potrebbe testimoniare;episodi su episodi;al riguardo.
1705;su;accumulare;greater_plurality/accumulation;errori su errori;yes;nominal;errore;pl;_;_;E, al contrario, il mister argentino continua ad accumulare;errori su errori;, cambiando ogni settimana le carte in tavola, senza trovare, naturalmente, il rimedio.
1706;su;laggiù;greater_plurality/accumulation;errori su errori;yes;nominal;errore;pl;_;_;Certo che ho mancato, e cominci a correre su e giù per la tua vita matrimoniale, ecco, qui e poi lì, e anche là, anche addirittura laggiù,;errori su errori;, una catena infinita.
1707;su;fare;greater_plurality/accumulation;errori su errori;yes;nominal;errore;pl;_;_;La mattina stessa in cui è stato scoperto l'omicidio ha fatto;errori su errori;per compromettere l'inchiesta e alla fine ha lasciato a casa di Vaudel figlio quanto serve per farmi sbattere in galera al posto dell'assassino.
1708;su;accumulare;greater_plurality/accumulation;errori su errori;yes;nominal;errore;pl;_;_;Io, la donna, gli ho impedito di raccogliere alla «piccola della porta accanto» la borsetta (di noi due non ero «io» la più anziana?), io ho accumulato;errori su errori;, finché lo sguardo della piccola diventò prima incredulo, e poi gelido.
1709;su;fare;greater_plurality/accumulation;esami su esami;yes;nominal;esame;pl;_;_;Inoltre, sono due anni che faccio;esami su esami;al colon e che dovrei farmi operare cominciando dall'intestino, adesso ho preso la decisione e devo comunicarla di persona ai Civili di Brescia: ci convivrò.
1712;su;citare;greater_plurality/accumulation;esempi su esempi;yes;nominal;esempio;pl;_;_;Ma si potrebbe continuare a citare;esempi su esempi;: il Medioevo è attraversato da queste ventate di rivolta in cui un gruppo si identifica con l'unica Chiesa legittima, legittimandosi col proprio rigorismo (che, curiosamente, spesso sfocia nella licenza, come se la coscienza della propria perfezione spirituale consentisse una maggior spregiudicatezza nel trattare le miserie della carne).
1714;su;in;greater_plurality/accumulation;estati su estati;yes;nominal;estate;pl;_;_;E le travi non arrugginiscono in pochi giorni, ma in inverni e inverni di gelo e silenzio e in;estati su estati;di assalti dell'erba.
1716;su;risparmiare;greater_plurality/accumulation;euro su euro;yes;nominal;euro;sg/pl;_;_;Sposando Luigi, avrebbe lavorato per tutta la vita negli uffici della Coop, risparmiando;euro su euro;per arrivare alla fine del mese.
1717;su;ambrosiano;greater_plurality/accumulation;fabbriche su fabbriche;yes;nominal;fabbrica;pl;_;_;Qui aveva qualche amico in Scaldasole e al circolo del Ponte della Ghisolfa, piazzale Lugano, il grigio più grigio della periferia ambrosiana,;fabbriche su fabbriche;, l'inizio della sopraelevata, il cavalcavia delle Varesine.
1721;su;indire;greater_plurality/accumulation;feste su feste;yes;nominal;festa;pl;_;_;Per questa ragione, cioè per aumentare il numero delle iscrizioni, gli scissionisti del Pd hanno deciso di indire;feste su feste;in tutta Italia durante l'estate.
1722;su;distinguere;greater_plurality/accumulation;file su file;yes;nominal;file;pl;_;_;I lievi raggi di sole forniscono la sola illuminazione disponibile e, quando i miei occhi si adattano, distinguo;file su file;di feriti, nelle brande, sui pagliericci, sul pavimento, perché sono in tanti a contendersi lo spazio.
1723;su;incassare;greater_plurality/accumulation;file su file;yes;nominal;file;pl;_;_;Il salotto era ampio e le pareti, nelle quali erano incassate;file su file;"di scaffali laccati di nero, erano tappezzate di una stoffa damascata in cui il nero prevaleva sul rosso; divano e poltrone erano rivestiti dello stesso tessuto delle pareti e i tappeti armonizzavano con il resto dell'arredamento"
1724;su;vedere;greater_plurality/accumulation;file su file;yes;nominal;file;pl;_;_;E d'improvviso ci sembrò di vedere;file su file;di formiche del miele col corpo striato e luccicante, che nelle loro celle sotto le radici del mulga traboccavano di nettare.
1725;su;potenzialità;greater_plurality/accumulation;fili su fili;yes;nominal;fili;pl;_;_;"O meglio c'era una che un giorno ""avrebbe potuto"" essere lei: se da un lato obbediva alla vocazione, se svolgeva le potenzialità,";fili su fili;.
1726;su;riempire;greater_plurality/accumulation;fogli su fogli;yes;nominal;foglio;pl;_;_;Dopo una giornata trascorsa in giro con me, riempie;fogli su fogli;.
1728;su;strappare;greater_plurality/accumulation;fogli su fogli;yes;nominal;foglio;pl;_;_;Un rumore molto forte, comese qualcuno fosse stato impegnato a strappare;fogli su fogli;di lamiera dal centro della macchina.
1729;su;togliere;greater_plurality/accumulation;fogli su fogli;yes;nominal;foglio;pl;_;_;Non facevo altro che togliere;fogli su fogli;di giornali sporchi di merda dalla sua gabbia.
1730;su;compilare;greater_plurality/accumulation;fogli su fogli;yes;nominal;foglio;pl;_;_;Abbiamo passato un pomeriggio intero, io e Fabio, in quel negozio in centro, con la commessa appresso che compilava;fogli su fogli;.
1731;su;soffitto;greater_plurality/accumulation;fogli su fogli;yes;nominal;foglio;pl;_;_;Pendeva al centro un complicato lampadario, come un cumulo di deposito burocratico al contrario, con la cima della catasta in basso e la base dell'ammasso che largheggiava sul soffitto:;fogli su fogli;"scaricati a caso e poi tessere, foto inutili, anche penne, matite, quasi una macchina da scrivere, e il piano della scrivania sbilenca e rivoltata, con le gambe divaricate larghe come di somaro sul ghiaccio e puntate verso il cielo scivoloso del soffitto; queste le forme, solo le forme perché il mucchio era tutto di vetro nei suoi componenti, nei suoi detriti da baraonda; pure lo scheletro e il corpo portante lo era oppure non si vedeva di cosa fosse."
1738;su;scattare;greater_plurality/accumulation;foto su foto;yes;nominal;foto;sg/pl;_;_;Prende la polaroid e scatta;foto su foto;.
1739;su;scattare;greater_plurality/accumulation;foto su foto;yes;nominal;foto;sg/pl;_;_;La segue con l'inseparabile Kodak in mano, come un giapponese che scatta;foto su foto;.
1740;su;brandello;succession/iteration/distributivity;frase su frase;yes;modifier;frase;sg;_;_;Il racconto che brandello su brandello,;frase su frase;, strappavo ai miei ricordi, come un cancro luminoso divorava la mia vita.
1742;su;inanellare;greater_plurality/accumulation;gaffes su gaffes;yes;nominal;gaffes;pl;_;_;Inoltre Greg, autentico Fantozzi, ne combina di tutti i colori, inanella;gaffes su gaffes;.
1744;su;battezzare;greater_plurality/accumulation;generazioni su generazioni;yes;nominal;generazione;pl;_;_;Nei paesi in passato il parroco rimaneva nello stesso posto anche quaranta - cinquanta anni e battezzava;generazioni su generazioni;, oggi in una realtà in continuo cambiamento, questo fatto non è accettabile, pur riconoscendo che occorre un certo numero di anni per realizzare un progetto o per stabilire un rapporto profondo.
1745;su;avere;greater_plurality/accumulation;generazioni su generazioni;yes;nominal;generazione;pl;_;_;Quantoa me, i giovani li conosco bene: a scuola ne ho avuto;generazioni su generazioni;, in casa ho avuto i miei figli.
1746;su;influenzare;greater_plurality/accumulation;generazioni su generazioni;yes;nominal;generazione;pl;_;_;La passione dichiarata è una sola: disseppellire e filtrare leggende di isole mai esistite o trasfigurate o disperse che tuttavia avevano influenzato;generazioni su generazioni;di navigatori portoghesi spagnoli inglesi, e popolato le loro mappe.
1749;su;via;greater_plurality/accumulation;giorni su giorni;yes;nominal;giorno;pl;_;_;Così se n'erano andati via;giorni su giorni;.
1750;su;dimostrare;succession/iteration/distributivity;giorno su giorno;yes;modifier;giorno;sg;_;_;Ne praticavano una da dimostrare;giorno su giorno;, tra gli agguati subiti e quelli resi.
1753;su;inanellare;greater_plurality/accumulation;giri su giri;yes;nominal;giro;pl;_;_;In lontananza la ruota panoramica inanellava;giri su giri;all'infinito proiettando le sue luci colorate sulle acque scure del porto.
1754;su;'';succession/iteration/distributivity;Giro su giro;yes;modifier;giro;sg;_;_;;Giro su giro;l ' uomo ha inanellato tre passaggi consecutivi davanti_al consolato russo attirando l'attenzione dei poliziotti
1755;su;km;greater_plurality/accumulation;giunzioni su giunzioni;yes;nominal;giunzione;pl;_;_;Novità più significative, figlie di questo nuovo modo di intendere la speleologia, sono le esplorazioni all'OPIII, alla Feruglio, nel Complesso del Foran del Muss (che macinando km su km;giunzioni su giunzioni;, sta insidiando l'adiacente Complesso del Col delle Erbe, da oltre 25 anni al primo posto nella classifica delle grotte più estese), e il Led Zeppelin, che è divenuta la più profonda cavità della regione.
1757;su;edilizio;succession/iteration/distributivity;granellino su granellino;yes;modifier;granellino;sg;_;_;E non meno sorprendente è la tecnica costruttiva della formica - bussola australiana (Amitermes meridionalis) i cui operai ciechi sanno deporre il materiale edilizio,;granellino su granellino;, in modo tale che il risultato sia un nido cuneiforme con l'asse maggiore orientato rigorosamente in direzione Nord - Sud.
1758;su;accavallare;greater_plurality/accumulation;imprecazioni su imprecazioni;yes;nominal;imprecazione;pl;_;_;"È un segno di gratitudine che solo le bestie sanno esprimere - Bestemmia Berlino invece, come si dice ""omen nomen"" riprende il filo del discorso accavallando";imprecazioni su imprecazioni;e riducendo le solite conosciute bestemmie a vili scioglilingua che non sanno di niente.
1759;su;tempo;greater_plurality/accumulation;incarichi su incarichi;yes;nominal;incarico;pl;_;_;Così finii, ancora una volta, ad accumulare in breve tempo;incarichi su incarichi;, fino ad arrivare a dirigere l'intera divisione.
1760;su;affastellare;greater_plurality/accumulation;indizi su indizi;yes;nominal;indizio;pl;_;_;Gli inquirenti romani stanno affastellando;indizi su indizi;, controlli, visure camerali, che confermerebbero l'ascesa delle 'ndrine in questo angolo esclusivo di Roma Nord.
1761;su;addosso;greater_plurality/accumulation;informazioni su informazioni;yes;nominal;informazione;pl;_;_;Di converso, e questo è il secondo aspetto, ciò significa che ti si rovesciano addosso;informazioni su informazioni;, sempre di più, col rischio che, superando certi livelli, tutto si confonde e perde di valore.
1763;su;di;greater_plurality/accumulation;interessi su interessi;yes;nominal;interesse;pl;_;_;Deve escludersi l'obbligo di corresponsione di;interessi su interessi;(cosiddetto anatocismo ex articolo 1283 del codice civile) a fronte della ritardata esecuzione di un rimborso Iva da parte dell'amministrazione finanziaria.
1768;su;strologare;greater_plurality/accumulation;invenzioni su invenzioni;yes;nominal;invenzione;pl;_;_;Non riuscendo a distillare più un solo rimasuglio di verso dalla testa burchiellata dall'intossicazione alcolica perenne, si fece erudito, strologando;invenzioni su invenzioni;di autori che conosceva solo per sentito dire, e soprattutto saccheggiando il Baretti, lui sì iniziatore della storia letteraria italiana, e come tale ignoto ai più.
1769;su;continuamente;greater_plurality/accumulation;ipotesi su ipotesi;yes;nominal;ipotesi;pl;_;_;Meno male che la scienza non pensa, ma fa continuamente;ipotesi su ipotesi;, che poi va a verificare diligentemente!
1770;su;macinare;greater_plurality/accumulation;km su km;yes;nominal;km;sg;_;_;Novità più significative, figlie di questo nuovo modo di intendere la speleologia, sono le esplorazioni all'OPIII, alla Feruglio, nel Complesso del Foran del Muss (che macinando;km su km;e giunzioni su giunzioni, sta insidiando l'adiacente Complesso del Col delle Erbe, da oltre 25 anni al primo posto nella classifica delle grotte più estese), e il Led Zeppelin, che è divenuta la più profonda cavità della regione.
1771;su;strato;succession/iteration/distributivity;layer su layer;yes;modifier;layer;sg;_;_;Detriti, come li chiama Napier, che sono visibili per strati,;layer su layer;, quasi si trattasse dei livelli che gli archeologi usano durante le operazioni di scavo.
1772;su;affastellare;greater_plurality/accumulation;leggi su leggi;yes;nominal;legge;pl;_;_;"Ecco perché nel Parlamento italiano non c'è mai stato nè mai ci sarà un deputato o un senatore che si alzi a dire: ""Onorevoli colleghi, smettiamola di affastellare";leggi su leggi;: in attività di servizio ce ne sono oltre duecentocinquantamila, il che ci rende lo zimbello del mondo.
1773;su;vuoto;greater_plurality/accumulation;leghe su leghe;yes;nominal;lega;pl;_;_;Guardia Grigia e Segno di Ghiaccio anche, non ho dubbi, e abbiamo altri quattordici fortilizi ancora vuoti,;leghe su leghe;di Barriera ancora non sorvegliate e indifese.
