ID;NPN;construction;preposition;noun;context_pre;costr;context_post;number_of_noun;meaning;syntactic_function;pre_lemma
1519;ACCUSE SU ACCUSE;yes;su;accusa;ANZICHE DISTRUGGERLA CON POLEMICHE SU POLEMICHE ... ;ACCUSE SU ACCUSE;…;pl;greater_plurality/accumulation;nominal;polemica
1520;aborti su aborti;yes;su;aborto;Ma il destino doveva volergliene personalmente per qualche imperdonabile colpa: Salma, sua moglie, subì;aborti su aborti;e morì mettendo al mondo Mouna dopo dieci mesi di penosa gravidanza.;pl;greater_plurality/accumulation;nominal;subire
1521;acciaio su acciaio;yes;su;acciaio;Esattamente come la vecchia Unione sovietica che macinava;acciaio su acciaio;e, per certi versi, anche la Cina attuale.;sg/pl;greater_plurality/accumulation;nominal;macinare
1522;accusa su accusa;yes;su;accusa;Per fortuna, conosceva la lingua così bene che capì ogni cosa, e si potette difendere, parola su parola ,;accusa su accusa;, prova su prova, senza perdersi d'animo.;sg;succession/iteration/distributivity;modifier;parola
1525;aggettivo su aggettivo;yes;su;aggettivo;"Tutto ""montato"" rase su frase,";aggettivo su aggettivo;, fino al crollo repentino della spaventevole magione.;sg;succession/iteration/distributivity;modifier;frase
1528;aria su aria;yes;su;aria;Il ventilatore non vale niente, muove;aria su aria;, sempre la stessa.;sg;greater_plurality/accumulation;nominal;muovere
1530;assalti su assalti;yes;su;assalto;E impugnava lo stendardo rosso con la stella argeade a sedici punte , lanciava  assalti su assalti , ma gli squadroni dei cavalieri arabi e assiri contrattaccavano ogni volta con;assalti su assalti;, ma gli squadroni dei cavalieri arabi e assiri contrattaccavano ogni volta con caparbio valore, sostenuti dai continui, fitti lanci di frecce degli arcieri medi e armeni.;pl;greater_plurality/accumulation;nominal;con
1531;assalti su assalti;yes;su;assalto;Sull'ala destra, la cavalleria di Besso si era infranta contro la massa della fanteria pesante greca, ma continuava a lanciare;assalti su assalti;, a ondate, come marosi che frangevano contro le rocce.;pl;greater_plurality/accumulation;nominal;lanciare
1534;avversari su avversari;yes;su;avversario;Marcella Bazzoni da poche ore si è dimessa da tecnico dell'Itm Jchnusa, la formazione di pallamano che nella prima parte di campionato ha macinato;avversari su avversari;nella A2 maschile, per poi crollare inanellando quattro sconfitte di seguito.;pl;greater_plurality/accumulation;nominal;macinare
1535;avversari su avversari;yes;su;avversario;Da questo momento in poi, Beckham continuerà almeno per un'ora a divorare metri su metri,;avversari su avversari;, con una facilità che fa male al cuore.;pl;greater_plurality/accumulation;nominal;metro
1536;bagni su bagni;yes;su;bagno;Ormai collaudato l'adattamento di Vucinic, attaccante di valore che continua a fare;bagni su bagni;d'umiltà.;pl;greater_plurality/accumulation;nominal;fare
1538;balle su balle;yes;su;balla;Il meccanismo adottato in Francia per convincere i cittadini della ineluttabilità del nucleare è lo stesso adottato di recente in Italia:;balle su balle;raccontate da venduti e soldi su soldi per la pubblicità e per foraggiare i giornali.;pl;greater_plurality/accumulation;nominal;Italia
1540;balle su balle;yes;su;balla;Capitan Findus Letta ha raccontato;balle su balle;sul taglio dei rimborsi elettorali che si è puntualmente intascato a luglio insieme agli altri partiti: una rata di 91 milioni.;pl;greater_plurality/accumulation;nominal;raccontare
1541;barzellette su barzellette;yes;su;barzelletta;Ormai, Ennio come un fucile, Athos come una mitraglia, sfornano;barzellette su barzellette;", come si suol dire, prendono il pallino in mano; fra un bicchiere e l'altro, una risata e l'altra, cadono le ultime barriere; ci sentiamo ormai comese fossimo davvero cresciuti tutti insieme; nasce in questa occasione oltrealla sintonia del branco, anche l'intercalare ufficiale della vacanza ""olè... se dobla""!";pl;greater_plurality/accumulation;nominal;sfornare
1542;battute su battute;yes;su;battuta;Risultato: si ride troppo, si fanno;battute su battute;, c'è un chiasso assordante.;pl;greater_plurality/accumulation;nominal;fare
1543;bellezza su bellezza;yes;su;bellezza;Allora, per un po', scherzo con la bellezza, ammucchiando;bellezza su bellezza;, facendone qualcosa di schiacciante, quasi di indecente, come uno stupro.;sg;greater_plurality/accumulation;nominal;ammucchiare
1544;beni su beni;yes;su;bene;"A loro dice che non devono preoccuparsi di quello che ""avrebbero mangiato o bevuto""; men che meno di ""accumulare";beni su beni;""".";pl;greater_plurality/accumulation;nominal;bere
1545;bersaglio su bersaglio;yes;su;bersaglio;Per oltre due ore, Ramses aveva tirato con l'arco, colpendo;bersaglio su bersaglio;.;sg;greater_plurality/accumulation;nominal;colpire
1547;bicchiere su bicchiere;yes;su;bicchiere;Poco sveglio da giovane, invecchiando aveva peggiorato e al calare del sole il vino che s'era bevuto durante il giorno, sommandosi;bicchiere su bicchiere;, lo riduceva ad appisolarsi accantoal fuoco d'inverno o sotto l'albero del cortile al tempo della buona stagione.;sg;succession/iteration/distributivity;modifier;sommare
1548;bisogni su bisogni;yes;su;bisogno;Nei campi è uno spumeggiare di queste sanguisughe parlanti in frenetica attività succhiatoria e anche psicotropica, assorbono;bisogni su bisogni;, emettono pezzi di promessa, certezza, appuntamenti, visioni.;pl;greater_plurality/accumulation;nominal;assorbire
1549;borotalco su borotalco;yes;su;borotalco;Il suo amore per i libri era nato là, a mettere;borotalco su borotalco;sui libri della biblioteca della scuola, borotalco melmoso e poi ancora borotalco melmoso alla pagina dopo - se eri riuscito a scollarla - tra risate e chiacchiere frenetiche, programmando impraticabili scherzi.;sg;greater_plurality/accumulation;nominal;mettere
1551;bozzi su bozzi;yes;su;bozzo;"""Da queste parti la chiamano";bozzi su bozzi;""", ridimensionò subito la faccenda.";pl;greater_plurality/accumulation;nominal;chiamare
1553;brani su brani;yes;su;brano;"John Lennon diceva che Beethoven ""era una truffa proprio come noi, produceva";brani su brani;""", Ringo invece ""ne ammirava soprattutto le poesie"".";pl;greater_plurality/accumulation;nominal;produrre
1555;cambiali su cambiali;yes;su;cambiale;Mario viveva lì da tanto tempo, aveva comprato quell'appartamento firmando;cambiali su cambiali;per anni, perchè doveva essere così, il matrimonio si sa impone questo tipo di sacrifici.;pl;greater_plurality/accumulation;nominal;firmare
1556;campi su campi;yes;su;campo;"Questi campi non vivono nello spaziotempo; vivono, per così dire, uno sull'altro:";campi su campi;.;pl;greater_plurality/accumulation;nominal;spaziotempo
1557;canzone su canzone;yes;su;canzone;Il Libro del Mondo è, in fondo, il lungo racconto che con incredibile coerenza ha costruito;canzone su canzone;"quel grande ""moralista camuffato da immmoralista"" (Cesare G. Romana ) che era Fabrizio.";sg;succession/iteration/distributivity;modifier;costruire
1559;caraffe su caraffe;yes;su;caraffa;Harry trangugiava un bicchiere fresco dopo l'altro, ordinando;caraffe su caraffe;, convinto che sapessero tutte di alcol da massaggi.;pl;greater_plurality/accumulation;nominal;ordinare
1562;case su case;yes;su;casa;A destra c'è il mare, a sinistra;case su case;, fino a pochi secondi prima di toccare.;pl;greater_plurality/accumulation;nominal;sinistra
1563;casi su casi;yes;su;caso;I laboratori forensi dell'Oklahoma, come di molti altri Stati, soffrivano di una cronica mancanza di fondi e di personale, a fronte di enormi pressioni perché risolvessero;casi su casi;.;pl;greater_plurality/accumulation;nominal;risolvere
1567;cazzate su cazzate;yes;su;cazzata;Mi aspetto che si metta a ridere come un pazzo e che poi ricominci a frullare;cazzate su cazzate;.;pl;greater_plurality/accumulation;nominal;frullare
1568;cene su cene;yes;su;cena;E fu senz'altro la disperazione che li portò a organizzare;cene su cene;con vino in abbondanza e conseguente e inevitabile sbronza collettiva.;pl;greater_plurality/accumulation;nominal;organizzare
1569;centesimo su centesimo;yes;su;centesimo;Aveva anche chiesto soldi in prestito ai suoi amanti, senza pudore, e li aveva, ogni volta, restituiti,;centesimo su centesimo;.;sg;succession/iteration/distributivity;modifier;restituire
1572;certificati su certificati;yes;su;certificato;Il secondo problema è quello del rispetto delle norme: per gestire correttamente una discoteca sarebbero necessari permessi su permessi,;certificati su certificati;.;pl;greater_plurality/accumulation;nominal;permesso
1573;chiacchiere su chiacchiere;yes;su;chiacchiera;«Ecco le due che spettegolano al buio!» esclamò la signorina Lydia , «;chiacchiere su chiacchiere;, nell 'oscurità.»;pl;greater_plurality/accumulation;nominal;Lydia
1576;chilometri su chilometri;yes;su;chilometro;E in fin dei conti due gomme sono come un paio di scarpe da corsa, macinano;chilometri su chilometri;, talvolta senza una meta precisa.;pl;greater_plurality/accumulation;nominal;macinare
1577;chilometri su chilometri;yes;su;chilometro;Le pianure spoglie di Marte,;chilometri su chilometri;di rovine deserte, si stendevano nel buio.;pl;greater_plurality/accumulation;nominal;Marte
1580;cifre su cifre;yes;su;cifra;Non so come fai a sopportare;cifre su cifre;tutti i giorni.;pl;greater_plurality/accumulation;nominal;sopportare
1582;circonferenze su circonferenze;yes;su;circonferenza;Restò così, trafitto da raggi e bisettrici, mentre le lumache disegnavano;circonferenze su circonferenze;intorno a lui.;pl;greater_plurality/accumulation;nominal;disegnare
1583;citazioni su citazioni;yes;su;citazioni;Mi chiese se continuava a fare;citazioni su citazioni;per legittimare le sue teorie.;pl;greater_plurality/accumulation;nominal;fare
1606;colpo su colpo;yes;su;colpo;"Lavorò tutta la mattina, scavando la pietra con il suo scalpello;";colpo su colpo;, poi stanco, si distese sulle stoppie, vicinoal suo cane accovacciato, che nel sonno bizzarro inseguiva chissà quale preda, emettendo guaiti di cucciolo.;sg;succession/iteration/distributivity;modifier;scalpello
1590;colpo su colpo;yes;su;colpo;Il Lecce metteva subito sotto pressione il Toro che non si lasciava intimidire e ribatteva;colpo su colpo;.;sg;succession/iteration/distributivity;modifier;ribattere
1628;colpo su colpo;yes;su;colpo;Maranghi, con l'arroganza che molti gli rimproverano, ha risposto;colpo su colpo;, rinfacciando alla fine quella che, secondo lui, è stata la più grave colpa del giovane direttore centrale: l'aver a suo tempo escluso che la Consob avrebbe obbligato Mediobanca a fare un'opa sull'ex gruppo Ferruzzi, come invece avvenne, costringendo l'istituto a un esborso di oltre 200 miliardi.;sg;succession/iteration/distributivity;modifier;rispondere
1602;colpo su colpo;yes;su;colpo;Il sole d'inizio primavera era alto e già piuttosto caldo e i ragazzi ansimavano apparentemente stremati, ma continuavano a scontrarsi con crescente impeto stringendo i denti, rispondendo;colpo su colpo;e urtandosi con gli scudi con tutta la forza residua delle membra.;sg;succession/iteration/distributivity;modifier;rispondere
1627;colpo su colpo;yes;su;colpo;"Ma ora che il presidente Hugo Chavez ha chiesto ai suoi di rispondere """;colpo su colpo;"alle provocazioni dei senzapatria"", quella delle pentole è diventata una piccola guerra che si estende per tutta la capitale venezuelana.";sg;succession/iteration/distributivity;modifier;rispondere
1645;colpo su colpo;yes;su;colpo;Se la reazione - peraltro incerta - dell'azionariato Ina fosse un rilancio sulla stessa Ina, poco male: ci si confronterebbe;colpo su colpo;di fronte al mercato.;sg;succession/iteration/distributivity;modifier;confrontare
1636;colpo su colpo;yes;su;colpo;L'intesa con Carnival fornisce inoltre a Fincantieri l'opportunità per ribattere davvero;colpo su colpo;la concorrenza dell'altro grande cantiere specializzato in navi passeggeri, il finlandese Masa Yard che recentemente si è aggiudicato un megacontratto della Royal Caribbean cruise line (Rccl) per la costruzione di due unità da 130mila tonnellate destinate a strappare proprio alle Carnival della serie Destiny il primato delle più grandi navi passeggeri del mondo.;sg;succession/iteration/distributivity;modifier;davvero
1587;colpo su colpo;yes;su;colpo;"Non rivolgerti con tono sferzante ad alcuno coloro ai quali ti rivolgerai in questo modo ti potrebbero rispondere nello stesso modo: le ingiurie sono dolorose;";colpo su colpo;, esse ricadranno sopra di te.;sg;succession/iteration/distributivity;modifier;doloroso
1639;colpo su colpo;yes;su;colpo;Ma Micheli si infervora, nega, ribatte;colpo su colpo;.;sg;succession/iteration/distributivity;modifier;ribattere
1594;colpo su colpo;yes;su;colpo;Diviso tra la sua anima pragmatica legata a Yassin e quella oltranzista del pediatra Rantisi, il gruppo, con profondi contatti col cosiddetto fronte delle carceri, replica alle ritorsioni israeliane;colpo su colpo;senza disdegnare quando necessario la ritirata strategica, la tregua, in vista di una razionalizzazione delle proprie forze.;sg;succession/iteration/distributivity;modifier;israeliano
1612;colpo su colpo;yes;su;colpo;Carafa no, preferiva abbandonare i protestanti al loro destino piuttosto che concedere anche una piccola incrinatura dell'autorità assoluta della Chiesa: occorreva ribattere ai luterani;colpo su colpo;, fare pulizia al proprio interno e dotarsi di apparati nuovi che raccogliessero la sfida.;sg;succession/iteration/distributivity;modifier;luterano
1618;colpo su colpo;yes;su;colpo;Sentiva quella sconfitta comese l'avesse subita personalmente, e la formidabile capacità di Memnone di restituire;colpo su colpo;e con forza spaventosa lo umiliava duramente e gli faceva provare per la prima volta in vita sua un frustrante senso d'impotenza e di profonda solitudine.;sg;greater_plurality/accumulation;nominal;restituire
1637;colpo su colpo;yes;su;colpo;Ma Giuseppe Stefanel, Bepi per gli amici, 44 anni, presidente e amministratore del gruppo di Ponte di Piave, non ci sta a passare per vittima sacrificale: rintuzza;colpo su colpo;gli attacchi, e annuncia che il secondo semestre '96 si chiuderà con un piccolo utile, dopo che al giro di boa dei primi sei mesi dell'anno il passivo segnava 19 miliardi.;sg;succession/iteration/distributivity;modifier;rintuzzare
1630;colpo su colpo;yes;su;colpo;Ma in questo campo gli americani sono in grado di ribattere;colpo su colpo;: Chevrolet risponde con una cult car, la Corvette.;sg;succession/iteration/distributivity;modifier;ribattere
1619;colpo su colpo;yes;su;colpo;Più adulto e più esperto di lui, era sempre riuscito a tenergli testa, a rispondere;colpo su colpo;o addirittura a prevenire le sue mosse.;sg;succession/iteration/distributivity;modifier;rispondere
1596;colpo su colpo;yes;su;colpo;Il nostro compito è restare vigili e rispondere;colpo su colpo;.;sg;succession/iteration/distributivity;modifier;rispondere
1642;colpo su colpo;yes;su;colpo;Entrambe le compagini si sono affrontate a viso aperto rispondendo;colpo su colpo;a qualasisi iniziativa opposta, esibendo in certi frangenti anche giocate di buona tecnica.;sg;succession/iteration/distributivity;modifier;rispondere
1588;colpo su colpo;yes;su;colpo;All'Arechi gli uomini di Beretta hanno dovuto fare i conti con una Salernitana mai doma, pronta a ribattere;colpo su colpo;agli affondi dei più blasonati avversari.;sg;succession/iteration/distributivity;modifier;ribattere
1593;colpo su colpo;yes;su;colpo;"Tutto improvvisamente, intorno a quel ripiano, era tornato coerente con il tradizionale menage familiare della famiglia Masina; Manlio col suo slang condito di parolacce, Giorgio col suo rispondere";colpo su colpo;a tutte le provocazioni esterne, Cinzia con la sua puntuale abilità di organizzatrice familiare, Valentina con la sua svogliata partecipazione alla conduzione domestica e Noel con la sua serena e coccolata presenza, tanto cara a tutti.;sg;succession/iteration/distributivity;modifier;Masina
1629;colpo su colpo;yes;su;colpo;Dopo aver speso una intera vita a fondarla e a cercare di farla funzionare, alla fine è stato lui stesso,;colpo su colpo;, a estinguerla.;sg;succession/iteration/distributivity;modifier;stesso
1607;colpo su colpo;yes;su;colpo;Da dove trar fuori l'energia pietosa per combattere quel dolore, per rispondergli;colpo su colpo;, per non lasciarlo dilagare nel mondo con la sua forza annientatrice?;sg;succession/iteration/distributivity;modifier;rispondere
1640;colpo su colpo;yes;su;colpo;I locali hanno comunque retto la botta almeno per i 40 minuti iniziali, controbattendo;colpo su colpo;, anzi pressando in tutte le parti del campo.;sg;succession/iteration/distributivity;modifier;controbattere
1620;colpo su colpo;yes;su;colpo;Solo gli Immortali restarono sul posto, si chiusero a quadrato e continuarono a respingere gli assalti nemici rispondendo;colpo su colpo;.;sg;succession/iteration/distributivity;modifier;rispondere
1595;colpo su colpo;yes;su;colpo;Che non consiste nel ribattere;colpo su colpo;alle battute dell'antipolitica nei salotti televisivi, ma nel rispondere alle domande della società.;sg;succession/iteration/distributivity;modifier;ribattere
1614;colpo su colpo;yes;su;colpo;La strada, però, con una durezza che si ripercoteva fino all'inguine, mi restituiva;colpo su colpo;.;sg;greater_plurality/accumulation;nominal;restituire
1613;colpo su colpo;yes;su;colpo;Aspetto solo una parola per reagire;colpo su colpo;al primo segnale.;sg;succession/iteration/distributivity;modifier;reagire
1600;colpo su colpo;yes;su;colpo;Jack Hyde mi fa domande spiazzanti e intelligenti, ma io non mi faccio cogliere impreparata: rispondo;colpo su colpo;e, quando discutiamo delle mie letture preferite, credo di cavarmela bene.;sg;succession/iteration/distributivity;modifier;rispondere
1601;colpo su colpo;yes;su;colpo;Ma Rambo non ci sta, Rambo combatte, lui resta in forma e risponde all'attacco;colpo su colpo;, prendendo la natura a calci nel culo e spaccando il muso alla società.;sg;succession/iteration/distributivity;modifier;attacco
1641;colpo su colpo;yes;su;colpo;Proprio la dote che l'aveva sorretta durante il primo tempo, consentendole di reggere il ritmo - non forsennato - degli avversari ai quali aveva restituito;colpo su colpo;.;sg;greater_plurality/accumulation;nominal;restituire
1634;colpo su colpo;yes;su;colpo;Katoh ha immediatamente risposto, ma Melandri ha reagito;colpo su colpo;.;sg;succession/iteration/distributivity;modifier;reagire
1654;comunicazioni su comunicazioni;yes;su;comunicazione;La capacità di significare tramite icone implica anche che tutti i processi di comunicazione siano di secondo livello, ovvero;comunicazioni su comunicazioni;, spesso lontane dalla vita quotidiana.;pl;greater_plurality/accumulation;nominal;ovvero
1655;conti su conti;yes;su;conto;"Mentre riaccompagnava Eco in auto in centro, Pete disse: ""Continuo a fare";conti su conti;", sai, mi sembra di essere un cane che si morde la coda"".";pl;greater_plurality/accumulation;nominal;fare
1657;controlli su controlli;yes;su;controllo;Strade bloccate, frontiere minate, posti di blocco volanti,;controlli su controlli;, ormai il Kosovo è solo questo.;pl;greater_plurality/accumulation;nominal;volante
1659;copie su copie;yes;su;copia;Nel suo ufficio sono accatastate;copie su copie;della Fattoria degli animali di Orwell: il contributo del governo britannico all'insegnamento dell'inglese nelle scuole afghane e una lezione elementare sui danni del marxismo, messa in bocca a un maiale.;pl;greater_plurality/accumulation;nominal;accatastare
1661;coppe su coppe;yes;su;coppa;Orinare stando in piedi era punito in un modo particolarmente arduo, e le donne che durante le mestruazioni si avvicinavano all'acqua o al fuoco venivano costrette a mangiare;coppe su coppe;di piscio e merda maschili.;pl;greater_plurality/accumulation;nominal;mangiare
1662;corna su corna;yes;su;corna;Invece toccò al capo, ad Agamennone, uomo borioso e fatuo, a cui Clitennestra da tempo metteva;corna su corna;perché ormai impotente.;pl;greater_plurality/accumulation;nominal;mettere
1663;corpi su corpi;yes;su;corpo;Invano risuonò l'ululato, straziante, di tutti i superstiti: i proiettili seguitarono a trafiggere;corpi su corpi;, trasformandoli in un batter d'occhio in bambolotti di pezza privi di vita.;pl;greater_plurality/accumulation;nominal;trafiggere
1664;corsi su corsi;yes;su;corso;Ultimamente, siccome si dice che questi ragazzi e queste ragazze non imparano niente, allora si fanno;corsi su corsi;per vedere come avvicinarsi, quindi per curare la relazione, però sempre in un modo strumentale, come mezzo per arrivare al RAZIONALE.;pl;greater_plurality/accumulation;nominal;fare
1668;creme su creme;yes;su;crema;Altro errore frequentissimo: applicare creme su;creme su creme;sulla cute del viso irritata, arrossata, sensibilizzata.;pl;greater_plurality/accumulation;nominal;su
1669;crosta su crosta;yes;su;crosta;Dall'alto del Forte capisco il rinnovo degli strati successivi,;crosta su crosta;.;sg;succession/iteration/distributivity;modifier;successivo
1671;curve su curve;yes;su;curva;All'altezza della rocca di Posada si penetra nell'interno proseguendo sulla statale 389:;curve su curve;dove è possibile non incrociare altre macchine.;pl;greater_plurality/accumulation;nominal;389
1672;danni su danni;yes;su;danno;La condizione, naturalmente, è voler discutere davvero del merito dei problemi: mettendo da parte una logica di contrapposizione politica esasperata che, a urne chiuse, non può che produrre;danni su danni;.;pl;greater_plurality/accumulation;nominal;produrre
1673;dati su dati;yes;su;dato;È il caso della finanza, che dopo la mondializzazione dei mercati borsistici ha visto scatenarsi;dati su dati;in quantità torrenziali e sta trovando nuova linfa proprio nelle nuove metodologie di rappresentazione.;pl;greater_plurality/accumulation;nominal;scatenare
1676;decine su decine;yes;su;decina;Poi tornava a navigare su internet e a vedere;decine su decine;di filmati.;pl;greater_plurality/accumulation;nominal;vedere
1678;denunce su denunce;yes;su;denuncia;Così come gli ingegneri e i geometri che lavorano per noi: anche tra loro, più d'uno ha subito il mio stesso trattamento,;denunce su denunce;.;pl;greater_plurality/accumulation;nominal;trattamento
1681;dettagli su dettagli;yes;su;dettaglio;E intanto Jonathan continuava a snocciolare;dettagli su dettagli;, tanto che lo accusai di aver messo sotto controllo il telefono.;pl;greater_plurality/accumulation;nominal;snocciolare
1682;dettaglio su dettaglio;yes;su;dettaglio;Eppure gli ci erano voluti dei mesi per mettere insieme il quadro della sua vita,;dettaglio su dettaglio;, dalle primissime annotazioni dell'epoca delle elementari attraverso le relazioni degli assistenti sociali finoalle inchieste di polizia e ai verbali del tribunale.;sg;succession/iteration/distributivity;modifier;vita
1683;dettaglio su dettaglio;yes;su;dettaglio;Prima parlò dei suoi studi segreti, quelli da architetto, e mi raccontò in modo snervante,;dettaglio su dettaglio;, come si era svolto un esame difficile che aveva superato brillantemente.;sg;succession/iteration/distributivity;modifier;snervante
1685;dichiarazioni su dichiarazioni;yes;su;dichiarazione;Da dieci giorni stiamo dicendo in tutte le sedi che bisognava intervenire: si è perduto tempo a discutere, a prendere contatti diplomatici, a fare riunioni su riunioni,;dichiarazioni su dichiarazioni;, mentre la tragedia albanese richiedeva interventi rapidi, decisi, organici, massicci.;pl;greater_plurality/accumulation;nominal;riunione
1688;digiuno su digiuno;yes;su;digiuno;"In America, i nostri amici del ""Catholic Worker"" non hanno smesso, a partire dal crimine di Hiroshima, di far";digiuno su digiuno;, pubbliche proteste e pubblicazioni: la loro ultima impresa è stata di farsi mettere in prigione per aver tentato di superare lo sbarramento del servizio d'ordine durante gli esperimenti nel Nevada.;sg;greater_plurality/accumulation;nominal;fare
1689;discussioni su discussioni;yes;su;discussione;Anzi, diciamola tutta: ciascuno ha un'idea differente del suo significato, e va così a finire che iniziano;discussioni su discussioni;.;pl;greater_plurality/accumulation;nominal;iniziare
1690;docce su docce;yes;su;doccia;Cioè: quando passavo davanti al monitor si accendevano tutte le lampadine, e questo significa che dovevo fare;docce su docce;": per ""purificarmi"".";pl;greater_plurality/accumulation;nominal;fare
1692;dolori su dolori;yes;su;dolore;E dietro a quello, molti altri ricordi rossi, indicibili, segreti, sepolti da anni di uso di mondo, errori, matrimoni, figlie, partenze, musica, abbandoni, gioielli, amanti, dolori, e;dolori su dolori;su dolori per mimetizzare il padre di tutti i dolori.;pl;greater_plurality/accumulation;nominal;e
1693;dolori su dolori;yes;su;dolore;E dietro a quello, molti altri ricordi rossi, indicibili, segreti, sepolti da anni di uso di mondo, errori, matrimoni, figlie, partenze, musica, abbandoni, gioielli, amanti, dolori, e dolori su;dolori su dolori;per mimetizzare il padre di tutti i dolori.;pl;greater_plurality/accumulation;nominal;su
1694;domande su domande;yes;su;domanda;E sa anche che se presenta operazioni un po' bislacche, in consiglio può trovare anche chi comincerà a far;domande su domande;.;pl;greater_plurality/accumulation;nominal;fare
1695;domande su domande;yes;su;domanda;Interi pomeriggi a bere tè ascoltando il racconto della loro vita, e io lì a fare;domande su domande;ome Maria De Filippi.;pl;greater_plurality/accumulation;nominal;fare
1696;domande su domande;yes;su;domanda;Faye ha scoperto ancora un'altra Julie rispondere a;domande su domande;.;pl;greater_plurality/accumulation;nominal;a
