ID;NPN;construction;preposition;noun;context_pre;costr;context_post;number_of_noun;meaning;syntactic_function;pre_lemma
1845;offesa su offesa;yes;su;offesa;Ieri però, dopo giorni di accuse dell'opposizione sui soldi spesi dall'amministrazione per le celebrazioni garibaldine, un gruppo di manifestanti lo ha affrontato a viso aperto e Daverio, ribattendo;offesa su offesa;, in qualche caso ha preferito il rilancio, come quando ha definito «cicciona» una delle manifestanti più ingaggiate.;sg;succession/iteration/distributivity;modifier;ribattere
1848;onda su onda;yes;su;onda;Il segreto sta nel piegare i tovaglioli a regola d'arte,;onda su onda;, a cono, a busta di lettera, per far trovare un bigliettino intrigante.;sg;succession/iteration/distributivity;modifier;arte
1850;onda su onda;yes;su;onda;Restando in tema acquatico, si voga;onda su onda;, al concerto dei Litfiba.;sg;succession/iteration/distributivity;modifier;voga
1852;opere su opere;yes;su;opera;Gianfrancesco Malipiero studiava e stampava Vivaldi e Monteverdi, mentre di suo scriveva;opere su opere;, grandi e piccole, sole e cicliche, serie e comiche, tra Orfeo e Goldoni muovendosi con la consapevolezza dell'uomo di cultura.;pl;greater_plurality/accumulation;nominal;scrivere
1853;opinioni su opinioni;yes;su;opinione;Ma allora, per essere pienamente razionale, ognuno dovrebbe essere dotato di una rappresentazione del mondo che è costituita da una gerarchia infinita dio;opinioni su opinioni;.;pl;greater_plurality/accumulation;nominal;dio
1854;ore su ore;yes;su;ora;Sei mesi da quando Veronica l'aveva lasciata, e ogni giorno l'appartamento si faceva più vuoto, Giorgia più malinconica, ridotta a passare;ore su ore;davanti al computer.;pl;greater_plurality/accumulation;nominal;passare
1855;ore su ore;yes;su;ora;Gli uomini possono trascorrere a teatro;ore su ore;, e le loro esperienze comuni sono le più svariate.;pl;greater_plurality/accumulation;nominal;teatro
1856;orrori su orrori;yes;su;orrore;Ora, non capisco perché dovrei portare rispetto verso una istituzione che nel corso dei secoli ha accumulato;orrori su orrori;, dei quali si è scusata in grave ritardo e solo in parte.;pl;greater_plurality/accumulation;nominal;accumulare
1859;pacchi su pacchi;yes;su;pacco;Ci mettemmo una cosa come mezz'ora, facendo avanti e indietro tra la strada e la cucina –;pacchi su pacchi;su pacchi – e quando il tizio con il berretto, sfinito, risalì sul suo furgone e sparì, dalla cucina li portammo in taverna – pacchi su pacchi su pacchi.;pl;greater_plurality/accumulation;nominal;cucina
1860;pacchi su pacchi;yes;su;pacco;Ci mettemmo una cosa come mezz'ora, facendo avanti e indietro tra la strada e la cucina – pacchi su;pacchi su pacchi;– e quando il tizio con il berretto, sfinito, risalì sul suo furgone e sparì, dalla cucina li portammo in taverna – pacchi su pacchi su pacchi.;pl;greater_plurality/accumulation;nominal;su
1864;pagine su pagine;yes;su;pagina;Perché c'è chi riesce a fartelo drizzare, chi riesce a farti ridere, chi a farti passare la notte divorando;pagine su pagine;per capire chi era l'agente segreto che cagava rubini, chi riesce a farti venire appetito e a farti tornare a Bangkok quando invece sei a casa tua, ad ognuno la sua specialità.;pl;greater_plurality/accumulation;nominal;divorare
1867;pagine su pagine;yes;su;pagina;L'uomo aveva sempre a disposizione;pagine su pagine;bianche, lavate dal suo alito.;pl;greater_plurality/accumulation;nominal;disposizione
1869;palla su palla;yes;su;palla;Noi abbiamo solo l'obbligo di giocare per vincere, di batterci;palla su palla;coi campioni olimpici.;sg;succession/iteration/distributivity;modifier;battere
1870;palla su palla;yes;su;palla;Concludiamo salendo a Noriglio, dove nel girone H, bellissima e tiratissima gara fra Calabria e Puglia che se la giocano;palla su palla;fino al decisivo tie - break.;sg;succession/iteration/distributivity;modifier;giocare
1871;palloni su palloni;yes;su;pallone;Con la palla a terra è un pericolo per i suoi, con la capoccia, che ricorda uno spillo, respinge;palloni su palloni;.;pl;greater_plurality/accumulation;nominal;respingere
1872;palloni su palloni;yes;su;pallone;I biancorossi di Guidolin hanno impresso un ritmo vorticoso alla gara fin dai primi minuti, hanno recuperato;palloni su palloni;grazie al pressing a centrocampo e hanno minacciato Turci in continuazione, con un Otero scatenato su tutto il fronte d'attacco.;pl;greater_plurality/accumulation;nominal;recuperare
1873;palloni su palloni;yes;su;pallone;Col passare dei minuti migliorano Peruzzi e Simic, nel centrocampo della Roma Assuncao recupera;palloni su palloni;che appoggia ai compagni senza strafare, ad avviare il motore giallorosso ci pensa Totti, che copre mezzo campo.;pl;greater_plurality/accumulation;nominal;recuperare
1874;parlamentari su parlamentari;yes;su;parlamentare;Per mesi Gianni Letta e i lobbisti del Biscione avevano avvicinato;parlamentari su parlamentari;.;pl;greater_plurality/accumulation;nominal;avvicinare
1877;parola su parola;yes;su;parola;Per fortuna, conosceva la lingua così bene che capì ogni cosa, e si potette difendere,;parola su parola;, accusa su accusa, prova su prova, senza perdersi d'animo.;sg;succession/iteration/distributivity;modifier;difendere
1878;parola su parola;yes;su;parola;"E poi, ""Il cambio della guardia a Whitehall..."" che era romantico; e poi, costruendo";parola su parola;", lesse: ""I soldati della cavalleria le dissero che il cavallo aveva la coda verde; ma per lei era un cavallo qualsiasi"".";sg;succession/iteration/distributivity;modifier;romantico
1879;parola su parola;yes;su;parola;Galvanizzato dagli ascolti dell'ultima puntata di Moby Dick (3 milioni 823 mila spettatori), Santoro ha subito replicato: Confermo;parola su parola;quello che ho detto.;sg;greater_plurality/accumulation;nominal;confermare
1880;parole su parole;yes;su;parola;E i giochini, i disegnetti a bordo pagina che sono sicuro lei fa mentre aspetta che il cervello elabori e le detti;parole su parole;"; perché non stampa anche quei disegnetti scarabocchiati per ingannare la mano che vorrebbe scrivere qualcosa in maniera autonoma?";pl;greater_plurality/accumulation;nominal;dare
1881;parole su parole;yes;su;parola;Troppe volte si spendono giorni e anni e decadi a piallare;parole su parole;senza sosta e alla fine queste parole sono come zoccoli di legno imperfetti, così scomodi e innaturali da calzare che dopo un po' è meglio tornare alla gomma, più industriale e fredda, ma più pratica, malleabile e comoda.;pl;greater_plurality/accumulation;nominal;piallare
1885;Parole su parole;yes;su;parola;;Parole su parole;, in forma di versi, di articoli, di canzoni perché Evtuscenko sapeva che un vecchio proverbio russo era sacrosanta verità: «Ciò che è stato scritto con la penna non si può rimuovere con un'accetta».;pl;greater_plurality/accumulation;nominal;
1887;pasticci su pasticci;yes;su;pasticcio;È questo il campo dove le donne commettono;pasticci su pasticci;"; seguono i suggerimenti di tutti e non fanno l'unica cosa che è veramente utile: un esame culturale, per valutare l'agente responsabile dell'infezione e mettere in atto, poi, una terapia mirata, suggerita dallo specialista.";pl;greater_plurality/accumulation;nominal;commettere
1889;pedalata su pedalata;yes;su;pedalata;Non essendo lontana dalla città, raggiungevamo la Carletta in bicicletta, portando sul cannone le ragazze e principiando, con timide e apparentemente occasionali strisciate di ginocchio contro il loro sedere,;pedalata su pedalata;, il rito sessuale ridotto.;sg;succession/iteration/distributivity;modifier;sedere
1890;permessi su permessi;yes;su;permesso;Chi dieci anni fa, a casa sua, ha piantato un filare di platani troppo vicini, non li può diradare senza;permessi su permessi;.;pl;greater_plurality/accumulation;nominal;senza
1891;permessi su permessi;yes;su;permesso;Il secondo problema è quello del rispetto delle norme: per gestire correttamente una discoteca sarebbero necessari;permessi su permessi;, certificati su certificati.;pl;greater_plurality/accumulation;nominal;necessario
1893;pezzetto su pezzetto;yes;su;pezzetto;Le era sembrato di costruire ogni giorno;pezzetto su pezzetto;la propria vita e ciò che l'aveva inorgoglita di più era che ogni piccolo miglioramento derivasse dalla sua volontà e dalla assoluta mancanza di compromessi.;sg;succession/iteration/distributivity;modifier;giorno
1895;pezzo su pezzo;yes;su;pezzo;Ho visto i palazzi monumentali di Dresda ricostruiti;pezzo su pezzo;, dopo le distruzioni della Seconda guerra mondiale e ho visto i monumenti dell'Alto Egitto salvati e rimontati all'asciutto.;sg;succession/iteration/distributivity;modifier;ricostruire
1896;piani su piani;yes;su;piano;Da mesi gli stati maggiori stanno elaborando;piani su piani;, ipotizzando un vertice italiano che gestirà uno schieramento di forze europee.;pl;greater_plurality/accumulation;nominal;elaborare
1898;piano su piano;yes;su;piano;Vuotò il bicchiere, chiuse gli occhi assaporando la squisitezza, annuì, e si alzò, un livello dopo l'altro, splendido edificio,;piano su piano;.;sg;succession/iteration/distributivity;modifier;edificio
1899;pietra su pietra;yes;su;pietra;Caro e grande maestro mio, esempio di contento puro e tutto avuto dal bisogno col quale s'era sempre cercato;pietra su pietra;", e quasi per un non - potere di sé che è, come ebbe a scrivere, ""genuinità"", ""qualità di delicatezza"".";sg;succession/iteration/distributivity;modifier;cercare
1900;pietra su pietra;yes;su;pietra;Secondo Rauber, l'organismo vivente non è costruito come un edificio, aggiungendo;pietra su pietra;in modo ordinato.;sg;greater_plurality/accumulation;nominal;aggiungere
1903;pietra su pietra;yes;su;pietra;"È necessario fare chiarezza su tali aporie (si ricordi il senso della ‘spiegazione’ in Kant!) ; la filosofia non procede cumulativamente, ‘";pietra su pietra;, né può pensare di porre ordine nel linguaggio che effettivamente parliamo ricorrendo al ‘modello’ di ideografie, valide soltanto nell’ambito di procedure logico-matematiche.;sg;succession/iteration/distributivity;modifier;cumulativamente
1904;pietra su pietra;yes;su;pietra;Alta tecnologia che non può fare amenodell'uomo: un po 'come il Duomo di Milano: un'opera collettiva, firmata dal popolo che l'ha edificato;pietra su pietra;.;sg;succession/iteration/distributivity;modifier;edificare
1905;pietra su pietra;yes;su;pietra;I monaci hanno progettato e costruito;pietra su pietra;, cattedrali e monasteri.;sg;succession/iteration/distributivity;modifier;costruire
1907;pietra su pietra;yes;su;pietra;Le pietre scolpite sono l'omaggio alla storia millenaria, costruita;pietra su pietra;, secolo dopo secolo.;sg;succession/iteration/distributivity;modifier;costruire
1909;pile su pile;yes;su;pile;Io volavo alle casse, Pabs disimballava, registrava, smistava e scaricava sudi me;pile su pile;di CD a velocità supersonica.;pl;greater_plurality/accumulation;nominal;me
1910;piste su piste;yes;su;pista;Quassù, vale la pena ricordarlo, non ci sono però caroselli per il circo invernale, neppure;piste su piste;, seggiovie e skilift che si inseguono tagliando a fette boschi e spianando pendii.;pl;greater_plurality/accumulation;nominal;neppure
1913;porte su porte;yes;su;porta;Non trattare il proprio spazio di comunicazione come una reggia dove;porte su porte;si aprono ai diversi poteri politici facendo divenire opinionisti soubrette e strateghi di approfondimento e portaborse esperti di moduli 740.;pl;greater_plurality/accumulation;nominal;dove
1914;posizioni su posizioni;yes;su;posizione;È straordinaria la facilità con cui l'attaccante, che sta ottenendo grande successo nel suo doratissimo esilio spagnolo, ha risalito;posizioni su posizioni;collocandosi al vertice della piramide azzurra.;pl;greater_plurality/accumulation;nominal;risalire
1915;posizioni su posizioni;yes;su;posizione;A quel punto la decisione vincente: si strappa la visiera e incomincia a risalire;posizioni su posizioni;.;pl;greater_plurality/accumulation;nominal;risalire
1916;premi su premi;yes;su;premio;Il suo ufficio è stracolmo di dossier, faldoni, documenti, libri in quantità, quadri, cornici d'argento con le foto di famiglia,;premi su premi;che raccontano di essere stati compagni di lunghe giornate.;pl;greater_plurality/accumulation;nominal;famiglia
1919;progetti su progetti;yes;su;progetto;Lei continua a girare il mondo e a sfornare;progetti su progetti;.;pl;greater_plurality/accumulation;nominal;sfornare
1923;proposte su proposte;yes;su;proposta;Così partirono casse su casse;proposte su proposte;, ma non ricevevamo se non giornali vecchi di due mesi, qualche settimanale come Ogonëk o Donna Sovietica, qualche rivista come Voprosy Filosofii e Sovetskoe Gosudarstvo i Pravo, dai quali ogni tanto Strada segnalava qualcosa perplesso.;pl;greater_plurality/accumulation;nominal;cassa
1924;prova su prova;yes;su;prova;Per fortuna, conosceva la lingua così bene che capì ogni cosa, e si potette difendere, parola su parola, accusa su accusa ,;prova su prova;, senza perdersi d'animo.;sg;succession/iteration/distributivity;modifier;accusa
1925;prove su prove;yes;su;prova;D'altronde da qualche anno l'attivista Jeff Ballinger, fondatore del gruppo Press for Change, porta;prove su prove;circa le scandalose differenze fra le remunerazioni dei lavoratori indonesiani della catena Nike (poco più di un dollaro al giorno) e quelle dei campioni della pubblicità a cui la multinazionale affida la propria immagine.;pl;greater_plurality/accumulation;nominal;portare
1927;prove su prove;yes;su;prova;Inoltre la pratica di chiedere ai datori di lavoro;prove su prove;"dell'effettiva necessità del lavoro straniero rifletteva la resistenza ad accettare l'idea che esistesse una vera domanda di manodopera non ""autoctona"".";pl;greater_plurality/accumulation;nominal;lavoro
1930;prove su prove;yes;su;prova;In Europa sta invece accadendo questo: nonostante ci siano ormai;prove su prove;che la strada che si è intrapresa è totalmente sbagliata ed andrebbe come minimo azzerata e ripensata, chiunque mette in discussione il sogno POTH progetto europeo è un odioso populista, reazionario, fascista.;pl;greater_plurality/accumulation;nominal;ormai
1931;prove su prove;yes;su;prova;Le avevo provviste nei giorni a venire, lunghe, minuziose, documentate, mentre sui tavolini di Pilade mostravo a Belbo;prove su prove;, che egli seguiva con l'occhio sempre più annebbiato, accendendo le sigarette coi mozziconi, stendendo ogni cinque minuti il braccio infuori, il bicchiere vuoto con una parvenza di ghiaccio sul fondo, e Pilade che si precipitava a rifornire, senza attendere altri comandi.;pl;greater_plurality/accumulation;nominal;Belbo
1932;prove su prove;yes;su;prova;Tutte abusive sono le donne nel mondo dei maschi: senza passaporto né carta di identità, si fanno passare per quello che non sono, si sottopongono a;prove su prove;, pur di resistere, di non essere cacciate.;pl;greater_plurality/accumulation;nominal;a
1933;prove su prove;yes;su;prova;La squadra di tecnici della Telecom fa;prove su prove;per trovare l'inghippo.;pl;greater_plurality/accumulation;nominal;fare
1937;prove su prove;yes;su;prova;Niente di peggio per cominciare un'altra settimana di esperimenti,;prove su prove;, verifiche e analisi di tutto ciò che non aveva funzionato come avrebbe dovuto.;pl;greater_plurality/accumulation;nominal;esperimento
1939;punti su punti;yes;su;punto;Se giocava a basket come baciava, sarebbe stato fin troppo facile segnare;punti su punti;senza un briciolo di fatica.;pl;greater_plurality/accumulation;nominal;segnare
1940;punti su punti;yes;su;punto;L'Eroe e per questo lo proclamiamo tale affronta ogni cimento quando gli si presenta, e accumula;punti su punti;.;pl;greater_plurality/accumulation;nominal;accumulare
1941;punti su punti;yes;su;punto;La Bundesbank, che questa palla l'ha sempre lanciata, guadagnando;punti su punti;, adesso potrebbe essere costretta a rincorrerla.;pl;greater_plurality/accumulation;nominal;guadagnare
1942;punto su punto;yes;su;punto;Stende la mano all'opposizione e rivendica;punto su punto;il proprio programma.;sg;succession/iteration/distributivity;modifier;rivendicare
1943;punto su punto;yes;su;punto;Il 2 febbraio, con l'Inter avanti di cinque punti, aveva detto: «Non mi dispiacerebbe nemmeno se dovessimo lottare;punto su punto;in campionato.»;sg;succession/iteration/distributivity;modifier;lottare
1945;punto su punto;yes;su;punto;Il capo degli anestesisti, Giuseppe Sala, ha respinto;punto su punto;ogni accusa nel faccia a faccia più lungo della giornata.;sg;succession/iteration/distributivity;modifier;respingere
1946;punto su punto;yes;su;punto;Il governatore Roberto Formigoni sembra chiamarsi fuori: «L'assessore Ponzoni mi ha preannunciato una sua ampia dichiarazione che sarà dimostrazione;punto su punto;di quanto sia estraneo ai fatti».;sg;succession/iteration/distributivity;modifier;dimostrare
1948;punto su punto;yes;su;punto;Incalzato dai rappresentanti di Uds (Unione degli studenti) e Ras (Rete autogestita studentesca), il ministro ha ribattuto;punto su punto;.;sg;succession/iteration/distributivity;modifier;ribattere
1949;punto su punto;yes;su;punto;Il tribunale della libertà risponde;punto su punto;alle obiezioni degli avvocati di Gregorat.;sg;succession/iteration/distributivity;modifier;rispondere
1950;punto su punto;yes;su;punto;Giusto così, i titoli si costruiscono alla Niki Lauda,;punto su punto;azzardando il meno possibile.;sg;succession/iteration/distributivity;modifier;Lauda
1951;punto su punto;yes;su;punto;Accornero è pronto a ribattere;punto su punto;.;sg;succession/iteration/distributivity;modifier;ribattere
1952;punto su punto;yes;su;punto;Il quale cade dalla nuvole, e replica;punto su punto;: È vero che la convocazione del notaio non è stata fatta per iscritto, bensì per telefono.;sg;succession/iteration/distributivity;modifier;replicare
1953;punto su punto;yes;su;punto;Proprio sotto la spinta del suo coloured, Verona ha rosicchiato così;punto su punto;agli avversari (28-31 al 17'), prima di cedere nuovamente qualcosa al riposo (30-35) anche per la serata negativa di Iuzzolino (zero punti all'intervallo, con 4 errori al tiro).;sg;succession/iteration/distributivity;modifier;così
1955;punto su punto;yes;su;punto;Una pessima notizia per il Basaksehir, club di recente fondazione che sta lottando;punto su punto;con il più quotato Galatasaray per la vittoria dello scudetto.;sg;succession/iteration/distributivity;modifier;lottare
1956;punto su punto;yes;su;punto;La strategia 5Stelle - contrastare;punto su punto;Salvini colpendolo anche sui temi a lui più cari, come sicurezza e immigrazione - sembra aver avuto qualche effetto.;sg;succession/iteration/distributivity;modifier;contrastare
1958;record su record;yes;su;record;Ma in questi anni va così,;record su record;.;sg/pl;greater_plurality/accumulation;nominal;così
1961;record su record;yes;su;record;Ritengo che, dopo essere salita in modo fulmineo macinando;record su record;, la Borsa Usa abbia bisogno di una ripulita dagli eccessi speculativi.;sg/pl;greater_plurality/accumulation;nominal;macinare
1963;record su record;yes;su;record;La ragione è semplice: le principali Borse mondiali (salvo Tokio) macinano;record su record;, la capitalizzazione dei grandi gruppi quotati si espande oltre ogni previsione, i ritorni sull'investimento per chi ha puntato su di loro un anno fa battono tutte le alternative.;sg/pl;greater_plurality/accumulation;nominal;macinare
1965;record su record;yes;su;record;Fuori Perugini: Valentino è primo, in dieci minuti dodici posti risucchiati,;record su record;.;sg/pl;greater_plurality/accumulation;nominal;risucchiati
1968;ricorsi su ricorsi;yes;su;ricorso;Ma in questo caso, cioè se i repubblicani decidessero di procedere alla convocazione di testimoni imbarazzanti per Clinton, la Casa Bianca reagirebbe alzando il tiro: presentando;ricorsi su ricorsi;alla Corte costituzionale, chiedendo un rinvio per la preparazione della difesa, moltiplicando il numero dei testimoni, allungando all'infinito l'iter dell'impeachment.;pl;greater_plurality/accumulation;nominal;presentare
1969;righe su righe;yes;su;riga;Dal vuoto, come fiocchi d'una neve cibernetica, scendono lievi quelle tremende figurine geometriche, e io le incastro una con l'altra, le ghiaccio su spianate inesorabili, sommo;righe su righe;: quindi aumento la velocità, sempre dipiù, sempre dipiù, fino al massimo consentito: ormai è una grandinata irrefrenabile.;pl;greater_plurality/accumulation;nominal;sommare
1970;righe su righe;yes;su;riga;e non continuate più a leggere queste;righe su righe;e su righe…;pl;greater_plurality/accumulation;nominal;questo
1972;rinvii su rinvii;yes;su;rinvio;Quindici giorni in cui le attività giudiziarie penalistiche - i processi, grandi e piccoli, di criminalità comune e organizzata, acaricodi imputati eccellenti e sconosciuti - hanno subito, in tutt'Italia,;rinvii su rinvii;e accumulato ritardi.;pl;greater_plurality/accumulation;nominal;Italia
1974;ritardi su ritardi;yes;su;ritardo;Bene il raddoppio Mortara, unica linea ancora a singolo binario in città, capacità limitata e treni affollati che accumulano;ritardi su ritardi;a causa degli incroci.;pl;greater_plurality/accumulation;nominal;accumulare
1975;ritardi su ritardi;yes;su;ritardo;E se il verboso cattivo accumula;ritardi su ritardi;nelle sue comunicazioni finali al buono, nei teatri d'una volta si gridava «e partite, cretini!»;pl;greater_plurality/accumulation;nominal;accumulare
1976;ritardi su ritardi;yes;su;ritardo;Una sorta di modello finlandese, sulla falsariga della società che ha affidato ad Areva la costruzione del reattore di Olkiluoto (che sta però collezionando;ritardi su ritardi;, l'ultimo reso noto proprio ieri).;pl;greater_plurality/accumulation;nominal;collezionare
1977;ritardi su ritardi;yes;su;ritardo;Da allora, poco o nulla più:;ritardi su ritardi;da parte di BluTec nell'esecuzione dei piani, i lavoratori che protestano, Invitalia che ritira il finanziamento e chiede indietro i soldi.;pl;greater_plurality/accumulation;nominal;più
1978;ritmi su ritmi;yes;su;ritmo;Come i concetti, la musica di Cretu-Enigma non si ferma ma continua ad indagare, sovrapponendo;ritmi su ritmi;, sonorità elettroniche su sonorità canore spesso sintetizzate.;pl;greater_plurality/accumulation;nominal;sovrapporre
1980;riunioni su riunioni;yes;su;riunione;Non resta che aspettare: sempre dal municipio i bene informati fanno sapere che proprio in queste ore si stanno svolgendo;riunioni su riunioni;per risolvere la matassa e passare all'azione, ma sulla tempistica non si sbilancia nessuno.;pl;greater_plurality/accumulation;nominal;svolgere
1981;riunioni su riunioni;yes;su;riunione;Come sempre accade, appena un matrimonio va a rotoli si inizia a lavorare finoa tardi, a fare;riunioni su riunioni;, viaggi improvvisi.;pl;greater_plurality/accumulation;nominal;fare
1982;riunioni su riunioni;yes;su;riunione;Ma per arrivare sino a quel punto, a quel sospiro di sollievo, ci sono state ore di trattative ininterrotte e telefonate notturne e sveglie all'alba e;riunioni su riunioni;.;pl;greater_plurality/accumulation;nominal;e
1983;riunioni su riunioni;yes;su;riunione;La situazione era diventata assurda: facevo;riunioni su riunioni;con colleghe e genitori sul modo di migliorare il rapporto educativo coi bambini, individuare le strategie per seguirli meglio... e intanto i miei erano soli.;pl;greater_plurality/accumulation;nominal;fare
1984;riunioni su riunioni;yes;su;riunione;Da dieci giorni stiamo dicendo in tutte le sedi che bisognava intervenire: si è perduto tempo a discutere, a prendere contatti diplomatici, a fare;riunioni su riunioni;, dichiarazioni su dichiarazioni, mentre la tragedia albanese richiedeva interventi rapidi, decisi, organici, massicci.;pl;greater_plurality/accumulation;nominal;fare
1985;riunioni su riunioni;yes;su;riunione;Naturalmente, come in ogni occupazione che si rispetti, si susseguono;riunioni su riunioni;.;pl;greater_plurality/accumulation;nominal;susseguire
1988;rospi su rospi;yes;su;rospo;L'italiano sente, con il suo istinto arcaico e animalesco, che è in arrivo una tempesta nella quale perderà quelle poche certezze che lo aiutavano a inghiottire;rospi su rospi;.;pl;greater_plurality/accumulation;nominal;inghiottire
1989;rovescio su rovescio;yes;su;rovescio;Sul sei pari abbiamo uno scambio assassino,;rovescio su rovescio;, e io sono un fascio di nervi scossi.;sg;succession/iteration/distributivity;modifier;assassino
1990;rovine su rovine;yes;su;rovina;Dove ci appare una catena di eventi, egli vede una sola catastrofe che accumula senza tregua;rovine su rovine;e le rovescia ai suoi piedi.;pl;greater_plurality/accumulation;nominal;tregua
1991;sangue su sangue;yes;su;sangue;Hanno gioito o si sono disperati,;sangue su sangue;.;sg;succession/iteration/distributivity;modifier;disperato
1992;saponi su saponi;yes;su;sapone;Mi lavo e mi rilavo, svaniscono;saponi su saponi;, asciugamani e salviette si impregnano d'acqua.;pl;greater_plurality/accumulation;nominal;svanire
1993;sassolino su sassolino;yes;su;sassolino;Nei giorni a venire e nelle notti illuni e nelle notti quando una luna fulgidissima splendeva sopra la terra, il vecchio avrebbe continuato a parlargli, a parlargli, goccia a goccia,;sassolino su sassolino;, petalo dopo petalo.;sg;succession/iteration/distributivity;modifier;goccia
1994;sbagli su sbagli;yes;su;sbaglio;Aveva sempre permesso che loro ne approfittassero – una masochistica consapevolezza che la portava a collezionare;sbagli su sbagli;.;pl;greater_plurality/accumulation;nominal;collezionare
