NPN;construction;preposition;noun;pre_lemma;context_pre;costr;context_post;number_of_noun;Type;other_cxn;meaning;syntactic_function
cellule a cellule;no;a;cellule;questo;Se un antigene viene presentato dalle cellule specializzate nel presentare l'antigene, determina anche l'attivazione linfocitaria e la differenziazione di queste;cellule a cellule;effettrici.;sg;N_extended;no;distractor;_
paese a paese;no;a;paese;da;L'entrata in vigore delle nuove normative Ue impone infatti la conservazione di tutti i messaggi di posta elettronica per un tempo definito, che varia da;paese a paese;, pertanto le aziende si troveranno ad affrontare il problema dell'archiviazione dei messaggi di posta, ulteriormente aggravato dal peso che le email personali hanno sui sistemi dedicati all'archiviazione dati.;sg;PNPN;yes;distractor;_
paese a paese;no;a;paese;da;E infatti vi sono ancora differenze profonde da;paese a paese;nell'uso della Tv generalista e specialmente nel settore dell'informazione.;sg;PNPN;yes;distractor;_
trave a trave;no;a;trave;da;Eccitate dalla gente, svolazzavano da;trave a trave;.;sg;PNPN;yes;distractor;_
uomo a uomo;no;a;uomo;da;Questo istinto di autodifesa genera la totalità delle persone oggi e genera l'assenza di ogni capacità di simpatia umana da;uomo a uomo;, dall'uomo al mondo, dall'uomo agli avvenimenti.;sg;PNPN;yes;distractor;_
uomo a uomo;no;a;uomo;da;Vi segnaliamo anche l'accusa pesantissima dell'animatore del sito pacifista Peacelink, Alessandro Marescotti, ai tecnici che si sono resi conniventi della truffa del baco del millennio: un confronto da;uomo a uomo;nella rubrica Delfino.;sg;PNPN;yes;distractor;_
donna a donna;no;a;donna;da;C'è una donna vescovo, adesso, negli Stati Uniti, forse potrei chiamarla, forse lei potrebbe arrivare a Vina e, non so, forse, parlandole da;donna a donna;, intercedere per me.;sg;PNPN;yes;distractor;_
individuo a individuo;no;a;individuo;da;La concentrazione di stronzio 90 nello scheletro umano varia molto da luogo a luogo e da;individuo a individuo;"; si sono trovate persone che ne hanno fino a settantacinque volte la quantità media; i bambini hanno in media una concentrazione almeno quadrupla di quella degli adulti, a causa del più rapido ricambio di sostanze nelle ossa durante la crescita.";sg;PNPN;yes;distractor;_
situazione a situazione;no;a;situazione;da;Questo modellamento, però, non può che essere diversificato da;situazione a situazione;perché le istituzioni devono avere forme, figure e azioni adeguate a rapportarsi alle diverse realtà, in alcuni casi prolungandosi, in altre arretrando.;sg;PNPN;yes;distractor;_
uomo a uomo;no;a;uomo;da;Inoltre la situazione degli xenotrapianti oggi è vista esattamente come i trapianti da;uomo a uomo;erano considerati all'inizio degli Anni Sessanta, quando eravamo davvero in pochi a crederci.;sg;PNPN;yes;distractor;_
paese a paese;no;a;paese;da;Poi c'è il fondamentalismo: diverso da;paese a paese;, potente perché capace di dare un'identità e un orgoglio di appartenenza ai ceti più poveri.;sg;PNPN;yes;distractor;_
paese a paese;no;a;paese;da;Essa può assumere valenze parzialmente diverse da;paese a paese;, ma generalmente si colloca a destra chi enfatizza i valori dell'ordine sociale, della stabilità, della retribuzione secondo i meriti e a sinistra chi, invece, a tali valori è meno sensibile in nome della libertà di ciascun individuo (libertà, peraltro, non tanto intesa in termini di attività economica e politica, quanto rispetto alle norme ed ai costumi) nonché del diritto di questi a veder soddisfatti i propri bisogni.;sg;PNPN;yes;distractor;_
paese a paese;no;a;paese;da;Se si sostiene un concetto soggettivo di salute, è accettabile che i criteri della sperimentazione umana varino da;paese a paese;.;sg;PNPN;yes;distractor;_
sergente a sergente;no;a;sergente;da;I periodi minimi di attribuzioni specifiche, per l'avanzamento dei sergenti dell'Aeronautica militare, da;sergente a sergente;maggiore e da sergente maggiore a sergente maggiore capo sono determinati in 4 anni di impiego in incarichi della categoria di appartenenza.;sg;N_extended;no;distractor;_
punto a punto;no;a;punto;da;L'ATM crea una connessione da;punto a punto;.;sg;PNPN;yes;distractor;_
uomo a uomo;no;a;uomo;da;Oppure senza i sì e i no della figura paterna: finiti i gesti di sostegno virile, i lanci in aria per gioco, le spiegazioni da;uomo a uomo;, il conforto dopo gli insuccessi.;sg;PNPN;yes;distractor;_
punto a punto;no;a;punto;da;I nuovi sistemi di trasmissione a distanza si differenziano dai precedenti - telegrafo e telefono - perché non costituiscono un legame da;punto a punto;.;sg;PNPN;yes;distractor;_
paese a paese;no;a;paese;da;L'entità di questa differenza varia da;paese a paese;"; in Unione Sovietica era pari al 30 per cento, ma è ovunque significativa nonostante la forte spinta della legislazione compensativa.";sg;PNPN;yes;distractor;_
individuo a individuo;no;a;individuo;da;Anche l'ampiezza e la profondità dello sviluppo mentale variano considerevolmente da;individuo a individuo;.;sg;PNPN;yes;distractor;_
individuo a individuo;no;a;individuo;da;La sensibilità all'alcool varia molto da;individuo a individuo;"; ma il fatto che uno lo regga bene e un altro si ubriachi subito sembra dovuto anche ai suoi geni, in particolare al gene che comanda la produzione nel cervello di un enzima, la Fyn chinasi.";sg;PNPN;yes;distractor;_
comune a comune;no;a;comune;da;La differenza percentuale fra livello minimale e medio della spesa standard varia però in modo sensibile da;comune a comune;e fra gruppi di comuni.;sg;PNPN;yes;distractor;_
individuo a individuo;no;a;individuo;da;La reazione all'alcol varia molto da;individuo a individuo;.;sg;PNPN;yes;distractor;_
casello a casello;no;a;casello;da;Masotti padre, per l'incazzatura, prese su e andò da Bologna a Taranto in tre ore da;casello a casello;, tanto che il camion si surriscaldò e arrivò a destinazione un gigantesco carico di fritto il cui odore appetitoso fu sentito in tutta la città dei due mari.;sg;PNPN;yes;distractor;_
pigmento a pigmento;no;a;pigmento;da;La macinazione permette l'ulteriore riduzione nelle dimensioni degli agglomerati di pigmento: la raffinazione varia da;pigmento a pigmento;e si ottiene tramite passaggi in mulini a microsfere del premiscelato.;sg;PNPN;yes;distractor;_
paese a paese;no;a;paese;da;Nella UE il settore dei trasporti genera il 4,1 % del valore aggiunto totale, con notevoli differenze da;paese a paese;: in Italia e Regno Unito si arriva a quasi il 5%, mentre in Germania, Francia e Spagna si registrano valori inferiori al 4%.;sg;PNPN;yes;distractor;_
comune a comune;no;a;comune;da;Questa procedura, necessaria per evitare squilibri nei bilanci comunali, genera però un impatto sul reddito disponibile dei cittadini diverso da;comune a comune;in funzione dell'aliquota ICI in vigore.;sg;PNPN;yes;distractor;_
paese a paese;no;a;paese;da;In Europa centrale e orientale e nei Nuovi Stati Indipendenti è stato definito il quadro giuridico necessario, anche se la qualità e le prestazioni delle autorità di regolamentazione differiscono da;paese a paese;e, in genere, nei paesi candidati migliorano più rapidamente che in Russia o in Ucraina.;sg;PNPN;yes;distractor;_
uomo a uomo;no;a;uomo;da;Questa doppia infezione potrebbe creare un virus nuovo, trasmissibile da;uomo a uomo;.;sg;PNPN;yes;distractor;_
uomo a uomo;no;a;uomo;da;Zika, inoltre, si rivelò molto più complicato di Ebola: mentre Ebola si diffonde quasi esclusivamente da;uomo a uomo;, Zika viene perlopiù trasmesso attraverso punture di zanzara.;sg;PNPN;yes;distractor;_
donna a donna;no;a;donna;da;Se mi fossi presentata nella maniera giusta, ho pensato, se le avessi parlato da;donna a donna;, lei avrebbe capito.;sg;PNPN;yes;distractor;_
comune a comune;no;a;comune;da;Limitare gli spostamenti, anche da;comune a comune;, serve a diminuire gli incontri tra le persone e, dunque, la circolazione del virus.;sg;PNPN;yes;distractor;_
bambino a bambino;no;a;bambino;da;Le difficoltà e i successi ovviamente variano da;bambino a bambino;e da un ordine di scuola all'altro anche in base alle caratteristiche e le modalità organizzative dei vari tipi di scuola.;sg;PNPN;yes;distractor;_
donna a donna;no;a;donna;da;" anche i sintomi e la successione degli eventi possono essere molto diversi da""";donna a donna;.;sg;PNPN;yes;distractor;_
