NPN;construction;preposition;noun;pre_lemma;context_pre;costr;context_post;number_of_noun;Type;other_cxn;meaning;syntactic_function
parola su parola;yes;su;parola;difendere;Per fortuna, conosceva la lingua così bene che capì ogni cosa, e si potette difendere,;parola su parola;, accusa su accusa, prova su prova, senza perdersi d'animo.;sg;_;_;succession/iteration/distributivity;modifier
accusa su accusa;yes;su;accusa;parola;Per fortuna, conosceva la lingua così bene che capì ogni cosa, e si potette difendere, parola su parola ,;accusa su accusa;, prova su prova, senza perdersi d'animo.;sg;_;_;succession/iteration/distributivity;modifier
strato su strato;yes;su;strato;che;Ad un certo punto incontrarono una fontana ghiacciata che,;strato su strato;", aveva formato una specie di scultura che sembrava la sagoma di un animale; ma a dire il vero bastava girarsi intorno per riconoscere nel paesaggio mille immagini diverse disegnate dalla galaverna.";sg;_;_;succession/iteration/distributivity;modifier
pezzetto su pezzetto;yes;su;pezzetto;giorno;Le era sembrato di costruire ogni giorno;pezzetto su pezzetto;la propria vita e ciò che l'aveva inorgoglita di più era che ogni piccolo miglioramento derivasse dalla sua volontà e dalla assoluta mancanza di compromessi.;sg;_;_;succession/iteration/distributivity;modifier
certificati su certificati;yes;su;certificato;permesso;Il secondo problema è quello del rispetto delle norme: per gestire correttamente una discoteca sarebbero necessari permessi su permessi,;certificati su certificati;.;pl;_;_;greater_plurality/accumulation;nominal
avversari su avversari;yes;su;avversario;macinare;Marcella Bazzoni da poche ore si è dimessa da tecnico dell'Itm Jchnusa, la formazione di pallamano che nella prima parte di campionato ha macinato;avversari su avversari;nella A2 maschile, per poi crollare inanellando quattro sconfitte di seguito.;pl;_;_;greater_plurality/accumulation;nominal
manciate su manciate;yes;su;manciata;dare;Alla fine scovò delle bacche mature e me ne diede;manciate su manciate;.;pl;_;_;greater_plurality/accumulation;nominal
parole su parole;yes;su;parola;piallare;Troppe volte si spendono giorni e anni e decadi a piallare;parole su parole;senza sosta e alla fine queste parole sono come zoccoli di legno imperfetti, così scomodi e innaturali da calzare che dopo un po' è meglio tornare alla gomma, più industriale e fredda, ma più pratica, malleabile e comoda.;pl;_;_;greater_plurality/accumulation;nominal
aggettivo su aggettivo;yes;su;aggettivo;frase;"Tutto ""montato"" rase su frase,";aggettivo su aggettivo;, fino al crollo repentino della spaventevole magione.;sg;_;_;succession/iteration/distributivity;modifier
canzone su canzone;yes;su;canzone;costruire;Il Libro del Mondo è, in fondo, il lungo racconto che con incredibile coerenza ha costruito;canzone su canzone;"quel grande ""moralista camuffato da immmoralista"" (Cesare G. Romana ) che era Fabrizio.";sg;_;_;succession/iteration/distributivity;modifier
mattone su mattone;yes;su;mattone;lavorare;I torinesi la videro, ma tra tumulti, morti, feriti: perché mentre loro lavoravano,;mattone su mattone;, a costruire l'aula voluta dal conte e dalla città per sostituire il provvisorio Parlamento subalpino messo su alla buona in soli 113 giorni (in tempo per proclamare, il 18 febbraio 1861, il Regno d'Italia), la diplomazia aveva già deciso di accontentare Napoleone III e trasferire la capitale a Firenze e pochi anni più tardi a Roma.;sg;_;_;succession/iteration/distributivity;modifier
palloni su palloni;yes;su;pallone;respingere;Con la palla a terra è un pericolo per i suoi, con la capoccia, che ricorda uno spillo, respinge;palloni su palloni;.;pl;_;_;greater_plurality/accumulation;nominal
ACCUSE SU ACCUSE;yes;su;accusa;polemica;ANZICHE DISTRUGGERLA CON POLEMICHE SU POLEMICHE ... ;ACCUSE SU ACCUSE;…;pl;_;_;greater_plurality/accumulation;nominal
prove su prove;yes;su;prova;portare;D'altronde da qualche anno l'attivista Jeff Ballinger, fondatore del gruppo Press for Change, porta;prove su prove;circa le scandalose differenze fra le remunerazioni dei lavoratori indonesiani della catena Nike (poco più di un dollaro al giorno) e quelle dei campioni della pubblicità a cui la multinazionale affida la propria immagine.;pl;_;_;greater_plurality/accumulation;nominal
sentenze su sentenze;yes;su;sentenza;con;Anche se quel reato, ha stabilito negli anni la Cassazione con;sentenze su sentenze;"circa il senso del pudore e della ""continenza sessuale"", è di fatto tollerato se non se ne fa offerta al pubblico.";pl;_;_;greater_plurality/accumulation;nominal
goccia a goccia;yes;a;goccia;scorrere;Nel braccio di Bruno è conficcato l'ago e lungo il flessibile scorre;goccia a goccia;la medicina che per il momento regala al suo volto un'aria distesa e l'ombra di un sorriso.;sg;_;_;succession/iteration/distributivity;modifier
goccia a goccia;yes;a;goccia;irrigazione;Secondo, meglio usare sistemi di irrigazione;goccia a goccia;, che non quelli a getto nebulizzato inmodoche vi sia un minor consumo d'acqua.;sg;_;_;succession/iteration/distributivity;modifier
gomito a gomito;yes;a;gomito;stare;Intorno al tavolo non c'erano abbastanza sedie per tutti e così Kenneth dovette stare;gomito a gomito;con Shirley, cosa che invero pareva non dispiacergli affatto.;sg;_;_;juxtaposition/contact;modifier
goccia a goccia;yes;a;goccia;amarezza;Il generale si mise a distillare le sue amarezze;goccia a goccia;.;sg;_;_;succession/iteration/distributivity;modifier
goccia a goccia;yes;a;goccia;svuotare;La fine portava la festa, il maiale si svuotava;goccia a goccia;, in chiesa il prete issava il Cristo infreddolito sulla croce e dava l'ostia ai credenti, le strade si riempivano, sulla terra bianca la chiazza rossa si stendeva con la lentezza delle cose passate, e il mio sguardo non trovava rifugio.;sg;_;_;succession/iteration/distributivity;modifier
goccia a goccia;yes;a;goccia;lentamente;Cominciò a scavare con la punta della spada finché vide affiorare lentamente,;goccia a goccia;, dell'acqua.;sg;_;_;succession/iteration/distributivity;modifier
pezzo a pezzo;yes;a;pezzo;via;Si era riparato in fondo al terrazzo, sotto a un pergolato che il vento stava portandosi via;pezzo a pezzo;, e tutt'insieme non solo il fumo gli si era parato davanti, ma bello e chiaro tutto il vapore, così vicino dentro la lente del cannocchiale che a momenti si vedevano i peli del naso a quelli di bordo.;sg;_;_;succession/iteration/distributivity;modifier
grado a grado;yes;a;grado;condurre;Catturato dalle sempre più sottili distinzioni e puntualizzazioni che lo conducono;grado a grado;"verso le profondità del microcosmo, il lettore ha la sorpresa di trovarsi alla fine in un terreno che ha le dimensioni dell'universo e un colore umano inconfondibile: E fortuna d'essermi senza volere trovato quasi solo usufruttuario d'un territorio senza confini, in un mondo spezzettato ormai in tante proprietà private, dove non è più palmo che non sia chiuso da cancelli cinto da filo spinato, ringhioso di cani da guardia; desideroso io solo di qualcosa che nessuno mi disputa, nessuno anzi vede (e se chi passa chiede, alla spiegazione sorride incredulo o commiserante).";sg;_;_;succession/iteration/distributivity;modifier
gomito a gomito;yes;a;gomito;fila;Di fronte al nemico si serrano i ranghi e le file;gomito a gomito;.;sg;_;_;juxtaposition/contact;modifier
fronte a fronte;yes;a;fronte;vigilare;E l'ordine, sia ben chiaro, non è l'assenza di disordine, ma la confusione regolamentata, su cui vigilano;fronte a fronte;re e vescovi.;sg;_;_;juxtaposition/contact;modifier
palmo a palmo;yes;a;palmo;praticamente;Quelli dell'NGA disponevano di migliaia di immagini scattate dai droni e dai satelliti, e conoscevano praticamente;palmo a palmo;l'intera area esterna del compound.;sg;_;_;succession/iteration/distributivity;modifier
goccia a goccia;yes;a;goccia;bere;"È solo che mi piace sentirti parlare di quando il mare si poteva vedere, di quando ci si poteva entrare dentro; mi piace bere,";goccia a goccia;, quel distillato di saggezza che... --- Il distillato di tua mamma!;sg;_;_;succession/iteration/distributivity;modifier
pezzo a pezzo;yes;a;pezzo;ricomporre;E questa non dovrebbe essere la terra sulla quale volendo, volendo e stravolendo tutto si può fare, allora vada a inseguirsi in cielo, volenterosamente vada a ricomporsi;pezzo a pezzo;.;sg;_;_;succession/iteration/distributivity;modifier
palmo a palmo;yes;a;palmo;battere;Da quella sera, fino a ieri pomeriggio, carabinieri, polizia e vigili del fuoco hanno continuato a cercare madre e figlio, battendo;palmo a palmo;la zona lungo il fiume e scandagliando le acque del Livenza, che a tratti ha correnti molto forti e profondità dai cinque ai nove metri.;sg;_;_;succession/iteration/distributivity;modifier
palmo a palmo;yes;a;palmo;che;Moltitudine di prostitute e colori sgargianti, stuoli d'artisti e piaceri del cibo, mio Ludovico, servono a celare spie e sbirri, giudici e inquisitori che;palmo a palmo;scrutano incessanti.;sg;_;_;succession/iteration/distributivity;modifier
uomini su uomini;no;su;uomo;di;"Come sottolineavano i compagni tedeschi delle Cellule Rivoluzionarie: ""Noi crediamo che la guerra totale contro il sistema di dominio di";uomini su uomini;acchiuda in se stessa contemporaneamente e in egual misura la lotta contro il sistema capitalistico che è in noi stessi.;pl;thematic_target;no;distractor;_
40 su 40;no;su;40;voto;Poi è il turno di Nintendogs, il perfect score di Famitsu (voto;40 su 40;), dopo aver conquistato il mercato nipponico, si prepara ad invadere anche quelli occidentali.;X;NumPNum;no;distractor;_
strada su strada;no;su;strada;di;In tal modo l'aquaplaning viene scongiurato e la tenuta di;strada su strada;bagnata e innevata è ottimale.;sg;N_extended;no;distractor;_
Arezzo su Arezzo;no;su;Arezzo;di;La posizione del Comune di;Arezzo su Arezzo;Fiere è chiarissima.;X;proper_name_inglobation;no;distractor;_
3 su 3;no;su;3;bene;Premetto che la scart è una 21 poli e ne ho provate ben;3 su 3;"televisori diversi, ma nulla da fare; pare che dalla scart del dvd non esca il seganle video ... cosa posso fare?";X;NumPNum;no;distractor;_
18 su 18;no;su;18;strappare;Io penso che se una persona si impegna, comincia a farlo all' universita' ... magari prendendo dei buoni voti agli esami senza andare a tentare, strappando;18 su 18;.;X;NumPNum;no;distractor;_
capelli su capelli;no;su;capello;di;Quindi, ad esempio, lo stesso taglio di;capelli su capelli;lisci e ricci apparirà completamente diverso. pertanto quando scegli un taglio di capelli, oltre al tipo di viso, considera anche il tipo di capelli.;pl;N_extended;no;distractor;_
punto su punto;no;su;punto;data;Punto croce ricamo una data;punto su punto; giù indico traccia di trama merletto finito.;sg;NsuNgiù;yes;distractor;_
7 su 7;no;su;7;con;Lo fa in modo incontestabile: chiude con;7 su 7;dai 6.25 mt per un totale di 29 punti, il tutto in sola metà gara.;X;NumPNum;no;distractor;_
uomo su uomo;no;su;uomo;qui;"Il problema del potere si ripresenta qui; il potere d'";uomo su uomo;.;sg;thematic_target;no;distractor;_
TV su TV;no;su;TV;diretta;Tutta la cerimonia finale verrá trasmessa in diretta;TV su TV;3 dalle 18.40 alle 20.15 e su TV 1 e TV 2 dalle 19.30 alle 20.00.;sg;proper_name_inglobation;no;distractor;_
2 su 2;no;su;2;vincente;Detto questo, torniamo alla realtà dei fatti, che ci rimanda un Barcellona più che mai vincente:;2 su 2;in Eurolega, con 12 punti di scarto rifilati all' Aek e 14 all' Olimpia (in questo caso con un provvidenziale + 18 nell' ultimo quarto), e 8 su 9 in campionato.;X;NumPNum;no;distractor;_
119 su 119;no;su;119;tutto;Attivate al 100 % le procedure di bonifica per i siti inquinati a breve termine, in tutto;119 su 119;, e al 58 % quelle per i 146 siti a medio termine, mentre per i 60 siti di piano definiti ' in approfondimentò (considerati a medio termine nell' attesa della definitiva classificazione nell' ambito dell' approvazione dei Piani Provinciali), tale percentuale scende al 32 %.;X;NumPNum;no;distractor;_
uomini su uomini;no;su;uomo;di;Ne restasse fuori anche uno solo, anche una sola testa, su cosa potrebbe mai fondarsi una nazione se non sul dominio di;uomini su uomini;?;pl;thematic_target;no;distractor;_
uomini su uomini;no;su;uomo;di;Dall'inizio degli anni Novanta è diminuito il numero di omicidi di;uomini su uomini;"mentre il numero di donne uccise da uomini è aumentato: l'intensità e il grado di diffusione di episodi di violenza e abuso nei confronti delle donne sono tali da aver suggerito il conio del termine ""femminicidio"".";pl;thematic_target;no;distractor;_
punto a punto;no;a;punto;da;Tra le singolarità c'è un agglomerato di linee di forza variamente incurvate da;punto a punto;.;sg;PNPN;yes;distractor;_
uomo a uomo;no;a;uomo;da;Quel pacchetto delle nazionali che offriva grandioso, da;uomo a uomo;, tirandolo fuori tutto stropicciato dalla tasca.;sg;PNPN;yes;distractor;_
autore a autore;no;a;autore;da;Certo, ed è persino superfluo ricordarlo, l'orchestrazione del dialogato conosce modulazioni plurime, variando da;autore a autore;, da opera a opera.;sg;PNPN;yes;distractor;_
bar a bar;no;a;bar;da;La cifra complessiva cambiava da;bar a bar;, ma erano tutti d'accordo che i ricorrenti avessero ottenuto circa cinque milioni di dollari.;sg;PNPN;yes;distractor;_
donna a donna;no;a;donna;da;" anche i sintomi e la successione degli eventi possono essere molto diversi da""";donna a donna;.;sg;PNPN;yes;distractor;_
inquadratura a inquadratura;no;a;inquadratura;da;Raramente i casi reali di compressione sono così semplici: anche un'unica inquadratura di un cielo blu include sottili variazioni di colore e i colori cambieranno da;inquadratura a inquadratura;.;sg;PNPN;yes;distractor;_
uomo a uomo;no;a;uomo;da;Questa doppia infezione potrebbe creare un virus nuovo, trasmissibile da;uomo a uomo;.;sg;PNPN;yes;distractor;_
uomo a uomo;no;a;uomo;da;Così ho inforcato la Chevrolet e girato per mezz'ora fra quei prefabbricati, cercando di capire dove si annidasse il marito: intendevo parlargli da;uomo a uomo;.;sg;PNPN;yes;distractor;_
uomo a uomo;no;a;uomo;da;Segreti, appunto, che erano da sempre tramandati da;uomo a uomo;, da adulto a giovane, da maestro a discepolo.;sg;PNPN;yes;distractor;_
punto a punto;no;a;punto;da;Dev'essere ristudiato il Radiobus «classico», ché la formula da;punto a punto;.;sg;PNPN;yes;distractor;_
banca a banca;no;a;banca;da;Per quest'ultimo servizio non c'è alcuna differenza tra tessera vecchia e tessera nuova: sono rimaste in vigore, infatti, le precedenti condizioni economiche, diverse da;banca a banca;, ma in genere gratuite per prelievi agli sportelli automatici del proprio istituto e tariffate (in media dalle 2500 alle 3000 lire) per prelievi in qualsiasi altra banca diversa dalla propria.;sg;PNPN;yes;distractor;_
azienda ad azienda;no;a;azienda;da;La modularità delle ante varia da;azienda ad azienda;ma, in generale, il battente singolo è largo cm 50-70.;sg;PNPN;yes;distractor;_
fratelli a fratelli;no;a;fratello;genitore;Riconosco i tanti cognomi della comunità, rivedo le loro storie, riunisco figli a genitori,;fratelli a fratelli;", amici ad amici; ma la pietà di chi resta può essere sufficiente?";pl;verbal;yes;distractor;_
punto a punto;no;a;punto;da;Il confronto del dato sperimentale con quello calcolato consente di tracciare mappe di variazione da;punto a punto;.;sg;PNPN;yes;distractor;_
uomo a uomo;no;a;uomo;da;Questo istinto di autodifesa genera la totalità delle persone oggi e genera l'assenza di ogni capacità di simpatia umana da;uomo a uomo;, dall'uomo al mondo, dall'uomo agli avvenimenti.;sg;PNPN;yes;distractor;_
