NPN;construction;preposition;noun;pre_lemma;context_pre;costr;context_post;number_of_noun;Type;other_cxn;meaning;syntactic_function
fratelli a fratelli;no;a;fratello;genitore;Riconosco i tanti cognomi della comunità, rivedo le loro storie, riunisco figli a genitori,;fratelli a fratelli;", amici ad amici; ma la pietà di chi resta può essere sufficiente?";pl;verbal;yes;distractor;_
punto a punto;no;a;punto;da;Il confronto del dato sperimentale con quello calcolato consente di tracciare mappe di variazione da;punto a punto;.;sg;PNPN;yes;distractor;_
uomo a uomo;no;a;uomo;da;Questo istinto di autodifesa genera la totalità delle persone oggi e genera l'assenza di ogni capacità di simpatia umana da;uomo a uomo;, dall'uomo al mondo, dall'uomo agli avvenimenti.;sg;PNPN;yes;distractor;_
bambino a bambino;no;a;bambino;da;Le difficoltà e i successi ovviamente variano da;bambino a bambino;e da un ordine di scuola all'altro anche in base alle caratteristiche e le modalità organizzative dei vari tipi di scuola.;sg;PNPN;yes;distractor;_
donna a donna;no;a;donna;da;C'è una donna vescovo, adesso, negli Stati Uniti, forse potrei chiamarla, forse lei potrebbe arrivare a Vina e, non so, forse, parlandole da;donna a donna;, intercedere per me.;sg;PNPN;yes;distractor;_
ministero a ministero;no;a;ministero;da;Naturalmente il fenomeno rivela un andamento discontinuo da;ministero a ministero;: dal 4,06% del Tesoro, ad esempio, si passa allo 0,29% degli Esteri.;sg;PNPN;yes;distractor;_
uomo a uomo;no;a;uomo;da;Possiamo avere una conversazione educata, da;uomo a uomo;, oppure devo farti strappare di bocca altre parole dai miei uomini?;sg;PNPN;yes;distractor;_
sportello a sportello;no;a;sportello;da;Mai più vedere soggetti che passano da;sportello a sportello;di uffici pubblici, talvolta con effetti defatiganti e che fanno di per sé sfiduciare completamente l'utente circa l'efficienza del servizio reso.;sg;PNPN;yes;distractor;_
bambino a bambino;no;a;bambino;da;Eppure non è mai stato provato un caso al mondo di contagio da;bambino a bambino;.;sg;PNPN;yes;distractor;_
uomo a uomo;no;a;uomo;da;Fisher, non ho mai avuto modo di parlarti, da;uomo a uomo;.;sg;PNPN;yes;distractor;_
donna a donna;no;a;donna;da;L'intensità del dolore in questa fase varia molto da;donna a donna;.;sg;PNPN;yes;distractor;_
abbondanza ad abbondanza;no;a;abbondanza;aggiungere;Anche per i Benetton il miliardo messo a disposizione dalla Cassa, con l'astensione in consiglio di Viesti e di un altro componente, sembra aggiungere;abbondanza ad abbondanza;.;sg;verbal;yes;distractor;_
sovrano a sovrano;no;a;sovrano;da;L'esito dello scontro è stato quello che gli dei hanno deciso, ma mi rivolgo a te da;sovrano a sovrano;affinché tu liberi i miei figli, mia madre e la mia sposa.;sg;PNPN;yes;distractor;_
uomo a uomo;no;a;uomo;da;Faustino Rivera aveva guardato il suo superiore e ne aveva intuito il pensiero, perché in certe notti di guardia avevano potuto parlare da;uomo a uomo;, scavalcando le gerarchie per analizzare le cause del sollevamento militare e delle sue conseguenze.;sg;PNPN;yes;distractor;_
donna a donna;no;a;donna;da;Ma se vuole un consiglio da;donna a donna;non lo farei.;sg;PNPN;yes;distractor;_
artista ad artista;no;a;artista;da;Lo spessore dello strato pittorico varia da;artista ad artista;e dalla tecnica impiegata.;sg;PNPN;yes;distractor;_
soggetto a soggetto;no;a;soggetto;da;I segni clinici, la cui intensità varia da;soggetto a soggetto;, si manifestano dopo aver assunto alimenti contenenti lattosio.;sg;PNPN;yes;distractor;_
banca a banca;no;a;banca;da;Per chiudere questo mutuo dovrete pagare una penale del 3% (ma come si vede nella tabella la percentuale cambia da;banca a banca;e, in alcuni casi, il conteggio si può rivelare molto complicato) sull'ammontare del capitale ancora da rimborsare (2.091.736 lire).;sg;PNPN;yes;distractor;_
