NPN;construction;preposition;noun;pre_lemma;context_pre;costr;context_post;number_of_noun;Type;other_cxn;meaning;syntactic_function
strato su strato;yes;su;strato;cipolla;A sua volta, il pensiero si divide, come dire, anche da se stesso, in accumulo, foglio sopra foglio, azione dopo ricordo, riflessione sopra decisione, lasciandomi come una grande cipolla,;strato su strato;, nel cui cuore profondo risuonano, lancinanti e abissali, le parole del Grande Matthys, il Dio Fornaio.;sg;_;_;succession/iteration/distributivity;modifier
bagni su bagni;yes;su;bagno;fare;Ormai collaudato l'adattamento di Vucinic, attaccante di valore che continua a fare;bagni su bagni;d'umiltà.;pl;_;_;greater_plurality/accumulation;nominal
bisogni su bisogni;yes;su;bisogno;assorbire;Nei campi è uno spumeggiare di queste sanguisughe parlanti in frenetica attività succhiatoria e anche psicotropica, assorbono;bisogni su bisogni;, emettono pezzi di promessa, certezza, appuntamenti, visioni.;pl;_;_;greater_plurality/accumulation;nominal
strato su strato;yes;su;strato;teglia;Cominciai a sbollentare le lasagne e a disporle nella teglia;strato su strato;, ma se avessi potuto distogliere Melchor dal suo gaydar.com gli avrei dato i soldi e gli avrei chiesto di andare a comperarmene una nuova di ghisa.;sg;_;_;succession/iteration/distributivity;modifier
pietra su pietra;yes;su;pietra;costruire;Le pietre scolpite sono l'omaggio alla storia millenaria, costruita;pietra su pietra;, secolo dopo secolo.;sg;_;_;succession/iteration/distributivity;modifier
colpo su colpo;yes;su;colpo;davvero;L'intesa con Carnival fornisce inoltre a Fincantieri l'opportunità per ribattere davvero;colpo su colpo;la concorrenza dell'altro grande cantiere specializzato in navi passeggeri, il finlandese Masa Yard che recentemente si è aggiudicato un megacontratto della Royal Caribbean cruise line (Rccl) per la costruzione di due unità da 130mila tonnellate destinate a strappare proprio alle Carnival della serie Destiny il primato delle più grandi navi passeggeri del mondo.;sg;_;_;succession/iteration/distributivity;modifier
permessi su permessi;yes;su;permesso;necessario;Il secondo problema è quello del rispetto delle norme: per gestire correttamente una discoteca sarebbero necessari;permessi su permessi;, certificati su certificati.;pl;_;_;greater_plurality/accumulation;nominal
pile su pile;yes;su;pile;me;Io volavo alle casse, Pabs disimballava, registrava, smistava e scaricava sudi me;pile su pile;di CD a velocità supersonica.;pl;_;_;greater_plurality/accumulation;nominal
pietra su pietra;yes;su;pietra;cumulativamente;"È necessario fare chiarezza su tali aporie (si ricordi il senso della ‘spiegazione’ in Kant!) ; la filosofia non procede cumulativamente, ‘";pietra su pietra;, né può pensare di porre ordine nel linguaggio che effettivamente parliamo ricorrendo al ‘modello’ di ideografie, valide soltanto nell’ambito di procedure logico-matematiche.;sg;_;_;succession/iteration/distributivity;modifier
schiaffoni su schiaffoni;yes;su;schiaffone;prendere;È il piccoletto dei Brutos che prendeva;schiaffoni su schiaffoni;.;pl;_;_;greater_plurality/accumulation;nominal
tappa su tappa;yes;su;tappa;aggiungere;Carica sulla Mercedes il figlio e la ex moglie, si ferma nei migliori alberghi lungo il tragitto, attraversa la Penisola Iberica aggiungendo;tappa su tappa;"di un itinerario ""turistico"": Malaga, Costa del Sol, Alicante.";sg;_;_;succession/iteration/distributivity;modifier
domande su domande;yes;su;domanda;fare;Interi pomeriggi a bere tè ascoltando il racconto della loro vita, e io lì a fare;domande su domande;ome Maria De Filippi.;pl;_;_;greater_plurality/accumulation;nominal
corna su corna;yes;su;corna;mettere;Invece toccò al capo, ad Agamennone, uomo borioso e fatuo, a cui Clitennestra da tempo metteva;corna su corna;perché ormai impotente.;pl;_;_;greater_plurality/accumulation;nominal
veleni su veleni;yes;su;veleno;alimentare;E una sfida all'arma bianca per arrivare alla guida di Palazzo Vermexio e gestire ancora il fiume di denaro che ha alimentato;veleni su veleni;, non ultimi quelli che grazie alle inchieste del piccolo giornale La Civetta hanno travolto la Procura, con tanto di trasferimento «cautelare» dell'ex capo Ugo Rossi per legami dei figli con alcune società nell'occhio del ciclone.;pl;_;_;greater_plurality/accumulation;nominal
memoria su memoria;yes;su;memoria;essere;Se voi mi chiedete come ciò possa essere -;memoria su memoria;, nient'altro che memoria - io ovviamente non so rispondere, e non perché non esistano «io» e «voi», non più di quanto esistano «qui» e «ora», ma perché l'unica cosa che esiste è il passato ricordato, non ritrovato e - attenzione alla differenza - non rivissuto nell'immediatezza del regno sensoriale, ma semplicemente ritrasmesso.;sg;_;_;succession/iteration/distributivity;modifier
colpo su colpo;yes;su;colpo;rispondere;Il nostro compito è restare vigili e rispondere;colpo su colpo;.;sg;_;_;succession/iteration/distributivity;modifier
pedalata su pedalata;yes;su;pedalata;sedere;Non essendo lontana dalla città, raggiungevamo la Carletta in bicicletta, portando sul cannone le ragazze e principiando, con timide e apparentemente occasionali strisciate di ginocchio contro il loro sedere,;pedalata su pedalata;, il rito sessuale ridotto.;sg;_;_;succession/iteration/distributivity;modifier
euro su euro;yes;su;euro;risparmiare;Sposando Luigi, avrebbe lavorato per tutta la vita negli uffici della Coop, risparmiando;euro su euro;per arrivare alla fine del mese.;sg/pl;_;_;greater_plurality/accumulation;nominal
aggettivo su aggettivo;yes;su;aggettivo;frase;"Tutto ""montato"" rase su frase,";aggettivo su aggettivo;, fino al crollo repentino della spaventevole magione.;sg;_;_;succession/iteration/distributivity;modifier
posizioni su posizioni;yes;su;posizione;risalire;È straordinaria la facilità con cui l'attaccante, che sta ottenendo grande successo nel suo doratissimo esilio spagnolo, ha risalito;posizioni su posizioni;collocandosi al vertice della piramide azzurra.;pl;_;_;greater_plurality/accumulation;nominal
parlamentari su parlamentari;yes;su;parlamentare;avvicinare;Per mesi Gianni Letta e i lobbisti del Biscione avevano avvicinato;parlamentari su parlamentari;.;pl;_;_;greater_plurality/accumulation;nominal
pacchi su pacchi;yes;su;pacco;cucina;Ci mettemmo una cosa come mezz'ora, facendo avanti e indietro tra la strada e la cucina –;pacchi su pacchi;su pacchi – e quando il tizio con il berretto, sfinito, risalì sul suo furgone e sparì, dalla cucina li portammo in taverna – pacchi su pacchi su pacchi.;pl;_;_;greater_plurality/accumulation;nominal
pezzetto su pezzetto;yes;su;pezzetto;giorno;Le era sembrato di costruire ogni giorno;pezzetto su pezzetto;la propria vita e ciò che l'aveva inorgoglita di più era che ogni piccolo miglioramento derivasse dalla sua volontà e dalla assoluta mancanza di compromessi.;sg;_;_;succession/iteration/distributivity;modifier
colpo su colpo;yes;su;colpo;rispondere;Entrambe le compagini si sono affrontate a viso aperto rispondendo;colpo su colpo;a qualasisi iniziativa opposta, esibendo in certi frangenti anche giocate di buona tecnica.;sg;_;_;succession/iteration/distributivity;modifier
colpo su colpo;yes;su;colpo;ribattere;All'Arechi gli uomini di Beretta hanno dovuto fare i conti con una Salernitana mai doma, pronta a ribattere;colpo su colpo;agli affondi dei più blasonati avversari.;sg;_;_;succession/iteration/distributivity;modifier
tasse su tasse;yes;su;tassa;stella;Dopo un anno, disoccupazione alle stelle,;tasse su tasse;, pensioni in pericolo, criminalità impunita e spavalda, città nelle mani di spacciatori e violenti, il futuro è visto da molti incerto e drammatico.;pl;_;_;greater_plurality/accumulation;nominal
vittime su vittime;yes;su;vittima;immolare;Filippo attraversò l'accampamento gettando una rapida occhiata ad Aristandro che continuava a immolare;vittime su vittime;sul suo altare fumigante nella notte, e raggiunse un luogo in cui sorgeva un gigantesco banyan.;pl;_;_;greater_plurality/accumulation;nominal
lettere su lettere;yes;su;lettera;scrivere;Ciò nonostante, padre Villaverde non esitò a scrivere;lettere su lettere;ai suoi superiori, sostenendo di essere stato aggredito senza motivo e chiedendo che questo accolito di Satana fosse radiato dalla Chiesa.;pl;_;_;greater_plurality/accumulation;nominal
bellezza su bellezza;yes;su;bellezza;ammucchiare;Allora, per un po', scherzo con la bellezza, ammucchiando;bellezza su bellezza;, facendone qualcosa di schiacciante, quasi di indecente, come uno stupro.;sg;_;_;greater_plurality/accumulation;nominal
campi su campi;yes;su;campo;spaziotempo;"Questi campi non vivono nello spaziotempo; vivono, per così dire, uno sull'altro:";campi su campi;.;pl;_;_;greater_plurality/accumulation;nominal
strati su strati;yes;su;strato;sovrapporre;"""Basta con le tante scene di passeggeri che viaggiano sovrapposti";strati su strati;", come in una dantesca millefoglie - è sbottato in una diretta Facebook il Governatore con il suo solito linguaggio colorito - da oggi pugno duro: i campani potranno disporsi al massimo su tre strati"".";pl;_;_;greater_plurality/accumulation;nominal
file su file;yes;su;file;vedere;E d'improvviso ci sembrò di vedere;file su file;di formiche del miele col corpo striato e luccicante, che nelle loro celle sotto le radici del mulga traboccavano di nettare.;pl;_;_;greater_plurality/accumulation;nominal
strato su strato;yes;su;strato;incollare;L'unica traccia di colore era offerta dai manifesti elettorali, sbiaditi e incollati;strato su strato;.;sg;_;_;succession/iteration/distributivity;modifier
colpo su colpo;yes;su;colpo;rispondere;Jack Hyde mi fa domande spiazzanti e intelligenti, ma io non mi faccio cogliere impreparata: rispondo;colpo su colpo;e, quando discutiamo delle mie letture preferite, credo di cavarmela bene.;sg;_;_;succession/iteration/distributivity;modifier
progetti su progetti;yes;su;progetto;sfornare;Lei continua a girare il mondo e a sfornare;progetti su progetti;.;pl;_;_;greater_plurality/accumulation;nominal
esempi su esempi;yes;su;esempio;citare;Ma si potrebbe continuare a citare;esempi su esempi;: il Medioevo è attraversato da queste ventate di rivolta in cui un gruppo si identifica con l'unica Chiesa legittima, legittimandosi col proprio rigorismo (che, curiosamente, spesso sfocia nella licenza, come se la coscienza della propria perfezione spirituale consentisse una maggior spregiudicatezza nel trattare le miserie della carne).;pl;_;_;greater_plurality/accumulation;nominal
colpo su colpo;yes;su;colpo;restituire;Proprio la dote che l'aveva sorretta durante il primo tempo, consentendole di reggere il ritmo - non forsennato - degli avversari ai quali aveva restituito;colpo su colpo;.;sg;_;_;greater_plurality/accumulation;nominal
colpo su colpo;yes;su;colpo;rispondere;Più adulto e più esperto di lui, era sempre riuscito a tenergli testa, a rispondere;colpo su colpo;o addirittura a prevenire le sue mosse.;sg;_;_;succession/iteration/distributivity;modifier
velo su velo;yes;su;velo;strada;Il vento era ancora leggero, ma prometteva tempesta, la sabbia volava bassa e copriva le strade,;velo su velo;.;sg;_;_;succession/iteration/distributivity;modifier
case su case;yes;su;casa;sinistra;A destra c'è il mare, a sinistra;case su case;, fino a pochi secondi prima di toccare.;pl;_;_;greater_plurality/accumulation;nominal
terreno su terreno;yes;su;terreno;guadagnare;Io guardavo lo zoppo rincorrere goffamente la più bella e l'altro inseguirli velocissimo guadagnando;terreno su terreno;.;sg;_;_;greater_plurality/accumulation;nominal
record su record;yes;su;record;macinare;Ritengo che, dopo essere salita in modo fulmineo macinando;record su record;, la Borsa Usa abbia bisogno di una ripulita dagli eccessi speculativi.;sg/pl;_;_;greater_plurality/accumulation;nominal
premi su premi;yes;su;premio;famiglia;Il suo ufficio è stracolmo di dossier, faldoni, documenti, libri in quantità, quadri, cornici d'argento con le foto di famiglia,;premi su premi;che raccontano di essere stati compagni di lunghe giornate.;pl;_;_;greater_plurality/accumulation;nominal
riunioni su riunioni;yes;su;riunione;fare;La situazione era diventata assurda: facevo;riunioni su riunioni;con colleghe e genitori sul modo di migliorare il rapporto educativo coi bambini, individuare le strategie per seguirli meglio... e intanto i miei erano soli.;pl;_;_;greater_plurality/accumulation;nominal
colpo su colpo;yes;su;colpo;rispondere;Maranghi, con l'arroganza che molti gli rimproverano, ha risposto;colpo su colpo;, rinfacciando alla fine quella che, secondo lui, è stata la più grave colpa del giovane direttore centrale: l'aver a suo tempo escluso che la Consob avrebbe obbligato Mediobanca a fare un'opa sull'ex gruppo Ferruzzi, come invece avvenne, costringendo l'istituto a un esborso di oltre 200 miliardi.;sg;_;_;succession/iteration/distributivity;modifier
domande su domande;yes;su;domanda;fare;E sa anche che se presenta operazioni un po' bislacche, in consiglio può trovare anche chi comincerà a far;domande su domande;.;pl;_;_;greater_plurality/accumulation;nominal
rovine su rovine;yes;su;rovina;tregua;Dove ci appare una catena di eventi, egli vede una sola catastrofe che accumula senza tregua;rovine su rovine;e le rovescia ai suoi piedi.;pl;_;_;greater_plurality/accumulation;nominal
strato su strato;yes;su;strato;sistemare;Nel ventre dell'acropoli, una collina compresa fra via Santa Maria in Costantinopoli, via Foria e via Tribunali, le epoche si sono sistemate;strato su strato;, dalle mura greche che risalgono alla fondazione nel V secolo avanti Cristo, fino agli edifici ottocenteschi.;sg;_;_;succession/iteration/distributivity;modifier
colpo su colpo;yes;su;colpo;ribattere;Ma Micheli si infervora, nega, ribatte;colpo su colpo;.;sg;_;_;succession/iteration/distributivity;modifier
record su record;yes;su;record;macinare;La ragione è semplice: le principali Borse mondiali (salvo Tokio) macinano;record su record;, la capitalizzazione dei grandi gruppi quotati si espande oltre ogni previsione, i ritorni sull'investimento per chi ha puntato su di loro un anno fa battono tutte le alternative.;sg/pl;_;_;greater_plurality/accumulation;nominal
coppe su coppe;yes;su;coppa;mangiare;Orinare stando in piedi era punito in un modo particolarmente arduo, e le donne che durante le mestruazioni si avvicinavano all'acqua o al fuoco venivano costrette a mangiare;coppe su coppe;di piscio e merda maschili.;pl;_;_;greater_plurality/accumulation;nominal
cazzate su cazzate;yes;su;cazzata;frullare;Mi aspetto che si metta a ridere come un pazzo e che poi ricominci a frullare;cazzate su cazzate;.;pl;_;_;greater_plurality/accumulation;nominal
pietra su pietra;yes;su;pietra;costruire;I monaci hanno progettato e costruito;pietra su pietra;, cattedrali e monasteri.;sg;_;_;succession/iteration/distributivity;modifier
posizioni su posizioni;yes;su;posizione;risalire;A quel punto la decisione vincente: si strappa la visiera e incomincia a risalire;posizioni su posizioni;.;pl;_;_;greater_plurality/accumulation;nominal
teglie su teglie;yes;su;teglia;grigliato;Un gigantesco pesce spada grigliato,;teglie su teglie;di parmigiana di melanzane, treccione di mozzarella di bufala, pasta con le zucchine fritte, crocchette ed arancini, una gigantesca torta di panna al limone, sfogliatelle e babà al rhum.;pl;_;_;greater_plurality/accumulation;nominal
pietra su pietra;yes;su;pietra;edificare;Alta tecnologia che non può fare amenodell'uomo: un po 'come il Duomo di Milano: un'opera collettiva, firmata dal popolo che l'ha edificato;pietra su pietra;.;sg;_;_;succession/iteration/distributivity;modifier
barzellette su barzellette;yes;su;barzelletta;sfornare;Ormai, Ennio come un fucile, Athos come una mitraglia, sfornano;barzellette su barzellette;", come si suol dire, prendono il pallino in mano; fra un bicchiere e l'altro, una risata e l'altra, cadono le ultime barriere; ci sentiamo ormai comese fossimo davvero cresciuti tutti insieme; nasce in questa occasione oltrealla sintonia del branco, anche l'intercalare ufficiale della vacanza ""olè... se dobla""!";pl;_;_;greater_plurality/accumulation;nominal
strato su strato;yes;su;strato;formare;La storia poco nota di questa parte di Roma è di straordinario interesse e basterebbe quasi, da sola, a illustrare attraverso quali peripezie militari e religiose si sia venuta formando,;strato su strato;, la città attuale.;sg;_;_;succession/iteration/distributivity;modifier
colpo su colpo;yes;su;colpo;scalpello;"Lavorò tutta la mattina, scavando la pietra con il suo scalpello;";colpo su colpo;, poi stanco, si distese sulle stoppie, vicinoal suo cane accovacciato, che nel sonno bizzarro inseguiva chissà quale preda, emettendo guaiti di cucciolo.;sg;_;_;succession/iteration/distributivity;modifier
odio su odio;yes;su;odio;conseguenza;La logica pretende di farla da padrona e queste sono le inevitabili conseguenze:;odio su odio;.;sg;_;_;greater_plurality/accumulation;nominal
goccia a goccia;yes;a;goccia;sangue;come una ferita che lascia sgorgare il sangue;goccia a goccia;.;sg;_;_;succession/iteration/distributivity;modifier
porta a porta;yes;a;porta;differenziato;"In particolare, anche in Italia ci sono esperienze straordinarie a riguardo, conta la raccolta differenziata """;porta a porta;""", domiciliarizzata, portare il servizio vicino alle famiglie.";sg;_;_;succession/iteration/distributivity;modifier
grado a grado;yes;a;grado;condurre;Catturato dalle sempre più sottili distinzioni e puntualizzazioni che lo conducono;grado a grado;"verso le profondità del microcosmo, il lettore ha la sorpresa di trovarsi alla fine in un terreno che ha le dimensioni dell'universo e un colore umano inconfondibile: E fortuna d'essermi senza volere trovato quasi solo usufruttuario d'un territorio senza confini, in un mondo spezzettato ormai in tante proprietà private, dove non è più palmo che non sia chiuso da cancelli cinto da filo spinato, ringhioso di cani da guardia; desideroso io solo di qualcosa che nessuno mi disputa, nessuno anzi vede (e se chi passa chiede, alla spiegazione sorride incredulo o commiserante).";sg;_;_;succession/iteration/distributivity;modifier
guancia a guancia;yes;a;guancia;stare;Me lo accosto al viso, quasi lo tocco con gli occhi, mentre Zot arriva e stiamo;guancia a guancia;a guardarlo, così vicini che i nostri respiri diventerebbero uno solo, se ci riuscisse respirare.;sg;_;_;juxtaposition/contact;modifier
porta a porta;yes;a;porta;vendita;Alla quale vanno aggiunti ancora un sindacato (Domina: organizzazione dei datori di lavoro domestico), un patronato (Informafamiglia), una società (Rete - Rete) per vendite;porta a porta;.;sg;_;_;succession/iteration/distributivity;modifier
campo a campo;yes;a;campo;meglio;E così, goccia a goccia, o meglio,;campo a campo;e casa a casa, in duemila anni la Chiesa ha potuto accumulare un patrimonio immenso, che nel passato era amministrato dal cosiddetto Obolo di San Pietro, e oggi lo è invece dal Pio Istituto per le Opere di Religione (IOR).;sg;_;_;succession/iteration/distributivity;modifier
bit a bit;yes;a;bit;trasmettere;È compito di quest'ultimo trasmettere,;bit a bit;, l'informazione sul cavo e quindi al destinatario.;sg;_;_;succession/iteration/distributivity;modifier
pezzo a pezzo;yes;a;pezzo;via;Si era riparato in fondo al terrazzo, sotto a un pergolato che il vento stava portandosi via;pezzo a pezzo;, e tutt'insieme non solo il fumo gli si era parato davanti, ma bello e chiaro tutto il vapore, così vicino dentro la lente del cannocchiale che a momenti si vedevano i peli del naso a quelli di bordo.;sg;_;_;succession/iteration/distributivity;modifier
fronte a fronte;yes;a;fronte;trovare;Proprio nel novembre del '95, in occasione di una tavola rotonda nell'aula Nervi sull'etica in presenza di duemila medici cattolici, Giovanni Paolo II ed Andreotti si trovarono;fronte a fronte;e si scambiarono una lunga stretta di mano in un clima di ovazione.;sg;_;_;juxtaposition/contact;modifier
goccia a goccia;yes;a;goccia;sgorgare;Grazie a una saracinesca regolata dall'interno dell'edificio, l'acqua della vasca sgorga;goccia a goccia;dalle fauci muschiate di un ippopotamo in pietra.;sg;_;_;succession/iteration/distributivity;modifier
corpo a corpo;yes;a;corpo;affrontare;Mai prima quei guerrieri avevano affrontato;corpo a corpo;le legioni e non pareva loro vero di sfogare la rabbia a lungo compressa su quei reparti in disfatta, in preda al panico e alla confusione.;sg;_;_;juxtaposition/contact;modifier
corpo a corpo;yes;a;corpo;duello;Pare abbia ucciso di sua mano un ribelle della tribù dei cadusi in un duello;corpo a corpo;.;sg;_;_;juxtaposition/contact;modifier
corpo a corpo;yes;a;corpo;combattimento;Non gli restava che il combattimento;corpo a corpo;.;sg;_;_;juxtaposition/contact;modifier
guancia a guancia;yes;a;guancia;ballare;E ha una canzone del cuore, la canzone che ascoltava da govane quando ballava;guancia a guancia;con Filippo di Grecia, suo futuro sposo, ora Filippo d'Edimburgo e Principe consorte.;sg;_;_;juxtaposition/contact;modifier
pezzo a pezzo;yes;a;pezzo;venire;Fu solo nei mesi successivi che quella barriera, ormai ridotta a monumento di una frontiera che divideva in due una metropoli e un popolo, venne;pezzo a pezzo;sbriciolata.;sg;_;_;succession/iteration/distributivity;modifier
corpo a corpo;yes;a;corpo;combattimento;Essi o lo impegnavano in violenti combattimenti;corpo a corpo;, oppure rimanevano ritti immobili e silenziosi in qualche angolo della casa.;sg;_;_;juxtaposition/contact;modifier
grado a grado;yes;a;grado;venire;Dormo fondo e poi vengo;grado a grado;in superficie, in una specie di ascensione inevitabile da galleggiante di sughero che sale dal fondo melmoso attraverso l'opacità che diventa via via più trasparente fino a proprio sotto il piano argentato tremolante della luce violenta.;sg;_;_;succession/iteration/distributivity;modifier
corpo a corpo;yes;a;corpo;combattimento;I caduti statunitensi erano già più di centomila, vittime in ugual misura del gelido inverno coreano e della maestria dell'esercito cinese nel combattimento;corpo a corpo;e nelle incursioni notturne.;sg;_;_;juxtaposition/contact;modifier
porta a porta;yes;a;porta;quotidiano;La sua storia di origini americane risale agli Anni 40 quando fu adottata dai ragazzi che consegnavano i quotidiani;porta a porta;.;sg;_;_;succession/iteration/distributivity;modifier
corpo a corpo;yes;a;corpo;combattimento;James Buck aveva fatto parte delle SAS, le forze aeree speciali britanniche, e, tra le altre cose, era un esperto di combattimenti;corpo a corpo;e di armi bianche.;sg;_;_;juxtaposition/contact;modifier
porta a porta;yes;a;porta;distribuzione;Poi i certificati verranno consegnati ai vigili che incominceranno la distribuzione;porta a porta;.;sg;_;_;succession/iteration/distributivity;modifier
goccia a goccia;yes;a;goccia;irrigazione;Secondo, meglio usare sistemi di irrigazione;goccia a goccia;, che non quelli a getto nebulizzato inmodoche vi sia un minor consumo d'acqua.;sg;_;_;succession/iteration/distributivity;modifier
guancia a guancia;yes;a;guancia;lui;Avrei voluto poter cucinare al mio lui una costata, sapendo che gli piaceva cotta al punto giusto, poter danzare con lui;guancia a guancia;.;sg;_;_;juxtaposition/contact;modifier
goccia a goccia;yes;a;goccia;svuotare;La fine portava la festa, il maiale si svuotava;goccia a goccia;, in chiesa il prete issava il Cristo infreddolito sulla croce e dava l'ostia ai credenti, le strade si riempivano, sulla terra bianca la chiazza rossa si stendeva con la lentezza delle cose passate, e il mio sguardo non trovava rifugio.;sg;_;_;succession/iteration/distributivity;modifier
corpo a corpo;yes;a;corpo;danza;Il killer - ballerino e le cubiste - prede erano impegnati in una danza;corpo a corpo;molto coinvolgente.;sg;_;_;juxtaposition/contact;modifier
porta a porta;yes;a;porta;condurre;"Un altro vantaggio per i broker è che i potenziali clienti ""visitano"" l'immobile online, liberando il professionista dall'onere di condurre";porta a porta;gli acquirenti interessati.;sg;_;_;succession/iteration/distributivity;modifier
corpo a corpo;yes;a;corpo;uomo;Elias insegnava ai popolani come schierarsi in falange, puntare le picche, affrontare un uomo;corpo a corpo;.;sg;_;_;juxtaposition/contact;modifier
porta a porta;yes;a;porta;e;Oltre agli immancabili call center con contratti a provvigione, tra i casi studiati verranno analizzati i pericoli che si celano nelle offerte per gli impieghi classici, «a domicilio e;porta a porta;"»; ma anche per i lavori che un tempo erano considerati anomali, ma che oggi sono fonte di guadagno per moltissimi giovani, come «quelli che prevedono un corso di formazione a pagamento iniziale, troppo spesso inutile e carissimo».";sg;_;_;succession/iteration/distributivity;modifier
guancia a guancia;yes;a;guancia;brillantina;La tromba è guerresca, angelica, apocalittica, vittoriosa, suona la carica, il sassofono fa ballare bulletti di periferia coi capelli unti di brillantina,;guancia a guancia;con ragazze sudate.;sg;_;_;juxtaposition/contact;modifier
corpo a corpo;yes;a;corpo;scontro;Non possedeva più la pistola e la spranga che aveva trovato si sarebbe rivelata utile solo in uno scontro;corpo a corpo;.;sg;_;_;juxtaposition/contact;modifier
goccia a goccia;yes;a;goccia;parsimonia;La medicina nutriva Malaussene con parsimonia,;goccia a goccia;.;sg;_;_;succession/iteration/distributivity;modifier
corpo a corpo;yes;a;corpo;scontro;Per contro la loro forze e il loro fisico non sono assolutamente adatti nello scontro;corpo a corpo;.;sg;_;_;juxtaposition/contact;modifier
