NPN;construction;preposition;noun;pre_lemma;context_pre;costr;context_post;number_of_noun;Type;other_cxn;meaning;syntactic_function
corpo a corpo;yes;a;corpo;te;"Sto rollando verso di te, balena, tu che tutto distruggi e nulla conquisti; fino all'ultimo lotto con te";corpo a corpo;", e dal cuore dell'inferno ti pugnalo; in nome dell'odio ti sputo addosso l'estremo respiro.";sg;_;_;juxtaposition/contact;modifier
brano a brano;yes;a;brano;cui;"""E siccome era stato portato lì davanti con tutti i suoi paramenti sacerdotali, iniziò un rito in cui";brano a brano;i paramenti gli venivano levati sinoa che rimase in quella vesticciola che a Firenze chiamano cioppa.;sg;_;_;succession/iteration/distributivity;modifier
pezzo a pezzo;yes;a;pezzo;smontare;Quello ottocentesco, in granito scuro, è stato smontato;pezzo a pezzo;e rivenduto agli americani nel 1968, i quali l'hanno rimesso in piedi nel deserto dell'Arizona.;sg;_;_;succession/iteration/distributivity;modifier
goccia a goccia;yes;a;goccia;irrigazione;Sarebbe meglio parlare di irrigazione;goccia a goccia;, quasi indipendente dai meriti dei ricercatori e dal valore del progetto presentato.;sg;_;_;succession/iteration/distributivity;modifier
pezzo a pezzo;yes;a;pezzo;vicenda;Taglienti come affilati bisturi, ci eravamo sezionate a vicenda,;pezzo a pezzo;.;sg;_;_;succession/iteration/distributivity;modifier
porta a porta;yes;a;porta;Spagna;Nella prefazione ho accennato al piccolo libro Dame al Macao di Alberto Arduini, raffinatissimo antiquario romano con negozio prima in via Frattina, poi in piazza di Spagna;porta a porta;con la KeatsShelley Memorial.;sg;_;_;succession/iteration/distributivity;modifier
corpo a corpo;yes;a;corpo;combattere;Nella tradizione cristiana, durante i giorni di Pasqua si legge un versetto in latino che dice in modo mirabile che la vita e la morte combattono;corpo a corpo;.;sg;_;_;juxtaposition/contact;modifier
goccia a goccia;yes;a;goccia;vivere;I suoi occhi sfavillano ora di un desiderio mai visto di vita, di piacere, ora di tristezza profonda, vissuta;goccia a goccia;, una desolazione tanto esausta da sconfinare nell'ironia.;sg;_;_;succession/iteration/distributivity;modifier
corpo a corpo;yes;a;corpo;combattere;Ma anche questa volta per occupare la Città Santa devono combattere;corpo a corpo;con i palestinesi per annientare la resistenza araba.;sg;_;_;juxtaposition/contact;modifier
goccia a goccia;yes;a;goccia;riprendere;Con il tempo la situazione peggiora: lo svuotamento avviene a più riprese,;goccia a goccia;.;sg;_;_;succession/iteration/distributivity;modifier
goccia a goccia;yes;a;goccia;dire;Senza un ordine preciso, ma, come si dice,;goccia a goccia;, mi giungevano, nell'angosciosa notte successiva alla sua morte i ricordi di quelle impressioni della vita familiare che avevo colto allora.;sg;_;_;succession/iteration/distributivity;modifier
corpo a corpo;yes;a;corpo;legare;"Dodici fra loro, originari di Lebbeke, si erano rifugiati nella fattoria di Ottavio Vernulst; essi furono legati";corpo a corpo;e condotti dietro alla fattoria, dove vennero massacrati.;sg;_;_;juxtaposition/contact;modifier
goccia a goccia;yes;a;goccia;usare;"Se, invece, la persona a cui volete regalarlo è come Coco Chanel, che diceva sempreche il profumo va messo ""dove si vuole essere baciate"", preferite un flacone: lo userà";goccia a goccia;.;sg;_;_;succession/iteration/distributivity;modifier
porta a porta;yes;a;porta;venditore;Dopo anni passati prima come venditore;porta a porta;di assicurazioni e di calzature per donne, poi come comparsa in film e serie televisive dimenticabili come Il ritorno dei pomodori assassini e Baby talk, questo è il suo momento.;sg;_;_;succession/iteration/distributivity;modifier
goccia a goccia;yes;a;goccia;solitudine;Erano passati vent'anni e la solitudine,;goccia a goccia;, era filtrata in lei.;sg;_;_;succession/iteration/distributivity;modifier
corpo a corpo;yes;a;corpo;rapido;Inoltre l'uso giudizioso della massa corporea può rappresentare in certe situazioni un vantaggio supplementare non indifferente, per esempio negli incontri rapidi;corpo a corpo;, come nella lotta greco - romana, nel catch, nel sumo.;sg;_;_;juxtaposition/contact;modifier
guancia a guancia;yes;a;guancia;dire;Certo che me ne aveva raccontate di cose, e ricordo benissimo che, durante quei quattro giorni si può dire;guancia a guancia;, a ogni nuova confidenza mi si raddoppiavano i brividi lungo la schiena: perché si fidava tanto, perché si era fidata incondizionatamente di me?;sg;_;_;juxtaposition/contact;modifier
grado a grado;yes;a;grado;Dio;[La scienza politica] chiarisce come scenda la rivelazione da presso Dio,;grado a grado;, fino al primo governante.;sg;_;_;succession/iteration/distributivity;modifier
goccia a goccia;yes;a;goccia;mai;Il libro inizia con queste parole: «La speranza non scende mai;goccia a goccia;.;sg;_;_;succession/iteration/distributivity;modifier
corpo a corpo;yes;a;corpo;lotta;I colpi sono stati sparati durante la lotta,;corpo a corpo;.;sg;_;_;juxtaposition/contact;modifier
bit a bit;yes;a;bit;or;Esegue l 'operazione di OR;bit a bit;tra i due operandio specificati, ponendo il risultato nel secondo.;sg;_;_;succession/iteration/distributivity;modifier
porta a porta;yes;a;porta;vendere;Quando si riprese, Ron andò a vendere;porta a porta;i prodotti della Rawleigh come suo padre.;sg;_;_;succession/iteration/distributivity;modifier
corpo a corpo;yes;a;corpo;impatto;Come dice Manuel Estiarte, il più forte pallanuotista di tutti i tempi: «È vero, bisogna calcolare che le probabilità che Messi esca sconfitto da un impatto;corpo a corpo;sono elevate, come elevato è il rischio che venga totalmente travolto dai difensori.;sg;_;_;juxtaposition/contact;modifier
brano a brano;yes;a;brano;rischiare;È sensibile ai tentativi dei poeti di rischiarare;brano a brano;l'ancora vasta oscurità delle cose non dette.;sg;_;_;succession/iteration/distributivity;modifier
porta a porta;yes;a;porta;vendita;Un trucchetto che mi ha insegnato un mio ex che faceva vendite;porta a porta;non so più di cosa.;sg;_;_;succession/iteration/distributivity;modifier
guancia a guancia;yes;a;guancia;cheek;"Azzurro Caltagirone è a un tavolo ""cheek to cheek"",";guancia a guancia;con il pretone.;sg;_;_;juxtaposition/contact;modifier
corpo a corpo;yes;a;corpo;combattere;Qualche scettico si domanderà come mai il comando americano mandi un preziosissimo marconista navajo a combattere;corpo a corpo;contro il nemico, con il rischio che lo catturino.;sg;_;_;juxtaposition/contact;modifier
porta a porta;yes;a;porta;venditore;L'Ambiente oggi cerca 20 distributori (uno per ogni regione) più venditori;porta a porta;in tutta Italia.;sg;_;_;succession/iteration/distributivity;modifier
donne su donne;no;su;donna;ponderare;"La vedo più come una presa di posizione forte, anche piuttosto ponderata; il fatto che nel filmato ci sia principalmente violenza di";donne su donne;ha abilmente evitato che eventuali polemiche di genere potessero sviare dalla violenza come concetto assoluto.;pl;thematic_target;no;distractor;_
Italia su Italia;no;su;Italia;in;"Una curiosità: Sandra Vidal ha partecipato alla versione americana del programma "" Popstars "", trasmesso anche in";Italia su Italia;1.;X;proper_name_inglobation;no;distractor;_
3 su 3;no;su;3;con;Da segnalare anche un ottima prestazione di Cazzulo con;3 su 3;da due e 2 su 2 dalla lunetta, in momenti importanti della gara.;X;NumPNum;no;distractor;_
3 su 3;no;su;3;fecondare;Per nostra fortuna sono stati fecondati;3 su 3;, il 100 %, pronti per essere impiantati in utero.;X;NumPNum;no;distractor;_
punto su punto;no;su;punto;data;Punto croce ricamo una data;punto su punto; giù indico traccia di trama merletto finito.;sg;NsuNgiù;yes;distractor;_
2 su 2;no;su;2;con;Tra le file dell' Hintegra realizzano le migliori prestazioni offensive Simone Vichi con;2 su 2;e Victor Lopez con 2 su 4.;X;NumPNum;no;distractor;_
uomini su uomini;no;su;uomo;di;Per un verso, infatti, essa esclude qualsiasi analogia mimetica tra la sovranità di Dio e la sovranità di;uomini su uomini;(significato politico-critico dell'immagine trinitaria di Dio).;pl;thematic_target;no;distractor;_
mente su mente;no;su;mente;parte;"Il credersi ""separati"" in più parti (";mente su mente;"giù, corpo questo e corpo quell'altro, questo è meglio e quello è peggio) è solo il frutto d'una visione ""schizofrenica"".";sg;NsuNgiù;yes;distractor;_
54 su 54;no;su;54;disponibile;La formazione pugliese è, assieme al Torino, la squadra che ha usufruito fino a questo momento di tutti i cambi disponibili;54 su 54;.;X;NumPNum;no;distractor;_
3 su 3;no;su;3;bene;Premetto che la scart è una 21 poli e ne ho provate ben;3 su 3;"televisori diversi, ma nulla da fare; pare che dalla scart del dvd non esca il seganle video ... cosa posso fare?";X;NumPNum;no;distractor;_
Sciascia su Sciascia;no;su;Sciascia;di;Ha curato l'edizione del Quaderno dell'Associazione Amici di;Sciascia su Sciascia;eretico del genere giallo (La vita felice, 2006) e la prefazione dell'edizione italiana de Il controllo della parola di André Schiffrin (Bollati Boringhieri, 2006).;X;proper_name_inglobation;no;distractor;_
justin su justin;no;su;justin;là;belibers.....cazzo calmatevi fate paura....justin di qua justin di là;justin su justin;giù!;X;NsuNgiù;yes;distractor;_
Italia su Italia;no;su;Italia;in;Ricordiamo che Futurama è partita in America sul network FOX il 28 marzo 1999, ed ha esordito in;Italia su Italia;1 in prima serata alle 20.45 il 6 gennaio 2000.;sg;proper_name_inglobation;no;distractor;_
uomini su uomini;no;su;uomo;di;Perché ogni governo è di;uomini su uomini;.;pl;thematic_target;no;distractor;_
Christine su Christine;no;su;Christine;cantare;"Nel 1969 anche i Nomadi si dedicano al ""trans"", cantano";Christine su Christine;Jorgensen, una transessuale famosa dal 1952, fotografa, attrice e cantante.;X;proper_name_inglobation;no;distractor;_
8 su 8;no;su;8;infilare;Un giorno si ritrova al campetto, tira fuori il pallone e infila;8 su 8;da tre punti: la mano è guarita.;X;NumPNum;no;distractor;_
jeans su jeans;no;su;jeans;di;Quindi abbinare un capo di questo tipo è, sottinteso, che sarà più facile di una semplice camicia di;jeans su jeans;elegante oppure un giabbottino.;sg/pl;N_extended;no;distractor;_
vacche su vacche;no;su;vacca;caricare;È suo il conio del palidromo accavallavacca (strumento per caricare;vacche su vacche;", o vacche su cavalli; vedi anche alle voci lavacavalli e vacca).";pl;thematic_target;no;distractor;_
4 su 4;no;su;4;distanza;Nonostante un opaco Sandro Cherubini (solo 4 i punti del centro della Nazionale italiana), Sassari ha potuto contare su un infallibile Caine dalla lunga distanza (;4 su 4;dalla linea dei 3 punti e 22 i punti totali del britannico) e sui punti di Eveson (25) e Kohlstrom (16), dominatori della lunetta.;X;NumPNum;no;distractor;_
18 su 18;no;su;18;compatto;La serie A ha votato compatta,;18 su 18;- afferma Galliani - per il ' lodo' che ha preso il mio nome, che prevedeva 3 retrocessioni dalla A e 5 promozioni dalla B, e dall' anno prossimo a regime 3 retrocessioni e 3 promozioni.;X;NumPNum;no;distractor;_
6 su 6;no;su;6;essere;No perchè 7 su 9 di jones non è che succede sempre, considerando anche il fatto che fino ad un certo punto era;6 su 6;.;X;NumPNum;no;distractor;_
km su km;no;su;km;poi;e non può che migliorare col tempo, poi;km su km;giù porto pazienza.;sg/pl;NsuNgiù;yes;distractor;_
4 su 4;no;su;4;libero;Raccoglie punti solamente nei tiri liberi (;4 su 4;) perché la soluzione dalla distanza sembra non baciarlo più, anche in gare facili come questa: su 4 da tre.;X;NumPNum;no;distractor;_
4 su 4;no;su;4;estivo;Risultato, al ritorno dopo l' operazione estiva,;4 su 4;da dove conta tre.;X;NumPNum;no;distractor;_
40 su 40;no;su;40;voto;Poi è il turno di Nintendogs, il perfect score di Famitsu (voto;40 su 40;), dopo aver conquistato il mercato nipponico, si prepara ad invadere anche quelli occidentali.;X;NumPNum;no;distractor;_
uomini su uomini;no;su;uomo;di;"Lo stato è così dunque ""un rapporto di potere di";uomini su uomini;", fondato sul mezzo dell'uso della forza legittima"" (si veda ""Economia e Società"", Milano 1961).";pl;thematic_target;no;distractor;_
4 su 4;no;su;4;un;Il suo score recita un;4 su 4;dalla grande distanza e 13 punti nei 13 minuti decisivi per affossare definitivamente la Scavolini.;X;NumPNum;no;distractor;_
ferro su ferro;no;su;ferro;di;Il valore del coefficiente di a. volvente del;ferro su ferro;"è per es. 0,005; quello radente, 0,21; l' a. volvente della gomma su strada, 0,02; quello radente, 0,07.";sg;N_extended;no;distractor;_
Sky su Sky;no;su;Sky;di;"È possibile acquistare entrambe le offerte ""Vodafone TV + NOW TV Intrattenimento"" e ""Vodafone TV Sport"" per avere accesso sia allo sport di";Sky su Sky;Sport Mix che all'entertaniment televisivo con il Ticket Intrattenimento di NOW TV.;X;proper_name_inglobation;no;distractor;_
capelli su capelli;no;su;capello;di;Quindi, ad esempio, lo stesso taglio di;capelli su capelli;lisci e ricci apparirà completamente diverso. pertanto quando scegli un taglio di capelli, oltre al tipo di viso, considera anche il tipo di capelli.;pl;N_extended;no;distractor;_
24 su 24;no;su;24;disponibile;Tale contenitore poi, grazie alla tecnologia e software di ultima generazione, è disponibile;24 su 24;online e aggiornato in tempo reale, permettendo così ai potenziali clienti di visionare gli immobili direttamente da casa o ufficio, e ai collaboratori del gruppo sparsi in Italia o all' estero di consultare e fornire proposte svincolate dal limite della territorialità di competenza.;X;NumPNum;no;distractor;_
periodi su periodi;no;su;periodo;avere;Tornando al banco,devo dire che i suoi dischi li amo tuttora,certo hanno avuto;periodi su periodi;ma son sempre stati più che dignitosi.;pl;NsuNgiù;yes;distractor;_
uomini su uomini;no;su;uomo;di;E quanto andiamo studiando ci insegna che le società organizzate, precedenti a quelle classiste, precedenti quindi alla comparsa della schiavitù e di ogni sfruttamento di;uomini su uomini;, accumulavano una straordinaria quantità di energia e l'applicavano alla modifica dell'ambiente (edifici monumentali, infrastrutture, produzione materiale) senza spezzarne l'equilibrio.;pl;thematic_target;no;distractor;_
100 su 100;no;su;100;di;Il valore modale ottenuto è di;100 su 100;, questo è quindi il valore che ricorre più frequentemente.;X;NumPNum;no;distractor;_
4 su 4;no;su;4;4;Dopo gara 4 i Knicks avranno degli incubi formato Kenyon Martin per tutta l' estate: altra doppia doppia (4;4 su 4;partite), ma quasta volta i punti sono 36.;X;NumPNum;no;distractor;_
6 su 6;no;su;6;femmina;Utilizzarono questa possibilità soprattutto le femmine (;6 su 6;), ma anche alcuni maschi (4 su 12), quindi nel complesso poco più del 50 % della classe.;X;NumPNum;no;distractor;_
Android su Android ;no;su;Android ;di;Attualmente è necessario impostare la versione minima di;Android su Android;7,0 (API 24-torrone) per distribuire l'app in dispositivi o emulatori torrone Android.;X;proper_name_inglobation;no;distractor;_
bandiere su bandiere;no;su;bandiera;dire;"Come se ci fosse bisogno di una voce dall' alto che dica""";bandiere su bandiere;" giù"".";pl;NsuNgiù;yes;distractor;_
90 su 90;no;su;90;a;Una volta fatto il gruppo (non esagerare con le unita' di supporto tanto, tra quelle in difesa e quelle prodotte sarai quasi a;90 su 90;) prendi la strada in alto a destra.;X;NumPNum;no;distractor;_
6 su 6;no;su;6;di;Sarà ricordata come la stagione del;6 su 6;: l' intera pallavolo bellunese è retrocessa.;X;NumPNum;no;distractor;_
Venezia su Venezia;no;su;Venezia;di;Pubblicazione di alcune foto di;Venezia su Venezia;Radio TV e Venetian Holiday.;X;proper_name_inglobation;no;distractor;_
uomini su uomini;no;su;uomo;di;Dall'inizio degli anni Novanta è diminuito il numero di omicidi di;uomini su uomini;"mentre il numero di donne uccise da uomini è aumentato: l'intensità e il grado di diffusione di episodi di violenza e abuso nei confronti delle donne sono tali da aver suggerito il conio del termine ""femminicidio"".";pl;thematic_target;no;distractor;_
uomini su uomini;no;su;uomo;di;Sono sempre segno di un'ingiustizia regnante, di oppressione di;uomini su uomini;.;pl;thematic_target;no;distractor;_
ASCO su ASCO;no;su;ASCO;di;Ulteriori informazioni Per ulteriori informazioni, vedi il meeting virtuale di;ASCO su ASCO;OnLine (www.asco.org), che contiene tutti gli abstract degli studi presentati alla conferenza.;X;proper_name_inglobation;no;distractor;_
uomini su uomini;no;su;uomo;da;Un crimine non certo benedetto da un Dio, ma fatto da;uomini su uomini;(l' orrore, vedi 1945).;pl;thematic_target;no;distractor;_
Saturno su Saturno;no;su;Saturno;di;Con il transito di ritorno di ;Saturno su Saturno;"natale ti potrebbe creare solo una certa ""accettazione"" e crescita nel campo descritto.";X;N_extended;no;;_
uomo su uomo;no;su;uomo;di;Con lo spargimento di sangue innocente (sopruso di;uomo su uomo;) che ne consegue.;sg;thematic_target;no;distractor;_
8 su 8;no;su;8;tre;Gioca 29' e chiude con 20 punti, 0 su 2 da due, 4 su 7 da tre,;8 su 8;ai tiri liberi, ben 5 rimbalzi, 4 assist, 25 di valutazione.;X;NumPNum;no;distractor;_
100 su 100;no;su;100;e;Anni dopo Bernardini ripropone lo stesso quesito in una scuola elementare, e;100 su 100;"rispondono: "" 50 anni """;X;NumPNum;no;distractor;_
2 su 2;no;su;2;con;Il MF salernitano si è portato da solo al comando con;2 su 2;, poi ha perso con Braga, ma la vittoria al sesto turno con Belotti lo ha ricatapultato da solo al primo posto a quota 4.5 su 6.;X;NumPNum;no;distractor;_
uomini su uomini;no;su;uomo;di;"Come sottolineavano i compagni tedeschi delle Cellule Rivoluzionarie: ""Noi crediamo che la guerra totale contro il sistema di dominio di";uomini su uomini;acchiuda in se stessa contemporaneamente e in egual misura la lotta contro il sistema capitalistico che è in noi stessi.;pl;thematic_target;no;distractor;_
19 su 19;no;su;19;positivo;L' Inter respira: allarme rientrato sullo stop di Vieri Vuelta, un danese vola sui Pirenei Frigo 4 ° in classifica Rugby, radiata squadra rumena: positivi;19 su 19;Maradona-doping, Boniek conferma.;X;NumPNum;no;distractor;_
uomo su uomo;no;su;uomo;di;cioè quando si abolirà non solo il concetto di proprieta' di uomo su uomo (schiavitu') ma anche quello di SERVITU' di;uomo su uomo;(noleggio, prostituzione, o come chiamo io, SERVIZIONE).;sg;thematic_target;no;distractor;_
jeans su jeans;no;su;jeans;di;Il trucco è prevalentemente uno, non eccedere con i colori, quindi se indossate una giacca di;jeans su jeans;blu dovranno avere lo stesso colore.;sg/pl;N_extended;no;distractor;_
7 su 7;no;su;7;un;Sta meglio il secondo anno (43 partite, 11,3 di medie), quando spara un;7 su 7;da tre al Madison Square Garden di New York.;X;NumPNum;no;distractor;_
7 su 7;no;su;7;con;Lo fa in modo incontestabile: chiude con;7 su 7;dai 6.25 mt per un totale di 29 punti, il tutto in sola metà gara.;X;NumPNum;no;distractor;_
Berlinguer su Berlinguer;no;su;Berlinguer;di;Si potrebbe provare A ragionare di;Berlinguer su Berlinguer;a partire da alcuni grandi punti del suo pensiero.;X;thematic_target;no;distractor;_
strada su strada;no;su;strada;di;In tal modo l'aquaplaning viene scongiurato e la tenuta di;strada su strada;bagnata e innevata è ottimale.;sg;N_extended;no;distractor;_
2 su 2;no;su;3;e;Da segnalare anche un ottima prestazione di Cazzulo con 3 su 3 da due e;2 su 2;dalla lunetta, in momenti importanti della gara.;X;NumPNum;no;distractor;_
37 su 37;no;su;37;essere;Nella votazione delle due di notte eravamo;37 su 37;e alla fine è scoppiato un applauso.;X;NumPNum;no;distractor;_
paese a paese;no;a;paese;da;Sempre nell'ambito dei paesi industrializzati, il ricordato aumento della crescita reale derivante dai processi di innovazione tecnologica e di globalizzazione si è riflesso sull'occupazione in modo diverso da;paese a paese;.;sg;PNPN;yes;distractor;_
donna a donna;no;a;donna;da;"Ai margini di un recente convegno sulla giustizia minorile, una procuratore aggiunta raccontava ""da";donna a donna;""" una storia che però non poteva mettere nelle sue relazioni ufficiali, la storia di Miriam, una bambina nordafricana di 11 anni, e di Carla, la sua compagna di banco italiana.";sg;PNPN;yes;distractor;_
periodo a periodo;no;a;periodo;da;Interessanti, poi, gli articoli di fine serie, scontatissimi, che varieranno da;periodo a periodo;.;sg;PNPN;yes;distractor;_
uomo a uomo;no;a;uomo;da;"Questa trasformazione, ipotizzano gli studiosi, ""potrebbe essere dovuta a variazioni o nelle capacità del virus di trasmettersi da";uomo a uomo;", o nelle caratteristiche della popolazione prevalentemente infettata"".";sg;PNPN;yes;distractor;_
ente a ente;no;a;ente;da;Bergoglio sollecita una maggiore mobilità da;ente a ente;, blocca gli straordinari, i rinnovi dei contratti a tempo determinato, i nuovi incarichi professionali, i passaggi di livello e, ovviamente, le assunzioni.;sg;PNPN;yes;distractor;_
individuo a individuo;no;a;individuo;da;La mancanza di equilibrio tra le due culture, umanistica e scientifica, ha rallentato in passato la trasmissione del sapere da;individuo a individuo;nella collettività, favorendo la fuga dei migliori ingegni verso lidi più accoglienti.;sg;PNPN;yes;distractor;_
uomo a uomo;no;a;uomo;da;Possiamo avere una conversazione educata, da;uomo a uomo;, oppure devo farti strappare di bocca altre parole dai miei uomini?;sg;PNPN;yes;distractor;_
paese a paese;no;a;paese;da;Tuttavia questi tassi di infezione da HIV variano notevolmente da;paese a paese;, dall'1% in Inghilterra, Irlanda e Galles al 32% in Spagna, ma anche all'interno di uno stesso Stato, tra regioni e città.;sg;PNPN;yes;distractor;_
specie a specie;no;a;specie;da;Per esempio, se siete contrari per i motivi più disparati, anche religiosi, a un trasferimento di geni da;specie a specie;, ora sapete che dovete distinguere tra OGM e OGM.;sg;PNPN;yes;distractor;_
uomo a uomo;no;a;uomo;da;"""È solo una questione di tempo"", secondo Webster, e il virus H5N1, prima o poi, farà il salto della specie, propagandosi da";uomo a uomo;.;sg;PNPN;yes;distractor;_
uomo a uomo;no;a;uomo;da;"""Ciò indica che la trasmissione del virus è possibile anche da";uomo a uomo;""", ma in quest'ultimo caso l'efficacia del contagio è scarsa, ha precisato Margaret Chan.";sg;PNPN;yes;distractor;_
uomo a uomo;no;a;uomo;da;Queste forme di sapere «tecnico» vengono tramandate da;uomo a uomo;, da adulto a giovane, e fanno parte degli insegnamenti che i ragazzi ricevono nella «casa degli uomini».;sg;PNPN;yes;distractor;_
donna a donna;no;a;donna;da;Il deficit estrogenico ha una serie di effetti a breve, medio e lungo termine differenti per incidenza da;donna a donna;in base anche a fattori costituzionali e socio-ambientali ma comunque capaci in molti casi di minare gravemente lo stato di salute generale attraverso il danneggiamento di numerosi organi ed apparati (cardiovascolare, nervoso, cutaneo, osseo, uro - genitale).;sg;PNPN;yes;distractor;_
specie a specie;no;a;specie;da;Il periodo di gestazione varia da;specie a specie;, da 3 o 4 settimane per i più piccoli roditori fino a 21 mesi per l'elefante.;sg;PNPN;yes;distractor;_
paese a paese;no;a;paese;da;Le restrizioni sull'esportazione variano da;paese a paese;.;sg;PNPN;yes;distractor;_
paese a paese;no;a;paese;da;"In effetti il significato delle parole ""edizione"" e ""libro"" differiscono non soltanto da continente a continente, ma anche da";paese a paese;.;sg;PNPN;yes;distractor;_
affetto a affetto;no;a;affetto;da;Diventiamo veramente gli epiteti che ci vengono spinti sotto il muso, i nomignoli, le dolci cime lanciate da;affetto a affetto;mentre tutto ondeggia e tra di noi c'è nebbia, quell'aria che si palpa e da noi nasce come da curve portuali, quell'aria dai calori ascellari, e noi diventiamo la cosa che sembriamo a chi ci dice cosa, quando quelle visioni mosse e volatili si fermano concrete e solide, fatte di materia comune, e si presentano come una esposizione da mercato, da bancarella.;sg;PNPN;yes;distractor;_
uomo a uomo;no;a;uomo;da;Essi non possono più guardare negli occhi un altro, da;uomo a uomo;"; possono invece infondere in un altro la forza di divenire ""più"" di loro.";sg;PNPN;yes;distractor;_
individuo a individuo;no;a;individuo;da;Di conseguenza, mentre il modo di guardare una immagine ferma varia molto da;individuo a individuo;, il modo di guardare un film è piuttosto uniforme: tutti gli spettatori tendono a esplorare l'immagine in moto nello stesso modo.;sg;PNPN;yes;distractor;_
paese a paese;no;a;paese;da;Il contributo della mutualità al finanziamento dell'assicurazione di disoccupazione è variabile da;paese a paese;e nel tempo.;sg;PNPN;yes;distractor;_
bambino a bambino;no;a;bambino;da;Eppure non è mai stato provato un caso al mondo di contagio da;bambino a bambino;.;sg;PNPN;yes;distractor;_
individuo a individuo;no;a;individuo;da;Zika è un virus che si trasmette da;individuo a individuo;principalmente attraverso un vettore: le zanzare di tipo Aedes.;sg;PNPN;yes;distractor;_
donna a donna;no;a;donna;da;Ma se vuole un consiglio da;donna a donna;non lo farei.;sg;PNPN;yes;distractor;_
paese a paese;no;a;paese;industriale;" ma la risposta è diversa da""";paese a paese;.;sg;PNPN;yes;distractor;_
specie a specie;no;a;specie;da;Gli occhi e le capacità visive dei rettili variano da;specie a specie;.;sg;PNPN;yes;distractor;_
uomo a uomo;no;a;uomo;da;Che fecero conoscenza con Fritz Schependonk, il vicino, il quale li prese per una coppia clandestina e confidò a Jan, da;uomo a uomo;", che mirava a una bionda diciottenne; lui, Jan, pensava che poteva sperarci?";sg;PNPN;yes;distractor;_
uomo a uomo;no;a;uomo;da;Poi smise di correre e mi salutò da;uomo a uomo;.;sg;PNPN;yes;distractor;_
