NPN;construction;preposition;noun;pre_lemma;context_pre;costr;context_post;number_of_noun;Type;other_cxn;meaning;syntactic_function
volta a volta;yes;a;volta;quello;In fondo, la crisi dell'università è il prodotto di due silenzi: uno è quello,;volta a volta;connivente, frustrato, desensibilizzato, del mondo accademico stesso, che vede e soffre le pecche del sistema e dei comportamenti, ma non sa uscirne con proposte generali e comportamenti adeguati.;sg;_;_;succession/iteration/distributivity;modifier
pezzo a pezzo;yes;a;pezzo;smontare;Quello ottocentesco, in granito scuro, è stato smontato;pezzo a pezzo;e rivenduto agli americani nel 1968, i quali l'hanno rimesso in piedi nel deserto dell'Arizona.;sg;_;_;succession/iteration/distributivity;modifier
porta a porta;yes;a;porta;raccogliere;Entro fine anno il vetro si raccoglierà;porta a porta;.;sg;_;_;succession/iteration/distributivity;modifier
corpo a corpo;yes;a;corpo;rapido;Inoltre l'uso giudizioso della massa corporea può rappresentare in certe situazioni un vantaggio supplementare non indifferente, per esempio negli incontri rapidi;corpo a corpo;, come nella lotta greco - romana, nel catch, nel sumo.;sg;_;_;juxtaposition/contact;modifier
corpo a corpo;yes;a;corpo;combattimento;James Buck aveva fatto parte delle SAS, le forze aeree speciali britanniche, e, tra le altre cose, era un esperto di combattimenti;corpo a corpo;e di armi bianche.;sg;_;_;juxtaposition/contact;modifier
corpo a corpo;yes;a;corpo;combattimento;Non gli restava che il combattimento;corpo a corpo;.;sg;_;_;juxtaposition/contact;modifier
muro a muro;yes;a;muro;stare;A Lucas Avenue guardavamo dall'alto in basso quelle disgraziate nei casini di Chestnut o di Market Strect, che stavano;muro a muro;con i teatri di varietà, le case da gioco dove un bullo poteva tentare la fortuna al faro o ad altri giochi, trovare qualsiasi tipo di liquore, e soddisfare qualunque capriccio sessuale.;sg;_;_;juxtaposition/contact;modifier
porta a porta;yes;a;porta;differenziato;Al via la raccolta differenziata a Molini, Girola e Valtenna Mercoledì 18 dicembre inizia il nuovo servizio di raccolta differenziata -;porta a porta;nei quartieri Molini, Girola e Valtenna.;sg;_;_;succession/iteration/distributivity;modifier
corpo a corpo;yes;a;corpo;legare;"Dodici fra loro, originari di Lebbeke, si erano rifugiati nella fattoria di Ottavio Vernulst; essi furono legati";corpo a corpo;e condotti dietro alla fattoria, dove vennero massacrati.;sg;_;_;juxtaposition/contact;modifier
corpo a corpo;yes;a;corpo;combattimento;I caduti statunitensi erano già più di centomila, vittime in ugual misura del gelido inverno coreano e della maestria dell'esercito cinese nel combattimento;corpo a corpo;e nelle incursioni notturne.;sg;_;_;juxtaposition/contact;modifier
corpo a corpo;yes;a;corpo;lotta;La caccia a cavallo o a piedi, la lotta;corpo a corpo;, i combattimenti dei galli erano quanto deliziava la gente e tutte queste attività si concludevano con solenni bevute.;sg;_;_;juxtaposition/contact;modifier
porta a porta;yes;a;porta;vendita;Un trucchetto che mi ha insegnato un mio ex che faceva vendite;porta a porta;non so più di cosa.;sg;_;_;succession/iteration/distributivity;modifier
volta a volta;yes;a;volta;essere;Una ulteriore complicazione dello schema risulterebbe se considerassimo come i destinatari grammaticali delle ottave dei poeti possano essere;volta a volta;, e anche nella medesima ottava, il proprio antagonista o il pubblico medesimo.;sg;_;_;succession/iteration/distributivity;modifier
volta a volta;yes;a;volta;cui;Mangi, beva, dorma, suoni, lavori o vada a spasso con la sua splendida ragazza tunisina, qualunque cosa faccia, non sopporta di essere distratto da ciò in cui,;volta a volta;, è impegnato.;sg;_;_;succession/iteration/distributivity;modifier
porta a porta;yes;a;porta;venditore;Dopo anni passati prima come venditore;porta a porta;di assicurazioni e di calzature per donne, poi come comparsa in film e serie televisive dimenticabili come Il ritorno dei pomodori assassini e Baby talk, questo è il suo momento.;sg;_;_;succession/iteration/distributivity;modifier
porta a porta;yes;a;porta;enciclopedia;Annunci del genere, sui giornali italiani, ormai riguardano solo i venditori di enciclopedie;porta a porta;.;sg;_;_;succession/iteration/distributivity;modifier
porta a porta;yes;a;porta;estorsione;I Giuliano sembrano un clan giunto al capolinea, lentamente emerso dalla miseria, dal contrabbando alle puttane, dalla gestione dell'estorsione;porta a porta;ai rapimenti.;sg;_;_;succession/iteration/distributivity;modifier
porta a porta;yes;a;porta;distribuzione;Poi i certificati verranno consegnati ai vigili che incominceranno la distribuzione;porta a porta;.;sg;_;_;succession/iteration/distributivity;modifier
corpo a corpo;yes;a;corpo;danza;Il killer - ballerino e le cubiste - prede erano impegnati in una danza;corpo a corpo;molto coinvolgente.;sg;_;_;juxtaposition/contact;modifier
volta a volta;yes;a;volta;dovere;Un agente di cambio, un venditore, una segretaria, un dirigente delle ferrovie, un professore universitario, un direttore d'albergo, devono;volta a volta;offrire un tipo di personalità diverso che, indipendentemente dalle differenze tra l'una e l'altra, deve rispondere sempre a una condizione: essere richiesto.;sg;_;_;succession/iteration/distributivity;modifier
porta a porta;yes;a;porta;distribuzione;"Si tratta di vendere questi prodotti attraverso il multilevel marketing, la cosiddetta distribuzione """;porta a porta;""" che funziona attraverso un efficace passa - parola e che permette di guadagnare anche su ogni persona che si riesce a reclutare.";sg;_;_;succession/iteration/distributivity;modifier
volta a volta;yes;a;volta;opportunamente;L'intento spiccatamente divulgativo non impedisce di raggiungere l'obiettivo di fornire una panoramica aggiornata e precisa, anche dal punto di vista quantitativo, di tutti questi fenomeni, rinviando opportunamente,;volta a volta;, alle fonti e alle indagini più approfondite pertinenti i diversi temi trattati.;sg;_;_;succession/iteration/distributivity;modifier
volta a volta;yes;a;volta;essere;I contributi alla comune cultura europea possono essere;volta a volta;preziosissimi come nel caso della libreria di Jim Stirling nei giardini della Biennale di Venezia o invece di una disarmante superficialità come nelcaso del progetto vincitore della nuova uscita del museo degli Uffizi a Firenze.;sg;_;_;succession/iteration/distributivity;modifier
pezzo a pezzo;yes;a;pezzo;venire;Fu solo nei mesi successivi che quella barriera, ormai ridotta a monumento di una frontiera che divideva in due una metropoli e un popolo, venne;pezzo a pezzo;sbriciolata.;sg;_;_;succession/iteration/distributivity;modifier
pezzo a pezzo;yes;a;pezzo;smontare;E vabbè, ma che significa, che la riforma Fornero resterà così com'è o verrà smontata;pezzo a pezzo;?;sg;_;_;succession/iteration/distributivity;modifier
porta a porta;yes;a;porta;firma;Scompariranno le sue leggendarie ma costose campagne per il finanziamento, durante le quali migliaia di militanti stipendiati raccoglievano soldi e firme;porta a porta;.;sg;_;_;succession/iteration/distributivity;modifier
corpo a corpo;yes;a;corpo;battaglia;La guerriglia urbana, la battaglia;corpo a corpo;nelle strade della capitale è proprio quello che al Pentagono vogliono evitare.;sg;_;_;juxtaposition/contact;modifier
braccio a braccio;yes;a;braccio;sviluppare;Primo edificio per la musica progettato dallo studio di Michel Rojkind, è il frutto di un processo progettuale sviluppato;braccio a braccio;con la direzione dell'Orchestra: le scelte riguardanti il tipo di sala, il numero di sedute e le destinazioni funzionali degli ambienti sono dunque condivise e volute dai successivi inquilini dello spazio.;sg;_;_;juxtaposition/contact;modifier
80 su 80;no;su;80;prendere;Faccia presente che anche se tutta la gente sapesse le cose benissimo, da prendere;80 su 80;comunque tantissima gente dovrebbe tornare a casa.;X;NumPNum;no;distractor;_
2 su 2;no;su;2;vittoria;La partecipazione è sempre stata sinonimo di vittoria:;2 su 2;con i trionfi del 1985 e 1996.;X;NumPNum;no;distractor;_
sedia su sedia;no;su;sedia;esempio;Le ragioni della priorità psicologica di, per esempio,;sedia su sedia;"a dondolo o mobilio sono percettive e morfologiche (percepiamo una sedia come una gestalt unitaria più facilmente del mobilio; associamo più facilmente un’immagine al livello base che agli altri), funzionali (abbiamo un programma motorio generale per interagire con le sedie, ma non con il mobilio), linguistiche e comunicative (il livello base contiene in media più attributi e dà più informazioni degli altri), di apprendimento (i bambini imparano prima i termini del livello base; inoltre spesso i termini del livello base sono più brevi e meno complessi degli altri).";sg;N_extended;no;distractor;_
donne su donne;no;su;donna;di;Così in quegli anni le esperienze di lavoro di;donne su donne;con sofferenza psichiatrica, se da una parte sollevarono alcune delle questioni dell'esser donna, dall'altra lasciarono immutato il manicomio e tanto piu' le donne che in quello continuavano ad essere recluse, non riuscendo ad arrivare al nocciolo della psichiatria, ne' tanto piu' arrivando a restituire al sociale, al sociale della comunita' femminile, la sua sofferenza.;pl;thematic_target;no;distractor;_
18 su 18;no;su;18;compatto;La serie A ha votato compatta,;18 su 18;- afferma Galliani - per il ' lodo' che ha preso il mio nome, che prevedeva 3 retrocessioni dalla A e 5 promozioni dalla B, e dall' anno prossimo a regime 3 retrocessioni e 3 promozioni.;X;NumPNum;no;distractor;_
uomini su uomini;no;su;uomo;di;Dall'inizio degli anni Novanta è diminuito il numero di omicidi di;uomini su uomini;"mentre il numero di donne uccise da uomini è aumentato: l'intensità e il grado di diffusione di episodi di violenza e abuso nei confronti delle donne sono tali da aver suggerito il conio del termine ""femminicidio"".";pl;thematic_target;no;distractor;_
jeans su jeans;no;su;jeans;di;Quindi abbinare un capo di questo tipo è, sottinteso, che sarà più facile di una semplice camicia di;jeans su jeans;elegante oppure un giabbottino.;sg/pl;N_extended;no;distractor;_
app su app;no;su;app;di;Per quanto riguarda la connessione mobile, 3g o 4g, le cose sono più complesse perché apple non permette di farlo nativamente, né naturalmente permette la presenza di;app su app;store che lo facciano per noi.;sg/pl;proper_name_inglobation;no;distractor;_
24 su 24;no;su;24;trasmettere;"Un ospedale di Pittsburgh fornisce addirittura una stazione televisiva chiamata ""Humor Helps Healing"" (l'umorismo aiuta a guarire), che trasmette";24 su 24;", mentre in South Carolina, i ""terapisti dell' umorismo"" hanno formato la Carolina Humour and Healing Association (HaHa).";X;NumPNum;no;distractor;_
6 su 6;no;su;6;contenere;Osimo ha totalizzato 10 su 10 per quel che concerne i contenuti,;6 su 6;per la programmazione, 6 su 7 per l' originalità e 6 su 7 per la grafica.;X;NumPNum;no;distractor;_
uomini su uomini;no;su;uomo;di;E quanto andiamo studiando ci insegna che le società organizzate, precedenti a quelle classiste, precedenti quindi alla comparsa della schiavitù e di ogni sfruttamento di;uomini su uomini;, accumulavano una straordinaria quantità di energia e l'applicavano alla modifica dell'ambiente (edifici monumentali, infrastrutture, produzione materiale) senza spezzarne l'equilibrio.;pl;thematic_target;no;distractor;_
base su base;no;su;base;di;Nella vita di tutti i giorni un lavaggio di;base su base;mensile è sufficiente.;sg;N_extended;no;distractor;_
capelli su capelli;no;su;capello;di;Quindi, ad esempio, lo stesso taglio di;capelli su capelli;lisci e ricci apparirà completamente diverso. pertanto quando scegli un taglio di capelli, oltre al tipo di viso, considera anche il tipo di capelli.;pl;N_extended;no;distractor;_
Apple su Apple;no;su;Apple;di;Anche Noi di Zoleounge.it stiamo promuovendo il Back Friday di Apple e se siete in procinto di acquistare con gli sconti del BlackFriday 2010 di;Apple su Apple;Italia, iTunes Store o su App Store e volete aiutare Zoelounge.it senza peraltro spendere una lira in più, potreste prendere in considerazione l'idea di cliccare su uno dei banner presenti in questa pagina o nei banner presenti nella sidebar.;X;proper_name_inglobation;no;distractor;_
110 su 110;no;su;110;con;Luciano Fonzi esprime il seguente giudizio: Laureato in Scienze Biologiche presso la Università di Siena nel 1969 con;110 su 110;e lode.;X;NumPNum;no;distractor;_
jeans su jeans;no;su;jeans;di;Il trucco è prevalentemente uno, non eccedere con i colori, quindi se indossate una giacca di;jeans su jeans;blu dovranno avere lo stesso colore.;sg/pl;N_extended;no;distractor;_
Guccini su Guccini;no;su;Guccini;di;Forse il fatto d'essere un lavoro di;Guccini su Guccini;, la possibilità di curiosare nell'armadio dei sogni e dei ricordi, mettendoci a disposizione fin dalla copertina la foto di famiglia del bisnonno che gli ha dato il nome (e sul retro, ma non cercatela nel booklet del cd, un'austera immagine della sua,;X;thematic_target;no;distractor;_
mille su mille;no;su;mille;sembrare;Il prezzo è stato 8.500 che mi sembra,; mille su mille;giù in linea con quello che si vede in giro.;sg;NsuNgiù;yes;distractor;_
carta su carta;no;su;carta;di;E poi c'è lo spariglio, una variante della presa di;carta su carta;uguale.;sg;thematic_target;no;distractor;_
ruota su ruota;no;su;ruota;strisciamento;DEFINIZIONE: l' attrito volvente (a) è la forza che si sviluppa fra due solidi a contatto in moto rotatorio relativo senza strisciamento (;ruota su ruota;o ruota su strada).;sg;thematic_target;no;distractor;_
uomo su uomo;no;su;uomo;di;cioè quando si abolirà non solo il concetto di proprieta' di;uomo su uomo;(schiavitu') ma anche quello di SERVITU' di uomo su uomo (noleggio, prostituzione, o come chiamo io, SERVIZIONE).;sg;thematic_target;no;distractor;_
bandiere su bandiere;no;su;bandiera;dire;"Come se ci fosse bisogno di una voce dall' alto che dica""";bandiere su bandiere;" giù"".";pl;NsuNgiù;yes;distractor;_
uomini su uomini;no;su;uomo;di;Per un verso, infatti, essa esclude qualsiasi analogia mimetica tra la sovranità di Dio e la sovranità di;uomini su uomini;(significato politico-critico dell'immagine trinitaria di Dio).;pl;thematic_target;no;distractor;_
Italia su Italia;no;su;Italia;in;Ricordiamo che Futurama è partita in America sul network FOX il 28 marzo 1999, ed ha esordito in;Italia su Italia;1 in prima serata alle 20.45 il 6 gennaio 2000.;sg;proper_name_inglobation;no;distractor;_
6 su 6;no;su;6;essere;No perchè 7 su 9 di jones non è che succede sempre, considerando anche il fatto che fino ad un certo punto era;6 su 6;.;X;NumPNum;no;distractor;_
Berlusconi su Berlusconi;no;su;Berlusconi;di;Va bene bene pubblicare in prima pagina una barzelletta di;Berlusconi su Berlusconi;, ma vi sia perlomeno il buon senso di dire al titolista di non mettere come titolo LA BATTUTA finale...;X;thematic_target;no;distractor;_
ferro su ferro;no;su;ferro;di;Il valore del coefficiente di a. volvente del;ferro su ferro;"è per es. 0,005; quello radente, 0,21; l' a. volvente della gomma su strada, 0,02; quello radente, 0,07.";sg;N_extended;no;distractor;_
Christine su Christine;no;su;Christine;cantare;"Nel 1969 anche i Nomadi si dedicano al ""trans"", cantano";Christine su Christine;Jorgensen, una transessuale famosa dal 1952, fotografa, attrice e cantante.;X;proper_name_inglobation;no;distractor;_
5 su 5;no;su;5;di; Questa volta è la Juventus a sbagliare di meno, anzi a non sbagliare proprio nulla visto che mette a segno uno score di;5 su 5;, mentre per il Milan è fatale l' errore di Brocchi.;X;NumPNum;no;distractor;_
119 su 119;no;su;119;tutto;Attivate al 100 % le procedure di bonifica per i siti inquinati a breve termine, in tutto;119 su 119;, e al 58 % quelle per i 146 siti a medio termine, mentre per i 60 siti di piano definiti ' in approfondimentò (considerati a medio termine nell' attesa della definitiva classificazione nell' ambito dell' approvazione dei Piani Provinciali), tale percentuale scende al 32 %.;X;NumPNum;no;distractor;_
10 su 10;no;su;10;se;Vorrei che ogni italiano, o almeno 8 su 10 sappiano cosa sia la Milano Sanremo, se;10 su 10;sanno cosa è il Giro.;X;NumPNum;no;distractor;_
90 su 90;no;su;90;a;Una volta fatto il gruppo (non esagerare con le unita' di supporto tanto, tra quelle in difesa e quelle prodotte sarai quasi a;90 su 90;) prendi la strada in alto a destra.;X;NumPNum;no;distractor;_
uomo su uomo;no;su;uomo;qui;"Il problema del potere si ripresenta qui; il potere d'";uomo su uomo;.;sg;thematic_target;no;distractor;_
bambini su bambini;no;su;bambino;di;All'inizio della settimana ho scritto un articolo circa le recenti notizie provenienti dal Kansas sui tassi di violenze sessuali di;bambini su bambini;, aumentate bruscamente...anche la polizia del Regno Unito ha segnalato questa tendenza (40.000 segnalazioni in un paio di anni)…;pl;thematic_target;no;distractor;_
54 su 54;no;su;54;disponibile;La formazione pugliese è, assieme al Torino, la squadra che ha usufruito fino a questo momento di tutti i cambi disponibili;54 su 54;.;X;NumPNum;no;distractor;_
5 su 5;no;su;5;destra;A questo punto anche un Cda tutto di destra (;5 su 5;) andrebbe in crisi;X;NumPNum;no;distractor;_
radio su radio;no;su;radio;a;Proprio stamattina presto, verso le 5 circa seguivo il programma alla;radio su radio;"1 ""istruzioni per l' uso"" e uno degli argomenti era per l' appunto il blog, si parlava di quanti blog esistono in Italia, circa 30000, (pensavo ce ne fossero di più) mentre in Francia sono 3000000!";sg;proper_name_inglobation;no;distractor;_
justin su justin;no;su;justin;là;belibers.....cazzo calmatevi fate paura....justin di qua justin di là;justin su justin;giù!;X;NsuNgiù;yes;distractor;_
facebook su facebook;no;su;facebook;di;la censura su facebook esiste, non si deve parlare male di;facebook su facebook;e non si devono aprire discorsi seri che non c'entrano con le informazioni private che servono 1: a controllarti 2: a sapere cosa pensano i giovani su determinati prodotti.;X;thematic_target;no;distractor;_
base su base;no;su;base;di;Agenzia Nazionale per la Ricerca (ANR), creata nel 2007 per finanziare progetti di ricerca di;base su base;competitiva.;sg;N_extended;no;distractor;_
mente su mente;no;su;mente;parte;"Il credersi ""separati"" in più parti (";mente su mente;"giù, corpo questo e corpo quell'altro, questo è meglio e quello è peggio) è solo il frutto d'una visione ""schizofrenica"".";sg;NsuNgiù;yes;distractor;_
2 su 2;no;su;3;e;Da segnalare anche un ottima prestazione di Cazzulo con 3 su 3 da due e;2 su 2;dalla lunetta, in momenti importanti della gara.;X;NumPNum;no;distractor;_
volume su volume;no;su;volume;indietro;Questo è un semplice lettore con play pausa avanti indietro;volume su volume;giù.;sg;NsuNgiù;yes;distractor;_
giornalisti su giornalisti;no;su;giornalista;di;Torna l' estate, tornano puntuali come le zanzare i libri di; giornalisti su giornalisti;e con la calura tornano a scoppiare anche le polemiche tra gli anchormen di casa Mediaset, in primis quella tra Emilio Fede ed Enrico Mentana.;pl;thematic_target;no;distractor;_
DVD su DVD;no;su;DVD;in;Se vuoi masterizzare un film in;DVD su DVD;+ R DL, ti conviene usare Alcohol o DVD Decrypter (in ISO mode).;sg/pl;thematic_target;no;distractor;_
5 su 5;no;su;5;inanellare;A detta di Alberto Artiglia che ne ha inanellati;5 su 5;(l' unico oltre al sottoscritto), il migliore vitto lo abbiamo avuto qui.;X;NumPNum;no;distractor;_
Android su Android ;no;su;Android ;di;Attualmente è necessario impostare la versione minima di;Android su Android;7,0 (API 24-torrone) per distribuire l'app in dispositivi o emulatori torrone Android.;X;proper_name_inglobation;no;distractor;_
19 su 19;no;su;19;scioperare;A Lecco si è registrato una adesione del 100 per cento (hanno scioperato;19 su 19;) così come al tribunale di sorveglianza di Milano (9 su 9).;X;NumPNum;no;distractor;_
100 su 100;no;su;100;massimo;Il punteggio minimo ottenuto dai nostri studenti è di 28,57, contro quello ottenuto dall' Emilia Romagna di 0,0 e dal Nord Est di 14,29, mentre è allineato il punteggio massimo:;100 su 100;.;X;NumPNum;no;distractor;_
5 su 5;no;su;5;essere;"Se il ""numero minimo di domande"" non è stato impostato, allora il suo voto sarà";5 su 5;, cioè 100 %.;X;NumPNum;no;distractor;_
Sky su Sky;no;su;Sky;di;La partita Napoli-Villarreal sarà trasmessa in diretta tv per gli abbonati di;Sky su Sky;Calcio 1 HD (canale 251).;X;proper_name_inglobation;no;distractor;_
Camerino su Camerino;no;su;Camerino;di;Interventi Regione ed Università di;Camerino su Camerino;.;X;proper_name_inglobation;no;distractor;_
strada su strada;no;su;strada;di;In tal modo l'aquaplaning viene scongiurato e la tenuta di;strada su strada;bagnata e innevata è ottimale.;sg;N_extended;no;distractor;_
jeans su jeans;no;su;jeans;jeans;Consigli per indossare il giubbino di jeans su jeans;jeans su jeans;.;sg/pl;N_extended;no;distractor;_
uomo su uomo;no;su;uomo;di;cioè quando si abolirà non solo il concetto di proprieta' di uomo su uomo (schiavitu') ma anche quello di SERVITU' di;uomo su uomo;(noleggio, prostituzione, o come chiamo io, SERVIZIONE).;sg;thematic_target;no;distractor;_
Italia su Italia;no;su;Italia;in;"Una curiosità: Sandra Vidal ha partecipato alla versione americana del programma "" Popstars "", trasmesso anche in";Italia su Italia;1.;X;proper_name_inglobation;no;distractor;_
periodi su periodi;no;su;periodo;avere;Tornando al banco,devo dire che i suoi dischi li amo tuttora,certo hanno avuto;periodi su periodi;ma son sempre stati più che dignitosi.;pl;NsuNgiù;yes;distractor;_
uomini su uomini;no;su;uomo;di;Sono sempre segno di un'ingiustizia regnante, di oppressione di;uomini su uomini;.;pl;thematic_target;no;distractor;_
24 su 24;no;su;24;vicinanza;Infatti la scommessa era quella dell' accompagnamento educativo, la presenza, la vicinanza;24 su 24;ore per tot mesi verso chi ne aveva bisogno.;X;NumPNum;no;distractor;_
Google su Google;no;su;Google;di;Come cancellare la cronologia di;Google su Google;Chrome.;X;proper_name_inglobation;no;distractor;_
zero a zero;no;a;zero;del;Se ciò risulterà vero, ci troveremo di fronte ad un'inestricabile coincidenza: due squadre che non si attaccano perché convinte della parziale utilità dello;zero a zero;.;sg;NumPNum;no;distractor;_
uomo a uomo;no;a;uomo;da;Volete che vi parli da;uomo a uomo;, o come ad uno che ha quel tanto di autorità ufficiale che gli consente di immischiarsi in una faccenda che non lo riguarda?;sg;PNPN;yes;distractor;_
zero a zero;no;a;zero;finire;Il primo tempo è finito;zero a zero;.;sg;NumPNum;no;distractor;_
punto a punto;no;a;punto;da;L'ATM crea una connessione da;punto a punto;.;sg;PNPN;yes;distractor;_
persona a persona;no;a;persona;da;Il cancro è una malattia complessa, che deriva da molti fattori interagenti, presumibilmente diversi da;persona a persona;.;sg;PNPN;yes;distractor;_
donna a donna;no;a;donna;da;" anche i sintomi e la successione degli eventi possono essere molto diversi da""";donna a donna;.;sg;PNPN;yes;distractor;_
categoria a categoria;no;a;categoria;da;Analogamente può essere trasferito da;categoria a categoria;e da specialità a specialità il sottufficiale e il volontario in congedo della Marina militare, da ruolo a ruolo e da categoria a categoria il sottufficiale e il volontario in congedo dell'Aeronautica militare.;sg;PNPN;yes;distractor;_
palmo a palmo;no;a;palmo;a;Stupita, scopriva la forma nuova e sorprendente del corpo del suo amico, il calore, il gusto, l'aroma, lo esplorava conquistandolo a;palmo a palmo;, seminandolo di carezze appena inventate.;sg;PNPN;yes;distractor;_
uomo a uomo;no;a;uomo;ovunque;" centinaia di cittadini sono stati contagiati quando era chiaro che il patogeno si trasmetteva da""";uomo a uomo;, ma era vietato dirlo per preservare la stabilità.;sg;PNPN;yes;distractor;_
uomo a uomo;no;a;uomo;da;Poi smise di correre e mi salutò da;uomo a uomo;.;sg;PNPN;yes;distractor;_
testa a testa;no;a;testa;a;Ma rischiava una sconfitta nella Sud Carolina, lo Stato di John Edwards, che lo precedeva nei sondaggi con il 30 contro il 25 per cento dei voti, e risultava a;testa a testa;con il generale Wesley Clark nell'Oklahoma (dove, a sorpresa, il bollettino di Internet Drudge Report dava invece vincente Edwards stesso).;sg;PNPN;yes;distractor;_
donna a donna;no;a;donna;aggiungere;Vai ora, non stare a perdere tempo, aggiungi;donna a donna;, e non metterti a contare.;sg;verbal;yes;distractor;_
punto a punto;no;a;punto;da;Oggi ci rendiamo conto che la critica faradayana alla nozione di particella, inquanto scaturisce da una fisica del continuum dove le interazioni agiscono da;punto a punto;.;sg;PNPN;yes;distractor;_
zero a zero;no;a;zero;sul;Il Genoa balbettante che aveva perso a Cesena e quello senza idee che si era fatto bloccare sullo;zero a zero;dalla Pro Piacenza sembra lontani anni luce.;sg;NumPNum;no;distractor;_
punto a punto;no;a;punto;da;Il confronto del dato sperimentale con quello calcolato consente di tracciare mappe di variazione da;punto a punto;.;sg;PNPN;yes;distractor;_
persona a persona;no;a;persona;da;La rete delle connessioni tra le cellule cerebrali cambia da;persona a persona;.;sg;PNPN;yes;distractor;_
persona a persona;no;a;persona;da;La malattia, infatti, ha un peggioramento progressivo, in media nell'arco di dieci anni, ma la rapidità con cui i sintomi evolvono varia molto da;persona a persona;.;sg;PNPN;yes;distractor;_
fiume a fiume;no;a;fiume;da;L'intero universo si inchinò al tirannosauro: io mi chiudevo dentro al guscio o balzavo da;fiume a fiume;.;sg;PNPN;yes;distractor;_
