NPN;construction;preposition;noun;pre_lemma;context_pre;costr;context_post;number_of_noun;Type;other_cxn;meaning;syntactic_function
palmo a palmo;no;a;palmo;a;Will e Nancy setacciarono di nuovo l'appartamento a;palmo a palmo;"; poi, mentre lei restava con Clive, Will perlustrò il corridoio e la tromba delle scale.";sg;PNPN;yes;distractor;_
donna a donna;no;a;donna;da;C'è una donna vescovo, adesso, negli Stati Uniti, forse potrei chiamarla, forse lei potrebbe arrivare a Vina e, non so, forse, parlandole da;donna a donna;, intercedere per me.;sg;PNPN;yes;distractor;_
tedeschi a tedeschi;no;a;tedeschi;di;Un comando particolare, straniero, il comando del nemico, donde «Diktat», aveva vietato l'atteggiamento imperioso del comando militare di;tedeschi a tedeschi;.;sg;N_extended;no;distractor;_
punto a punto;no;a;punto;da;Il computer può trattare frasi che arrivino a un massimo di 1500 caratteri da;punto a punto;.;sg;PNPN;yes;distractor;_
euro a euro;no;a;euro;500;Salvo che il fatto costituisca reato, il mancato rispetto, da parte del debitore, dei termini di pagamento stabiliti al comma 3 è punito con sanzione amministrativa pecuniaria da 500;euro a euro;500.000.;sg;N_extended;no;distractor;_
donna a donna;no;a;donna;da;Il deficit estrogenico ha una serie di effetti a breve, medio e lungo termine differenti per incidenza da;donna a donna;in base anche a fattori costituzionali e socio-ambientali ma comunque capaci in molti casi di minare gravemente lo stato di salute generale attraverso il danneggiamento di numerosi organi ed apparati (cardiovascolare, nervoso, cutaneo, osseo, uro - genitale).;sg;PNPN;yes;distractor;_
persona a persona;no;a;persona;da;Invece da noi è possibile che un virus o un germe si possa trasmettere da;persona a persona;in quel momento.;sg;PNPN;yes;distractor;_
uomo a uomo;no;a;uomo;da;"""È solo una questione di tempo"", secondo Webster, e il virus H5N1, prima o poi, farà il salto della specie, propagandosi da";uomo a uomo;.;sg;PNPN;yes;distractor;_
albero ad albero;no;a;albero;da;Non un solo silenzio, ma parecchi: quello del muschio sotto i piedi, quello delle ombre da;albero ad albero;, il silenzio di un piccolo ruscello in esplorazione di pezzetti di terreno, i silenzi che lo attorniavano mentre sbucava su una radura.;sg;PNPN;yes;distractor;_
persona a persona;no;a;persona;da;Il virus della nuova influenza A si trasmette come una normale influenza stagionale, da;persona a persona;"; febbre, tosse, mal di testa e dolori muscolari sono i sintomi che, nella maggior parte dei casi, si risolvono senza complicazioni.";sg;PNPN;yes;distractor;_
persona a persona;no;a;persona;da;Per alcune malattie genetiche esiste una cura ma, di nuovo, questa può variare da;persona a persona;, con differenze significative nei risultati.;sg;PNPN;yes;distractor;_
bambino a bambino;no;a;bambino;da;Le difficoltà e i successi ovviamente variano da;bambino a bambino;e da un ordine di scuola all'altro anche in base alle caratteristiche e le modalità organizzative dei vari tipi di scuola.;sg;PNPN;yes;distractor;_
persona a persona;no;a;persona;da;L'eccitazione e il piacere sono composte da mille sensazioni diverse e arricchite da aspetti psicologici che variano da;persona a persona;.;sg;PNPN;yes;distractor;_
donna a donna;no;a;donna;da;La signorina Griffin ed io abbiamo fatto una lunga chiacchierata, da;donna a donna;, ed abbiamo tratto il massimo l'una dall'altra.;sg;PNPN;yes;distractor;_
persona a persona;no;a;persona;da;La ferocia funziona se si propaga come un contagio, di bocca in bocca, da;persona a persona;.;sg;PNPN;yes;distractor;_
persona a persona;no;a;persona;da;La durata della terapia però varia molto da;persona a persona;e dai risultati che si vogliono ottenere.;sg;PNPN;yes;distractor;_
zero a zero;no;a;zero;sul;Nino Malandrino quel 29 aprile era stato l'eroe del giorno, parando un rigore sullo;zero a zero;.;sg;NumPNum;no;distractor;_
uomo a uomo;no;a;uomo;da;Oppure senza i sì e i no della figura paterna: finiti i gesti di sostegno virile, i lanci in aria per gioco, le spiegazioni da;uomo a uomo;, il conforto dopo gli insuccessi.;sg;PNPN;yes;distractor;_
uomo a uomo;no;a;uomo;da;Anche gli alleati del re di Macedonia gli si rivolgevano da;uomo a uomo;, attendendosi da lui soltanto cortesia e generosità.;sg;PNPN;yes;distractor;_
persona a persona;no;a;persona;da;"Questa ""soglia di diversità"", come chiamiamo il punto di svolta, può differire da";persona a persona;.;sg;PNPN;yes;distractor;_
uomo a uomo;no;a;uomo;da;Fisher, non ho mai avuto modo di parlarti, da;uomo a uomo;.;sg;PNPN;yes;distractor;_
persona a persona;no;a;persona;da;Naturalmente si tratta di valori approssimativi, perché i fattori che possono influire sull'aumento di peso variano da;persona a persona;.;sg;PNPN;yes;distractor;_
testa a testa;no;a;testa;a;I primi e gli ultimi della scuola europea restano a;testa a testa;anche al terzo problema sull'intricata questione delle proporzioni fisiche di Paolo, Pietro e Maria, risolta brillantemente come un quiz enigmistico.;sg;PNPN;yes;distractor;_
donna a donna;no;a;donna;da;Quali sono i fattori che determinano queste differenze da;donna a donna;?;sg;PNPN;yes;distractor;_
persona a persona;no;a;persona;da;E ciò non è più altro che una relazione da;persona a persona;, più o meno istituzionalizzata.;sg;PNPN;yes;distractor;_
uomo a uomo;no;a;uomo;da;Faustino Rivera aveva guardato il suo superiore e ne aveva intuito il pensiero, perché in certe notti di guardia avevano potuto parlare da;uomo a uomo;, scavalcando le gerarchie per analizzare le cause del sollevamento militare e delle sue conseguenze.;sg;PNPN;yes;distractor;_
punto a punto;no;a;punto;da;Al contrario nel Tipo C, dove il pino domestico è stato seminato in maniera andante e a integrazione di nuclei di latifoglie preesistenti, con conseguente maggiore variabilità da;punto a punto;.;sg;PNPN;yes;distractor;_
donna a donna;no;a;donna;da;Sono villana, lo sai già, e se c'è qualcosa che mi mette di malumore sono le sedute di confidenze da;donna a donna;, per cui gradirei che mi risparmiassi le tue.;sg;PNPN;yes;distractor;_
uomo a uomo;no;a;uomo;da;Ci siamo stretti con forza, nell'abbraccio da;uomo a uomo;che avevamo codificato la prima volta quando era venuto a prendermi al residence sulla collina.;sg;PNPN;yes;distractor;_
uomo a uomo;no;a;uomo;da;"Questa trasformazione, ipotizzano gli studiosi, ""potrebbe essere dovuta a variazioni o nelle capacità del virus di trasmettersi da";uomo a uomo;", o nelle caratteristiche della popolazione prevalentemente infettata"".";sg;PNPN;yes;distractor;_
persona a persona;no;a;persona;da;Le zone del corpo più sensibili alle carezze sono in molti casi soggettive e variano da;persona a persona;.;sg;PNPN;yes;distractor;_
punto a punto;no;a;punto;da;Tra le singolarità c'è un agglomerato di linee di forza variamente incurvate da;punto a punto;.;sg;PNPN;yes;distractor;_
palmo a palmo;no;a;palmo;a;Ciò non è avvenuto: per cinque anni il centrosinistra ha combattuto a;palmo a palmo;"sul terreno della Rai, senza sfuggire al sospetto di una lottizzazione contrattata; e probabilmente la riforma Gentiloni è la figlia, non indecente ma chissà quanto adeguata, di una timidezza durata troppo a lungo.";sg;PNPN;yes;distractor;_
uomo a uomo;no;a;uomo;da;Questa malattia può dare luogo a febbri emorragiche anche fatali e ha una caratteristica particolare: non si trasmette da;uomo a uomo;, ma viene trasmessa da una zanzara, che prima punge un malato e poi uno sano.;sg;PNPN;yes;distractor;_
barca a barca;no;a;barca;da;Riflessa dall'acciaio nero della Moldava, l'agitazione variopinta dei giochi di luce faceva guizzare i suoi messaggi di fuoco da;barca a barca;, da zattera a zattera.;sg;PNPN;yes;distractor;_
uomo a uomo;no;a;uomo;da;Quel pacchetto delle nazionali che offriva grandioso, da;uomo a uomo;, tirandolo fuori tutto stropicciato dalla tasca.;sg;PNPN;yes;distractor;_
uomo a uomo;no;a;uomo;da;Queste forme di sapere «tecnico» vengono tramandate da;uomo a uomo;, da adulto a giovane, e fanno parte degli insegnamenti che i ragazzi ricevono nella «casa degli uomini».;sg;PNPN;yes;distractor;_
complotto a complotto;no;a;complotto;da;Un progetto astratto di complotto migrava da;complotto a complotto;.;sg;PNPN;yes;distractor;_
eguale a eguale;no;a;eguale;da;Perché se è vero che noi oggi proclamiamo la nostra indipendenza d'intesa col Belgio, paese amico col quale oggi trattiamo da;eguale a eguale;, è pur vero che nessun congolese degno di questo nome potrà dimenticare che questa indipendenza è stata conquistata con una lotta condotta giorno per giorno, una lotta ardente e idealista, una lotta nella quale non abbiamo risparmiato le nostre forze, né le sofferenze, né i sacrifici, né il sangue.;sg;PNPN;yes;distractor;_
confine a confine;no;a;confine;da;"In Finlandia si disputa la marcia sciistica non competitiva più lunga del mondo: la Rajalta rajalle - hiihto (che tradotto dal finlandese significa ""Sciata da";confine a confine;"""), più di 400 chilometri percorsi costeggiando il Circolo polare artico da Saunavaara, vicino alla Russia, fino alla Svezia.";sg;PNPN;yes;distractor;_
legge a legge;no;a;legge;carta;Aveva opposto carte a carte,;legge a legge;.;sg;verbal;yes;distractor;_
persona a persona;no;a;persona;da;In qualche caso era richiesto l'uso di droghe, che inducevano sogni ed incubi, diversi da;persona a persona;.;sg;PNPN;yes;distractor;_
