NPN;construction;preposition;noun;pre_lemma;context_pre;costr;context_post;number_of_noun;Type;other_cxn;meaning;syntactic_function
colpo su colpo;yes;su;colpo;restituire;La strada, però, con una durezza che si ripercoteva fino all'inguine, mi restituiva;colpo su colpo;.;sg;_;_;greater_plurality/accumulation;nominal
terreno su terreno;yes;su;terreno;guadagnare;Io guardavo lo zoppo rincorrere goffamente la più bella e l'altro inseguirli velocissimo guadagnando;terreno su terreno;.;sg;_;_;greater_plurality/accumulation;nominal
verbali su verbali;yes;su;verbale;pubblicare;Insomma, nel corso di Tangentopoli i mass media hanno pubblicato;verbali su verbali;ancora freschi d'inchiostro e rivelato notizie coperte da segreto istruttorio.;pl;_;_;greater_plurality/accumulation;nominal
riunioni su riunioni;yes;su;riunione;susseguire;Naturalmente, come in ogni occupazione che si rispetti, si susseguono;riunioni su riunioni;.;pl;_;_;greater_plurality/accumulation;nominal
verbali su verbali;yes;su;verbale;elevare;Un uomo dalla finestra di casa osserva i pizzardoni mentre elevano;verbali su verbali;.;pl;_;_;greater_plurality/accumulation;nominal
miliardi su miliardi;yes;su;miliardo;risparmiare;Soprattutto per gli assicuratori, che possono continuare a inserire una clausola che consente loro di risparmiare;miliardi su miliardi;sulla pelle degli assicurati.;pl;_;_;greater_plurality/accumulation;nominal
lunghezza su lunghezza;yes;su;lunghezza;recuperare;"Il tedesco Caitano, montato da Andreas Starke, ha atteso la dirittura d'arrivo del ""Jockey"" per recuperare";lunghezza su lunghezza;ai britannici Luso e Mons ed imporre la legge del più forte.;sg;_;_;greater_plurality/accumulation;nominal
colpo su colpo;yes;su;colpo;restituire;Sentiva quella sconfitta comese l'avesse subita personalmente, e la formidabile capacità di Memnone di restituire;colpo su colpo;e con forza spaventosa lo umiliava duramente e gli faceva provare per la prima volta in vita sua un frustrante senso d'impotenza e di profonda solitudine.;sg;_;_;greater_plurality/accumulation;nominal
colpo su colpo;yes;su;colpo;luterano;Carafa no, preferiva abbandonare i protestanti al loro destino piuttosto che concedere anche una piccola incrinatura dell'autorità assoluta della Chiesa: occorreva ribattere ai luterani;colpo su colpo;, fare pulizia al proprio interno e dotarsi di apparati nuovi che raccogliessero la sfida.;sg;_;_;succession/iteration/distributivity;modifier
cambiali su cambiali;yes;su;cambiale;firmare;Mario viveva lì da tanto tempo, aveva comprato quell'appartamento firmando;cambiali su cambiali;per anni, perchè doveva essere così, il matrimonio si sa impone questo tipo di sacrifici.;pl;_;_;greater_plurality/accumulation;nominal
layer su layer;yes;su;layer;strato;Detriti, come li chiama Napier, che sono visibili per strati,;layer su layer;, quasi si trattasse dei livelli che gli archeologi usano durante le operazioni di scavo.;sg;_;_;succession/iteration/distributivity;modifier
riunioni su riunioni;yes;su;riunione;e;Ma per arrivare sino a quel punto, a quel sospiro di sollievo, ci sono state ore di trattative ininterrotte e telefonate notturne e sveglie all'alba e;riunioni su riunioni;.;pl;_;_;greater_plurality/accumulation;nominal
avversari su avversari;yes;su;avversario;macinare;Marcella Bazzoni da poche ore si è dimessa da tecnico dell'Itm Jchnusa, la formazione di pallamano che nella prima parte di campionato ha macinato;avversari su avversari;nella A2 maschile, per poi crollare inanellando quattro sconfitte di seguito.;pl;_;_;greater_plurality/accumulation;nominal
prove su prove;yes;su;prova;fare;La squadra di tecnici della Telecom fa;prove su prove;per trovare l'inghippo.;pl;_;_;greater_plurality/accumulation;nominal
rinvii su rinvii;yes;su;rinvio;Italia;Quindici giorni in cui le attività giudiziarie penalistiche - i processi, grandi e piccoli, di criminalità comune e organizzata, acaricodi imputati eccellenti e sconosciuti - hanno subito, in tutt'Italia,;rinvii su rinvii;e accumulato ritardi.;pl;_;_;greater_plurality/accumulation;nominal
palmo a palmo;yes;a;palmo;battere;Per individuare le casse di zinco, la polizia batte;palmo a palmo;tutta la basilica, partendo dai sottotetti, scoprendo locali nemmeno mappati nelle cartine catastali, per passare alle stanze che ospitano gli organi, sino a sgabuzzini ricavati vicino alle aule, come quello ispezionato vicino all'attuale aula 201: la coincidenza è interessante, perché la stanza si trova a pochi metri dal quarto piano del palazzo adiacente: proprio la vecchia sede dell'istituto Ludovico da Victoria, la scuola di musica dove Emanuela nel 1983 andava a lezione.;sg;_;_;succession/iteration/distributivity;modifier
spalla a spalla;yes;a;spalla;lavorare;La maggior parte dei dirigenti è lì, a lavorare;spalla a spalla;con l'imprenditore.;sg;_;_;juxtaposition/contact;modifier
goccia a goccia;yes;a;goccia;irrigazione;Secondo, meglio usare sistemi di irrigazione;goccia a goccia;, che non quelli a getto nebulizzato inmodoche vi sia un minor consumo d'acqua.;sg;_;_;succession/iteration/distributivity;modifier
corpo a corpo;yes;a;corpo;lotta;I colpi sono stati sparati durante la lotta,;corpo a corpo;.;sg;_;_;juxtaposition/contact;modifier
goccia a goccia;yes;a;goccia;lentamente;Cominciò a scavare con la punta della spada finché vide affiorare lentamente,;goccia a goccia;, dell'acqua.;sg;_;_;succession/iteration/distributivity;modifier
spalla a spalla;yes;a;spalla;Nick;Arrivo di corsa e trovo Gabriel e Nick,;spalla a spalla;, che aspettano.;sg;_;_;juxtaposition/contact;modifier
goccia a goccia;yes;a;goccia;scorrere;Nel braccio di Bruno è conficcato l'ago e lungo il flessibile scorre;goccia a goccia;la medicina che per il momento regala al suo volto un'aria distesa e l'ombra di un sorriso.;sg;_;_;succession/iteration/distributivity;modifier
spalla a spalla;yes;a;spalla;combattere;Era per vendicarsi di una condanna ingiusta che aveva combattuto;spalla a spalla;con quegli stessi Uberti che a Campaldino militavano tra le file nemiche o quella alleanza, che soltanto pochi mesi prima gli sarebbe sembrata contro natura, aveva una più profonda e nobile giustificazione?;sg;_;_;juxtaposition/contact;modifier
spalla a spalla;yes;a;spalla;e;Tutto sommato, l'Italia, partita tardi, ha recuperato, piazzandosi dietro la Germania e;spalla a spalla;con gli inglesi.;sg;_;_;juxtaposition/contact;modifier
spalla a spalla;yes;a;spalla;agire;Tutti gli oranti si trovano ad agire;spalla a spalla;nel modo più disciplinato, indipendentemente da ogni considerazione di tipo mondano.;sg;_;_;juxtaposition/contact;modifier
palmo a palmo;yes;a;palmo;controllare;Ufficio che è stato controllato;palmo a palmo;.;sg;_;_;succession/iteration/distributivity;modifier
spalla a spalla;yes;a;spalla;mentre;Questi pensieri mi agitavano mentre;spalla a spalla;con i miei compagni muti attendevo i colpi di fischietto degli ufficiali per superare il parapetto e inoltrarmi in quell'orribile scabro e tormentato deserto innanzia me.;sg;_;_;juxtaposition/contact;modifier
corpo a corpo;yes;a;corpo;danza;Il killer - ballerino e le cubiste - prede erano impegnati in una danza;corpo a corpo;molto coinvolgente.;sg;_;_;juxtaposition/contact;modifier
spalla a spalla;yes;a;spalla;Polo;Torino, Rifondazione apre a Castellani L'ex ministro Costa corre per il Polo,;spalla a spalla;con il sindaco.;sg;_;_;juxtaposition/contact;modifier
corpo a corpo;yes;a;corpo;rapido;Inoltre l'uso giudizioso della massa corporea può rappresentare in certe situazioni un vantaggio supplementare non indifferente, per esempio negli incontri rapidi;corpo a corpo;, come nella lotta greco - romana, nel catch, nel sumo.;sg;_;_;juxtaposition/contact;modifier
mente su mente;no;su;mente;parte;"Il credersi ""separati"" in più parti (";mente su mente;"giù, corpo questo e corpo quell'altro, questo è meglio e quello è peggio) è solo il frutto d'una visione ""schizofrenica"".";sg;NsuNgiù;yes;distractor;_
punto su punto;no;su;punto;data;Punto croce ricamo una data;punto su punto; giù indico traccia di trama merletto finito.;sg;NsuNgiù;yes;distractor;_
bandiere su bandiere;no;su;bandiera;dire;"Come se ci fosse bisogno di una voce dall' alto che dica""";bandiere su bandiere;" giù"".";pl;NsuNgiù;yes;distractor;_
justin su justin;no;su;justin;là;belibers.....cazzo calmatevi fate paura....justin di qua justin di là;justin su justin;giù!;X;NsuNgiù;yes;distractor;_
volume su volume;no;su;volume;indietro;Questo è un semplice lettore con play pausa avanti indietro;volume su volume;giù.;sg;NsuNgiù;yes;distractor;_
km su km;no;su;km;poi;e non può che migliorare col tempo, poi;km su km;giù porto pazienza.;sg/pl;NsuNgiù;yes;distractor;_
mille su mille;no;su;mille;sembrare;Il prezzo è stato 8.500 che mi sembra,; mille su mille;giù in linea con quello che si vede in giro.;sg;NsuNgiù;yes;distractor;_
mani su mani;no;su;mano;fare;Anche il testo della canzone era stato scritto per essere abbastanza esplicativo e per mostrare cosa si sarebbe dovuto fare (;mani su mani;giù mani dove vuoi) ma l'immagine dei Ricchi & Poveri non era tale da poter imporre un ballo inventato di sana pianta anche perché non c'era più la moda di inventarne di nuovi per il tramite di una canzone lanciata appositamente.;pl;NsuNgiù;yes;distractor;_
periodi su periodi;no;su;periodo;avere;Tornando al banco,devo dire che i suoi dischi li amo tuttora,certo hanno avuto;periodi su periodi;ma son sempre stati più che dignitosi.;pl;NsuNgiù;yes;distractor;_
anima ad anima;no;a;anima;da;Sembrano interconnesse in una sfida infinita che si tramanda da corpo a corpo, da;anima ad anima;, da essere ad essere.;sg;PNPN;yes;distractor;_
caso a caso;no;a;caso;da;Dato che le situazioni possono essere molto diverse da;caso a caso;, si consiglia di chiedere indicazioni sulla prassi per il disconoscimento al Consultorio ad un avvocato, al Tribunale per i minorenni o al Servizio Sociale del proprio comune.;sg;PNPN;yes;distractor;_
splendore a splendore;no;a;splendore;aggiungere;Ma queste fantasie schliemanniane non fanno altro che aggiungere;splendore a splendore;.;sg;verbal;yes;distractor;_
goccia a goccia ;no;a;goccia;a;Accese uno Zippo, infiammò lo stoppino di una piccola ampolla di cherosene e cominciò a sciogliere a;goccia a goccia;una stecca di ceralacca sul cartoncino finché non si formò una pozza rosso sangue.;sg;PNPN;yes;distractor;_
libro a libro;no;a;libro;da;Insomma, un autore che sapeva descrivere senza errori da;libro a libro;la pianta della casa di Wolfe, i cibi che mangiava, le diecimila orchidee che coltivava, specie per specie, non aveva mai pensato a tenere uno schedario generale (biograficamente attendibile) dei suoi personaggi?;sg;PNPN;yes;distractor;_
gomito a gomito;no;a;gomito;a;Così ci siamo attrezzati con un nostro ufficio in un palazzo accanto, dove lavorano a;gomito a gomito;giovani avvocati italiani, albanesi e americani.;sg;PNPN;yes;distractor;_
mistero a mistero;no;a;mistero;aggiungere;Due elementi, ritornati fino a noi dalla profondità del tempo insieme a Oetzi e alle sue povere cose, forse spiegano in parte la sua fine, forse aggiungono;mistero a mistero;.;sg;verbal;yes;distractor;_
corpo a corpo;no;a;corpo;a;Un classico contemporaneo a tu per tu, o meglio a;corpo a corpo;, con l'eternità del classico.;sg;PNPN;yes;distractor;_
verde a verde;no;a;verde;aggiungere;Una grande fabbrica silenziosa con alberi che si arrampicano sulla facciata, aggiungendo;verde a verde;, colore non solo del riposo ma anche del risparmio energetico: preoccupazione prima dell'intero progetto.;sg;verbal;yes;distractor;_
canino a canino;no;a;canino;da;Non sarei troppo esigente con l'editore, basterebbe un piccolo anticipo di dodici milioni (tale è la cifra che il mio dentista esige per il nuovo ponte superiore da;canino a canino;, altrimenti, aggiungendoci qualche dente, diciotto milioni e non se ne parla più), una bella copertina blu con il mio nome scritto in bianco ed eventualmente anche il titolo del libro, e... voilà, ecco un uomo felice!;sg;PNPN;yes;distractor;_
banca a banca;no;a;banca;da;l prezzo al dettaglio (diverso da;banca a banca;), poi, va aggiunta la commissione che può variare dai 50 ai 100 punti base.;sg;PNPN;yes;distractor;_
amico ad amico;no;a;amico;da;E visto che tra noi è tutto finito, dimmelo francamente, da;amico ad amico;: dove sei stato?;sg;PNPN;yes;distractor;_
goccia a goccia ;no;a;goccia;a;Diventai come un recipiente che venga riempito a;goccia a goccia;.;sg;PNPN;yes;distractor;_
superficie a superficie;no;a;superficie;da;Per il Novecento, il record di vicinanza è già alle nostre spalle e fu stabilito il 4 gennaio 1912, quando tra la Terra e la Luna, da;superficie a superficie;, intercorsero 348.259 chilometri (e 356.375 da centro a centro dei due corpi celesti).;sg;PNPN;yes;distractor;_
casello a casello;no;a;casello;da;Masotti padre, per l'incazzatura, prese su e andò da Bologna a Taranto in tre ore da;casello a casello;, tanto che il camion si surriscaldò e arrivò a destinazione un gigantesco carico di fritto il cui odore appetitoso fu sentito in tutta la città dei due mari.;sg;PNPN;yes;distractor;_
